"id","journal","publication_date","author","author_affiliate","author_notes","competing_interest"
"10.1371/journal.pmed.0020330","plos medicine","2005-10-04T00:00:00Z","Karen I Barnes; David N Durrheim; Francesca Little; Amanda Jackson; Ushma Mehta; Elizabeth Allen; Sicelo S Dlamini; Joyce Tsoka; Barry Bredenkamp; D Jotham Mthembu; Nicholas J White; Brian L Sharp","Division of Clinical Pharmacology, University of Cape Town, Cape Town, South Africa; Health Protection, Hunter New England Population Health, Newcastle, New South Wales, Australia; Department of Statistical Sciences, University of Cape Town, Cape Town, South Africa; Malaria Research Lead Programme, Medical Research Council, Durban, South Africa; Malaria Control Programme, KwaZulu–Natal Provincial Department of Health, South Africa; Faculty of Tropical Medicine, Mahidol University, Bangkok, Thailand; Centre of Vaccinology and Tropical Medicine, Churchill Hospital, Oxford, United Kingdom","KIB is the principal investigator of the South East African Combination Antimalarial Therapy (SEACAT) evaluation, within which this study was nested. KIB conceptualised this study and analysed the data, drafted this manuscript, and together with DND, NJW, and BLS designed and interpreted results of all study components. FL supervised the statistical analyses performed. AJ managed data entry and together with SSD conducted preliminary analysis and interpretation of the household survey. UM conducted preliminary analysis and interpretation of sentinel safety data. JT conducted preliminary analysis and interpretation of sentinel hospital morbidity and mortality data. EA and BB assisted in the design, and together with DJM, assisted in the coordination of the in vivo study. All authors revised manuscript critically for substantial intellectual content and have access to all data in the studies reported.","NJW is chairman of the World Health Organization malaria treatment guidelines committee and is on the editorial board of PLoS medicine. The authors have no other conflict of interest to declare."
"10.1371/journal.pmed.0020333","plos medicine","2005-11-01T00:00:00Z","Matthew L Batten; Yoshikazu Imanishi; Daniel C Tu; Thuy Doan; Li Zhu; Jijing Pang; Lyudmila Glushakova; Alexander R Moise; Wolfgang Baehr; Russell N Van Gelder; William W Hauswirth; Fred Rieke; Krzysztof Palczewski","Department of Ophthalmology, University of Washington, Seattle, Washington, United States of America; Department of Pharmacology, Case School of Medicine, Case Western Reserve University, Cleveland, Ohio, United States of America; Department of Ophthalmology and Visual Sciences, Washington University School of Medicine, St. Louis, Missouri, United States of America; Department of Physiology and Biophysics, University of Washington, Seattle, Washington, United States of America; Department of Chemistry, University of Washington, Seattle, Washington, United States of America; Department of Ophthalmology, and Powell Gene Therapy Center, University of Florida, Gainesville, Florida, United States of America; Department of Ophthalmology, University of Utah, Salt Lake City, Utah, United States of America; Department of Biology, University of Utah, Salt Lake City, Utah, United States of America; Department of Neurobiology and Anatomy, University of Utah, Salt Lake City, Utah, United States of America; Department of Molecular Biology, Washington University School of Medicine, St. Louis, Missouri, United States of America; Department of Pharmacology, Washington University School of Medicine, St. Louis, Missouri, United States of America; Department of Pharmacology, University of Washington, Seattle, Washington, United States of America","MLB, YI, DCT, TD, LZ, JP, LG, ARM, WB, RNVG, WWH, FR, and KP contributed to conception and design, or acquisition of data, or analysis and interpretation of data. MLB, YI, DCT, TD, LZ, ARM, WB, RNVG, WWH, FR, and KP contributed to writing the paper.","WWH and the University of Florida own equity in a company, Applied Genetic Technologies Corporation, that may commercialize some of the technology described in this work. KP owns shares of the company Retinagenix. The University of Washington and Retinagenix may commercialize some of the technology described in this work."
"10.1371/journal.ppat.1001134","plos pathogens","2010-10-07T00:00:00Z","Stephanie Haensch; Raffaella Bianucci; Michel Signoli; Minoarisoa Rajerison; Michael Schultz; Sacha Kacki; Marco Vermunt; Darlene A Weston; Derek Hurst; Mark Achtman; Elisabeth Carniel; Barbara Bramanti","Institute for Anthropology, Johannes Gutenberg University, Mainz, Germany; Laboratory of Criminalistic Sciences Department of Anatomy, Pharmacology and Legal Medicine, University of Turin, Turin, Italy; Unité d'Anthropologie Bioculturelle, Faculté de Medecine, University of Mediterranean-CNRS-EFS, Marseille, France; Centre d'Études Préhistoire, Antiquité, Moyen-âge, UMR 6130 CNRS–250 University of Nice, Valbonne, France; Center for Plague, Institute Pasteur de Madagascar, World Health Organization Collaborating, Antananarivo, Madagascar; Department of Anatomy and Embryology Medical Faculty, Georg-August University, Göttingen, Germany; Inrap, Villeneuve-d'Ascq Archaeological Center, Villeneuve-d'Ascq, France; Laboratoire d'Anthropologie des Populations du Passé, Université Bordeaux 1, Talence, France; Department of Monuments and Archaeology, Municipality of Bergen op Zoom, Bergen op Zoom, The Netherlands; Barge's Anthropologica, Department of Anatomy and Embryology, Leiden University Medical Center, Leiden, The Netherlands; Division of Archaeological Sciences, University of Bradford, Bradford, West Yorkshire, United Kingdom; Department of Human Evolution, Max Planck Institute for Evolutionary Anthropology, Leipzig, Germany; Worcestershire Historic Environment and Archaeology Service, Worcestershire County Council, Worcester, United Kingdom; Environmental Research Institute, University College Cork, Cork, Ireland; Yersinia Research Unit, Institut Pasteur, Paris, France","Conceived the experiment: R. Bianucci, M. Schultz, B. Bramanti. Carried out aDNA research: S. Haensch, B. Bramanti. Performed the RDT analysis: R. Bianucci, M. Rajerison. Carried out the data analysis together with E. Carniel and M. Achtman: S. Haensch, B. Bramanti. Contributed with archaeological and historical data: M. Signoli, S. Kacki, M. Vermunt, D. Weston, D. Hurst. Wrote the paper: S. Haensch, M. Achtman, E. Carniel, B. Bramanti.","The authors have declared that no competing interests exist."
"10.1371/journal.ppat.1001136","plos pathogens","2010-10-07T00:00:00Z","Christina M Carlson; Elizabeth A Turpin; Lindsey A Moser; Kevin B O'Brien; Troy D Cline; Jeremy C Jones; Terrence M Tumpey; Jacqueline M Katz; Laura A Kelley; Jack Gauldie; Stacey Schultz-Cherry","Department of Medical Microbiology and Immunology, University of Wisconsin, Madison, Wisconsin, United States of America; Pfizer Inc., Department of Viral Vaccines, Research Triangle Park, North Carolina, United States of America; Department of Infectious Disease, St. Jude Children's Research Hospital, Memphis, Tennessee, United States of America; Influenza Division, National Center for Immunization and Respiratory Diseases, Centers for Disease Control and Prevention, Atlanta, Georgia, United States of America; Biosciences Research Laboratory, USDA Agricultural Research Station, Fargo, North Dakota, United States of America; Department of Pathology and Molecular Medicine, McMaster University, Hamilton, Ontario, Canada","Conceived and designed the experiments: CMC EAT LAM KBO TDC TMT JMK SSC. Performed the experiments: CMC EAT LAM KBO TDC JCJ TMT LAK SSC. Analyzed the data: CMC EAT LAM TDC JCJ TMT JMK SSC. Contributed reagents/materials/analysis tools: JG SSC. Wrote the paper: EAT LAM SSC.","The authors have declared that no competing interests exist."
"10.1371/journal.ppat.1001144","plos pathogens","2010-10-14T00:00:00Z","Malte Bachmann; Katharina Horn; Ina Rudloff; Itamar Goren; Martin Holdener; Urs Christen; Nicole Darsow; Klaus-Peter Hunfeld; Ulrike Koehl; Peter Kind; Josef Pfeilschifter; Peter Kraiczy; Heiko Mühl","pharmazentrum frankfurt/ZAFES, University Hospital Goethe University Frankfurt, Frankfurt, Germany; Institute of Medical Microbiology and Infection Control, University Hospital Goethe University Frankfurt, Frankfurt, Germany; Institute for Laboratory Medicine, North West Medical Centre, Frankfurt, Germany; Pediatric Hematology and Oncology, University Hospital Goethe-University Frankfurt, Frankfurt, Germany; Dermatohistological Laboratory Offenbach, Offenbach, Germany","Conceived and designed the experiments: M. Bachmann, H. Mühl. Performed the experiments: M. Bachmann, K. Horn, I. Rudloff, I. Goren, M. Holdener, N. Darsow, U. Koehl. Analyzed the data: M. Bachmann, K. Horn, I. Rudloff, I. Goren, M. Holdener, U. Christen, K-P. Hunsfeld, U. Koehl, P. Kraiczy, H. Mühl. Contributed reagents/materials/analysis tools: U. Christen, P. Kind, J. Pfeilschifter, P. Kraiczy. Wrote the paper: H. Mühl.","The authors have declared that no competing interests exist."
"10.1371/journal.ppat.1001150","plos pathogens","2010-10-14T00:00:00Z","Lars Dölken; Astrid Krmpotic; Sheila Kothe; Lee Tuddenham; Mélanie Tanguy; Lisa Marcinowski; Zsolt Ruzsics; Naama Elefant; Yael Altuvia; Hanah Margalit; Ulrich H Koszinowski; Stipan Jonjic; Sébastien Pfeffer","Max von Pettenkofer-Institute, Ludwig-Maximilians-University Munich, Munich, Germany; Department of Histology and Embryology, Faculty of Medicine University of Rijeka, Rijeka, Croatia; Architecture et Réactivité de l'ARN, Université de Strasbourg, Institut de Biologie Moléculaire et Cellulaire du CNRS, Strasbourg, France; Department of Microbiology and Molecular Genetics, Faculty of Medicine, The Hebrew University, Jerusalem, Israel","Conceived and designed the experiments: LD AK UHK SJ SP. Performed the experiments: LD AK SK LT MT LM NE YA. Analyzed the data: LD AK LT ZR NE YA HM UHK SJ SP. Contributed reagents/materials/analysis tools: ZR HM UHK SJ. Wrote the paper: LD SJ SP.","The authors have declared that no competing interests exist."
"10.1371/journal.pcbi.0020096","plos computational biology","2006-07-28T00:00:00Z","Arun Mehra; Christian I Hong; Mi Shi; Jennifer J Loros; Jay C Dunlap; Peter Ruoff","Department of Genetics, Dartmouth Medical School, Hanover, New Hampshire, United States of America; Department of Mathematics and Natural Science, University of Stavanger, Stavanger, Norway; Department of Biochemistry, Dartmouth Medical School, Hanover, New Hampshire, United States of America","AM and PR conceived and designed the experiments. AM, CIH, and PR performed the experiments. AM, CIH, MS, JJL, JCD, and PR analyzed the data. CIH and PR contributed reagents/materials/analysis tools. AM and PR wrote the paper.","The authors have declared that no competing interests exist."
"10.1371/journal.pcbi.0020059","plos computational biology","2006-07-28T00:00:00Z","Hiroyuki Kurata; Hana El-Samad; Rei Iwasaki; Hisao Ohtake; John C Doyle; Irina Grigorova; Carol A Gross; Mustafa Khammash","Department of Bioscience and Bioinformatics, Kyushu Institute of Technology, Iizuka, Fukuoka, Japan; Department of Biochemistry and Biophysics, University of California San Francisco, San Francisco, California, United States of America; California Institute for Quantitative Biomedical Research, University of California San Francisco, San Francisco, California, United States of America; Department of Biotechnology, Graduate School of Engineering, Osaka University, Osaka, Japan; Control and Dynamical Systems, California Institute of Technology, Pasadena, California, United States of America; Department of Cell and Tissue Biology, University of California San Francisco, San Francisco, California, United States of America; Department of Microbiology and Immunology, University of California San Francisco, San Francisco, California, United States of America; Department of Mechanical Engineering, University of California Santa Barbara, Santa Barbara, California, United States of America","HK, HES, HO, JCD, CAG, and MK conceived and designed the experiments. HK and RI performed the experiments. HK, HES, and CAG analyzed the data. HES, JCD, IG, CAG, and MK contributed reagents/materials/analysis tools. HK, HES, JCD, CAG, and MK wrote the paper.","The authors have declared that no competing interests exist."
"10.1371/journal.ppat.1001108","plos pathogens","2010-09-16T00:00:00Z","N Luisa Hiller; Azad Ahmed; Evan Powell; Darren P Martin; Rory Eutsey; Josh Earl; Benjamin Janto; Robert J Boissy; Justin Hogg; Karen Barbadora; Rangarajan Sampath; Shaun Lonergan; J Christopher Post; Fen Z Hu; Garth D Ehrlich","Allegheny General Hospital, Allegheny-Singer Research Institute, Center for Genomic Sciences, Pittsburgh, Pennsylvania, United States of America; Computational Biology Group, Institute of Infectious Disease and Molecular Medicine, University of Cape Town, Cape Town, South Africa; Department of Internal Medicine, University of Nebraska Medical Center, Omaha, Nebraska, United States of America; Children's Hospital of Pittsburgh, Pittsburgh, Pennsylvania, United States of America; Abbott Molecular IbisBiosciences Division, Carlsbad, California, United States of America; Department of Microbiology and Immunology, Drexel University College of Medicine, Allegheny Campus, Pittsburgh, Pennsylvania, United States of America; Department of Otolaryngology Head and Neck Surgery, Drexel University College of Medicine, Allegheny Campus, Pittsburgh, Pennsylvania, United States of America","Conceived and designed the experiments: NLH JCP FZH GDE. Performed the experiments: NLH AA EP DPM RE JE BJ RS. Analyzed the data: NLH DPM. Contributed reagents/materials/analysis tools: DPM RJB JH KB RS SL. Wrote the paper: NLH DPM GDE.","The authors have declared that no competing interests exist."
"10.1371/journal.pmed.0020295","plos medicine","2005-10-04T00:00:00Z","Alex Loukas; Jeffrey M Bethony; Susana Mendez; Ricardo T Fujiwara; Gaddam Narsa Goud; Najju Ranjit; Bin Zhan; Karen Jones; Maria Elena Bottazzi; Peter J Hotez","Division of Infectious Diseases and Immunology, Queensland Institute of Medical Research, Brisbane, Queensland, Australia; Department of Microbiology and Tropical Medicine, The George Washington University Medical Center, Washington, District of Columbia, United States of America","AL, JMB, MEB, and PJH designed the study. AL, RTF, GNG, NR, BZ, performed experiments. AL, PJH, JMB, SM, and KJ analyzed the data. AL, PJH, JMB, and SM contributed to writing the paper.","The authors have declared that no competing interests exist."
"10.1371/journal.ppat.1001110","plos pathogens","2010-09-16T00:00:00Z","Mohammad F Saeed; Andrey A Kolokoltsov; Thomas Albrecht; Robert A Davey","Department of Microbiology & Immunology, The University of Texas Medical Branch, Galveston, Texas, United States of America; Galveston National Laboratory, The University of Texas Medical Branch, Galveston, Texas, United States of America; Institute of Human Infection and Immunity, The University of Texas Medical Branch, Galveston, Texas, United States of America; Department SK, Building 37, NASA, Houston, Texas, United States of America","Conceived and designed the experiments: MFS AAK RAD. Performed the experiments: MFS AAK TA. Analyzed the data: MFS AAK RAD. Contributed reagents/materials/analysis tools: TA RAD. Wrote the paper: MFS RAD.","The authors have declared that no competing interests exist."
"10.1371/journal.pcbi.0020063","plos computational biology","2006-06-16T00:00:00Z","Gevorg Grigoryan; Fei Zhou; Steve R Lustig; Gerbrand Ceder; Dane Morgan; Amy E Keating","Department of Biology, Massachusetts Institute of Technology, Cambridge, Massachusetts, United States of America; Department of Physics, Massachusetts Institute of Technology, Cambridge, Massachusetts, United States of America; DuPont Central Research and Development, Experimental Station, Wilmington, Delaware, United States of America; Department of Material Science and Engineering, Massachusetts Institute of Technology, Cambridge, Massachusetts, United States of America; Department of Material Science and Engineering, University of Wisconsin, Madison, Wisconsin, United States of America","GG, FZ, GC, DM, and AEK conceived and designed the experiments. GG and FZ performed the experiments. GG, FZ, GC, DM, and AEK analyzed the data. SRL participated in intellectual discussions. GG and AEK wrote the paper.","The authors have declared that no competing interests exist."
"10.1371/journal.pmed.0020288","plos medicine","2005-09-20T00:00:00Z","Alexander Drzezga; Timo Grimmer; Martin Peller; Marc Wermke; Hartwig Siebner; Josef P Rauschecker; Markus Schwaiger; Alexander Kurz","Department of Nuclear Medicine, Technische Universität München, Munich, Germany; Department of Psychiatry and Psychotherapy, Technische Universität München, Munich, Germany; Department of Neurology, Christian-Albrechts-Universität, Kiel, Germany; Department of Physiology and Biophysics, Georgetown University Medical Center, Washington, District of Columbia, United States of America","AD, MS, and AK designed the study. AD, TG, MP, MW, and HS analyzed the data. TG, MP, and MW enrolled patients. AD, TG, HS, JPR, and AK contributed to writing the paper.","The authors have declared that no competing interests exist."
"10.1371/journal.ppat.1001111","plos pathogens","2010-09-16T00:00:00Z","Yingzhong Li; Shuxin Li; Dongling Bi; Yu Ti Cheng; Xin Li; Yuelin Zhang","National Institute of Biological Sciences, Zhongguancun Life Science Park, Beijing, People's Republic of China; College of Life Sciences, Peking University, Beijing, People's Republic of China; Michael Smith Laboratories, University of British Columbia, Vancouver, British Columbia, Canada","Conceived and designed the experiments: SL DB XL YZ. Performed the experiments: YL SL DB YTC. Analyzed the data: YL SL DB YTC XL YZ. Wrote the paper: YL XL YZ.","The authors have declared that no competing interests exist."
"10.1371/journal.pcbi.0020062","plos computational biology","2006-06-23T00:00:00Z","Sergei L Kosakovsky Pond; Simon D W Frost; Zehava Grossman; Michael B Gravenor; Douglas D Richman; Andrew J Leigh Brown","Department of Pathology, University of California San Diego, La Jolla, California, United States of America; National HIV Reference Lab, Public Health Laboratory, Ministry of Health, Tel Hashomer, Israel; School of Medicine, University of Swansea, Swansea, Wales, United Kingdom; VA San Diego Health Care System, San Diego, California, United States of America; Institute for Evolutionary Biology, School of Biological Sciences, University of Edinburgh, Edinburgh, Scotland, United Kingdom","SLKP, SDWF, DDR, and AJLB conceived and designed the experiments. SLKP, SDWF, and AJLB analyzed the data. ZG and MBG contributed reagents/materials/analysis tools. SLKP, SDWF, ZG, and AJLB wrote the paper.","The authors have declared that no competing interests exist."
"10.1371/journal.pbio.1002416","plos biology","2016-03-16T00:00:00Z","Chunmei Li; Victor L Jensen; Kwangjin Park; Julie Kennedy; Francesc R Garcia-Gonzalo; Marta Romani; Roberta De Mori; Ange-Line Bruel; Dominique Gaillard; Bérénice Doray; Estelle Lopez; Jean-Baptiste Rivière; Laurence Faivre; Christel Thauvin-Robinet; Jeremy F Reiter; Oliver E Blacque; Enza Maria Valente; Michel R Leroux","Department of Molecular Biology and Biochemistry and Centre for Cell Biology, Development and Disease, Simon Fraser University, Burnaby, British Columbia, Canada; School of Biomolecular & Biomedical Science, University College Dublin, Belfield, Dublin 4, Ireland; Department of Biochemistry and Biophysics, Cardiovascular Research Institute, University of California, San Francisco, San Francisco, California, United States of America; Neurogenetics Unit, Mendel Laboratory, IRCCS Casa Sollievo della Sofferenza, San Giovanni Rotondo, Italy; EA4271 GAD Génétique des Anomalies du Développement, FHU-TRANSLAD, Université Fédérale Bourgogne Franche-Comté, Dijon, France; Service de Génétique clinique, CHU Reims, Reims, France; Service de Génétique clinique, CHRU Strasbourg, Strasbourg, France; Laboratoire de Génétique moléculaire, Plateau Technique de Biologie, CHU Dijon, Dijon, France; Centre de Génétique, FHU-TRANSLAD, Hôpital d’Enfants, CHU Dijon, Dijon, France; Department of Medicine and Surgery, University of Salerno, Salerno, Italy","Conceived and designed the experiments: MRL CL KP VLJ OEB FRGG EMV JFR CTR. Performed the experiments: CL VLJ KP JK FRGG MR RDM ALB DG BD EL JBR LF. Analyzed the data: CL VLJ KP JK OEB MRL EMV JFR CTR FRGG. Contributed reagents/materials/analysis tools: MRL OEB JFR EMV CTR. Wrote the paper: MRL CL KP VLJ OEB JFR EMV CTR.","The authors have declared that no competing interests exist."
"10.1371/journal.pcbi.0010008","plos computational biology","2005-06-24T00:00:00Z","Laxmi Parida; Ruhong Zhou","Computational Biology Center, IBM Thomas J. Watson Research Center, Yorktown Heights, New York, United States of America,; Department of Chemistry, Columbia University, New York, New York, United States of America","RZ conceived and designed the experiments. LP and RZ performed the experiments, analyzed the data, and wrote the paper.","The authors have declared that no competing interests exist."
"10.1371/journal.ppat.1000979","plos pathogens","2010-07-01T00:00:00Z","Sunny H Wong; Sailesh Gochhait; Dheeraj Malhotra; Fredrik H Pettersson; Yik Y Teo; Chiea C Khor; Anna Rautanen; Stephen J Chapman; Tara C Mills; Amit Srivastava; Aleksey Rudko; Maxim B Freidin; Valery P Puzyrev; Shafat Ali; Shweta Aggarwal; Rupali Chopra; Belum S N Reddy; Vijay K Garg; Suchismita Roy; Sarah Meisner; Sunil K Hazra; Bibhuti Saha; Sian Floyd; Brendan J Keating; Cecilia Kim; Benjamin P Fairfax; Julian C Knight; Philip C Hill; Richard A Adegbola; Hakon Hakonarson; Paul E M Fine; Ramasamy M Pitchappan; Rameshwar N K Bamezai; Adrian V S Hill; Fredrik O Vannberg","Wellcome Trust Centre for Human Genetics, University of Oxford, Oxford, United Kingdom; National Centre of Applied Human Genetics, School of Life Sciences, Jawaharlal Nehru University, New Delhi, India; Host Susceptibility to Infection Program, Singapore Institute for Clinical Sciences, Agency for Science, Technology and Research, Singapore; Research Institute of Medical Genetics, Siberian Branch of Russian Academy of Medical Sciences, Tomsk, Russia; Department of Dermatology and Sexually Transmitted Diseases, Maulana Azad Medical College, Lok Nayak Jai Prakash Hospital, New Delhi, India; Bath Royal United Hospital Trust, Combe Park, Bath, United Kingdom; Calcutta School of Tropical Medicine, Kolkata, India; Infectious Disease Epidemiology Unit, London School of Hygiene and Tropical Medicine, London, United Kingdom; Institute for Translational Medicine and Therapeutics, School of Medicine, University of Pennsylvania, Philadelphia, Pennsylvania, United States of America; Center for Applied Genomics, Abramson Research Center, The Children's Hospital of Philadelphia, Philadelphia, Pennsylvania, United States of America; MRC Laboratories, Fajara, The Gambia; Centre for Excellence in Genomic Sciences, Madurai Kamaraj University, Madurai, India","Conceived and designed the experiments: S. Wong, C. Khor, A. Rautanen, S. Chapman, B. Keating, H. Hakonarson, P. Fine, R. Pitchappan, R. Bamezai, A. Hill, F. Vannberg. Performed the experiments: S. Wong, S. Gochhait, D. Malhotra, T. Mills, A. Srivastava, S. Ali, S. Aggarwal, R. Chopra, B. Keating, C. Kim, F. Vannberg. Analyzed the data: S. Wong, S. Gochhait, D. Malhotra, F. Pettersson, Y. Teo, A. Rautanen, A. Srivastava, S. Ali, S. Aggarwal, R. Chopra, S. Floyd, C. Kim, F. Vannberg. Contributed reagents/materials/analysis tools: F. Pettersson, Y. Teo, C. Khor, T. Mills, A. Rudko, M. Freidin, V. Puzyrev, S. Ali, B. Reddy, V. Garg, S. Roy, S. Meisner, S. Hazra, B. Saha, B. Keating, B. Fairfax, J. Knight, P. Hill, R. Adegbola, H. Hakonarson, P. Fine, R. Pitchappan, R. Bamezai, A. Hill. Wrote the paper: S. Wong, A. Hill, F. Vannberg.","The authors have declared that no competing interests exist."
"10.1371/journal.ppat.1000959","plos pathogens","2010-06-24T00:00:00Z","Jason G Smith; Mariena Silvestry; Steffen Lindert; Wuyuan Lu; Glen R Nemerow; Phoebe L Stewart","Department of Immunology and Microbial Science, The Scripps Research Institute, La Jolla, California, United States of America; Department of Molecular Physiology and Biophysics, Vanderbilt University Medical Center, Nashville, Tennessee, United States of America; Institute of Human Virology, University of Maryland School of Medicine, Baltimore, Maryland, United States of America","¤Current address: Department of Microbiology, University of Washington School of Medicine, Seattle, Washington, United States of America","The authors have declared that no competing interests exist."
"10.1371/journal.ppat.1000957","plos pathogens","2010-06-24T00:00:00Z","Alejandra Garces; Krishnamohan Atmakuri; Michael R Chase; Joshua S Woodworth; Bryan Krastins; Alissa C Rothchild; Talia L Ramsdell; Mary F Lopez; Samuel M Behar; David A Sarracino; Sarah M Fortune","Harvard School of Public Health, Department of Immunology and Infectious Diseases, Boston, Massachusetts, United States of America; Brigham and Women's Hospital, Division of Rheumatology, Boston, Massachusetts, United States of America; Thermo Fisher Scientific, BRIMS Unit, Cambridge, Massachusetts, United States of America","Conceived and designed the experiments: AG KA SMB DAS SMF. Performed the experiments: AG KA JSW BK ACR TLR DAS SMF. Analyzed the data: AG KA MRC JSW SMB DAS SMF. Contributed reagents/materials/analysis tools: TLR MFL SMF. Wrote the paper: SMF.","The authors have declared that no competing interests exist."
