"id","journal","publication_date","author","author_affiliate","author_notes","competing_interest"
"10.1371/journal.pcbi.1000488","plos computational biology","2009-09-04T00:00:00Z","Julie Baussand; Alessandra Carbone","Génomique Analytique, Université Pierre et Marie Curie, Paris, France; Génomique des Microorganismes, CNRS, Paris, France","Conceived and designed the experiments: JB AC. Performed the experiments: JB. Analyzed the data: JB AC. Wrote the paper: JB AC.","The authors have declared that no competing interests exist."
"10.1371/journal.pcbi.1000490","plos computational biology","2009-08-28T00:00:00Z","Roberto Mosca; Carles Pons; Juan Fernández-Recio; Patrick Aloy","Institute for Research in Biomedicine, Barcelona, Spain; Barcelona Supercomputing Center, Barcelona, Spain; National Institute of Bioinformatics (INB), Barcelona, Spain; Institució Catalana de Recerca i Estudis Avançats (ICREA), Barcelona, Spain","Conceived and designed the experiments: RM JFR PA. Performed the experiments: RM CP. Analyzed the data: RM JFR PA. Contributed reagents/materials/analysis tools: JFR. Wrote the paper: RM CP JFR PA.","The authors have declared that no competing interests exist."
"10.1371/journal.pcbi.1000497","plos computational biology","2009-09-04T00:00:00Z","Amrita Mohan; Vladimir N Uversky; Predrag Radivojac","School of Informatics and Computing, Indiana University, Bloomington, Indiana, United States of America; Institute for Intrinsically Disordered Protein Research, Center for Computational Biology and Bioinformatics, Department of Biochemistry and Molecular Biology, Indiana University School of Medicine, Indianapolis, Indiana, United States of America; Institute for Biological Instrumentation, Russian Academy of Sciences, Moscow Region, Russia","Conceived and designed the experiments: VNU PR. Performed the experiments: AM. Analyzed the data: AM PR. Wrote the paper: AM VNU PR.","The authors have declared that no competing interests exist."
"10.1371/journal.ppat.1002688","plos pathogens","2012-05-10T00:00:00Z","Peter T Beernink; Jutamas Shaughnessy; Rolando Pajon; Emily M Braga; Sanjay Ram; Dan M Granoff","Center for Immunobiology and Vaccine Development, Children's Hospital Oakland Research Institute, Oakland, California, United States of America; Division of Infectious Diseases and Immunology, University of Massachusetts Medical School, Worcester, Massachusetts, United States of America","Conceived and designed the experiments: PTB SR DMG. Performed the experiments: JS RP EMB. Analyzed the data: PTB EMB DMG. Contributed reagents/materials/analysis tools: PTB JS RP SR. Wrote the paper: PTB SR DMG.","Dan M. Granoff is principal investigator of laboratory research conducted on behalf of Children s Hospital Oakland Research Institute that is funded by grants from Novartis Vaccines and Diagnostics, and Sanofi Pasteur. He also is supported in part by an endowment established by the Clorox Company. Dan M. Granoff also holds a paid consultancy from Novartis and is an inventor on patents or patent applications in the area of meningococcal B vaccines.   Peter T. Beerink, Sanjay Ram and Rolando Pajon are inventors on patents or patent applications in the area of meningococcal B vaccines. Jutamas Shaughnessy declares no competing interests exist."
"10.1371/journal.pcbi.1000496","plos computational biology","2009-09-04T00:00:00Z","Timothy R Lezon; Andrej Sali; Ivet Bahar","Department of Computational Biology, School of Medicine, University of Pittsburgh, Pittsburgh, Pennsylvania, United States of America; Department of Bioengineering and Therapeutic Sciences, Department of Pharmaceutical Chemistry, University of California at San Francisco, San Francisco, California, United States of America; California Institute for Quantitative Biomedical Research, University of California at San Francisco, San Francisco, California, United States of America","Conceived and designed the experiments: TRL AS IB. Performed the experiments: TRL. Analyzed the data: TRL AS IB. Wrote the paper: TRL AS IB.","The authors have declared that no competing interests exist."
"10.1371/journal.pcbi.1000494","plos computational biology","2009-09-04T00:00:00Z","Stefano Allesina; Mercedes Pascual","National Center for Ecological Analysis and Synthesis, Santa Barbara, California, United States of America; Department of Ecology and Evolutionary Biology, University of Michigan, Ann Arbor, Michigan, United States of America; Santa Fe Institute, Santa Fe, New Mexico, United States of America; Howard Hughes Medical Institute","Conceived and designed the experiments: SA MP. Performed the experiments: SA. Analyzed the data: SA. Wrote the paper: SA MP.","The authors have declared that no competing interests exist."
"10.1371/journal.ppat.1002685","plos pathogens","2012-05-03T00:00:00Z","Rafael Sanjuán","Institut Cavanilles de Biodiversitat i Biologia Evolutiva, Universitat de València, Paterna, Valencia, Spain","Conceived and designed the experiments: RS. Performed the experiments: RS. Analyzed the data: RS. Contributed reagents/materials/analysis tools: RS. Wrote the paper: RS.","The authors have declared that no competing interests exist."
"10.1371/journal.pmed.0050185","plos medicine","2008-09-09T00:00:00Z","Michael J Thun; Lindsay M Hannan; Lucile L Adams-Campbell; Paolo Boffetta; Julie E Buring; Diane Feskanich; W Dana Flanders; Sun Ha Jee; Kota Katanoda; Laurence N Kolonel; I-Min Lee; Tomomi Marugame; Julie R Palmer; Elio Riboli; Tomotaka Sobue; Erika Avila-Tang; Lynne R Wilkens; Jon M Samet","American Cancer Society, Atlanta, Georgia, United States of America; Howard University Cancer Center, Washington, D. C., United States of America; International Agency for Research on Cancer (IARC), Lyon, France; Brigham and Women's Hospital and Harvard Medical School, Boston, Massachusetts, United States of America; Rollins School of Public Health, Emory University, Atlanta, Georgia, United States of America; Institute for Health Promotion, Graduate School of Public Health, Yonsei University, Seoul, Korea; Cancer Information Services and Surveillance Division, Center for Cancer Control and Information Services, National Cancer Center, Tokyo, Japan; Cancer Research Center of Hawaii, University of Hawaii, Honolulu, Hawaii, United States of America; Slone Epidemiology Center, Boston University, Boston, Massachusetts, United States of America; Department of Epidemiology, Bloomberg School of Public Health, Johns Hopkins University, Baltimore, Maryland, United States of America","The study was jointly conceived by MJT, PB, and JMS, and written by MJT, LMH, LLA-C, PB, JEB, DF, WDF, SHJ, KK, LNK, IML, TM, JRP, ER, TS, EAT, LRW, and JMS. MJT, LMH, and WDF compiled and analyzed the data.","The authors have declared that no competing interests exist."
"10.1371/journal.pcbi.1000495","plos computational biology","2009-09-04T00:00:00Z","Pietro Berkes; Richard E Turner; Maneesh Sahani","Gatsby Computational Neuroscience Unit, London, United Kingdom","¤Current address: Volen Center for Complex Systems, Brandeis University, Waltham, Massachusetts, United States of America","The authors have declared that no competing interests exist."
"10.1371/journal.ppat.1002686","plos pathogens","2012-05-31T00:00:00Z","Nicholas F Parrish; Craig B Wilen; Lauren B Banks; Shilpa S Iyer; Jennifer M Pfaff; Jesus F Salazar-Gonzalez; Maria G Salazar; Julie M Decker; Erica H Parrish; Anna Berg; Jennifer Hopper; Bhavna Hora; Amit Kumar; Tatenda Mahlokozera; Sally Yuan; Charl Coleman; Marion Vermeulen; Haitao Ding; Christina Ochsenbauer; John C Tilton; Sallie R Permar; John C Kappes; Michael R Betts; Michael P Busch; Feng Gao; David Montefiori; Barton F Haynes; George M Shaw; Beatrice H Hahn; Robert W Doms","Department of Microbiology, Perelman School of Medicine at the University of Pennsylvania, Philadelphia, Pennsylvania, United States of America; Department of Medicine, Perelman School of Medicine at the University of Pennsylvania, Philadelphia, Pennsylvania, United States of America; Department of Medicine, University of Alabama at Birmingham, Birmingham, Alabama, United States of America; Duke Human Vaccine Institute, Duke University School of Medicine, Durham, North Carolina, United States of America; Donation Testing Department, South African National Blood Service, Roodepoort, Gauteng, South Africa; Department of General Medical Sciences, Center for Proteomics, Case Western Reserve University School of Medicine, Cleveland, Ohio, United States of America; Department of Pediatrics, Duke University School of Medicine, Durham, North Carolina, United States of America; Blood Systems Research Institute, San Francisco, California, United States of America; Department of Medicine, Duke University School of Medicine, Durham, North Carolina, United States of America; Department of Surgery, Duke University School of Medicine, Durham, North Carolina, United States of America; Department of Immunology, Duke University School of Medicine, Durham, North Carolina, United States of America","Conceived and designed the experiments: NFP CBW GMS BHH RWD. Performed the experiments: NFP CBW JMP JMD LBB SSI JFS-G MGS EHP AB JH BH AK SY. Analyzed the data: NFP CBW JMD LBB SSI JFS-G MGS EHP AB JH BH AK SY. Contributed reagents/materials/analysis tools: TM CC MV HD CO JCT SRP JCK MRB MPB FG DM BFH. Wrote the paper: NFP CBW GMS BHH RWD.","The authors have declared that no competing interests exist."
"10.1371/journal.pmed.0050188","plos medicine","2008-09-16T00:00:00Z","A Roderick Escombe; David A J Moore; Robert H Gilman; William Pan; Marcos Navincopa; Eduardo Ticona; Carlos Martínez; Luz Caviedes; Patricia Sheen; Armando Gonzalez; Catherine J Noakes; Jon S Friedland; Carlton A Evans","Department of Infectious Diseases and Immunity, Imperial College London, United Kingdom; Wellcome Trust Centre for Clinical Tropical Medicine, Imperial College London, United Kingdom; Asociación Benéfica PRISMA, Lima, Perú; Facultad de Ciencias, Universidad Peruana Cayetano Heredia, Lima, Perú; Johns Hopkins Bloomberg School of Public Health, Baltimore, Maryland, United States of America; Servicio de Enfermedades Tropicales y Infecciosas, Hospital Dos de Mayo, Lima, Perú; Universidad Nacional Mayor San Marcos, Lima, Perú; Servicio de Neumología, Hospital Nacional Dos de Mayo, Lima, Perú; School of Civil Engineering, University of Leeds, Leeds, United Kingdom","All authors contributed to the design or data analysis of the study, the writing of the article and approved the final version to be published. ARE had full access to all the data in the study and had final responsibility for the decision to submit for publication and is the guarantor.","The authors have declared that no competing interests exist."
"10.1371/journal.ppat.1002708","plos pathogens","2012-05-17T00:00:00Z","Giovanna Clavarino; Nuno Cláudio; Thérèse Couderc; Alexandre Dalet; Delphine Judith; Voahirana Camosseto; Enrico K Schmidt; Till Wenger; Marc Lecuit; Evelina Gatti; Philippe Pierre","Centre d'Immunologie de Marseille-Luminy, UM2, Aix-Marseille Université, Marseille, France; INSERM, U1104, Marseille, France; CNRS, UMR 7280, Marseille, France; Institut Pasteur, ‘Microbes and host barriers’ Group, Paris, France; Inserm, Equipe avenir U604, Paris, France; Université Paris Descartes, Hôpital Necker-Enfants malades, Service des Maladies Infectieuses et Tropicales, Assistance Publique-Hôpitaux de Paris, Paris, France","Conceived and designed the experiments: GC NC AD EG PP. Performed the experiments: GC TC NC AD DJ EKS TW VC. Analyzed the data: GC NC TC AD ML EG PP. Wrote the paper: GC NC AD ML EG PP.","The authors have declared that no competing interests exist."
"10.1371/journal.pmed.0050197","plos medicine","2008-10-07T00:00:00Z","Mark J Caulfield; Patricia B Munroe; Deb O'Neill; Kate Witkowska; Fadi J Charchar; Manuel Doblado; Sarah Evans; Susana Eyheramendy; Abiodun Onipinla; Philip Howard; Sue Shaw-Hawkins; Richard J Dobson; Chris Wallace; Stephen J Newhouse; Morris Brown; John M Connell; Anna Dominiczak; Martin Farrall; G Mark Lathrop; Nilesh J Samani; Meena Kumari; Michael Marmot; Eric Brunner; John Chambers; Paul Elliott; Jaspal Kooner; Maris Laan; Elin Org; Gudrun Veldre; Margus Viigimaa; Francesco P Cappuccio; Chen Ji; Roberto Iacone; Pasquale Strazzullo; Kelle H Moley; Chris Cheeseman","Clinical Pharmacology and The Genome Centre, William Harvey Research Institute, Barts and The London School of Medicine and Dentistry, London, United Kingdom; Department of Physiology, University of Alberta, Edmonton, Alberta, Canada; Department of Obstetrics and Gynaecology, Washington University in St Louis School of Medicine, St. Louis, Missouri, United States of America; Department of Statistics, Pontificia Universidad Católica de Chile, Santiago, Chile; Clinical Pharmacology Unit, University of Cambridge, Addenbrookes Hospital, Cambridge, United Kingdom; Glasgow Cardiovascular Research Centre, University of Glasgow, Glasgow, United Kingdom; Cardiovascular Medicine, University of Oxford, Wellcome Trust Centre for Human Genetics, Oxford, United Kingdom; Centre National de Génotypage, Evry, France; Cardiovascular Sciences, University of Leicester, Glenfield Hospital, Leicester, United Kingdom; Epidemiology and Public Health, University College, London, United Kingdom; National Heart Lung Institute and Epidemiology and Public Health, Imperial College, London, United Kingdom; Institute of Molecular and Cell Biology, University of Tartu, Tartu, Estonia; Department of Cardiology, University of Tartu, Tartu, Estonia; Centre of Cardiology, North Estonia Medical Centre, Tallinn, Estonia; Cardiovascular Medicine and Epidemiology, Clinical Sciences Research Institute, University of Warwick Medical School, Clifford Bridge Road, Coventry, United Kingdom; Department of Clinical and Experimental Medicine, Federico II University of Naples Medical School, Naples, Italy","M.J. Caulfield, P.B. Munroe, F.J. Charchar, K.H. Moley, and C. Cheeseman contributed to study design, execution, planning, analysis, and writing of the manuscript. D. O'Neill, K. Witkowska, M. Doblado, S. Evans, P. Howard, S. Newhouse, A. Onipinla, S. Shaw-Hawkins, R. Dobson, C. Wallace, M. Brown, J. Connell, A. Dominiczak, G.M. Lathrop, N.J. Samani, M. Marmot, E. Brunner, J. Chambers, P. Elliott, J. Kooner, M. Laan, E. Org, G. Veldre, and M. Viigimaa contributed to design and execution of the study. S. Eyheramendy, M. Farrall, M. Kumari, F. Cappuccio, C. Ji, R. Iacone, and P. Strazzullo contributed to design, execution, and analysis.","The authors have declared that no competing interests exist."
"10.1371/journal.ppat.1002699","plos pathogens","2012-05-17T00:00:00Z","José Ronnie Vasconcelos; Oscar Bruña–Romero; Adriano F Araújo; Mariana R Dominguez; Jonatan Ersching; Bruna C G de Alencar; Alexandre V Machado; Ricardo T Gazzinelli; Karina R Bortoluci; Gustavo P Amarante-Mendes; Marcela F Lopes; Mauricio M Rodrigues","Centro de Terapia Celular e Molecular (CTCMol), Universidade Federal de São Paulo-Escola Paulista de Medicina, São Paulo, São Paulo, Brazil; Departmento de Microbiologia, Imunologia e Parasitologia, Universidade Federal de São Paulo-Escola Paulista de Medicina, São Paulo, São Paulo, Brazil; Departamento de Microbiologia, Instituto de Ciências Biológicas, Universidade Federal de Minas Gerais, Belo Horizonte, Minas Gerais, Brazil; Centro de Pesquisas René Rachou, FIOCRUZ, Belo Horizonte, Minas Gerais, Brazil; Departamento de Bioquímica e Imunologia, Instituto de Ciências Biológicas, Universidade Federal de Minas Gerais, Pampulha, Belo Horizonte, Minas Gerais, Brazil; Division of Infectious Disease and Immunology, Department of Medicine, University of Massachusetts Medical School, Worcester, Massachusetts, United States of America; Departamento de Ciências Biológicas, Universidade Federal de São Paulo-Escola Paulista de Medicina, Diadema, São Paulo, Brazil; Departamento de Imunologia, Instituto de Ciências Biomédicas, Universidade de São Paulo, São Paulo, São Paulo, Brazil; Instituto de Biofísica Carlos Chagas Filho, Universidade Federal do Rio de Janeiro, Rio de Janeiro, Rio de Janeiro, Brazil","Conceived and designed the experiments: JRV AFA MRD JE BCGA KRB GPAM MFL MMR. Performed the experiments: JRV AFA MRD JE BCGA. Analyzed the data: JRV OBR AFA MRD JE BCGA KRB GPAM MFL MMR. Contributed reagents/materials/analysis tools: OBR AFA AVM RTG KRB GPAM. Wrote the paper: MMR MFL KRB JRV BCGA GPAM.","I have read the journal's policy and have the following conflicts: R.T.G., M.M.R., A.V.M. and O.B.-R. are named inventors on patent applications covering Trypanosoma cruzi vectored vaccines and immunization regimens."
"10.1371/journal.ppat.1002697","plos pathogens","2012-05-10T00:00:00Z","Emily Heath; Noelia Begue-Pastor; Sridhar Chaganti; Debbie Croom-Carter; Claire Shannon-Lowe; Dieter Kube; Regina Feederle; Henri-Jacques Delecluse; Alan B Rickinson; Andrew I Bell","School of Cancer Sciences, College of Medicine and Dental Sciences, University of Birmingham, Edgbaston, Birmingham, United Kingdom; Department of Haematology and Oncology, Georg August University Göttingen, Göttingen, Germany; Department of Virus-Associated Tumours, DKFZ, Heidelberg, Germany","Conceived and designed the experiments: HJD ABR AIB. Performed the experiments: EH NBP SC DCC CSL DK RF AIB. Analyzed the data: EH NBP SC HJD ABR AIB. Wrote the paper: HJD ABR AIB.","The authors have declared that no competing interests exist."
"10.1371/journal.pmed.0050020","plos medicine","2008-01-22T00:00:00Z","Sally Hopewell; Mike Clarke; David Moher; Elizabeth Wager; Philippa Middleton; Douglas G Altman; Kenneth F Schulz; and the CONSORT Group","UK Cochrane Centre, Oxford, United Kingdom; Centre for Statistics in Medicine, Wolfson College, Oxford University, Oxford, United Kingdom; School of Nursing and Midwifery, Trinity College Dublin, Dublin, Ireland; Chalmers Research Group, Children's Hospital of Eastern Ontario Research Institute, Ottawa, Canada; Department of Epidemiology and Community Medicine, Faculty of Medicine, University of Ottawa, Ottawa, Canada; Sideview, Princes Risborough, United Kingdom; Discipline of Obstetrics and Gynaecology, The University of Adelaide, Adelaide, Australia; Family Health International, Research Triangle Park, North Carolina, United States of America","SH, MC, DM, EW, and PM were involved in the design, implementation, analysis of the study, and in writing and commenting on drafts on the final manuscript. DGA and KFS were involved in the analysis of the study and commenting on drafts on the final manuscript.","All authors are involved in many initiatives in health care and healthcare research which should benefit from a wide uptake of the CONSORT for Abstracts statement."
"10.1371/journal.pcbi.1000367","plos computational biology","2009-04-24T00:00:00Z","Srinivas Ramachandran; Adrian W R Serohijos; Le Xu; Gerhard Meissner; Nikolay V Dokholyan","Department of Biochemistry and Biophysics, University of North Carolina Chapel Hill, Chapel Hill, North Carolina, United States of America; Molecular and Cellular Biophysics Program, University of North Carolina Chapel Hill, Chapel Hill, North Carolina, United States of America; Department of Physics and Astronomy, University of North Carolina Chapel Hill, Chapel Hill, North Carolina, United States of America","Conceived and designed the experiments: SR AWRS LX GM NVD. Performed the experiments: SR AWRS LX GM NVD. Analyzed the data: SR AWRS LX GM NVD. Wrote the paper: SR AWRS LX GM NVD.","The authors have declared that no competing interests exist."
"10.1371/journal.pcbi.1000377","plos computational biology","2009-05-01T00:00:00Z","Joel O Wertheim; Michael Worobey","Department of Ecology and Evolutionary Biology, University of Arizona, Tucson, Arizona, United States of America","Conceived and designed the experiments: JOW MW. Performed the experiments: JOW. Analyzed the data: JOW. Wrote the paper: JOW MW.","The authors have declared that no competing interests exist."
"10.1371/journal.pcbi.1000370","plos computational biology","2009-05-01T00:00:00Z","Maoz Shamir; Oded Ghitza; Steven Epstein; Nancy Kopell","Center for BioDynamics, Boston University, Boston, Massachusetts, United States of America; Department of Physiology, Ben-Gurion University of the Negev, Be'er-Sheva, Israel","Conceived and designed the experiments: MS OG SE NK. Performed the experiments: MS. Analyzed the data: MS. Contributed reagents/materials/analysis tools: MS. Wrote the paper: MS OG SE NK.","The authors have declared that no competing interests exist."
"10.1371/journal.pmed.0050029","plos medicine","2008-02-05T00:00:00Z","Pieter H M van Baal; Johan J Polder; G Ardine de Wit; Rudolf T Hoogenveen; Talitha L Feenstra; Hendriek C Boshuizen; Peter M Engelfriet; Werner B F Brouwer","National Institute for Public Health and the Environment (RIVM), Centre for Prevention and Health Services Research, Bilthoven, The Netherlands; National Institute for Public Health and the Environment, Centre for Public Health Forecasting, Bilthoven, The Netherlands; Tilburg University, Department Tranzo, Tilburg, The Netherlands; Erasmus University, Medical Center, Rotterdam, The Netherlands","PHMvB had the original idea for the paper, carried out the analyses, and drafted the initial manuscript. RTH developed the simulation model. All authors contributed substantially in developing and writing the paper. HCB is the guarantor.","The authors have declared that no competing interest exist."
"10.1371/journal.ppat.1002555","plos pathogens","2012-03-01T00:00:00Z","Mariem Ben-Abdallah; Aude Sturny-Leclère; Patrick Avé; Anne Louise; Frédérique Moyrand; Falk Weih; Guilhem Janbon; Sylvie Mémet","Institut Pasteur, Unité de Mycologie Moléculaire, Département Infection et Epidémiologie, Paris, France; CNRS, URA3012, Paris, France; Institut Pasteur, Unité d'Histopathologie, Département Infection et Epidémiologie, Paris, France; Institut Pasteur, Plateforme d'Imagerie Dynamique, Paris, France; Institut Pasteur, Unité des Aspergillus, Département de Parasitologie et Mycologie, Paris, France; Leibniz-Institute for Age Research - Fritz-Lipmann-Institute, Research Group Immunology, Jena, Germany","Conceived and designed the experiments: MBA SM. Performed the experiments: MBA ASL PA AL SM. Analyzed the data: MBA AL GJ SM. Contributed reagents/materials/analysis tools: FM FW GJ. Wrote the paper: SM.","The authors have declared that no competing interests exist."
"10.1371/journal.pcbi.1000363","plos computational biology","2009-04-17T00:00:00Z","Chase L Beisel; Christina D Smolke","Division of Chemistry and Chemical Engineering, California Institute of Technology, Pasadena, California, United States of America","¤Current address: Department of Bioengineering, Stanford University, Palo Alto, California, United States of America","The authors have declared that no competing interests exist."
"10.1371/journal.ppat.1002556","plos pathogens","2012-02-23T00:00:00Z","Aurélie A Albertini; Cécile Mérigoux; Sonia Libersou; Karine Madiona; Stéphane Bressanelli; Stéphane Roche; Jean Lepault; Ronald Melki; Patrice Vachette; Yves Gaudin","Centre de Recherche de Gif, Laboratoire de Virologie Moléculaire et Structurale, CNRS (UPR 3296), Gif sur Yvette, France; Institut de Biochimie et Biophysique Moléculaire et Cellulaire - Université de Paris-Sud 11, Orsay, France; Centre de Recherche de Gif, Laboratoire d'Enzymologie et de Biochimie Structurale, CNRS (UPR 3082), Gif sur Yvette, France","Conceived and designed the experiments: AAA SB SR RM JL PV YG. Performed the experiments: AAA CM SL KM JL PV. Analyzed the data: AAA CM SL KM RM SB SR JL PV YG. Wrote the paper: AAA PV YG.","The authors have declared that no competing interests exist."
"10.1371/journal.pcbi.1000376","plos computational biology","2009-05-01T00:00:00Z","Bálint Mészáros; István Simon; Zsuzsanna Dosztányi","Institute of Enzymology, Biological Research Center, Hungarian Academy of Sciences, Budapest, Hungary","Conceived and designed the experiments: BM IS ZD. Performed the experiments: BM. Analyzed the data: BM IS ZD. Wrote the paper: BM IS ZD.","The authors have declared that no competing interests exist."
"10.1371/journal.pmed.0050018","plos medicine","2008-01-22T00:00:00Z","Steven Riley; Hélène Carabin; Patrick Bélisle; Lawrence Joseph; Veronica Tallo; Ernesto Balolong; A Lee Willingham; Tomas J Fernandez; Ryan O'Neal Gonzales; Remigio Olveda; Stephen T McGarvey","Department of Community Medicine and School of Public Health, Li Ka Shing Faculty of Medicine, The University of Hong Kong, Hong Kong Special Administrative Region, China; University of Oklahoma Health Sciences Center, Oklahoma City, Oklahoma, United States of America; McGill University Health Center, Montreal, Quebec, Canada; Research Institute for Tropical Medicine, Muntinlupa City, Republic of the Philippines; World Health Organization/Food and Agriculture Organization Collaborating Center for Parasitic Zoonoses, University of Copenhagen, Frederiksberg, Denmark; College of Veterinary Medicine, Visayas State University, Baybay, Leyte, Republic of the Philippines; Brown University, Providence, Rhode Island, United States of America","SR, HC, EB, and STM designed the study. VT and TJF collected data and performed experiments. SR, HC, and PB analyzed the data. VT and RO enrolled patients. SR, HC, LJ, VT, EB, ALW, ROG, RO, and STM contributed to writing the paper.","The authors have declared that no competing interests exist."
