"id","journal","publication_date","author","author_affiliate","author_notes","competing_interest"
"10.1371/journal.pone.0010161","plos one","2010-04-13T00:00:00Z","Gayla Hadwiger; Scott Dour; Swathi Arur; Paul Fox; Michael L Nonet","Department of Anatomy and Neurobiology, Washington University School of Medicine, St. Louis, Missouri, United States of America; Department of Genetics, Washington University School of Medicine, St. Louis, Missouri, United States of America","Conceived and designed the experiments: GH MLN. Performed the experiments: GH SD PF SA. Analyzed the data: GH SD PF SA MLN. Wrote the paper: GH MLN.","The authors have declared that no competing interests exist."
"10.1371/journal.pone.0123986","plos one","2015-04-29T00:00:00Z","Jianhua Wang; Yuzheng Zhao; Chao Wang; Qian Zhu; Zengmin Du; Aiguo Hu; Yi Yang","Synthetic Biology and Biotechnology Laboratory, State Key Laboratory of Bioreactor Engineering, CAS Center for Excellence in Brain Science, School of Pharmacy, East China University of Science and Technology, 130 Mei Long Road, Shanghai, 200237, P. R. China; Shanghai Key Laboratory of Advanced Polymeric Materials, School of Materials Science and Engineering, East China University of Science and Technology, 130 Mei Long Road, Shanghai, 200237, P. R. China","Conceived and designed the experiments: YY AH. Performed the experiments: JW YZ CW QZ ZD. Analyzed the data: YY AH YZ JW CW QZ ZD. Contributed reagents/materials/analysis tools: JW YZ CW QZ ZD. Wrote the paper: YY AH YZ JW CW.","The authors have declared that no competing interests exist."
"10.1371/journal.pone.0010160","plos one","2010-04-13T00:00:00Z","Justin K Valley; Paul Swinton; W John Boscardin; Tom F Lue; Paolo F Rinaudo; Ming C Wu; Maurice M Garcia","Berkeley Sensor & Actuator Center (BSAC), Electrical Engineering and Computer Sciences, University of California, Berkeley, California, United States of America; Gladstone Transgenic Gene-Targeting Core Laboratory, University of California San Francisco, San Francisco, California, United States of America; Department of Epidemiology and Biostatistics, University of California San Francisco, San Francisco, California, United States of America; Department of Urology, University of California San Francisco, San Francisco, California, United States of America; Division of Reproductive Endocrinology, Department of Obstetrics and Gynaecology, University of California San Francisco, San Francisco, California, United States of America","Conceived and designed the experiments: JV MG. Performed the experiments: JV PS MG. Analyzed the data: JV WJB TL PR MCW MG. Contributed reagents/materials/analysis tools: JV PS WJB PR MCW MG. Wrote the paper: JV PS WJB TL PR MCW MG.","J.V., T.L., M.W., and M.G. have U.S. Patents and U.S. Patents Pending regarding OET and its applications described herein. This work was not funded or supported (either directly or indirectly) by commercial or corporate interests."
"10.1371/journal.pone.0123985","plos one","2015-04-17T00:00:00Z","Jiangnan Wang; Rong Ma; Ashok Sharma; Mingfang He; Jing Xue; Jianzhong Wu; Boying Dun; Gang Li; Xiaoxiao Wang; Minghua Ji; Jin-Xiong She; Jinhai Tang","Institute of Translational Medicine, School of Pharmaceutical Sciences, Nanjing University of Technology, Nanjing, Jiangsu Province, China; Zhengjiang Jintai Biosciences, Zhengjiang, Jiangsu Province, China; Jiangsu Cancer Hospital, Nanjing Medical University, Nanjing, Jiangsu Province, China; Center for Biotechnology and Genomic Medicine, Medical College of Georgia, Georgia Regents University, Augusta, Georgia, United States of America","Conceived and designed the experiments: J. Wang AS JXS JT. Performed the experiments: J. Wang RM MH JX J. Wu BD GL MJ. Analyzed the data: AS XW JXS. Contributed reagents/materials/analysis tools: JXS JT. Wrote the paper: J. Wang AS JXS JT.","Jing Xue is an employee of Zhengjiang Jintai Biosciences, who performed this study as an employee of Nanjing University of Technology. There are no patents, products in development or marketed products to declare. This does not alter the authors' adherence to all the PLOS ONE policies on sharing data and materials."
"10.1371/journal.pone.0010159","plos one","2010-04-15T00:00:00Z","Silvia Volpe; Sylvia Thelen; Thomas Pertel; Martin J Lohse; Marcus Thelen","Institute for Research in Biomedicine, Bellinzona, Switzerland; Department of Microbiology and Molecular Medicine, University of Geneva, Geneva, Switzerland; Rudolf Virchow Center and Institute of Pharmacology and Toxicology, University of Würzburg, Würzburg, Germany","Conceived and designed the experiments: SV MT. Performed the experiments: SV ST. Analyzed the data: SV ST. Contributed reagents/materials/analysis tools: TP MJL. Wrote the paper: MT.","The authors have declared that no competing interests exist."
"10.1371/journal.pone.0123982","plos one","2015-04-20T00:00:00Z","Naoyuki Kawao; Yukinori Tamura; Yoshitaka Horiuchi; Katsumi Okumoto; Masato Yano; Kiyotaka Okada; Osamu Matsuo; Hiroshi Kaji","Department of Physiology and Regenerative Medicine, Kinki University Faculty of Medicine, Osakasayama, Japan; Life Science Research Institute, Kinki University, Osaka, Japan","Conceived and designed the experiments: NK HK. Performed the experiments: NK YT YH KO MY KO OM. Analyzed the data: NK HK. Wrote the paper: NK HK.","The authors have declared that no competing interests exist."
"10.1371/journal.pone.0010158","plos one","2010-04-13T00:00:00Z","Ron P Dirks; Remon van Geel; Sanne M M Hensen; Siebe T van Genesen; Nicolette H Lubsen","Department of Biomolecular Chemistry, Radboud University Nijmegen, Nijmegen, The Netherlands","Conceived and designed the experiments: RPD NL. Performed the experiments: RPD RvG SH STvG. Analyzed the data: RPD. Wrote the paper: RPD NL.","The first author moved to ZF-screens B.V. after completion of the experiments and even after completing the manuscript. The company did thus not fund the research either directly or indirectly."
"10.1371/journal.pone.0010372","plos one","2010-04-29T00:00:00Z","Shilpa Aggarwal; Birgit Bradel-Tretheway; Toru Takimoto; Stephen Dewhurst; Baek Kim","Department of Microbiology and Immunology, University of Rochester Medical Center, Rochester, New York, United States of America","Conceived and designed the experiments: BK. Performed the experiments: SA. Analyzed the data: BBT. Contributed reagents/materials/analysis tools: TT SD.","The authors have declared that no competing interests exist."
"10.1371/journal.pone.0124253","plos one","2015-04-15T00:00:00Z","Giovanni Bertolini; Andrea Wicki; Christian R Baumann; Dominik Straumann; Antonella Palla","Department of Neurology, Zurich University Hospital, Zurich, Switzerland","Conceived and designed the experiments: GB AP AW CRB DS. Performed the experiments: AP AW. Analyzed the data: GB AP. Contributed reagents/materials/analysis tools: GB. Wrote the paper: GB AP DS AW CRB.","The authors have declared that no competing interests exist."
"10.1371/journal.pone.0010371","plos one","2010-04-28T00:00:00Z","Charlotte Labalette; Yann Nouët; Florence Levillayer; Sabine Colnot; Ju Chen; Valere Claude; Michel Huerre; Christine Perret; Marie-Annick Buendia; Yu Wei","Département de Virologie, Institut Pasteur, Paris, France; Inserm U579, Paris, France; Département d'Endocrinologie Métabolisme et Cancer, Institut Cochin, Paris, France; Inserm U567, Paris, France; Department of Medicine, University of California San Diego, La Jolla, California, United States of America; Département d'Anapathologie, Hôpital Bégin, Saint Mandé, France; Département d'Infection et Epidémiologie, Institut Pasteur, Paris, France","Conceived and designed the experiments: CL YN YW. Performed the experiments: CL YN FL YW. Analyzed the data: CL YN FL SC VC MH CP MAB YW. Contributed reagents/materials/analysis tools: SC JC VC MH CP. Wrote the paper: CL MAB YW.","The authors have declared that no competing interests exist."
"10.1371/journal.pone.0010370","plos one","2010-04-28T00:00:00Z","Ravit Arav-Boger; Ran He; Chuang-Jiun Chiou; Jianyong Liu; Lauren Woodard; Andrew Rosenthal; Lorraine Jones-Brando; Michael Forman; Gary Posner","Department of Pediatrics, Johns Hopkins University School of Medicine, Baltimore, Maryland, United States of America; The Sidney Kimmel Comprehensive Cancer Center, Johns Hopkins University School of Medicine, Baltimore, Maryland, United States of America; Department of Chemistry, School of Arts and Sciences, The Johns Hopkins University, Baltimore, Maryland, United States of America; Department of Pathology, Johns Hopkins Medical Institutions, Baltimore, Maryland, United States of America","Conceived and designed the experiments: RAB. Performed the experiments: RAB RH CJC JL LJB MF. Analyzed the data: RAB. Contributed reagents/materials/analysis tools: LW AR LJB MF GP. Wrote the paper: RAB. Provided expertise on the compounds used, provided the chemical structure reviewed and revised the manuscript: GP.","The authors have declared that no competing interests exist."
"10.1371/journal.pone.0124251","plos one","2015-04-21T00:00:00Z","Roni Gilad; Karen Meir; Ilan Stein; Larissa German; Eli Pikarsky; Nicola J Mabjeesh","Department of Urology, Tel Aviv Sourasky Medical Center, Sackler Faculty of Medicine, Tel Aviv University, Tel Aviv, Israel; Department of Pathology, The Hebrew University-Hadassah Medical School, Jerusalem, Israel","Conceived and designed the experiments: RG EP NJM. Performed the experiments: RG KM IS. Analyzed the data: RG LG EP NJM. Contributed reagents/materials/analysis tools: KM IS EP NJM. Wrote the paper: RG EP NJM.","The authors have declared that no competing interests exist."
"10.1371/journal.pone.0010369","plos one","2010-04-28T00:00:00Z","Chiara Lambertini; Serafino Pantano; G Paolo Dotto","Department of Biochemistry, University of Lausanne, Epalinges, Switzerland; Cutaneous Biology Research Center, Massachusetts General Hospital, Charlestown, Massachusetts, United States of America","Conceived and designed the experiments: CL SP GPD. Performed the experiments: CL SP. Analyzed the data: CL SP GPD. Wrote the paper: GPD.","The authors have declared that no competing interests exist."
"10.1371/journal.pone.0124250","plos one","2015-04-29T00:00:00Z","Guillermo E Bachmann; Diego F Segura; Francisco Devescovi; M Laura Juárez; M Josefina Ruiz; M Teresa Vera; Jorge L Cladera; Peter E A Teal; Patricia C Fernández","Instituto de Genética “E.A. Favret”, Instituto Nacional de Tecnología Agropecuaria (INTA), Hurlingham, Argentina; Consejo Nacional de Investigaciones Científicas y Técnicas (CONICET), Ciudad Autónoma de Buenos Aires, Argentina; Facultad de Agronomía y Zootecnia (FAZ), Universidad Nacional de Tucumán, San Miguel de Tucumán, Argentina; Estación Experimental Agroindustrial Obispo Colombres (EEAOC), San Miguel de Tucumán, Argentina; Center for Medical, Agricultural and Veterinary Entomology (CMAVE), USDA-ARS, Gainesville, FL, United States of America; Estación Experimental Agropecuaria Delta del Paraná, Instituto Nacional de Tecnología Agropecuaria (INTA), Campana, Argentina","Conceived and designed the experiments: DFS MTV PCF JC. Performed the experiments: DFS MTV GEB PCF MJR MLJ FD. Analyzed the data: DFS MTV GEB PCF PET MLJ. Contributed reagents/materials/analysis tools: DFS MTV PCF PET JC. Wrote the paper: DFS MTV GEB PCF.","The authors have declared that no competing interests exist."
"10.1371/journal.pone.0010368","plos one","2010-04-28T00:00:00Z","Elena G Govorunova; Mustapha Moussaif; Andrey Kullyev; Ken C Q Nguyen; Thomas V McDonald; David H Hall; Ji Y Sze","Department of Molecular Pharmacology, Albert Einstein College of Medicine, Bronx, New York, United States of America; Department of Medicine, Albert Einstein College of Medicine, Bronx, New York, United States of America; Department of Neuroscience, Albert Einstein College of Medicine, Bronx, New York, United States of America","Conceived and designed the experiments: EG MM AK JYS. Performed the experiments: EG MM AK KCQN. Analyzed the data: EG MM AK TM DH JYS. Contributed reagents/materials/analysis tools: TM DH JYS. Wrote the paper: EG MM TM DH JYS.","The authors have declared that no competing interests exist."
"10.1371/journal.pone.0124249","plos one","2015-05-08T00:00:00Z","Mario Barbosa; Isabel Prada-López; Maximiliano Álvarez; Barbas Amaral; Casares-De-Cal María de los Angeles; Inmaculada Tomás","School of Dentistry, Instituto Superior de Ciências da Saúde-Norte, Centro de Investigação de Ciências da Saúde, Gandra, Portugal; Oral Sciences Research Group, Special Needs Unit, School of Medicine and Dentistry, University of Santiago de Compostela, Santiago de Compostela, Spain; Department of Microbiology, CHUVI, Xeral-Cíes Hospital, IBIV, Vigo, Spain; Department of Stomatology and Maxilo-Facial Surgery, St. António General Hospital, Oporto, Portugal","Conceived and designed the experiments: MA IT. Performed the experiments: MB BA. Analyzed the data: IT MACDC. Contributed reagents/materials/analysis tools: MA. Wrote the paper: IPL IT.","The authors have declared that no competing interests exist."
"10.1371/journal.pone.0010367","plos one","2010-04-28T00:00:00Z","Swapnalee Sarmah; Alejandro Barrallo-Gimeno; David B Melville; Jacek Topczewski; Lilianna Solnica-Krezel; Ela W Knapik","Department of Medicine, Division of Genetic Medicine and Department of Cell and Developmental Biology, Vanderbilt University Medical Center, Nashville, Tennessee, United States of America; Developmental Biology, Institute Biology I, University of Freiburg, Freiburg, Germany; Department of Biological Sciences, Vanderbilt University, Nashville, Tennessee, United States of America","Conceived and designed the experiments: SS EWK. Performed the experiments: SS ABG DBM EWK. Analyzed the data: SS ABG DBM EWK. Contributed reagents/materials/analysis tools: JT LSK. Wrote the paper: SS EWK. Corrected manuscript drafts: EWK SS ABG DBM JT LSK.","The authors have declared that no competing interests exist."
"10.1371/journal.pone.0010366","plos one","2010-04-28T00:00:00Z","John F Nomellini; Carmen Li; Danielle Lavallee; Iryna Shanina; Lisa A Cavacini; Marc S Horwitz; John Smit","Beth Israel Deaconess Medical Center, Boston, Massachusetts, United States of America; Microbiology and Immunology, The University of British Columbia, Vancouver, British Columbia, Canada","Conceived and designed the experiments: MSH JS. Performed the experiments: JFN CL DJL IS. Analyzed the data: JFN CL DJL IS LC MSH JS. Contributed reagents/materials/analysis tools: JS. Wrote the paper: MSH JS.","The authors have declared that no competing interests exist."
"10.1371/journal.pone.0124246","plos one","2015-04-16T00:00:00Z","Mónica Costa; Eugénia Cruz; Susana Oliveira; Vladimir Benes; Tomi Ivacevic; Maria João Silva; Inês Vieira; Francisco Dias; Sónia Fonseca; Marta Gonçalves; Margarida Lima; Catarina Leitão; Martina U Muckenthaler; Jorge Pinto; Graça Porto","I3S - Instituto de Investigação e Inovação em Saúde, Universidade do Porto, Porto, Portugal; Basic and Clinical Research on Iron Biology, IBMC—Instituto de Biologia Molecular e Celular, Universidade do Porto, Porto, Portugal; Doctoral Program in Biomedicine, Faculdade de Medicina, Universidade do Porto, Porto, Portugal; Clinical Hematology, Santo António Hospital—Centro Hospitalar do Porto, Porto, Portugal; Genomics Core Facility, European Molecular Biology Laboratory, Heidelberg, Germany; Advanced Flow Cytometry Unit, IBMC—Instituto de Biologia Molecular e Celular, Universidade do Porto, Porto, Portugal; Departments of Pediatric Hematology, Oncology and Immunology, University of Heidelberg and Molecular Medicine Partnership Unit, Heidelberg, Germany; Molecular Immunology and Pathology, ICBAS—Instituto de Ciências Biomédicas Abel Salazar, Universidade do Porto, Porto, Portugal","Conceived and designed the experiments: GP JP MC MUM SO MJS. Performed the experiments: MC EC SO VB TI MJS IV SF MG. Analyzed the data: MC EC SO JP MJS VB TI GP. Contributed reagents/materials/analysis tools: VB TI FD ML CL. Wrote the paper: MC EC SO MUM GP MJS JP.","The authors have declared that no competing interests exist."
"10.1371/journal.pone.0124245","plos one","2015-04-14T00:00:00Z","Brittany L Mihelich; Joseph C Maranville; Rosalie Nolley; Donna M Peehl; Larisa Nonn","Department of Pathology, University of Illinois at Chicago, Chicago, IL, 60612, United States of America; Clinical Pharmacology and Pharmacogenomics, University of Chicago, Chicago, IL, 60637, United States of America; Department of Urology, Stanford University, Palo Alto, CA, 94305, United States of America","Conceived and designed the experiments: LN DP. Performed the experiments: BM. Analyzed the data: BM JM LN. Contributed reagents/materials/analysis tools: DP LN. Wrote the paper: BM DP LN. Patient selection and matching: RN.","The authors have declared that no competing interests exist."
"10.1371/journal.pone.0010365","plos one","2010-04-28T00:00:00Z","Abhik Bandyopadhyay; Long Wang; Joseph Agyin; Yuping Tang; Shu Lin; I-Tien Yeh; Keya De; Lu-Zhe Sun","Department of Cellular and Structural Biology, University of Texas Health Science Center, San Antonio, Texas, United States of America; Department of Biochemistry, University of Texas Health Science Center, San Antonio, Texas, United States of America; Department of Pathology, University of Texas Health Science Center, San Antonio, Texas, United States of America","Conceived and designed the experiments: AB LZS. Performed the experiments: AB LW YT SL KD. Analyzed the data: AB LW YT SL KD. Contributed reagents/materials/analysis tools: JA. Wrote the paper: AB LZS. Histology analysis: ITY.","The authors have declared that no competing interests exist."
"10.1371/journal.pone.0010364","plos one","2010-04-28T00:00:00Z","Aubree Gordon; Elsa Videa; Saira Saborío; Roger López; Guillermina Kuan; Angel Balmaseda; Eva Harris","Division of Epidemiology, School of Public Health, University of California, Berkeley, California, United States of America; John E. Fogarty International Center, National Institutes of Health, Bethesda, Maryland, United States of America; Sustainable Sciences Institute, Managua, Nicaragua; Departamento de Virología, Centro Nacional de Diagnóstico y Referencia, Ministry of Health, Managua, Nicaragua; Centro de Salud Sócrates Flores Vivas, Ministry of Health, Managua, Nicaragua; Division of Infectious Diseases and Vaccinology, School of Public Health, University of California, Berkeley, California, United States of America","Conceived and designed the experiments: AG GK AB EH. Performed the experiments: AG EV SS RL GK AB. Analyzed the data: AG. Contributed reagents/materials/analysis tools: EH. Wrote the paper: AG AB EH.","None of the authors have any relationships or support that might be perceived as constituting a conflict of interest, except that Quidel Corporation covered the costs of airfare and hotel for AG at one conference in February 2009 and provided the rapid tests. This does not alter the authors' adherence to all of the PLoS ONE policies on sharing data and materials."
"10.1371/journal.pone.0124244","plos one","2015-04-24T00:00:00Z","Riccardo Zanni; Maria Galvez-Llompart; Cecilia Morell; Nieves Rodríguez-Henche; Inés Díaz-Laviada; Maria Carmen Recio-Iglesias; Ramon Garcia-Domenech; Jorge Galvez","Department of Physical Chemistry, School of Pharmacy, University of Valencia, Valencia, Spain; Department of System Biology, Biochemistry and Molecular Biology Unit, School of Medicine, University of Alcala, Alcalá de Henares, Spain; Department of Pharmacology, School of Pharmacy, University of Valencia, Valencia, Spain","Conceived and designed the experiments: RZ MGL MCR RGD JG. Performed the experiments: RZ MGL CM NRH IDL MCR. Analyzed the data: RZ MGL CM NRH IDL RGD JG. Wrote the paper: RZ MGL IDL JG.","The authors have declared that no competing interests exist."
"10.1371/journal.pone.0010363","plos one","2010-04-27T00:00:00Z","Jun-Ichi Miyazaki; Leonardo de Oliveira Martins; Yuko Fujita; Hiroto Matsumoto; Yoshihiro Fujiwara","Faculty of Education and Human Sciences, University of Yamanashi, Kofu, Yamanashi, Japan; Department of Biochemistry, Genetics and Immunology, University of Vigo, Vigo, Spain; Institute of Biological Sciences, University of Tsukuba, Tsukuba, Ibaraki, Japan; Research Program for Marine Biology and Ecology, Japan Agency for Marine-Earth Science and Technology (JAMSTEC), Yokosuka, Kanagawa, Japan","Conceived and designed the experiments: JIM. Performed the experiments: JIM YF HM YF. Analyzed the data: JIM LdOM YF HM YF. Contributed reagents/materials/analysis tools: JIM LdOM YF. Wrote the paper: JIM LdOM.","The authors have declared that no competing interests exist."
"10.1371/journal.pone.0124243","plos one","2015-05-01T00:00:00Z","Remko Schats; Else M Bijker; Geert-Jan van Gemert; Wouter Graumans; Marga van de Vegte-Bolmer; Lisette van Lieshout; Mariëlle C Haks; Cornelus C Hermsen; Anja Scholzen; Leo G Visser; Robert W Sauerwein","Leiden University Medical Center, Department of Infectious Diseases, PO Box 9600, 2300 RC, Leiden, The Netherlands; Radboud university medical center, Department of Medical Microbiology, PO Box 9101, 6500 HB, Nijmegen, The Netherlands; Leiden University Medical Center, Department of Medical Microbiology, PO Box 9600, 2300 RC, Leiden, The Netherlands; Leiden University Medical Center, Department of Parasitology, PO Box 9600, 2300 RC, Leiden, The Netherlands","Conceived and designed the experiments: RS EMB AS LGV RWS. Performed the experiments: RS EMB GJvG WG MvdVB LvL CCH AS LGV RWS. Analyzed the data: RS MCH LGV. Contributed reagents/materials/analysis tools: GJvG WG MvdVB LvL CCH AS. Wrote the paper: RS EMB MCH LGV RWS.","The authors have declared that no competing interests exist."
"10.1371/journal.pone.0010362","plos one","2010-05-05T00:00:00Z","Bernat Vila; Frankie D Jackson; Josep Fortuny; Albert G Sellés; Àngel Galobart","Institut Català de Paleontologia, Campus de la Universitat Autònoma de Barcelona, Barcelona, Spain; Department of Earth Sciences, Montana State University, Bozeman, Montana, United States of America","Conceived and designed the experiments: BV FDJ ÀG. Analyzed the data: BV FDJ JF AGS ÀG. Contributed reagents/materials/analysis tools: BV JF AGS. Wrote the paper: BV. Participated in discovering the fossil material: BV FDJ JF AGS ÀG. Involved in CT scanning, 3-D modelling, and interpreting fossil material that was scanned: BV JF AGS.","The authors have declared that no competing interests exist."
"10.1371/journal.pone.0124242","plos one","2015-04-20T00:00:00Z","Dan Ziegler; Alexander Strom; Klaus Strassburger; Bettina Nowotny; Lejla Zahiragic; Peter J Nowotny; Maren Carstensen-Kirberg; Christian Herder; Julia Szendroedi; Michael Roden","Institute for Clinical Diabetology, German Diabetes Center at Heinrich Heine University, Leibniz Center for Diabetes Research, Düsseldorf, Germany; Department of Endocrinology and Diabetology, University Hospital, Düsseldorf, Germany; German Center for Diabetes Research (DZD), Partner Düsseldorf, Düsseldorf, Germany; Institute of Biometrics and Epidemiology, German Diabetes Center at Heinrich Heine University, Leibniz Center for Diabetes Research, Düsseldorf, Germany","Conceived and designed the experiments: MR DZ. Performed the experiments: DZ BN LZ MCK CH JS. Analyzed the data: DZ AS BN KS LZ MCK CH JS. Contributed reagents/materials/analysis tools: PJN KS. Wrote the paper: DZ PJN CH MR AS.","The authors have declared that no competing interests exist."
"10.1371/journal.pone.0010361","plos one","2010-04-29T00:00:00Z","Justina C Wolters; Ronnie P-A Berntsson; Nadia Gul; Akira Karasawa; Andy-Mark W H Thunnissen; Dirk-Jan Slotboom; Bert Poolman","Biochemistry Department, Groningen Biomolecular Sciences and Biotechnology Institute, Netherlands Proteomics Centre, Zernike Institute for Advanced Materials, University of Groningen, Groningen, The Netherlands; Biophysical Chemistry Department, Groningen Biomolecular Sciences and Biotechnology Institute, University of Groningen, Groningen, The Netherlands","Conceived and designed the experiments: JW RB DJS BP. Performed the experiments: JW RB NG AK. Analyzed the data: JW RB NG AK AMWHT DJS BP. Wrote the paper: JW RB AMWHT DJS BP.","The authors have declared that no competing interests exist."
"10.1371/journal.pone.0010360","plos one","2010-04-29T00:00:00Z","Naia Morueta-Holme; Camilla Fløjgaard; Jens-Christian Svenning","Ecoinformatics and Biodiversity Group, Department of Biological Sciences, Aarhus University, Aarhus, Denmark; Department of Wildlife Ecology and Biodiversity, National Environmental Research Institute, Aarhus University, Rønde, Denmark","Conceived and designed the experiments: NMH CF JCS. Performed the experiments: NMH CF. Analyzed the data: NMH. Wrote the paper: NMH CF JCS.","The authors have declared that no competing interests exist."
"10.1371/journal.pone.0124240","plos one","2015-04-13T00:00:00Z","Boris Zimmermann; Zdenko Tkalčec; Armin Mešić; Achim Kohler","Department of Mathematical Sciences and Technology, Norwegian University of Life Sciences, Ås, Norway; Division for Marine and Environmental Research, Ruđer Bošković Institute, Zagreb, Croatia","Conceived and designed the experiments: BZ ZT AM. Performed the experiments: BZ ZT. Analyzed the data: BZ AK. Contributed reagents/materials/analysis tools: BZ AM ZT AK. Wrote the paper: BZ AM ZT AK.","The authors have declared that no competing interests exist."
