"id","journal","publication_date","author","author_affiliate","author_notes","competing_interest"
"10.1371/journal.pbio.0060182","plos biology","2008-07-22T00:00:00Z","Konstantinos Meletis; Fanie Barnabé-Heider; Marie Carlén; Emma Evergren; Nikolay Tomilin; Oleg Shupliakov; Jonas Frisén","Department of Cell and Molecular Biology, Karolinska Institute, Stockholm, Sweden; Department of Neuroscience, Karolinska Institute, Stockholm, Sweden","KM, FBH, MC, and JF conceived and designed the experiments. KM, FBH, MC, EE, NT, OS, and JF performed the experiments and analyzed the data. KM, FBH, MC, and JF wrote the paper.","The authors have declared that no competing interests exist."
"10.1371/journal.pgen.1004118","plos genetics","2014-01-23T00:00:00Z","Kazuya Ono; Tomoko Kita; Shigeru Sato; Paul O'Neill; Siu-Shan Mak; Marie Paschaki; Masataka Ito; Noriko Gotoh; Kiyoshi Kawakami; Yoshiki Sasai; Raj K Ladher","Sensory Development, RIKEN Center for Developmental Biology, Chuo-ku, Kobe, Japan; Neurogenesis and Organogenesis, RIKEN Center for Developmental Biology, Chuo-ku, Kobe, Japan; Division of Biology, Center for Molecular Medicine, Jichi Medical University, Shimotsuke, Tochigi, Japan; Department of Anatomy, National Defense Medical College, Tokorozawa, Japan; Division of Genetics, Institute of Medical Science, University of Tokyo, Minato-ku, Japan","Conceived and designed the experiments: KO TK RKL. Performed the experiments: KO TK PO SSM MP. Analyzed the data: KO TK YS RKL. Contributed reagents/materials/analysis tools: SS MI NG KK. Wrote the paper: KO RKL.","The authors have declared that no competing interests exist."
"10.1371/journal.pgen.1004117","plos genetics","2014-02-20T00:00:00Z","Merennege Dilan Anush Fernando; Ilias Kounatidis; Petros Ligoxygakis","Genes and Development Laboratory, Department of Biochemistry, University of Oxford, Oxford, United Kingdom","Conceived and designed the experiments: PL MDAF IK. Performed the experiments: MDAF IK PL. Analyzed the data: PL IK MDAF. Contributed reagents/materials/analysis tools: MDAF PL. Wrote the paper: MDAF IK PL.","The authors have declared that no competing interests exist."
"10.1371/journal.pbio.0060254","plos biology","2008-10-28T00:00:00Z","Laurent Kappeler; Carlos De Magalhaes Filho; Joëlle Dupont; Patricia Leneuve; Pascale Cervera; Laurence Périn; Catherine Loudes; Annick Blaise; Rüdiger Klein; Jacques Epelbaum; Yves Le Bouc; Martin Holzenberger","INSERM U893, Hôpital Saint-Antoine, Paris, France; Université Pierre-et-Marie-Curie, Paris, France; INRA, Nouzilly, France; Service d'Anatomopathologie, Hôpital Saint-Antoine, Paris, France; INSERM U549, Centre Paul Broca, Paris, France; Department of Molecular Neurobiology, Max-Planck Institute of Neurobiology, Munich-Martinsried, Germany","LK, CDMF, YLB, and MH designed the experiments. LK, CDMF, JD, PL, PC, LP, CL, AB, JE, and MH performed the experiments and analyzed the data. RK provided NesCre mice and advice. MH wrote the manuscript. LK, CDMF, JD, PL, PC, LP, CL, AB, RK, JE, YLB, and MH discussed the results and commented on the manuscript.","The authors have declared that no competing interests exist."
"10.1371/journal.pbio.0060255","plos biology","2008-10-28T00:00:00Z","Daniel J Hogan; Daniel P Riordan; André P Gerber; Daniel Herschlag; Patrick O Brown","Department of Biochemistry, Stanford University School of Medicine, Stanford, California, United States of America; Howard Hughes Medical Institute, Stanford University School of Medicine, Stanford, California, United States of America; Department of Genetics, Stanford University School of Medicine, Stanford, California, United States of America; Institute of Pharmaceutical Sciences, Department of Chemistry and Applied Biosciences, ETH Zurich, Zurich, Switzerland","DJH, APG, DH, and POB conceived and designed the experiments. DJH and APG performed the experiments. DJH and DPR analyzed the data. DPR, DH, and POB contributed reagents/materials/analysis tools. DJH, DPR, APG, DH, and POB wrote the paper.","The authors have declared that no competing interests exist."
"10.1371/journal.pbio.0060258","plos biology","2008-10-28T00:00:00Z","Wilder Doucette; Diego Restrepo","Department of Cell and Developmental Biology, Neuroscience Program and Rocky Mountain Taste and Smell Center, University of Colorado Denver Anschutz Medical Campus, Aurora, Colorado, United States of America","WD and DR designed the experiments and assembled and troubleshot the experimental setup. WD did all the experiments. DR did all the programming for data analysis with input from WD on algorithm design. WD and DR did the analysis and writing of the manuscript.","The authors have declared that no competing interests exist."
"10.1371/journal.pgen.1004116","plos genetics","2014-01-30T00:00:00Z","Jie Zhou; Yan Zhang; Jingxia Qi; Yingjin Chi; Baofang Fan; Jing-Quan Yu; Zhixiang Chen","Department of Horticulture, Zijingang Campus, Zhejiang University, Hangzhou, China; Department of Botany and Plant Pathology, Purdue University, West Lafayette, Indiana, United States of America","Conceived and designed the experiments: ZC JZ JQY. Performed the experiments: JZ YZ JQ YC BF. Analyzed the data: ZC JZ YZ. Contributed reagents/materials/analysis tools: JQY. Wrote the paper: ZC JZ.","The authors have declared that no competing interests exist."
"10.1371/journal.pgen.1004370","plos genetics","2014-05-15T00:00:00Z","Michaela Drögemüller; Vidhya Jagannathan; Doreen Becker; Cord Drögemüller; Claude Schelling; Jocelyn Plassais; Cécile Kaerle; Caroline Dufaure de Citres; Anne Thomas; Eliane J Müller; Monika M Welle; Petra Roosje; Tosso Leeb","Institute of Genetics, Vetsuisse Faculty, University of Bern, Bern, Switzerland; DermFocus, University of Bern, Bern, Switzerland; Clinic for Reproductive Medicine, University of Zurich, Zurich, Switzerland; CNRS, UMR 6290, Institut Génétique et Développement de Rennes, Rennes, France; Université Rennes 1, UEB, Biosit, Faculté de Médecine, Rennes, France; Antagene, Animal Genetics Laboratory, La Tour de Salvagny, France; Institute of Animal Pathology, Vetsuisse Faculty, University of Bern, Bern, Switzerland; Division of Clinical Dermatology, Vetsuisse Faculty, University of Bern, Bern, Switzerland","Conceived and designed the experiments: MD VJ JP AT EJM MMW PR TL. Performed the experiments: MD VJ DB CD JP CK CDdC MMW PR TL. Analyzed the data: MD VJ DB JP CK CDdC AT EJM MMW PR TL. Contributed reagents/materials/analysis tools: CS. Wrote the paper: MD VJ AT EJM MMW PR TL.","I have read the journal's policy and have the following conflicts: The authors CK, CDdC and AT are employees of Antagene, a private company selling diagnostic tests in dogs."
"10.1371/journal.pgen.1004353","plos genetics","2014-05-08T00:00:00Z","Martin Sikora; Meredith L Carpenter; Andres Moreno-Estrada; Brenna M Henn; Peter A Underhill; Federico Sánchez-Quinto; Ilenia Zara; Maristella Pitzalis; Carlo Sidore; Fabio Busonero; Andrea Maschio; Andrea Angius; Chris Jones; Javier Mendoza-Revilla; Georgi Nekhrizov; Diana Dimitrova; Nikola Theodossiev; Timothy T Harkins; Andreas Keller; Frank Maixner; Albert Zink; Goncalo Abecasis; Serena Sanna; Francesco Cucca; Carlos D Bustamante","Department of Genetics, Stanford University, Stanford, California, United States of America; Institute of Evolutionary Biology (CSIC-UPF), PRBB, Barcelona, Spain; CRS4 (Centre for Advanced Studies, Research and Development in Sardinia), Pula, Italy; Istituto di Ricerca Genetica e Biomedica (IRGB), CNR, Monserrato, Italy; Center for Statistical Genetics, University of Michigan, Ann Arbor, Michigan, United States of America; Università degli Studi di Sassari, Dip. Scienze Biomediche, Sassari, Italy; Laboratorios de Investigación y Desarrollo, Facultad de Ciencias y Filosofía, Universidad Peruana Cayetano Heredia, Lima, Peru; National Archaeological Institute with Museum, Sofia, Bulgaria; Sofia University St. Kliment Ohridski, Sofia, Bulgaria; Life Technologies, Beverly, Massachusetts, United States of America; University Hospital, Saarland University, Saarbrücken, Germany; EURAC, Institute for mummies and the Iceman, Bolzano, Italy","Conceived and designed the experiments: MS TTH AK AZ GA SS FC CDB BMH PAU. Performed the experiments: MLC IZ MP CS FB AM AA CJ. Analyzed the data: MS MLC AME FSQ IZ JMR. Contributed reagents/materials/analysis tools: FSQ IZ MP CS FB AM AA CJ GN DD NT FM. Wrote the paper: MS BMH PAU CDB.","The authors have declared that no competing interests exist."
"10.1371/journal.pbio.1000147","plos biology","2009-06-30T00:00:00Z","Christian Mitri; Laurent Soustelle; Bérénice Framery; Joël Bockaert; Marie-Laure Parmentier; Yves Grau","Institut de Génomique Fonctionnelle, CNRS UMR5203, INSERM U661, University of Montpellier I and II, Montpellier, France","The author(s) have made the following declarations about their contributions: Conceived and designed the experiments: CM LS JB MLP YG. Performed the experiments: CM LS BF YG. Analyzed the data: CM LS JB MLP YG. Contributed reagents/materials/analysis tools: CM LS BF MLP YG. Wrote the paper: CM LS JB MLP YG.","The authors have declared that no competing interests exist."
"10.1371/journal.pgen.1004322","plos genetics","2014-05-08T00:00:00Z","Elizabeth G King; Brian J Sanderson; Casey L McNeil; Anthony D Long; Stuart J Macdonald","Department of Ecology and Evolutionary Biology, University of California Irvine, Irvine, California, United States of America; Department of Molecular Biosciences, University of Kansas, Lawrence, Kansas, United States of America; Department of Biology, Newman University, Wichita, Kansas, United States of America","Conceived and designed the experiments: ADL SJM. Performed the experiments: BJS CLM SJM. Analyzed the data: ADL EGK. Wrote the paper: ADL EGK SJM.","The authors have declared that no competing interests exist."
"10.1371/journal.pgen.1004319","plos genetics","2014-05-01T00:00:00Z","Rituparna Mukhopadhyay; Julien Lajugie; Nicolas Fourel; Ari Selzer; Michael Schizas; Boris Bartholdy; Jessica Mar; Chii Mei Lin; Melvenia M Martin; Michael Ryan; Mirit I Aladjem; Eric E Bouhassira","Department of Cell Biology, Albert Einstein College of Medicine, Bronx, New York, United States of America; Department of Systems and Computational Biology, Albert Einstein College of Medicine, Bronx, New York, United States of America; Laboratory of Molecular Pharmacology, Center for Cancer Research, National Cancer Institute, Bethesda, Maryland, United States of America","Conceived and designed the experiments: RM JL NF AS MS JM CML MMM MR MIA EEB. Performed the experiments: RM JL NF AS MS JM CML MMM MR MIA EEB. Analyzed the data: RM JL NF AS MS BB JM CML MMM MR MIA EEB. Wrote the paper: RM JL NF AS MS JM CML MMM MR MIA EEB.","The authors have declared that no competing interests exist."
"10.1371/journal.pgen.1004058","plos genetics","2014-01-09T00:00:00Z","Jamie T Bridgham; June Keay; Eric A Ortlund; Joseph W Thornton","Institute of Ecology and Evolution, University of Oregon, Eugene, Oregon, United States of America; Biochemistry Department, Emory University School of Medicine, Atlanta, Georgia, United States of America; Departments of Human Genetics and Ecology & Evolution, The University of Chicago, Chicago, Illinois, United States of America","Conceived and designed the experiments: JWT JTB JK EAO. Performed the experiments: JTB JK. Analyzed the data: JTB JK EAO JWT. Wrote the paper: JWT JTB JK EAO.","The authors have declared that no competing interests exist."
"10.1371/journal.pgen.1003286","plos genetics","2013-02-14T00:00:00Z","Yumi Mizuno; Yuichi Ninomiya; Yutaka Nakachi; Mioko Iseki; Hiroyasu Iwasa; Masumi Akita; Tohru Tsukui; Nobuyuki Shimozawa; Chizuru Ito; Kiyotaka Toshimori; Megumi Nishimukai; Hiroshi Hara; Ryouta Maeba; Tomoki Okazaki; Ali Nasser Ali Alodaib; Mohammed Al Amoudi; Minnie Jacob; Fowzan S Alkuraya; Yasushi Horai; Mitsuhiro Watanabe; Hiromi Motegi; Shigeharu Wakana; Tetsuo Noda; Igor V Kurochkin; Yosuke Mizuno; Christian Schönbach; Yasushi Okazaki","Division of Functional Genomics and Systems Medicine, Research Center for Genomic Medicine, Saitama Medical University, Hidaka-shi, Saitama, Japan; Division of Translational Research, Research Center for Genomic Medicine, Saitama Medical University, Hidaka-shi, Saitama, Japan; Division of Morphological Science, Biomedical Research Center, Saitama Medical University, Iruma-gun, Saitama, Japan; Experimental Animal Laboratory, Research Center for Genomic Medicine, Saitama Medical University, Hidaka-shi, Saitama, Japan; Division of Genomics Research, Life Science Research Center, Gifu University, Gifu, Japan; Department of Anatomy and Developmental Biology, Graduate School of Medicine, Chiba University, Chiba, Japan; Laboratory of Nutritional Biochemistry, Research Group of Food Science, Division of Applied Bioscience, Graduate School of Agriculture, Hokkaido University, Sapporo, Hokkaido, Japan; Department of Biochemistry, Teikyo University School of Medicine, Itabashi-ku, Tokyo, Japan; Developmental Genetics Department, Department of Genetics, King Faisal Specialist Hospital and Research Center, Riyadh, Kingdom of Saudi Arabia; The National Newborn Screening Laboratory, Department of Genetics, King Faisal Specialist Hospital and Research Center, Riyadh, Kingdom of Saudi Arabia; Department of Pediatrics, King Khalid University Hospital and College of Medicine, King Saud University, Riyadh, Kingdom of Saudi Arabia; Department of Anatomy and Cell Biology, College of Medicine, Alfaisal University, Riyadh, Kingdom of Saudi Arabia; Department of Internal Medicine, School of Medicine, Keio University, Shinjuku-ku, Tokyo, Japan; Graduate School of Media and Governance, Keio University, Tokyo, Japan; Faculty of Environment and Information Studies, Keio University, Tokyo, Japan; Team for Advanced Development and Evaluation of Human Disease Models, Japan Mouse Clinic, BioResource Center (BRC), Tsukuba, Ibaraki, Japan; The Japan Mouse Clinic, RIKEN BioResource Center (BRC), Tsukuba, Ibaraki, Japan; The Cancer Institute of the Japanese Foundation for Cancer Research, Koto-ku, Tokyo, Japan; Genome and Gene Expression Data Analysis Division, Bioinformatics Institute, A*STAR, Singapore, Republic of Singapore; Division of Genomics and Genetics, School of Biological Sciences, Nanyang Technological University, Singapore, Republic of Singapore","Conceived and designed the experiments: Yumi Mizuno, Yosuke Mizuno, Yuichi Ninomiya, Christian Schönbach, Igor V Kurochkin, Hiroyasu Iwasa, Yasushi Okazaki. Performed the experiments: Yumi Mizuno, Mioko Iseki, Yuichi Ninomiya, Masumi Akita, Tohru Tsukui, Nobuyuki Shimozawa, Chizuru Ito, Kiyotaka Toshimori, Hiromi Motegi, Shigeharu Wakana, Tetsuo Noda, Megumi Nishimukai, Hiroshi Hara, Ryouta Maeba, Tomoki Okazaki, Ali Nasser Ali Alodaib, Mohammed Al Amoudi, Minnie Jacob, Fowzan S Alkuraya, Yasushi Horai, Mitsuhiro Watanabe, Yosuke Mizuno. Analyzed the data: Yumi Mizuno, Mioko Iseki, Yuichi Ninomiya, Yutaka Nakachi, Masumi Akita, Tohru Tsukui, Nobuyuki Shimozawa, Chizuru Ito, Kiyotaka Toshimori, Hiromi Motegi, Shigeharu Wakana, Tetsuo Noda, Megumi Nishimukai, Hiroshi Hara, Ryouta Maeba, Tomoki Okazaki, Ali Nasser Ali Alodaib, Mohammed Al Amoudi, Minnie Jacob, Fowzan S Alkuraya, Yasushi Horai, Mitsuhiro Watanabe, Yosuke Mizuno, Igor V Kurochkin, Christian Schönbach, Yasushi Okazaki. Wrote the paper: Yumi Mizuno, Yosuke Mizuno, Yutaka Nakachi, Masumi Akita, Nobuyuki Shimozawa, Chizuru Ito, Kiyotaka Toshimori, Fowzan S Alkuraya, Igor V Kurochkin, Christian Schönbach, Yasushi Okazaki.","The authors have declared that no competing interests exist."
"10.1371/journal.pgen.1003281","plos genetics","2013-02-21T00:00:00Z","He Gao; Xiao-Ming Zheng; Guilin Fei; Jun Chen; Mingna Jin; Yulong Ren; Weixun Wu; Kunneng Zhou; Peike Sheng; Feng Zhou; Ling Jiang; Jie Wang; Xin Zhang; Xiuping Guo; Jiu-Lin Wang; Zhijun Cheng; Chuanyin Wu; Haiyang Wang; Jian-Min Wan","National Key Laboratory for Crop Genetics and Germplasm Enhancement, Jiangsu Plant Gene Engineering Research Center, Nanjing Agricultural University, Nanjing, China; National Key Facility for Crop Gene Resources and Genetic Improvement, Institute of Crop Science, Chinese Academy of Agricultural Sciences, Beijing, China","Conceived and designed the experiments: HG CW HW J-MW. Performed the experiments: HG X-MZ GF JC MJ YR WW KZ PS FZ LJ JW XZ XG J-LW ZC. Analyzed the data: HG X-MZ CW HW J-MW. Contributed reagents/materials/analysis tools: CW J-MW. Wrote the paper: HG CW HW J-MW.","The authors have declared that no competing interests exist."
"10.1371/journal.pbio.0030328","plos biology","2005-08-30T00:00:00Z","Chih Long Liu; Tommy Kaplan; Minkyu Kim; Stephen Buratowski; Stuart L Schreiber; Nir Friedman; Oliver J Rando","Bauer Center for Genomics Research, Harvard University, Cambridge, Massachusetts, United States of America; Department of Chemistry and Chemical Biology, Harvard University, Cambridge, Massachusetts, United States of America; School of Computer Science and Engineering, The Hebrew University, Jerusalem, Israel; Department of Molecular Genetics and Biotechnology, The Hebrew University, Jerusalem, Israel; Department of Biological Chemistry and Molecular Pharmacology, Harvard University, Boston, Massachusetts, United States of America","CLL, SB, SLS, and OJR conceived and designed the experiments. CLL and MK performed the experiments. CLL, TK, NF, and OJR analyzed the data. NF and OJR wrote the paper.","The authors have declared that no competing interests exist."
"10.1371/journal.pgen.1003231","plos genetics","2013-01-24T00:00:00Z","Congxing Lin; Yan Yin; Sheila M Bell; G Michael Veith; Hong Chen; Sung-Ho Huh; David M Ornitz; Liang Ma","Division of Dermatology, Department of Medicine, Washington University School of Medicine, St. Louis, Missouri, United States of America; Perinatal Institute of Cincinnati Children's Hospital Medical Center, Division of Neonatology-and Pulmonary Biology, University of Cincinnati College of Medicine, Cincinnati, Ohio, United States of America; Department of Developmental Biology, Washington University School of Medicine, St. Louis, Missouri, United States of America","Conceived and designed the experiments: CL LM. Performed the experiments: CL YY SMB GMV HC S-HH. Analyzed the data: CL YY SMB LM. Contributed reagents/materials/analysis tools: SMB S-HH DMO. Wrote the paper: CL YY SMB DMO LM.","The authors have declared that no competing interests exist."
"10.1371/journal.pbio.0030324","plos biology","2005-09-06T00:00:00Z","Haitao Yang; Weiqing Xie; Xiaoyu Xue; Kailin Yang; Jing Ma; Wenxue Liang; Qi Zhao; Zhe Zhou; Duanqing Pei; John Ziebuhr; Rolf Hilgenfeld; Kwok Yung Yuen; Luet Wong; Guangxia Gao; Saijuan Chen; Zhu Chen; Dawei Ma; Mark Bartlam; Zihe Rao","Tsinghua-IBP Joint Research Group for Structural Biology, Tsinghua University, Beijing, China; National Laboratory of Biomacromolecules, Institute of Biophysics, Chinese Academy of Sciences, Beijing, China; State Key Laboratory of Bioorganic and Natural Products Chemistry, Shanghai Institute of Organic Chemistry, Chinese Academy of Sciences, Shanghai, China; Shanghai Institute of Hematology, Rui-Jin Hospital affiliated to Shanghai Second Medical University, Shanghai, China; Guangzhou Institute of Biomedicine and Health, Chinese Academy of Sciences, Guangzhou, China; Institute of Virology and Immunology, University of Würzburg, Würzburg, Germany; Institute for Biochemistry, University of Lübeck, Lübeck, Germany; Department of Microbiology, University of Hong Kong, Hong Kong, China; Department of Chemistry, Inorganic Chemistry Laboratory, University of Oxford, Oxford, United Kingdom","HY, DM, and ZR conceived and designed the experiments. HY, WX, XX, KY, JM, WL, QZ, ZZ, JZ, KYY, GG, DM, and MB performed the experiments. HY, XX, KY, QZ, ZZ, LW, DM, and MB analyzed the data. WX, DP, JZ, RH, KYY, GG, SC, ZC, and DM contributed reagents/materials/analysis tools. HY, MB, and ZR wrote the paper.","The authors have declared that no competing interests exist."
"10.1371/journal.pgen.1003230","plos genetics","2013-01-31T00:00:00Z","Yan Li; Divya Padmanabha; Luciana B Gentile; Catherine I Dumur; Robert B Beckstead; Keith D Baker","Department of Biochemistry and Molecular Biology and the Massey Cancer Center, Virginia Commonwealth University School of Medicine, Richmond, Virginia, United States of America; Department of Pathology, Virginia Commonwealth University School of Medicine, Richmond, Virginia, United States of America; Department of Poultry Science, University of Georgia, Athens, Georgia, United States of America","Conceived and designed the experiments: KDB. Performed the experiments: YL DP LBG RBB KDB. Analyzed the data: YL DP CID. Contributed reagents/materials/analysis tools: YL CID. Wrote the paper: YL KDB.","The authors have declared that no competing interests exist."
"10.1371/journal.pbio.0030319","plos biology","2005-08-09T00:00:00Z","Jeffrey S Dukes; Nona R Chiariello; Elsa E Cleland; Lisa A Moore; M Rebecca Shaw; Susan Thayer; Todd Tobeck; Harold A Mooney; Christopher B Field","Department of Global Ecology, Carnegie Institution of Washington, Stanford, California, United States of America; Department of Biological Sciences, Stanford University, Stanford, California, United States of America; Department of Plant Biology, Carnegie Institution of Washington, Stanford, California, United States of America","CBF, HAM, NRC, and MRS conceived and designed the experiments. JSD analyzed the data and wrote the paper. JSD, NRC, EEC, LAM, MRS, ST, TT, and CBF contributed substantially to the maintenance of the experiment and the collection, organization, and verification of data relevant to this paper.","The authors have declared that no competing interests exist."
"10.1371/journal.pgen.1004362","plos genetics","2014-05-15T00:00:00Z","Josephine A Reinhardt; Cara L Brand; Kimberly A Paczolt; Philip M Johns; Richard H Baker; Gerald S Wilkinson","Department of Biology, University of Maryland, College Park, Maryland, United States of America; Department of Biology, University of Rochester, Rochester, New York, United States of America; Bard College, Annadale-on-Hudson, New York, United States of America; Sackler Institute for Comparative Genomics, American Museum of Natural History, New York, New York, United States of America","Conceived and designed the experiments: GSW JAR RHB. Performed the experiments: CLB PMJ JAR KAP. Analyzed the data: JAR RHB GSW. Contributed reagents/materials/analysis tools: KAP PMJ RHB. Wrote the paper: JAR GSW.","The authors have declared that no competing interests exist."
"10.1371/journal.pbio.0060251","plos biology","2008-10-21T00:00:00Z","Josefa González; Kapa Lenkov; Mikhail Lipatov; J Michael Macpherson; Dmitri A Petrov","Department of Biology, Stanford University, Stanford, California, United States of America","JG, KL, and DAP conceived and designed the experiments. JG and KL performed the experiments. JG, KL, ML, JMM, and DAP analyzed the data. JMM contributed reagents/materials/analysis tools. JG and DAP wrote the paper.","The authors have declared that no competing interests exist."
"10.1371/journal.pgen.1004310","plos genetics","2014-05-08T00:00:00Z","Mark Itsko; Roel M Schaaper","Laboratory of Molecular Genetics, National Institute of Environmental Health Sciences, Research Triangle Park, North Carolina, United States of America","Conceived and designed the experiments: MI RMS. Performed the experiments: MI. Analyzed the data: MI RMS. Wrote the paper: MI RMS.","The authors have declared that no competing interests exist."
"10.1371/journal.pgen.1004292","plos genetics","2014-04-24T00:00:00Z","Yun C Chang; Ami Khanal Lamichhane; H Martin Garraffo; Peter J Walter; Maarten Leerkes; Kyung J Kwon-Chung","Molecular Microbiology Section, Laboratory of Clinical Infectious Diseases, NIAID, NIH Bethesda, Maryland, United States of America; Clinical Mass Spectrometry Core, NIDDK, NIH, Bethesda, Maryland, United States of America; Bioinformatics and Computational Biosciences Branch, NIAID, NIH, Bethesda, Maryland, United States of America","Conceived and designed the experiments: YCC. Performed the experiments: YCC AKL HMG. Analyzed the data: YCC ML. Contributed reagents/materials/analysis tools: PJW KJKC. Wrote the paper: YCC KJKC.","The authors have declared that no competing interests exist."
"10.1371/journal.pgen.1004309","plos genetics","2014-05-15T00:00:00Z","Amine Bouafia; Sébastien Corre; David Gilot; Nicolas Mouchet; Sharon Prince; Marie-Dominique Galibert","CNRS-UMR6290 Genetic and Development Institute of Rennes, GEO Team, Rennes, France; Université de Rennes 1, UEB, SFR Biosit, Rennes, France; University of Cape Town, Department of Human Biology, Faculty of Health Sciences, Cape Town, South Africa; CHU Rennes, Service de génétique moléculaire et génomique, Rennes, France","Conceived and designed the experiments: MDG SC AB. Performed the experiments: AB SC DG NM. Analyzed the data: MDG SC AB SP DG. Contributed reagents/materials/analysis tools: DG NM SP. Wrote the paper: MDG SP AB.","The authors have declared that no competing interests exist."
