"id","journal","publication_date","author","author_affiliate","author_notes","competing_interest"
"10.1371/journal.pone.0018604","plos one","2011-04-20T00:00:00Z","Michal M Poplawski; Jason W Mastaitis; Fumiko Isoda; Fabrizio Grosjean; Feng Zheng; Charles V Mobbs","Fishberg Center for Neurobiology, Mount Sinai School of Medicine, New York, New York, United States of America; Department of Internal Medicine, Yale University School of Medicine, New Haven, Connecticut, United States of America; Department of Geriatrics and Palliative Medicine, Mount Sinai School of Medicine, New York, New York, United States of America","Conceived and designed the experiments: CVM MMP. Performed the experiments: MMP JWM FI. Analyzed the data: MMP JWM FI FG FZ CVM. Contributed reagents/materials/analysis tools: FG FZ. Wrote the paper: CVM MMP.","The authors have declared that no competing interests exist."
"10.1371/journal.pone.0087445","plos one","2014-01-29T00:00:00Z","Maaike J de Boer; Hannemike E Steinhagen; Gerbrig J Versteegen; Michel M R F Struys; Robbert Sanderman","Pain Center, Department of Anesthesiology, University of Groningen, University Medical Center Groningen, Groningen, The Netherlands; Health Psychology Section, Department of Health Sciences, University of Groningen, University Medical Center Groningen, Groningen, The Netherlands","Conceived and designed the experiments: MJB HS. Performed the experiments: MJB HS. Analyzed the data: MJB HS RS. Contributed reagents/materials/analysis tools: MJB HS GJV. Wrote the paper: MJB HS GJV RS MMRFS.","The authors have declared that no competing interests exist."
"10.1371/journal.pone.0007230","plos one","2009-09-30T00:00:00Z","Lluís Armengol; Sergi Villatoro; Juan R González; Lorena Pantano; Manel García-Aragonés; Raquel Rabionet; Mario Cáceres; Xavier Estivill","Genetic Causes of Disease Group, Genes and Disease Program, Center for Genomic Regulation (CRG-UPF) and CIBERESP, Barcelona, Catalonia, Spain; Quantitative Genomic Medicine Laboratories (qGenomics), Barcelona, Catalonia, Spain; Center for Research in Environmental Epidemiology (CREAL), Barcelona, Catalonia, Spain; Genetics Unit, Department of Health and Experimental Life Sciences, Pompeu Fabra University (UPF), Barcelona, Catalonia, Spain; National Genotyping Center (CeGen) Barcelona Genotyping Node, Center for Genomic Regulation (CRG-UPF), Barcelona, Catalonia, Spain","Conceived and designed the experiments: LA MC XE. Performed the experiments: LA SV MGA MC. Analyzed the data: LA SV JRG MC. Contributed reagents/materials/analysis tools: LA LP MC. Wrote the paper: LA JRG RR MC XE.","The authors have declared that no competing interests exist."
"10.1371/journal.pone.0110275","plos one","2014-10-15T00:00:00Z","Bing Qi; Qingshan Ji; Yuechun Wen; Lian Liu; Xiaoling Guo; Guanghui Hou; Guifang Wang; Jingxiang Zhong","Department of Ophthalmology, the First Affiliated Hospital of Jinan University, Guangzhou, Guangdong, China; Department of Ophthalmology, Affiliated Anhui Provincial Hospital of Anhui Medical University, Hefei, Anhui, China; Department of Cell Biology, the Cell Biology Institute of Jinan University, Guangzhou, Guangdong, China; Department of Ophthalmology, the Third Affiliated Hospital of Jinan University, Zhuhai, Guangdong, China","Conceived and designed the experiments: QJ JZ. Performed the experiments: BQ QJ LL. Analyzed the data: XG GH. Contributed reagents/materials/analysis tools: BQ QJ GW. Wrote the paper: BQ QJ YW.","The authors have declared that no competing interests exist."
"10.1371/journal.pone.0076016","plos one","2013-09-27T00:00:00Z","Jin Yan; Michael Lamar Seibenhener; Luis Calderilla-Barbosa; Maria-Theresa Diaz-Meco; Jorge Moscat; Jianxiong Jiang; Marie W Wooten; Michael C Wooten","Department of Biological Sciences, Cellular and Molecular Biosciences Program, Auburn University, Auburn, Alabama, United States of America; Sanford-Burnham Medical Research Institute, La Jolla, California, United States of America; Department of Pharmacology, Emory University School of Medicine, Atlanta, Georgia, United States of America","Conceived and designed the experiments: JY MLS LCB MWW MCW. Performed the experiments: JY MLS JJ. Analyzed the data: JY MLS. Contributed reagents/materials/analysis tools: MTDM JM. Wrote the paper: JY MLS MCW.","The authors have declared that no competing interests exist."
"10.1371/journal.pone.0098805","plos one","2014-06-02T00:00:00Z","Wei-Lan Yeh; Hui-Yi Lin; Hung-Ming Wu; Dar-Ren Chen","Department of Cell and Tissue Engineering, Changhua Christian Hospital, Changhua, Taiwan; School of Pharmacy, China Medical University, Taichung, Taiwan; Department of Neurology, Changhua Christian Hospital, Changhua, Taiwan; Comprehensive Breast Cancer Center, Changhua Christian Hospital, Changhua, Taiwan","Conceived and designed the experiments: WLY DRC. Performed the experiments: WLY HYL. Analyzed the data: WLY HMW. Contributed to the writing of the manuscript: WLY DRC.","The authors have declared that no competing interests exist."
"10.1371/journal.pone.0018595","plos one","2011-04-29T00:00:00Z","Dale J Hedges; Toumy Guettouche; Shan Yang; Guney Bademci; Ashley Diaz; Ashley Andersen; William F Hulme; Sara Linker; Arpit Mehta; Yvonne J K Edwards; Gary W Beecham; Eden R Martin; Margaret A Pericak-Vance; Stephan Zuchner; Jeffery M Vance; John R Gilbert","John T. MacDonald Department of Human Genetics, Hussman Institute for Human Genomics, University of Miami Miller School of Medicine, Miami, Florida, United States of America; Life Technologies, Inc., Carlsbad, California, United States of America","Conceived and designed the experiments: DH JG. Performed the experiments: TG AA AD BH GB WFH. Analyzed the data: DH AM IE GWB EM SZ SL YJKE. Contributed reagents/materials/analysis tools: JV SY MP-V. Wrote the paper: DH.","A portion of the reagents used in this study was provided free of charge by the participating vendors, including Roche-Nimblegen, Raindance, Agilent, and Applied Biosystems. This does not alter the authors' adherence to all the PLoS ONE policies on sharing data and materials."
"10.1371/journal.pone.0110266","plos one","2014-10-17T00:00:00Z","Fhernanda R Smiderle; Cristiane H Baggio; Débora G Borato; Arquimedes P Santana-Filho; Guilherme L Sassaki; Marcello Iacomini; Leo J L D Van Griensven","Department of Biochemistry and Molecular Biology, Federal University of Parana, Curitiba, Parana, Brazil; Department of Pharmacology, Federal University of Parana, Curitiba, Parana, Brazil; Plant Research International, Wageningen University and Research Centre, Wageningen, The Netherlands","Conceived and designed the experiments: FRS CHB DGB APSF GLS MI LVG. Performed the experiments: FRS CHB DGB APSF. Analyzed the data: FRS CHB DGB APSF GLS MI LVG. Contributed reagents/materials/analysis tools: FRS CHB DGB APSF GLS MI LVG. Contributed to the writing of the manuscript: FRS CHB DGB APSF GLS MI LVG.","The authors have read the journal's policy and the authors of this manuscript have the following competing interests: LVG is a retired professor who owns a small non-profit company that provides for reagents and for rent of laboratory and office space. LVG is not involved in any commercial consulting or production related activities concerning Cordyceps sp. The authors confirm that this does not alter their adherence to all PLOS ONE policies on sharing data and materials. There are no restrictions on sharing of data and/or materials."
"10.1371/journal.pone.0121786","plos one","2015-04-07T00:00:00Z","Sarah J Tarr; Andrew R Osborne","Institute of Structural and Molecular Biology, Division of Biosciences, Birkbeck and University College London, London, United Kingdom","Conceived and designed the experiments: ST AO. Performed the experiments: ST AO. Analyzed the data: ST AO. Contributed reagents/materials/analysis tools: ST AO. Wrote the paper: ST AO.","The authors have declared that no competing interests exist."
"10.1371/journal.pone.0053063","plos one","2013-01-02T00:00:00Z","Robert Gütig; Tim Gollisch; Haim Sompolinsky; Markus Meister","Max Planck Institute of Experimental Medicine, Göttingen, Germany; Racah Institute of Physics and Interdisciplinary Center for Neural Computation, Hebrew University, Jerusalem, Israel; University Medical Center Göttingen, Department of Ophthalmology, Göttingen, Germany; Center for Brain Science, Harvard University, Cambridge, Massachusetts, United States of America; Department of Molecular and Cellular Biology, Harvard University, Cambridge, Massachusetts, United States of America","Conceived and designed the experiments: RG TG HS MM. Performed the experiments: RG TG. Analyzed the data: RG TG. Wrote the paper: RG TG HS MM.","The authors have declared that no competing interests exist."
"10.1371/journal.pone.0007223","plos one","2009-09-29T00:00:00Z","Veiko Krauss; Carina Eisenhardt; Tina Unger","Department of Genetics, Institute of Biology II, University of Leipzig, Leipzig, Germany","Conceived and designed the experiments: VK. Performed the experiments: CE TU. Analyzed the data: VK CE TU. Contributed reagents/materials/analysis tools: VK. Wrote the paper: VK.","The authors have declared that no competing interests exist."
"10.1371/journal.pone.0030051","plos one","2012-01-20T00:00:00Z","Yvonne Lange; Jin Ye; Theodore L Steck","Department of Pathology, Rush University Medical Center, Chicago, Illinois, United States of America; Department of Biochemistry and Molecular Biology, University of Chicago, Chicago, Illinois, United States of America","Conceived and designed the experiments: YL TLS. Performed the experiments: YL JY. Analyzed the data: YL JY TLS. Contributed reagents/materials/analysis tools: YL JY. Wrote the paper: YL TLS.","The authors have declared that no competing interests exist."
"10.1371/journal.pone.0087428","plos one","2014-02-18T00:00:00Z","Dawn M Roje","Department of Ichthyology, American Museum of Natural History, New York, New York, United States of America","Conceived and designed the experiments: DR. Performed the experiments: DR. Analyzed the data: DR. Contributed reagents/materials/analysis tools: DR. Wrote the paper: DR. Sole contributor of all work from inception to submission: DR.","This author has declared that no competing interests exist."
"10.1371/journal.pone.0041506","none","2012-07-31T00:00:00Z","Junli Zhao; Hua He; Kechun Zhou; Yonggang Ren; Zixiao Shi; Zhiyuan Wu; Yizheng Wang; Yicheng Lu; Jianwei Jiao","Institute of Zoology, State Key Laboratory of Reproductive Biology, Chinese Academy of Sciences, Beijing, China; Institute of Neuroscience, Chinese Academy of Sciences, Shanghai, China; Department of Neurosurgery, Changzheng Hospital, Second Military Medical University, Shanghai, China; Ruijin Hospital, Shanghai, China","Conceived and designed the experiments: YW YL JJ. Performed the experiments: JZ HH KZ YR ZS ZW. Analyzed the data: JZ HH KZ YR ZS ZW. Contributed reagents/materials/analysis tools: JZ HH JJ. Wrote the paper: JZ HH JJ.","The authors have declared that no competing interests exist."
"10.1371/journal.pone.0076014","plos one","2013-10-04T00:00:00Z","Bruno Pagano; Abdullah Jama; Pierre Martinez; Ester Akanho; Tam T T Bui; Alex F Drake; Franca Fraternali; Penka V Nikolova","King’s College London, School of Biomedical Sciences, Department of Biochemistry & Randall Division of Cell and Molecular Biophysics, New Hunt’s House, London, United Kingdom; Department of Pharmacy, University of Naples “Federico II”, Napoli, Italy; Institute for Pharmaceutical Science, London, United Kingdom","Conceived and designed the experiments: PN FF BP. Performed the experiments: AJ EA TB PM BP. Analyzed the data: PN BP FF AD TB. Wrote the manuscript: PN FF BP.","Dr. Franca Fraternali is a PLOS ONE editorial Board member. This does not alter our adherence to all the PLOS ONE policies on sharing data and materials."
"10.1371/journal.pone.0121793","plos one","2015-04-15T00:00:00Z","Jutta Wanner; Darlene Romashko; Douglas S Werner; Earl W May; Yue Peng; Ryan Schulz; Kenneth W Foreman; Suzanne Russo; Lee D Arnold; Maneesh Pingle; Donald E Bergstrom; Francis Barany; Stuart Thomson","Coferon Inc, 25 Health Sciences Drive, Stony Brook, New York, United States of America; Purdue University, West Lafayette, Indiana, United States of America; Department of Microbiology, Weill Cornell Medical College, New York, New York, United States of America","Conceived and designed the experiments: JW KWF DSW LDA EWM ST MP. Performed the experiments: DR DSW YP RS SR. Analyzed the data: JW DSW DR YP RS SR EWM ST. Wrote the paper: JW EWM KWF MP ST. Platform development work: LDA MP DEB FB.","JW, DR, DSW, EWM, YP, RS, KWF, SR, MP, ST and LDA are affiliated to Coferon Inc at the time of the study. LDA is now affiliated with Assembly Biosciences, Inc. MP, FB and DEB are founders and shareholders of Coferon, Inc. JW, KWF, DSW and LDA are authors on a patent application submitted by Coferon Inc, covering the molecules described in this manuscript. This does not alter the authors' adherence to all the PLOS ONE policies on sharing data and materials, as detailed online in the guide for authors."
"10.1371/journal.pone.0098811","plos one","2014-06-02T00:00:00Z","Stephanie J Yaung; Kevin M Esvelt; George M Church","Wyss Institute for Biologically Inspired Engineering, Harvard Medical School, Boston, Massachusetts, United States of America; Department of Genetics, Harvard Medical School, Boston, Massachusetts, United States of America; Program in Medical Engineering & Medical Physics, Harvard-MIT Division of Health Sciences and Technology, Massachusetts Institute of Technology, Cambridge, Massachusetts, United States of America","Conceived and designed the experiments: SJY KME. Performed the experiments: SJY. Analyzed the data: SJY KME GMC. Contributed to the writing of the manuscript: SJY KME GMC.","The authors declare that no competing interests exist."
"10.1371/journal.pone.0041515","plos one","2012-07-26T00:00:00Z","Shahid Siddique; Miroslaw Sobczak; Raimund Tenhaken; Florian M W Grundler; Holger Bohlmann","Division of Plant Protection, Department of Crop Sciences, University of Natural Resources and Life Sciences, Vienna, Austria; Department of Botany, Warsaw University of Life Sciences (SGGW), Warsaw, Poland; Division of Plant Physiology, University of Salzburg, Salzburg, Austria","Conceived and designed the experiments: HB SS. Performed the experiments: SS MS RT. Analyzed the data: HB SS MS RT FMWG. Contributed reagents/materials/analysis tools: HB MS RT. Wrote the paper: HB FMWG.","The authors have declared that no competing interests exist."
"10.1371/journal.pone.0030056","plos one","2012-01-11T00:00:00Z","Xiangdong Chen; Wangzhen Guo; Bingliang Liu; Yuanming Zhang; Xianliang Song; Yu Cheng; Lili Zhang; Tianzhen Zhang","National Key Laboratory of Crop Genetics and Germplasm Enhancement, Cotton Research Institute, Nanjing Agricultural University, Nanjing, China","Conceived and designed the experiments: TZZ. Performed the experiments: XDC WZG. Analyzed the data: XDC BLL YC LLZ. Contributed reagents/materials/analysis tools: YMZ XLS. Wrote the paper: XDC TZZ.","The authors have declared that no competing interests exist."
"10.1371/journal.pone.0018599","plos one","2011-04-11T00:00:00Z","Tina Skjørringe; Zeynep Tümer; Lisbeth Birk Møller","Department of Applied Functional Human Genetics, The Kennedy Center, Glostrup, Denmark","Performed the in silico studies and analysed the results: TS. Furthermore drafted the manuscript together with LBM: TS. Performed the in vivo experiments and together with ZT performed identification of the novel mutations: LBM. Read and approved the manuscript: TS ZT LBM.","The authors have declared that no competing interests exist."
"10.1371/journal.pone.0087437","plos one","2014-02-18T00:00:00Z","Xiaomei Zhu; Xiaopeng Deng; Guangying Huang; Jing Wang; Jingwen Yang; Si Chen; Xu Ma; Binbin Wang","Graduate School of Peking Union Medical College, Beijing, China; National Research Institute for Family Planning, Beijing, China; Department of Obstetrics and Gynecology, Shengjing Hospital of China Medical University, Shenyang, China; World Health Organization Collaborating Centre for Research in Human Reproduction, Beijing, China; Children's Hospital of Fudan University, Shanghai, China; Department of Medical Genetics, School of Basic Medical Sciences, Capital Medical University, Beijing, China","Conceived and designed the experiments: XM BW XZ. Performed the experiments: XZ. Analyzed the data: XZ JW. Contributed reagents/materials/analysis tools: XD GH JY SC. Wrote the paper: XZ.","The authors have declared that no competing interests exist."
"10.1371/journal.pone.0145088","plos one","2015-12-28T00:00:00Z","Élise Fortin; Robert W Platt; Patricia S Fontela; David L Buckeridge; Caroline Quach","Department of Epidemiology, Biostatistics and Occupational Health, McGill University, Montréal, Québec, Canada; Direction des risques biologiques et de la santé au travail, Institut national de santé publique du Québec, Québec and Montréal, Québec, Canada; Department of Pediatrics, The Montréal Children's Hospital, McGill University, Montréal, Québec, Canada","Conceived and designed the experiments: EF RWP DLB CQ. Performed the experiments: EF CQ. Analyzed the data: EF. Wrote the paper: EF RWP PSF DLB CQ.","The authors have declared that no competing interests exist."
"10.1371/journal.pone.0121791","plos one","2015-04-17T00:00:00Z","Ray F Lee","Princeton Neuroscience Institute, Princeton University, Princeton, New Jersey, United States of America","Conceived and designed the experiments: RL. Performed the experiments: RL. Analyzed the data: RL. Contributed reagents/materials/analysis tools: RL. Wrote the paper: RL. Derived concepts and theory: RL.","The author has declared that no competing interests exist."
"10.1371/journal.pone.0098809","plos one","2014-06-03T00:00:00Z","Gursimran Chandhok; Nadine Schmitt; Vanessa Sauer; Annu Aggarwal; Mohit Bhatt; Hartmut H J Schmidt","Clinic for Transplantation Medicine, Münster University Hospital, Münster, Germany; Wilson Disease Clinic, Kokilaben Dhirubhai Ambani Hospital and Medical Research Institute, Mumbai, India","Conceived and designed the experiments: GC NS VS AA MB HHJS. Performed the experiments: GC NS VS. Analyzed the data: GC NS VS. Contributed reagents/materials/analysis tools: GC NS VS. Wrote the paper: GC HHJS.","The authors have declared that no competing interests exist."
"10.1371/journal.pone.0133531","plos one","2015-07-21T00:00:00Z","Mona Tafreshi; Nicolas Zwickel; Rebecca Jane Gorrell; Terry Kwok","Department of Biochemistry and Molecular Biology, Monash University, Clayton, Victoria, Australia; Department of Microbiology, Monash University, Clayton, Victoria, Australia","Conceived and designed the experiments: RJG TK. Performed the experiments: MT NZ RJG. Analyzed the data: MT NZ RJG TK. Wrote the paper: RJG TK.","The authors have declared that no competing interests exist."
"10.1371/journal.pone.0133530","plos one","2015-07-24T00:00:00Z","Juan-Juan Sun; Yong Wu; Yong-Ming Lu; Hui-Zhi Zhang; Tao Wang; Xiao-Qun Yang; Meng-Hong Sun; Chao-Fu Wang","Department of Pathology, Fudan University Shanghai Cancer Center, Shanghai, China; Department of Oncology, Shanghai Medical College, Fudan University, Shanghai, China; Institute of Pathology, Fudan University, Shanghai, China","Conceived and designed the experiments: CFW. Performed the experiments: JJS HZZ. Analyzed the data: YW JJS HZZ. Contributed reagents/materials/analysis tools: YML MHS. Wrote the paper: YW. Participated in reading sections and provided important proposals: XQY. Collected materials and participated in some experiments: TW.","The authors have declared that no competing interests exist."
"10.1371/journal.pone.0041516","none","2012-07-27T00:00:00Z","Stefania Zampieri; Silvia Cattarossi; Ana Maria Oller Ramirez; Camillo Rosano; Charles Marques Lourenco; Nadia Passon; Isabella Moroni; Graziella Uziel; Antonella Pettinari; Franco Stanzial; Raquel Dodelson de Kremer; Nydia Beatriz Azar; Filiz Hazan; Mirella Filocamo; Bruno Bembi; Andrea Dardis","Regional Coordinator Center for Rare Diseases, University Hospital Santa Maria della Misericordia, Udine, Italy; Centro de Estudio de las Metabolopatias Congénitas, CEMECO, University of Córdoba, Córdoba, Argentine; Patologia Molecolare Integrata – A.O.U. IRCSS San Martino – IST, Istituto Nazionale per la Ricerca sul Cancro, Genova, Italy; Medical Genetics Service, Clinics Hospital of Ribeirao Preto, University of Sao Paulo, Sao Paulo, Brazil; Dipartimento di Scienze Mediche e Biologiche, Università di Udine, Udine, Italy; Department of Child Neurology, Fondazione Istituto Neurologico Besta, Milan, Italy; Laboratorio di Genetica Medica, Clinica Pediatrica, Ospedali Riuniti Ancona, Ancona, Italy; Servizio di Consulenza Genetica, Centro Provinciale di Coordinamento della Rete delle Malattie Rare, Azienda Sanitaria dell’Alto-Adige, Bolzano, Italy; Medical Faculty, Genetic Department, Izmir, Turkey; U.O.S.D. Laboratorio Diagnosi Pre-Postnatale Malattie Metaboliche, Istituto G. Gaslini, Genova, Italy","Conceived and designed the experiments: AD SZ. Performed the experiments: SZ SC AMOR NBA CML. Analyzed the data: AD MF IM GU BB. Contributed reagents/materials/analysis tools: NP AP FS RDK FH. Wrote the paper: AD BB MF. Performed the 3D structural analysis: CR.","The authors have declared that no competing interests exist."
"10.1371/journal.pone.0007227","plos one","2009-10-06T00:00:00Z","Kim A Caldwell; Michelle L Tucci; Jafa Armagost; Tyler W Hodges; Jue Chen; Shermeen B Memon; Jeana E Blalock; Susan M DeLeon; Robert H Findlay; Qingmin Ruan; Philip J Webber; David G Standaert; Julie B Olson; Guy A Caldwell","Department of Biological Sciences, The University of Alabama, Tuscaloosa, Alabama, United States of America; Department of Neurology, Center for Neurodegeneration and Experimental Therapeutics, University of Alabama at Birmingham, Birmingham, Alabama, United States of America; Department of Neurobiology, University of Alabama at Birmingham, Birmingham, Alabama, United States of America","Conceived and designed the experiments: KAC MLT JA TWH JC RHF QR DGS JBO GAC. Performed the experiments: KAC MLT JA TWH JC SBM JEB SMD QR PJW JBO. Analyzed the data: KAC MLT JA TWH JC RHF QR PJW DGS JBO GAC. Contributed reagents/materials/analysis tools: MLT JA TWH JC QR JBO. Wrote the paper: KAC TWH RHF DGS JBO GAC.","The authors have declared that no competing interests exist."
"10.1371/journal.pone.0145089","plos one","2015-12-16T00:00:00Z","Ronan G Shaughnessy; Damien Farrell; Karel Riepema; Douwe Bakker; Stephen V Gordon","UCD School of Veterinary Medicine, University College Dublin, Dublin 4, Ireland; Department of Bacteriology and TSEs, Central Veterinary Institute of Wageningen University, Edelhertweg 15, 8200 AB Lelystad, The Netherlands; Buitenplaats 116, 8212 AM Lelystad, The Netherlands; UCD School of Medicine, University College Dublin, Dublin 4, Ireland; UCD School of Biomolecular and Biomedical Science, University College Dublin, Dublin 4, Ireland; UCD Conway Institute of Biomolecular and Biomedical Science, University College Dublin, Dublin 4, Ireland","Conceived and designed the experiments: SVG RGS DB. Performed the experiments: RGS KR. Analyzed the data: DF RGS DB SVG. Contributed reagents/materials/analysis tools: RGS DF KR DB. Wrote the paper: RGS DF DB SVG.","The authors have declared that no competing interests exist."
"10.1371/journal.pone.0098810","plos one","2014-06-02T00:00:00Z","David P Sargeant; Sandeep Deverasetty; Christy L Strong; Izua J Alaniz; Alexandria Bartlett; Nicholas R Brandon; Steven B Brooks; Frederick A Brown; Flaviona Bufi; Monika Chakarova; Roxanne P David; Karlyn M Dobritch; Horacio P Guerra; Michael W Hedden; Rma Kumra; Kelvy S Levitt; Kiran R Mathew; Ray Matti; Dorothea Q Maza; Sabyasachy Mistry; Nemanja Novakovic; Austin Pomerantz; Josue Portillo; Timothy F Rafalski; Viraj R Rathnayake; Noura Rezapour; Sarah Songao; Sean L Tuggle; Sandy Yousif; David I Dorsky; Martin R Schiller","School of Life Sciences, University of Nevada Las Vegas, Las Vegas, Nevada, United States of America; Department of Medicine, University of Connecticut Health Center, Farmington, Connecticut, United States of America","Conceived and designed the experiments: MRS CLS DPS SD DID. Performed the experiments: SD DPS. Analyzed the data: MRS CLS DPS. Wrote the paper: MRS CLS DPS. Built the HIVToolbox database: IA AB NRB SBB FAB FB MC RPD KMD HPG KSL KRM RM DQM SM NN AP JP TFR VRR NR SS SLT SY CLS MRS. Generated the user guide: RK DPS MRS MWH. Generated video tutorials: MRS. Advised on different aspects of HIV virology: DID.","The authors have declared that no competing interests exist."
