"id","journal","publication_date","author","author_affiliate","author_notes","competing_interest"
"10.1371/journal.pbio.1000179","plos biology","2009-08-25T00:00:00Z","Richard Bailey; Karsten Schönrogge; James M Cook; George Melika; György Csóka; Csaba Thuróczy; Graham N Stone","Institute of Evolutionary Biology, School of Biology, University of Edinburgh, Edinburgh, United Kingdom; Department of Animal Ecology, Evolutionary Biology Centre, Uppsala University, Uppsala, Sweden; Centre for Ecology and Hydrology, CEH Wallingford, Wallingford, United Kingdom; Division of Biology, Imperial College London, Ascot, United Kingdom; Centre for Population Biology, Imperial College London, Silwood Park Campus, Ascot, United Kingdom; School of Biological Sciences, Whiteknights, University of Reading, Reading, United Kingdom; Systematic Parasitoid Laboratory, Vas County Plant Protection and Soil 15 Conservation Service, Köszeg, Hungary; Hungarian Forest Research Institute, Mátrafüred Research Station, Mátrafüred, Hungary; Malomarok, Köszeg, Hungary","The author(s) have made the following declarations about their contributions: Conceived and designed the experiments: KS JMC GNS. Performed the experiments: RB GM GC CT. Analyzed the data: RB KS JMC GNS. Wrote the paper: RB KS JMC GNS.","The authors have declared that no competing interests exist."
"10.1371/journal.pbio.1000178","plos biology","2009-08-25T00:00:00Z","Mary I O'Connor; Michael F Piehler; Dina M Leech; Andrea Anton; John F Bruno","Curriculum in Ecology, The University of North Carolina, Chapel Hill, Chapel Hill, North Carolina, United States of America; Department of Marine Sciences, The University of North Carolina, Chapel Hill, Chapel Hill, North Carolina, United States of America; Institute of Marine Sciences, Morehead City, North Carolina, United States of America","The author(s) have made the following declarations about their contributions: Conceived and designed the experiments: MIO MFP JFB. Performed the experiments: MIO MFP DML AA. Analyzed the data: MIO MFP. Contributed reagents/materials/analysis tools: MFP DML. Wrote the paper: MIO.","The authors have declared that no competing interests exist."
"10.1371/journal.pgen.1004366","plos genetics","2014-05-22T00:00:00Z","Daniel I Chasman; Verneri Anttila; Julie E Buring; Paul M Ridker; Markus Schürks; Tobias Kurth; on behalf of the International Headache Genetics Consortium","Division of Preventive Medicine, Brigham and Women's Hospital, Boston, Massachusetts, United States of America; Harvard Medical School, Boston, Massachusetts, United States of America; Analytical and Translational Genetics Unit, Department of Medicine, Massachusetts General Hospital, Boston, Massachusetts, United States of America; Program in Medical and Population Genetics, Broad Institute of MIT and Harvard, Cambridge, Massachusetts, United States of America; Institute for Molecular Medicine Finland (FIMM), University of Helsinki, Helsinki, Finland; Department of Neurology, University Hospital Essen, Essen, Germany; Inserm Research Center for Epidemiology and Biostatistics (U897) - Team Neuroepidemiology, Bordeaux, France; University of Bordeaux, College of Health Sciences, Bordeaux, France","Conceived and designed the experiments: DIC. Performed the experiments: DIC VA. Analyzed the data: DIC VA. Contributed reagents/materials/analysis tools: JEB PMR MS TK. Wrote the paper: DIC MS TK. Cohort assembly and collection of clinical and genetic data: DIC JEB PMR MS TK.","The authors have declared that no competing interests exist."
"10.1371/journal.pgen.1004365","plos genetics","2014-06-05T00:00:00Z","Sylvain Aubry; Steven Kelly; Britta M C Kümpers; Richard D Smith-Unna; Julian M Hibberd","Department of Plant Sciences, University of Cambridge, Cambridge, United Kingdom; Department of Plant Sciences, University of Oxford, Oxford, United Kingdom","Conceived and designed the experiments: SA SK BMCK RDSU JMH. Performed the experiments: SA SK BMCK RDSU. Analyzed the data: SA SK RDSU JMH. Contributed reagents/materials/analysis tools: SA SK BMCK RDSU. Wrote the paper: SA SK JMH.","The authors have declared that no competing interests exist."
"10.1371/journal.pgen.1004368","plos genetics","2014-06-19T00:00:00Z","Johanna Schott; Sonja Reitter; Janine Philipp; Katharina Haneke; Heiner Schäfer; Georg Stoecklin","Helmholtz Junior Research Group Posttranscriptional Control of Gene Expression, German Cancer Research Center (DKFZ), Heidelberg, Germany, and Zentrum für Molekulare Biologie der Universität Heidelberg (ZMBH), Germany, DKFZ-ZMBH Alliance, Heidelberg, Germany; Laboratory of Molecular Gastroenterology and Hepatology, Department of Internal Medicine 1, Universitätsklinikum Schleswig-Holstein Campus Kiel, Kiel, Germany","Conceived and designed the experiments: GS JS. Performed the experiments: JS JP SR KH. Analyzed the data: JS. Contributed reagents/materials/analysis tools: HS. Wrote the paper: JS GS.","The authors have declared that no competing interests exist."
"10.1371/journal.pbio.1000177","plos biology","2009-08-25T00:00:00Z","Samantha P Tull; Clara M Yates; Benjamin H Maskrey; Valerie B O'Donnell; Jackie Madden; Robert F Grimble; Philip C Calder; Gerard B Nash; G Ed Rainger","Centre for Cardiovascular Sciences, School of Clinical and Experimental Medicine, The Medical School, The University of Birmingham, Birmingham, United Kingdom; Department of Medical Biochemistry and Immunology, School of Medicine, Cardiff University, Cardiff, United Kingdom; Institute of Human Nutrition, School of Medicine, University of Southampton, Southampton, United Kingdom","The author(s) have made the following declarations about their contributions: Conceived and designed the experiments: VBO RFG PCC GBN GER. Performed the experiments: SPT CMY BHM JM. Analyzed the data: SPT CMY BHM VBO JM GER. Contributed reagents/materials/analysis tools: VBO RFG PCC GBN. Wrote the paper: GER.","The authors have declared that no competing interests exist."
"10.1371/journal.pbio.1000176","plos biology","2009-08-18T00:00:00Z","Karine Loulier; Justin D Lathia; Veronique Marthiens; Jenne Relucio; Mohamed R Mughal; Sung-Chun Tang; Turhan Coksaygan; Peter E Hall; Srinivasulu Chigurupati; Bruce Patton; Holly Colognato; Mahendra S Rao; Mark P Mattson; Tarik F Haydar; Charles ffrench-Constant","Center for Neuroscience, Children's National Medical Center, Washington, D.C., United States of America; Department of Pathology, University of Cambridge, Cambridge, United Kingdom; Department of Medical Genetics, University of Cambridge, Cambridge, United Kingdom; Centre for Brain Repair, University of Cambridge, Cambridge, United Kingdom; Laboratory of Neuroscience, National Institute on Aging Intramural Research Program, Baltimore, Maryland, United States of America; Department of Pharmacology, State University of New York at Stony Brook, Stony Brook, New York, United States of America; School of Medicine, University of Maryland, Baltimore, Maryland, United States of America; Center for Research on Occupational and Environmental Toxicology, Oregon Health and Science University, Portland, Oregon, United States of America; Corporate Research Laboratories, Invitrogen Corporation, Carlsbad, California, United States of America; Department of Neuroscience, Johns Hopkins University School of Medicine, Baltimore, Maryland, United States of America","The author(s) have made the following declarations about their contributions: Conceived and designed the experiments: KL JDL HC MSR MPM TFH CfC. Performed the experiments: KL JDL VM TFH. Analyzed the data: KL JDL VM TFH CfC. Contributed reagents/materials/analysis tools: JR MRM SCT TC PEH SC BP HC. Wrote the paper: KL JDL TFH CfC.","The authors have declared that no competing interests exist."
"10.1371/journal.pgen.1004367","plos genetics","2014-05-29T00:00:00Z","Manuela Zanda; Suna Onengut-Gumuscu; Neil Walker; Corina Shtir; Daniel Gallo; Chris Wallace; Deborah Smyth; John A Todd; Matthew E Hurles; Vincent Plagnol; Stephen S Rich","University College London (UCL) Genetics Institute (UGI), London, United Kingdom; Wellcome Trust Sanger Institute, Hinxton, United Kingdom; University of Virginia, Charlottesville, Virginia, United States of America; JDRF/Wellcome Trust Diabetes and Inflammation laboratory, Cambridge Institute for Medical Research, University of Cambridge, Cambridge, United Kingdom","Conceived and designed the experiments: VP SSR MEH JAT. Performed the experiments: SOG DG DS. Analyzed the data: MZ NW CS CW. Wrote the paper: VP MZ MEH SSR.","The authors have declared that no competing interests exist."
"10.1371/journal.pgen.1004369","plos genetics","2014-05-22T00:00:00Z","Gavin Hudson; Aurora Gomez-Duran; Ian J Wilson; Patrick F Chinnery","Wellcome Centre for Mitochondrial Research, Institute of Genetic Medicine, Newcastle University, Central Parkway, Newcastle upon Tyne, United Kingdom","Conceived and designed the experiments: PFC GH. Performed the experiments: GH IJW. Analyzed the data: GH IJW. Wrote the paper: PFC GH AGD.","The authors have declared that no competing interests exist."
"10.1371/journal.pgen.1004372","plos genetics","2014-05-29T00:00:00Z","Megan Ulmer Carnes; Yangfan P Liu; R Rand Allingham; Benjamin T Whigham; Shane Havens; Melanie E Garrett; Chunyan Qiao; NEIGHBORHOOD Consortium Investigators; Nicholas Katsanis; Janey L Wiggs; Louis R Pasquale; Allison Ashley-Koch; Edwin C Oh; Michael A Hauser","The Center for Human Genetics, Duke University, Durham, North Carolina, United States of America; The Center for Human Disease Modeling, Duke University Medical Center, Durham, North Carolina, United States of America; Department of Ophthalmology, Duke University Medical Center, Durham, North Carolina, United States of America; Department of Ophthalmology, Harvard Medical School, Boston, Massachusetts, United States of America; Beijing Tongren Hospital, Beijing Tongren Eye Center, Beijing Ophthalmology & Visual Sciences Key Laboratory, Capital Medical University, Beijing, China; Channing Division of Network Medicine, Brigham and Women's Hospital, Boston, Massachusetts, United States of America; Department of Medicine, Duke University Medical Center, Durham, North Carolina, United States of America; Department of Neurology, Duke University Medical Center, Durham, North Carolina, United States of America","Conceived and designed the experiments: MUC YPL RRA BTW AAK ECO MAH. Performed the experiments: MUC YPL BTW SH CQ. Analyzed the data: MUC YPL MEG ECO. Contributed reagents/materials/analysis tools: RRA NK JLW LRP ECO MAH. Wrote the paper: MUC MAH ECO.","The authors have declared that no competing interests exist."
"10.1371/journal.pgen.1004360","plos genetics","2014-05-29T00:00:00Z","Shaul Raviv; Kapil Bharti; Sigal Rencus-Lazar; Yamit Cohen-Tayar; Rachel Schyr; Naveh Evantal; Eran Meshorer; Alona Zilberberg; Maria Idelson; Benjamin Reubinoff; Rhonda Grebe; Rina Rosin-Arbesfeld; James Lauderdale; Gerard Lutty; Heinz Arnheiter; Ruth Ashery-Padan","Department of Human Molecular Genetics and Biochemistry, Sackler Faculty of Medicine, Tel Aviv University, Tel Aviv, Israel; Unit on Ocular and Stem Cell Translational Research, National Eye Institute, National Institutes of Health, Bethesda, Maryland, United States of America; Department of Genetics, The Institute of Life Sciences, The Hebrew University of Jerusalem, Jerusalem, Israel; Department of Clinical Microbiology and Immunology, Sackler School of Medicine, Tel Aviv University, Tel Aviv, Israel; The Hadassah Human Embryonic Stem Cell Research Center, The Goldyne Savad Institute of Gene Therapy & Department of Gynecology, Hadassah-Hebrew University Medical Center, Jerusalem, Israel; Wilmer Ophthalmological Institute, The Johns Hopkins University, School of Medicine, Baltimore, Maryland, United States of America; Department of Cellular Biology, The University of Georgia, Athens, Georgia, United States of America; Mammalian Development Section, National Institute of Neurological Disorders and Stroke, National Institute of Health, Bethesda, Maryland, United States of America","Conceived and designed the experiments: SR SRL RAP. Performed the experiments: SR KB SRL RG YCT RS NE EM. Analyzed the data: SR KB SRL RG RRA GL HA RAP. Contributed reagents/materials/analysis tools: JL AZ MI BR. Wrote the paper: SR SRL RAP.","The authors have declared that no competing interests exist."
"10.1371/journal.pbio.1000169","plos biology","2009-08-11T00:00:00Z","Phil G T Sanders; Silvia Muñoz-Descalzo; Tina Balayo; Frederik Wirtz-Peitz; Penelope Hayward; Alfonso Martinez Arias","Department of Genetics, University of Cambridge, Cambridge, United Kingdom","The author(s) have made the following declarations about their contributions: Conceived and designed the experiments: PGS SMD PH AMA. Performed the experiments: PGS SMD TB FWP PH AMA. Analyzed the data: PGS SMD TB FWP PH AMA. Contributed reagents/materials/analysis tools: PGS SMD TB FWP PH AMA. Wrote the paper: PGS SMD AMA.","The authors have declared that no competing interests exist."
"10.1371/journal.pbio.1000149","plos biology","2009-07-07T00:00:00Z","Tibor Kalmar; Chea Lim; Penelope Hayward; Silvia Muñoz-Descalzo; Jennifer Nichols; Jordi Garcia-Ojalvo; Alfonso Martinez Arias","Department of Genetics, University of Cambridge, Cambridge, United Kingdom; Wellcome Trust Centre for Stem Cell Research, University of Cambridge, Cambridge, United Kingdom; Departament de Fisica i Enginyeria Nuclear, Universitat Politecnica de Catalunya, Colom 11, Terrassa, Spain","The author(s) have made the following declarations about their contributions: Conceived and designed the experiments: TK CL PH AMA. Performed the experiments: TK CL PH SM-D JN. Analyzed the data: TK CL PH JN JG-O AMA. Contributed reagents/materials/analysis tools: TK. Wrote the paper: TK JG-O AMA. Developed the model: JG-O AMA.","The authors have declared that no competing interests exist."
"10.1371/journal.pgen.1004342","plos genetics","2014-05-15T00:00:00Z","Matthew D Rasmussen; Melissa J Hubisz; Ilan Gronau; Adam Siepel","Department of Biological Statistics and Computational Biology, Cornell University, Ithaca, New York, United States of America; European Molecular Biology Laboratory, European Bioinformatics Institute, Wellcome Trust Genome Campus, Hinxton, Cambs, United Kingdom","Conceived and designed the experiments: MDR MJH IG AS. Performed the experiments: MDR MJH IG. Analyzed the data: MDR MJH IG AS. Wrote the paper: MDR MJH IG AS. Designed and implemented the ARGweaver software: MDR.","The authors have declared that no competing interests exist."
"10.1371/journal.pgen.1004341","plos genetics","2014-05-01T00:00:00Z","Andrea Haag; Peter Gutierrez; Alessandra Bühler; Michael Walser; Qiutan Yang; Maeva Langouët; David Kradolfer; Erika Fröhli; Christina J Herrmann; Alex Hajnal; Juan M Escobar-Restrepo","University of Zurich, Institute of Molecular Life Sciences, Zurich, Switzerland; PhD program in Molecular Life Sciences, Uni ETH Zürich, Switzerland","Conceived and designed the experiments: AHaa PG AB MW QY DK AHaj JMER. Performed the experiments: AHaa PG AB MW QY ML DK EF JMER. Analyzed the data: AHaa PG AB MW QY AHaj JMER. Contributed reagents/materials/analysis tools: CJH. Wrote the paper: AHaa AHaj JMER.","The authors have declared that no competing interests exist."
"10.1371/journal.pgen.1004340","plos genetics","2014-05-01T00:00:00Z","Patrick Callier; Pierre Calvel; Armine Matevossian; Periklis Makrythanasis; Pascal Bernard; Hiroshi Kurosaka; Anne Vannier; Christel Thauvin-Robinet; Christelle Borel; Séverine Mazaud-Guittot; Antoine Rolland; Christèle Desdoits-Lethimonier; Michel Guipponi; Céline Zimmermann; Isabelle Stévant; Françoise Kuhne; Béatrice Conne; Federico Santoni; Sandy Lambert; Frederic Huet; Francine Mugneret; Jadwiga Jaruzelska; Laurence Faivre; Dagmar Wilhelm; Bernard Jégou; Paul A Trainor; Marilyn D Resh; Stylianos E Antonarakis; Serge Nef","Department of Genetic Medicine and Development, University of Geneva Medical School, Geneva, Switzerland; FHU-TRANSLAD, Département de Génétique, Hôpital Le Bocage, CHU, Dijon, France; EA 4271 GAD Génétique des Anomalies du Développement, Université de Bourgogne, Dijon, France; Cell Biology Program, Memorial Sloan-Kettering Cancer Center, New York, New York, United States of America; Gerstner Sloan-Kettering Graduate School of Biomedical Sciences, Memorial Sloan-Kettering Cancer Center, New York, New York, United States of America; Graduate Program in Pharmacology, Weill Graduate School of Medical Sciences of Cornell University, New York, New York, United States of America; Department of Anatomy and Developmental Biology, Monash University, Clayton, Australia; Stowers Institute for Medical Research, Kansas City, Missouri, United States of America; Institut National de la Santé et de la Recherche Médicale (Inserm) U1085-IRSET, Université de Rennes 1, Structure Fédérative Recherche Biosit, Campus de Beaulieu, Rennes, France; Polish Academy of Sciences, Institute of Human Genetics, Poznań, Poland; EHESP School of Public Health, Rennes, France; Department of Anatomy and Cell Biology, University of Kansas Medical Center, Kansas City, Kansas, United States of America; iGE3, Institute of Genetics and Genomics of Geneva, University of Geneva, Geneva, Switzerland","Conceived and designed the experiments: PCalv SN SEA. Performed the experiments: PCalv AM PM PB CZ FK BC IS. Analyzed the data: PCalv PCall AV DW CB MG FS IS. Contributed reagents/materials/analysis tools: PCall AM MDR HK CTR SMG AR CDL SL FH FM JJ LF BJ PAT. Wrote the paper: PCalv PM SN MDR.","The authors have declared that no competing interests exist."
"10.1371/journal.pbio.1000151","plos biology","2009-07-14T00:00:00Z","Huaiyu Yang; Ye Yu; Wei-Guang Li; Fang Yu; Hui Cao; Tian-Le Xu; Hualiang Jiang","Drug Discovery and Design Center, State Key Laboratory of Drug Research, Shanghai Institute of Materia Medica, Chinese Academy of Sciences, Shanghai, China; Institute of Neuroscience and State Key Laboratory of Neuroscience, Shanghai Institutes for Biological Sciences, Chinese Academy of Sciences, Shanghai, China; School of Pharmacy, East China University of Science and Technology, Shanghai, China","The author(s) have made the following declarations about their contributions: Conceived and designed the experiments: HY YY TLX HJ. Performed the experiments: HY YY WGL FY HC. Analyzed the data: HY YY TLX HJ. Wrote the paper: HY YY TLX HJ.","The authors have declared that no competing interests exist."
"10.1371/journal.pbio.1000154","plos biology","2009-07-21T00:00:00Z","Bridget C Lear; Luoying Zhang; Ravi Allada","Department of Neurobiology and Physiology, Northwestern University, Evanston, Illinois, United States of America","The author(s) have made the following declarations about their contributions: Conceived and designed the experiments: BCL LZ RA. Performed the experiments: BCL LZ. Analyzed the data: BCL LZ RA. Wrote the paper: BCL LZ RA.","The authors have declared that no competing interests exist."
"10.1371/journal.pgen.1004343","plos genetics","2014-06-19T00:00:00Z","E Thomas Danielsen; Morten E Moeller; Elad Dorry; Tatsuya Komura-Kawa; Yoshinori Fujimoto; Jesper T Troelsen; Rachel Herder; Michael B O'Connor; Ryusuke Niwa; Kim F Rewitz","Department of Biology, University of Copenhagen, Copenhagen, Denmark; Graduate School of Life and Environmental Sciences, University of Tsukuba, Tsukuba, Ibaraki, Japan; Department of Chemistry and Materials Science, Tokyo Institute of Technology, Meguro, Tokyo, Japan; Department of Science, Systems and Models, Roskilde University, Roskilde, Denmark; Department of Genetics, Cell Biology and Development, University of Minnesota, Minneapolis, Minnesota, United States of America; PRESTO, JST, Kawaguchi, Saitama, Japan","Conceived and designed the experiments: ETD MEM TKK YF RH MBO RN KFR. Performed the experiments: ETD MEM ED TKK YF RH MBO RN KFR. Analyzed the data: ETD MEM ED TKK YF JTT RH MBO RN KFR. Contributed reagents/materials/analysis tools: YF JTT MBO RN KFR. Wrote the paper: ETD MEM ED TKK RH MBO RN KFR.","The authors have declared that no competing interests exist."
"10.1371/journal.pbio.1000164","plos biology","2009-07-28T00:00:00Z","Burkhard Pleger; Christian C Ruff; Felix Blankenburg; Stefan Klöppel; Jon Driver; Raymond J Dolan","Wellcome Trust Centre for Neuroimaging at UCL, London, United Kingdom; Department of Cognitive Neurology, Max Planck Institute for Human Cognitive and Brain Sciences, Leipzig, Germany; UCL Institute of Cognitive Neuroscience, London, United Kingdom; Laboratory for Social and Neural Systems Research (SNS), Institute for Empirical Research in Economics, University of Zurich, Switzerland; Department of Neurology and Bernstein Center for Computational Neuroscience, Charité, Berlin, Germany; Department of Psychiatry and Psychotherapy, University of Freiburg, Freiburg, Germany","The author(s) have made the following declarations about their contributions: Conceived and designed the experiments: BP CCR FB SK JD RJD. Performed the experiments: BP CCR FB SK. Analyzed the data: BP CCR FB JD. Contributed reagents/materials/analysis tools: BP CCR FB RJD. Wrote the paper: BP CCR JD RJD.","The authors have declared that no competing interests exist."
"10.1371/journal.pbio.1000163","plos biology","2009-07-28T00:00:00Z","Jing Jin; Nathan M Sherer; Gisela Heidecker; David Derse; Walther Mothes","Section of Microbial Pathogenesis, Yale University School of Medicine, New Haven, Connecticut, United States of America; HIV Drug Resistance Program, National Cancer Institute-Frederick, Frederick, Maryland, United States of America","The author(s) have made the following declarations about their contributions: Conceived and designed the experiments: JJ NMS WM. Performed the experiments: JJ. Analyzed the data: JJ WM. Contributed reagents/materials/analysis tools: JJ NMS GH DD. Wrote the paper: JJ NMS WM.","The authors have declared that no competing interests exist."
"10.1371/journal.pgen.1004358","plos genetics","2014-06-19T00:00:00Z","Christopher D Richardson; Joachim J Li","Department of Biochemistry and Biophysics, University of California San Francisco, San Francisco, California, United States of America; Department of Microbiology and Immunology, University of California San Francisco, San Francisco, California, United States of America","Conceived and designed the experiments: CDR JJL. Performed the experiments: CDR. Analyzed the data: CDR JJL. Contributed reagents/materials/analysis tools: CDR. Wrote the paper: CDR JJL.","The authors have declared that no competing interests exist."
"10.1371/journal.pbio.1000161","plos biology","2009-07-28T00:00:00Z","Xin Chenglin Li; John C Schimenti; Bik K Tye","Department of Molecular Biology and Genetics, College of Agriculture and Life Sciences, Cornell University, Ithaca, New York, United States of America; Department of Biomedical Sciences, College of Veterinary Medicine, Cornell University, Ithaca, New York, United States of America","The author(s) have made the following declarations about their contributions: Conceived and designed the experiments: XCL BKT. Performed the experiments: XCL. Analyzed the data: XCL BKT. Wrote the paper: XCL JCS BKT.","The authors have declared that no competing interests exist."
"10.1371/journal.pgen.1004349","plos genetics","2014-05-01T00:00:00Z","Erica E Rosenbaum; Eva Vasiljevic; Kimberley S Brehm; Nansi Jo Colley","Department of Ophthalmology & Visual Sciences and Department of Genetics, University of Wisconsin-Madison, Madison, Wisconsin, United States of America","Conceived and designed the experiments: NJC EER. Performed the experiments: EER EV KSB. Analyzed the data: NJC EER EV KSB. Wrote the paper: NJC EER.","The authors have declared that no competing interests exist."
"10.1371/journal.pbio.1000157","plos biology","2009-07-21T00:00:00Z","Kaustubh Supekar; Mark Musen; Vinod Menon","Graduate Program in Biomedical Informatics, Stanford University School of Medicine, Stanford, California, United States of America; Center for Biomedical Informatics Research, Stanford University School of Medicine, Stanford, California, United States of America; Program in Neuroscience, Stanford University School of Medicine, Stanford, California, United States of America; Department of Psychiatry and Behavioral Sciences, Stanford University School of Medicine, Stanford, California, United States of America","The author(s) have made the following declarations about their contributions: Conceived and designed the experiments: KS VM. Performed the experiments: KS. Analyzed the data: KS VM. Contributed reagents/materials/analysis tools: MM VM. Wrote the paper: KS VM.","The authors have declared that no competing interests exist."
