"id","journal","publication_date","author","author_affiliate","author_notes","competing_interest"
"10.1371/journal.pone.0055056","plos one","2013-01-25T00:00:00Z","Vicente Castro; Barbara Grisdale-Helland; Ståle J Helland; Jacob Torgersen; Torstein Kristensen; Guy Claireaux; Anthony P Farrell; Harald Takle","Nofima AS, Ås, Norway; Institute of Animal Sciences, Norwegian University of Life Sciences (UMB), Ås, Norway; Aquaculture Protein Centre, Ås, Norway; Nofima AS, Sunndalsøra, Norway; Norwegian Institute of Water Research, Bodø, Norway; Laboratoire des Sciences de ĺEnvironnement Marin (LEMAR), Université de Bretagne Occidentale, & Unité de Physiologie Fonctionnelle des Organismes Marins, Ifremer, Plouzané, France; Faculty of Land and Food Systems, & Department of Zoology, University of British Columbia, Vancouver, British Columbia, Canada; AVS Chile SA, Puerto Varas, Chile","Conceived and designed the experiments: HT BGH SH GC AF. Performed the experiments: VC BGH SH HT TK JT. Analyzed the data: VC BGH JT HT. Contributed reagents/materials/analysis tools: JT. Wrote the paper: VC BGH SH JT TK GC AF HT.","The authors have declared that no competing interests exist. Nofima AS is not a commercial company but a governmental own non-profit research institute. Nofima do independent research and this study was supported by two public funding bodies: the norwegian research council (NRC) and the fishery and aquaculture research fund (FHF)."
"10.1371/journal.pone.0124472","plos one","2015-05-20T00:00:00Z","Yu-Zhong Chen; Zi-Gang Huang; Shouhuai Xu; Ying-Cheng Lai","School of Electrical, Computer and Energy Engineering, Arizona State University, Tempe, Arizona 85287, USA; Institute of Computational Physics and Complex Systems, Lanzhou University, Lanzhou Gansu 730000, China; Department of Computer Science, University of Texas at San Antonio, San Antonio, TX 78249, USA; Department of Physics, Arizona State University, Tempe, Arizona 85287, USA","Conceived and designed the experiments: SX YCL. Performed the experiments: YZC. Analyzed the data: YZC ZGH SX YCL. Wrote the paper: YZC YCL.","The authors have declared that no competing interests exist."
"10.1371/journal.pone.0032101","plos one","2012-02-15T00:00:00Z","Donald L J Quicke","Department of Life Science, Imperial College London, Ascot, Berkshire, United Kingdom; Department of Entomology, Natural History Museum, London, United Kingdom","Conceived and designed the experiments: DQ. Performed the experiments: DQ. Analyzed the data: DQ. Contributed reagents/materials/analysis tools: DQ. Wrote the paper: DQ.","The author has declared that no competing interests exist."
"10.1371/journal.pone.0124468","plos one","2015-04-15T00:00:00Z","Chantal A Coles; Jenny Wadeson; Carolina P Leyton; Jason P Siddell; Paul L Greenwood; Jason D White; Matthew B McDonagh","Department of Primary Industries Victoria, Discovery Technologies, Biosciences Research Division, Melbourne, Victoria 3083, Australia; Department of Veterinary Science, University of Melbourne, Melbourne, Victoria 3010, Australia; Cooperative Research Centre for Cattle and Beef Quality, University of New England, Armidale, NSW 2351, Australia; New South Wales Department of Primary Industries, Beef Industry Centre of Excellence, Armidale, NSW 2351, Australia","Conceived and designed the experiments: CAC JW JPS PLG JDW MBM. Performed the experiments: CAC CPL. Analyzed the data: CAC JDW PLG MBD. Contributed reagents/materials/analysis tools: CAC JW CPL JPS PLG JDW MBM. Wrote the paper: CAC. Obtained permission for use of cattle within Beef CRC project: PLG JPS.","This work was supported by Cooperative Research Centre for Beef Genetic Technologies Australia (Beef CRC) and partly supported by Victorian Government’s Operational Infrastructure Support program. There are no competing interests between Beef CRC and Victorian Government’s Operational Infrastructure Support program or any restrictions on sharing data or materials. This does not alter the authors' adherence to PLOS ONE policies on sharing data and materials."
"10.1371/journal.pone.0010532","plos one","2010-05-07T00:00:00Z","Deborah F Kelly; Robert J Lake; Teije C Middelkoop; Hua-Ying Fan; Spyros Artavanis-Tsakonas; Thomas Walz","Department of Cell Biology, Harvard Medical School, Boston, Massachusetts, United States of America; Epigenetics and Progenitor Cells Program, Fox Chase Cancer Center, Philadelphia, Pennsylvania, United States of America; Howard Hughes Medical Institute, Harvard Medical School, Boston, Massachusetts, United States of America","Conceived and designed the experiments: DFK SAT TW. Performed the experiments: DFK RJL TCM. Analyzed the data: DFK. Contributed reagents/materials/analysis tools: HYF SAT. Wrote the paper: DFK SAT TW.","The authors have declared that no competing interests exist."
"10.1371/journal.pone.0124467","plos one","2015-04-14T00:00:00Z","Nancy Witowski; Elizabeth Lusczek; Charles Determan; Daniel Lexcen; Kristine Mulier; Beverly Ostrowski; Greg Beilman","Department of Surgery, University of Minnesota, Minneapolis, MN, United States of America; Minnesota NMR Center, University of Minnesota, Minneapolis, MN, United States of America","Conceived and designed the experiments: GB NW. Performed the experiments: NW EL CD DL KM BO. Analyzed the data: NW EL CD DL KM BO. Contributed reagents/materials/analysis tools: KM BO GB. Wrote the paper: NW EL CD GB.","The authors have declared that no competing interests exist."
"10.1371/journal.pone.0055050","plos one","2013-01-31T00:00:00Z","Shiyan Ren; Xianlun Li; Jianyan Wen; Wenjian Zhang; Peng Liu","Cardiovascular Center, China-Japan Friendship Hospital, Beijing, People’s Republic of China; Clinical Research Institute, China-Japan Friendship Hospital, Beijing, People’s Republic of China","Conceived and designed the experiments: SR XL PL. Performed the experiments: SR XL. Analyzed the data: SR WZ JW. Contributed reagents/materials/analysis tools: SR. Wrote the paper: SR.","The authors have declared that no competing interests exist."
"10.1371/journal.pone.0010531","plos one","2010-05-07T00:00:00Z","Kashif Ahmed; Hesam Dehghani; Peter Rugg-Gunn; Eden Fussner; Janet Rossant; David P Bazett-Jones","Genetics and Genome Biology Program, The Hospital for Sick Children, Toronto, Ontario, Canada; Department of Physiology, School of Veterinary Medicine and Institute of Biotechnology, Ferdowsi University of Mashhad, Mashhad, Iran; Developmental and Stem Cell Biology Program, The Hospital for Sick Children, Toronto, Ontario, Canada","Conceived and designed the experiments: KA HD PRG. Performed the experiments: KA HD EF. Analyzed the data: KA HD EF DBJ. Contributed reagents/materials/analysis tools: PRG JR DBJ. Wrote the paper: KA HD PRG JR DBJ.","The authors have declared that no competing interests exist."
"10.1371/journal.pone.0010530","plos one","2010-05-07T00:00:00Z","Anna Liisa Suominen-Taipale; Timo Partonen; Anu W Turunen; Satu Männistö; Antti Jula; Pia K Verkasalo","Department of Environmental Health, National Institute for Health and Welfare (THL), Kuopio, Finland; Department of Public Health Dentistry, Institute of Dentistry, University of Turku, Turku, Finland; Department of Mental Health and Substance Abuse Services, National Institute for Health and Welfare (THL), Helsinki, Finland; Department of Chronic Disease Prevention, National Institute for Health and Welfare (THL), Helsinki, Finland; Department of Chronic Disease Prevention, National Institute for Health and Welfare (THL), Turku, Finland","Analyzed the data: ALST. Wrote the paper: ALST. Conception and design: ALST TP AWT PKV. Analysis of the data: ALST AWT. Interpretation of the data: ALST AWT SM AJ. Revising the article critically: TP AWT SM AJ PKV.","The authors have declared that no competing interests exist."
"10.1371/journal.pone.0135581","plos one","2015-08-18T00:00:00Z","Ben A Ward","Laboratoire des Sciences de l’Environnement Marin, Institut Universitaire Européen de la Mer, Place Nicolas Copernic, Plouzané, France; School of Geographical Sciences, University of Bristol, Bristol, United Kingdom","Conceived and designed the experiments: BAW. Performed the experiments: BAW. Analyzed the data: BAW. Wrote the paper: BAW.","The authors have declared that no competing interests exist."
"10.1371/journal.pone.0135580","plos one","2015-08-19T00:00:00Z","Stephanie Trend; Emma de Jong; Megan L Lloyd; Chooi Heen Kok; Peter Richmond; Dorota A Doherty; Karen Simmer; Foteini Kakulas; Tobias Strunk; Andrew Currie","Centre for Neonatal Research and Education, The University of Western Australia, Perth, Western Australia, Australia; School of Paediatrics and Child Health, The University of Western Australia, Perth, Western Australia, Australia; School of Veterinary and Life Sciences, Murdoch University, Perth, Western Australia, Australia; School of Pathology and Laboratory Medicine, The University of Western Australia, Perth, Western Australia, Australia; Neonatal Clinical Care Unit, King Edward Memorial Hospital for Women, Perth, Western Australia, Australia; School of Women’s and Infants’ Health, The University of Western Australia, Perth, Western Australia, Australia; School of Chemistry and Biochemistry, The University of Western Australia, Perth, Australia","Conceived and designed the experiments: ST TS AC KS PR EJ FK. Performed the experiments: ST. Analyzed the data: ST. Contributed reagents/materials/analysis tools: ML CK FK AC. Wrote the paper: ST TS AC. Recruited study participants: ST ML CK. Editing and reviewing manuscript: EJ ML CK PR DD KS FK TS AC.","The authors have declared that no competing interests exist."
"10.1371/journal.pone.0135579","plos one","2015-08-14T00:00:00Z","Diego O Andrey; Ambre Jousselin; Maite Villanueva; Adriana Renzoni; Antoinette Monod; Christine Barras; Natalia Rodriguez; William L Kelley","Service of Infectious Diseases, University Hospital and Medical School of Geneva, 4 rue Gabrielle-Perret-Gentil, CH-1211 Geneva 14, Switzerland; Department of Microbiology and Molecular Medicine, University Hospital and Medical School of Geneva, 1 rue Michel-Servet, CH-1211 Geneva, Switzerland","Conceived and designed the experiments: DOA WLK AJ MV. Performed the experiments: DOA AJ AR AM CB NR MV. Analyzed the data: DOA WLK AJ MV AR. Wrote the paper: DOA AR WLK AJ MV.","The authors have declared that no competing interests exist."
"10.1371/journal.pone.0055045","plos one","2013-02-06T00:00:00Z","Claudia Hornung; Anja Poehlein; Frederike S Haack; Martina Schmidt; Katja Dierking; Andrea Pohlen; Hinrich Schulenburg; Melanie Blokesch; Laure Plener; Kirsten Jung; Andreas Bonge; Ines Krohn-Molt; Christian Utpatel; Gabriele Timmermann; Eva Spieck; Andreas Pommerening-Röser; Edna Bode; Helge B Bode; Rolf Daniel; Christel Schmeisser; Wolfgang R Streit","Abteilung für Mikrobiologie und Biotechnologie, Biozentrum Klein Flottbek, Universität Hamburg, Hamburg, Germany; Laboratorium für Genomanalyse, Institut für Mikrobiologie und Genetik, Georg-August-Universität Göttingen, Göttingen, Germany; Department of Evolutionary Ecology and Genetics, Christian-Albrechts Universität zu Kiel, Kiel, Germany; Laboratory of Molecular Microbiology, Global Health Institute, School of Life Sciences, Ecole Polytechnique Fédérale de Lausanne (EPFL), Lausanne, Switzerland; Center for integrated Protein Science Munich (CiPSM) at the Department of Biology I, Microbiology, Ludwig-Maximilians-Universität München, Martinsried, Germany; Molekulare Biotechnologie, Institut für Molekulare Biowissenschaften, Goethe Universität Frankfurt, Frankfurt am Main, Germany","Provided the pTS21 construct: HH LMU. Conceived and designed the experiments: CH CS WRS. Performed the experiments: CH A. Poehlein FSH MS IKM KD A. Pohlen MB LP AB CU GT ES APR EB. Analyzed the data: CH A. Poehlein A. Pohlen FSH HS MB KJ HBB RD CS WRS. Contributed reagents/materials/analysis tools: A. Pohlen KD HS MB LP KJ EB HBB RD WRS. Wrote the paper: CS FSH WRS.","The authors have declared that no competing interests exist."
"10.1371/journal.pone.0055044","plos one","2013-01-30T00:00:00Z","Meiye Wu; Matthew Piccini; Chung-Yan Koh; Kit S Lam; Anup K Singh","Department of Biotechnology and Bioengineering, Sandia National Laboratory, Livermore, California, United States of America; Biochemistry and Molecular Biology Graduate Group, University of California Davis, Davis, California, United States of America; Department of Hematology and Oncology, University of California Davis Medical Center, Sacramento, California, United States of America","Conceived and designed the experiments: MW KSL AKS. Performed the experiments: MW MP CK. Analyzed the data: MW AKS. Contributed reagents/materials/analysis tools: CK KSL AKS. Wrote the paper: MW.","The authors have read the journal’s policy and have the following conflicts: Meiye Wu, Matthew Piccini, Chung-yan Koh, and Anup K. Singh are employees of Sandia National Laboratory. Sandia is a multiprogram laboratory operated by Sandia Corporation, a Lockheed Martin Company, for the United States Department of Energy’s National Nuclear Security Administration under contract DE-AC04-94AL85000. Meiye Wu was also a graduate student at UC Davis, under Kit Lam, and financially supported by Sandia’s Special Degree program. There are no patents, products in development or marketed products to declare. This does not alter the authors’ adherence to all the PLOS ONE policies on sharing data and materials, as detailed online in the guide for authors."
"10.1371/journal.pone.0135578","plos one","2015-08-14T00:00:00Z","Kiera-Nicole Lee; Sanika Chirwa","Department of Neuroscience and Pharmacology, Meharry Medical College, 1005 DB Todd Boulevard, Nashville, TN, 37208, United States of America; Department of Pharmacology, 23rd Avenue South & Pierce, Vanderbilt University, Nashville, TN, 37203, United States of America","Conceived and designed the experiments: SC KNL. Performed the experiments: KNL SC. Analyzed the data: SC KNL. Contributed reagents/materials/analysis tools: SC. Wrote the paper: SC KNL.","The authors have declared that no competing interests exist."
"10.1371/journal.pone.0124433","plos one","2015-04-17T00:00:00Z","Masahiro Hosoda; Shinji Tokonami; Yasutaka Omori; Sarata Kumar Sahoo; Suminori Akiba; Atsuyuki Sorimachi; Tetsuo Ishikawa; Raghu Ram Nair; Padmavathy Amma Jayalekshmi; Paul Sebastian; Kazuki Iwaoka; Naofumi Akata; Hiromi Kudo","Hirosaki University Graduate School of Health Sciences, Aomori, Japan; Institute of Radiation Emergency Medicine, Hirosaki University, Aomori, Japan; Fukushima Medical University, Fukushima, Japan; National Institute of Radiological Sciences, Chiba, Japan; Kagoshima University Graduate School of Medical and Dental Sciences, Kagoshima, Japan; Regional Cancer Center, Kerala, India; Natural Background Radiation Cancer Registry, Kerala, India; National Institute for Fusion Science, Gifu, Japan","Conceived and designed the experiments: SA ST TI AS RRN PAJ PS. Performed the experiments: MH ST SKS SA RRN PAJ PS. Analyzed the data: MH ST YO RRN PAJ PS KI NA HK. Contributed reagents/materials/analysis tools: ST RRN PAJ PS. Wrote the paper: MH ST RRN PAJ PS. All authors contributed extensively to discussions about this work and in reviewing the manuscript.","Although Prof. Suminori Akiba is a PLOS ONE Editorial Board member, the present study does not alter the authors' adherence to PLOS ONE Editorial policies and criteria."
"10.1371/journal.pone.0135554","plos one","2015-08-12T00:00:00Z","Mami Shiwa; Masayasu Yoneda; Hirofumi Okubo; Haruya Ohno; Kazuhiro Kobuke; Yuko Monzen; Rui Kishimoto; Yusuke Nakatsu; Tomoichiro Asano; Nobuoki Kohno","Department of Molecular and Internal Medicine, Graduate School of Biomedical and Health Sciences, Hiroshima University, Hiroshima, Japan; Department of Biomedical Chemistry, Graduate School of Biomedical and Health Sciences, Hiroshima University, Hiroshima, Japan","Conceived and designed the experiments: MY. Performed the experiments: MS. Analyzed the data: MS. Contributed reagents/materials/analysis tools: H. Okubo. Wrote the paper: MS. Assisted with the experiments: MY H. Okubo KK YM RK YN. Critically revised the manuscript for important intellectual content: H. Okubo H. Ohno TA NK.","The authors have declared that no competing interests exist."
"10.1371/journal.pone.0010509","plos one","2010-05-06T00:00:00Z","Juan J Soler; Jesús M Avilés","Departamento de Ecología Funcional y Evolutiva, Estación Experimental de Zonas Áridas, Almería, Spain","Conceived and designed the experiments: JJS JMA. Performed the experiments: JJS JMA. Analyzed the data: JJS JMA. Contributed reagents/materials/analysis tools: JJS JMA. Wrote the paper: JJS.","The authors have declared that no competing interests exist."
"10.1371/journal.pone.0055017","plos one","2013-01-28T00:00:00Z","Elena Agliari; Lorenzo Asti; Adriano Barra; Rossana Scrivo; Guido Valesini; Robert S Wallis","Dipartimento di Fisica, Università di Parma, Parma, Italy; Istituto Nazionale di Fisica Nucleare, Gruppo Collegato di Parma, Parma, Italy; Dipartimento di Scienze di Base e Applicate per l’Ingegneria, Sapienza Università di Roma, Roma, Italy; Dipartimento di Fisica, Sapienza Università di Roma, Roma, Italy; Dipartimento di Medicina Interna e Specialità mediche, Sapienza Università di Roma, Roma, Italy; Pfizer, Groton, Connecticut, United States of America","Conceived and designed the experiments: EA AB RS. Performed the experiments: EA AB LA. Analyzed the data: EA LA RS. Contributed reagents/materials/analysis tools: EA LA RS GV RSW. Wrote the paper: EA RS GV RSW.","The authors have read the journal’s policy and have the following conflict: one of the authors (R.S. Wallis) is Senior Director at Pfizer, which is the manufacturer of Enbrel (etanercept). This does not alter the authors’ adherence to all the PLOS ONE policies on sharing data and materials."
"10.1371/journal.pone.0124429","plos one","2015-04-20T00:00:00Z","Gordon P Otto; Jorge Hurtado-Oliveros; Ha-Yeun Chung; Kristin Knoll; Thomas Neumann; Hans J Müller; Marco Herbsleb; Matthias Kohl; Martin Busch; Maik Sossdorf; Ralf A Claus","Center for Sepsis Control and Care, Jena University Hospital, Jena, Germany; Clinic for Anesthesiology and Intensive Care, Jena University Hospital, Jena, Germany; Clinic for Internal Medicine (KIM III)—Rheumatology, Jena University Hospital, Jena, Germany; Department of Sports Medicine and Health Promotion, Friedrich-Schiller-University, Jena, Germany; Department of Medical and Life Sciences, Furtwangen University, Villingen-Schwenningen, Germany; Clinic for Internal Medicine (KIM III)—Nephrology, Jena University Hospital, Jena, Germany","Conceived and designed the experiments: GPO HC JHO MS KK TN HJM MH MK MB RAC. Performed the experiments: GPO HC JHO MS TN HJM MH. Analyzed the data: GPO KK MH MK. Contributed reagents/materials/analysis tools: TN HJM MH MK MB RAC. Wrote the paper: GPO MK MB RAC.","The authors have declared that no competing interests exist."
"10.1371/journal.pone.0032065","plos one","2012-02-14T00:00:00Z","Laurent R Chiarelli; Simone M Morera; Paola Bianchi; Elisa Fermo; Alberto Zanella; Alessandro Galizzi; Giovanna Valentini","Dipartimento di Biologia e Biotecnologie “L. Spallanzani”, Università degli Studi di Pavia, Pavia, Italy; U.O. Ematologia 2, Fondazione IRCCS Cà Granda Ospedale Maggiore Policlinico, Milano, Italy","Conceived and designed the experiments: GV LRC. Performed the experiments: EF LRC PB SMM. Analyzed the data: AG AZ GV LRC PB SMM. Wrote the paper: AG GV.","The authors have declared that no competing interests exist."
"10.1371/journal.pone.0010506","plos one","2010-05-05T00:00:00Z","Swaminathan Sethu; Peter N Pushparaj; Alirio J Melendez","Department of Physiology, Yong Loo Lin School of Medicine, National University of Singapore, Singapore, Singapore; Division of Immunology, Infection and Inflammation, Glasgow Biomedical Research Centre, University of Glasgow, Glasgow, Scotland, United Kingdom","Conceived and designed the experiments: AM. Performed the experiments: SS PNP. Analyzed the data: SS PNP. Wrote the paper: AM.","The authors have declared that no competing interests exist."
"10.1371/journal.pone.0010505","plos one","2010-05-05T00:00:00Z","Rong Lu; Shaoping Wu; Xingyin Liu; Yinglin Xia; Yong-guo Zhang; Jun Sun","Department of Medicine, University of Rochester, Rochester, New York, United States of America; Department of Biostatistics and Computational Biology, University of Rochester, Rochester, New York, United States of America; Department of Microbiology and Immunology, University of Rochester, Rochester, New York, United States of America; Wilmot Cancer Center, University of Rochester, Rochester, New York, United States of America","Conceived and designed the experiments: RL SW XL YX YgZ JS. Performed the experiments: RL SW XL YgZ JS. Analyzed the data: RL SW XL YX JS. Contributed reagents/materials/analysis tools: JS. Wrote the paper: RL YX JS.","The authors have declared that no competing interests exist."
"10.1371/journal.pone.0135545","plos one","2015-09-02T00:00:00Z","Irene Jao; Francis Kombe; Salim Mwalukore; Susan Bull; Michael Parker; Dorcas Kamuya; Sassy Molyneux; Vicki Marsh","Health Systems and Research Ethics Department, Kenya Medical Research Institute Wellcome Trust Research Programme, Kilifi, Kenya; Ethox Centre, Nuffield Department of Population Health, Oxford University, Oxford, United Kingdom; Centre for Tropical Medicine and Global Health, Nuffield Department of Medicine, Oxford University, Oxford, United Kingdom","Conceived and designed the experiments: IJ FK S. Mwalukore SB MP DK S. Molyneux VM. Performed the experiments: IJ FK S. Mwalukore DK S. Molyneux VM. Analyzed the data: IJ DK S. Molyneux VM. Contributed reagents/materials/analysis tools: IJ DK S. Molyneux VM. Wrote the paper: IJ FK S. Mwalukore SB MP DK S. Molyneux VM.","The authors have declared that no competing interests exist."
"10.1371/journal.pone.0135543","plos one","2015-08-25T00:00:00Z","John W Crabb; Bo Hu; John S Crabb; Pierre Triozzi; Yogen Saunthararajah; Raymond Tubbs; Arun D Singh","Cole Eye Institute, Cleveland Clinic, Cleveland, Ohio, United States of America; Lerner Research Institute, Cleveland Clinic, Cleveland, Ohio, United States of America; Department of Ophthalmology, Cleveland Clinic Lerner College of Medicine of Case Western Reserve University, Cleveland Clinic, Cleveland, Ohio, United States of America; Department of Molecular Medicine, Cleveland Clinic Lerner College of Medicine of Case Western Reserve University, Cleveland Clinic, Cleveland, Ohio, United States of America; Department of Quantitative Health Sciences, Cleveland Clinic, Cleveland, Ohio, United States of America; Taussig Cancer Institute, Cleveland Clinic, Cleveland, Ohio, United States of America; Department of Molecular Pathology, Pathology & Laboratory Medicine Institute, Cleveland Clinic, Cleveland, Ohio, United States of America","Conceived and designed the experiments: JWC YS. Performed the experiments: BH JSC YS RT. Analyzed the data: BH JSC YS RT JWC. Contributed reagents/materials/analysis tools: ADS. Wrote the paper: JWC BH PT YS ADS.","The authors have declared that no competing interests exist."
"10.1371/journal.pone.0010502","plos one","2010-05-05T00:00:00Z","Sandra Knapp","Department of Botany, The Natural History Museum, London, United Kingdom","Conceived and designed the experiments: SK. Performed the experiments: SK. Analyzed the data: SK. Contributed reagents/materials/analysis tools: SK. Wrote the paper: SK.","The author has declared that no competing interests exist."
"10.1371/journal.pone.0055011","plos one","2013-01-23T00:00:00Z","Lu Yang; Paul O’Neill; Kareen Martin; Juan C Maass; Vassil Vassilev; Raj Ladher; Andrew K Groves","Departments of Neuroscience and Molecular and Human Genetics, Baylor College of Medicine, Houston, Texas, United States of America; Program in Developmental Biology, Baylor College of Medicine, Houston, Texas, United States of America; Division of Cell Biology and Genetics, House Research Institute, Los Angeles, California, United States of America; RIKEN Center for Developmental Biology, Chuo-ku, Kobe, Japan; Department of Otolaryngology, Hospital Clínico Universidad de Chile, Santiago, Chile; Department of Otolaryngology, Clínica Alemana de Santiago, Facultad de Medicina Clínica Alemana-Universidad del Desarrollo, Santiago, Chile","Conceived and designed the experiments: LY PO KM JM RL AG. Performed the experiments: LY PO KM JM VV AG. Analyzed the data: LY PO KM JM VV RL AG. Wrote the paper: LY PO JM RL AG.","The authors have declared that no competing interests exist."
"10.1371/journal.pone.0124420","plos one","2015-05-01T00:00:00Z","Hua Wang; Rui-Ting Sun; Yang Li; Yue-Feng Yang; Feng-Jun Xiao; Yi-Kun Zhang; Shao-Xia Wang; Hui-Yan Sun; Qun-Wei Zhang; Chu-Tse Wu; Li-Sheng Wang","Department of Experimental Hematology, Beijing Institute of Radiation Medicine, Beijing, 100850, PR China; College of Life Science and Bioengineering, Beijing University of Technology, Beijing, 100022, PR China; Department of Experimental Pathology, Beijing Institute of Radiation Medicine, Beijing, 100850, PR China; Collaborative Innovation Center for Biotherapy, West China Hospital, Sichuan University，Chengdu, 610041, PR China","Conceived and designed the experiments: HW CW LW. Performed the experiments: RS YL YY FX YZ QZ HS SW. Analyzed the data: HW RS YY FX. Contributed reagents/materials/analysis tools: QZ FX. Wrote the paper: HW RS.","The authors have declared that no competing interests exist."
