"id","journal","publication_date","author","author_affiliate","author_notes","competing_interest"
"10.1371/journal.pgen.1004854","plos genetics","2014-12-18T00:00:00Z","Anke Tönjes; Markus Scholz; Jana Breitfeld; Carola Marzi; Harald Grallert; Arnd Gross; Claes Ladenvall; Dorit Schleinitz; Kerstin Krause; Holger Kirsten; Esa Laurila; Jennifer Kriebel; Barbara Thorand; Wolfgang Rathmann; Leif Groop; Inga Prokopenko; Bo Isomaa; Frank Beutner; Jürgen Kratzsch; Joachim Thiery; Mathias Fasshauer; Nora Klöting; Christian Gieger; Matthias Blüher; Michael Stumvoll; Peter Kovacs","Department of Medicine, University of Leipzig, Leipzig, Germany; Institute of Medical Informatics, Statistics and Epidemiology, University of Leipzig, Leipzig, Germany; LIFE Research Center, University of Leipzig, Leipzig, Germany; IFB Adiposity Diseases, University of Leipzig, Leipzig, Germany; Research Unit of Molecular Epidemiology, Helmholtz Center Munich, German Research Center for Environmental Health, Neuherberg, Germany; Institute of Epidemiology II, Helmholtz Center Munich, German Research Center for Environmental Health, Neuherberg, Germany; German Center for Diabetes Research (DZD e.V.), Neuherberg, Germany; Department of Clinical Sciences, Diabetes and Endocrinology, Lund University and Lund University Diabetes Centre, CRC at Skåne University Hospital, Malmö, Sweden; Department for Cell Therapy, Fraunhofer Institute for Cell Therapy and Immunology, Leipzig, Germany; Institute of Epidemiology II, Helmholtz Zentrum München, German Research Center for Environmental Health, München, Germany; Institute of Biometrics and Epidemiology, German Diabetes Center, Leibniz Center for Diabetes Research at Heinrich Heine University Düsseldorf, Düsseldorf, Germany; Wellcome Trust Centre for Human Genetics, University of Oxford, Oxford, United Kingdom; Oxford Centre for Diabetes, Endocrinology and Metabolism, University of Oxford, Oxford, United Kingdom; Department of Genomics of Common Diseases, Imperial College London, London, United Kingdom; Department of Social Services and Health Care, Jakobstad, Finland; Folkhälsan Research Centre, Helsinki, Finland; Institute of Laboratory Medicine, Clinical Chemistry and Molecular Diagnostics, University Hospital Leipzig, Leipzig, Germany; Institute of Genetic Epidemiology, Helmholtz Zentrum München, German Research Center for Environmental Health, Neuherberg, Germany","Conceived and designed the experiments: AT MSc PK. Performed the experiments: AT JB CM HG DS KK EL NK. Analyzed the data: AT MSc HG CM AG CL HK LG IP CG. Contributed reagents/materials/analysis tools: MB MF JKri BT WR BI FB JKra JT. Wrote the paper: PK AT MSc JB CM DS MSt.","The authors have declared that no competing interests exist."
"10.1371/journal.ppat.0010039","plos pathogens","2005-12-09T00:00:00Z","Stanley G Sawicki; Dorothea L Sawicki; Diane Younker; Yvonne Meyer; Volker Thiel; Helen Stokes; Stuart G Siddell","Department of Medical Microbiology and Immunology, Medical University of Ohio, Toledo, Ohio, United States of America; Institute of Virology, University of Würzburg, Würzburg, Germany; Department of Cellular and Molecular Medicine, University of Bristol, Bristol, United Kingdom","S. G. Sawicki, D. L. Sawicki, and S. G. Siddell conceived and designed the experiments. S. G. Sawicki, D. L. Sawicki, D. Younker, Y. Meyer, V. Thiel, H. Stokes, and S. G. Siddell performed the experiments and analyzed the data. S. G. Sawicki, V. Thiel, and S. G. Siddell wrote the paper.","The authors have declared that no competing interests exist."
"10.1371/journal.pgen.1004842","plos genetics","2014-12-11T00:00:00Z","Xia Shen; Jennifer De Jonge; Simon K G Forsberg; Mats E Pettersson; Zheya Sheng; Lars Hennig; Örjan Carlborg","Swedish University of Agricultural Sciences, Department of Clinical Sciences, Division of Computational Genetics, Uppsala, Sweden; Karolinska Institutet, Department of Medical Epidemiology and Biostatistics, Stockholm, Sweden; University of Edinburgh, MRC Institute of Genetics and Molecular Medicine, MRC Human Genetics Unit, Edinburgh, United Kingdom; Swedish University of Agricultural Sciences, Department of Plant Biology, Uppsala, Sweden","Conceived and designed the experiments: ÖC XS LH JDJ. Performed the experiments: JDJ. Analyzed the data: XS ÖC SKGF MEP ZS JDJ LH. Contributed reagents/materials/analysis tools: XS. Wrote the paper: XS ÖC. Led and coordinated the study: ÖC. Conceived and designed the computational genetic re-analysis based on publicly available data: XS ÖC. Contributed to all computational and statistical analyses of data: XS ÖC. Developed the method for the genome-scan: XS. Performed the statistical analyses: XS. Contributed to the analyses of the expression and methylation data: SKGF. Contributed to the replication GWAS analysis: MEP. Contributed to the functional analyses of genetic polymorphisms: ZS. Planned and conducted the heat-stress experiments: LH JDJ. Commented on the manuscript: SKGF MEP LH JDJ ZS.","The authors have declared that no competing interests exist."
"10.1371/journal.pbio.1001062","plos biology","2011-05-17T00:00:00Z","Matthias Stöck; Agnès Horn; Christine Grossen; Dorothea Lindtke; Roberto Sermier; Caroline Betto-Colliard; Christophe Dufresnes; Emmanuel Bonjour; Zoé Dumas; Emilien Luquet; Tiziano Maddalena; Helena Clavero Sousa; Iñigo Martinez-Solano; Nicolas Perrin","Department of Ecology and Evolution, University of Lausanne, Lausanne, Switzerland; Department of Biology, University of Fribourg, Fribourg, Switzerland; Umweltmikrobiologie, EAWAG, Dübendorf, Switzerland; UMR 5023 Ecology of Fluvial Hydrosystems, Bât. Darwin C, Université Lyon, Villeurbanne, France; Gordevio, Switzerland; Perpetuo Socorro, Puerto Santa María (Cádiz), Spain; Instituto de Investigación en Recursos Cinegéticos (UCLM-CSIC-JCCM), Ciudad Real, Spain","The author(s) have made the following declarations about their contributions: Conceived and designed the experiments: MS AH CG NP. Performed the experiments: MS AH CG DL RS CBC CD EB ZD EL TM HCS IMS NP. Analyzed the data: MS AH CG DL RS NP. Contributed reagents/materials/analysis tools: MS AH CG DL RS CBC CD EB ZD EL TM HCS IMS NP. Wrote the paper: MS AH CG NP.","The authors have declared that no competing interests exist."
"10.1371/journal.pgen.1004839","plos genetics","2014-12-04T00:00:00Z","Puja Yadav; Victoria Harcy; Juan Lucas Argueso; Margaret Dominska; Sue Jinks-Robertson; Nayun Kim","Department of Microbiology and Molecular Genetics, University of Texas Health Science Center at Houston, Houston, Texas, United States of America; Department of Environmental and Radiological Health Sciences, Colorado State University, Fort Collins, Colorado, United States of America; Department of Molecular Genetics and Microbiology, Duke University Medical Center, Durham, North Carolina, United States of America","Conceived and designed the experiments: NK SJR. Performed the experiments: NK PY JLA MD VH. Analyzed the data: NK PY SJR JLA. Wrote the paper: NK JLA.","The authors have declared that no competing interests exist."
"10.1371/journal.pgen.1004847","plos genetics","2014-12-04T00:00:00Z","Kenji Nishide; Tatsuya Hirano","Chromosome Dynamics Laboratory, RIKEN, Hirosawa, Wako, Saitama, Japan","Conceived and designed the experiments: KN TH. Performed the experiments: KN. Analyzed the data: KN TH. Contributed reagents/materials/analysis tools: KN. Wrote the paper: KN TH.","The authors have declared that no competing interests exist."
"10.1371/journal.ppat.0010020","plos pathogens","2005-10-28T00:00:00Z","Matthew C Fisher; William P Hanage; Sybren de Hoog; Elizabeth Johnson; Michael D Smith; Nicholas J White; Nongnuch Vanittanakom","Department of Infectious Disease Epidemiology, St Mary's Hospital Campus, Imperial College London, London, United Kingdom; Centraalbureau voor Schimmelcultures, Utrecht, The Netherlands; Mycology Reference Laboratory, Health Protection Agency, Bristol, United Kingdom; Department of Microbiology, Taunton and Somerset Hospital, Taunton, United Kingdom; Faculty of Tropical Medicine, Mahidol University, Bangkok, Thailand; Department of Microbiology, Faculty of Medicine, Chiang Mai University, Chiang Mai, Thailand","MCF conceived and designed the experiments. MCF and NV performed the experiments. MCF and BH analyzed the data. SdH, EJ, MDS, NJW, and NV contributed reagents/materials/analysis tools. MCF wrote the paper.","The authors have declared that no competing interests exist."
"10.1371/journal.pbio.1001064","plos biology","2011-05-17T00:00:00Z","Philippe G Schyns; Gregor Thut; Joachim Gross","Institute of Neuroscience and Psychology, University of Glasgow, Glasgow, United Kingdom","The author(s) have made the following declarations about their contributions: Conceived and designed the experiments: PGS. Performed the experiments: PGS. Analyzed the data: PGS JG. Contributed reagents/materials/analysis tools: PGS JG. Wrote the paper: PGS JG GT.","The authors have declared that no competing interests exist."
"10.1371/journal.ppat.0010016","plos pathogens","2005-10-14T00:00:00Z","Ka-Wing Wong; Ralph R Isberg","Department of Molecular Biology and Microbiology, Tufts University School of Medicine, Boston, Massachusetts, United States of America; Howard Hughes Medical Institute, Tufts University School of Medicine, Boston, Massachusetts, United States of America","KWW and RRI conceived and designed the experiments. KWW performed the experiments. KWW and RRI analyzed the data. RRI contributed reagents/materials/analysis tools. KWW and RRI wrote the paper.","The authors have declared that no competing interests exist."
"10.1371/journal.pgen.1004844","plos genetics","2014-12-04T00:00:00Z","He Huang; Ying Lu-Bo; Gabriel G Haddad","Department of Pediatrics (Division of Respiratory Medicine), University of California San Diego, La Jolla, California, United States of America; Rady Children's Hospital San Diego, San Diego, California, United States of America","Conceived and designed the experiments: HH GGH. Performed the experiments: HH YLB. Analyzed the data: HH GGH. Contributed reagents/materials/analysis tools: HH. Wrote the paper: HH GGH.","The authors have declared that no competing interests exist."
"10.1371/journal.pgen.1004843","plos genetics","2014-12-04T00:00:00Z","Hao Wang; Katrien M Devos; Jeffrey L Bennetzen","Department of Genetics, University of Georgia, Athens, Georgia, United States of America; Department of Crop and Soil Sciences, and Department of Plant Biology, University of Georgia, Athens, Georgia, United States of America; Germplasm Bank of Wild Species in Southwestern China, Kunming Institute of Botany, Kunming, Yunnan, P.R. China","Conceived and designed the experiments: HW KMD JLB. Performed the experiments: HW. Analyzed the data: HW. Wrote the paper: HW KMD JLB.","The authors have declared that no competing interests exist."
"10.1371/journal.pbio.1001065","plos biology","2011-05-24T00:00:00Z","Seung-Hun Baek; Alice H Li; Christopher M Sassetti","Department of Microbiology and Physiological Systems, University of Massachusetts Medical School, Worcester, Massachusetts, United States of America; Howard Hughes Medical Institute, Chevy Chase, Maryland, United States of America","The author(s) have made the following declarations about their contributions: Conceived and designed the experiments: SB AL CS. Performed the experiments: SB AL CS. Analyzed the data: SB AL CS. Wrote the paper: SB CS.","The authors have declared that no competing interests exist."
"10.1371/journal.ppat.0010017","plos pathogens","2005-10-21T00:00:00Z","David L Alexander; Jeffrey Mital; Gary E Ward; Peter Bradley; John C Boothroyd","Department of Microbiology and Immunology, Stanford University, Stanford, California, United States of America; Department of Microbiology and Molecular Genetics, University of Vermont, Burlington, Vermont, United States of America; Department of Microbiology and Immunology, University of California, Los Angeles, Los Angeles, California, United States of America","DLA conceived, designed, and performed the experiments. DLA, JM, PB, and JCB analyzed the data. JM, GEW, and PB contributed reagents/materials/analysis tools. DLA and JCB wrote the paper.","The authors have declared that no competing interests exist."
"10.1371/journal.pbio.1001060","plos biology","2011-05-10T00:00:00Z","Nadia Litterman; Yoshiho Ikeuchi; Gilbert Gallardo; Brenda C O'Connell; Mathew E Sowa; Steven P Gygi; J Wade Harper; Azad Bonni","Department of Pathology, Harvard Medical School, Boston, Massachusetts, United States of America; Program in Neuroscience, Harvard Medical School, Boston, Massachusetts, United States of America; Department of Cell Biology, Harvard Medical School, Boston, Massachusetts, United States of America","The author(s) have made the following declarations about their contributions: Conceived and designed the experiments: NL AB. Performed the experiments: NL YI GG BCO. Analyzed the data: NL GG BCO. Contributed reagents/materials/analysis tools: NL MES JWH SPG. Wrote the paper: NL AB.","The authors have declared that no competing interests exist."
"10.1371/journal.ppat.0010018","plos pathogens","2005-11-11T00:00:00Z","Masahiro Yamashita; Michael Emerman","Division of Human Biology and Basic Sciences, Fred Hutchinson Cancer Research Center, Seattle, Washington, United States of America","MY and ME conceived and designed the experiments. MY performed the experiments. MY and ME analyzed the data. MY contributed reagents, materials, and analysis tools. MY and ME wrote the paper.","The authors have declared that no competing interests exist."
"10.1371/journal.ppat.0020007","plos pathogens","2006-02-10T00:00:00Z","Oscar A Negrete; Mike C Wolf; Hector C Aguilar; Sven Enterlein; Wei Wang; Elke Mühlberger; Stephen V Su; Andrea Bertolotti-Ciarlet; Ramon Flick; Benhur Lee","Department of Microbiology, Immunology and Molecular Genetics, David Geffen School of Medicine, University of California Los Angeles, Los Angeles, California, United States of America; University of Texas Medical Branch, Galveston, Texas, United States of America; Department of Medicine-Infectious Diseases, David Geffen School of Medicine, University of California Los Angeles, Los Angeles, California, United States of America; Institute for Virology, Philipps-University Marburg, Marburg, Germany; Department of Microbiology, University of Pennsylvania, Philadelphia, Pennsylvania, United States of America; Department of Pathology and Laboratory Medicine, David Geffen School of Medicine, University of California Los Angeles, Los Angeles, California, United States of America; UCLA AIDS Institute, David Geffen School of Medicine, University of California Los Angeles, Los Angeles, California, United States of America","OAN and BL conceived and designed the experiments. OAN, MCW, SE, WW, and SVS performed the experiments and analyzed the data. OAN, HCA, EM, ABC, and RF contributed reagents/materials/analysis tools. OAN and BL wrote the paper.","The authors have declared that no competing interests exist."
"10.1371/journal.ppat.0020006","plos pathogens","2006-01-27T00:00:00Z","Nihal A Okan; James B Bliska; A Wali Karzai","Department of Biochemistry and Cell Biology, and Center for Infectious Diseases, Stony Brook University, Stony Brook, New York, United States of America; Department of Molecular Genetics and Microbiology, Stony Brook University, Stony Brook, New York, United States of America","NAO and AWK conceived and designed the experiments. NAO, JBB, and AWK performed the experiments. NAO, JBB, and AWK analyzed the data. NAO and AWK contributed reagents/materials/analysis tools. NAO and AWK wrote the paper.","The authors have declared that no competing interests exist."
"10.1371/journal.pgen.1004865","plos genetics","2014-12-11T00:00:00Z","Margarida L A Figueiredo; Maria Kim; Philge Philip; Anders Allgardsson; Per Stenberg; Jan Larsson","Department of Molecular Biology, Umeå University, Umeå, Sweden; Computational Life Science Cluster (CLiC), Umeå University, Umeå, Sweden","Conceived and designed the experiments: MLAF MK JL. Performed the experiments: MLAF MK. Analyzed the data: MLAF MK PP AA PS JL. Wrote the paper: MLAF MK PP PS JL.","The authors have declared that no competing interests exist."
"10.1371/journal.pgen.1004863","plos genetics","2014-12-11T00:00:00Z","Panojot Bifsha; Jianqi Yang; Rory A Fisher; Jacques Drouin","Laboratoire de Génétique Moléculaire, Institut de Recherches Cliniques de Montréal (IRCM) Montréal, Quebec, Canada; Division of Experimental Medicine, McGill University, Montréal, Quebec, Canada; Department of Pharmacology, University of Iowa Carver College of Medicine, Iowa City, Iowa, United States of America","Conceived and designed the experiments: PB JY RAF JD. Performed the experiments: PB JY. Analyzed the data: PB JY RAF JD. Contributed reagents/materials/analysis tools: PB JY RAF JD. Wrote the paper: PB JY RAF JD.","The authors have declared that no competing interests exist."
"10.1371/journal.ppat.0020003","plos pathogens","2006-01-27T00:00:00Z","Mickey Pentecost; Glen Otto; Julie A Theriot; Manuel R Amieva","Department of Microbiology and Immunology, Stanford University, Stanford, California, United States of America; Department of Comparative Medicine, Stanford University, Stanford, California, United States of America; Department of Biochemistry, Stanford University, Stanford, California, United States of America; Department of Pediatrics, Stanford University, Stanford, California, United States of America","MP, GO, JAT, and MRA conceived and designed the experiments. MP, GO, and MRA performed the experiments. MP, JAT, and MRA analyzed the data and wrote the manuscript. JAT and MRA contributed equally as senior authors.","The authors have declared that no competing interests exist."
"10.1371/journal.pbio.1001090","plos biology","2011-06-21T00:00:00Z","Sébastien Tauzin; Benjamin Chaigne-Delalande; Eric Selva; Nadine Khadra; Sophie Daburon; Cécile Contin-Bordes; Patrick Blanco; Jacques Le Seyec; Thomas Ducret; Laurent Counillon; Jean-François Moreau; Paul Hofman; Pierre Vacher; Patrick Legembre","Université de Rennes-1, Rennes, France; IRSET/EA-4427 SeRAIC, Rennes, France; CNRS UMR 5164, Bordeaux, France; Université de Bordeaux-2, Bordeaux, France; Université de Nice Sophia antipolis, INSERM ERI21/EA 4319, Nice, France; CHU Bordeaux, Bordeaux, France; INSERM U1045, Centre de Recherche Cardio-Thoracique de Bordeaux, Bordeaux, France; Université de Nice-Sophia Antipolis, UMR 6097 Faculté des Sciences Parc Valrose, Nice, France; CHU de Nice et Centre de Ressources Biologiques-Tumorothèque, Nice, France; INSERM U916, Institut Bergonié, Bordeaux, France","The author(s) have made the following declarations about their contributions: Conceived and designed the experiments: PL. Performed the experiments: ST BCD NK ES SD PV. Analyzed the data: ST BCD CCB PB PH PV PL. Contributed reagents/materials/analysis tools: CCB PB JLS TD LC. Wrote the paper: JFM PV PL.","The authors have declared that no competing interests exist."
"10.1371/journal.pgen.1004861","plos genetics","2014-12-04T00:00:00Z","Kahori Shiba-Fukushima; Taku Arano; Gen Matsumoto; Tsuyoshi Inoshita; Shigeharu Yoshida; Yasushi Ishihama; Kwon-Yul Ryu; Nobuyuki Nukina; Nobutaka Hattori; Yuzuru Imai","Department of Neurology, Juntendo University Graduate School of Medicine, Tokyo, Japan; Department of Research for Parkinson's Disease, Juntendo University Graduate School of Medicine, Tokyo, Japan; Department of Neuroscience for Neurodegenerative Disorders, Juntendo University Graduate School of Medicine, Tokyo, Japan; Department of Molecular and Cellular BioAnalysis, Graduate School of Pharmaceutical Sciences, Kyoto University, Kyoto, Japan; Department of Life Science, University of Seoul, Seoul, Korea","Conceived and designed the experiments: KSF YIm. Performed the experiments: KSF TA GM TI SY YIm. Analyzed the data: KSF TA GM TI SY YIs YIm. Contributed reagents/materials/analysis tools: KYR NN. Wrote the paper: NH YIm.","The authors have declared that no competing interests exist."
"10.1371/journal.pbio.1001089","plos biology","2011-06-21T00:00:00Z","Guido Biele; Jörg Rieskamp; Lea K Krugel; Hauke R Heekeren","Max Planck Institute for Human Development, Berlin, Germany; Center for the Study of Human Cognition, Department of Psychology, University of Oslo, Oslo, Norway; Department of Education and Psychology, Freie Universität Berlin, Berlin, Germany; Department of Psychology, University of Basel, Basel, Switzerland; Department of Neurology, Charité University Medicine Berlin, Berlin, Germany","The author(s) have made the following declarations about their contributions: Conceived and designed the experiments: GB JR HRH. Performed the experiments: GB LKK. Wrote the paper: GB JR LKK HRH. Performed fMRI analysis: GB HRH. Modeled behavioral data: GB JR.","The authors have declared that no competing interests exist."
"10.1371/journal.pbio.1001095","plos biology","2011-07-05T00:00:00Z","Patricia Julián; Pohl Milon; Xabier Agirrezabala; Gorka Lasso; David Gil; Marina V Rodnina; Mikel Valle","Structural Biology Unit, Center for Cooperative Research in Biosciences (CIC bioGUNE), Parque Tecnológico de Bizkaia, Derio, Spain; Department of Physical Biochemistry, Max Planck Institute for Biophysical Chemistry, Göttingen, Germany; Department of Biochemistry and Molecular Biology. Faculty of Science and Technology, University of the Basque Country, Bilbao, Spain","The author(s) have made the following declarations about their contributions: Conceived and designed the experiments: PJ PM MVR MV. Performed the experiments: PJ PM DG. Analyzed the data: PJ PM XA GL MVR MV. Wrote the paper: PJ PM MVR MV.","The authors have declared that no competing interests exist."
"10.1371/journal.pbio.1001107","plos biology","2011-07-19T00:00:00Z","Lauw J Klaassen; Ziyi Sun; Marvin N Steijaert; Petra Bolte; Iris Fahrenfort; Trijntje Sjoerdsma; Jan Klooster; Yvonne Claassen; Colleen R Shields; Huub M M Ten Eikelder; Ulrike Janssen-Bienhold; Georg Zoidl; Douglas G McMahon; Maarten Kamermans","Research Unit Retinal Signal Processing, The Netherlands Institute for Neuroscience, Amsterdam, The Netherlands; Department of Biological Sciences, Vanderbilt University, Nashville, Tennessee, United States of America; Department of Biomedical Engineering, Eindhoven University of Technology, The Netherlands; Department of Neurobiology, University of Oldenburg, Oldenburg, Germany; Department of Neurobiology and Behavior, SUNY at Stony Brook, Stony Brook, New York, United States of America; Department of Neuroanatomy and Molecular Brain Research, Ruhr University, Bochum, Germany; Department of Cytology, Ruhr University, Bochum, Germany; Department of Neurogenetics, Academic Medical Center, University of Amsterdam, Amsterdam, The Netherlands","The author(s) have made the following declarations about their contributions: Conceived and designed the experiments: MK DM GZ UJB HMMTE. Performed the experiments: LJK ZS MNS PB IF TS JK YC CS. Analyzed the data: LK ZS MNS PB IF TS JK YC CS MK GZ UJB. Wrote the paper: MK LK GZ UJB DM.","The authors have declared that no competing interests exist."
"10.1371/journal.pbio.1001106","plos biology","2011-07-19T00:00:00Z","Mally Dori-Bachash; Efrat Shema; Itay Tirosh","Department of Molecular Genetics, Weizmann Institute of Science, Rehovot, Israel; Department of Molecular Cell Biology, Weizmann Institute of Science, Rehovot, Israel","The author(s) have made the following declarations about their contributions: Conceived and designed the experiments: IT. Performed the experiments: MDB ES. Analyzed the data: IT. Wrote the paper: IT.","The authors have declared that no competing interests exist."
"10.1371/journal.pgen.1004877","plos genetics","2015-01-28T00:00:00Z","Olga Shakhova; Phil Cheng; Pravin J Mishra; Daniel Zingg; Simon M Schaefer; Julien Debbache; Jessica Häusel; Claudia Matter; Theresa Guo; Sean Davis; Paul Meltzer; Daniela Mihic-Probst; Holger Moch; Michael Wegner; Glenn Merlino; Mitchell P Levesque; Reinhard Dummer; Raffaella Santoro; Paolo Cinelli; Lukas Sommer","Cell and Developmental Biology, Institute of Anatomy, University of Zurich, Zurich, Switzerland; Department of Dermatology, University Hospital Zurich, Zurich, Switzerland; Laboratory of Cancer Biology and Genetics, National Cancer Institute, Bethesda, Maryland, United States of America; Department of Pathology, Institute of Surgical Pathology, University Hospital Zurich, Zurich, Switzerland; Institute of Biochemistry, Emil Fischer Center, FAU University of Erlangen-Nuernberg, Erlangen, Germany; Institute of Veterinary Biochemistry and Molecular Biology, University of Zurich, Zurich, Switzerland; Division of Trauma Surgery, Center for Clinical Research, University Hospital Zurich, Zurich, Switzerland; Department of Oncology, University Hospital Zurich, Schlieren, Switzerland","Conceived and designed the experiments: OS PCh RS GM LS. Performed the experiments: OS PCh DZ PJM CM TG SD PM SMS JD JH DMP PCi. Analyzed the data: OS PCh JD DMP PCi LS. Contributed reagents/materials/analysis tools: HM MW MPL RD RS. Wrote the paper: OS LS.","The authors have declared that no competing interests exist."
