"id","journal","publication_date","author","author_affiliate","author_notes","competing_interest"
"10.1371/journal.pone.0114153","plos one","2014-12-05T00:00:00Z","David R Warriner; Alistair G Brown; Susheel Varma; Paul J Sheridan; Patricia Lawford; David R Hose; Abdallah Al-Mohammad; Yubing Shi","Medical Physics Group, Department of Cardiovascular Science, University of Sheffield, Sheffield, S10 2TN, United Kingdom; Department of Cardiology, Northern General Hospital, Sheffield Teaching Hospitals, Sheffield, S5 7AU, United Kingdom","Conceived and designed the experiments: DW YS AB. Performed the experiments: DW YS AB. Analyzed the data: DW YS AB. Contributed reagents/materials/analysis tools: DH PL. Wrote the paper: DW YS AB PS AA PL DH SV.","The authors have declared that no competing interests exist."
"10.1371/journal.pone.0114152","plos one","2014-12-03T00:00:00Z","Anil R Mhashal; Sudip Roy","Physical Chemistry Division, National Chemical Laboratory, Dr. Homi Bhabha Road, Pune, 411008, India","Conceived and designed the experiments: SR ARM. Analyzed the data: ARM SR. Contributed reagents/materials/analysis tools: ARM SR. Wrote the paper: ARM SR. Performed simulation: ARM.","The authors have declared that no competing interests exist."
"10.1371/journal.pone.0012621","plos one","2010-09-07T00:00:00Z","Olga Yu Rybina; Elena G Pasyukova","Institute of Molecular Genetics of RAS, Moscow, Russia","Conceived and designed the experiments: OYR EGP. Performed the experiments: OYR. Analyzed the data: OYR EGP. Wrote the paper: OYR EGP.","The authors have declared that no competing interests exist."
"10.1371/journal.pone.0138127","plos one","2015-09-18T00:00:00Z","Minrong Ai; Holly Mills; Makoto Kanai; Jason Lai; Jingjing Deng; Eric Schreiter; Loren Looger; Thomas Neubert; Greg Suh","Department of Cell Biology, Skirball Institute of Biomolecular Medicine, New York University, School of Medicine, New York, New York, United States of America; Department of Biochemistry and Molecular Pharmacology, Skirball Institute of Biomolecular Medicine, New York University, School of Medicine, New York, New York, United States of America; Janelia Research Campus, Howard Hughes Medical Institute, Ashburn, VA, United States of America","Conceived and designed the experiments: MA GS. Performed the experiments: MA HM MK JL JD. Analyzed the data: MA HM. Contributed reagents/materials/analysis tools: MA GS ES LL JJ TN. Wrote the paper: MA HM LL GS.","A patent application for this work has been filed, Green-to-red photo-convertible fluorescent calcium indicator, application number 14/622,025. There are no further patents, products in development or marketed products to declare. This does not alter the authors' adherence to all the PLOS ONE policies on sharing data and materials, as detailed online in the guide for authors."
"10.1371/journal.pone.0114151","plos one","2014-12-05T00:00:00Z","Denise H Iunes; Carmélia B J Rocha; Nathália C S Borges; Caroline O Marcon; Valéria M Pereira; Leonardo C Carvalho","Federal University of Alfenas, Alfenas, Brazil; Health of the Municipal State of Alfenas, Alfenas, Brazil","Conceived and designed the experiments: DHI CBJR NCSB LCC. Performed the experiments: DHI CBJR NCSB COM VMP LCC. Analyzed the data: DHI NCSB COM LCC. Contributed reagents/materials/analysis tools: DHI CBJR VMP LCC. Wrote the paper: DHI CBJR LCC.","The authors have declared that no competing interests exist."
"10.1371/journal.pone.0012620","plos one","2010-09-07T00:00:00Z","Marc Kochzius; Christian Seidel; Aglaia Antoniou; Sandeep Kumar Botla; Daniel Campo; Alessia Cariani; Eva Garcia Vazquez; Janet Hauschild; Caroline Hervet; Sigridur Hjörleifsdottir; Gudmundur Hreggvidsson; Kristina Kappel; Monica Landi; Antonios Magoulas; Viggo Marteinsson; Manfred Nölte; Serge Planes; Fausto Tinti; Cemal Turan; Moleyur N Venugopal; Hannes Weber; Dietmar Blohm","Centre for Applied Gene Sensor Technology (CAG), FB2-UFT, University of Bremen, Bremen, Germany; Marine Biology, Free University of Brussels (VUB), Brussels, Belgium; Institute of Marine Biology and Genetics, Hellenic Centre of Marine Research, Heraklion, Crete, Greece; Department of Functional Biology, Universidad de Oviedo, Oviedo, Spain; Department of Experimental Evolutionary Biology, University of Bologna, Bologna, Italy; UMR 5244 CNRS-EPHE-UPVD, Université de Perpignan, Perpignan, France; Prokaria, Matis ohf, Reykjavik, Iceland; Faculty of Life and Environmental Sciences, University of Iceland, Reykjavík, Iceland; Zentrum für Technomathematik (ZeTeM), University of Bremen, Bremen, Germany; Faculty of Fisheries, Mustafa Kemal University, Iskenderun, Hatay, Turkey; College of Fisheries, Mangalore, Karnataka, India","Conceived and designed the experiments: MK DB. Performed the experiments: MK CS SKB JH SH GH VM MNV. Analyzed the data: MK CS JH MN HW. Contributed reagents/materials/analysis tools: MK AA DC AC EGV CH SH GH KK ML AM VM MN SP FT CT HW DB. Wrote the paper: MK AA AC SP FT DB.","The authors have declared that no competing interests exist."
"10.1371/journal.pone.0114154","plos one","2014-12-03T00:00:00Z","Sandra Tranquilli; Michael Abedi-Lartey; Katharine Abernethy; Fidèle Amsini; Augustus Asamoah; Cletus Balangtaa; Stephen Blake; Estelle Bouanga; Thomas Breuer; Terry M Brncic; Geneviève Campbell; Rebecca Chancellor; Colin A Chapman; Tim R B Davenport; Andrew Dunn; Jef Dupain; Atanga Ekobo; Manasseh Eno-Nku; Gilles Etoga; Takeshi Furuichi; Sylvain Gatti; Andrea Ghiurghi; Chie Hashimoto; John A Hart; Josephine Head; Martin Hega; Ilka Herbinger; Thurston C Hicks; Lars H Holbech; Bas Huijbregts; Hjalmar S Kühl; Inaoyom Imong; Stephane Le-Duc Yeno; Joshua Linder; Phil Marshall; Peter Minasoma Lero; David Morgan; Leonard Mubalama; Paul K N'Goran; Aaron Nicholas; Stuart Nixon; Emmanuelle Normand; Leonidas Nziguyimpa; Zacharie Nzooh-Dongmo; Richard Ofori-Amanfo; Babafemi G Ogunjemite; Charles-Albert Petre; Hugo J Rainey; Sebastien Regnaut; Orume Robinson; Aaron Rundus; Crickette M Sanz; David Tiku Okon; Angelique Todd; Ymke Warren; Volker Sommer","Department of Biological Anthropology, University College London, London, United Kingdom; Department of Migration and Immuno-Ecology, Max Planck Institute for Ornithology, Radolfzell, Germany; Department of Biology, University of Konstanz, Konstanz, Germany; African Forest Ecology Group, School of Natural Sciences, University of Stirling, Stirling, United Kingdom; IRET, Libreville, Gabon; Frankfurt Zoological Society, Maiko National Park, Tshopo, Democratic Republic of Congo; Environmental Sustainability Project, United Nations Development Programme/Ghana Cocoa Board, Adabraka, Accra, Ghana; Wildlife Division of Forestry Commission of Ghana, Ankasa Conservation Area, Elubo, Takoradi, Ghana; Wildlife Conservation Society, New York, United States of America; Whitney Harris World Ecology Center, University of Missouri – Saint Louis, Saint Louis, Missouri, United States of America; Ministère de la Forêt, de l'Environnement et de la Protection des Ressources Naturelles, Libreville, Gabon; Wildlife Conservation Society, Congo Program, Brazzaville, Republic of Congo; Tacugama Chimpanzee Sanctuary, Freetown, Sierra Leone; Independent Researcher, Montreal, Canada; Departments of Anthropology & Sociology, and Psychology, West Chester University, West Chester, Pennsylvania, United States of America; Department of Anthropology and McGill School of Environment, McGill University, Montréal, Québec, Canada; Wildlife Conservation Society, Tanzania Program, Zanzibar, Tanzania; Wildlife Conservation Society, Calabar, Nigeria; African Wildlife Foundation, Nairobi, Kenya; World Wide Fund for Nature, Limbe, Cameroon; World Wide Fund for Nature, Mount Cameroon NP, Limbe, Cameroon; World Wide Fund for Nature CARPO, Jengi Tridom, Yaundé, Cameroon; Primate Research Institute, Kyoto University, Kyoto, Japan; Support for Conservation of Bonobos, Luo Reserve, Democratic Republic of Congo; West African Primate Conservation Action, Accra, Ghana; Independent Researcher, Rome, Italy; Lukuru Wildlife Research Foundation, Kinshasa, Democratic Republic of Congo; Department of Primatology, Max Planck Institute for Evolutionary Anthropology, Leipzig, Germany; Wildlife Conservation Society, Monts de Cristal, Gabon; World Wide Fund for Nature, Berlin, Germany; Institute for Biodiversity and Ecosystem Dynamics, The University of Amsterdam, Amsterdam, The Netherlands; Department of Animal Biology and Conservation Science, University of Ghana, Legon, Accra, Ghana; World Wide Fund for Nature, Central Africa Regional Programme Office, Yaoundé, Cameroon; German Centre for Integrative Biodiversity Research, Leipzig, Germany; World Wide Fund for Nature, Gamba, Libreville, Gabon; Department of Sociology and Anthropology, James Madison University, Harrisonburg, Virginia, United States of America; North Eastern Parks Programme, Windhoek, Namibia; Directorate of Wildlife Service, Ministry of Interior and Wildlife Conservation, Juba, Republic of South Sudan; Lester E. Fisher Center for Great Ape Research, Lincoln Park Zoo, Chicago, Illinois, United States of America; World Wide Fund for Nature, Itombwe Conservation Programme, Bukavu, South Kivu Province, Eastern Democratic Republic of Congo; Centre Suisse de Recherches Scientifiques en Côte d’Ivoire, Abidjan, Côte d’Ivoire; Wildlife Conservation Society, Ruaha-Katavi Landscape, Tanzania; Zoological Society of London, London, United Kingdom; Wild Chimpanzee Foundation, Abidjan, Cote d’Ivoire; Institut National pour l'Environnement et la Conservation de la Nature, Bururi, Burundi; Bia Conservation Area, Sefwi Wiawso, Ghana; Department Ecotourism and Wildlife Management, Federal University of Technology, Akure, Nigeria; Laboratory of Tropical and Subtropical Forestry, Unit of Forest and Nature Management, Gembloux Agro-Bio Tech, University of Liège, Gembloux, Belgium; Education and Nature, Conservation Biology Unit, Royal Belgian Institute of Natural Sciences, Brussels, Belgium; International Union for Conservation of Nature, Protected Areas Program West and Central Africa, Ouagadougou, Burkina Faso; Ministry of Forestry and Wildlife, Korup National Park, Ndian, Cameroon; Department of Psychology, West Chester University, West Chester, Pennsylvania, United States of America; Department of Anthropology, Washington University, Saint Louis, Missouri, United States of America; World Wide Fund for Nature, Korup National Park, Limbe, Cameroon; World Wide Fund for Nature, Bangui, Central African Republic; Wildlife Conservation Society, Limbe, Cameroon","Conceived and designed the experiments: ST. Performed the experiments: ST. Analyzed the data: ST. Contributed reagents/materials/analysis tools: ST MA-L KA FA AA CB SB EB TB TMB GC RC CAC TRBD AD JD AE MEN GE TF SG AG CH JAH JH MH IH TCH LHH BH HSK II SL-DY JL PM PML DM LM PKN AN SN EN LN ZN-D RO-A BGO C-AP HJR SR OR AR CMS DTO AT YW VS. Wrote the paper: ST MA-L KA FA AA CB SB EB TB TMB GC RC CAC TRBD AD JD AE MEN GE TF SG AG CH JAH JH MH IH TCH LHH BH HSK II SL-DY JL PM PML DM LM PKN AN SN EN LN ZN-D RO-A BGO C-AP HJR SR OR AR CMS DTO AT YW VS.","The authors modified the affiliation of the two co-authors that are currently employed by commercial companies “SG Sustainable Oils Cameroon” and “AGRECO”. At the time of data collection, one of them was employed at the WWF and the other one was an independent researcher. Therefore, the authors changed their affiliation according to with whom they were affiliated at the time of the data collection. The authors confirm that this does not alter their adherence to PLOS ONE policies on sharing data and materials."
"10.1371/journal.pone.0012622","plos one","2010-09-07T00:00:00Z","Jenny Pena Dias; Sébastien Talbot; Jacques Sénécal; Pierre Carayon; Réjean Couture","Department of Physiology, Faculty of Medicine, Université de Montréal, Montréal, Québec, Canada; Sanofi-Aventis R&D, Montpellier, France","Conceived and designed the experiments: JPD PC RC. Performed the experiments: JPD ST JS. Analyzed the data: JPD ST JS. Contributed reagents/materials/analysis tools: PC. Wrote the paper: JPD RC.","Dr P. Carayon from Sanofi-Aventis R&D and Dr R. Couture from Université de Montréal hereby declare a duality of interest in view of their holding a patent made available to public in 2008 for the use of a non-peptide kinin B1 receptor antagonist in the treatment of hypertension (Publication No. 2916352). This does not alter adherence of these authors to all the PLoS ONE policies on sharing data and materials, as detailed online in the guide for authors. The other authors have nothing to disclose."
"10.1371/journal.pone.0091520","plos one","2014-03-13T00:00:00Z","Chad Smithson; Alex Purdy; Adrian J Verster; Chris Upton","Department of Biochemistry and Microbiology, University of Victoria, Victoria, British Columbia, Canada; Department of Molecular Genetics, University of Toronto, Toronto, Ontario, Canada","Conceived and designed the experiments: CU AJV. Performed the experiments: CS AJV. Analyzed the data: CU CS AJV. Contributed reagents/materials/analysis tools: AP. Wrote the paper: CU CS.","The authors have declared that no competing interests exist."
"10.1371/journal.pone.0080314","plos one","2013-11-26T00:00:00Z","Melissa A Merritt; Stefan Bentink; Matthew Schwede; Marcin P Iwanicki; John Quackenbush; Terri Woo; Elin S Agoston; Ferenc Reinhardt; Christopher P Crum; Ross S Berkowitz; Samuel C Mok; Abigail E Witt; Michelle A Jones; Bin Wang; Tan A Ince","Department of Biostatistics and Computational Biology, Dana-Farber Cancer Institute, Boston, Massachusetts, United States of America; Division of Gynecologic Oncology, Department of Obstetrics and Gynecology, Brigham and Women’s Hospital, Boston, Massachusetts, United States of America; Department of Epidemiology, Harvard School of Public Health, Boston, Massachusetts, United States of America; Department of Cell Biology, Harvard Medical School, Boston, Massachusetts, United States of America; Division of Women's and Perinatal Pathology, Department of Pathology, Brigham and Women’s Hospital, Boston, Massachusetts, United States of America; Department of Gynecologic Oncology, University of Texas MD Anderson Cancer Center, Houston, Texas, United States of America; Department of Pathology, Interdisciplinary Stem Cell Institute and Braman Family Breast Cancer Institute, Miller School of Medicine, University of Miami, Miami, Florida, United States of America","Conceived and designed the experiments: MAM SB MS MPI JQ TAI. Performed the experiments: MAM SB MS MPI TW ESA FR SCM AEW MAJ BW TAI. Analyzed the data: MAM SB MS JQ TAI. Contributed reagents/materials/analysis tools: MAM SB MS MPI JQ FR CPC RSB SCM TAI. Wrote the paper: MAM TAI. Edited the manuscript: MAM SB MS MPI JQ TW ESA FR CPC RSB SCM AEW MAJ BW TAI.","The authors have read the journal's policy and TAI has the following conflicts: intellectual proprietary interest as the inventor of WIT media. The other authors have no conflicts of interest to disclose. This does not alter the authors' adherence to all of the PLOS ONE policies on sharing data and materials."
"10.1371/journal.pone.0148580","plos one","2016-02-04T00:00:00Z","Fabian Feiersinger; Elke Nolte; Sven Wach; Tilman T Rau; Nikolaos Vassos; Carol Geppert; Andreas Konrad; Susanne Merkel; Helge Taubert; Michael Stürzl; Roland S Croner","Division of Molecular & Experimental Surgery, Clinic of Surgery, Friedrich-Alexander- Universität Erlangen-Nürnberg, Schwabachanlage 12, 91054, Erlangen, Germany; Clinic of Urology, Friedrich-Alexander-Universität Erlangen-Nürnberg, Krankenhausstr. 12, 91054, Erlangen, Germany; Department of Pathology, Friedrich-Alexander-Universität Erlangen-Nürnberg, Krankenhausstr. 12, 91054, Erlangen, Germany; Clinic of Surgery, Friedrich-Alexander-Universität Erlangen-Nürnberg, Krankenhausstr. 12, 91054, Erlangen, Germany","Conceived and designed the experiments: FF HT RSC MS. Performed the experiments: FF EN SW TTR NV CG AK MS. Analyzed the data: FF EN SW TTR CG AK SM MS RSC. Contributed reagents/materials/analysis tools: FF EN SW TTR NV CG AK MS HT. Wrote the paper: FF MS RSC HT.","The authors have declared that no competing interests exist."
"10.1371/journal.pone.0034677","plos one","2012-04-02T00:00:00Z","Jeomil Bae; Bong Hwan Sung; In Ha Cho; Seon-Myung Kim; Woo Keun Song","Cell Dynamics and Bioimaging Research Center, School of Life Sciences, Gwangju Institute of Science and Technology, Gwangju, Korea; Department of Cancer Biology, Vanderbilt University Medical Center, Nashville, Tennessee, United States of America; Department of Cell Biology and Neurology, Center for Neurodegenerative Diseases, Emory University School of Medicine, Atlanta, Georgia, United States of America","Conceived and designed the experiments: JB BHS WKS. Performed the experiments: JB BHS IHC SMK. Analyzed the data: JB. Contributed reagents/materials/analysis tools: JB BHS IHC SMK. Wrote the paper: JB WKS.","The authors have declared that no competing interests exist."
"10.1371/journal.pone.0046047","plos one","2012-10-31T00:00:00Z","Anna Lavender; Helen Startup; Ulrike Naumann; Nelum Samarawickrema; Hannah DeJong; Martha Kenyon; Frederique van den Eynde; Ulrike Schmidt","Eating Disorders Service, South London and Maudsley NHS Foundation Trust, Maudsley Hospital, London, United Kingdom; Department of Biostatistics and Computing, Institute of Psychiatry, King's College London, London, United Kingdom; Section of Eating Disorders, Department of Psychological Medicine, Institute of Psychiatry, King's College London, London, United Kingdom","Conceived and designed the experiments: AL HS US. Performed the experiments: AL HS FvD. Analyzed the data: UN. Wrote the paper: AL HS MK UN US. Helped to collect and collate data and administer study: NS HdJ MK.","The authors have declared that no competing interests exist."
"10.1371/journal.pone.0126962","plos one","2015-05-11T00:00:00Z","Fen-Guo Zhang; Quan-Guo Zhang","State Key Laboratory of Earth Surface Processes and Resource Ecology and MOE Key Laboratory for Biodiversity Science and Ecological Engineering, Beijing Normal University, Beijing, China","Conceived and designed the experiments: FGZ QGZ. Performed the experiments: FGZ. Analyzed the data: FGZ QGZ. Contributed reagents/materials/analysis tools: FGZ QGZ. Wrote the paper: FGZ QGZ.","The authors have declared that no competing interests exist."
"10.1371/journal.pone.0114159","plos one","2014-12-04T00:00:00Z","Maria Domina; Veronica Lanza Cariccio; Salvatore Benfatto; Deborah D'Aliberti; Mario Venza; Erica Borgogni; Flora Castellino; Carmelo Biondo; Daniel D'Andrea; Luigi Grassi; Anna Tramontano; Giuseppe Teti; Franco Felici; Concetta Beninati","SPGMB Department, University of Messina, Messina, Italy; SSMCSO Department, University of Messina, Messina, Italy; Novartis Vaccines and Diagnostics, Siena, Italy; Department of Physics, Sapienza University, Rome, Italy; Charybdis Vaccines Srl, Messina, Italy; Department of Biosciences and Territory, University of Molise, Pesche, Isernia, Italy","Conceived and designed the experiments: GT C. Beninati FF. Performed the experiments: MD VLC SB D. D'Aliberti MV EB. Analyzed the data: C. Beninati GT FF MV FC AT D. D'Andrea LG SB. Contributed reagents/materials/analysis tools: AT EB FC LG D. D'Andrea. Wrote the paper: GT C. Beninati C. Biondo FF. Developed the software used in analysis: AT D. D'Andrea LG SB.","G. Teti and C. Beninati own Charybdis Vaccines Srl, a spin-off of the University of Messina that has filed a patent application (RM2014A000185) on the PROFILER technology. E. Borgogni and F. Castellino are full-time employees of Novartis Vaccines and Diagnostics. This does not alter our adherence to PLOS ONE policies on sharing data and materials. The other authors declare no competing financial interests."
"10.1371/journal.pone.0034682","plos one","2012-06-07T00:00:00Z","Heike Hadrys; Sabrina Simon; Barbara Kaune; Oliver Schmitt; Anja Schöner; Wolfgang Jakob; Bernd Schierwater","ITZ, Division of Ecology and Evolution, Stiftung Tieraerztliche Hochschule Hannover, Hannover, Germany; Dept. of Ecology and Evolutionary Biology, Yale University, New Haven, Connecticut, United States of America; American Museum of Natural History, New York City, New York, United States of America","Conceived and designed the experiments: HH BS. Performed the experiments: BK OS AS WJ. Analyzed the data: HH SS WJ BS. Contributed reagents/materials/analysis tools: HH. Wrote the paper: HH BS.","The authors have declared that no competing interests exist."
"10.1371/journal.pone.0114156","plos one","2014-12-03T00:00:00Z","Tara M Stanne; Anna Tjärnlund-Wolf; Sandra Olsson; Katarina Jood; Christian Blomstrand; Christina Jern","Institute of Biomedicine, Section for Clinical Genetics, the Sahlgrenska Academy at University of Gothenburg, Gothenburg, Sweden; Institute of Neuroscience and Physiology, Section for Clinical Neuroscience and Rehabilitation, the Sahlgrenska Academy at University of Gothenburg, Gothenburg, Sweden","Conceived and designed the experiments: TMS AT SO KJ CB CJ. Analyzed the data: TMS AT SO. Contributed reagents/materials/analysis tools: KJ CB CJ. Wrote the paper: TMS AT SO CJ.","The authors have declared that no competing interests exist."
"10.1371/journal.pone.0046048","none","2012-09-27T00:00:00Z","Eric T Beck; Jie He; Martha I Nelson; Michael E Bose; Jiang Fan; Swati Kumar; Kelly J Henrickson","Midwest Respiratory Virus Program, Department of Pediatrics, Medical College of Wisconsin, Milwaukee, Wisconsin, United States of America; Children's Research Institute, Children's Hospital of Wisconsin, Milwaukee, Wisconsin, United States of America; Fogarty International Center, National Institutes of Health, Bethesda, Maryland, United States of America","Conceived and designed the experiments: JH KJH. Performed the experiments: JH. Analyzed the data: ETB JH MIN MEB. Contributed reagents/materials/analysis tools: ETB JH MIN JF SK. Wrote the paper: ETB JH. Edited the manuscript: ETB JH MIN MEB JF SK KJH.","The authors have declared that no competing interests exist."
"10.1371/journal.pone.0034678","plos one","2012-03-30T00:00:00Z","Olivier Pays; Daniel Fortin; Jean Gassani; Jean Duchesne","Groupe Ecologie et Conservation, Université d'Angers, Angers, France; Centre de Recherche et Formation en Eco-Ethologie, Université de Reims, Boult-aux-Bois, France; Comportement et Ecologie de la Faune Sauvage, Institut National de Recherche Agronomique, Castanet-Tolosan, France; Département de biologie, Université Laval, Québec, Canada; Université de Djibouti, Djibouti, République de Djibouti; Unité de recherche Paysage, Agrocampus Ouest, Angers, France","Conceived and designed the experiments: OP. Performed the experiments: OP. Analyzed the data: OP DF. Wrote the paper: OP DF. Extracted landscape features from ARC GIS: JG JD.","The authors have declared that no competing interests exist."
"10.1371/journal.pone.0148579","plos one","2016-02-05T00:00:00Z","Joshua G X Wong; Tun Linn Thein; Yee-Sin Leo; Junxiong Pang; David C Lye","Institute of Infectious Disease and Epidemiology, Tan Tock Seng Hospital, Singapore, Singapore; Department of Clinical Epidemiology, Tan Tock Seng Hospital, Singapore, Singapore; Lee Kong Chian School of Medicine, Nanyang Technological University, Singapore, Singapore; Saw Swee Hock School of Public Health, National University of Singapore, Singapore, Singapore; Yong Loo Lin School of Medicine, National University of Singapore, Singapore, Singapore","Conceived and designed the experiments: YSL DCL. Performed the experiments: TLT YSL DCL. Analyzed the data: JGW. Contributed reagents/materials/analysis tools: TLT YSL DCL. Wrote the paper: JGW TLT YSL JXP DCL.","The authors have declared that no competing interests exist."
"10.1371/journal.pone.0080313","plos one","2013-11-25T00:00:00Z","Ewa Kotula; Wolfgang Faigle; Nathalie Berthault; Florent Dingli; Damarys Loew; Jian-Sheng Sun; Marie Dutreix; Maria Quanz","Institut Curie, Centre National de Recherche Scientifique (CNRS) UMR3347, Institut National de la Santé et de Recherche Médicale (INSERM) U1021, Université Paris-Sud 11, Centre Universitaire, Orsay, France; DNA Therapeutics, Evry, France; Institut Curie, Centre de Recherche, Laboratory of Proteomic Mass Spectrometry, Paris, France; University Hospital Zürich, Department of Clinical Neuroimmunology and MS Research, Paris, France; Muséum National d’Histoire Naturelle, USM503, Paris, France","Conceived and designed the experiments: MD JSS MQ. Performed the experiments: EK MQ NB WF FD. Analyzed the data: EK WF MD MQ. Contributed reagents/materials/analysis tools: DL JSS. Wrote the paper: EK MD MQ. Developed the mass spectrometry analysis: WF FD DL.","E. Kotula is a recipient of a PhD fellowship cofinanced by DNA Therapeutics and M. Quanz is an employee of DNA Therapeutics. M. Dutreix and J-S. Sun are cofounders of DNA Therapeutics, the company holding the patent for the clinical use of Dbait32Hc. This does not alter the authors' adherence to all the PLOS ONE policies on sharing data and materials."
