"id","journal","publication_date","author","author_affiliate","author_notes","competing_interest"
"10.1371/journal.pone.0110315","plos one","2014-10-14T00:00:00Z","Chia-Ter Chao; Szu-Ying Lee; Wei-Shun Yang; Huei-Wen Chen; Cheng-Chung Fang; Chung-Jen Yen; Chih-Kang Chiang; Kuan-Yu Hung; Jenq-Wen Huang","Division of Nephrology, Department of Internal Medicine, National Taiwan University Hospital Jin-Shan Branch, New Taipei City, Taiwan; Graduate Institute of Toxicology, National Taiwan University, Taipei, Taiwan; Division of Nephrology, Department of Internal Medicine, National Taiwan University Hospital Yun-Lin Branch, Yun-Lin County, Taiwan; Division of Nephrology, Department of Internal Medicine, National Taiwan University Hospital Hsin-Chu Branch, Hsin-Chu County, Taiwan; Division of Nephrology, Department of Internal Medicine, National Taiwan University Hospital, Taipei, Taiwan; Department of Emergency Medicine, National Taiwan University Hospital, Taipei, Taiwan; Department of Geriatrics and Gerontology, National Taiwan University Hospital, Taipei, Taiwan; Department of Integrative diagnostics and Therapeutics, National Taiwan University Hospital, Taipei, Taiwan","Conceived and designed the experiments: CTC JWH. Performed the experiments: CTC SYL WSY HWC CCF CJY CKC KYH JWH. Analyzed the data: CTC SYL WSY HWC CCF CJY CKC KYH JWH. Contributed reagents/materials/analysis tools: CTC JWH. Wrote the paper: CTC SYL WSY HWC CCF CJY CKC KYH JWH.","The authors have declared that no competing interests exist."
"10.1371/journal.pone.0121947","plos one","2015-03-27T00:00:00Z","Erdembileg Anuurad; Annie Mirsoian; Byambaa Enkhmaa; Wei Zhang; Laurel A Beckett; William J Murphy; Lars F Berglund","Department of Medicine, University of California Davis, Davis, CA, United States of America; Department of Dermatology University of California Davis, Davis, CA, United States of America; Department of Public Health Sciences, University of California Davis, Davis, CA, United States of America; The VA Northern California Health Care System, Sacramento, CA, United States of America","Conceived and designed the experiments: AE AM BE WJM LFB. Performed the experiments: AE AM BE WZ WJM LFB. Analyzed the data: AE BE LAB WJM LFB. Contributed reagents/materials/analysis tools: AE AM BE WZ WJM. Wrote the paper: AE AM BE LAB WJM LFB.","The authors have declared that no competing interests exist."
"10.1371/journal.pone.0110313","plos one","2014-10-22T00:00:00Z","Yan Yang; Chuang Wen; Shuli Wang; Yuqing Feng","Jiangsu Key Laboratory of Oil-Gas Storage and Transportation Technology, Changzhou University, Changzhou, Jiangsu Province, China; Computational Informatics, Commonwealth Scientific and Industrial Research Organization, Melbourne, The State of Victoria, Australia","Conceived and designed the experiments: CW YY. Performed the experiments: CW YY. Analyzed the data: CW YY. Contributed reagents/materials/analysis tools: CW YY. Wrote the paper: CW YY. Revised the manuscript: CW YY SW YF.","The authors have declared that no competing interests exist."
"10.1371/journal.pone.0098903","plos one","2014-07-14T00:00:00Z","Hanen Sellami; Abir Znazen; Afifa Sellami; Hela Mnif; Nour Louati; Soumaya Ben Zarrouk; Leila Keskes; Tarek Rebai; Radhouane Gdoura; Adnene Hammami","Department of Microbiology and research laboratory “Microorganismes et Pathologies Humaines”, Habib Bourguiba University Hospital of Sfax, Sfax, Tunisia; Histology Embryology Research Unit, Faculty of Medicine of Sfax, University of Sfax, Sfax, Tunisia; Sfax Regional Center of Blood Transfusion, Sfax, Tunisia; Unit Research of Toxicology-Microbiology Environmental and Health, Sciences Faculty of Sfax, University of Sfax, Sfax, Tunisia","Conceived and designed the experiments: HS AZ RG AS. Performed the experiments: HS SB AZ HM NL. Analyzed the data: HS AZ RG AS HM. Contributed reagents/materials/analysis tools: HM TR AH LK. Wrote the paper: HS AZ RG AS. Contributed to specimens collection: LK.","No competing interests to declare."
"10.1371/journal.pone.0030094","plos one","2012-02-02T00:00:00Z","Longhui Cao; Scott Silvestry; Ning Zhao; James Diehl; Jianzhong Sun","Department of Anesthesiology, Jefferson Medical College, Thomas Jefferson University, Philadelphia, Pennsylvania, United States of America; Division of Cardiothoracic Surgery, Jefferson Medical College, Thomas Jefferson University, Philadelphia, Pennsylvania, United States of America; Anesthesiology Department, Sun Yat-Sen University Cancer Center, Guangzhou, People's Republic of China; Department of Psychiatry, University of Pennsylvania Health System, Philadelphia, Pennsylvania, United States of America","Conceived and designed the experiments: LC SS JD JS. Performed the experiments: LC JS. Analyzed the data: LC NZ JS. Contributed reagents/materials/analysis tools: SS JD JS. Wrote the paper: LC SS JD JS.","The authors have declared that no competing interests exist."
"10.1371/journal.pone.0110309","plos one","2014-10-13T00:00:00Z","Stefan Markun; Barbara M Holzer; Roksana Rodak; Vladimir Kaplan; Claudia C Wagner; Edouard Battegay; Lukas Zimmerli","Division of Internal Medicine, University Hospital Zurich, Zurich, Switzerland; Institute of General Practice and Health Service Research, University of Zurich, University Hospital of Zurich, Zurich, Switzerland; Center of Competence Multimorbidity, University of Zurich, Zurich, Switzerland; University Research Priority Program Dynamics of Healthy Aging, University of Zurich, Zurich, Switzerland","Conceived and designed the experiments: SM RR VK EB. Performed the experiments: SM RR VK CW. Analyzed the data: SM BMH CW LZ. Contributed to the writing of the manuscript: SM BMH VK EB LZ.","The authors have declared that no competing interests exist."
"10.1371/journal.pone.0076055","plos one","2013-10-15T00:00:00Z","Zhijun Zhang; Sandra Almeida; Yubing Lu; Agnes L Nishimura; Lingtao Peng; Danqiong Sun; Bei Wu; Anna M Karydas; Maria C Tartaglia; Jamie C Fong; Bruce L Miller; Robert V Farese; Melissa J Moore; Christopher E Shaw; Fen-Biao Gao","Department of Neurology, University of Massachusetts Medical School, Worcester, Massachusetts, United States of America; Department of Clinical Neuroscience, Institute of Psychiatry, London, United Kingdom; Department of Biological Chemistry and Molecular Pharmacology, University of Massachusetts Medical School, Worcester, Massachusetts, United States of America; Howard Hughes Medical Institute, Worcester, Massachusetts, United States of America; Gladstone Institute of Cardiovascular Disease, San Francisco, California, United States of America; Center for Neurologic Diseases, Harvard Medical School, Boston, Massachusetts, United States of America; Memory and Aging Center, Department of Neurology, University of California San Francisco, San Francisco, California, United States of America; Departments of Medicine and Biochemistry and Biophysics, University of California San Francisco, San Francisco, California, United States of America","Conceived and designed the experiments: FBG ZZ SA. Performed the experiments: ZZ SA YL ALN LP DS BW. Analyzed the data: FBG ZZ SA YL LP BW MJM. Contributed reagents/materials/analysis tools: AMK MCT JCF BLM. Wrote the paper: FBG ZZ SA YL ALN CES RVF.","The authors have declared that no competing interests exist."
"10.1371/journal.pone.0030097","plos one","2012-01-11T00:00:00Z","Lin An; Xiwen Zhao; Jian Wu; Jianguo Jia; Yunzeng Zou; Xizhi Guo; Lin He; Hongxin Zhu","Bio-X Institutes, Key Laboratory for the Genetics of Developmental and Neuropsychiatric Disorders, Ministry of Education, Shanghai Jiao Tong University, Shanghai, China; Institutes of Biomedical Sciences, Fudan University, Shanghai, China","Conceived and designed the experiments: LH HZ. Performed the experiments: LA XZ JW JJ HZ. Analyzed the data: LA XZ HZ. Contributed reagents/materials/analysis tools: YZ XG. Wrote the paper: LA XZ HZ.","The authors have declared that no competing interests exist."
"10.1371/journal.pone.0030096","plos one","2012-01-10T00:00:00Z","Kate Birnie; Yoav Ben-Shlomo; Jeff M P Holly; David Gunnell; Shah Ebrahim; Antony Bayer; John Gallacher; Richard M Martin","School of Social and Community Medicine, University of Bristol, Bristol, United Kingdom; School of Clinical Sciences, University of Bristol, Bristol, United Kingdom; London School of Hygiene & Tropical Medicine, London, United Kingdom; School of Medicine, Cardiff University, Cardiff, United Kingdom","Conceived and designed the experiments: RM YB-S DG JH JG AB SE. Performed the experiments: RM YB-S DG JH JG AB. Analyzed the data: KB. Contributed reagents/materials/analysis tools: JH. Wrote the paper: KB.","The authors have declared that no competing interests exist."
"10.1371/journal.pone.0110308","plos one","2014-10-23T00:00:00Z","Mai Lan Kranitz; Edward Biffin; Alexandra Clark; Michelle L Hollingsworth; Markus Ruhsam; Martin F Gardner; Philip Thomas; Robert R Mill; Richard A Ennos; Myriam Gaudeul; Andrew J Lowe; Peter M Hollingsworth","Royal Botanic Garden Edinburgh, Edinburgh, United Kingdom; University of Edinburgh, Institute of Evolutionary Biology, Edinburgh, United Kingdom; UMR CNRS MNHN UPMC EPHE 7205 Institut de Systématique, Evolution, Biodiversité, Muséum National d'Histoire Naturelle, Paris, France; Australian Centre for Evolutionary Biology and Biodiversity, Environment Institute, School of Earth and Environmental Science, University of Adelaide, Adelaide, Australia","Conceived and designed the experiments: PMH RAE MK. Performed the experiments: MK AC MLH EB. Analyzed the data: MK EB PMH. Contributed reagents/materials/analysis tools: MK AC MLH RAE MFG MG PT RRM AJL. Wrote the paper: EB PMH MR RRM.","The authors have declared that no competing interests exist."
"10.1371/journal.pone.0110318","plos one","2014-10-21T00:00:00Z","Yi-Fu Hou; Zhan-Li Sun; Yan-Wen Chong; Chun-Hou Zheng","College of Electrical Engineering and Automation, Anhui University, Hefei, China; State Key Laboratory for Information Engineering in Surveying, Mapping and Remote Sensing, Wuhan University, Wuhan, China","No. Conceived and designed the experiments: YFH CHZ. Performed the experiments: YFH ZLS. Analyzed the data: YFH YWC. Contributed reagents/materials/analysis tools: YWC CHZ. Wrote the paper: YFH CHZ.","The authors have declared that no competing interests exist."
"10.1371/journal.pone.0006983","plos one","2009-09-10T00:00:00Z","Maria Antonietta Costa; Carney Matheson; Lucia Iachetta; Agustín Llagostera; Otto Appenzeller","Instituto Investigaciones Arqueológicas y Museo, Universidad Católica del Norte, San Pedro de Atacama, Chile; Paleo-DNA Research, Lakehead University, Thunder Bay, Ontario, Canada; Department of Anthropology, The University of Western Ontario, London, Ontario, Canada; New Mexico Health Enhancement and Marathon Clinics Research Foundation, Albuquerque, New Mexico, United States of America","Conceived and designed the experiments: MAC CDM LI OA. Performed the experiments: CDM LI OA. Analyzed the data: CDM LI OA. Contributed reagents/materials/analysis tools: MAC CDM LI AL. Wrote the paper: OA. Wrote Spanish version of part of the paper: MAC. Reviewed the manuscript: CDM LI AL. Wrote technical part of manuscript: CDM. Contributed to Spanish version of the manuscript: AL.","The authors have declared that no competing interests exist."
"10.1371/journal.pone.0087509","plos one","2014-01-28T00:00:00Z","Alison Pischedda; Michael P Shahandeh; Wesley G Cochrane; Veronica A Cochrane; Thomas L Turner","Department of Ecology, Evolution and Marine Biology, University of California Santa Barbara, Santa Barbara, California, United States of America; Department of Cell and Developmental Biology, Oregon Health and Science University, Portland, Oregon, United States of America","Conceived and designed the experiments: AP TLT. Performed the experiments: AP MPS WGC VAC. Analyzed the data: AP. Wrote the paper: AP TLT.","The authors have declared that no competing interests exist."
"10.1371/journal.pone.0006971","plos one","2009-09-11T00:00:00Z","Archana Shenoy; Robert Blelloch","The Eli and Edythe Broad Center of Regeneration Medicine and Stem Cell Research, Center for Reproductive Sciences, and Department of Urology, University of California San Francisco, San Francisco, California, United States of America","Conceived and designed the experiments: AS RB. Performed the experiments: AS. Analyzed the data: AS RB. Wrote the paper: AS RB.","The authors have declared that no competing interests exist."
"10.1371/journal.pone.0110306","plos one","2014-10-20T00:00:00Z","Rahima Zennadi","Division of Hematology and Duke Comprehensive Sickle Cell Center, Department of Medicine, Duke University Medical Center, Durham, North Carolina, United States of America","Conceived and designed the experiments: RZ. Performed the experiments: RZ. Analyzed the data: RZ. Contributed to the writing of the manuscript: RZ.","The author has declared that no competing interests exist."
"10.1371/journal.pone.0030089","plos one","2012-01-17T00:00:00Z","Kati Juuti-Uusitalo; Hanna Vaajasaari; Tuomas Ryhänen; Susanna Narkilahti; Riitta Suuronen; Eliisa Mannermaa; Kai Kaarniranta; Heli Skottman","The Institute of Biomedical Technology, University of Tampere, Tampere, Finland; Department of Ophthalmology, Institute of Clinical Medicine, University of Eastern Finland, Kuopio, Finland; Department of Eye, Ear, and Oral Diseases, Tampere University Hospital, Tampere, Finland; Department of Biomaterial Engineering, Tampere University of Technology, Tampere, Finland; Department of Ophthalmology, Kuopio University Hospital, Kuopio, Finland","Conceived and designed the experiments: KJ-U HV KK HS. Performed the experiments: KJ-U HV TR. Analyzed the data: KJ-U HV. Contributed reagents/materials/analysis tools: EM. Wrote the paper: KJ-U HV KK. Acquired the funding: KJ-U HS KK SN RS.","The authors have declared that no competing interests exist."
"10.1371/journal.pone.0064443","plos one","2013-05-16T00:00:00Z","Cristiana C Garcia; Wynne Weston-Davies; Remo C Russo; Luciana P Tavares; Milene A Rachid; José C Alves-Filho; Alexandre V Machado; Bernhard Ryffel; Miles A Nunn; Mauro M Teixeira","Laboratório de Imunofarmacologia, Departamento de Bioquímica e Imunologia, ICB, Universidade Federal de Minas Gerais, Belo Horizonte, Minas Gerais, Brazil; Varleigh Ltd, London, United Kingdom; Departamento de Fisiologia e Biofísica, ICB, Universidade Federal de Minas Gerais, Belo Horizonte, Minas Gerais, Brazil; Departamento de Patologia Geral, ICB, Universidade Federal de Minas Gerais, Belo Horizonte, Minas Gerais, Brazil; Departamento de Farmacologia, Faculdade de Medicina de Ribeirão Preto, Universidade de São Paulo, Ribeirão Preto, São Paulo, Brazil; Centro de Pesquisas René Rachou, Fundação Oswaldo Cruz, Belo Horizonte, Minas Gerais, Brazil; CNRS UMR7355, CNRS and University Orleans, France and IIDMM, University of Cape Town, Cape Town, South Africa; Centre for Ecology and Hydrology, Wallingford, United Kingdom","Conceived and designed the experiments: CCG WW RCR BR MN MMT. Performed the experiments: CCG RCR LPT MAR AVM JCAF. Analyzed the data: CCG RCR LPT MAR. Contributed reagents/materials/analysis tools: WW AVM MN BR JCAF. Wrote the paper: CCG WW MN MMT.","The authors have the following interests. The author Dr. Wynne Weston-Davies is the Medical Director of Varleigh Ltd, the company that developed and supplied the C5a inhibitor, OmCI or coversin, used in this study. Co-authors Jose Carlos Alves-Filho and Bernhard Ryffel are PLOS ONE Editorial Board members. There are no further patents, products in development, or marketed products to declare. This does not alter the authors' adherence to all the PLOS ONE policies on sharing data and materials."
"10.1371/journal.pone.0110255","plos one","2014-10-13T00:00:00Z","Tiffany-Jane Evans; Elizabeth Milne; Denise Anderson; Nicholas H de Klerk; Sarra E Jamieson; Bente A Talseth-Palmer; Nikola A Bowden; Elizabeth G Holliday; Jérémie Rudant; Laurent Orsi; Ebony Richardson; Laura Lavis; Daniel Catchpoole; John R Attia; Bruce K Armstrong; Jacqueline Clavel; Rodney J Scott","Centre for Bioinformatics, Biomarker Discovery and Information-Based Medicine, Hunter Medical Research Institute, Newcastle, New South Wales, Australia; School of Biomedical Sciences and Pharmacy, University of Newcastle, Newcastle, New South Wales, Australia; Telethon Kids Institute, The University of Western Australia, Perth, Western Australia, Australia; Centre for Clinical Epidemiology and Biostatistics, School of Medicine and Public Health, University of Newcastle, Newcastle, New South Wales, Australia; INSERM, U1018, Department of Environmental Epidemiology of Cancers, Villejuif, France; Paris-Sud University, UMR-S1018, Department of Environmental Epidemiology of Cancers, Research Center in Epidemiology and Population Health, Villejuif, France; French National Registry of Childhood Blood Malignancies (RNHE), Villejuif, France; The Tumour Bank, The Children’s Cancer Research Unit, The Children’s Hospital Westmead, Westmead, New South Wales, Australia; Department of Medicine, John Hunter Hospital and Hunter Medical Research Institute, New Lambton, New South Wales, Australia; School of Public Health, The University of Sydney and Sax Institute, Sydney, New South Wales, Australia; Molecular Genetics, Hunter Area Pathology Service, Newcastle, New South Wales, Australia","Conceived and designed the experiments: RJS JRA EM BKA DC. Performed the experiments: T-JE DA SJ JR LO ER LL. Analyzed the data: T-JE NdK SJ EGH JC EM JRA. Contributed reagents/materials/analysis tools: BAT-P NAB LO JR DA EM NdK RJS. Contributed to the writing of the manuscript: T-JE EM NdK BAT-P NAB EGH DC JRA BKA JC RJS.","RJS is a PLOS ONE Editorial Board member. This does not alter our adherence to PLOS ONE Editorial policies and criteria."
"10.1371/journal.pone.0075987","plos one","2013-10-14T00:00:00Z","Sotiris Plainis; Dionysia Petratou; Trisevgeni Giannakopoulou; Hema Radhakrishnan; Ioannis G Pallikaris; W Neil Charman","Institute of Vision & Optics (IVO), University of Crete, Heraklion, Greece; Faculty of Life Sciences, The University of Manchester, Manchester, United Kingdom","Conceived and designed the experiments: SP HR WNC. Performed the experiments: SP TG DP. Analyzed the data: SP TG DP WNC. Wrote the paper: SP HR WNC IJP.","IG Pallikaris is the medical director of the Flexivue Corneal Inlay (Presbia) (nonfinancial competing interest). This does not alter the authors' adherence to all the PLOS ONE policies on sharing data and materials."
"10.1371/journal.pone.0133387","plos one","2015-07-23T00:00:00Z","Mathilde de Taffin; Yannick Carrier; Laurence Dubois; Laetitia Bataillé; Anaïs Painset; Stéphanie Le Gras; Bernard Jost; Michèle Crozatier; Alain Vincent","Centre de Biologie du Développement, UMR 5547 CNRS Université de Toulouse 3, 118 route de Narbonne, F-31062, Toulouse cedex 09, France; Plate-forme bio-informatique Genotoul/MIA-T, INRA, Borde Rouge, 31326, Castanet-Tolosan, France; Institut de Génétique et de Biologie Moléculaire et Cellulaire, CNRS/INSERM/Université de Strasbourg, 67404, Illkirch, France","Conceived and designed the experiments: MdT YC AV. Performed the experiments: MdT YC LB LD SLG. Analyzed the data: MdT YC AP SLG BJ AV. Contributed reagents/materials/analysis tools: MC. Wrote the paper: AV.","The authors have declared that no competing interests exist."
"10.1371/journal.pone.0041388","plos one","2012-07-23T00:00:00Z","Susan J van Dijk; Marco Mensink; Diederik Esser; Edith J M Feskens; Michael Müller; Lydia A Afman","Division of Human Nutrition, Wageningen University, Wageningen, The Netherlands; Netherlands Nutrigenomics Centre, TI Food and Nutrition, Wageningen, The Netherlands","Conceived and designed the experiments: SJD MM DE EJM MM LA. Performed the experiments: SJD MM DE. Analyzed the data: SJD MM DE. Wrote the paper: SJD. Critically revised the manuscript for important intellectual content: MM DE EJM MM LAA.","The authors have declared that no competing interests exist."
"10.1371/journal.pone.0121843","plos one","2015-04-09T00:00:00Z","Patrick H Maduna; Matt Dolan; Lwando Kondlo; Honey Mabuza; Judith N Dlamini; Mike Polis; Thabo Mnisi; Susan Orsega; Patrick Maja; Lotty Ledwaba; Thuthukile Molefe; Phumelele Sangweni; Lisette Malan; Gugu Matchaba; Paul Khabo; Greg Grandits; James D Neaton","South Africa Military Health Services, South African National Defence Forces, Pretoria, South Africa; The Henry M. Jackson Foundation for the Advancement of Military Medicine, Inc., Bethesda, Maryland, United States of America; Charisma Healthcare Solutions, Pretoria, South Africa; National Institute of Allergy and Infectious Diseases, National Institutes of Health, Bethesda, Maryland, United States of America; Division of Biostatistics, University of Minnesota, Minneapolis, Minnesota, United States of America","Conceived and designed the experiments: PHM JDN. Analyzed the data: GG PK LK JDN. Wrote the paper: PHM MD LK HM JND MP T. Mnisi SO PM LL T. Molefe PS LM GM PK GG JDN.","Several of the staff for Project Phidisa in South Africa were employed by Charisma Healthcare Solutions. They were 100% paid by Charisma with a grant from NIH. This does not alter the authors' adherence to PLOS ONE policies on sharing data and materials."
"10.1371/journal.pone.0110220","plos one","2014-10-24T00:00:00Z","John F Eisses; Amy W Davis; Akif Burak Tosun; Zachary R Dionise; Cheng Chen; John A Ozolek; Gustavo K Rohde; Sohail Z Husain","Pediatrics, University of Pittsburgh, Children's Hospital of Pittsburgh of UPMC, Pittsburgh, Pennsylvania, United States of America; Pathology, University of Pittsburgh, Children's Hospital of Pittsburgh of UPMC, Pittsburgh, Pennsylvania, United States of America; Biomedical and Electrical and Computer Engineering, Center for Bioimage Informatics, Carnegie Mellon University, Pittsburgh, Pennsylvania, United States of America","Conceived and designed the experiments: JFE AD ABT JAO GKR SZH. Performed the experiments: JFE AD ABT ZRD JAO GKR SZH. Analyzed the data: JFE AD ABT ZRD JAO GKR SZH. Contributed reagents/materials/analysis tools: GKR CC ABT. Wrote the paper: JFE JAO SZH.","The authors have declared that no competing interests exist."
"10.1371/journal.pone.0087430","plos one","2014-02-04T00:00:00Z","Yujing Huang; Junnan Li; Jose M Garcia; Hui Lin; Yanzhou Wang; Ping Yan; Lingqiao Wang; Yao Tan; Jiaohua Luo; Zhiqun Qiu; Ji-an Chen; Weiqun Shu","Department of Environmental Hygiene, College of Preventive Medicine, Third Military Medical University, Chongqing, China; Department of gynecology and obstetrics, Southwest Hospital, Third Military Medical University, Chongqing, China; Division of Endocrinology, Center for Translational Research in Inflammatory Diseases, Michael E. DeBakey VAMC/Baylor College of Medicine, Houston, Texas, United States of America; Department of Epidemiology, College of Preventive Medicine, Third Military Medical University, Chongqing, China","Conceived and designed the experiments: JAC HL YJH WQS. Performed the experiments: YJH YZW PY JNL LQW YT. Analyzed the data: YJH JHL ZQQ HL. Contributed reagents/materials/analysis tools: JAC HL YZW PY JNL. Wrote the paper: YJH JMG JAC WQS.","The authors have declared that no competing interests exist."
"10.1371/journal.pone.0064415","plos one","2013-05-09T00:00:00Z","Sai Xu; Yoshitaka Hayashi; Yoshiko Takagishi; Mariko Itoh; Yoshiharu Murata","Department of Genetics, Division of Stress Adaptation and Protection, Research Institute of Environmental Medicine, Nagoya University, Nagoya, Japan; Technical Department, Research Institute of Environmental Medicine, Nagoya University, Nagoya, Japan","Conceived and designed the experiments: YH YM. Performed the experiments: SX MI YT YH. Analyzed the data: SX YT YH YM. Wrote the paper: SX YH YM.","The authors have declared that no competing interests exist."
"10.1371/journal.pone.0110224","plos one","2014-10-08T00:00:00Z","Jinhwan Kwon; Ken-ichiro Ogawa; Yoshihiro Miyake","Department of Computational Intelligence and Systems Science, Tokyo Institute of Technology, Yokohama, Kanagawa, Japan","Conceived and designed the experiments: JK YM. Performed the experiments: JK KO YM. Analyzed the data: JK KO YM. Contributed reagents/materials/analysis tools: JK KO YM. Contributed to the writing of the manuscript: JK KO YM. Designed the software used in analysis: JK.","The authors have declared that no competing interests exist."
"10.1371/journal.pone.0041381","none","2012-07-27T00:00:00Z","Xingui Tian; Xiaobo Su; Xiao Li; Haitao Li; Ting Li; Zhichao Zhou; Tianhua Zhong; Rong Zhou","State Key Lab of Respiratory Disease, The First Affiliated Hospital of Guangzhou Medical College, Guangzhou, Guangdong, China; Department of Medical Genetics and Cell Biology, School of Basic Science, Guangzhou Medical College, Guangzhou, Guangdong, China","¤ Current address: Institute of Chinese Medical Sciences, University of Macau, Av. Padre Tomas Pereira, Taipa, Macau, China","The authors have declared that no competing interests exist."
