"id","journal","publication_date","author","author_affiliate","author_notes","competing_interest"
"10.1371/journal.pcbi.1000562","plos computational biology","2009-11-13T00:00:00Z","Eivind Valen; Albin Sandelin; Ole Winther; Anders Krogh","The Bioinformatics Centre, Department of Biology and the Biotech Research and Innovation Centre (BRIC), University of Copenhagen, Copenhagen, Denmark; DTU Informatics, Technical University of Denmark, Lyngby, Denmark","Conceived and designed the experiments: EV AS OW AK. Performed the experiments: EV. Analyzed the data: EV. Wrote the paper: EV AS OW AK.","The authors have declared that no competing interests exist."
"10.1371/journal.pmed.0050251","plos medicine","2008-12-23T00:00:00Z","Monique E Muggli; Kelley Lee; Quan Gan; Jon O Ebbert; Richard D Hurt","Mayo Clinic, Rochester, Minnesota, United States of America; Centre on Global Change and Health, London School of Hygiene & Tropical Medicine, London, United Kingdom; Center for Tobacco Control Research and Education, University of California San Francisco, San Francisco, California, United States of America","MEM conducted the research and developed the manuscript. KL, JOE, and RDH assisted in research and writing of the manuscript. QG assisted in translating documents and writing of the manuscript.","The authors have declared that no competing interests exist."
"10.1371/journal.pmed.0050242","plos medicine","2008-12-23T00:00:00Z","Luke C Mullany; Catherine I Lee; Lin Yone; Palae Paw; Eh Kalu Shwe Oo; Cynthia Maung; Thomas J Lee; Chris Beyrer","Center for Public Health and Human Rights, Bloomberg School of Public Health, Baltimore, Maryland, United States of America; Global Health Access Program, Mae Sot, Thailand; Burma Medical Association, Mae Sot, Thailand; Karen Department of Health and Welfare, Mae Sot, Thailand; Mae Tao Clinic, Mae Sot, Thailand","LCM: overall design/concept of project; oversight of implementation; writing of manuscript. CIL: design, management, and implementation of project; data management; critical review of the manuscript. LY: design and implementation of project; data management; critical review of the manuscript. PP: design and implementation of project; data management; critical review of the manuscript. EKSO: design of project; management and implementation; review of the manuscript. CM: overall design/concept of project; oversight of implementation; critical review of the manuscript. TJL: overall design/concept of project; oversight of field implementation; writing of the manuscript. CB: overall design/concept of project; oversight of implementation; critical review of manuscript.","The authors have declared that no competing interests exist."
"10.1371/journal.pcbi.1000541","plos computational biology","2009-10-23T00:00:00Z","Holly J Atkinson; Patricia C Babbitt","Graduate Program in Biological and Medical Informatics, University of California, San Francisco, California, United States of America; Institute for Quantitative Biosciences, University of California, San Francisco, California, United States of America; Department of Bioengineering and Therapeutic Sciences, University of California, San Francisco, California, United States of America; Department of Pharmaceutical Chemistry, University of California, San Francisco, California, United States of America","Conceived and designed the experiments: HJA PCB. Performed the experiments: HJA. Analyzed the data: HJA. Wrote the paper: HJA PCB.","The authors have declared that no competing interests exist."
"10.1371/journal.pmed.0050239","plos medicine","2008-12-09T00:00:00Z","Charlie W Lees; William J Zacharias; Mark Tremelling; Colin L Noble; Elaine R Nimmo; Albert Tenesa; Jennine Cornelius; Leif Torkvist; John Kao; Susan Farrington; Hazel E Drummond; Gwo-Tzer Ho; Ian D R Arnott; Henry D Appelman; Lauri Diehl; Harry Campbell; Malcolm G Dunlop; Miles Parkes; Sarah E M Howie; Deborah L Gumucio; Jack Satsangi","Gastrointestinal Unit, Molecular Medicine Centre, University of Edinburgh, Edinburgh, United Kingdom; Immunobiology Group, Medical Research Council (MRC) Centre for Inflammation Research, Queens Medical Research Institute, University of Edinburgh, Edinburgh, United Kingdom; Department of Cell and Developmental Biology, University of Michigan Medical School, Ann Arbor, Michigan, United States of America; Inflammatory Bowel Disease (IBD) Research Group, Addenbrooke's Hospital, University of Cambridge, Cambridge, United Kingdom; Colon Cancer Genetics Group, MRC Human Genetics Unit, Western General Hospital, Edinburgh, United Kingdom; Department of Pathology, Genentech, Inc, South San Francisco, California, United States of America; Department of Medical & Surgical Gastroenterology, Karolinska University Hospital, Stockholm, Sweden; Department of Internal Medicine, University of Michigan Medical School, Ann Arbor, Michigan, United States of America; Department of Pathology, University of Michigan Medical School, Ann Arbor, Michigan, United States of America","¶ These authors are joint senior authors on this work.","Lauri Diehl is a paid employee of Genentech, Inc and a stockholder in that company. While this paper does not describe any Genentech product, it is possible that these findings may be relevant to a pathway or pathways of interest to the company for current or future therapeutic agents. None of the other authors have any competing interests to declare."
"10.1371/journal.pcbi.1000546","plos computational biology","2009-10-30T00:00:00Z","Ibrahim Barıs; Aytug Tuncel; Natali Ozber; Ozlem Keskin; Ibrahim Halil Kavakli","Department of Chemical and Biological Engineering, College of Engineering, Koc University, Rumeli Feneri Yolu, Istanbul, Turkey","Conceived and designed the experiments: IB AT. Performed the experiments: IB AT NO. Analyzed the data: OK IHK. Contributed reagents/materials/analysis tools: OK IHK. Wrote the paper: OK IHK.","The authors have declared that no competing interests exist."
"10.1371/journal.pcbi.1000545","plos computational biology","2009-10-23T00:00:00Z","Alon Zaslaver; Shai Kaplan; Anat Bren; Adrian Jinich; Avi Mayo; Erez Dekel; Uri Alon; Shalev Itzkovitz","Division of Biology, California Institute of Technology, Pasadena, California, United States of America; Department of Molecular Cell Biology, Weizmann Institute of Science, Rehovot, Israel; Department of Computer Science and Applied Mathematics, Weizmann Institute of Science, Rehovot, Israel; Department of Biological Chemistry, Weizmann Institute of Science, Rehovot, Israel","Conceived and designed the experiments: AZ UA SI. Performed the experiments: AZ SI. Analyzed the data: AZ SI. Contributed reagents/materials/analysis tools: AZ SK AB AJ AM ED UA SI. Wrote the paper: AZ UA SI.","The authors have declared that no competing interests exist."
"10.1371/journal.ppat.1002735","plos pathogens","2012-06-14T00:00:00Z","Francesco Nazzi; Sam P Brown; Desiderato Annoscia; Fabio Del Piccolo; Gennaro Di Prisco; Paola Varricchio; Giorgio Della Vedova; Federica Cattonaro; Emilio Caprio; Francesco Pennacchio","Dipartimento di Scienze Agrarie e Ambientali, Università degli Studi di Udine, Udine, Italy; Centre for Immunity, Infection and Evolution, School of Biological Sciences, University of Edinburgh, Edinburgh, United Kingdom; Dipartimento di Entomologia e Zoologia Agraria “Filippo Silvestri”, Università degli Studi di Napoli “Federico II”, Portici (Napoli), Italy; Istituto di Genomica Applicata, Parco Scientifico e Tecnologico Luigi Danieli, Udine, Italy","Conceived and designed the experiments: FN FP. Performed the experiments: FN DA FDP GDP PV GDV FC EC. Analyzed the data: FN SPB. Wrote the paper: FN FP SPB.","The authors have declared that no competing interests exist."
"10.1371/journal.pmed.0050253","plos medicine","2008-12-23T00:00:00Z","Rose McGready; Saw Oo Tan; Elizabeth A Ashley; Mupawjay Pimanpanarak; Jacher Viladpai-nguen; Lucy Phaiphun; Katja Wüstefeld; Marion Barends; Natthapon Laochan; Lily Keereecharoen; Niklas Lindegardh; Pratap Singhasivanon; Nicholas J White; François Nosten","Shoklo Malaria Research Unit (SMRU), Mae Sot, Tak, Thailand; Faculty of Tropical Medicine, Mahidol University, Bangkok, Thailand; Centre for Clinical Vaccinology and Tropical Medicine, Churchill Hospital, Oxford, United Kingdom","RM, NJW, and FN developed the study protocol. RM, SOT, EAA, MP, JV, LP, and KW oversaw the implementation of the trial, assisted with the data analysis and drafting of the manuscript. LK oversaw the field laboratory work and analysis of the malaria smear results, MB and N Laochan undertook the PCR analysis, and N Lindegardh the lumefantrine analysis. EAA, PS, NJW, and FN contributed to the monitoring of the trial and drafting of the manuscript.","NJW is co-chairman of the WHO treatment guidelines committee."
"10.1371/journal.ppat.1002750","plos pathogens","2012-06-07T00:00:00Z","Veronica Jimenez; Roberto Docampo","Center for Tropical and Emerging Global Diseases and Department of Cellular Biology, University of Georgia, Athens, Georgia, United States of America","Conceived and designed the experiments: VJ RD. Performed the experiments: VJ. Analyzed the data: VJ RD. Contributed reagents/materials/analysis tools: VJ RD. Wrote the paper: VJ RD.","The authors have declared that no competing interests exist."
"10.1371/journal.pcbi.1000560","plos computational biology","2009-11-13T00:00:00Z","Kenneth S Campbell","Department of Physiology and Center for Muscle Biology, University of Kentucky, Lexington, Kentucky, United States of America","Conceived and designed the experiments: KSC. Performed the experiments: KSC. Analyzed the data: KSC. Contributed reagents/materials/analysis tools: KSC. Wrote the paper: KSC.","The author has declared that no competing interests exist."
"10.1371/journal.ppat.1002751","plos pathogens","2012-06-14T00:00:00Z","Hua Xiang; Yue Feng; Jiawei Wang; Bao Liu; Yeguang Chen; Lei Liu; Xuming Deng; Maojun Yang","Key Laboratory for Protein Sciences of Ministry of Education, Tsinghua-Peking Center for Life Sciences, School of Life Sciences, Tsinghua University, Beijing, China; Department of Veterinary Pharmacology, College of Animal Science and Veterinary Medicine, Jilin University, Changchun, China; Department of Vascular Surgery, Peking Union Medical College Hospital, Beijing, China; Department of Chemistry, Tsinghua University, Beijing, China","Conceived and designed the experiments: MY. Performed the experiments: HX YF JW BL LL. Analyzed the data: MY HX YF JW BL LL YC XD. Contributed reagents/materials/analysis tools: BL LL YC. Wrote the paper: MY.","The authors have declared that no competing interests exist."
"10.1371/journal.ppat.1002739","plos pathogens","2012-06-14T00:00:00Z","Jennifer Mabuka; Ruth Nduati; Katherine Odem-Davis; Dylan Peterson; Julie Overbaugh","Division of Human Biology, Fred Hutchinson Cancer Research Center, Seattle, Washington, United States of America; Program of Pathobiology, Department of Global Health, University of Washington, Seattle, Washington, United States of America; Department of Pediatrics, University of Nairobi, Nairobi, Kenya; Public Health Sciences, Fred Hutchinson Cancer Research Center, Seattle, Washington, United States of America","Conceived and designed the experiments: JM RN JO. Performed the experiments: JM DP. Analyzed the data: JM KOD. Contributed reagents/materials/analysis tools: RN KOD JO. Wrote the paper: JM JO. Provided comments on the manuscript: RN KOD DP Provided overall guidance: JO.","The authors have declared that no competing interests exist."
"10.1371/journal.ppat.1002738","plos pathogens","2012-07-26T00:00:00Z","Ursula Neu; Holger Hengel; Bärbel S Blaum; Rachel M Schowalter; Dennis Macejak; Michel Gilbert; Warren W Wakarchuk; Akihiro Imamura; Hiromune Ando; Makoto Kiso; Niklas Arnberg; Robert L Garcea; Thomas Peters; Christopher B Buck; Thilo Stehle","Interfaculty Institute of Biochemistry, University of Tuebingen, Tuebingen, Germany; Department of Chemistry, University of Luebeck, Luebeck, Germany; Laboratory of Cellular Oncology, National Cancer Institute, Bethesda, Maryland, United States of America; Department of Molecular, Cellular, and Developmental Biology, and the Biofrontiers Institute, University of Colorado at Boulder, Boulder, Colorado, United States of America; National Research Council Canada, Institute for Biological Sciences, Glycobiology Program, Ottawa, Ontario, Canada; Institute for Integrated Cell-Material Sciences (iCeMS), Kyoto University, Kyoto, Japan; Department of Applied Bioorganic Chemistry, Gifu University, Gifu, Japan; Division of Virology, Department of Clinical Microbiology, Umeå University, Umeå, Sweden; Department of Pediatrics, Vanderbilt University School of Medicine, Nashville, Tennessee, United States of America","Conceived and designed the experiments: UN HH BSB TP RMS CBB TS. Performed the experiments: UN HH BSB RMS. Analyzed the data: UN HH BSB RMS TP CBB TS. Contributed reagents/materials/analysis tools: DM MG WWW AI HA MK NA RLG TP. Wrote the paper: UN BSB RMS CBB TS.","The authors have declared that no competing interests exist."
"10.1371/journal.ppat.1002740","plos pathogens","2012-06-07T00:00:00Z","Mike Reichelt; Lydia Joubert; John Perrino; Ai Leen Koh; Ibanri Phanwar; Ann M Arvin","Departments of Pediatrics and Microbiology & Immunology, Stanford University School of Medicine, Stanford, California, United States of America; Cell Sciences Imaging Facility, Stanford University School of Medicine, Stanford, California, United States of America; Stanford Nanocharacterization Laboratory, Geballe Laboratory for Advanced Materials, Stanford University, Stanford, California, United States of America","Conceived and designed the experiments: MR LJ AMA. Performed the experiments: MR LJ JP ALK. Analyzed the data: MR AMA. Contributed reagents/materials/analysis tools: LJ JP IP ALK. Wrote the paper: MR AMA.","The authors have declared that no competing interests exist."
"10.1371/journal.pmed.0050222","plos medicine","2008-11-18T00:00:00Z","Joanna Kempner","Rutgers University, Department of Sociology and Institute for Health, Health Care Policy and Aging Research, New Brunswick, New Jersey, United States of America","JK designed the study, enrolled participants, conducted interviews, analyzed the data, and wrote the paper.","The author has declared that no competing interests exist."
"10.1371/journal.pcbi.1000527","plos computational biology","2009-10-02T00:00:00Z","Jin Liu; Ruth Nussinov","Basic Science Program, SAIC-Frederick, Inc., Center for Cancer Research Nanobiology Program, NCI-Frederick, Frederick, Maryland, United States of America; Sackler Institute of Molecular Medicine, Department of Human Genetics and Molecular Medicine, Sackler School of Medicine, Tel Aviv University, Tel Aviv, Israel","Conceived and designed the experiments: JL. Performed the experiments: JL. Analyzed the data: JL. Wrote the paper: JL RN.","The authors have declared that no competing interests exist."
"10.1371/journal.pcbi.1000526","plos computational biology","2009-10-02T00:00:00Z","Hsiao-Mei Lu; Jie Liang","Department of Bioengineering, University of Illinois at Chicago, Chicago, Illinois, United States of America","Conceived and designed the experiments: HML JL. Performed the experiments: HML. Analyzed the data: HML JL. Contributed reagents/materials/analysis tools: HML JL. Wrote the paper: HML JL.","The authors have declared that no competing interests exist."
"10.1371/journal.pcbi.1000525","plos computational biology","2009-10-02T00:00:00Z","Penelope A Hancock","Centre for Population Biology, Imperial College London, Silwood Park Campus, Ascot, Berkshire, United Kingdom","Conceived and designed the experiments: PAH. Performed the experiments: PAH. Analyzed the data: PAH. Wrote the paper: PAH.","The author has declared that no competing interests exist."
"10.1371/journal.ppat.1002716","plos pathogens","2012-05-17T00:00:00Z","Lena Poppinga; Bettina Janesch; Anne Fünfhaus; Gerhard Sekot; Eva Garcia-Gonzalez; Gillian Hertlein; Kati Hedtke; Christina Schäffer; Elke Genersch","Institute for Bee Research, Department of Molecular Bee Pathology, Hohen Neuendorf, Germany; Department für NanoBiotechnologie, NanoGlycobiology, Universität für Bodenkultur Wien, Wien, Austria","Conceived and designed the experiments: CS EG. Performed the experiments: LP BJ AF GS EGG GH KH. Analyzed the data: LP CS EG. Wrote the paper: LP CS EG.","The authors have declared that no competing interests exist."
"10.1371/journal.ppat.1002723","plos pathogens","2012-06-07T00:00:00Z","Andrés G Madrigal; Kenneth Barth; George Papadopoulos; Caroline Attardo Genco","Department of Medicine, Section of Infectious Diseases, Boston University School of Medicine, Boston, Massachusetts, United States of America","Conceived and designed the experiments: AGM CAG. Performed the experiments: AGM KB GP. Analyzed the data: AGM KB GP. Contributed reagents/materials/analysis tools: AGM KB GP CAG. Wrote the paper: AGM KB GP CAG.","The authors have declared that no competing interests exist."
"10.1371/journal.pcbi.1000528","plos computational biology","2009-10-09T00:00:00Z","Noriaki Okimoto; Noriyuki Futatsugi; Hideyoshi Fuji; Atsushi Suenaga; Gentaro Morimoto; Ryoko Yanai; Yousuke Ohno; Tetsu Narumi; Makoto Taiji","High-performance Molecular Simulation Team, Computational Systems Biology Research Group, Advanced Computational Sciences Department, RIKEN Advanced Science Institute, Yokohama, Kanagawa, Japan; High-performance Computing Team, Integrated Simulation of Living Matter Group, Computational Science Research Program, RIKEN, Yokohama, Kanagawa, Japan; Graduate School of Pharmaceutical Sciences, Chiba University, Chiba, Japan; Department of Computer Science, The University of Electro-Communications, Chofu-shi, Tokyo, Japan","Conceived and designed the experiments: NO AS MT. Performed the experiments: NO NF HF. Analyzed the data: NO NF. Contributed reagents/materials/analysis tools: NO NF HF GM RY YO TN. Wrote the paper: NO AS MT.","The authors have declared that no competing interests exist."
"10.1371/journal.ppat.1002718","plos pathogens","2012-05-17T00:00:00Z","Sheena D Singh-Babak; Tomas Babak; Stephanie Diezmann; Jessica A Hill; Jinglin Lucy Xie; Ying-Lien Chen; Susan M Poutanen; Robert P Rennie; Joseph Heitman; Leah E Cowen","Department of Molecular Genetics, University of Toronto, Toronto, Ontario, Canada; Department of Biology, Stanford University, Stanford, California, United States of America; Department of Molecular Genetics and Microbiology, Duke University Medical Center, Durham, North Carolina, United States of America; University Health Network/Mount Sinai Hospital, Department of Microbiology, Toronto, Ontario, Canada; Department of Laboratory Medicine and Pathobiology, University of Toronto, Toronto, Ontario, Canada; Department of Medicine, University of Toronto, Toronto, Ontario, Canada; Department of Laboratory Medicine and Pathology, University of Alberta, Edmonton, Alberta, Canada","Conceived and designed the experiments: SDSB LEC. Performed the experiments: SDSB TB SD JAH JLX YLC RPR. Analyzed the data: SDSB TB. Contributed reagents/materials/analysis tools: SMP JH. Wrote the paper: SDSB LEC.","The authors have declared that no competing interests exist."
"10.1371/journal.ppat.1002717","plos pathogens","2012-05-24T00:00:00Z","Santosh K Panda; Sunil Kumar; Nitin C Tupperwar; Tushar Vaidya; Anna George; Satyajit Rath; Vineeta Bal; Balachandran Ravindran","Institute of Life Sciences, Bhubaneswar, India; Centre for Cellular and Molecular Biology, Hyderabad, India; National Institute of Immunology, New Delhi, India","Conceived and designed the experiments: BR along with his collaborators AG, VB and SR conceived the project, assisted in designing some of the study and some of the experiments were conducted in the collaborators laboratory at NII, Delhi by SKP. Performed the experiments: SKP performed the most part of experiments. SKP, NCT and TV performed Q-PCR data reported here at TVs laboratory at CCMB, Hyderabad. SK performed all In silico analysis reported in the manuscript. Analyzed the data: SKP, BR, AG, SR and VB. Wrote the paper: SKP wrote the initial draft and it was finalized and completed by BR along with TV, AG, SR and VB.","The authors have declared that no competing interests exist."
"10.1371/journal.pcbi.1000537","plos computational biology","2009-10-16T00:00:00Z","Bard Ermentrout; Daniel J Simons; Peter W Land","Department of Mathematics, University of Pittsburgh, Pittsburgh, Pennsylvannia, United States of America; Department of Neurobiology, University of Pittsburgh, Pittsburgh, Pennsylvannia, United States of America","Conceived and designed the experiments: BE DJS. Performed the experiments: PWL. Analyzed the data: BE DJS PWL. Wrote the paper: BE DJS.","The authors have declared that no competing interests exist."
"10.1371/journal.pmed.0050061","plos medicine","2008-04-01T00:00:00Z","Elie G Karam; Zeina N Mneimneh; Hani Dimassi; John A Fayyad; Aimee N Karam; Soumana C Nasser; Somnath Chatterji; Ronald C Kessler","Department of Psychiatry and Clinical Psychology, Saint George Hospital University Medical Center, Beirut, Lebanon; Department of Psychiatry and Clinical Psychology, Faculty of Medicine, Balamand University Medical School, Beirut, Lebanon; Institute for Development, Research, Advocacy and Applied Care (IDRAAC), Beirut, Lebanon; Survey Methodology Program, Institute for Social Research, University of Michigan, Ann Arbor, Michigan, United States of America; School of Nursing, Faculty of Medicine, American University of Beirut, Beirut, Lebanon; School of Pharmacy, Lebanese American University, Byblos, Lebanon; World Health Organization (WHO), Geneva, Switzerland; Department of Health Care Policy, Harvard Medical School, Boston, Massachusetts, United States of America","EGK, ZNM, JAF, ANK, SC, and RCK participated in the study concept and design. EGK, ZNM, JAF, and ANK acquired data. EGK, ZNM, HD, JAF, ANK, SCN, SC, and RCK analyzed and interpreted data. EGK, ZNM, HD, JAF, ANK, and SCN drafted the manuscript. All authors critically revised the manuscript for important intellectual content. EGK, ZNM, HD, and RCK provided statistical expertise. EGK, ZNM, HD, JAF, ANK, and SCN provided administrative, technical, or material support.","RCK has been a consultant for Astra Zeneca, Bristol-Myers Squibb, Eli Lilly and Company, GlaxoSmithKline, Pfizer, Sanofi-Aventis, and Wyeth, and has had research support for his epidemiological studies from Bristol-Myers Squibb, Eli Lilly and Company, Ortho-McNeil, Pfizer, and the Pfizer Foundation. The other authors have declared that no competing interests exist."
"10.1371/journal.pmed.0050060","plos medicine","2008-03-18T00:00:00Z","Patrick Gérardin; Georges Barau; Alain Michault; Marc Bintner; Hanitra Randrianaivo; Ghassan Choker; Yann Lenglet; Yasmina Touret; Anne Bouveret; Philippe Grivard; Karin Le Roux; Séverine Blanc; Isabelle Schuffenecker; Thérèse Couderc; Fernando Arenzana-Seisdedos; Marc Lecuit; Pierre-Yves Robillard","Neonatal and Pediatric Intensive Care Unit, Pôle Mère-Enfant, Groupe Hospitalier Sud-Réunion, Saint-Pierre, La Réunion, France; Center of Clinical Investigation–Clinical Epidemiology (CIC-EC, INSERM), Saint-Pierre, La Réunion, France; Department of Gynecology and Obstetrics, Pôle Mère-Enfant, Groupe Hospitalier Sud-Réunion, Saint-Pierre, La Réunion, France; Department of Microbiology, Pôle des Sciences Biologiques, Groupe Hospitalier Sud-Réunion, Saint-Pierre, La Réunion, France; Department of Neuroradiology, Pôle de Radiologie, Groupe Hospitalier Sud-Réunion, Saint-Pierre, La Réunion, France; Fetal Medicine and Fetopathology Unit, Pôle Mère-Enfant, Groupe Hospitalier Sud-Réunion, Saint-Pierre, La Réunion, France; National Reference Center for Arboviruses, Institut Pasteur, Lyon, France; Institut Pasteur, Microorganisms and Host Barriers Group, F-75015, Paris, France; Inserm, Equipe Avenir U604, F-75015, Paris, France; Institut Pasteur, Molecular Viral Pathogenesis Unit, F-75015, Paris, France; Inserm U819, F-75015, Paris, France; Department of Infectious Diseases and Tropical Medicine, Necker-Pasteur Center for Infectious Diseases, Hôpital Necker-Enfants Malades, Assistance Publique-Hôpitaux de Paris, F-75015, Paris, France","P. Gérardin, G. Choker, and P.Y. Robillard participated in the clinical management and the data collection for pediatric cases. G. Barau, Y. Lenglet, Y. Touret, and A. Bouveret did the same for parturient women. M. Bintner and S. Blanc performed neuroimaging. H. Randrianaivo performed autopsies on fetuses. A. Michault and K. Le Roux developed the RT-PCR and adapted the IgM serology assays. P. Grivard helped A. Michault with virology. I. Schuffenecker validated the RT-PCR and IgM serology assays. F. Arenzana-Seisdedos helped set up the collaboration between the Institut Pasteur and the GHSR. T. Couderc and M. Lecuit performed the placental and animal model studies. P. Gérardin and P.Y. Robillard designed the study, and reviewed the data for consistency and errors. P. Gérardin, A. Michault, and M. Lecuit analyzed the data and wrote the manuscript with the help of G. Barau and P.Y. Robillard.","The authors have declared that no competing interests exist."
