"id","journal","publication_date","author","author_affiliate","author_notes","competing_interest"
"10.1371/journal.pgen.1005226","plos genetics","2015-05-07T00:00:00Z","Dennis Lal; Ann-Kathrin Ruppert; Holger Trucks; Herbert Schulz; Carolien G de Kovel; Dorothée Kasteleijn-Nolst Trenité; Anja C M Sonsma; Bobby P Koeleman; Dick Lindhout; Yvonne G Weber; Holger Lerche; Claudia Kapser; Christoph J Schankin; Wolfram S Kunz; Rainer Surges; Christian E Elger; Verena Gaus; Bettina Schmitz; Ingo Helbig; Hiltrud Muhle; Ulrich Stephani; Karl M Klein; Felix Rosenow; Bernd A Neubauer; Eva M Reinthaler; Fritz Zimprich; Martha Feucht; Rikke S Møller; Helle Hjalgrim; Peter De Jonghe; Arvid Suls; Wolfgang Lieb; Andre Franke; Konstantin Strauch; Christian Gieger; Claudia Schurmann; Ulf Schminke; Peter Nürnberg; EPICURE Consortium; Thomas Sander","Cologne Center for Genomics (CCG), University of Cologne, Cologne, Germany; Cologne Excellence Cluster on Cellular Stress Responses in Aging-Associated Diseases (CECAD), University of Cologne, Cologne, Germany; Department of Neuropediatrics, University Medical Center Giessen and Marburg, Giessen, Germany; EPICURE Consortium; Department of Medical Genetics, University Medical Center Utrecht, Utrecht, The Netherlands; SEIN Epilepsy Institute in the Netherlands, Hoofddorp, The Netherlands; Department of Neurology and Epileptology, Hertie Institute of Clinical Brain Research, University of Tübingen, Tübingen, Germany; Department of Neurology, University of Munich Hospital—Großhadern, Munich, Germany; Department of Epileptology, University Clinics Bonn, Bonn, Germany; Department of Neurology, Charité University Medicine, Campus Virchow Clinic, Berlin, Germany; Department of Neurology, Vivantes Humboldt-Klinikum, Berlin, Germany; Department of Neuropediatrics, University Medical Center Schleswig-Holstein (Kiel Campus), Kiel, Germany; Epilepsy-Center Hessen, Department of Neurology, Philipps-University Marburg, Marburg, Germany; Epilepsy Center Frankfurt Rhein-Main, Department of Neurology, Johann Wolfgang Goethe University Frankfurt, Frankfurt, Germany; Department of Neuropediatrics, University Medical Center Giessen and Marburg, Giessen, Germany; Department of Neurology, Medical University of Vienna, Vienna, Austria; Department of Pediatrics and Neonatology, Medical University of Vienna, Vienna, Austria; Department of Neurology, Danish Epilepsy Centre, Dianalund, Denmark; Institute for Regional Health Services, University of Southern Denmark, Odense, Denmark; Neurogenetics Group, VIB Department of Molecular Genetics, University of Antwerp, Antwerp, Belgium; Laboratory of Neurogenetics, Institute Born-Bunge, University of Antwerp, Antwerp, Belgium; Institute of Epidemiology and Biobank Popgen, Christian Albrechts University, Kiel, Germany; Institute of Clinical Molecular Biology, Christian-Albrechts-University of Kiel, Kiel, Germany; Institute of Genetic Epidemiology, Helmholtz Zentrum München—German Research Center for Environmental Health, Neuherberg, Germany; Institute of Medical Informatics, Biometry and Epidemiology, and Chair of Genetic Epidemiology, Ludwig-Maximilians-University, Munich, Germany; Research Unit of Molecular Epidemiology, Helmholtz Zentrum München—German Research Center for Environmental Health, Neuherberg, Germany; Institute of Epidemiology II, Helmholtz Zentrum München—German Research Center for Environmental Health, Neuherberg, Germany; Interfaculty Institute for Genetics and Functional Genomics, Ernst Moritz Arndt University, Greifswald, Germany; Department of Neurology, University Medicine Greifswald, Ernst Moritz Arndt University, Greifswald, Germany; Center for Molecular Medicine Cologne (CMMC), University of Cologne, Cologne, Germany","Conceived and designed the experiments: DLa HT TS. Performed the experiments: HT HS AKR PN TS. Analyzed the data: DLa AKR HT HS TS. Contributed reagents/materials/analysis tools: CGdK DKNT ACMS BPK DLi YGW HL CK CJS WSK RS CEE VG BS IH HM USt KMK FR BAN EMR FZ MF RSM HH PDJ AS TS EC WL AF CG KS CS USc HT DLa HS. Wrote the paper: DLa HS TS.","I have read the journal's policy and the authors of this manuscript have the following competing interests: BS has received in the last three years research funding from the German Society for Epileptology, UCB Pharma GmbH and Desitin Arzneimittel Deutschland. BS received speakers honoraria from Eisai GmbH, Desitin Arzneimittel Deutschland and UCB Pharma GmbH. The other authors declare no conflict of interest."
"10.1371/journal.ppat.1000068","plos pathogens","2008-05-16T00:00:00Z","Fiona E Lovegrove; Sina A Gharib; Lourdes Peña-Castillo; Samir N Patel; John T Ruzinski; Timothy R Hughes; W Conrad Liles; Kevin C Kain","Institute of Medical Science, Department of Medicine, University of Toronto, Toronto, Ontario, Canada; McLaughlin-Rotman Centre for Global Health, McLaughlin Centre for Molecular Medicine, University Health Network, University of Toronto, Toronto, Ontario, Canada; Department of Medicine, University of Washington, Seattle, Washington, United States of America; Center for Cellular and Biomolecular Research, University of Toronto, Toronto, Ontario, Canada; Department of Medical Genetics and Microbiology, University of Toronto, Toronto, Ontario, Canada; Division of Infectious Diseases, Department of Medicine, University of Toronto, Toronto, Ontario, Canada","Conceived and designed the experiments: FL WL KK. Performed the experiments: FL SP JR. Analyzed the data: FL SG LP. Contributed reagents/materials/analysis tools: LP TH. Wrote the paper: FL SG WL KK.","The authors have declared that no competing interests exist."
"10.1371/journal.pgen.1005159","plos genetics","2015-04-10T00:00:00Z","Kyla S Ost; Teresa R O’Meara; Naureen Huda; Shannon K Esher; J Andrew Alspaugh","Departments of Medicine/ Molecular Genetics & Microbiology, Duke University School of Medicine, Durham, North Carolina, United States of America","Conceived and designed the experiments: KSO TRO SKE JAA. Performed the experiments: KSO TRO NH SKE. Analyzed the data: KSO TRO NH SKE JAA. Contributed reagents/materials/analysis tools: KSO TRO NH SKE JAA. Wrote the paper: KSO JAA.","The authors have declared that no competing interests exist."
"10.1371/journal.ppat.0040036","plos pathogens","2008-02-15T00:00:00Z","Marc-Jan Gubbels; Margaret Lehmann; Mani Muthalagi; Maria E Jerome; Carrie F Brooks; Tomasz Szatanek; Jayme Flynn; Ben Parrot; Josh Radke; Boris Striepen; Michael W White","Center for Tropical and Emerging Global Diseases and Department of Cellular Biology, University of Georgia, Athens, Georgia, United States of America; Department of Biology, Boston College, Chestnut Hill, Massachusetts, United States of America; Department of Veterinary Molecular Biology, Montana State University, Bozeman, Montana, United States of America","MJG, BS, and MWW conceived and designed the experiments. MJG, ML, MM, MEJ, CFB, TS, JF, BP, JR, performed the experiments. MJG, BS, and MWW analyzed the data. MJG, BS, and MWW wrote the paper.","The authors have declared that no competing interests exist."
"10.1371/journal.ppat.0040035","plos pathogens","2008-02-15T00:00:00Z","Andrew Y Koh; Julia R Köhler; Kathleen T Coggshall; Nico Van Rooijen; Gerald B Pier","Channing Laboratory, Department of Medicine, Brigham and Women's Hospital, Harvard Medical School, Boston, Massachusetts, United States of America; Department of Medicine, Hematology/Oncology, Children's Hospital, Boston, Massachusetts, United States of America; Department of Medicine, Infectious Diseases, Children's Hospital, Boston, Massachusetts, United States of America; Department of Pediatric Oncology, Dana Farber Cancer Institute, Boston, Massachusetts, United States of America; Department of Cell Biology and Immunology, Free University, Amsterdam, The Netherlands","AYK conceived and designed the experiments, performed the experiments, analyzed the data, and wrote the paper. JRK provided C. albicans microbiological instruction and support. KTC performed the experiments. NVR provided the liposomal clodronate and instruction on dosing and methods for verification of macrophage depletion. GPB conceived and designed the experiments and analyzed the data.","The authors have declared that no competing interests exist."
"10.1371/journal.pbio.1001415","plos biology","2012-10-30T00:00:00Z","Isabel Olivera-Martinez; Hidekiyo Harada; Pamela A Halley; Kate G Storey","Division of Cell and Developmental Biology, College of Life Sciences, University of Dundee, Dundee, United Kingdom; Department of Molecular Neurobiology, Graduate School of Life Sciences and Institute of Development, Aging and Cancer, Tohoku University, Sendai, Japan","The author(s) have made the following declarations about their contributions: Conceived and designed the experiments: KGS IO-M HH PAH. Performed the experiments: KGS IO-M HH PAH. Analyzed the data: KGS IO-M HH PAH. Wrote the paper: KGS IO-M HH.","The authors have declared that no competing interests exist."
"10.1371/journal.ppat.0040042","plos pathogens","2008-02-15T00:00:00Z","Pernille Andersen; Morten A Nielsen; Mafalda Resende; Thomas S Rask; Madeleine Dahlbäck; Thor Theander; Ole Lund; Ali Salanti","Center for Biological Sequence Analysis, BioCentrum-DTU, Denmark; Centre for Medical Parasitology at University of Copenhagen and Copenhagen University Hospital (Rigshospitalet), Copenhagen, Denmark","PA, MAN, TT, and AS conceived and designed the experiments. PA, MAN, MR, MD, and AS performed the experiments. PA, TSR, TT, OL, and AS analyzed the data. MAN, TSR, and MD contributed reagents/materials/analysis tools. PA, TT, and AS wrote the paper.","The authors have declared that no competing interests exist."
"10.1371/journal.ppat.0040037","plos pathogens","2008-02-15T00:00:00Z","Shalaka Samant; Hyunwoo Lee; Mahmood Ghassemi; Juan Chen; James L Cook; Alexander S Mankin; Alexander A Neyfakh","Center for Pharmaceutical Biotechnology, University of Illinois at Chicago, Chicago, Illinois, United States of America; Section of Infectious Diseases, Immunology and Internal Medicine, Department of Medicine, University of Illinois at Chicago, Chicago, Illinois, United States of America","SS, JLC, and AAN conceived and designed the experiments. SS, MG, and JC performed the experiments. HL, MG, JLC, and ASM analyzed the data. contributed reagents/materials/analysis tools. SS and ASM wrote the paper.","The authors have declared that no competing interests exist."
"10.1371/journal.pgen.1005155","plos genetics","2015-05-28T00:00:00Z","Sylvia T Nurnberg; Karen Cheng; Azad Raiesdana; Ramendra Kundu; Clint L Miller; Juyong B Kim; Komal Arora; Ivan Carcamo-Oribe; Yiqin Xiong; Nikhil Tellakula; Vivek Nanda; Nikitha Murthy; William A Boisvert; Ulf Hedin; Ljubica Perisic; Silvia Aldi; Lars Maegdefessel; Milos Pjanic; Gary K Owens; Michelle D Tallquist; Thomas Quertermous","Department of Medicine, Cardiovascular Research Institute, Stanford University School of Medicine, Stanford, California, United States of America; Department of Medicine, University of Hawaii, Honolulu, Hawaii, United States of America; Department of Molecular Medicine and Surgery, Karolinska Institute, Stockholm, Sweden; Department of Medicine, Karolinska Institute, Stockholm, Sweden; Department of Molecular Physiology and Biological Physics, University of Virginia School of Medicine, Charlottesville, Virginia, United States of America","Conceived and designed the experiments: STN WAB GKO MDT TQ. Performed the experiments: STN KC AR CLM KA RK ICO YX NT NM LP SA VN. Analyzed the data: STN TQ JBK MP. Contributed reagents/materials/analysis tools: WAB GKO MDT. Wrote the paper: MDT TQ JBK UH LM.","The authors have declared that no competing interests exist."
"10.1371/journal.pbio.1001412","none","2012-10-23T00:00:00Z","Jacinto López-Sagaseta; Jennifer E Kung; Paul B Savage; Jenny Gumperz; Erin J Adams","Department of Biochemistry and Molecular Biology, University of Chicago, Chicago, Illinois, United States of America; Department of Chemistry, Brigham Young University, Provo, Utah, United States of America; Department of Medical Microbiology and Immunology, University of Wisconsin School of Medicine and Public Health, Madison, Wisconsin, United States of America; Committee on Immunology, University of Chicago, Chicago, Illinois, United States of America","The author(s) have made the following declarations about their contributions: Conceived and designed the experiments: JLS JG EJA. Performed the experiments: JLS JEK. Analyzed the data: JLS EJA. Contributed reagents/materials/analysis tools: PBS JG. Wrote the paper: JLS EJA.","The authors have declared that no competing interests exist."
"10.1371/journal.pgen.1005156","plos genetics","2015-04-13T00:00:00Z","Alfonso Soler-Bistué; Juan A Mondotte; Michael Jason Bland; Marie-Eve Val; María-Carla Saleh; Didier Mazel","Institut Pasteur, Unité Plasticité du Génome Bactérien, Département Génomes et Génétique, Paris, France; Centre National de la Recherche Scientifique UMR3525, Paris, France; Institut Pasteur, Viruses and RNA Interference; Centre National de la Recherche Scientifique UMR3569, Paris, France","Conceived and designed the experiments: ASB JAM MEV MCS DM. Performed the experiments: ASB JAM MJB. Analyzed the data: ASB JAM. Contributed reagents/materials/analysis tools: MEV MCS DM. Wrote the paper: ASB MCS DM.","The authors have declared that no competing interests exist"
"10.1371/journal.ppat.0040043","plos pathogens","2008-02-15T00:00:00Z","Olga Zaborina; Christopher Holbrook; Yimei Chen; Jason Long; Alexander Zaborin; Irina Morozova; Hoylan Fernandez; Yingmin Wang; Jerrold R Turner; John C Alverdy","Department of Surgery, Pritzker School of Medicine, University of Chicago, Chicago, Illinois, United States of America; Department of Biochemistry and Molecular Biology, University of Chicago, Chicago, Illinois, United States of America; Department of Pathology, University of Chicago, Chicago, Illinois, United States of America","OZ originated the project, designed all experiments, did the main work, and wrote the paper; CH performed mice experiments. YC helped to create electron microscopy images. JL helped in mice experiments. AZ helped in the RT-PCR experiments. IM made technical contributions throughout the work. HF helped in the verification of mutants. YW made technical contributions in growing Caco-2 cells. JRT made intellectual contributions and provided reagents. JCA originated the project, participated in the experimental design, wrote the paper, and provided grant support.","The authors have declared that no competing interests exist."
"10.1371/journal.ppat.1000052","plos pathogens","2008-04-25T00:00:00Z","Blaise R Boles; Alexander R Horswill","Department of Microbiology, Roy J. and Lucille A. Carver College of Medicine, University of Iowa, Iowa City, Iowa, United States of America","Conceived and designed the experiments: BB AH. Performed the experiments: BB. Analyzed the data: BB. Wrote the paper: BB AH.","The authors have declared that no competing interests exist."
"10.1371/journal.ppat.1000056","plos pathogens","2008-05-02T00:00:00Z","Jihong Li; Bruce A McClane","Department of Microbiology and Molecular Genetics, University of Pittsburgh School of Medicine, Pittsburgh, Pennsylvania, United States of America","Conceived and designed the experiments: JL BM. Performed the experiments: JL. Analyzed the data: JL BM. Wrote the paper: JL BM.","The authors have declared that no competing interests exist."
"10.1371/journal.pgen.1005208","plos genetics","2015-05-28T00:00:00Z","Dany Gaillard; Mingang Xu; Fei Liu; Sarah E Millar; Linda A Barlow","Department of Cell & Developmental Biology, and the Rocky Mountain Taste & Smell Center, University of Colorado Anschutz Medical Campus, Aurora, Colorado, United States of America; Department of Dermatology, University of Pennsylvania School of Medicine, Philadelphia, Pennsylvania, United States of America; Department of Cell & Developmental Biology, University of Pennsylvania School of Medicine, Philadelphia, Pennsylvania, United States of America; Institute for Regenerative Medicine at Scott & White Hospital, Texas A&M University System Health Science Center, Temple, Texas, United States of America","Conceived and designed the experiments: DG MX FL SEM LAB. Performed the experiments: DG MX FL. Analyzed the data: DG MX FL SEM LAB. Contributed reagents/materials/analysis tools: DG MX FL SEM LAB. Wrote the paper: DG MX FL SEM LAB.","The authors have declared that no competing interests exist."
"10.1371/journal.pbio.1001460","plos biology","2012-12-27T00:00:00Z","Elaine M Dunleavy; Nicole L Beier; Walter Gorgescu; Jonathan Tang; Sylvain V Costes; Gary H Karpen","Department of Genome Dynamics, Life Sciences Division, Lawrence Berkeley National Laboratory, and Department of Molecular and Cell Biology, University of California Berkeley, Berkeley, California, United States of America; Department of Cancer and DNA Damage Responses, Life Sciences Division, Lawrence Berkeley National Laboratory, Berkeley, California, United States of America","The author(s) have made the following declarations about their contributions: Conceived and designed the experiments: EMD NLB GHK. Performed the experiments: EMD NLB. Analyzed the data: EMD NLB WG. Contributed reagents/materials/analysis tools: WG JT SVC. Wrote the paper: EMD NLB GHK.","The authors have declared that no competing interests exist."
"10.1371/journal.pbio.1001455","plos biology","2013-01-03T00:00:00Z","Céline Jouffe; Gaspard Cretenet; Laura Symul; Eva Martin; Florian Atger; Felix Naef; Frédéric Gachon","Department of Pharmacology and Toxicology, University of Lausanne, Lausanne, Switzerland; The Institute of Bioengineering, School of Life Sciences, Ecole Polytechnique Fédérale de Lausanne, Lausanne, Switzerland","The author(s) have made the following declarations about their contributions: Conceived and designed the experiments: CJ GC FG. Performed the experiments: CJ GC EM FA FG. Analyzed the data: LS FN FG. Wrote the paper: FG FN.","The authors have declared that no competing interests exist."
"10.1371/journal.pgen.1005203","plos genetics","2015-05-05T00:00:00Z","Dustin C Hancks; Melissa K Hartley; Celia Hagan; Nathan L Clark; Nels C Elde","Department of Human Genetics, University of Utah School of Medicine, Salt Lake City, Utah, United States of America; Basic Sciences Division, Fred Hutchinson Cancer Research Center, Seattle, Washington, United States of America; Department of Computational and Systems Biology, University of Pittsburgh, Pittsburgh, Pennsylvania, United States of America","Conceived and designed the experiments: DCH NCE. Performed the experiments: DCH MKH CH. Analyzed the data: DCH NLC NCE. Contributed reagents/materials/analysis tools: NCE. Wrote the paper: DCH NCE.","The authors have declared that no competing interests exist."
"10.1371/journal.ppat.1000049","plos pathogens","2008-04-18T00:00:00Z","Lot de Witte; Rory D de Vries; Michiel van der Vlist; Selma Yüksel; Manja Litjens; Rik L de Swart; Teunis B H Geijtenbeek","Department of Molecular Cell Biology and Immunology, VU University Medical Center, Amsterdam, The Netherlands; Department of Virology, Erasmus MC, University Medical Center, Rotterdam, The Netherlands","Conceived and designed the experiments: LdW RDdV TG. Performed the experiments: LdW RDdV MvdV SY ML. Analyzed the data: LdW RDdV MvdV SY ML RLdS TG. Wrote the paper: LdW RDdV TG.","The authors have declared that no competing interests exist."
"10.1371/journal.ppat.1000050","plos pathogens","2008-04-18T00:00:00Z","Eleanor M Cottam; Jemma Wadsworth; Andrew E Shaw; Rebecca J Rowlands; Lynnette Goatley; Sushila Maan; Narender S Maan; Peter P C Mertens; Katja Ebert; Yanmin Li; Eoin D Ryan; Nicholas Juleff; Nigel P Ferris; John W Wilesmith; Daniel T Haydon; Donald P King; David J Paton; Nick J Knowles","Institute for Animal Health, Pirbright Laboratory, Pirbright, Woking, Surrey, United Kingdom; Division of Environmental and Evolutionary Biology, University of Glasgow, Glasgow, United Kingdom; Animal Health and Welfare, Defra, London, United Kingdom","Conceived and designed the experiments: EC DK DP NK. Performed the experiments: EC JW AS RR LG SM NM PM KE YL ER NJ NF. Analyzed the data: EC JWW DH DK DP NK. Contributed reagents/materials/analysis tools: EC YL ER NJ NF DH NK. Wrote the paper: EC DH DK DP NK.","The authors have declared that no competing interests exist."
"10.1371/journal.pgen.1005202","plos genetics","2015-05-28T00:00:00Z","Olga Sazonova; Yuqi Zhao; Sylvia Nürnberg; Clint Miller; Milos Pjanic; Victor G Castano; Juyong B Kim; Elias L Salfati; Anshul B Kundaje; Gill Bejerano; Themistocles Assimes; Xia Yang; Thomas Quertermous","Department of Medicine, Division of Cardiovascular Medicine, Stanford University School of Medicine, Stanford, California, United States of America; Cardiovascular Institute, Stanford University School of Medicine, Stanford, California, United States of America; Department of Integrative Biology and Physiology, University of California, Los Angeles, Los Angeles, California, United States of America; Department of Genetics, Stanford University School of Medicine, Stanford, California, United States of America; Department of Computer Science, Stanford University School of Medicine, Stanford, California, United States of America; Department of Pediatrics, Stanford University School of Medicine, Stanford, California, United States of America; Department of Developmental Biology, Stanford University School of Medicine, Stanford, California, United States of America","Conceived and designed the experiments: OS SN CM TQ JBK. Performed the experiments: OS SN YZ. Analyzed the data: OS SN YZ CM TA ELS VGC TQ MP. Contributed reagents/materials/analysis tools: ABK GB. Wrote the paper: OS YZ TA XY TQ.","The authors have declared that no competing interests exist."
"10.1371/journal.pbio.1001452","plos biology","2012-12-18T00:00:00Z","Mioara Larion; Roberto Kopke Salinas; Lei Bruschweiler-Li; Brian G Miller; Rafael Brüschweiler","Department of Chemistry and Biochemistry, Florida State University, Tallahassee, Florida, United States of America; Institute of Chemistry, University of São Paulo, São Paulo, Brazil; National High Magnetic Field Laboratory, Florida State University, Tallahassee, Florida, United States of America","The author(s) have made the following declarations about their contributions: Conceived and designed the experiments: ML RKS LB BGM RB. Performed the experiments: ML RKS. Analyzed the data: ML RKS LB BGM RB. Contributed reagents/materials/analysis tools: BGM RB. Wrote the paper: ML RKS LB BGM RB.","The authors have declared that no competing interests exist."
"10.1371/journal.ppat.1000048","plos pathogens","2008-04-18T00:00:00Z","Ziyin Li; Megan E Lindsay; Shawn A Motyka; Paul T Englund; Ching C Wang","Department of Pharmaceutical Chemistry, University of California, San Francisco, California, United States of America; Department of Biological Chemistry, Johns Hopkins University School of Medicine, Baltimore, Maryland, United States of America","Conceived and designed the experiments: ZL ML SM PE. Performed the experiments: ZL ML SM. Analyzed the data: ZL ML PE CW. Wrote the paper: ZL PE CW.","The authors have declared that no competing interests exist."
"10.1371/journal.pgen.1005209","plos genetics","2015-05-28T00:00:00Z","Hiroko Sano; Akira Nakamura; Michael J Texada; James W Truman; Hiroshi Ishimoto; Azusa Kamikouchi; Yutaka Nibu; Kazuhiko Kume; Takanori Ida; Masayasu Kojima","Department of Molecular Genetics, Institute of Life Science, Kurume University, Kurume, Fukuoka, Japan; Department of Germline Development, Institute of Molecular Embryology and Genetics, Kumamoto University, Kumamoto, Japan; Janelia Research Campus, Howard Hughes Medical Institute, Ashburn, Virginia, United States of America; Graduate School of Science, Nagoya University, Nagoya, Aichi, Japan; Precursory Research for Embryonic Science and Technology, Japan Science and Technology Agency, Tokyo, Japan; Department of Cell and Developmental Biology, Weill Medical College of Cornell University, New York, New York, United States of America; Graduate School of Pharmaceutical Sciences, Nagoya City University, Nagoya, Aichi, Japan; Division for Searching and Identification of Bioactive Peptides, Department of Bioactive Peptides, Frontier Science Research Center, University of Miyazaki, Miyazaki, Miyazaki, Japan","Conceived and designed the experiments: HS MK. Performed the experiments: HS AN MJT HI. Analyzed the data: HS AN MJT JWT HI AK. Contributed reagents/materials/analysis tools: KK TI. Wrote the paper: HS AN YN.","The authors have declared that no competing interests exist."
"10.1371/journal.pgen.1005207","plos genetics","2015-05-28T00:00:00Z","Eduardo Flores-Sandoval; D Magnus Eklund; John L Bowman","School of Biological Sciences, Monash University, Melbourne, Victoria, Australia; Department of Plant Biology, University of California, Davis, Davis, California, United States of America","Conceived and designed the experiments: EFS DME JLB. Performed the experiments: EFS DME. Analyzed the data: EFS DME JLB. Contributed reagents/materials/analysis tools: EFS DME. Wrote the paper: EFS DME JLB.","The authors have declared that no competing interests exist."
