"id","journal","publication_date","author","author_affiliate","author_notes","competing_interest"
"10.1371/journal.pone.0053145","plos one","2013-01-02T00:00:00Z","Feng Zhou; Min Xue; Di Qin; Xiaofei Zhu; Cong Wang; Jianzhong Zhu; Tingting Hao; Lin Cheng; Xiuying Chen; Zhiqiang Bai; Ninghan Feng; Shou-Jiang Gao; Chun Lu","State Key Laboratory of Reproductive Medicine, Nanjing Medical University, Nanjing, People’s Republic of China; Key Laboratory of Pathogen Biology of Jiangsu Province, Nanjing Medical University, Nanjing, People’s Republic of China; Department of Microbiology and Immunology, Nanjing Medical University, Nanjing, People’s Republic of China; Department of Pathogenic Biology and Immunology, Xuzhou Medical College, Xuzhou, Jiangsu, People’s Republic of China; Department of Physiology, Xuzhou Medical College, Xuzhou, Jiangsu, People’s Republic of China; Pathology of Department, the First Affiliated Hospital of Nanjing Medical University, Nanjing, People’s Republic of China; Cancer Virology Program, University of Pittsburgh Cancer Institute, Pittsburgh, Pennsylvania, United States of America; Department of Urology, the First Affiliated Hospital of Nanjing Medical University, Nanjing, People’s Republic of China; Department of Molecular Microbiology and Immunology, Keck School of Medicine, University of Southern California, Los Angeles, California, United States of America","Conceived and designed the experiments: DQ CL. Performed the experiments: FZ MX XZ CW TH LC XC. Analyzed the data: ZB NF. Contributed reagents/materials/analysis tools: SJG. Wrote the paper: FZ JZ CL.","The authors have declared that no competing interests exist"
"10.1371/journal.pone.0121900","plos one","2015-04-02T00:00:00Z","Bryan D James; Patricia A Boyle; Lei Yu; S Duke Han; David A Bennett","Rush Alzheimer’s Disease Center, Chicago, IL, United States of America; Department of Internal Medicine, Rush University Medical Center, Chicago, IL, United States of America; Department of Behavioral Sciences, Rush University Medical Center, Chicago, IL, United States of America; Department of Neurological Sciences, Rush University Medical Center, Chicago, IL, United States of America; Department of Mental Health, VA Long Beach Healthcare System, Long Beach, CA, United States of America","Conceived and designed the experiments: BDJ PAB. Performed the experiments: BDJ LY. Analyzed the data: BDJ LY. Wrote the paper: BDJ PAB SDH DAB.","The authors have declared that no competing interests exist."
"10.1371/journal.pone.0110477","plos one","2014-10-28T00:00:00Z","Kersten Villringer; Ulrike Grittner; Lars-Arne Schaafs; Christian H Nolte; Heinrich Audebert; Jochen B Fiebach","Academic Neuroradiology, Department of Neurology and Center for Stroke Research, Charité, Berlin, Germany; Department for Biostatistics and Clinical Epidemiology and Center for Stroke Research, Charité, Berlin, Germany; Department of Neurology and Center for Stroke Research, Charité, Berlin, Germany","Conceived and designed the experiments: KV L-AS JBF. Performed the experiments: KV. Analyzed the data: KV UG. Wrote the paper: KV UG CHN HA JBF.","KV reports that receiving consulting fees by Bayer Schering and JBF reports receiving consulting, lecture and advisory board fees by BMS, Siemens, Perceptive, Synarc, BioImaging Technologies, Novartis, Wyeth, Pfizer, Boehringer Ingelheim, Lundbeck and Sygnis do not alter their adherence to PLOS ONE policies on sharing data and materials."
"10.1371/journal.pone.0076060","plos one","2013-09-17T00:00:00Z","Henriette Frikke-Schmidt; Thomas Åskov Pedersen; Christian Fledelius; Grith Skytte Olsen; Marc Hellerstein","Department of Nutritional Sciences and Toxicology, University of California Berkeley, Berkeley, California, United States of America; Department of Insulin Biology, Novo Nordisk A/S, Maaloev, Denmark; Department of Insulin Pharmacology, Novo Nordisk A/S, Maaloev, Denmark; KineMed, Inc., Emeryville, California, United States of America","Conceived and designed the experiments: HFS TÅP GSO CF MH. Performed the experiments: HFS. Analyzed the data: HFS. Contributed reagents/materials/analysis tools: MH. Wrote the manuscript: HFS MH. Reviewed the manuscript prior to submission: HFS TÅP GSO CF MH.","The authors declare that the study was funded by Novo Nordisk A/S through which the authors HF-S, TÅP, GSO, and CF all are employees and stakeholders. The insulin used for the experiments has been provided by Novo Nordisk A/S. All Intellectual Property Rights of the current study are owned by University of California Berkeley and there has been no compromise of the objectivity or validity of the data in the manuscript. There are no further patents, products in development or marketed products to declare. This does not alter the authors' adherence to all the PLOS ONE policies on sharing data and materials."
"10.1371/journal.pone.0110474","plos one","2014-10-17T00:00:00Z","Timothy J Wade; Cynthia J Lin; Jyotsna S Jagai; Elizabeth D Hilborn","United States Environmental Protection Agency, National Health and Environmental Effects Research Laboratory, Environmental Public Health Division, Chapel Hill, North Carolina, United States of America; Oak Ridge Institute for Science and Education (ORISE) Research Participation Program at the United States Environmental Protection Agency, Chapel Hill, North Carolina, United States of America; University of North Carolina, Gillings School of Global Public Health, Department of Epidemiology, Chapel Hill, North Carolina, United States of America; University of Illinois, Chicago, School of Public Health, Division of Environmental and Occupational Health Sciences, Chicago, Illinois, United States of America","Conceived and designed the experiments: TW EH CL JJ. Performed the experiments: TW CL. Analyzed the data: TW. Contributed reagents/materials/analysis tools: TW EH CL JJ. Contributed to the writing of the manuscript: TW CL JJ EH.","The authors have declared that no competing interests exist."
"10.1371/journal.pone.0064596","plos one","2013-05-21T00:00:00Z","Fabio Campanella; Franco Fabbro; Cosimo Urgesi","Neurosurgery Unit, Azienda Ospedaliero-Universitaria ‘Santa Maria della Misericordia’, Udine, Italy; Department of Human Sciences, University of Udine, Udine, Italy; Istituto di Ricovero e Cura a Carattere Scientifico ‘E. Medea’, Polo Regionale Friuli Venezia Giulia, San Vito al Tagliamento, Pordenone, Italy","Conceived and designed the experiments: FC FF CU. Performed the experiments: FC CU. Analyzed the data: FC CU. Wrote the paper: FC FF CU.","The authors have declared that no competing interests exist."
"10.1371/journal.pone.0030257","plos one","2012-01-17T00:00:00Z","Ram H Nagaraj; Alok Kumar Panda; Shilpa Shanthakumar; Puttur Santhoshkumar; NagaRekha Pasupuleti; Benlian Wang; Ashis Biswas","Department of Ophthalmology and Visual Sciences, Case Western Reserve University, Cleveland, Ohio, United States of America; School of Basic Sciences, Indian Institute of Technology Bhubaneswar, Orissa, India; Department of Ophthalmology, University of Missouri-Columbia, Columbia, Missouri, United States of America; Center for Proteomics and Bioinformatics, Case Western Reserve University, Cleveland, Ohio, United States of America","Conceived and designed the experiments: RHN AB. Performed the experiments: RHN AKP SS PS NP BW AB. Analyzed the data: RHN PS AB. Wrote the paper: RHN PS BW AB.","The authors have declared that no competing interests exist."
"10.1371/journal.pone.0121897","plos one","2015-03-26T00:00:00Z","Jude S Morton; Irene J Andersson; Po-Yin Cheung; Philip Baker; Sandra T Davidge","Department of Obstetrics and Gynaecology, University of Alberta, Edmonton, AB, Canada; Women and Children's Health Research Institute and the Cardiovascular Research Centre, Edmonton, AB, Canada; Department of Medicine, University of Alberta, Edmonton, AB, Canada; Department of Physiology, University of Alberta, Edmonton, AB, Canada; Department of Pediatrics, University of Alberta, Edmonton, AB, Canada; Gravida, National Research Centre for Growth and Development, Liggins Institute, University of Auckland, Auckland, New Zealand","Conceived and designed the experiments: JM IA SD. Performed the experiments: JM IA. Analyzed the data: JM IA. Contributed reagents/materials/analysis tools: PYC PB SD. Wrote the paper: JM IA PYC PB SD.","The authors have declared that no competing interests exist."
"10.1371/journal.pone.0041675","plos one","2012-07-23T00:00:00Z","Annukka M Lahtinen; Peter A Noseworthy; Aki S Havulinna; Antti Jula; Pekka J Karhunen; Johannes Kettunen; Markus Perola; Kimmo Kontula; Christopher Newton-Cheh; Veikko Salomaa","Research Programs Unit, Molecular Medicine and Department of Medicine, University of Helsinki, Helsinki, Finland; Cardiovascular Research Center and Center for Human Genetic Research, Massachusetts General Hospital, Boston, Massachusetts, United States of America; Program in Medical and Population Genetics, Broad Institute, Cambridge, Massachusetts, United States of America; National Institute for Health and Welfare, Helsinki, Finland; National Institute for Health and Welfare, Turku, Finland; School of Medicine, University of Tampere and Centre for Laboratory Medicine, Tampere University Hospital, Tampere, Finland; Institute of Molecular Medicine FIMM, University of Helsinki, Helsinki, Finland","Conceived and designed the experiments: AML PAN ASH AJ PJK JK MP KK CNC VS. Performed the experiments: AML. Analyzed the data: ASH JK. Contributed reagents/materials/analysis tools: PAN ASH AJ PJK JK MP KK CNC VS. Wrote the paper: AML PAN ASH KK CNC VS.","The authors have declared that no competing interests exist."
"10.1371/journal.pone.0030246","plos one","2012-01-20T00:00:00Z","Junegoo Lee; Tilahun Jiffar; Michael E Kupferman","Department of Head and Neck Surgery, MD Anderson Cancer Center, University of Texas, Houston, Texas, United States of America","Conceived and designed the experiments: JL TJ MEK. Performed the experiments: JL TJ MEK. Analyzed the data: JL TJ MEK. Contributed reagents/materials/analysis tools: JL TJ MEK. Wrote the paper: JL TJ MEK.","The authors have declared that no competing interests exist."
"10.1371/journal.pone.0007106","plos one","2009-09-23T00:00:00Z","Lauren A Solomon; Jennifer R Li; Nathalie G Bérubé; Frank Beier","Department of Biochemistry, University of Western Ontario, London, Ontario, Canada; Children's Health Research Institute, Victoria Research Laboratories, London, Ontario, Canada; Skeletal Biology Group, University of Western Ontario, London, Ontario, Canada; Department of Paediatrics, University of Western Ontario, London, Ontario, Canada; Department of Physiology and Pharmacology, University of Western Ontario, London, Ontario, Canada","Conceived and designed the experiments: NB FB. Performed the experiments: LAS JRL. Analyzed the data: LAS JRL. Wrote the paper: LAS JRL NB FB.","The authors have declared that no competing interests exist."
"10.1371/journal.pone.0098890","plos one","2014-06-05T00:00:00Z","Estefanía Jurado-Tarifa; Sebastian Napp; Juan Manuel Gómez-Pacheco; Manuel Fernández-Morente; Juan Antonio Jaén-Téllez; Antonio Arenas; Ignacio García-Bocanegra","Departamento de Sanidad Animal, Facultad de Veterinaria, Universidad de Córdoba-Agrifood Excellence International Campus, Córdoba, Spain; Centre de Recerca en Sanitat Animal (CReSA), Universitat Autònoma de Barcelona-Institut de Recerca i Tecnología Agralimentàries (UAB-IRTA), Bellaterra, Barcelona, Spain; Laboratorio de Sanidad y Producción Animal, Consejería de Agricultura, Pesca y Desarrollo Rural de la Junta de Andalucía, Córdoba, Spain; Servicio de Sanidad Animal, Consejería de Agricultura, Pesca y Desarrollo Rural de la Junta de Andalucía, Sevilla, Spain; Agencia de Gestión Agraria y Pesquera de Andalucía, Consejería de Agricultura, Pesca y Desarrollo Rural de la Junta de Andalucía, Sevilla, Spain","Conceived and designed the experiments: IGB EJ MF JAJ AA. Performed the experiments: JG IGB EJ. Analyzed the data: EJ IGB SN JG. Contributed reagents/materials/analysis tools: IGB JG JAJ. Wrote the paper: IGB EJ SN JG. Performed the field-work: IGB EJ MF JAJ. Read, revised, and approved the final manuscript: EJ SN JG MF JAJ AA IGB.","The authors have declared that no competing interests exist."
"10.1371/journal.pone.0087459","plos one","2014-01-27T00:00:00Z","Allison Bray; James Nieh","Division of Biological Sciences, Section of Ecology, Behavior, and Evolution, University of California San Diego, La Jolla, California, United States of America","Conceived and designed the experiments: AB JN. Performed the experiments: AB. Analyzed the data: AB JN. Contributed reagents/materials/analysis tools: JN. Wrote the paper: AB JN.","The authors have declared that no competing interests exist."
"10.1371/journal.pone.0041640","none","2012-07-27T00:00:00Z","Julia Metzger; Bernhard Ohnesorge; Ottmar Distl","Institute for Animal Breeding and Genetics, University of Veterinary Medicine Hannover, Hannover, Germany; Clinic for Horses, University of Veterinary Medicine Hannover, Hannover, Germany","Conceived and designed the experiments: OD BO. Performed the experiments: JM OD BO. Analyzed the data: JM OD. Contributed reagents/materials/analysis tools: OD BO. Wrote the paper: JM OD BO. Clinical diagnosis and surgery: BO.","The authors have declared that no competing interests exist."
"10.1371/journal.pone.0087464","plos one","2014-01-31T00:00:00Z","Jawed Iqbal; Steven McRae; Thi Mai; Krishna Banaudha; Mehuli Sarkar-Dutta; Gulam Waris","Department of Microbiology and Immunology, H. M. Bligh Cancer Research Laboratories, Rosalind Franklin University of Medicine and Science, Chicago Medical School, North Chicago, Illinois, United States of America; Department of Biochemistry and Molecular Biology, The George Washington University, Washington, DC, United States of America","Conceived and designed the experiments: JI SM TM KB MSD GW. Performed the experiments: JI SM MSD GW. Analyzed the data: JI GW. Contributed reagents/materials/analysis tools: JI KB GW. Wrote the paper: JI GW.","Gulam Waris is a PLOS ONE Academic Editorial Board member. This does not alter the authors’ adherence to all the PLOS ONE policies on sharing data and materials."
"10.1371/journal.pone.0007079","plos one","2009-09-17T00:00:00Z","Charlotte Andreasen; Daniel A Powell; Nicholas H Carbonetti","Department of Microbiology and Immunology, University of Maryland School of Medicine, Baltimore, Maryland, United States of America","Conceived and designed the experiments: NC. Performed the experiments: CA DP. Analyzed the data: CA DP NC. Wrote the paper: CA NC.","The authors have declared that no competing interests exist."
"10.1371/journal.pone.0030221","plos one","2012-01-11T00:00:00Z","Daniel G Weber; Georg Johnen; Oleksandr Bryk; Karl-Heinz Jöckel; Thomas Brüning","Center of Molecular Medicine, Institute of Prevention and Occupational Medicine of the German Social Accident Insurance - Institute of the Ruhr-Universität Bochum (IPA), Bochum, Germany; Institute of Medical Informatics, Biometry and Epidemiology, University Duisburg-Essen, Essen, Germany","Conceived and designed the experiments: DGW GJ OB TB. Performed the experiments: OB. Analyzed the data: DGW OB KHJ. Wrote the paper: DGW GJ.","The authors have declared that no competing interests exist."
"10.1371/journal.pone.0133395","plos one","2015-07-23T00:00:00Z","Yoshitake Takao; Yuji Tomaru; Keizo Nagasaki; Daiske Honda","Department of Marine Bioscience, Fukui Prefectural University, 1–1 Gakuencho, Obama, Fukui, 917–0003, Japan; National Research Institute of Fisheries and Environment of Inland Sea, Fisheries Research Agency, 2-17-5 Maruishi, Hatsukaichi, Hiroshima, 739–0452, Japan; Department of Biology, Faculty of Science and Engineering, Konan University, 8-9-1 Okamoto, Higashinada, Kobe, 658–8501, Japan","Conceived and designed the experiments: Y. Takao Y. Tomaru KN DH. Performed the experiments: Y. Takao Y. Tomaru. Analyzed the data: Y. Takao. Contributed reagents/materials/analysis tools: Y. Takao Y. Tomaru KN DH. Wrote the paper: Y. Takao Y. Tomaru KN DH.","The authors have declared that no competing interests exist."
"10.1371/journal.pone.0076041","plos one","2013-10-17T00:00:00Z","Donglai Chen; Beihai Jiang; Jiadi Xing; Maoxing Liu; Ming Cui; Yiqiang Liu; Zaozao Wang; Lei Chen; Hong Yang; Chenghai Zhang; Zhendan Yao; Nan Zhang; Jiafu Ji; Hong Qu; Xiangqian Su","Center for Bioinformatics, State Key Laboratory of Protein and Plant Gene Research, College of Life Sciences, Peking University, Beijing, China; Key laboratory of Carcinogenesis and Translational Research (Ministry of Education), Department of Minimally Invasive Gastrointestinal Surgery, Peking University Cancer Hospital & Institute, Beijing, China; Key laboratory of Carcinogenesis and Translational Research (Ministry of Education), Department of Pathology, Peking University Cancer Hospital & Institute, Beijing, China; Key laboratory of Carcinogenesis and Translational Research (Ministry of Education), Department of Surgery, Peking University Cancer Hospital & Institute, Beijing, China","Conceived and designed the experiments: XS HQ. Performed the experiments: DC BJ JX ML. Analyzed the data: DC BJ LM HQ. Contributed reagents/materials/analysis tools: JJ JX ML MC YL ZW LC HY CZ ZY NZ. Wrote the paper: DC BJ HQ.","The authors have declared that no competing interests exist."
"10.1371/journal.pone.0030234","plos one","2012-01-23T00:00:00Z","Luca Orlando; Yolanda Sanchez-Ripoll; James Foster; Heather Bone; Claudia Giachino; Melanie J Welham","Centre for Regenerative Medicine, Department of Pharmacy and Pharmacology, University of Bath, Bath, United Kingdom; Department of Clinical and Biological Sciences, University of Turin, Orbassano (Torino), Italy","Conceived and designed the experiments: LO YS-R HB MJW. Performed the experiments: LO YS-R JF HB. Analyzed the data: LO CG MJW. Wrote the paper: LO CG MJW.","The authors have declared that no competing interests exist."
"10.1371/journal.pone.0041648","none","2012-07-25T00:00:00Z","Daniele Lilleri; Giuseppe Gerna; Paola Zelini; Antonella Chiesa; Vanina Rognoni; Angela Mastronuzzi; Giovanna Giorgiani; Marco Zecca; Franco Locatelli","Laboratori Sperimentali di Ricerca, Area Trapiantologica, Fondazione IRCCS Policlinico San Matteo, Pavia, Italy; Struttura Semplice Virologia Molecolare, Struttura Complessa Virologia e Microbiologia, Fondazione IRCCS Policlinico San Matteo, Pavia, Italy; Dipartimento di Oncoematologia Pediatrica, IRCCS Ospedale Pediatrico Bambino Gesù, Roma, Italy; Struttura Complessa di Ematologia ed Oncologia Pediatrica, Fondazione IRCCS Policlinico San Matteo, Pavia, Italy; Università di Pavia, Pavia, Italy","Conceived and designed the experiments: G. Gerna FL. Performed the experiments: PZ AC VR. Analyzed the data: DL. Contributed reagents/materials/analysis tools: AM MZ G. Giorgiani. Wrote the manuscript: DL G. Gerna FL.","The authors have declared that no competing interests exist."
"10.1371/journal.pone.0121878","plos one","2015-03-30T00:00:00Z","Jonathan A Hardman; Iain S Haslam; Nilofer Farjo; Bessam Farjo; Ralf Paus","The Dermatology Centre, Institute of Inflammation and Repair, University of Manchester, Manchester, United Kingdom; Doctoral Training Centre in Integrative Systems Biology, Manchester Interdisciplinary Bio centre, University of Manchester, Manchester, United Kingdom; The Farjo Hair Institute, Manchester, United Kingdom; Department of Dermatology, University of Muenster, Muenster, Germany","Conceived and designed the experiments: JH RP. Performed the experiments: JH. Analyzed the data: JH. Contributed reagents/materials/analysis tools: NF BF IH. Wrote the paper: JH IH RP.","The authors have declared that no competing interests exist."
"10.1371/journal.pone.0087502","plos one","2014-01-31T00:00:00Z","Wu Zheng; Xueyan Zhang; Zuoren Yang; Jiahe Wu; Fenglian Li; Lanling Duan; Chuanliang Liu; Lili Lu; Chaojun Zhang; Fuguang Li","State Key Laboratory of Cotton Biology, Institute of Cotton Research, Chinese Academy of Agricultural Sciences, Anyang, Henan, China; Institute of Microbiology, Chinese Academy of Sciences, Beijing, China","Conceived and designed the experiments: Fuguang Li CZ WZ. Performed the experiments: WZ. Analyzed the data: WZ Fuguang Li CZ JW XZ ZY. Contributed reagents/materials/analysis tools: CZ LD Fuguang Li CL Fenglian Li ZY. Wrote the paper: WZ. Check writing: LL JW.","The authors have declared that no competing interests exist."
"10.1371/journal.pone.0110487","plos one","2014-10-14T00:00:00Z","Agustin Gonzalez-Vicente; Pablo D Cabral; Jeffrey L Garvin","Department of Physiology and Biophysics, Case Western Reserve University, School of Medicine, Cleveland, Ohio, United States of America; Universidad de Buenos Aires, Facultad de Farmacia y Bioquímica, Ciudad Autónoma de Buenos Aires, Buenos Aires, Argentina; Universidad de Buenos Aires, Facultad de Medicina, Ciudad Autónoma de Buenos Aires, Buenos Aires, Argentina; Hypertension and Vascular Research, Department of Internal Medicine, Henry Ford Hospital, Detroit, Michigan, United States of America","Conceived and designed the experiments: AGV PDC JLG. Performed the experiments: AGV PDC. Analyzed the data: AGV PDC JLG. Contributed reagents/materials/analysis tools: JLG. Contributed to the writing of the manuscript: AGV JLG.","The authors have declared that no competing interests exist."
"10.1371/journal.pone.0098897","plos one","2014-06-10T00:00:00Z","Allison J Richard; Scott Fuller; Veaceslav Fedorcenco; Robbie Beyl; Thomas P Burris; Randall Mynatt; David M Ribnicky; Jacqueline M Stephens","Pennington Biomedical Research Center, Louisiana State University, Baton Rouge, Louisiana, United States of America; Department of Pharmacological & Physiological Science, Saint Louis University, St. Louis, Missouri, United States of America; Department of Plant Biology and Pathology, Rutgers University, New Brunswick, New Jersey, United States of America","Conceived and designed the experiments: JMS AJR RM. Performed the experiments: AJR VF TPB. Analyzed the data: AJR TPB RB. Contributed reagents/materials/analysis tools: DMR. Wrote the paper: AJR SF JMS.","The authors have declared that no competing interest exist."
"10.1371/journal.pone.0053153","plos one","2013-02-15T00:00:00Z","Zhimin Ma; Yu Liu; Yu Xu; Yun Huang; Min Xu; Xiaolin Zhu; Huijie Zhang; Baihui Xu; Fei Huang; Zhi Yang; Xiaoying Li; Weiqing Wang; Yufang Bi","Key Laboratory for Endocrine and Metabolic Diseases of Ministry of Health, Rui-Jin Hospital, Shanghai Jiao Tong University School of Medicine, E-Institute of Shanghai Universities, Shanghai, China; Shanghai Clinical Center for Endocrine and Metabolic Diseases, Shanghai Institute of Endocrine and Metabolic Diseases, Department of Endocrinology and Metabolism, Rui-jin Hospital, Shanghai Jiao Tong University School of Medicine, Shanghai, China","Conceived and designed the experiments: YB WW MX. Performed the experiments: ZM YL YX YH XZ HZ BX FH ZY. Analyzed the data: ZM YL YH MX. Contributed reagents/materials/analysis tools: XL WW YB MX. Wrote the paper: ZM YL.","The authors have declared that no competing interests exist."
"10.1371/journal.pone.0053152","plos one","2012-12-31T00:00:00Z","Wei-Bin Cai; Yang Zhang; Rui Cheng; Zheng Wang; Shu-Huan Fang; Zu-Min Xu; Xia Yang; Zhong-Han Yang; Jian-Xing Ma; Chun-Kui Shao; Guo-Quan Gao","Department of Biochemistry, Zhongshan School of Medicine, Sun Yat-sen University, Guangzhou, China; DME Center, Clinical Pharmacology Institute, Guangzhou University of Chinese Medicine, Guangzhou, China; Key Laboratory of Functional Molecules from Marine Microorganisms (Sun Yat-sen University), Department of Education of Guangdong Province, Guangzhou, China; Department of Physiology, University of Oklahoma Health Sciences Center, Oklahoma City, Oklahoma, United States of America; Department of Pathology, the Third Affiliated Hospital, Sun Yat-sen University, Guangzhou, China; China Key Laboratory of Tropical Disease Control (Sun Yat-sen University), Ministry of Education, Guangzhou, China","Conceived and designed the experiments: GQG CKS JXM WBC. Performed the experiments: WBC YZ RC ZW. Analyzed the data: WBC YZ RC ZW GQG CKS JXM. Contributed reagents/materials/analysis tools: WBC SHF ZMX XY ZHY. Wrote the paper: WBC GQG.","The authors have declared that no competing interests exist."
"10.1371/journal.pone.0110478","plos one","2014-10-31T00:00:00Z","Eric Frouin; Bernard Guillot; Marion Larrieux; Ariane Tempier; Nathalie Boulle; Vincent Foulongne; Céline Girard; Valérie Costes; Jérome Solassol","Department of Biopathology, CHU Montpellier, Montpellier, France; University of Montpellier I, Montpellier, France; Department of Dermatology, CHU Montpellier, Montpellier, France; U1058, INSERM, University of Montpellier I, Montpellier, France; Department of Virology, CHU Montpellier, Montpellier, France; Department of Clinical Oncoproteomics, Montpellier Cancer Institute (ICM), Montpellier, France","Conceived and designed the experiments: EF BG JS. Performed the experiments: EF ML AT NB VF CG VC. Analyzed the data: EF BG ML JS. Contributed reagents/materials/analysis tools: EF ML AT NB VF VC JS. Wrote the paper: EF BG ML NB VF VC JS.","The authors have declared that no competing interests exist."
"10.1371/journal.pone.0087511","plos one","2014-02-07T00:00:00Z","Jeroen Geuze; Jason Farquhar; Peter Desain","Radboud University Nijmegen, Donders Institute for Brain, Cognition, and Behaviour, Nijmegen, The Netherlands","Conceived and designed the experiments: JG PD JF. Performed the experiments: JG. Analyzed the data: JG. Contributed reagents/materials/analysis tools: JG JF. Wrote the paper: JG PD JF.","The authors have declared that no competing interests exist."
