"id","journal","publication_date","author","author_affiliate","author_notes","competing_interest"
"10.1371/journal.pone.0135400","plos one","2015-08-14T00:00:00Z","Mei Wang; Huili Wang; Rongbo Zhang; Meiping Ma; Kun Mei; Fang Fang; Xuedong Wang","Key Laboratory of Watershed Science and Health of Zhejiang Province, Wenzhou Medical University, Wenzhou 325035, China; College of Life Sciences, Wenzhou Medical University, Wenzhou 325035, China","Conceived and designed the experiments: WX WH. Performed the experiments: WM ZR. Analyzed the data: MM. Contributed reagents/materials/analysis tools: MK FF. Wrote the paper: WM.","The authors have declared that no competing interests exist."
"10.1371/journal.pone.0010395","plos one","2010-05-13T00:00:00Z","Melissa G Naylor; Xihong Lin; Scott T Weiss; Benjamin A Raby; Christoph Lange","Department of Biostatistics, Harvard School of Public Health, Boston, Massachusetts, United States of America; Channing Laboratory, Brigham and Women's Hospital, Boston, Massachusetts, United States of America","Conceived and designed the experiments: MGN XL BAR CL. Performed the experiments: MGN. Analyzed the data: MGN. Contributed reagents/materials/analysis tools: STW. Wrote the paper: MGN BAR.","The authors have declared that no competing interests exist."
"10.1371/journal.pone.0010448","plos one","2010-05-03T00:00:00Z","Magaly M Blas; Isaac E Alva; Cesar P Carcamo; Robinson Cabello; Steven M Goodreau; Ann M Kimball; Ann E Kurth","Unit of Epidemiology, HIV and STD, School of Public Health and Administration, Universidad Peruana Cayetano Heredia, Lima, Peru; NGO Via Libre, Lima, Peru; Department of Epidemiology, School of Public Health and Community Medicine, University of Washington, Seattle, Washington, United States of America; Department of Anthropology, University of Washington, Seattle, Washington, United States of America; Departments of Global Health, and of Epidemiology, School of Public Health and Community Medicine, University of Washington, Seattle, Washington, United States of America; School of Nursing, University of Washington, Seattle, Washington, United States of America","Conceived and designed the experiments: MMB IA. Performed the experiments: MMB IA RC. Analyzed the data: MMB IA CPC SMG AMK AK. Contributed reagents/materials/analysis tools: MMB IA CPC RC SMG AMK AK. Wrote the paper: MMB IA CPC RC SMG AMK AK.","The authors have declared that no competing interests exist."
"10.1371/journal.pone.0135463","plos one","2015-08-14T00:00:00Z","Vladan P Čokić; Pascal Mossuz; Jing Han; Nuria Socoro; Bojana B Beleslin-Čokić; Olivera Mitrović; Tijana Subotički; Miloš Diklić; Danijela Leković; Mirjana Gotić; Raj K Puri; Constance Tom Noguchi; Alan N Schechter","Institute for Medical Research, University of Belgrade, Belgrade, Serbia; Département d'Hématologie, Institut de Biologie et Pathologie, CHU Grenoble, Grenoble, France; Tumor vaccines and Biotechnology Branch, Division of Cellular and Gene Therapies, Center for Biologics Evaluation and Research, Food and Drug Administration, Bethesda, MD, United States of America; Laboratoire TIMC IMAG, Faculté de Médecine de Grenoble, La Tronche Cedex, Grenoble, France; Clinic of Endocrinology, Diabetes and Diseases of Metabolism, Clinical Center of Serbia, Belgrade, Serbia; Clinic of Hematology, Clinical Center of Serbia, Belgrade, Serbia; Medical Faculty, University of Belgrade, Belgrade, Serbia; Molecular Medicine Branch, National Institute of Diabetes and Digestive and Kidney Diseases, National Institutes of Health, Bethesda, MD, United States of America","Conceived and designed the experiments: VPC RKP PM. Performed the experiments: VPC JH NS BBC. Analyzed the data: VPC OM TS MD BBC DL. Contributed reagents/materials/analysis tools: ANS CTN RKP VPC PM MG. Wrote the paper: VPC RKP ANS CTN PM.","The authors have declared that no competing interests exist."
"10.1371/journal.pone.0124339","plos one","2015-04-13T00:00:00Z","Maja Vukić; Antonio Neme; Sabine Seuter; Noora Saksa; Vanessa D F de Mello; Tarja Nurmi; Matti Uusitupa; Tomi-Pekka Tuomainen; Jyrki K Virtanen; Carsten Carlberg","School of Medicine, Institute of Biomedicine, University of Eastern Finland, Kuopio, Finland; Institute of Public Health and Clinical Nutrition, University of Eastern Finland, Kuopio, Finland","Conceived and designed the experiments: MV AN CC. Performed the experiments: MV. Analyzed the data: MV AN CC. Contributed reagents/materials/analysis tools: SS NS VdM TN MU T-PT JV. Wrote the paper: CC.","The authors have declared that no competing interests exist."
"10.1371/journal.pone.0031965","plos one","2012-02-20T00:00:00Z","Di Tian; Wanju Zhang; Jing He; Yi Liu; Zhigang Song; Zhitong Zhou; Min Zheng; Yunwen Hu","Pathogen Diagnosis and Biosafety Department, Shanghai Public Health Clinical Center Affiliated to Fudan University, Shanghai, China; State Key Laboratory of Infectious Disease Diagnostic and Treatment, First Affiliated Hospital, School of Medicine, Zhejiang University, Hangzhou, China","Conceived and designed the experiments: YH. Performed the experiments: DT WZ YL. Analyzed the data: DT WZ JH MZ. Contributed reagents/materials/analysis tools: MZ JH ZS ZZ. Wrote the paper: WZ DT.","The authors have declared that no competing interests exist."
"10.1371/journal.pone.0124337","plos one","2015-04-21T00:00:00Z","Changxing Ma; Guogen Shan; Song Liu","Department of Biostatistics, University at Buffalo, Buffalo, New York 14214, USA; Department of Environmental and Occupational Health, School of Community Health Sciences, University of Nevada Las Vegas, Las Vegas, NV 89154, USA; Department of Biostatistics and Bioinformatics, Roswell Park Cancer Institute, Buffalo, NY 14203, USA","Conceived and designed the experiments: CM GS. Performed the experiments: CM. Analyzed the data: CM. Contributed reagents/materials/analysis tools: CM GS. Wrote the paper: CM GS SL.","The authors have declared that no competing interests exist."
"10.1371/journal.pone.0054974","plos one","2013-02-06T00:00:00Z","Christina Spry; Cristiano Macuamule; Zhiyang Lin; Kristopher G Virga; Richard E Lee; Erick Strauss; Kevin J Saliba","Research School of Biology, College of Medicine, Biology and Environment, The Australian National University, Canberra, Australian Capital Territory, Australia; Medical School, College of Medicine, Biology and Environment, The Australian National University, Canberra, Australian Capital Territory, Australia; Department of Biochemistry, Stellenbosch University, Matieland, Stellenbosch, South África; Department of Pharmaceutical and Administrative Sciences, Presbyterian College School of Pharmacy, Clinton, South Carolina, United States of America; Department of Pharmaceutical Sciences, University of Tennessee Health Science Center, Memphis, Tennessee, United States of America; Department of Chemical Biology and Therapeutics, St. Jude Children’s Research Hospital, Memphis, Tennessee, United States of America","Interpreted data and discussed experimental design: CS CM ZL KGV REL ES KJS. Conceived and designed the experiments: CS CM ES KJS. Performed the experiments: CS CM ZL KJS. Analyzed the data: CS CM ZL KJS. Contributed reagents/materials/analysis tools: KGV REL ES. Wrote the paper: CS ES KJS.","The authors have declared that no competing interests exist."
"10.1371/journal.pone.0124229","plos one","2015-04-16T00:00:00Z","Nadine Correia Santos; Patrício Soares Costa; Liliana Amorim; Pedro Silva Moreira; Pedro Cunha; Jorge Cotter; Nuno Sousa","Life and Health Sciences Research Institute (ICVS), School of Health Sciences, University of Minho, Braga, Portugal; ICVS/3B’s, PT Government Associate Laboratory, Braga/Guimarães, Portugal; Centro Hospitalar do Alto Ave—EPE, Guimarães, Portugal","Conceived and designed the experiments: NCS PC JC NS. Performed the experiments: NCS PC JC NS. Analyzed the data: NCS PSC LA PSM. Contributed reagents/materials/analysis tools: NCS PSC LA PSM. Wrote the paper: NCS PSC LA PSM PC JC NS. Participated in data interpretation: NCS PSC LA PSM PC JC NS. Contributed substantially to the scientific process leading up to the writing of the submitted manuscript: NCS PSC LA PSM PC JC NS. Approved of the final version: NCS PSC LA PSM PC JC NS.","The authors have declared that no competing interests exist."
"10.1371/journal.pone.0124227","plos one","2015-04-23T00:00:00Z","Matthew C L Keith; Xian-Liang Tang; Yukichi Tokita; Qian-hong Li; Shahab Ghafghazi; Joseph Moore IV; Kyung U Hong; Brandon Elmore; Alok Amraotkar; Brian L Ganzel; Kendra J Grubb; Michael P Flaherty; Gregory Hunt; Bathri Vajravelu; Marcin Wysoczynski; Roberto Bolli","Institute of Molecular Cardiology, University of Louisville, Louisville, Kentucky, United States of America; Department of Cardiothoracic Surgery, University of Louisville, Louisville, Kentucky, United States of America","Conceived and designed the experiments: MK XT YT QL BE KH RB. Performed the experiments: MK XT YT QL BE BG KG MF GH KH BV. Analyzed the data: MK XT YT QL KH AA JM RB. Contributed reagents/materials/analysis tools: MK XT QL BG KG MF KH MW RB. Wrote the paper: MK XT YT QL SG KH BE AA BG KG MF GH JM BV MW RB.","The authors have declared that no competing interests exist."
"10.1371/journal.pone.0124222","plos one","2015-04-27T00:00:00Z","Jürgen Hänggi; Nicolas Langer; Kai Lutz; Karin Birrer; Susan Mérillat; Lutz Jäncke","Division Neuropsychology, Department of Psychology, University of Zurich, Zurich, Switzerland; Neural Systems Lab, The City College of New York, New York, NY, United States of America; Child Mind Institute, New York, NY, United States of America; Center for Neurology and Rehabilitation, cereneo AG, Vitznau, Switzerland; Department of Neurology, University Hospital Zurich, Zurich, Switzerland; Rehabilitation Center Affoltern am Albis, University Children’s Hospital Zurich, Affoltern am Albis, Switzerland; International Normal Aging and Plasticity Imaging Center (INAPIC), University of Zurich, Zurich, Switzerland; Center for Integrative Human Physiology (ZIHP), University of Zurich, Zurich, Switzerland; University Research Priority Program (URPP), Dynamic of Healthy Aging, University of Zurich, Zurich, Switzerland; Department of Special Education, King Abdulaziz University, Jeddah, Saudi Arabia","Conceived and designed the experiments: SM KL LJ. Performed the experiments: SM NL KL KB LJ. Analyzed the data: JH NL. Contributed reagents/materials/analysis tools: JH NL. Wrote the paper: JH NL KL KB SM LJ.","The authors have declared that no competing interests exist."
"10.1371/journal.pone.0010351","plos one","2010-04-26T00:00:00Z","Bethany H Cool; Guy C-K Chan; Lin Lee; Junko Oshima; George M Martin; Qubai Hu","Department of Pathology, University of Washington, Seattle, Washington, United States of America; Department of Pharmacology, University of Washington, Seattle, Washington, United States of America","Conceived and designed the experiments: BHC GM QH. Performed the experiments: BHC GCKC LL JO QH. Analyzed the data: BHC GCKC JO QH. Contributed reagents/materials/analysis tools: BHC QH. Wrote the paper: BHC GCKC GM QH.","The authors have declared that no competing interests exist."
"10.1371/journal.pone.0010350","plos one","2010-04-26T00:00:00Z","Venkata Ramesh Dasari; Kiranpreet Kaur; Kiran Kumar Velpula; Meena Gujrati; Daniel Fassett; Jeffrey D Klopfenstein; Dzung H Dinh; Jasti S Rao","Department of Cancer Biology and Pharmacology, University of Illinois College of Medicine at Peoria, Peoria, Illinois, United States of America; Department of Pathology, University of Illinois College of Medicine at Peoria, Peoria, Illinois, United States of America; Department of Neurosurgery, University of Illinois College of Medicine at Peoria, Peoria, Illinois, United States of America","Conceived and designed the experiments: VRD JR. Performed the experiments: VRD KK KKV. Analyzed the data: VRD MG DF JDK DHD JR. Contributed reagents/materials/analysis tools: JR. Wrote the paper: VRD.","The authors have declared that no competing interests exist."
"10.1371/journal.pone.0124220","plos one","2015-04-20T00:00:00Z","Kiranpreet Kaur; Kari Olli Helgesen; Marit Jørgensen Bakke; Tor Einar Horsberg","NMBU School of Veterinary Science, Sea Lice Research Centre, PO Box 8146 Dep., NO-0033 Oslo, Norway","Conceived and designed the experiments: KK KH MB TH. Performed the experiments: KK KH MB TH. Analyzed the data: KK KH MB TH. Contributed reagents/materials/analysis tools: KK KH MB TH. Wrote the paper: KK KH MB TH.","The authors have declared that no competing interests exist."
"10.1371/journal.pone.0010349","plos one","2010-04-27T00:00:00Z","Shubha Gopal; Daniela Berg; Nicole Hagen; Eva-Maria Schriefer; Regina Stoll; Werner Goebel; Jürgen Kreft","Department of Studies in Microbiology, University of Mysore, Mysore, India; Lehrstuhl für Mikrobiologie - Biozentrum, Universität Würzburg, Würzburg, Germany; Institut für Pathologie, Technische Universität, München, Germany; Lehrstuhl Bakteriologie, Max von Pettenkofer-Institut, Universität München, München, Germany","Conceived and designed the experiments: SG WG JK. Performed the experiments: SG DB NH EMS RS. Analyzed the data: SG DB NH EMS RS WG JK. Wrote the paper: SG JK.","The authors have declared that no competing interests exist."
"10.1371/journal.pone.0124219","plos one","2015-05-27T00:00:00Z","Siamak Ravanbakhsh; Philip Liu; Trent C Bjordahl; Rupasri Mandal; Jason R Grant; Michael Wilson; Roman Eisner; Igor Sinelnikov; Xiaoyu Hu; Claudio Luchinat; Russell Greiner; David S Wishart","Department of Computing Science, University of Alberta, Edmonton, AB, Canada; Alberta Innovates Center for Machine Learning, Edmonton, AB, Canada; Department of Biological Sciences, University of Alberta, Edmonton, AB, Canada; Fiorgen Foundation, 50019 Sesto Fiorentino, Florence, Italy; Centro Risonanze Magnetiche, University of Florence, Florence, Italy; National Research Council, National Institute for Nanotechnology, Edmonton, AB, Canada","Conceived and designed the experiments: SR RG DW. Performed the experiments: SR PL TB JG RE MW XH CL. Analyzed the data: SR PL RM IS TB MW RE JG RG DW. Contributed reagents/materials/analysis tools: DW TB PL IS RM. Wrote the paper: SR RG DW.","Part of this work was funded by the Alberta/Pfizer Translational Research Fund Opportunity. The authors clarify that this does not alter their adherence to PLOS ONE policies on sharing data and materials."
"10.1371/journal.pone.0010348","plos one","2010-04-27T00:00:00Z","David Montaner; Joaquín Dopazo","Department of Bioinformatics and Genomics, Centro de Investigación Príncipe Felipe (CIPF), Valencia, Spain; Functional Genomics Node (INB), Centro de Investigación Príncipe Felipe (CIPF), Valencia, Spain; CIBER de Enfermedades Raras (CIBERER), Valencia, Spain","Conceived and designed the experiments: DM JD. Performed the experiments: DM. Analyzed the data: DM. Wrote the paper: JD.","The authors have declared that no competing interests exist."
"10.1371/journal.pone.0010347","plos one","2010-04-26T00:00:00Z","Silvia M Goicoechea; Brian Bednarski; Christianna Stack; David W Cowan; Keith Volmar; Leigh Thorne; Edna Cukierman; Anil K Rustgi; Teresa Brentnall; Rosa F Hwang; Christopher A G McCulloch; Jen Jen Yeh; David J Bentrem; Steven N Hochwald; Sunil R Hingorani; Hong Jin Kim; Carol A Otey","Department of Cell and Molecular Physiology, University of North Carolina, Chapel Hill, North Carolina, United States of America; Division of Surgical Oncology, Department of Surgery, University of North Carolina, Chapel Hill, North Carolina, United States of America; Lineberger Comprehensive Cancer Center, Chapel Hill, North Carolina, United States of America; Department of Pathology and Laboratory Medicine, University of North Carolina, Chapel Hill, North Carolina, United States of America; Cancer Biology Program, Fox Chase Cancer Center, Philadelphia, Pennsylvania, United States of America; Departments of Medicine and Genetics, Abramson Cancer Center, University of Pennsylvania, Philadelphia, Pennsylvania, United States of America; Department of Medicine, University of Washington, Seattle, Washington, United States of America; Department of Surgical Oncology, M. D. Anderson Cancer Center, University of Texas, Houston, Texas, United States of America; CIHR Group in Matrix Dynamics, University of Toronto, Toronto, Canada; Surgical Oncology, Northwestern Medical Faculty Foundation, Chicago, Illinois, United States of America; Division of Surgical Oncology, University of Florida, Gainesville, Florida, United States of America; Fred Hutchinson Cancer Research Center and University of Washington, Seattle, Washington, United States of America","Conceived and designed the experiments: SMG BKB HJK CAAO. Performed the experiments: SMG CS EC SH. Analyzed the data: SMG BKB KV LT SH HJK CAAO. Contributed reagents/materials/analysis tools: DWC KV LT AKR TAB RFH CAM JJY DJB SH SH HJK CAAO. Wrote the paper: SMG CAAO.","The authors have declared that no competing interests exist."
"10.1371/journal.pone.0124218","plos one","2015-04-24T00:00:00Z","A R M Ruhul Amin; Abedul Haque; Mohammad Aminur Rahman; Zhuo Georgia Chen; Fadlo Raja Khuri; Dong Moon Shin","Department of Hematology and Medical Oncology, Winship Cancer Institute of Emory University, Atlanta, GA, 30322, United States of America","Conceived and designed the experiments: ARA MAR DMS. Performed the experiments: ARA MAR AH. Analyzed the data: ARA MAR DMS. Contributed reagents/materials/analysis tools: ZGC. Wrote the paper: ARA ZGC MAR FRK DMS.","Co-author Dr. A. R. M. Ruhul Amin is an academic editor of PLOS ONE. This does not alter the authors' adherence to PLOS ONE Editorial policies and criteria."
"10.1371/journal.pone.0010346","plos one","2010-04-26T00:00:00Z","Lucy E King; Joseph Soltis; Iain Douglas-Hamilton; Anne Savage; Fritz Vollrath","Animal Behaviour Research Group, Department of Zoology, University of Oxford, Oxford, United Kingdom; Education and Science, Disney's Animal Kingdom, Bay Lake, Florida, United States of America; Save the Elephants, Nairobi, Kenya","Conceived and designed the experiments: LEK JS IDH AS FV. Performed the experiments: LEK JS. Analyzed the data: LEK JS. Wrote the paper: LEK JS IDH AS FV.","Save the Elephants has received funding from The Disney Worldwide Conservation Fund (DWCF), which helps scientists all over the world study animals and their habitats, working with qualified and respected nonprofit organizations on community conservation, education, science and environmental policies. The Disney Worldwide Conservation Fund is supported by Guest contributions, merchandise initiatives, special guest programs, and Disney's Office of Corporate Outreach. The DWCF ensures that 100 percent of the funds are directed to U.S. 501c3 nonprofit organizations to support worldwide conservation. The DWCF has supported the work of researchers working with Save the Elephants, via the U.S. nonprofit Wildlife Conservation Network, for many years to help engage communities in Samburu and ultimately protect elephants. Joseph Soltis' research in Samburu is funded independently of the DWCF, from the operating budget of the Animal Programs Administration at Disney's Animal Kingdom (“Cast Conservation Programs”). The DWCF does not support Joseph Soltis or any Cast Conservation Program. DWCF is not involved in the conception, direction, implementation, analysis, interpretation or publication of this research."
"10.1371/journal.pone.0124217","plos one","2015-04-24T00:00:00Z","Susann Minkwitz; Mirja Faßbender; Zienab Kronbach; Britt Wildemann","Julius Wolff Institute, Berlin-Brandenburg Center for Regenerative Therapies, Charité-Universitätsmedizin Berlin, Augustenburger Platz 1, Berlin, Germany","Conceived and designed the experiments: BW MF. Performed the experiments: SM MF. Analyzed the data: SM. Contributed reagents/materials/analysis tools: ZK. Wrote the paper: SM BW.","The authors have declared that no competing interests exist."
"10.1371/journal.pone.0010345","plos one","2010-04-26T00:00:00Z","Elena Favaro; Anassuya Ramachandran; Robert McCormick; Harriet Gee; Christine Blancher; Meredith Crosby; Cecilia Devlin; Christopher Blick; Francesca Buffa; Ji-Liang Li; Borivoj Vojnovic; Ricardo Pires das Neves; Peter Glazer; Francisco Iborra; Mircea Ivan; Jiannis Ragoussis; Adrian L Harris","Genomics Group, Wellcome Trust Centre for Human Genetics, University of Oxford, Oxford, United Kingdom; Molecular Oncology Laboratories, Weatherall Institute of Molecular Medicine, University of Oxford, John Radcliffe Hospital, Oxford, United Kingdom; Department of Therapeutic Radiology, Yale University School of Medicine, New Haven, Connecticut, United States of America; Indiana University, Indianapolis, Indiana, United States of America; Gray Institute for Radiation Oncology & Biology, University of Oxford, Oxford, United Kingdom; Molecular Haematology Laboratories, Weatherall Institute of Molecular Medicine, University of Oxford, John Radcliffe Hospital, Oxford, United Kingdom","Wrote the paper: ALH. Project Director, initial suggestion of target: ALH. Analysis of mRNA changes in hypoxia, ISCU protein changes, enzyme assays: EF AR. Analysis of ISCU RNA and protein, mitochondrial fractionation: RM. Analysis of a panel of cell lines and xenografts: HG. Analysis of the 3′ UTR: C Blancher. Analysis of clonogenic survival: MC CD. Analysis of iron metabolism: C Blick. Bioinformatics analysis of the databases: FMB. Xenograft studies: JLL. Analysis of data, discussion: BV PG. Analysis of free radicals: RPdN. Analysis of free radical production: FJI. Analysis of target, discussion of targets, cell survival assays: MI. Bioinformatics array analysis, discussion: JR.","The authors have declared that no competing interests exist."
"10.1371/journal.pone.0124215","plos one","2015-04-29T00:00:00Z","Matthias Wissuwa; Katsuhiko Kondo; Takuya Fukuda; Asako Mori; Michael T Rose; Juan Pariasca-Tanaka; Tobias Kretzschmar; Stephan M Haefele; Terry J Rose","Crop, Livestock and Environment Division, Japan International Research Centre for Agricultural Science, Tsukuba, Ibaraki, Japan; School of Chemistry, Monash University, Clayton, Victoria, Australia; International Rice Research Institute (IRRI), Los Banos, Philippines; Australian Centre for Plant Functional Genomics (ACPFG), Glen Osmond, South Australia, Australia; Centre for Plant Sciences, Southern Cross University, Lismore, New South Wales, Australia","Conceived and designed the experiments: MW TJR MTR KK. Performed the experiments: MW TJR TF KK MTR JPT AM SH. Analyzed the data: MW TK KK TF. Contributed reagents/materials/analysis tools: TK. Wrote the paper: MW TJR MTR TK.","The authors have declared that no competing interests exist."
"10.1371/journal.pone.0010344","plos one","2010-05-11T00:00:00Z","Jeannie L Te; Igor M Dozmorov; Joel M Guthridge; Kim L Nguyen; Joshua W Cavett; Jennifer A Kelly; Gail R Bruner; John B Harley; Joshua O Ojwang","Department of Arthritis and Immunology, Oklahoma Medical Research Foundation, Oklahoma City, Oklahoma, United States of America; Department of Clinical Immunology, Oklahoma Medical Research Foundation, Oklahoma City, Oklahoma, United States of America; Department of Medicine, University of Oklahoma Health Sciences Center, Oklahoma City, Oklahoma, United States of America; United States Department of Veterans Affairs Medical Center, Oklahoma City, Oklahoma, United States of America","Conceived and designed the experiments: JMG JBH JOO. Performed the experiments: JLT KLN JWC JOO. Analyzed the data: ID JOO. Contributed reagents/materials/analysis tools: JAK GB. Wrote the paper: JOO.","The authors have declared that no competing interests exist."
"10.1371/journal.pone.0124214","plos one","2015-06-23T00:00:00Z","Brendan Wilson; Andrea Bialocerkowski","Menzies Health Institute Queensland/ School of Allied Health Sciences, Gold Coast Campus, Griffith University, Queensland, Australia","Conceived and designed the experiments: BW AB. Performed the experiments: BW AB. Analyzed the data: BW AB. Wrote the paper: BW AB.","The authors have declared that no competing interests exist."
"10.1371/journal.pone.0124290","plos one","2015-05-22T00:00:00Z","Micòl E Gianinazzi; Corina S Rueegg; Karin Zimmerman; Claudia E Kuehni; Gisela Michel; the Swiss Paediatric Oncology Group (SPOG)","Department of Health Sciences and Health Policy, University of Lucerne, Lucerne, Switzerland; Pediatric Hematology/Oncology, University Children’s Hospital, Bern, Switzerland; Swiss Childhood Cancer Registry, Institute of Social and Preventive Medicine, University of Bern, Bern, Switzerland","Conceived and designed the experiments: MEG CSR GM. Performed the experiments: MEG. Analyzed the data: MEG. Contributed reagents/materials/analysis tools: MEG CSR GM. Wrote the paper: MEG CSR KZ CEK GM.","The authors have declared that no competing interests exist."
"10.1371/journal.pone.0135411","plos one","2015-08-12T00:00:00Z","Qiwei Zeng; Hongyu Chen; Chao Zhang; Minjing Han; Tian Li; Xiwu Qi; Zhonghuai Xiang; Ningjia He","State Key Laboratory of Silkworm Genome Biology, Institute of Sericulture and Systems Biology, Southwest University, 216 Tiansheng Road, Beibei District, Chongqing, 400716, China","Conceived and designed the experiments: QZ NH. Performed the experiments: QZ HC CZ. Analyzed the data: QZ MH TL. Contributed reagents/materials/analysis tools: ZX TL XQ. Wrote the paper: QZ NH.","The authors have declared that no competing interests exist."
