"id","journal","publication_date","author","author_affiliate","author_notes","competing_interest"
"10.1371/journal.pone.0080633","plos one","2013-12-02T00:00:00Z","Rob Horne; Sarah C E Chapman; Rhian Parham; Nick Freemantle; Alastair Forbes; Vanessa Cooper","Centre for Behavioural Medicine, Department of Practice and Policy, UCL School of Pharmacy, London, United Kingdom; Department of Primary Care and Population Health, University College London, London, United Kingdom; Department of Internal Medicine, University College Hospital, London, United Kingdom","Analyzed the data: VC RH RP SC AF NF. Wrote the paper: RH VC RP SC. Conceived and designed the study: RH. Acquired the data: RP SC VC. Critically revised the manuscript for important intellectual content: RH SC RP NF AF VC.","The authors have performed consultancy for Nycomed, Takeda, B Braun, Shire, Warner Chilcott, Abbott, MSD, and the university spin out consultancy company, Spoonful of Sugar of which RH is a shareholder; RH has undertaken speaker engagements with honoraria for pharmaceutical companies, RH has received consultancy payments from pharmaceutical companies related to the use of the BMQ in industry sponsored studies. There are no other relationships or activities that could appear to have influenced the submitted work. This does not alter the authors' adherence to all the PLOS ONE policies on sharing data and materials."
"10.1371/journal.pone.0102989","plos one","2014-07-24T00:00:00Z","Neeta Singla; Srinath Satyanarayana; Kuldeep Singh Sachdeva; Rafael Van den Bergh; Tony Reid; Katherine Tayler-Smith; V P Myneedu; Engy Ali; Donald A Enarson; Digamber Behera; Rohit Sarin","National Institute of Tuberculosis & Respiratory Diseases, Delhi, India; International Union against Tuberculosis & Lung Disease, South-East Asia Regional Office, New Delhi, India; Central TB Division, Directorate General of Health Services, Ministry of Health and Family Welfare, Government of India, New Delhi, India; Médecins Sans Frontières – Operational Centre Brussels, Operational Research Unit (LuxOR), Luxembourg; International Union against Tuberculosis & Lung Disease, Paris, France; Postgraduate Institute of Medical Education & Research, Chandigarh, India","Conceived and designed the experiments: NS SS KSS DE DB RS. Performed the experiments: NS VPM RS. Analyzed the data: NS SS RVDB KTS. Contributed reagents/materials/analysis tools: NS SS RVDB KTS VPM DB RS. Wrote the paper: NS SS KSS RVBD TR KTS VPM EA DE DB RS.","The authors have declared that no competing interests exist."
"10.1371/journal.pone.0091855","plos one","2014-03-20T00:00:00Z","Kelechi Ugonna; Colin D Bingle; Karen Plant; Kirsty Wilson; Mark L Everard","Department of Respiratory Medicine, Sheffield Children’s Hospital, Sheffield, United Kingdom; Academic Unit of Respiratory Medicine, Dept. of Infection and Immunity University of Sheffield, Sheffield, United Kingdom; School Of Paediatrics and Child Health, University of Western Australia, Princess Margaret Hospital, Subiaco, Western Australia","Conceived and designed the experiments: MLE. Performed the experiments: KU KP KW. Analyzed the data: KU CB MLE. Wrote the paper: KU CB MLE.","The authors have declared that no competing interests exist."
"10.1371/journal.pone.0127237","plos one","2015-05-29T00:00:00Z","Jurjen van der Schans; Nikos Kotsopoulos; Pieter J Hoekstra; Eelko Hak; Maarten J Postma","Unit of PharmacoEpidemiology & PharmacoEconomics (PE2), Department of Pharmacy, University of Groningen (RUG), Groningen, the Netherlands; University of Groningen, University Medical Center Groningen, Department of Psychiatry, Groningen, the Netherlands; University of Groningen, University Medical Center Groningen, Institute of Science in Healthy Aging & healthcaRE, Groningen, the Netherlands","Conceived and designed the experiments: MJP JvdS. Performed the experiments: JvdS. Analyzed the data: JvdS MJP. Wrote the paper: NK PJH EH JvdS MJP.","PJH has been member of paid advisory board meetings of Shire and Eli Lilly and has received an unrestricted research grant from Shire. MJP has received grants, honoraria and travel stipends from various pharmaceutical companies, inclusive those interested in the subject matter of this paper. JvdS, NK and EH declare that they have no conflict of interest in relation to this work. This does not alter the authors' adherence to PLOS ONE policies on sharing data and materials."
"10.1371/journal.pone.0057872","plos one","2013-03-06T00:00:00Z","Vidya Athreya; Morten Odden; John D C Linnell; Jagdish Krishnaswamy; Ullas Karanth","Wildlife Conservation Society-India, Centre for Wildlife Studies, Bangalore, Karnataka, India; Faculty of Applied Ecology and Agricultural Sciences, Hedmark University College, Campus Evenstad, Elverum, Norway; Norwegian Institute for Nature Research, Trondheim, Norway; Ashoka Trust for Research in Ecology and the Environment, Bangalore. Karnataka, India","Conceived and designed the experiments: VA MO JDCL JK UK. Performed the experiments: VA. Analyzed the data: VA MO. Contributed reagents/materials/analysis tools: JDCL JK UK. Wrote the paper: VA.","The authors have declared that no competing interests exist."
"10.1371/journal.pone.0069263","plos one","2013-07-02T00:00:00Z","Floris Grasmeijer; Paul Hagedoorn; Henderik W Frijlink; H Anne de Boer","Department of Pharmaceutical Technology and Biopharmacy, University of Groningen, Groningen, The Netherlands","Conceived and designed the experiments: FG PH AHdeB. Performed the experiments: FG PH. Analyzed the data: FG PH HWF AHdeB. Wrote the manuscript: FG PH HWF AHdeB.","The authors have declared that no competing interests exist."
"10.1371/journal.pone.0034996","plos one","2012-04-12T00:00:00Z","Clémence Belleannée; Ezéquiel Calvo; Véronique Thimon; Daniel G Cyr; Christine Légaré; Louis Garneau; Robert Sullivan","Centre de Recherche du CHUQ and Département d'Obstétrique-Gynécologie, Faculté de Médecine, Université Laval, Québec, Canada; Laboratory of Endocrinology and Genomics, CHUL Research Center and Department of Molecular Medicine, Université Laval, Québec, Canada; Département de Biologie, Université de la Martinique, Martinique, France; INRS-Institut Armand-Frappier, Université du Québec, Laval, Québec, Canada","Conceived and designed the experiments: CB RS. Performed the experiments: CB EC VT CL LG. Analyzed the data: CB EC. Contributed reagents/materials/analysis tools: RS DC EC. Wrote the paper: CB RS DC.","The authors have declared that no competing interests exist."
"10.1371/journal.pone.0012878","plos one","2010-09-22T00:00:00Z","C T Ranjith-Kumar; Yvonne Lai; Robert T Sarisky; C Cheng Kao","Department of Molecular and Cellular Biochemistry, Indiana University, Bloomington, Indiana, United States of America; Pharmaceutical Research & Development, Johnson & Johnson, Raritan, New Jersey, United States of America","Conceived and designed the experiments: CTRK YL RTS CCK. Performed the experiments: CTRK YL. Analyzed the data: CTRK YL CCK. Contributed reagents/materials/analysis tools: RTS. Wrote the paper: CTRK YL CCK. Initiated the idea for chemical biology approach to innate immune receptors and contributed to the initial design of the screens: RTS. The objective interpretation of the results and the selection of the chemical libraries, the target molecule and the presentation of the results were solely from: CTRK CCK YL.","This work was funded in part by an unrestricted research grant from Johnson and Johnson Pharmaceuticals, where J&J does not have any restriction for the research direction, the use of reagents, the interpretation of the results, or any claim for intellectual property."
"10.1371/journal.pone.0102990","plos one","2014-07-22T00:00:00Z","Ido Amihai; Maria Kozhevnikov","National University of Singapore, Psychology Department, Singapore, Singapore; Martinos Center for Biomedical Imaging, MGH & Harvard Medical School, Charlestown, Massachusetts, United States of America","Conceived and designed the experiments: MK. Performed the experiments: MK IA. Analyzed the data: IA MK. Wrote the paper: IA MK.","The authors have declare that no competing interests exist."
"10.1371/journal.pone.0057874","plos one","2013-03-08T00:00:00Z","Wenjie Qiu; Kenneth Wee; Kosuke Takeda; Xuemei Lim; Shigeki Sugii; George K Radda; Weiping Han","Laboratory of Metabolic Medicine, Singapore Bioimaging Consortium, Agency for Science, Technology and Research, Singapore, Republic of Singapore; Cardiovascular and Metabolic Disorders Program, Duke-National University of Singapore Graduate Medical School, Singapore, Republic of Singapore; Department of Biochemistry, Yong Loo Lin School of Medicine, National University of Singapore, Singapore, Republic of Singapore; Metabolism in Human Diseases, Institute of Molecular and Cell Biology, Agency for Science, Technology and Research, Singapore, Republic of Singapore","Conceived and designed the experiments: WQ SS GKR WH. Performed the experiments: WQ KW KT XL. Analyzed the data: WQ KW SS WH. Wrote the paper: WQ KW SS WH.","The authors have declared that no competing interests exist."
"10.1371/journal.pone.0034998","plos one","2012-04-18T00:00:00Z","Bram Vanschoenwinkel; Tom Pinceel; Maarten P M Vanhove; Carla Denis; Merlijn Jocque; Brian V Timms; Luc Brendonck","Laboratory of Aquatic Ecology and Evolutionary Biology, KU Leuven, Leuven, Belgium; Laboratory of Animal Diversity and Systematics, KU Leuven, Leuven, Belgium; Royal Belgian Institute of Natural Sciences, Brussels, Belgium; Australian Museum, Sydney, New South Wales, Australia","Conceived and designed the experiments: BV TP. Performed the experiments: BV TP CD. Analyzed the data: BV TP MPMV. Contributed reagents/materials/analysis tools: BVT LB. Wrote the paper: BV TP BVT MJ LB.","The authors have declared that no competing interests exist."
"10.1371/journal.pone.0000742","plos one","2007-08-15T00:00:00Z","Corinne Tremblay; François Champoux; Patrice Voss; Benoit A Bacon; Franco Lepore; Hugo Théoret","Department of Psychology, University of Montreal, Montreal, Canada; Research Center, Sainte-Justine Hospital, Montreal, Canada; Speech Language Pathology and Audiology, University of Montreal, Montreal, Canada; Department of Psychology, Bishop's University, Sherbrooke, Quebec, Canada","Conceived and designed the experiments: FL HT CT FC BB. Performed the experiments: PV CT FC. Analyzed the data: PV CT FC. Contributed reagents/materials/analysis tools: FC. Wrote the paper: FL HT CT FC BB.","The authors have declared that no competing interests exist."
"10.1371/journal.pone.0127238","plos one","2015-06-03T00:00:00Z","L Suzanne Leslie; Tomasz P Wrobel; David Mayerich; Snehal Bindra; Rajyasree Emmadi; Rohit Bhargava","Beckman Institute for Advanced Science and Technology, University of Illinois at Urbana-Champaign, Urbana, Illinois, United States of America; Department of Bioengineering, University of Illinois at Urbana-Champaign, Urbana, Illinois, United States of America; Department of Electrical and Computer Engineering, University of Houston, Houston, Texas, United States America; Department of Pathology, University of Illinois at Chicago, Chicago, Illinois, United States of America; Department of Chemical and Biomolecular Engineering, University of Illinois at Urbana-Champaign, Illinois, United States of America; Department of Electrical and Computer Engineering, University of Illinois at Urbana-Champaign, Illinois, United States of America; Department of Mechanical Science and Engineering, University of Illinois at Urbana-Champaign, Illinois, United States of America; Department of Chemistry, University of Illinois at Urbana-Champaign, Illinois, United States of America","Conceived and designed the experiments: LSL RE RB. Performed the experiments: LSL SB. Analyzed the data: LSL TPW SB. Contributed reagents/materials/analysis tools: TPW DM RE RB. Wrote the paper: LSL TPW DM RE RB.","The authors have declared that no competing interests exist."
"10.1371/journal.pone.0091859","plos one","2014-03-20T00:00:00Z","Guo-Qing Tang; Divya Nandakumar; Rajiv P Bandwar; Kyung Suk Lee; Rahul Roy; Taekjip Ha; Smita S Patel","Department of Biochemistry and Molecular Biology, Rutgers University, Robert Wood Johnson Medical School, Piscataway, New Jersey, United States of America; Department of Physics and Center for the Physics of Living Cells, University of Illinois at Urbana-Champaign, Urbana, Illinois, United States of America; Center for Biophysics and Computational Biology, University of Illinois at Urbana-Champaign, Urbana, Illinois, United States of America; Howard Hughes Medical Institutes, Urbana, Illinois, United States of America","Conceived and designed the experiments: GQT RB KSL RR TH SSP. Performed the experiments: GQT RB RR KSL. Analyzed the data: GQT RB DN RR KSL SSP TH. Contributed reagents/materials/analysis tools: GQT RB RR KSL DN. Wrote the paper: GQT RB DN SSP.","The authors have declared that no competing interests exist."
"10.1371/journal.pone.0069269","plos one","2013-07-22T00:00:00Z","Francesca Sperati; Patrizia Vici; Marcello Maugeri-Saccà; Saverio Stranges; Nancy Santesso; Luciano Mariani; Antonio Giordano; Domenico Sergi; Laura Pizzuti; Luigi Di Lauro; Maurizio Montella; Anna Crispo; Marcella Mottolese; Maddalena Barba","Bostatistics/Scientific Direction, Regina Elena National Cancer Institute, Rome, Italy; Division of Medical Oncology B, Regina Elena National Cancer Institute, Rome, Italy; Division of Medical Oncology B/Scientific Direction, Regina Elena National Cancer Institute, Rome, Italy; Health Sciences, Warwick Medical School, Coventry, United Kingdom; Department of Clinical Epidemiology and Biostatistics, McMaster University Health Sciences Centre, Ontario, Canada; Division of Gynecologic Oncology, Regina Elena National Cancer Institute, Rome, Italy; Sbarro Institute for Cancer Research and Molecular Medicine and Center of Biotechnology, Temple University, Philadelphia, Pennsylvania, United States of America; Epidemiology Unit, National Cancer Institute G. Pascale Foundation, Naples, Italy; Department of Pathology, Regina Elena National Cancer Institute, Rome, Italy","Conceived and designed the experiments: MB M. Mottolese. Analyzed the data: FS. Contributed reagents/materials/analysis tools: FS. Wrote the paper: FS PV MB. Designed search strategy, performed and updated search: NS. Screened reference files and extracted data: NS DS LP AC. Provided methodological advice and critically revised the manuscript: MM-S SS LM AG LDL M. Montella.","The authors have declared that no competing interests exist."
"10.1371/journal.pone.0102991","plos one","2014-07-23T00:00:00Z","Hamed Layeghkhavidaki; Marie-Claire Lanhers; Samina Akbar; Lynn Gregory-Pauron; Thierry Oster; Nathalie Grova; Brice Appenzeller; Jordane Jasniewski; Cyril Feidt; Catherine Corbier; Frances T Yen","Unité de Recherche Animal et Fonctionnalités des Produits Animaux EA3998, Université de Lorraine, Vandœuvre-lès-Nancy, France; Institut National de Recherche Agronomique USC 0340, Vandœuvre-lès-Nancy, France; Laboratory of Analytical Human Biomonitoring, Centre de Recherche Public de la Santé, Luxembourg, Luxembourg; Laboratoire d'Ingenérie des Biomolécules, Université de Lorraine, Vandœuvre-lès-Nancy, France; Institut National de la Santé et de la Recherche Médicale, Vandœuvre-lès-Nancy, France","Conceived and designed the experiments: HL MCL CF CC FTY. Performed the experiments: HL MCL SA NG. Analyzed the data: HL MCL SA TO NG BA LGP CC FTY JJ. Contributed reagents/materials/analysis tools: JJ. Wrote the paper: HL SA TO NG BA CC FTY.","The authors have declared that no competing interests exist."
"10.1371/journal.pone.0035000","plos one","2012-04-03T00:00:00Z","Takeshi Nishiyama; Hirohisa Kishino; Sadao Suzuki; Ryosuke Ando; Hideshi Niimura; Hirokazu Uemura; Mikako Horita; Keizo Ohnaka; Nagato Kuriyama; Haruo Mikami; Naoyuki Takashima; Keitaro Mastuo; Yin Guang; Kenji Wakai; Nobuyuki Hamajima; Hideo Tanaka; for the J-MICC Study Group","Clinical Trial Management Center, Nagoya City University Hospital, Nagoya, Japan; Laboratory of Biometry and Bioinformatics, Graduate School of Agriculture and Life Sciences, University of Tokyo, Tokyo, Japan; Department of Public Health, Nagoya City University Graduate School of Medicine, Nagoya, Japan; Department of Nephro-urology, Nagoya City University Graduate School of Medicine, Nagoya, Japan; Department of International Island and Community Medicine, Kagoshima University Graduate School of Medical and Dental Sciences, Kagoshima, Japan; Department of Preventive Medicine, Institute of Health Biosciences the University of Tokushima Graduate School, Tokushima, Japan; Department of Preventive Medicine, Faculty of Medicine, Saga University, Saga, Japan; Department of Geriatric Medicine, Graduate School of Medical Sciences, Kyushu University, Fukuoka, Japan; Department of Epidemiology for Community Health and Medicine, Kyoto Prefectural University of Medicine Graduate School of Medical Science, Kyoto, Japan; Division of Cancer Registry, Prevention and Epidemiology, Chiba Cancer Center, Chiba, Japan; Department of Health Science, Shiga University of Medical Science, Otsu, Japan; Division of Epidemiology and Prevention, Aichi Cancer Center Research Institute, Nagoya, Japan; Department of Preventive Medicine, Nagoya University Graduate School of Medicine, Nagoya, Japan","Conceived and designed the experiments: NH HT KW. Performed the experiments: SS RA HN HU MH KO NK HM NT KM YG KW NH HT. Analyzed the data: TN HK. Wrote the paper: TN HK SS KW NH HT.","The authors have declared that no competing interests exist."
"10.1371/journal.pone.0046365","none","2012-09-28T00:00:00Z","Sanjay Rampal; Sanjiv Mahadeva; Eliseo Guallar; Awang Bulgiba; Rosmawati Mohamed; Ramlee Rahmat; Mohamad Taha Arif; Lekhraj Rampal","Julius Centre University of Malaya, Department of Social and Preventive Medicine, Faculty of Medicine, University of Malaya, Kuala Lumpur, Malaysia; Department of Epidemiology and Welch Center for Prevention, Epidemiology, and Clinical Research, Johns Hopkins University Bloomberg School of Public Health, Baltimore, Maryland, United States of America; Department of Medicine, Faculty of Medicine, University of Malaya, Kuala Lumpur, Malaysia; Department of Medicine, Johns Hopkins School of Medicine, Baltimore, Maryland, United States of America; Area of Cardiovascular Epidemiology and Population Genetics, National Center for Cardiovascular Research (CNIC), Madrid, Spain; Ministry of Health, Putrajaya, Malaysia; Faculty of Medicine and Health Sciences, Universiti Sarawak Malaysia, Sarawak, Malaysia; Faculty of Medicine and Health Sciences, Universiti Putra Malaysia, Selangor, Malaysia","Conceived and designed the experiments: SR RR MTA LR. Performed the experiments: LR SR RR MTA. Analyzed the data: SR SM EG LR. Contributed reagents/materials/analysis tools: LR. Wrote the paper: SR SM EG AB RM RR MTA LR.","The authors have declared that no competing interests exist."
"10.1371/journal.pone.0012881","plos one","2010-09-20T00:00:00Z","Megan E Moore; Fred A Goetz; Donald M Van Doornik; Eugene P Tezak; Thomas P Quinn; Jose J Reyes-Tomassini; Barry A Berejikian","Resource Enhancement and Utilization Technologies Division, Northwest Fisheries Science Center, National Oceanic and Atmospheric Administration Fisheries, Manchester Research Station, Manchester, Washington, United States of America; School of Aquatic and Fishery Sciences, University of Washington, Seattle, Washington, United States of America; Conservation Biology Division, Northwest Fisheries Science Center, National Oceanic and Atmospheric Administration Fisheries, Manchester Research Station, Manchester, Washington, United States of America","Conceived and designed the experiments: MEPM FAG EPT TPQ BB. Performed the experiments: MEPM FAG DMVD EPT. Analyzed the data: MEPM DMVD EPT JJRT. Contributed reagents/materials/analysis tools: MEPM FAG DMVD EPT TPQ BB. Wrote the paper: MEPM TPQ BB.","The authors have declared that no competing interests exist."
"10.1371/journal.pone.0127239","plos one","2015-05-14T00:00:00Z","Rebecca Kan; Wai Ho Shuen; Hong Lok Lung; Arthur Kwok Leung Cheung; Wei Dai; Dora Lai-Wan Kwong; Wai Tong Ng; Anne Wing Mui Lee; Chun Chung Yau; Roger Kai Cheong Ngan; Stewart Yuk Tung; Maria Li Lung","Department of Clinical Oncology, Li Ka Shing Faculty of Medicine, University of Hong Kong, Hong Kong (SAR), PR China; Center for Cancer Research, Li Ka Shing Faculty of Medicine, University of Hong Kong, Hong Kong (SAR), PR China; Center for Nasopharyngeal Carcinoma Research, Li Ka Shing Faculty of Medicine, University of Hong Kong, Hong Kong (SAR), PR China; Department of Clinical Oncology, Pamela Youde Nethersole Eastern Hospital, Hong Kong (SAR), PR China; Department of Clinical Oncology, The University of Hong Kong—Shen Zhen Hospital, PR China; Department of Oncology, Princess Margaret Hospital, Hong Kong (SAR), PR China; Department of Clinical Oncology, Queen Elizabeth Hospital, Hong Kong (SAR), PR China; Department of Clinical Oncology, Tuen Mun Hospital, Hong Kong (SAR), PR China","Conceived and designed the experiments: RK WHS. Performed the experiments: RK WHS. Analyzed the data: RK WHS WD MLL. Contributed reagents/materials/analysis tools: HLL AKLC DLK WTN AWML CCY RKCN SYT MLL. Wrote the paper: RK WHS MLL.","The authors have declared that no competing interests exist."
"10.1371/journal.pone.0102996","plos one","2014-07-23T00:00:00Z","Adam G Dale; Steven D Frank","North Carolina State University, Raleigh, North Carolina, United States of America","Conceived and designed the experiments: AGD SDF. Performed the experiments: AGD. Analyzed the data: AGD. Contributed reagents/materials/analysis tools: AGD SDF. Contributed to the writing of the manuscript: AGD SDF.","The authors have declared that no competing interests exist."
"10.1371/journal.pone.0138462","plos one","2015-09-22T00:00:00Z","Tatsuya Yamamoto; Tomoyuki Uchiyama; Yoshinori Higuchi; Masato Asahina; Shigeki Hirano; Yoshitaka Yamanaka; Satoshi Kuwabara","Department of Neurology, Graduate School of Medicine, Chiba University, Chiba, Japan; Department of Neurosurgery, Graduate School of Medicine, Chiba University, Chiba, Japan; Department of Neurology, Dokkyo Medical College, Tochigi, Japan","Conceived and designed the experiments: TY TU YH YY. Performed the experiments: TY TU YH. Analyzed the data: TY TU YH YY. Contributed reagents/materials/analysis tools: TY TU YH MA SH YY SK. Wrote the paper: TY TU SK.","The authors have declared that no competing interests exist."
"10.1371/journal.pone.0023183","plos one","2011-08-17T00:00:00Z","Veerle Van Hoeck; Roger G Sturmey; Pablo Bermejo-Alvarez; Dimitrios Rizos; Alfonso Gutierrez-Adan; Henry J Leese; Peter E J Bols; Jo L M R Leroy","Laboratory for Veterinary Physiology and Biochemistry, Department of Veterinary Sciences, Faculty of Biomedical, Pharmaceutical and Veterinary Sciences, University of Antwerp, Wilrijk, Belgium; Hull-York Medical School, University of Hull, Hull, United Kingdom; Departamento de Reproducción Animal y Conservación de Recursos Zoogenéticos, INIA, Madrid, Spain","Conceived and designed the experiments: JLMRL RGS VVH HJL. Performed the experiments: VVH RGS PB-A JLMRL. Analyzed the data: JLMRL VVH RGS PB-A. Wrote the paper: VVH RGS PB-A DR AG-A HJL PEJB JLMRL.","The authors have declared that no competing interests exist."
"10.1371/journal.pone.0080637","plos one","2013-12-09T00:00:00Z","Lili Li; Katherine Howell; Michelle Sands; Mark Banahan; Stephen Frohlich; Simon C Rowan; Roisín Neary; Donal Ryan; Paul McLoughlin","University College Dublin, School of Medicine and Medical Sciences, Conway Institute, Dublin, Ireland; Department of Anaesthesia and Critical Care, St Vincent's University Hospital, Dublin, Ireland","Conceived and designed the experiments: PM. Performed the experiments: LL KH MS MB SF SCR RN DR. Analyzed the data: LL KH MS SF SCR RN. Contributed reagents/materials/analysis tools: LL KH MS MB SF SCR RN DR PM. Wrote the paper: LL KH PM.","The authors have declared that no competing interests exist."
"10.1371/journal.pone.0102992","plos one","2014-07-28T00:00:00Z","Reza Hosseinzadeh; Ali Akbar Moosavi Movahedi; Hedayatollah Ghourchian","Institute of Biochemistry & Biophysics (IBB), University of Tehran, Tehran, Iran; Chromatography Research Group, Academic Center for Education, Culture and Research (ACECR), Urmia Branch, University of Urmia, Urmia, Iran; Center of Excellence in Biothermodymanics, University of Tehran, Tehran, Iran","Conceived and designed the experiments: RH AAMM. Performed the experiments: RH AAMM HG. Analyzed the data: RH AAMM. Contributed reagents/materials/analysis tools: AAMM HG. Wrote the paper: RH AAMM.","The authors have declared that no competing interests exist."
"10.1371/journal.pone.0035001","plos one","2012-04-19T00:00:00Z","Teng-Fei Ma; Xiao-Lei Zhao; Lei Cai; Nan Zhang; Si-Qiang Ren; Fang Ji; Tian Tian; Wei Lu","Department of Neurobiology, Nanjing Medical University, Nanjing, Jiangsu Province, People's Republic of China; Key Laboratory for Neurodegenerative Disease of Jiangsu Province, Nanjing Medical University, Nanjing, Jiangsu Province, People's Republic of China; Laboratory of Reproductive Medicine, Nanjing Medical University, Nanjing, Jiangsu Province, People's Republic of China; Key Laboratory for Human Functional Genomics of Jiangsu Province, Nanjing Medical University, Nanjing, Jiangsu Province, People's Republic of China","Conceived and designed the experiments: WL. Performed the experiments: TM XZ LC NZ SR FJ. Analyzed the data: TM XZ. Contributed reagents/materials/analysis tools: TT. Wrote the paper: WL.","The authors have declared that no competing interests exist."
