"id","journal","publication_date","author","author_affiliate","author_notes","competing_interest"
"10.1371/journal.pbio.1001281","plos biology","2012-03-06T00:00:00Z","Ariel Erental; Idith Sharon; Hanna Engelberg-Kulka","Department of Microbiology and Molecular Genetics, Institute for Medical Research Israel-Canada, The Hebrew University-Hadassah Medical School, Jerusalem, Israel","The author(s) have made the following declarations about their contributions: Conceived and designed the experiments: HEK AE. Performed the experiments: AE IS. Analyzed the data: AE IS. Contributed reagents/materials/analysis tools: HEK AE IS. Wrote the paper: HEK AE.","The authors have declared that no competing interests exist."
"10.1371/journal.pbio.1001280","plos biology","2012-03-13T00:00:00Z","Shadi Jafari; Liza Alkhori; Alexander Schleiffer; Anna Brochtrup; Thomas Hummel; Mattias Alenius","Department of Clinical and Experimental Medicine, Linköping University, Linköping, Sweden; Research Institute of Molecular Pathology (IMP), Vienna, Austria; Department of Neurobiology, University of Vienna, Vienna, Austria","The author(s) have made the following declarations about their contributions: Conceived and designed the experiments: Screen: MA; expression analysis: MA; mutant analysis: TH; temporal TF requirement: MA; regulatory matrix: MA; bioinformatics: MA; TF analysis: MA; OR promoter analysis: MA; dual TF function: MA. Performed the experiments: Screen: MA; expression analysis: MA; mutant analysis: AB TH; temporal TF requirement: SJ AB TH; regulatory matrix: SJ LA MA; bioinformatics: AS MA; TF analysis: SJ MA; OR promoter analysis: SJ MA; dual TF function: LA MA. Analyzed the data: Screen: MA; expression analysis: LA MA; mutant analysis: AB TH; temporal TF requirement: SJ MA; regulatory matrix: SJ LA MA bioinformatics: AS MA; TF analysis: SJ MA; OR promoter analysis: SJ MA; dual TF function: LA MA. Contributed reagents/materials/analysis tools: Screen: MA; expression analysis: MA; mutant analysis: TH; temporal TF requirement: MA; regulatory matrix: MA; bioinformatics: MA; TF analysis: MA; OR promoter analysis: MA; dual TF function: MA. Wrote the paper: TH MA.","The authors have declared that no competing interests exist."
"10.1371/journal.pgen.1005039","plos genetics","2015-04-22T00:00:00Z","Stacey L Hanlon; Joachim J Li","Department of Biochemistry and Biophysics, University of California, San Francisco, San Francisco, California, United States of America; Department of Microbiology and Immunology, University of California, San Francisco, San Francisco, California, United States of America","Conceived and designed the experiments: SLH JJL. Performed the experiments: SLH. Analyzed the data: SLH JJL. Contributed reagents/materials/analysis tools: SLH JJL. Wrote the paper: SLH JJL.","The authors have declared that no competing interests exist."
"10.1371/journal.pgen.1005038","plos genetics","2015-03-16T00:00:00Z","Di Wen; Crisalejandra Rivera-Perez; Mohamed Abdou; Qiangqiang Jia; Qianyu He; Xi Liu; Ola Zyaan; Jingjing Xu; William G Bendena; Stephen S Tobe; Fernando G Noriega; Subba R Palli; Jian Wang; Sheng Li","Key Laboratory of Insect Developmental and Evolutionary Biology, Institute of Plant Physiology and Ecology, Shanghai Institutes for Biological Sciences, Chinese Academy of Sciences, Shanghai, China; Department of Life Science, Qiannan Normal College for Nationalities, Duyun, Guizhou, China; Department of Biological Sciences, Florida International University, Miami, Florida, United States of America; Department of Entomology, University of Maryland, College Park, Maryland, United States of America; Department of Entomology, College of Agriculture, University of Kentucky, Lexington, Kentucky, United States of America; Department of Biology, Queen’s University, Kingston, Ontario, Canada; Department of Cell and Systems Biology, University of Toronto, Toronto, Ontario, Canada","Conceived and designed the experiments: SL JW. Performed the experiments: DW CRP MA QJ QH XL OZ JX SL. Analyzed the data: DW CRP SL. Contributed reagents/materials/analysis tools: FGN SST WGB SRP. Wrote the paper: SL DW FGN SRP SST WGB JW.","The authors have declared that no competing interests exist."
"10.1371/journal.ppat.0030095","plos pathogens","2007-07-06T00:00:00Z","Joel O Wertheim; Michael Worobey","Department of Ecology and Evolutionary Biology, University of Arizona, Tucson, Arizona, United States of America","JOW and MW conceived of and designed the experiments, performed the phylogenetic analysis, and wrote the paper. JOW performed the experiments.","The authors have declared that no competing interests exist."
"10.1371/journal.ppat.0030106","plos pathogens","2007-07-27T00:00:00Z","Stephane Daffis; Melanie A Samuel; Brian C Keller; Michael Gale; Michael S Diamond","Department of Medicine, Washington University School of Medicine, St. Louis. Missouri, United States of America; Department of Molecular Microbiology, Washington University School of Medicine, St. Louis. Missouri, United States of America; Department of Microbiology, University of Texas Southwestern Medical Center, Dallas, Texas, United States of America; Department of Pathology and Immunology, Washington University School of Medicine, St. Louis, Missouri, United States of America","All authors conceived and designed the experiments and analyzed the data. SD, MAS, and BCK performed the experiments. SD, MAS, MG, and MSD wrote the paper.","The authors have declared that no competing interests exist."
"10.1371/journal.pbio.1001287","plos biology","2012-03-27T00:00:00Z","Kelly N DuBois; Sam Alsford; Jennifer M Holden; Johanna Buisson; Michal Swiderski; Jean-Mathieu Bart; Alexander V Ratushny; Yakun Wan; Philippe Bastin; J David Barry; Miguel Navarro; David Horn; John D Aitchison; Michael P Rout; Mark C Field","Department of Pathology, University of Cambridge, Cambridge, United Kingdom; London School of Hygiene & Tropical Medicine, London, United Kingdom; Trypanosome Cell Biology Unit, Pasteur Institute and Centre National de la Recherche Scientifique, Paris, France; Wellcome Trust Center for Molecular Parasitology, University of Glasgow, Glasgow, United Kingdom; Instituto de Parasitología y Biomedicina López-Neyra, Consejo Superior de Investigaciones Cientificas, Granada, Spain; The Institute for Systems Biology, Seattle, Washington, United States of America; Seattle Biomedical Research Institute, Seattle, Washington, United States of America; The Rockefeller University, New York, New York, United States of America","The author(s) have made the following declarations about their contributions: Conceived and designed the experiments: KND SA PB JDB MN DH JDA MPR MCF. Performed the experiments: KND SA JMH JB MS JB AVR YW. Analyzed the data: KND SA JMH JB MS JB AVR YW PB JDB MN DH JDA MPR MCF. Wrote the paper: KND SA PB JDB MN DH JDA MPR MCF.","The authors have declared that no competing interests exist."
"10.1371/journal.pgen.1005049","plos genetics","2015-03-05T00:00:00Z","Carrie L Flood; Gina P Rodriguez; Gaobin Bao; Arthur H Shockley; Yoke Wah Kow; Gray F Crouse","Department of Biology, Emory University, Atlanta, Georgia, United States of America; Department of Radiation Oncology, Emory University, Atlanta, Georgia, United States of America; Winship Cancer Institute, Emory University, Atlanta, Georgia, United States of America","Conceived and designed the experiments: GFC YWK. Performed the experiments: CLF GPR GB AHS. Analyzed the data: CLF GPR GFC. Wrote the paper: GFC.","The authors have declared that no competing interests exist."
"10.1371/journal.ppat.0030100","plos pathogens","2007-07-13T00:00:00Z","Danelle S Eto; Tiffani A Jones; Jamie L Sundsbak; Matthew A Mulvey","Division of Cell Biology and Immunology, Pathology Department, University of Utah, Salt Lake City, Utah, United States of America","DSE and MAM conceived and designed the experiments, analyzed the data and wrote the paper. DSE, TAJ, and JLS performed the experiments.","The authors have declared that no competing interests exist."
"10.1371/journal.ppat.0030105","plos pathogens","2007-08-03T00:00:00Z","Bryant McLaughlin; Janet S Chon; Jason A MacGurn; Fredric Carlsson; Terri L Cheng; Jeffery S Cox; Eric J Brown","Program in Microbial Pathogenesis and Host Defense, University of California San Francisco, San Francisco, California, United States of America; Department of Microbiology and Immunology, University of California San Francisco, San Francisco, California, United States of America","BM and EJB conceived and designed the experiments and analyzed the data. BM, JSC, JAM, and TLC performed the experiments. BM, JAM, FC, JSC, and EJB contributed reagents/materials/analysis tools. BM, FC, JSC, and EJB wrote the paper.","The authors have declared that no competing interests exist."
"10.1371/journal.pgen.1005043","plos genetics","2015-03-11T00:00:00Z","Hui-Min Cheng; Yijuang Chern; I-Hui Chen; Chia-Rung Liu; Sih-Huei Li; Seung J Chun; Frank Rigo; C Frank Bennett; Ning Deng; Yanan Feng; Chyuan-Sheng Lin; Yu-Ting Yan; Stanley N Cohen; Tzu-Hao Cheng","Institute of Biochemistry and Molecular Biology, National Yang-Ming University, Taipei, Taiwan, Republic of China; Institute of Biomedical Sciences, Academia Sinica, Taipei, Taiwan, Republic of China; ISIS Pharmaceuticals, Carlsbad, California, United States of America; Department of Genetics, Stanford University School of Medicine, Stanford, California, United States of America; Department of Pathology and Cell Biology & Herbert Irving Comprehensive Cancer Center, Columbia University, New York, New York, United States of America; Brain Research Center, National Yang-Ming University, Taipei, Taiwan, Republic of China","Conceived and designed the experiments: THC SNC YTY. Performed the experiments: HMC SHL IHC CRL SJC FR ND YF. Analyzed the data: THC SNC YTY. Contributed reagents/materials/analysis tools: YC CSL CFB. Wrote the paper: THC SNC YTY.","The authors have declared that no competing interests exist."
"10.1371/journal.pbio.1001288","plos biology","2012-03-20T00:00:00Z","Vafa Bayat; Isabelle Thiffault; Manish Jaiswal; Martine Tétreault; Taraka Donti; Florin Sasarman; Geneviève Bernard; Julie Demers-Lamarche; Marie-Josée Dicaire; Jean Mathieu; Michel Vanasse; Jean-Pierre Bouchard; Marie-France Rioux; Charles M Lourenco; Zhihong Li; Claire Haueter; Eric A Shoubridge; Brett H Graham; Bernard Brais; Hugo J Bellen","Program in Developmental Biology, Baylor College of Medicine, Houston, Texas, United States of America; Medical Scientist Training Program, Baylor College of Medicine, Houston, Texas, United States of America; Laboratoire de Neurogénétique de la Motricité, Centre de Recherche du Centre Hospitalier de l'Université de Montréal, Montréal, Québec, Canada; Department of Human Genetics, Montreal Neurological Institute–McGill University, Montréal, Québec, Canada; Department of Molecular and Human Genetics, Baylor College of Medicine, Houston, Texas, United States of America; Clinique des Maladies Neuromusculaires, Centre de Santé et de Services Sociaux de Jonquière, Saguenay, Québec, Canada; Clinique des Maladies Neuromusculaires, Centre Hospitalier Universitaire Sainte-Justine, Montréal, Québec, Canada; Service de Neurologie, Centre Hospitalier Affilié Universitaire de Québec–Hôpital de l'Enfant-Jésus, Université Laval, Québec, Québec, Canada; Service de Neurologie, Centre hospitalier de l'Université de Sherbrooke, Sherbrooke, Québec, Canada; Department of Medical Genetics, University of São Paulo, Ribeirao Preto–São Paulo, Brazil; Howard Hughes Medical Institute, Baylor College of Medicine, Houston, Texas, United States of America; Department of Neuroscience, Baylor College of Medicine, Houston, Texas, United States of America; Jan and Dan Duncan Neurological Research Institute, Baylor College of Medicine, Houston, Texas, United States of America","The author(s) have made the following declarations about their contributions: Conceived and designed the experiments: VB IT BHG HJB BB. Performed the experiments: VB IT CH MJ TD ZL MT FS ES BB JM JPB MFR MJD MV. Analyzed the data: VB IT BHG HJB BB TD ZL MT ES JDL GB. Contributed reagents/materials/analysis tools: HJB BHG BB ES. Wrote the paper: VB IT MJ HJB BHG BB. Contributed key patients to the study: BB JM JPB MFR CML.","The authors have declared that no competing interests exist."
"10.1371/journal.pgen.1005041","plos genetics","2015-03-13T00:00:00Z","Molly Schumer; Rongfeng Cui; Gil G Rosenthal; Peter Andolfatto","Department of Ecology and Evolutionary Biology, Princeton University, Princeton, New Jersey, United States of America; Department of Biology, Texas A&M University, College Station, Texas, United States of America; Centro de Investigaciones Científicas de las Huastecas “Aguazarca”, Calnali, Hidalgo, Mexico; Max Planck Institute for the Biology of Ageing, Cologne, Germany; Lewis-Sigler Institute for Integrative Genomics, Princeton University, Princeton, New Jersey, United States of America","Conceived and designed the experiments: MS. Performed the experiments: MS RC PA. Analyzed the data: MS RC PA GGR. Wrote the paper: MS RC PA GGR. Designed the admixture simulator: RC.","The authors have declared that no competing interests exist."
"10.1371/journal.pgen.1005042","plos genetics","2015-03-10T00:00:00Z","Karl R Wotton; Eva Jiménez-Guri; Johannes Jaeger","EMBL/CRG Research Unit in Systems Biology, Centre for Genomic Regulation (CRG), Barcelona, Spain; Universitat Pompeu Fabra (UPF), Barcelona, Spain","Conceived and designed the experiments: KRW JJ. Performed the experiments: KRW EJG. Analyzed the data: KRW EJG JJ. Contributed reagents/materials/analysis tools: KRW EJG. Wrote the paper: KRW EJG JJ.","The authors have declared that no competing interests exist."
"10.1371/journal.pgen.1005048","plos genetics","2015-05-05T00:00:00Z","Gustavo de los Campos; Daniel Sorensen; Daniel Gianola","Departments of Epidemiology & Biostatistics, and Statistics, Michigan State University, United States of America; Department of Molecular Biology and Genetics, Aarhus University, Tjele, Denmark; Departments of Animal Science, Dairy Science and Biostatistics and Medical Informatics, University of Wisconsin-Madison, Madison, Wisconsin, United States of America","Conceived and designed the experiments: GdlC DS DG. Performed the experiments: GdlC. Analyzed the data: GdlC. Contributed reagents/materials/analysis tools: GdlC. Wrote the paper: GdlC DS DG. Theory: GdlC DS DG.","The authors have declared that no competing interests exist."
"10.1371/journal.ppat.0030102","plos pathogens","2007-07-27T00:00:00Z","Silvia Herbert; Agnieszka Bera; Christiane Nerz; Dirk Kraus; Andreas Peschel; Christiane Goerke; Michael Meehl; Ambrose Cheung; Friedrich Götz","Microbial Genetics Department, University of Tübingen, Tübingen, Germany; Medical Microbiology and Hygiene Department, University of Tübingen, Tübingen, Germany; Department of Microbiology, Dartmouth Medical School, Hanover, New Hampshire, United States of America","SH and FG conceived and designed the experiments and wrote the paper. SH and DK performed the experiments. SH, CN, and FG analyzed the data. SH, AB, AP, CG, MM, AC, and FG contributed reagents/materials/analysis tools.","The authors have declared that no competing interests exist."
"10.1371/journal.ppat.0030123","plos pathogens","2007-08-24T00:00:00Z","Scott H Robbins; Gilles Bessou; Amélie Cornillon; Nicolas Zucchini; Brigitte Rupp; Zsolt Ruzsics; Torsten Sacher; Elena Tomasello; Eric Vivier; Ulrich H Koszinowski; Marc Dalod","Centre d'Immunologie de Marseille-Luminy, Université de la Méditerranée, Marseille, France; INSERM (U631), Marseille, France; CNRS (UMR6102), Marseille, France; Max von Pettenkofer Institut für Virologie, Ludwig-Maximilians-Universität München, Munich, Germany; Assistance Publique-Hôpitaux de Marseille and Hôpital de la Conception, Marseille, France","SHR and MD designed research. SHR, GB, AC, NZ, and MD performed research. BR, ZR, TS, ET, EV, and UHK provided valuable reagents and significant intellectual input. SHR and MD wrote the manuscript.","The authors have declared that no competing interests exist."
"10.1371/journal.pbio.1001301","plos biology","2012-04-03T00:00:00Z","Jun Zhu; Pavel Sova; Qiuwei Xu; Kenneth M Dombek; Ethan Y Xu; Heather Vu; Zhidong Tu; Rachel B Brem; Roger E Bumgarner; Eric E Schadt","Sage Bionetworks, Seattle, Washington, United States of America; Department of Microbiology, University of Washington, Seattle Washington, United States of America; Safety Assessment, Merck & Co., Inc., West Point, Pennsylvania, United States of America; Molecular Profiling, Merck Research Laboratories, Boston, Massachusetts, United States of America; Department of Molecular and Cell Biology, University of California at Berkeley, Berkeley, California, United States of America; Department of Genetics and Genomic Sciences, Mount Sinai School of Medicine, New York City, New York, United States of America","The author(s) have made the following declarations about their contributions: Conceived and designed the experiments: JZ REB RBB EES. Performed the experiments: PS QX KMD EYX HV. Analyzed the data: JZ ZT RBB REB EES. Contributed reagents/materials/analysis tools: PS QX KMD EYX HV RBB REB. Wrote the paper: JZ PS QX EYX ZT RBB REB EES.","I have read the journal's policy and have the following conflicts. The work was partially funded by Merck."
"10.1371/journal.ppat.0030119","plos pathogens","2007-08-24T00:00:00Z","Andrew E Scott; Andrew R Timms; Phillippa L Connerton; Catherine Loc Carrillo; Khairul Adzfa Radzum; Ian F Connerton","Division of Food Sciences, University of Nottingham, Loughborough, United Kingdom","AES and IFC conceived and designed the experiments, analysed the data, and wrote the paper. AES, ART, PLC, CLC, and KAR performed the experiments.","The authors have declared that no competing interests exist."
"10.1371/journal.pgen.1005053","plos genetics","2015-03-19T00:00:00Z","Kristina Kirschner; Shamith A Samarajiwa; Jonathan M Cairns; Suraj Menon; Pedro A Pérez-Mancera; Kosuke Tomimatsu; Camino Bermejo-Rodriguez; Yoko Ito; Tamir Chandra; Masako Narita; Scott K Lyons; Andy G Lynch; Hiroshi Kimura; Tetsuya Ohbayashi; Simon Tavaré; Masashi Narita","Cancer Research UK Cambridge Institute, University of Cambridge, Li Ka Shing Centre, Cambridge, United Kingdom; Graduate School of Bioscience and Biotechnology, Tokyo Institute of Technology, Yokohama, Japan; Research Center for Bioscience and Technology, Tottori University, Yonago, Japan","Conceived and designed the experiments: KK SAS ST MasasN. Performed the experiments: KK PAPM KT CBR YI TC MasakN. Analyzed the data: SAS JMC SM AGL TO. Contributed reagents/materials/analysis tools: SKL HK. Wrote the paper: KK SAS JMC ST MasasN.","The authors have declared that no competing interests exist."
"10.1371/journal.pbio.1001300","plos biology","2012-04-03T00:00:00Z","Matthias Konrad; Meghan L Vyleta; Fabian J Theis; Miriam Stock; Simon Tragust; Martina Klatt; Verena Drescher; Carsten Marr; Line V Ugelvig; Sylvia Cremer","Evolutionary Biology, IST Austria (Institute of Science and Technology Austria), Klosterneuburg, Austria; Institute of Bioinformatics and Systems Biology, Helmholtz Center Munich, Neuherberg, Germany; Evolution, Behaviour & Genetics, University of Regensburg, Regensburg, Germany","The author(s) have made the following declarations about their contributions: Conceived and designed the experiments: MKonrad MVyleta FTheis LUgelvig SCremer. Performed the experiments: MKonrad MVyleta FTheis MStock STragust MKlatt VDrescher LUgelvig SCremer. Analyzed the data: MKonrad MVyleta MKlatt CMarr LUgelvig SCremer. Wrote the paper: MKonrad MVyleta FTheis LUgelvig SCremer.","The authors have declared that no competing interests exist."
"10.1371/journal.ppat.0030124","plos pathogens","2007-08-24T00:00:00Z","Wanqiu Hou; Eui Young So; Byung S Kim","Department of Microbiology-Immunology, Feinberg School of Medicine, Northwestern University, Chicago, Illinois, United States of America","WH, EYS, and BSK conceived and designed the experiments, analyzed the data, and wrote the paper. WH and EYS performed the experiments.","The authors have declared that no competing interests exist."
"10.1371/journal.pgen.1005059","plos genetics","2015-03-23T00:00:00Z","Zena T Wolf; Harrison A Brand; John R Shaffer; Elizabeth J Leslie; Boaz Arzi; Cali E Willet; Timothy C Cox; Toby McHenry; Nicole Narayan; Eleanor Feingold; Xioajing Wang; Saundra Sliskovic; Nili Karmi; Noa Safra; Carla Sanchez; Frederic W B Deleyiannis; Jeffrey C Murray; Claire M Wade; Mary L Marazita; Danika L Bannasch","Department of Population Health and Reproduction, School of Veterinary Medicine University of California, Davis, Davis, California, United States of America; Center for Craniofacial and Dental Genetics, Department of Oral Biology, University of Pittsburgh School of Dental Medicine, Pittsburgh, Pennsylvania, United States of America; Department of Human Genetics, University of Pittsburgh Graduate School of Public Health, Pittsburgh, Pennsylvania, United States of America; Department of Surgical and Radiological Sciences, School of Veterinary Medicine, University of California, Davis, Davis, California, United States of America; Faculty of Veterinary Science, University of Sydney, Sydney, New South Wales, Australia; Department of Pediatrics (Division of Craniofacial Medicine), University of Washington, Seattle, Washington, United States of America; Center for Developmental Biology and Regenerative Medicine, Seattle Children’s Research Institute, Seattle, Washington, United States of America; Department of Anatomy & Developmental Biology, Monash University, Clayton, Victoria, Australia; Department of Medical Microbiology and Immunology, School of Medicine, University of California, Davis, Davis, California, United States of America; Department of Surgery, Plastic and Reconstructive Surgery, University of Colorado School of Medicine, Aurora, Colorado, United States of America; Division of Neonatology, Department of Pediatrics, University of Iowa, Iowa City, Iowa, United States of America; Clinical and Translational Science and Department of Psychiatry, University of Pittsburgh School of Medicine, Pittsburgh, Pennsylvania, United States of America","Conceived and designed the experiments: DLB MLM CMW. Performed the experiments: ZTW HAB JRS EJL BA CEW TCC TM NN EF XW SS. Analyzed the data: ZTW HAB JRS BA TCC DLB MLM CMW. Contributed reagents/materials/analysis tools: NK NS CS FWBD JCM CMW. Wrote the paper: ZTW HAB JRS EJL CEW BA TCC DLB MLM.","A DNA test for the canine ADAMTS20 mutation is tested through BDH Genetics, which is owned by a family member of DLB. The authors declare that no other competing interests exist."
"10.1371/journal.pbio.1001299","plos biology","2012-04-03T00:00:00Z","Shingo Nagawa; Tongda Xu; Deshu Lin; Pankaj Dhonukshe; Xingxing Zhang; Jiri Friml; Ben Scheres; Ying Fu; Zhenbiao Yang","Center for Plant Cell Biology, Department of Botany and Plant Sciences, University of California, Riverside, California, United States of America; Temasek Lifesciences Laboratory Ltd, National University of Singapore, Singapore; State Key Laboratory of Plant Physiology and Biochemistry, Department of Plant Sciences, College of Biological Sciences, China Agricultural University, Beijing, China; Department of Biology, Faculty of Science, Utrecht University, Utrecht, The Netherlands; Department of Plant Systems Biology, VIB and Department of Plant Biotechnology and Genetics, Ghent University, Ghent, Belgium","The author(s) have made the following declarations about their contributions: Conceived and designed the experiments: SN TX ZY. Performed the experiments: SN TX DL XZ. Analyzed the data: SN TX ZY. Contributed reagents/materials/analysis tools: PD BS JF YF. Wrote the paper: SN TX ZY.","The authors have declared that no competing interests exist."
"10.1371/journal.ppat.0030125","plos pathogens","2007-08-31T00:00:00Z","Steve Simoneau; Human Rezaei; Nicole Salès; Gunnar Kaiser-Schulz; Maxime Lefebvre-Roque; Catherine Vidal; Jean-Guy Fournier; Julien Comte; Franziska Wopfner; Jeanne Grosclaude; Hermann Schätzl; Corinne Ida Lasmézas","Commissariat à l'Energie Atomique, Fontenay-aux-Roses, France; Institut National de la Recherche Agronomique, Jouy-en-Josas, France; Department of Infectology, The Scripps Research Institute, Jupiter, Florida, United States of America; Institute of Virology, Technical University of Munich, Munich, Germany; Institut Pasteur, Paris, France","SS and CIL conceived and designed the experiments and wrote the paper. SS, HR, NS, GKS, MLR, CV, JGF, JC, and FW performed the experiments. SS, JG, HS, and CIL analyzed the data. HR and HS contributed reagents/materials/analysis tools.","The authors have declared that no competing interests exist."
"10.1371/journal.ppat.0030158","plos pathogens","2007-10-26T00:00:00Z","Todd A Schlenke; Jorge Morales; Shubha Govind; Andrew G Clark","Department of Molecular Biology and Genetics, Cornell University, Ithaca, New York, United States of America; Department of Biology, Emory University, Atlanta, Georgia, United States of America; Biology Department, City College and the Graduate Center of The City University of New York, New York, New York, United States of America","TAS, JM, SG, and AGC conceived and designed the experiments, analyzed the data, and wrote the paper. TAS and JM performed the experiments. SG and AGC contributed reagents/materials/analysis tools.","The authors have declared that no competing interests exist."
