"id","journal","publication_date","author","author_affiliate","author_notes","competing_interest"
"10.1371/journal.pone.0086040","plos one","2014-01-21T00:00:00Z","Kim Stevens; Karen Weynberg; Christopher Bellas; Sonja Brown; Colin Brownlee; Murray T Brown; Declan C Schroeder","Cell and Molecular Department, Marine Biological Association, Plymouth, Devon, United Kingdom; School of Marine Science and Engineering, University of Plymouth, Plymouth, Devon, United Kingdom","Conceived and designed the experiments: KS DCS. Performed the experiments: KS KW CBellas SB DCS. Analyzed the data: KS KW CBellas MTB DCS. Contributed reagents/materials/analysis tools: CBrownlee DCS. Wrote the paper: KS MTB DCS.","The authors have declared that no competing interests exist."
"10.1371/journal.pone.0063205","plos one","2013-04-30T00:00:00Z","Sonali Nashine; Yogesh Bhootada; Alfred S Lewin; Marina Gorbatyuk","Department of Cell Biology and Anatomy, University of North Texas Health Science Center, Fort Worth, Texas, United States of America; Department of Vision Sciences, University of Alabama at Birmingham, Birmingham, Alabama, United States of America; Department of Molecular Genetics and Microbiology, University of Florida, Gainesville, Florida, United States of America","Provided comments: AL. Conceived and designed the experiments: SN YB MG. Performed the experiments: SN YB. Analyzed the data: MG AL. Contributed reagents/materials/analysis tools: MG. Wrote the paper: MG.","The authors have declared that no competing interests exist."
"10.1371/journal.pone.0074661","plos one","2013-09-18T00:00:00Z","Anne-Sophie Wattiez; Xavier Pichon; Amandine Dupuis; Alejandro Hernández; Anne-Marie Privat; Youssef Aissouni; Maryse Chalus; Teresa Pelissier; Alain Eschalier; Philippe Marin; Christine Courteix","Clermont Université, Université d'Auvergne, Pharmacologie Fondamentale et Clinique de la Douleur, Clermont-Ferrand, France; Institut National de la Santé et de la Recherche Médicale, Unité 1107, NEURO-DOL, Clermont-Ferrand, France; Laboratory of Neurobiology, Department of Biology, Faculty of Chemistry and Biology, University of Santiago of Chile, Santiago, Chile; Program of Molecular and Clinical Pharmacology, Faculty of Medicine, University of Chile, Santiago, Chile; Centre Hospitalier Universitaire de Clermont-Ferrand, Service de Pharmacologie, Clermont-Ferrand, France; Institut de Génomique Fonctionnelle, Centre National de la Recherche Scientifique, Unité Mixte de Recherche 5203, Universités Montpellier 1 and 2, Montpellier, France; Institut National de la Santé et de la Recherche Médicale, Unité 661, Montpellier, France","Conceived and designed the experiments: AE PM CC. Performed the experiments: ASW XP AMP AD MC YA. Analyzed the data: ASW XP AMP YA. Wrote the manuscript: ASW AH TP PM CC.","The authors have declared that no competing interests exist."
"10.1371/journal.pone.0097420","plos one","2014-05-14T00:00:00Z","Jiajin Yuan; Yingying Liu; Nanxiang Ding; Jiemin Yang","Key Laboratory of Cognition and Personality (SWU), Ministry of Education, and School of Psychology, Southwest University, Chongqing, China","Conceived and designed the experiments: JJY YYL NXD JMY. Performed the experiments: YYL NXD. Analyzed the data: JJY YYL. Wrote the paper: JJY YYL JMY.","The authors have declared that no competing interests exist."
"10.1371/journal.pone.0051751","plos one","2012-12-18T00:00:00Z","Hao Wu; Ning Tao; Xiaoman Liu; Xiao Li; Jian Tang; Chungwah Ma; Xiaofei Xu; Haitao Shao; Baidong Hou; Hui Wang; Zhihai Qin","Xinxiang Medical University, Xinxiang, China; Protein and Peptide Pharmaceutical Laboratory, Institute of Biophysics, Chinese Academy of Sciences, Beijing, China; Infinitus (China) Company Ltd., Guangzhou, China; Key Laboratory of Infection and Immunity, Institute of Biophysics, Chinese Academy of Sciences, Beijing, China","Conceived and designed the experiments: ZQ HW BH. Performed the experiments: HW NT X. Liu X. Li. Analyzed the data: HW NT. Contributed reagents/materials/analysis tools: JT CM HS. Wrote the paper: HW NT ZQ BH XX.","Some authors are employed by a commercial company “Infinitus (China) Company Ltd”. There are no other declarations relating to employment, consultancy, patents, products in development or marketed products. This does not alter the authors' adherence to all the PLOS ONE policies on sharing data and materials."
"10.1371/journal.pone.0040323","plos one","2012-07-06T00:00:00Z","Shu Meng; JiaTian Cao; LianSheng Wang; Qing Zhou; YiGang Li; ChengXing Shen; XiaoPing Zhang; ChangQian Wang","Department of Cardiology, School of Medicine, Shanghai Jiao-tong University, Xin-hua Hospital, Shanghai, China; Department of Cardiology, School of Medicine, Shanghai Jiao-tong University, No. 9 People's Hospital, Shanghai, China; Department of Laboratory Medicine, School of Medicine, Shanghai Jiao-tong University, No.9 People's Hospital, Shanghai, China; Department of Nuclear Medicine, School of Medicine, Tongji University, Shanghai 10th People's Hospital, Shangha, China","Conceived and designed the experiments: CW SM JC LW. Performed the experiments: CW SM JC ZP LW QZ YL. Analyzed the data: CW SM JC LW CS. Contributed reagents/materials/analysis tools: CW SM JC LW CS ZP. Wrote the paper: CW SM JC LW.","The authors have declared that no competing interests exist."
"10.1371/journal.pone.0131984","plos one","2015-07-02T00:00:00Z","James Negen; Marko Nardini","Department of Psychology, Durham University, Durham, County Durham, United Kingdom","Conceived and designed the experiments: MN. Performed the experiments: MN. Analyzed the data: JN MN. Contributed reagents/materials/analysis tools: JN MN. Wrote the paper: JN MN. Programmed models in analysis: JN.","The authors have declared that no competing interests exist."
"10.1371/journal.pone.0051743","plos one","2012-12-14T00:00:00Z","Cheng-Hao Weng; Ching-Chih Hu; Ja-Liang Lin; Dan-Tzu Lin-Tan; Wen-Hung Huang; Ching-Wei Hsu; Tzung-Hai Yen","Department of Nephrology, Chang Gung Memorial Hospital, Linkou Medical Center, Taipei, Taiwan; Department of Hepatogastroenterology and Liver Research Unit, Chang Gung Memorial Hospital, Keelung, Taiwan; Chang Gung University, College of Medicine, Taoyuan, Taiwan","Conceived and designed the experiments: C-HW T-HY. Analyzed the data: C-HW. Wrote the paper: C-HW C-CH. Performed the study: C-HW. Supervised the study: J-LL. Contributed to patient care and management: W-HH C-HW J-LL D-TL-T C-WH T-HY. Helped in data analysis and manuscript writing: T-HY.","The authors have declared that no competing interests exist."
"10.1371/journal.pone.0028843","plos one","2011-12-21T00:00:00Z","Roi Dor; Irby J Lovette; Rebecca J Safran; Shawn M Billerman; Gernot H Huber; Yoni Vortman; Arnon Lotem; Andrew McGowan; Matthew R Evans; Caren B Cooper; David W Winkler","Fuller Evolutionary Biology Program, Cornell Lab of Ornithology, Cornell University, Ithaca, New York, United States of America; Department of Ecology and Evolutionary Biology, Cornell University, Ithaca, New York, United States of America; Department of Ecology and Evolutionary Biology, University of Colorado, Boulder, Colorado, United States of America; Department of Zoology and Physiology, University of Wyoming, Laramie, Wyoming, United States of America; Department of Zoology, Tel Aviv University, Tel Aviv, Israel; School of Biosciences, University of Exeter, Exeter, United Kingdom; Cornell Lab of Ornithology, Cornell University, Ithaca, New York, United States of America","Conceived and designed the experiments: RD IJL CBC DWW. Performed the experiments: RD. Analyzed the data: RD SMB GHH YV. Contributed reagents/materials/analysis tools: RD IJL RJS SMB GHH YV AL AM MRE CBC DWW. Wrote the paper: RD IJL RJS SMB YV CBC DWW.","The authors have declared that no competing interests exist."
"10.1371/journal.pone.0097410","plos one","2014-05-12T00:00:00Z","Hongyan Guo; Xiaoguang Song; Guiling Wang; Kun Yang; Yu Wang; Libo Niu; Xiaoying Chen; Rongxiang Fang","State Key Laboratory of Plant Genomics, Institute of Microbiology, Chinese Academy of Sciences, Beijing, China; National Plant Gene Research Center, Beijing, China; University of Chinese Academy of Sciences, Beijing, China; School of Life Science and Technology, University of Electronic Science and Technology of China, Chengdu, China","Conceived and designed the experiments: HG XS GW XC RF. Performed the experiments: HG XS GW KY YW LN XC. Analyzed the data: HG XS XC. Wrote the paper: HG XS XC RF.","The authors have declared that no competing interests exist."
"10.1371/journal.pone.0051742","plos one","2012-12-11T00:00:00Z","Alicia P Higueruelo; Adrian Schreyer; G Richard J Bickerton; Tom L Blundell; Will R Pitt","Department of Biochemistry, University of Cambridge, Cambridge, United Kingdom; UCB Pharma, Slough, United Kingdom","Conceived and designed the experiments: APH TLB WRP. Performed the experiments: APH. Analyzed the data: APH. Contributed reagents/materials/analysis tools: AS GRJB. Wrote the paper: APH TLB WRP. Reviewed and edited the final version of the manuscript: APH AS GRJB TLB WRP.","WRP is an employee of UCB Pharma. However, the work was carried out while he was seconded to the University of Cambridge and he has no competing interests in the material in this manuscript. Therefore this does not alter the authors' adherence to all the PLOS ONE policies on sharing data and materials. The authors have declared that no other competing interests exist."
"10.1371/journal.pone.0132012","plos one","2015-06-29T00:00:00Z","Chien-Ming Chou; Fang-Yi Yu; Pei-Ling Yu; Jia-Fang Ho; Richard M Bostock; Kuang-Ren Chung; Jenn-Wen Huang; Miin-Huey Lee","Department of Plant Pathology, National Chung-Hsing University, Taichung, Taiwan; NCHU-UCD Plant and Food Biotechnology Center, National Chung-Hsing University, Taichung, Taiwan; Agricultural Biotechnology Center, National Chung-Hsing University, Taichung, Taiwan; Department of Plant Pathology, University of California, Davis, California, United States of America","Conceived and designed the experiments: MHL CMC FYY PLY. Performed the experiments: CMC FYY PLY JFH. Analyzed the data: CMC FYY PLY JFH MHL RMB. Contributed reagents/materials/analysis tools: MHL RMB KRC JWH. Wrote the paper: CMC MHL RMB KRC.","The authors have declared that no competing interests exist."
"10.1371/journal.pone.0028875","plos one","2011-12-14T00:00:00Z","Thomas M Chappell; Mark D Rausher","Department of Biology, Duke University, Durham, North Carolina, United States of America","Conceived and designed the experiments: TMC MDR. Performed the experiments: TMC. Analyzed the data: TMC. Contributed reagents/materials/analysis tools: MDR. Wrote the paper: TMC MDR.","The authors have declared that no competing interests exist."
"10.1371/journal.pone.0109055","plos one","2014-09-30T00:00:00Z","Joo-Hee Park; Yoo-Jin Shin; Tae-Ryong Riew; Mun-Yong Lee","Department of Anatomy, Catholic Neuroscience Institute, College of Medicine, The Catholic University of Korea, Seoul, Korea","Conceived and designed the experiments: JHP MYL. Performed the experiments: JHP. Analyzed the data: JHP MYL. Contributed reagents/materials/analysis tools: YJS TRR. Contributed to the writing of the manuscript: JHP MYL.","The authors have declared that no competing interests exist."
"10.1371/journal.pone.0040336","plos one","2012-06-29T00:00:00Z","Gregory S Jensen; Elizabeth S Haswell","Department of Biology, Washington University in Saint Louis, Saint Louis, Missouri, United States of America","Conceived and designed the experiments: EH. Performed the experiments: EH GJ. Analyzed the data: EH GJ. Wrote the paper: EH GJ.","The authors have declared that no competing interests exist."
"10.1371/journal.pone.0074672","plos one","2013-09-05T00:00:00Z","Zongyang Sun; Boon Ching Tee; Kelly S Kennedy; Patrick M Kennedy; Do-Gyoon Kim; Susan R Mallery; Henry W Fields","Division of Orthodontics, College of Dentistry, Ohio State University, Columbus, Ohio, United States of America; Division of Oral and Maxillofacial Surgery, College of Dentistry, Ohio State University, Columbus, Ohio, United States of America; Division of Oral Pathology and Radiology, College of Dentistry, Ohio State University, Columbus, Ohio, United States of America","Conceived and designed the experiments: ZS. Performed the experiments: ZS BCT KK PK. Analyzed the data: ZS BCT PK. Contributed reagents/materials/analysis tools: ZS KK DK. Wrote the paper: ZS BCT KK SM HF. Grant application: ZS KK SM HF.","The authors have declared that no competing interests exist."
"10.1371/journal.pone.0097417","plos one","2014-05-13T00:00:00Z","Satu Hämäläinen; Svetlana Solovieva; Tapio Vehmas; Katariina Luoma; Päivi Leino-Arjas; Ari Hirvonen","Finnish Institute of Occupational Health, Centre of Expertise for Health and Work Ability, Helsinki, Finland; University of Helsinki, Helsinki University Central Hospital, Radiology department, Helsinki, Finland","Conceived and designed the experiments: SH SS TV KL PL-A AH. Performed the experiments: SH SS TV KL. Analyzed the data: SH SS TV KL. Contributed reagents/materials/analysis tools: AH. Wrote the paper: SH SS TV KL PL-A AH.","The authors have declared that no competing interests exist."
"10.1371/journal.pone.0074652","plos one","2013-09-12T00:00:00Z","Rajpal S Kashyap; Amit R Nayak; Hari M Gaherwar; Shraddha S Bhullar; Aliabbas A Husain; Seema D Shekhawat; Ruchika K Jain; Sonali S Gaikwad; Ashish R Satav; Hemant J Purohit; Girdhar M Taori; Hatim F Daginawala","Biochemistry Research Laboratory, Central India Institute of Medical Sciences, Nagpur, Maharashtra, India; Meditation, AIDS, Health, Addiction & Nutrition (MAHAN) Trust, C/O Mahatma Gandhi Tribal Hospital, Karmagram, Utavali, Tahsil Dharni, Amaravati, Maharashtra, India; Environmental Genomics Unit, National Environmental Engineering Research Institute,Nagpur, Maharashtra, India","Conceived and designed the experiments: RSK ARS HJP GMT HFD. Performed the experiments: SSB RKJ SSG. Analyzed the data: RSK ARS HJP GMT HFD ARN HMG AAH SDS SSB RKJ SSG. Contributed reagents/materials/analysis tools: ARN HMG AAH SDS SSB RKJ SSG. Wrote the manuscript: RSK ARS HJP GMT HFD ARN HMG AAH SDS SSB RKJ SSG.","The authors have declared that no competing interests exist."
"10.1371/journal.pone.0097327","plos one","2014-05-13T00:00:00Z","Yanbing Qi; Biao Huang; Jeremy Landon Darilek","College of Resources and Environment, Northwest Agriculture and Forestry University, Yangling, Shaanxi, People’s Republic of China; Key Laboratory of Plant Nutrition and the Agri-environment in Northwest China, Ministry of Agriculture, Yangling, Shaanxi, People’s Republic of China; State Key Laboratory of Soil and Sustainable Agriculture, Institute of Soil Science, Chinese Academy of Sciences, Nanjing, Jiangsu, People’s Republic of China","Conceived and designed the experiments: YQ. Performed the experiments: YQ JLD. Analyzed the data: YQ BH. Contributed reagents/materials/analysis tools: BH. Wrote the paper: YQ.","The authors have declared that no competing interests exist."
"10.1371/journal.pone.0040229","plos one","2012-07-06T00:00:00Z","Bin Xiao; Yisheng Huang; Lizhen Zhang; Zhoubin Lin; Guofu Wang","Key Laboratory of Optoelectronics Material Chemistry and Physics, Fujian Institute of Research on the Structure of Matter, Chinese Academy of Sciences, Fuzhou, Fujian, China; Graduate School of Chinese Academy of Sciences, Beijing, China","Conceived and designed the experiments: BX GW. Performed the experiments: BX ZL. Analyzed the data: BX GW. Contributed reagents/materials/analysis tools: YH LZ. Wrote the paper: BX GW.","The authors have declared that no competing interests exist."
"10.1371/journal.pone.0108929","plos one","2014-09-24T00:00:00Z","Shuk C Tsoi; Utsav V Aiya; Kobi D Wasner; Mimi L Phan; Carolyn L Pytte; David S Vicario","Biology Department, The Graduate Center, City University of New York, New York, New York, United States of America; Psychology Department, Rutgers, The State University of New Jersey, Piscataway, New Jersey, United States of America; Psychology Department, Queens College, City University of New York, New York, New York, United States of America","Conceived and designed the experiments: MLP CLP DSV. Performed the experiments: SCT UVA KDW MLP CLP. Analyzed the data: SCT UVA KDW MLP CLP DSV. Contributed to the writing of the manuscript: MLP CLP DSV.","The authors have declared that no competing interests exist."
"10.1371/journal.pone.0063096","plos one","2013-05-16T00:00:00Z","Min Li; Bing-bing Yu; Jian-hua Wu; Lin Xu; Gang Sun","Department of Medical Imaging, Jinan Military General Hospital, Jinan, Shandong Province, China; School of Bioscience and Bioengineering, South China University of Technology, Guangzhou, Guangdong Province, China; Department of Medical Cardiology, Jinan Military General Hospital, Shandong Province, China","Conceived and designed the experiments: GS. Performed the experiments: ML BY. Analyzed the data: JW. Contributed reagents/materials/analysis tools: ML BY LX. Wrote the paper: ML BY JW LX GS.","The authors have declared that no competing interests exist."
"10.1371/journal.pone.0097308","plos one","2014-05-16T00:00:00Z","Hong Cui; Xiao-hui Liu; Ke-yong Wang; Chun-yan Zhu; Chen Wang; Xin-hui Xie","Division of Medical Psychology, Chinese PLA General Hospital and Medical School PLA, Beijing, China; Department of Psychiatry, Anhui Mental Health Center, Hefei, Anhui, China; Department of Medical Psychology, Anhui Medical University, Hefei, Anhui, China","Conceived and designed the experiments: XHX. Performed the experiments: HC XHL. Analyzed the data: KYW CW XHX. Wrote the paper: HC XHL CYZ XHX.","The authors have declared that no competing interests exist."
"10.1371/journal.pone.0108924","plos one","2014-10-01T00:00:00Z","Cindy H Nakatsu; Arthur Armstrong; Andrea P Clavijo; Berdine R Martin; Stephen Barnes; Connie M Weaver","Department of Agronomy, Purdue University, West Lafayette, Indiana, United States of America; Department of Nutrition Science, Purdue University, West Lafayette, Indiana, United States of America; Department of Pharmacology and Toxicology, University of Alabama at Birmingham, Birmingham, Alabama, United States of America","Conceived and designed the experiments: CHN BRM CMW. Performed the experiments: BRM APC. Analyzed the data: CHN AA APC SB. Contributed reagents/materials/analysis tools: CHN SB CMW. Wrote the paper: CHN BRM CMW.","The authors have declared that no competing interests exist."
"10.1371/journal.pone.0028757","plos one","2011-12-21T00:00:00Z","Shixia Wang; Anthony Hackett; Na Jia; Chunhua Zhang; Lu Zhang; Chris Parker; An Zhou; Jun Li; Wu-Chun Cao; Zuhu Huang; Yan Li; Shan Lu","Jiangsu Province Key Laboratory in Infectious Diseases, The First Affiliated Hospital of Nanjing Medical University, Nanjing, China; Department of Infectious Diseases, The First Affiliated Hospital of Nanjing Medical University, Nanjing, China; China-US Vaccine Research Center, The First Affiliated Hospital of Nanjing Medical University, Nanjing, China; Beijing Institute of Microbiology and Epidemiology, and State Key Laboratory of Pathogen and Biosecurity, Beijing, China; National Microbiology Laboratory, Public Health Agency of Canada, Winnipeg, Manitoba, Canada; Department of Medicine, University of Massachusetts Medical School, Worcester, Massachusetts, United States of America","Conceived and designed the experiments: SW SL. Performed the experiments: AH NJ CZ LZ CP AZ. Analyzed the data: SW SL YL. Contributed reagents/materials/analysis tools: JL WC ZH. Wrote the paper: SW SL.","The authors have declared that no competing interests exist."
"10.1371/journal.pone.0108988","plos one","2014-10-09T00:00:00Z","Faizan Naeem Razali; Amirah Ismail; Nurhayati Zainal Abidin; Adawiyah Suriza Shuib","Institute of Biological Sciences, Faculty of Science, University of Malaya, Kuala Lumpur, Malaysia; University of Malaya Centre for Proteomics Research, Faculty of Medicine, University of Malaya, Kuala Lumpur, Malaysia","Conceived and designed the experiments: ASS. Performed the experiments: FNR AI. Analyzed the data: NZA ASS FNR. Contributed reagents/materials/analysis tools: NZA ASS. Wrote the paper: FNR ASS.","The authors have declared that no competing interests exist."
"10.1371/journal.pone.0028817","plos one","2011-12-13T00:00:00Z","Zhiqiang Zhang; Wei Liao; Xi-Nian Zuo; Zhengge Wang; Cuiping Yuan; Qing Jiao; Huafu Chen; Bharat B Biswal; Guangming Lu; Yijun Liu","Department of Medical Imaging, Jinling Hospital, Nanjing University School of Medicine, Nanjing, Jiangsu Province, China; Key Laboratory for NeuroInformation of Ministry of Education, School of Life Science and Technology, University of Electronic Science and Technology of China, Chengdu, Sichuan Province, China; Laboratory for Functional Connectome and Development, Institute of Psychology, Chinese Academy of Sciences. Beijing, China; Phyllis Green and Randolph Cowen Institute for Pediatric Neuroscience, New York University Child Study Center, New York, New York, United States of America; Department of Radiology, UMDNJ New Jersey Medical School, Newark, New Jersey, United States of America; Department of Psychiatry, University of Florida, Gainesville, Florida, United States of America","Conceived and designed the experiments: ZZ X-NZ WL GL BBB HC YL. Performed the experiments: ZZ X-NZ WL ZW CY. Analyzed the data: ZZ X-NZ WL. Contributed reagents/materials/analysis tools: ZZ GL X-NZ WL QJ. Wrote the paper: ZZ X-NZ WL.","The authors have declared that no competing interests exist."
"10.1371/journal.pone.0108992","plos one","2014-10-03T00:00:00Z","Harsha L Rao; Ravi K Yadav; Uday K Addepalli; Shashikant Chaudhary; Sirisha Senthil; Nikhil S Choudhari; Chandra S Garudadri","VST Glaucoma Center, L V Prasad Eye Institute, Banjara Hills, Hyderabad, India","Conceived and designed the experiments: HLR RKY UKA SC SS NSC CSG. Performed the experiments: HLR RKY UKA SC SS NSC CSG. Analyzed the data: HLR. Contributed reagents/materials/analysis tools: HLR SS NSC CSG. Wrote the paper: HLR RKY UKA SC SS NSC CSG.","The authors have declared that no competing interests exist."
"10.1371/journal.pone.0074633","plos one","2013-09-10T00:00:00Z","Ning Ding; Fang Wang; Hui Xiao; Lixin Xu; Shouzhang She","Department of Anesthesiology, Guangzhou First People’s Hospital, Guangzhou Medical University, Guangzhou, China; Department of Medicine, Shandong Binzhou Vocational College, Binzhou, China; Department of Out-patient, Guangzhou First People’s Hospital, Guangzhou Medical University, Guangzhou, China","Conceived and designed the experiments: ND SZS. Performed the experiments: ND FW HX LXX. Analyzed the data: ND FW HX. Contributed reagents/materials/analysis tools: ND FW. Wrote the paper: ND LXX SZS.","The authors have declared that no competing interests exist."
"10.1371/journal.pone.0120465","plos one","2015-04-07T00:00:00Z","Hamidur Rahaman; Md Khurshid Alam Khan; Md Imtaiyaz Hassan; Asimul Islam; Ali Akbar Moosavi-Movahedi; Faizan Ahmad","Centre for Interdisciplinary Research in Basic Sciences, Jamia Millia Islamia, Jamia Nagar, New Delhi, 110025, India; Institute of Biochemistry and Biophysics, University of Tehran, Tehran, Iran","Conceived and designed the experiments: HR MKAK FA. Performed the experiments: HR MKAK MIH. Analyzed the data: HR MKAK FA AI AAMM FA. Contributed reagents/materials/analysis tools: HR AI. Wrote the paper: HR MKAK FA. Computational analysis: AI FA.","The authors have declared that no competing interests exist."
"10.1371/journal.pone.0086008","plos one","2014-01-21T00:00:00Z","Gigi Galiana; R Todd Constable","Department of Diagnostic Radiology, Yale University, New Haven, Connecticut, United States of America; Department of Biomedical Engineering, Yale University, New Haven, Connecticut, United States of America","Conceived and designed the experiments: GG RTC. Performed the experiments: GG RTC. Analyzed the data: GG RTC. Wrote the paper: GG RTC.","The authors have declared that no competing interests exist."
"10.1371/journal.pone.0063154","plos one","2013-04-30T00:00:00Z","Michael H Alpert; Simon Alford","Department of Biological Sciences, University of Illinois at Chicago, Chicago, Illinois, United States of America","Conceived and designed the experiments: SA MA. Performed the experiments: MA SA. Analyzed the data: MA SA. Contributed reagents/materials/analysis tools: MA SA. Wrote the paper: MA SA.","The authors have declared that no competing interests exist."
"10.1371/journal.pone.0040280","plos one","2012-07-02T00:00:00Z","Ferenc Jordán; Nerta Gjata; Shu Mei; Catherine M Yule","The Microsoft Research – University of Trento Centre for Computational and Systems Biology, Trento, Italy; School of Science, Monash University, Selangor DarulEhsan, Malaysia","Conceived and designed the experiments: CMY. Performed the experiments: CMY SM. Analyzed the data: NG FJ CMY. Contributed reagents/materials/analysis tools: CMY. Wrote the paper: FJ CMY.","The authors have declared that no competing interests exist."
"10.1371/journal.pone.0028819","plos one","2011-12-19T00:00:00Z","Martin C Frith","Computational Biology Research Center, Institute for Advanced Industrial Science and Technology, Koto-ku, Tokyo, Japan","Conceived and designed the experiments: MCF. Performed the experiments: MCF. Analyzed the data: MCF. Contributed reagents/materials/analysis tools: MCF. Wrote the paper: MCF.","The authors have declared that no competing interests exist."
