"id","journal","publication_date","author","author_affiliate","author_notes","competing_interest"
"10.1371/journal.pone.0133674","plos one","2015-07-20T00:00:00Z","Martin Zinicola; Hazel Higgins; Svetlana Lima; Vinicius Machado; Charles Guard; Rodrigo Bicalho","Department of Population Medicine and Diagnostic Sciences, Cornell University, Ithaca, New York, United States of America","Conceived and designed the experiments: MZ RB CG. Performed the experiments: MZ HH SL VM RB. Analyzed the data: MZ RB CG. Contributed reagents/materials/analysis tools: MZ HH SL VM RB. Wrote the paper: MZ HH RB.","The authors have declared that no competing interests exist."
"10.1371/journal.pone.0064602","plos one","2013-05-29T00:00:00Z","Anouk Keizer; Monique A M Smeets; H Chris Dijkerman; Siarhei A Uzunbajakau; Annemarie van Elburg; Albert Postma","Experimental Psychology/Helmholtz Institute, Utrecht University, Utrecht, The Netherlands; Faculty of Social and Behavioural Sciences, Utrecht University, Utrecht, The Netherlands; Department of Neurology, University Medical Centre Utrecht, Utrecht, The Netherlands; Eating Disorders Rintveld, Altrecht, Zeist, The Netherlands","Conceived and designed the experiments: AK MS HCD SU AvE AP. Performed the experiments: AK. Analyzed the data: AK SU. Contributed reagents/materials/analysis tools: AK SU. Wrote the paper: AK MS HCD SU AvE AP.","The authors have declared that no competing interests exist."
"10.1371/journal.pone.0110442","plos one","2014-10-22T00:00:00Z","Yongmei Zhang; Richeng Mao; Ran Yan; Dawei Cai; Yijun Zhang; Haoxiang Zhu; Yaoyue Kang; Hongyan Liu; Jinyu Wang; Yanli Qin; Yuxian Huang; Haitao Guo; Jiming Zhang","Department of Infectious Diseases, Huashan Hospital, Shanghai Medical College, Fudan University, Shanghai, China; Institute for Biotechnology and Virology Research, Department of Microbiology and Immunology, Drexel University College of Medicine, Doylestown, Pennsylvania, United States of America; Key Laboratory of Medical Molecular Virology (MOH & MOE), Shanghai Medical College, Fudan University, Shanghai, China","Conceived and designed the experiments: Yongmei Zhang RM HG JZ. Performed the experiments: Yongmei Zhang RY DC Yijun Zhang. Analyzed the data: Yongmei Zhang HZ YK. Contributed reagents/materials/analysis tools: HL JW YQ YH. Wrote the paper: Yongmei Zhang HG JZ.","The authors have declared that no competing interests exist."
"10.1371/journal.pone.0053227","plos one","2013-03-13T00:00:00Z","Jaume Baixeries; Brita Elvevåg; Ramon Ferrer-i-Cancho","Laboratory for Relational Algorithmics, Complexity and Learning (LARCA), Departament de Llenguatges i Sistemes Informàtics, Universitat Politècnica de Catalunya, Barcelona, Catalonia, Spain; Complexity & Quantitative Linguistics Lab, Departament de Llenguatges i Sistemes Informàtics, Center for Language and Speech Technologies and Applications (TALP Research Center), Universitat Politècnica de Catalunya, Barcelona, Catalonia, Spain; Psychiatry Research Group, Department of Clinical Medicine, University of Tromsø, Tromsø, Norway; Norwegian Centre for Integrated Care and Telemedicine (NST), University Hospital of North Norway, Tromsø, Norway","Conceived and designed the experiments: RF JB BE. Performed the experiments: JB. Analyzed the data: JB RF. Wrote the paper: RF BE JB.","The authors have declared that no competing interests exist."
"10.1371/journal.pone.0041659","none","2012-08-22T00:00:00Z","Yuan Sun; Yan Li; Dianzhong Luo; D Joshua Liao","Hormel Institute, University of Minnesota, Austin, Minnesota, United States of America; Department of Pathology, Guangxi Medical University, Nanning, Guangxi, People's Republic of China","Conceived and designed the experiments: DJL DZL. Performed the experiments: YS. Analyzed the data: YL. Wrote the paper: DJL.","The authors have declared that no competing interests exist."
"10.1371/journal.pone.0007351","plos one","2009-10-09T00:00:00Z","David W Sims; Nuno Queiroz; Nicolas E Humphries; Fernando P Lima; Graeme C Hays","Marine Biological Association of the United Kingdom, The Laboratory, Plymouth, United Kingdom; School of Biological Sciences, University of Plymouth, Plymouth, United Kingdom; CIBIO – Universidade de Porto, Campus Agrário de Vairão, Vairão, Portugal; Department of Biological Sciences, University of South Carolina, Columbia, South Carolina, United States of America; Institute of Environmental Sustainability, Swansea University, Swansea, United Kingdom","Conceived and designed the experiments: DWS GCH. Performed the experiments: NQ FPL. Analyzed the data: DWS NQ FPL GCH. Contributed reagents/materials/analysis tools: NEH. Wrote the paper: DWS GCH.","The authors have declared that no competing interests exist."
"10.1371/journal.pone.0030228","plos one","2012-02-02T00:00:00Z","Adam M Yates; Frank H Neumann; P John Hancox","Bernard Price Institute for Palaeontological Research, University of the Witwatersrand, Johannesburg, South Africa; Museum of Central Australia, Araluen Cultural Precinct, Alice Springs, Northern Territory, Australia; Forschungsstelle für Paläobotanik, Westfälische Wilhelms-Universität, Münster, Germany","Analyzed the data: AMY FHN. Contributed reagents/materials/analysis tools: AMY FHN PJH. Wrote the paper: AMY. Conceived and designed the investigation of coprolite inclusions: AMY FHN PJH. Performed the investigation of coprolite inclusions: AMY FHN. Collected specimens in the field: PJH. Interpreted geology of the field site: PJH.","The authors have declared that no competing interests exist."
"10.1371/journal.pone.0053237","plos one","2013-01-07T00:00:00Z","Yan Bai; Mei-Yun Wang; Yan-Hong Han; She-Wei Dou; Qing Lin; Ying Guo; Wei Li; De-Gang Ding; Jian-Ping Dai; Wei Qin; Da-Peng Shi; Jie Tian; Yong-Ming Dai","Department of Radiology, Henan Provincial People's Hospital, Zhengzhou, Henan, China; Department of Urinary Surgery, Henan Provincial People's Hospital, Zhengzhou, Henan, China; MRI, Siemens Healthcare, Shanghai, China; Institute of Automation, Chinese Academy of Sciences, Beijing, China; Life Science Research Center, School of Sciences and Technology, Xidian University, Xi’an, Shanxi, China","Guarantor of integrity of the entire study: MYW YB DGD DPS. Study concepts: MYW YB DPS. Definition of intellectual content: MYW YB YHH DPS. Literature research: MYW YB YHH DGD JPD DPS YMD. Clinical studies: MYW YB YHH SWD QL YG WL DGD DPS. Statistical analysis: MYW YB DPS JT WQ. Manuscript editing: MYW YB DGD JPD DPS YMD JT WQ. Manuscript review: MYW YB YHH SWD QL YG WL DGD JPD DPS YMD. Conceived and designed the experiments: MYW YB YHH DGD DPS. Performed the experiments: YB YHH MYW SWD QL YG WL DGD. Analyzed the data: MYW YB YHH DGD DPS YMD JT WQ. Contributed reagents/materials/analysis tools: YB YHH SWD QL YG WL. Wrote the paper: YB MYW.","Author (Yong-Ming Dai) from a commercial company, Siemens Healthcare, was a MR collaboration manager doing technique support in this study under Siemens collaboration regulation without any payment and personal concern regarding with this study. This does not alter the authors' adherence to all the PLOS ONE policies on sharing data and materials."
"10.1371/journal.pone.0098960","plos one","2014-06-05T00:00:00Z","Elke Bocksteins; Evy Mayeur; Abbi Van Tilborg; Glenn Regnier; Jean-Pierre Timmermans; Dirk J Snyders","Laboratory for Molecular Biophysics, Physiology and Pharmacology, Department of Biomedical Sciences, University of Antwerp, Antwerp, Belgium; Laboratory of Cell Biology and Histology, Department of Veterinary Sciences, University of Antwerp, Antwerp, Belgium","Conceived and designed the experiments: EB DJS. Performed the experiments: EB EM AVT GR. Analyzed the data: EB. Contributed reagents/materials/analysis tools: JPT. Wrote the paper: EB JPT DJS.","The authors have declared that no competing interests exist."
"10.1371/journal.pone.0145228","plos one","2015-12-15T00:00:00Z","William P Halford; Joshua Geltz; Ronald J Messer; Kim J Hasenkrug","Dept of Microbiology and Immunology, Southern Illinois University School of Medicine, Springfield, IL, 62702, United States of America; Laboratory of Persistent Viral Diseases, Rocky Mountain Laboratories, National Institute of Allergy and Infectious Diseases, National Institutes of Health, Hamilton, MT, 59840, United States of America","Conceived and designed the experiments: WPH KJH. Performed the experiments: WPH RJM JG. Analyzed the data: WPH RJM JG. Contributed reagents/materials/analysis tools: WPH KJH RJM JG. Wrote the paper: WPH KJH.","The authors of this manuscript have read the journal's policy and have the following competing interests. William Halford is a co-author on United States Patent Number 8,802,109, which describes the uses of herpes simplex virus mutant ICP0 in the design of a live-attenuated HSV-2 vaccine strain. In addition, William Halford is a co-founder of Rational Vaccines Incorporated which has licensed U.S. Patents 7,785,605 and 8,802,109. This does not alter the authors’ adherence to all PLOS ONE policies on sharing data and materials."
"10.1371/journal.pone.0053226","plos one","2013-01-07T00:00:00Z","Rogerio Faustino Ribeiro; Felipe F Potratz; Brunella M M Pavan; Ludimila Forechi; Filipe Lugon Moulin Lima; Jonaina Fiorim; Aurelia Araujo Fernandes; Dalton Valentim Vassallo; Ivanita Stefanon","Department of Physiological Sciences, Federal University of Espirito Santo, Vitoria, Brazil; Department of Physiological Sciences, EMESCAM, Vitoria, Brazil","Conceived and designed the experiments: RFRJ JF AAF IS. Performed the experiments: RFRJ FFP BMMP LF FLML JF. Analyzed the data: RFRJ FFP BMMP LF. Wrote the paper: RFRJ AAF DVV IS.","The authors have declared that no competing interests exist."
"10.1371/journal.pone.0098964","plos one","2014-06-11T00:00:00Z","Jenny Brändstedt; Sakarias Wangefjord; Björn Nodin; Jakob Eberhard; Magnus Sundström; Jonas Manjer; Karin Jirström","Department of Clinical Sciences, Division of Oncology and Pathology, Lund University, Skåne University Hospital, Lund, Sweden; Department of Surgery, Skåne University Hospital, Malmö, Sweden; Department of Immunology, Genetics and Pathology, Uppsala University, Uppsala, Sweden; Department of Clinical Sciences, Malmö, Lund University, Skåne University Hospital, Malmö, Sweden; Department of Plastic Surgery, Skåne University Hospital, Malmö, Sweden","Conceived and designed the experiments: KJ. Performed the experiments: JB BN SW MS. Analyzed the data: JB SW JE JM KJ. Contributed reagents/materials/analysis tools: JB JE KJ JM. Wrote the paper: JB.","The authors have declared that no competing interests exist."
"10.1371/journal.pone.0087614","plos one","2014-02-19T00:00:00Z","Saravanan Ayyadurai; Moiz A Charania; Bo Xiao; Emilie Viennois; Yuchen Zhang; Didier Merlin","Department of Biology and Chemistry, Center for Diagnostics and Therapeutics, Georgia State University, Atlanta, Georgia, United States of America; Veterans Affairs Medical Center, Decatur, Georgia, United States of America","Conceived and designed the experiments: SA DM. Performed the experiments: SA MC BX. Analyzed the data: SA MC EV YZ DM. Contributed reagents/materials/analysis tools: SA DM. Wrote the paper: SA DM.","The authors have declared that no competing interests exist."
"10.1371/journal.pone.0110467","plos one","2014-10-22T00:00:00Z","Luigi Margiotta-Casaluci; Stewart F Owen; Rob I Cumming; Anna de Polo; Matthew J Winter; Grace H Panter; Mariann Rand-Weaver; John P Sumpter","Institute for the Environment, Brunel University, London, United Kingdom; AstraZeneca, Global Environment, Freshwater Quarry, Brixham, United Kingdom; Biosciences, School of Health Sciences and Social Care, Brunel University, London, United Kingdom","Conceived and designed the experiments: LM-C SFO GHP MR-W JPS. Performed the experiments: LM-C SFO RIC AdP. Analyzed the data: LM-C SFO RIC AdP MJW GHP MR-W JPS. Contributed reagents/materials/analysis tools: SFO RIC MJW GHP MR-W JPS. Contributed to the writing of the manuscript: LM-C. Critical review and revision of the manuscript: SFO AdP MJW GHP MR-W JPS.","This work was co-funded by the AstraZeneca Global Environment research programme. SFO is an employee of AstraZeneca; RIC, MJW and GHP were also AstraZeneca employees. AstraZeneca is a biopharmaceutical company specialized in the discovery, development, manufacturing and marketing of prescription medicines, including some anxiolytic products. This does not alter our adherence to all the PLoS ONE policies on sharing data and materials."
"10.1371/journal.pone.0053244","plos one","2012-12-28T00:00:00Z","Kathleen M Griffiths; Andrew J Mackinnon; Dimity A Crisp; Helen Christensen; Kylie Bennett; Louise Farrer","Centre for Mental Health Research, The Australian National University, Canberra, Australian Capital Territory, Australia; Biostatistics Unit, Orygen Youth Health Research Centre, University of Melbourne, Melbourne, Victoria, Australia; Centre for Research in Ageing, Health and Wellbeing, The Australian National University, Canberra, Australian Capital Territory, Australia","Conceived and designed the experiments: KG AM HC KB. Performed the experiments: DC KB. Analyzed the data: KG AM DC LF. Wrote the manuscript: KG. Critically edited the manuscript: AM DC HC KB LF. Oversaw the IT implementation of the project: KB.","All authors declare that there are no competing interests that might be interpreted as influencing the research.  Authors Kathleen Griffiths, Helen Christensen and Kylie Bennett have developed e-couch (http://ecouch.anu.edu.au), which is available free of charge on the Internet. There are no patents, products in development or marketed products to declare. This does not alter the authors' adherence to all the PLOS ONE policies on sharing data and materials."
"10.1371/journal.pone.0087611","plos one","2014-02-05T00:00:00Z","Julie Jeukens; Brian Boyle; Irena Kukavica-Ibrulj; Myriam M Ouellet; Shawn D Aaron; Steve J Charette; Joanne L Fothergill; Nicholas P Tucker; Craig Winstanley; Roger C Levesque","Institute for integrative and systems biology (IBIS), University Laval, Quebec City, Quebec, Canada; Centre de recherche de l’Institut universitaire de cardiologie et de pneumologie de Québec, Quebec City, Quebec, Canada; Ottawa Hospital Research Institute, Ottawa, Ontario, Canada; Institute of Infection and Global Health, University of Liverpool, Liverpool, United Kingdom; Strathclyde Institute of Pharmacy and Biomedical Sciences, University of Strathclyde, Glasgow, United Kingdom","Conceived and designed the experiments: JJ BB IKI MMO SDA SJC JLF NPT CW RCL. Performed the experiments: JJ BB IKI MMO JLF. Analyzed the data: JJ BB MMO JLF NPT CW RCL. Contributed reagents/materials/analysis tools: BB SDA SJC JLF NPT CW RCL. Wrote the paper: JJ BB IKI MMO SDA SJC JLF NPT CW RCL.","The authors have declared that no competing interests exist."
"10.1371/journal.pone.0041680","none","2012-07-25T00:00:00Z","Mohini S Ghatge; Roberto Contestabile; Martino L di Salvo; Jigar V Desai; Amit K Gandhi; Christina M Camara; Rita Florio; Isabel N González; Alessia Parroni; Verne Schirch; Martin K Safo","Department of Medicinal Chemistry, Institute for Structural Biology and Drug Discovery, Virginia Commonwealth University, Richmond, Virginia, United States of America; Istituto Pasteur-Fondazione Cenci Bolognetti and Dipartimento di Scienze Biochimiche, Sapienza Università di Roma, Roma, Italy; Consiglio Nazionale delle Ricerche, Istituto di Biologia Agroambientale e Forestale, Monterotondo Scalo, Roma, Italy; Institute of Biocomputation and Physics of Complex Systems, Universidad de Zaragoza, Zaragoza, Spain","Conceived and designed the experiments: MSG RC MLDS VS MKS. Performed the experiments: MSG MLDS VS JVD AKG RF ING AP CMC. Analyzed the data: MSG RC MLDS VS MKS. Contributed reagents/materials/analysis tools: RC MLDS VS MKS. Wrote the paper: RC MLDS VS MKS.","The authors have declared that no competing interests exist."
"10.1371/journal.pone.0087610","plos one","2014-02-11T00:00:00Z","Jan Blancato; Ashley Graves; Banafsheh Rashidi; Maria Moroni; Leopold Tchobe; Metin Ozdemirli; Bhaskar Kallakury; Kepher H Makambi; Catalin Marian; Susette C Mueller","Department of Oncology, Lombardi Comprehensive Cancer Center, Georgetown University Medical Center, Washington, D. C., United States of America; Department of Pathology, Georgetown University Medical Center, Washington, D. C., United States of America; Armed Forces Radiobiology Research Institute, Uniformed Services University of the Health Sciences, Bethesda, Maryland, United States of America; University of the District of Columbia/Lombardi Comprehensive Cancer Center Partnership, Washington, D. C., United States of America; Department of Biostatistics and Bioinformatics, Georgetown University Medical Center, Washington, D. C., United States of America; Ohio State University Comprehensive Cancer Center, The Ohio State University, Columbus, Ohio, United States of America; Biochemistry Department, University of Medicine and Pharmacy, “Victor Babes”, Timisoara, Romania","Conceived and designed the experiments: JB SCM. Performed the experiments: JB AG BR MM LT MO BK SCM. Analyzed the data: JB KHM CM SCM. Contributed reagents/materials/analysis tools: JB BK SCM. Wrote the paper: JB BK CM SCM.","The authors have declared that no competing interests exist."
"10.1371/journal.pone.0007364","plos one","2009-10-08T00:00:00Z","Ping Hong Meng; Cécile Raynaud; Guillaume Tcherkez; Sophie Blanchet; Kamal Massoud; Séverine Domenichini; Yves Henry; Ludivine Soubigou-Taconnat; Caroline Lelarge-Trouverie; Patrick Saindrenan; Jean Pierre Renou; Catherine Bergounioux","Institut de Biotechnologie des Plantes, UMR CNRS 8618, Université Paris-Sud XI, bât 630, Plateau de Moulon, Orsay, France; Plateforme Métabolisme Métabolome IFR87, Institut de Biotechnologie des Plantes, Université Paris-Sud XI, bât 630, Plateau du Moulon, Orsay, France; Unité de Recherche en Génomique Végétale, 2, CP5708, Evry, France","Conceived and designed the experiments: CR GT JPR CB. Performed the experiments: PHM CR SB KM SD LST CLT CB. Analyzed the data: CR GT SB KM SD YH LST CLT JPR CB. Contributed reagents/materials/analysis tools: PS. Wrote the paper: CR GT YH CB.","The authors have declared that no competing interests exist."
"10.1371/journal.pone.0087601","plos one","2014-01-30T00:00:00Z","Li Li; Chang Liu; Fang Wang; Wei Miao; Jie Zhang; Zhiqian Kang; Yihan Chen; Luying Peng","Division of Medical Genetics, Tongji University School of Medicine, Shanghai, China; Key Laboratory of Arrhythmias, Ministry of Education, Tongji University, Shanghai, China","Conceived and designed the experiments: LL YC LP. Performed the experiments: LL WM. Analyzed the data: LL JZ. Contributed reagents/materials/analysis tools: CL FW ZK. Wrote the paper: LL LP.","The authors have declared that no competing interests exist."
"10.1371/journal.pone.0041672","plos one","2012-07-24T00:00:00Z","Rachel V Downey; Huw J Griffiths; Katrin Linse; Dorte Janussen","British Antarctic Survey, Natural Environmental Research Council, Cambridge, United Kingdom; Sektion Marine Evertebraten I, Forschungsinstitut und Naturmuseum Senckenberg, Frankfurt am Main, Germany","Conceived and designed the experiments: HJG RVD KL. Performed the experiments: HJG RVD KL. Analyzed the data: HJG RVD KL. Contributed reagents/materials/analysis tools: HJG RVD KL. Wrote the paper: HJG RVD KL DJ. Taxonomic expertise: DJ. GIS mapping: HJG.","The authors have declared that no competing interests exist."
"10.1371/journal.pone.0007378","plos one","2009-10-12T00:00:00Z","Yan Ropert-Coudert; Lisa Brooks; Maki Yamamoto; Akiko Kato","Institut Pluridisciplinaire Hubert Curien, UMR7178, Strasbourg, France; Koala Conservation Centre, Phillip Island Nature Park, Cowes, Victoria, Australia; Department of Bioengineering, Nagaoka University of Technology 1603-1, Kamitomioka, Nagaoka, Niigata, Japan; National Institute of Polar Research, Itabashi-ku, Japan","Conceived and designed the experiments: YRC LB AK. Performed the experiments: YRC LB AK. Analyzed the data: YRC MY AK. Contributed reagents/materials/analysis tools: YRC MY AK. Wrote the paper: YRC AK.","The authors have declared that no competing interests exist."
"10.1371/journal.pone.0098973","plos one","2014-07-01T00:00:00Z","Ning Zhang; Mei-Dan Ying; Yong-Ping Wu; Zhi-Hong Zhou; Zhao-Ming Ye; Hang Li; Ding-Sheng Lin","Department of Orthopaedics, 2nd Affiliated Hospital, School of Medicine, Zhejiang University, Hangzhou, P.R. China; Institute of Pharmacology and Toxicology, College of Pharmaceutical Sciences, Zhejiang University, Hangzhou, P.R. China; Department of Orthopaedics, 3rd Affiliated Hospital, Zhejiang Chinese Medical University, Hangzhou, P.R. China; Department of Orthopaedics, Wenzhou Medical College-Affiliated Second Hospital, Wenzhou, P.R. China","Conceived and designed the experiments: Z-MY HL. Performed the experiments: NZ M-DY. Analyzed the data: Y-PW Z-HZ. Contributed reagents/materials/analysis tools: D-SL. Wrote the paper: NZ M-DY.","The authors have declared that no competing interests exist."
"10.1371/journal.pone.0133699","plos one","2015-08-05T00:00:00Z","Wei-Ru Huang; Hung-Chuan Chiu; Tsai-Ling Liao; Kuo-Pin Chuang; Wing-Ling Shih; Hung-Jen Liu","Institute of Molecular Biology, National Chung Hsing University, Taichung, 402, Taiwan; Department of Medical Research, Taichung Veterans General Hospital, Taichung, 402, Taiwan; Graduate Institute of Animal Vaccine Technology, National Pingtung University of Science and Technology, Pingtung, 912, Taiwan; Department of Biological Science and Technology, National Pingtung University of Science and Technology, Pingtung, 912, Taiwan; Agricultural Biotechnology Center, National Chung Hsing University, Taichung, 402, Taiwan; Rong Hsing Research Center for Translational Medicine, National Chung Hsing University, Taichung, 402, Taiwan","Conceived and designed the experiments: H-JL. Performed the experiments: W-RH H-CC. Analyzed the data: W-RH H-CC T-LL K-PC W-LS H-JL. Contributed reagents/materials/analysis tools: W-LS H-JL. Wrote the paper: H-JL. Supervised the project: H-JL.","The authors have declared that no competing interests exist."
"10.1371/journal.pone.0076183","plos one","2013-10-14T00:00:00Z","Jasmine El Andalousi; Yuan Li; Madhu B Anand-Srivastava","Department of Physiology, Université de Montréal, Quebec, Canada","Conceived and designed the experiments: MBA-S. Performed the experiments: JEA YL. Analyzed the data: JEA YL. Contributed reagents/materials/analysis tools: JEA YL. Wrote the paper: MBA-S.","The authors have declared that no competing interests exist."
"10.1371/journal.pone.0030244","plos one","2012-01-23T00:00:00Z","Wen Huang; Asif Nadeem; Bao Zhang; Masroor Babar; Morris Soller; Hasan Khatib","Department of Dairy Science, University of Wisconsin, Madison, Wisconsin, United States of America; Institute of Biochemistry and Biotechnology, University of Veterinary and Animal Sciences, Lahore, Pakistan; College of Animal Science and Technology, Northwest A&F University, Yangling, Shaanxi, China; Department of Genetics, The Hebrew University of Jerusalem, Jerusalem, Israel; Department of Animal Sciences, University of Wisconsin, Madison, Wisconsin, United States of America","Conceived and designed the experiments: WH HK. Performed the experiments: BZ AN WH. Analyzed the data: WH MS. Contributed reagents/materials/analysis tools: AN MB. Wrote the paper: WH HK.","The authors have declared that no competing interests exist."
"10.1371/journal.pone.0133686","plos one","2015-08-07T00:00:00Z","Tana Wuyun; Hitomi Amo; Jingshi Xu; Teng Ma; Chiyomi Uematsu; Hironori Katayama","Paulownia Research and Development Center of China, Non-timber Forestry Research and Development of CAF, Weiwu Road, Zhengzhou City 450003, China; Food Resources Education and Research Center, Faculty of Agriculture, Kobe University, Hyogo 675–2103, Japan; Key Laboratory of Cultivation and Protection for Non-Wood Forest Trees and Non-wood Forest Products of SFA, Central South University of Forestry and Technology, Changsha, Hunan 410004, China; Botanical Gardens, Graduate School of Science, Osaka City University, Osaka 576–0004, Japan; Forestry technology Popularization Station of Beihai City, Beihai 536000, Guang Xi, China","Conceived and designed the experiments: HK CU TW. Performed the experiments: TW TM JX HA. Analyzed the data: HA JX. Contributed reagents/materials/analysis tools: TW TM JX HA. Wrote the paper: TW HA HK. Calculated the stastic softwares: HA HK.","The authors have declared that no competing interests exist."
"10.1371/journal.pone.0087612","plos one","2014-02-04T00:00:00Z","Clio Der Sarkissian; Paul Brotherton; Oleg Balanovsky; Jennifer E L Templeton; Bastien Llamas; Julien Soubrier; Vyacheslav Moiseyev; Valery Khartanovich; Alan Cooper; Wolfgang Haak; The Genographic Consortium","Australian Centre for Ancient DNA, School of Earth and Environmental Sciences, University of Adelaide, Adelaide, South Australia, Australia; Vavilov Institute for General Genetics, Russian Academy of Sciences, Moscow, Russia; Research Centre for Medical Genetics, Russian Academy of Medical Sciences, Moscow, Russia; Peter the Great Museum of Anthropology and Ethnography (Kunstkamera) RAS, St Petersburg, Russia","Conceived and designed the experiments: CDS WH PB BL AC. Performed the experiments: CDS WH PB BL JT. Analyzed the data: CDS WH PB BL JS. Contributed reagents/materials/analysis tools: CDS WH PB BL JS JT OB VM VK AC TGC. Wrote the paper: CDS WH AC.","The authors declare having received funding from a commercial partner (IBM). This does not alter the authors’ adherence to all the PLOS ONE policies on sharing data and materials."
