"id","journal","publication_date","author","author_affiliate","author_notes","competing_interest"
"10.1371/journal.pone.0135588","plos one","2015-09-18T00:00:00Z","Young-eun Lee; Jung-eun Ellie Yun; Eun Young Kim; Hyun-joo Song","Department of Psychology, Yonsei University, Seoul, Korea; Graduate School of Education and Information Studies, University of California, Los Angeles, Los Angeles, United States of America; Department of Occupational Therapy, College of Medical Science, Soonchunhyang University, Asan, Korea","Conceived and designed the experiments: JEY HjS. Performed the experiments: JEY. Analyzed the data: YeL JEY EyK HjS. Contributed reagents/materials/analysis tools: JEY HjS. Wrote the paper: YeL HjS EyK.","The authors have declared that no competing interests exist."
"10.1371/journal.pone.0032098","plos one","2012-03-26T00:00:00Z","David C Weksberg; Stephen D Bilton; Eric L Chang","MD Anderson Cancer Center, Department of Radiation Oncology, University of Texas, Houston, Texas, United States of America; Department of Radiation Oncology, University of Southern California Keck School of Medicine, Norris Cancer Hospital, Los Angeles, California, United States of America","Conceived and designed the experiments: DCW ELC. Performed the experiments: DCW SDB. Analyzed the data: DCW SDB ELC. Wrote the paper: DCW.","The authors have declared that no competing interests exist."
"10.1371/journal.pone.0032095","plos one","2012-02-29T00:00:00Z","Xuekui Zhang; Gordon Robertson; Sangsoon Woo; Brad G Hoffman; Raphael Gottardo","Statistics Department, University of British Columbia, Vancouver, British Columbia, Canada; Canada's Michael Smith Genome Sciences Centre, British Columbia Cancer Agency, Vancouver, British Columbia, Canada; Vaccine and Infectious Disease and Public Health Sciences Divisions, Fred Hutchinson Cancer Research Center, Seattle, Washington, United States of America; Child and Family Research Institute, British Columbia Children's Hospital and Sunny Hill Health Centre, Vancouver, British Columbia, Canada; Department of Surgery, University of British Columbia, Vancouver, British Columbia, Canada","Wrote the paper: RG XZ GR SW BH. Developed the methodology and software, and performed the analyses: XZ RG. Helped with the data analysis: SW. Conceived the study, and participated in its design and coordination: GR BH RG. Read and approved the final manuscript: RG XZ GR SW BH.","The authors have declared that no competing interests exist."
"10.1371/journal.pone.0135552","plos one","2015-08-14T00:00:00Z","Takahiko Toyonaga; Hiroshi Nakase; Satoru Ueno; Minoru Matsuura; Takuya Yoshino; Yusuke Honzawa; Ayako Itou; Kazuyoshi Namba; Naoki Minami; Satoshi Yamada; Yorimitsu Koshikawa; Toshimitsu Uede; Tsutomu Chiba; Kazuichi Okazaki","Department of Gastroenterology and Hepatology, Kansai Medical University, Hirakata, Osaka, Japan; Department of Gastroenterology and Hepatology, Graduate School of Medicine, Kyoto University, Sakyo-ku, Kyoto, Japan; Department of Internal medicine, Takashima Municipal Hospital, Takashima, Shiga, Japan; Nutritional Science Institute, Morinaga Milk Industry Co., Ltd, Zama, Kanagawa, Japan; Department of Matrix Medicine, Institute for Genetic Medicine, Hokkaido University, Sapporo, Hokkaido, Japan","Conceived and designed the experiments: HN TC KO. Performed the experiments: TT SU MM TY YH AI KN NM SY YK. Analyzed the data: TT SU HN. Contributed reagents/materials/analysis tools: TU. Wrote the paper: TT HN.","AI & KN are employees of Morinaga Milk Industry Co., Ltd. There are no patents, products in development or marketed products to declare. This does not alter the authors’ adherence to all the PLOS ONE policies on sharing data and materials."
"10.1371/journal.pone.0010507","plos one","2010-05-06T00:00:00Z","Ricardo Valladares; Dhyana Sankar; Nan Li; Emily Williams; Kin-Kwan Lai; Asmaa Sayed Abdelgeliel; Claudio F Gonzalez; Clive H Wasserfall; Joseph Larkin; Desmond Schatz; Mark A Atkinson; Eric W Triplett; Josef Neu; Graciela L Lorca","Department of Microbiology and Cell Science, University of Florida, Gainesville, Florida, United States of America; Department of Pediatrics, University of Florida, Gainesville, Florida, United States of America; Department of Pathology, Immunology, and Laboratory Medicine, University of Florida, Gainesville, Florida, United States of America","Conceived and designed the experiments: CFG MAA JN GLL. Performed the experiments: RV DS NL EW ASA KKL CHW GLL. Analyzed the data: RV DS NL EW KKL CFG CHW JL DS MAA EWT JN GLL. Contributed reagents/materials/analysis tools: CHW DS MAA EWT JN GLL. Wrote the paper: RV CFG JN GLL.","The authors have declared that no competing interests exist."
"10.1371/journal.pone.0135513","plos one","2015-09-25T00:00:00Z","Anne-Laure Flamar; Vanessa Contreras; Sandra Zurawski; Monica Montes; Nathatlie Dereuddre-Bosquet; Frédéric Martinon; Jacques Banchereau; Roger Le Grand; Gerard Zurawski; Yves Levy","Baylor Institute for Immunology Research, Dallas, Texas, United States of America; Vaccine Research Institute, Créteil, France; INSERM UMR 955, Equipe 16, Créteil, France; CEA, Division of Immuno-Virology, IDMIT Center, Institute for Emerging Diseases and Innovative Therapies, Fontenay-aux-Roses, France; INSERM UMR 1184, Fontenay-aux-Roses, France; Université Paris-Sud 11, Orsay, France; Jackson Laboratory for Genomic Medicine, Farmington, Connecticut, United States of America; Assistance Publique-Hôpitaux de Paris, Groupe Henri-Mondor Albert-Chenevier, service d’immunologie clinique, Créteil, France; Université Paris Est, Faculté de médecine, Créteil, France","Conceived and designed the experiments: ALF SZ JB YL RL GZ. Performed the experiments: ALF VC SZ MM NDB FM. Analyzed the data: ALF VC SZ FM RL YL GZ. Contributed reagents/materials/analysis tools: ALF SZ GZ. Wrote the paper: ALF RL YL GZ.","ALF, SZ, JB and GZ are inventors on an issued patent related to the work described in this study. The Baylor Research Institute has patent filings related to the anti-DCIR Gag p24 vaccine described in this paper at various stages in various countries: specifically they are entitled VACCINES BASED ON TARGETING ANTIGEN TO DCIR EXPRESSED AN ANTIGEN-PRESENTING CELLS with reference numbers 2008214032 Australia, PCT National Phase; 2715044, Canada, PCT National Phase; 10108281.9, Hong Kong, Reregistration of EP/CN; 200880011285.1, China, PCT National Phase; 08728868.4, Germany, France, United Kingdom, EP National Stage; 12164572.5, European Patent Office, Divisional; 200088, Israel, PCT National Phase; 2009-548481, Japan, PCT National Phase; MX/a/2009/008140, Mexico, PCT National Phase; MX/a/2012/002859, Mexico, Divisional; 578696, New Zealand, PCT National Phase; 593450, New Zealand, Divisional; 97104113, Taiwan, Standard; 2009/05347, South Africa, PCT National Phase; 12/024897, 13/234914, 13/872793, 14/045454, USA, Continuation; 13/454404, USA, Divisional. The anti-DCIR Gag p24 vaccine is not currently in clinical development and we confirm that the above patent filing activities do not alter adherence to all PLOS ONE policies on sharing data and materials, as detailed online in your guide for authors. The authors confirm there are no restrictions on sharing of data and/or materials associated with this study other than the requirement for standard Material Transfer Agreements for governing material sharing that would be typical for any academic research institution."
"10.1371/journal.pone.0054985","plos one","2013-01-25T00:00:00Z","Qijian Song; David L Hyten; Gaofeng Jia; Charles V Quigley; Edward W Fickus; Randall L Nelson; Perry B Cregan","Soybean Genomics and Improvement Laboratory, Agricultural Research Service, United States Department of Agriculture, Beltsville, Maryland, United States of America; Pathology and Genetics Research Unit and Department of Crop Sciences, Soybean/Maize Germplasm, Agricultural Research Service, United States Department of Agriculture, University of Illinois, Urbana, Illinois, United States of America","Designed the Illumina Infinium BeadChip: QS DLH PC. Conceived and designed the experiments: DLH PC. Performed the experiments: CQ EF GJ. Analyzed the data: QS DLH PC. Contributed reagents/materials/analysis tools: RLN. Wrote the paper: QS PC RLN.","The authors have declared that no competing interests exist."
"10.1371/journal.pone.0010497","plos one","2010-05-05T00:00:00Z","Hania Köver; Shaowen Bao","Helen Wills Neuroscience Institute, University of California, Berkeley, California, United States of America","Conceived and designed the experiments: HK SB. Performed the experiments: HK SB. Analyzed the data: HK SB. Contributed reagents/materials/analysis tools: HK SB. Wrote the paper: HK SB.","The authors have declared that no competing interests exist."
"10.1371/journal.pone.0124415","plos one","2015-04-29T00:00:00Z","Krista K Bartz; Michael J Ford; Timothy J Beechie; Kurt L Fresh; George R Pess; Robert E Kennedy; Melinda L Rowse; Mindi Sheer","Conservation Biology Division, Northwest Fisheries Science Center, National Marine Fisheries Service, National Oceanic and Atmospheric Administration, Seattle, Washington, United States of America; Fish Ecology Division, Northwest Fisheries Science Center, National Marine Fisheries Service, National Oceanic and Atmospheric Administration, Seattle, Washington, United States of America; College of Earth, Ocean, and Atmospheric Sciences; Oregon State University, Corvallis, Oregon, United States of America","Conceived and designed the experiments: KKB MJF TJB KLF GRP REK MLR. Analyzed the data: KKB MS MJF. Contributed reagents/materials/analysis tools: REK. Wrote the paper: KKB MJF TJB KLF GRP REK MLR.","The authors have declared that no competing interests exist."
"10.1371/journal.pone.0010513","plos one","2010-05-07T00:00:00Z","Sarah A Wernimont; William T N Simonson; Peter A Greer; Christine M Seroogy; Anna Huttenlocher","Program in Cellular and Molecular Biology, University of Wisconsin, Madison, Wisconsin, United States of America; Department of Pathology and Molecular Medicine, Queen's University, Kingston, Ontario, Canada; Departments of Pediatrics and Medical Microbiology and Immunology, University of Wisconsin, Madison, Wisconsin, United States of America","Conceived and designed the experiments: SW WTS CMS AH. Performed the experiments: SW WTS. Analyzed the data: SW AH. Contributed reagents/materials/analysis tools: PAG. Wrote the paper: SW AH.","The authors have declared that no competing interests exist."
"10.1371/journal.pone.0055022","plos one","2013-01-31T00:00:00Z","Jean-Pierre Baudoin; W Gray Jerome; Christian Kübel; Niels de Jonge","Department of Molecular Physiology and Biophysics, Vanderbilt University School of Medicine, Nashville, Tennessee, United States of America; Department of Pathology, Microbiology and Immunology, Vanderbilt University School of Medicine, Nashville, Tennessee, United States of America; Institute of Nanotechnology (INT) and Karlsruhe Nano Micro Facility (KNMF), Karlsruhe Institute of Technology (KIT), Eggenstein-Leopoldshaffen, Germany; INM – Leibniz Institute for New Materials, Saarbrücken, Germany","Conceived and designed the experiments: JPB CK WGJ NdJ. Performed the experiments: JPB CK NdJ. Analyzed the data: JPB NdJ. Wrote the paper: JPB NdJ.","The authors have declared that no competing interests exist."
"10.1371/journal.pone.0135528","plos one","2015-08-18T00:00:00Z","Yidan Zhi; Zhirong Mou; Jun Chen; Yujun He; Hui Dong; Xiaolan Fu; Yuzhang Wu","Institute of Immunology of PLA, Third Military Medical University, Chongqing, China; Department of General surgery, Southwest Hospital, Chongqing, China; Department of General surgery, Daping Hospital, Chongqing, China","Conceived and designed the experiments: YW ZM YZ. Performed the experiments: YZ JC YH HD. Analyzed the data: YZ ZM YW. Contributed reagents/materials/analysis tools: JC YH XF. Wrote the paper: YZ ZM YW.","The authors have declared that no competing interests exist."
"10.1371/journal.pone.0135516","plos one","2015-08-11T00:00:00Z","Takahiro Teshima; Hirotaka Matsumoto; Tomoko Okusa; Yumi Nakamura; Hidekazu Koyama","Division of Therapeutic Science I, Department of Veterinary Clinical Medicine, School of Veterinary Medicine, Faculty of Veterinary Science, Nippon Veterinary and Life Science University, 1-7-1 Kyonan-cho, Musashino-shi, Tokyo 180-8602, Japan","Conceived and designed the experiments: TT HK. Performed the experiments: TT HM TO YN. Analyzed the data: TT HM. Contributed reagents/materials/analysis tools: HK. Wrote the paper: TT HK.","The authors have declared that no competing interests exist."
"10.1371/journal.pone.0010518","plos one","2010-05-06T00:00:00Z","Catherine A Pfister; Folker Meyer; Dionysios A Antonopoulos","Department of Ecology and Evolution, University of Chicago, Chicago, Illinois, United States of America; Computation Institute, University of Chicago, Chicago, Illinois, United States of America; Institute for Genomics and Systems Biology, Argonne National Laboratory, Argonne, Illinois, United States of America; Department of Medicine, University of Chicago, Chicago, Illinois, United States of America","Conceived and designed the experiments: CP FM. Performed the experiments: CP. Analyzed the data: CP FM DAA. Contributed reagents/materials/analysis tools: CP. Wrote the paper: CP.","The authors have declared that no competing interests exist."
"10.1371/journal.pone.0135566","plos one","2015-08-12T00:00:00Z","Po-Ming Chow; I-Ni Chiang; Chia-Yen Chen; Kuo-How Huang; Jui-Shan Hsu; Shuo-Meng Wang; Yuan-Ju Lee; Hong-Jeng Yu; Yeong-Shiau Pu; Chao-Yuan Huang","Department of Urology, National Taiwan University Hospital and National Taiwan University College of Medicine, Taipei, Taiwan; Psychiatric and Neurodevelopmental Genetics Unit and Analytic and Translational Genetics Unit, Massachusetts General Hospital, Boston, Massachusetts, United States of America; Department of Medical Imaging, Cardinal Tien Hospital, School of Medicine Fu-Jen Catholic University, New Taipei City, Taiwan; Department of Medical Imaging, National Taiwan University Hospital and National Taiwan University College of Medicine, Taipei, Taiwan","Conceived and designed the experiments: PMC CYH. Analyzed the data: PMC CYC JSH. Contributed reagents/materials/analysis tools: PMC INC KHH JSH SMW YJL HJY YSP CYH. Wrote the paper: PMC CYC.","The authors have declared that no competing interests exist."
"10.1371/journal.pone.0010566","plos one","2010-05-10T00:00:00Z","Takashi Shimbo; Atsushi Tanemura; Takehiko Yamazaki; Katsuto Tamai; Ichiro Katayama; Yasufumi Kaneda","Division of Gene Therapy Science, Osaka University Graduate School of Medicine, Osaka, Japan; Department of Dermatology, Osaka University Graduate School of Medicine, Osaka, Japan","Conceived and designed the experiments: TS YK. Performed the experiments: TS. Analyzed the data: TS AT KT. Contributed reagents/materials/analysis tools: AT TY IK. Wrote the paper: TS YK.","The authors have declared that no competing interests exist."
"10.1371/journal.pone.0055083","plos one","2013-01-31T00:00:00Z","Kazumasa Uehara; Takuya Morishita; Shinji Kubota; Kozo Funase","Human Motor Control Laboratory, Division of Human Sciences, Graduate School of Integrated Arts and Sciences, Hiroshima University, Higashi-Hiroshima, Hiroshima, Japan; Research Fellow of the Japan Society for the Promotion of Science, Tokyo, Japan","Conceived and designed the experiments: KU TM KF. Performed the experiments: KU TM SK KF. Analyzed the data: KU. Contributed reagents/materials/analysis tools: UK TM SK. Wrote the paper: UK KF.","The authors have declared that no competing interests exist."
"10.1371/journal.pone.0010457","plos one","2010-05-05T00:00:00Z","Andrea Petróczi; Eugene V Aidman; Iltaf Hussain; Nawed Deshmukh; Tamás Nepusz; Martina Uvacsek; Miklós Tóth; James Barker; Declan P Naughton","School of Life Sciences, Kingston University London, Kingston upon Thames, United Kingdom; Department of Psychology, University of Sheffield, Sheffield, United Kingdom; Land Operations Division, Defence Science and Technology Organisation, Edinburgh, Australia; School of Pharmacy and Chemistry, Kingston University London, Kingston upon Thames, United Kingdom; Faculty of Physical Education and Sport Sciences, Semmelweis University, Budapest, Hungary","Conceived and designed the experiments: AP DPN. Performed the experiments: MU MT. Analyzed the data: AP EVA TN. Contributed reagents/materials/analysis tools: AP EVA IH ND TN JB DPN. Wrote the paper: AP EVA IH ND JB DPN. Developed the implicit doping attitude test: AP EVA. Contributed to the design of the study and behavioural data analysis: EVA. Developed the methods for chemical analysis and performed the chemical analyses: IH ND. Developed the computerised test: TN. Contributed to the data acquisition and statistical analyses: TN. Contributed to drafting the manuscript: MU MT JB. Contributed to the chemical analysis: JB. Contributed to the method development for chemical analysis and interpretation of the results: DPN.","The authors have declared that no competing interests exist."
"10.1371/journal.pone.0054957","plos one","2013-01-28T00:00:00Z","María C de Andrés; Emmajayne Kingham; Kei Imagawa; Antonio Gonzalez; Helmtrud I Roach; David I Wilson; Richard O C Oreffo","Bone and Joint Research Group, University of Southampton, Southampton, United Kingdom; Centre for Human Development, Stem Cells and Regeneration Human Development and Health, Institute of Developmental Sciences, University of Southampton, Southampton, United Kingdom; Instituto de Investigación Sanitaria-Hospital Clínico Universitario de Santiago, Santiago de Compostela, Spain; Tohoku University School of Medicine, Sendai, Japan; Stem Cell Unit, Department of Anatomy, College of Medicine, King Saud University, Riyadh, Kingdom of Saudi Arabia","Conceived and designed the experiments: RO HIR MCA EK. Performed the experiments: MCA EK KI. Analyzed the data: MCA EK KI AG DIW RO. Contributed reagents/materials/analysis tools: HIR RO. Wrote the paper: MCA EK AG DIW RO.","The authors have declared that no competing interest exist."
"10.1371/journal.pone.0124360","plos one","2015-04-13T00:00:00Z","Eric Dugat-Bony; Cécile Straub; Aurélie Teissandier; Djamila Onésime; Valentin Loux; Christophe Monnet; Françoise Irlinger; Sophie Landaud; Marie-Noëlle Leclercq-Perlat; Pascal Bento; Sébastien Fraud; Jean-François Gibrat; Julie Aubert; Frédéric Fer; Eric Guédon; Nicolas Pons; Sean Kennedy; Jean-Marie Beckerich; Dominique Swennen; Pascal Bonnarme","INRA, UMR 782 Génie et Microbiologie des Procédés Alimentaires, F-78850, Thiverval-Grignon, France; AgroParisTech, UMR 782 Génie et microbiologie des procédés alimentaires, F-78850, Thiverval-Grignon, France; AgroParisTech, UMR 518 Mathématiques et Informatiques Appliquées, F-75231, Paris, France; INRA, UMR 518 Mathématiques et Informatiques Appliquées, F-75231, Paris, France; INRA, Institut Micalis, F-78352, Jouy-en-Josas, France; AgroParisTech, Institut Micalis, F-78352, Jouy-en-Josas, France; INRA, UR1404 Mathématiques et Informatique Appliquées du Génome à l’Environnement, F-78352, Jouy-en-Josas, France; Actalia, F-74801, La Roche sur Foron, France; INRA, US 1367 Metagenopolis, F-78352, Jouy-en-Josas, France","Conceived and designed the experiments: P. Bonnarme JMB CM FI DS. Performed the experiments: CS CM FI SL SK DO MNLP SF. Analyzed the data: EDB CS P. Bento VL NP AT JA FF EG. Contributed reagents/materials/analysis tools: P. Bonnarme JMB JFG. Wrote the paper: EDB CS P. Bonnarme JMB DS.","The authors have declared that no competing interests exist."
"10.1371/journal.pone.0031992","plos one","2012-04-06T00:00:00Z","Sebastian Nehring; Nediljko Budisa; Birgit Wiltschi","Department of Biocatalysis, Technical University of Berlin, Berlin, Germany; BIOSS - Centre for Biological Signalling Studies, Albert-Ludwigs-University Freiburg, Freiburg, Germany; Faculty of Biology, Albert-Ludwigs-University Freiburg, Freiburg, Germany","Conceived and designed the experiments: NB BW. Performed the experiments: SN. Analyzed the data: SN NB BW. Wrote the paper: SN BW.","The authors have declared that no competing interests exist."
"10.1371/journal.pone.0124359","plos one","2015-04-17T00:00:00Z","Zengqiang Li; Bingzi Zhao; Qingyun Wang; Xiaoyan Cao; Jiabao Zhang","State Key Laboratory of Soil and Sustainable Agriculture, Institute of Soil Science, Chinese Academy of Sciences, Nanjing, China; Graduate School of the Chinese Academy of Science, Beijing, China; Department of Chemistry, Brandeis University, Waltham, Massachusetts, United States of America","Conceived and designed the experiments: BZ. Performed the experiments: ZL. Analyzed the data: ZL BZ QW. Contributed reagents/materials/analysis tools: QW JZ. Wrote the paper: ZL BZ QW XC JZ.","The authors have declared that no competing interests exist."
"10.1371/journal.pone.0010455","plos one","2010-05-05T00:00:00Z","Simone Mader; Andreas Lutterotti; Franziska Di Pauli; Bettina Kuenz; Kathrin Schanda; Fahmy Aboul-Enein; Michael Khalil; Maria K Storch; Sven Jarius; Wolfgang Kristoferitsch; Thomas Berger; Markus Reindl","Clinical Department of Neurology, Innsbruck Medical University, Innsbruck, Austria; Department of Neurology, SMZ-Ost Donauspital, Vienna, Austria; Department of Neurology, Medical University of Graz, Graz, Austria; Division of Molecular Neuroimmunology, Department of Neurology, University of Heidelberg, Heidelberg, Germany","Conceived and designed the experiments: SM FDP KS MR. Performed the experiments: SM KS. Analyzed the data: SM AL FDP WK MR. Contributed reagents/materials/analysis tools: AL FDP BK FAE MK MKS SJ WK TB. Wrote the paper: SM AL FDP SJ WK TB MR.","The authors have declared that no competing interests exist."
"10.1371/journal.pone.0031991","plos one","2012-02-23T00:00:00Z","Galina Dvoriantchikova; Dmitry Ivanov; David Barakat; Alexander Grinberg; Rong Wen; Vladlen Z Slepak; Valery I Shestopalov","Department of Ophthalmology, Bascom Palmer Eye Institute, University of Miami Miller School of Medicine, Miami, Florida, United States of America; Vavilov Institute of General Genetics, Russian Academy of Sciences, Moscow, Russian Federation; National Institute of Child Health and Development, National Institutes of Health, Bethesda, Maryland, United States of America; Department of Molecular Pharmacology, University of Miami Miller School of Medicine, Miami, Florida, United States of America; Department of Cell Biology and Anatomy, University of Miami Miller School of Medicine, Miami, Florida, United States of America","Conceived and designed the experiments: GD VIS VZS DI RW. Performed the experiments: DB AG RW VZS VIS. Analyzed the data: GD DI DB RW VZS VIS. Contributed reagents/materials/analysis tools: DI AG RW VZS VIS. Wrote the paper: GD DI DB RW VZS VIS.","The authors have declared that no competing interests exist."
"10.1371/journal.pone.0010454","plos one","2010-05-04T00:00:00Z","Elena Gómez-Díaz; Jacob González-Solís","Institut de Recerca de la Biodiversitat i Departament Biologia Animal (Vertebrats), Universitat de Barcelona, Barcelona, Spain","Conceived and designed the experiments: EGD JGS. Performed the experiments: EGD. Analyzed the data: EGD. Contributed reagents/materials/analysis tools: JGS. Wrote the paper: EGD JGS.","The authors have declared that no competing interests exist."
"10.1371/journal.pone.0124357","plos one","2015-04-15T00:00:00Z","Anna Sophie Rommel; Frühling Rijsdijk; Corina U Greven; Philip Asherson; Jonna Kuntsi","King’s College London, Medical Research Council Social, Genetic and Developmental Psychiatry Centre, Institute of Psychiatry, Psychology and Neuroscience, London, United Kingdom; Radboud University Medical Centre, Department of Cognitive Neuroscience, Donders Institute for Brain, Cognition and Behaviour, Nijmegen, The Netherlands; Karakter Child and Adolescent Psychiatry University Center, Nijmegen, The Netherlands","Conceived and designed the experiments: AR FR. Analyzed the data: AR FR. Contributed reagents/materials/analysis tools: FR CG. Wrote the paper: AR FR CG PA JK.","The authors have declared that no competing interests exist."
"10.1371/journal.pone.0031989","plos one","2012-03-09T00:00:00Z","Xiang-Bo Wan; Yan Zhao; Xin-Juan Fan; Hong-Min Cai; Yan Zhang; Ming-Yuan Chen; Jie Xu; Xiang-Yuan Wu; Hong-Bo Li; Yi-Xin Zeng; Ming-Huang Hong; Quentin Liu","Department of Medical Oncology, the Third Affiliated Hospital, Sun Yat-sen University, Guangzhou, Guangdong, People's Republic of China; State Key Laboratory of Oncology in South China, Cancer Center, Sun Yat-sen University, Guangzhou, Guangdong, People's Republic of China; Department of Pathology, Gastrointestinal Institute, the Sixth Affiliated Hospital, Sun Yat-sen University, Guangzhou, Guangdong, People's Republic of China; School of Information Science and Technology, Sun Yat-sen University, Guangzhou, Guangdong, People's Republic of China; Department of Pathology, Kingmed Diagnostic Company, Guangzhou, Guangdong, People's Republic of China; Clinical Trials Center and Institute of Drug Clinical Trials, Cancer Center, Sun Yat-sen University, Guangzhou, Guangdong, People's Republic of China","Conceived and designed the experiments: XBW XJF MHH QL Y. Zhao. Performed the experiments: XBW XJF MYC Y. Zhang JX XYW. Analyzed the data: HMC XBW XJF QL. Contributed reagents/materials/analysis tools: YXZ MHH QL HBL. Wrote the paper: XBW QL HMC.","The authors have declared that no competing interests exist."
