"id","journal","publication_date","author","author_affiliate","author_notes","competing_interest"
"10.1371/journal.pone.0098851","plos one","2014-06-05T00:00:00Z","Liping Sun; Jingwei Liu; Quan Yuan; Chengzhong Xing; Yuan Yuan","Tumor Etiology and Screening Department of Cancer Institute and General Surgery, the First Affiliated Hospital of China Medical University, and Key Laboratory of Cancer Etiology and Prevention (China Medical University), Liaoning Provincial Education Department, Shenyang, China","Conceived and designed the experiments: YY CX. Analyzed the data: LS JL QY. Wrote the paper: LS JL.","The authors have declared that no competing interests exist."
"10.1371/journal.pone.0121834","plos one","2015-04-17T00:00:00Z","Francisco Rothhammer; Macarena Fuentes-Guajardo; Ranajit Chakraborty; Justo Lorenzo Bermejo; Manuela Dittmar","Instituto de Alta Investigación, Universidad de Tarapacá, Arica, Chile; Centro de Investigaciones del Hombre en el Desierto (CIHDE), Arica, Chile; Center for Computational Genomics, Institute of Applied Genetics, University of North Texas Health Science Center, Fort Worth, Texas, United State of America; Institute of Medical Biometry and Informatics, University of Heidelberg, Heidelberg, Germany; Department of Human Biology, Zoological Institute, Christian Albrechts-University, Kiel, Germany; Departmento de Tecnología Médica, Facultad de Ciencias de la Salud, Universidad de Tarapacá, Arica, Chile","Conceived and designed the experiments: FR. Analyzed the data: RC MD MF. Contributed reagents/materials/analysis tools: RC. Wrote the paper: FR RC JLB.","The authors have declared that no competing interests exist."
"10.1371/journal.pone.0110423","plos one","2014-10-21T00:00:00Z","Ting-Feng Lin; Guey-Mei Jow; Hsin-Yu Fang; Ssu-Ju Fu; Hao-Han Wu; Mei-Miao Chiu; Chung-Jiuan Jeng","Institute of Anatomy and Cell Biology, School of Medicine, National Yang-Ming University, Taipei, Taiwan; Brain Research Center, National Yang-Ming University, Taipei, Taiwan; School of Medicine, Fu-Jen Catholic University, Hsin-Chuang, New Taipei City, Taiwan","Conceived and designed the experiments: TFL GMJ CJJ. Performed the experiments: TFL HYF SJF HHW. Analyzed the data: TFL SJF. Contributed reagents/materials/analysis tools: GMJ CJJ. Contributed to the writing of the manuscript: GMJ MMC CJJ.","The authors have declared that no competing interests exist."
"10.1371/journal.pone.0110422","plos one","2014-10-21T00:00:00Z","Sylvie Juliant; Anne Harduin-Lepers; François Monjaret; Béatrice Catieau; Marie-Luce Violet; Pierre Cérutti; Annick Ozil; Martine Duonor-Cérutti","CNRS UPS3044 Baculovirus et Thérapie, Saint Christol Lèz Alès, France; CNRS UMR8576, Unité de Glycobiologie Structurale et Fonctionnelle, Université Lille Nord de France, Lille1, Villeneuve d'Ascq, France; Laboratoire Français du Fractionnement et des Biotechnologies de Lille, Lille, France","Conceived and designed the experiments: MD-C SJ FM AH-L. Performed the experiments: SJ FM BC MLV PC AO AH-L MD-C. Analyzed the data: MD-C SJ FM AH-L. Contributed reagents/materials/analysis tools: SJ FM BC MLV PC AO. Contributed to the writing of the manuscript: MD-C SJ AH-L.","The authors have declared that no competing interests exist."
"10.1371/journal.pone.0007046","plos one","2009-09-16T00:00:00Z","Mattias C U Gustafsson; Deborah Knight; Colin N A Palmer","Biomedical Research Institute, University of Dundee, Ninewells Hospital and Medical School, Dundee, United Kingdom","Conceived and designed the experiments: MCUG DK CNP. Performed the experiments: MCUG DK. Analyzed the data: MCUG DK CNP. Wrote the paper: MCUG CNP.","The authors have declared that no competing interests exist."
"10.1371/journal.pone.0030190","plos one","2012-01-18T00:00:00Z","Koji Toda; Yasuko Sugase-Miyamoto; Takashi Mizuhiki; Kiyonori Inaba; Barry J Richmond; Munetaka Shidara","Doctoral Program in Kansei, Behavioral and Brain Sciences, Graduate School of Comprehensive Human Sciences, University of Tsukuba, Tsukuba, Ibaraki, Japan; Human Technology Research Institute, National Institute of Advanced Industrial Science and Technology, Tsukuba, Ibaraki, Japan; Faculty of Medicine, University of Tsukuba, Tsukuba, Ibaraki, Japan; Laboratory of Neuropsychology, National Institute of Mental Health, National Institutes of Health, Department of Health and Human Services, Bethesda, Maryland, United States of America","Conceived and designed the experiments: KT MS. Performed the experiments: KT YS-M TM KI MS. Analyzed the data: KT YS-M TM BJR MS. Wrote the paper: KT YS-M BJR MS.","The authors have declared that no competing interests exist."
"10.1371/journal.pone.0041618","none","2012-08-06T00:00:00Z","Mario Songane; Johanneke Kleinnijenhuis; Bachti Alisjahbana; Edhyana Sahiratmadja; Ida Parwati; Marije Oosting; Theo S Plantinga; Leo A B Joosten; Mihai G Netea; Tom H M Ottenhoff; Esther van de Vosse; Reinout van Crevel","Department of Medicine, Radboud University Nijmegen Medical Centre, Nijmegen, The Netherlands; Nijmegen Institute for Infection, Inflammation and Immunity (N4i), Radboud University Nijmegen Medical Centre, Nijmegen, The Netherlands; Department of Internal Medicine, Faculty of Medicine, Universitas Padjadjaran, Bandung, Indonesia; Health Research Unit, Faculty of Medicine, Universitas Padjadjaran, Bandung, Indonesia; Department of Biochemistry, Faculty of Medicine, Universitas Padjadjaran, Bandung, Indonesia; Department of Clinical Pathology, Faculty of Medicine, Universitas Padjadjaran, Bandung, Indonesia; Department of Infectious Diseases, Leiden University Medical Center, Leiden, The Netherlands","Conceived and designed the experiments: MS JK MN TO EV RC. Performed the experiments: MS JK BA ES IP MO TP. Analyzed the data: MS JK MN TO EV RC. Wrote the paper: MS JK LJ MN TO EV RC.","The authors have declared that no competing interests exist."
"10.1371/journal.pone.0075988","plos one","2013-11-15T00:00:00Z","Eduard Korkotian; Tatyana Bombela; Tatiana Odegova; Petr Zubov; Menahem Segal","Department of Neurobiology, The Weizmann Institute, Rehovot, Israel; Department of Pharmacognosy, Perm State Pharmaceutical Academy, Perm, Russia; Department of Microbiology, Perm State Pharmaceutical Academy, Perm, Russia","Conceived and designed the experiments: EK MS TO. Performed the experiments: EK PZ TB. Analyzed the data: EK PZ TB. Contributed reagents/materials/analysis tools: EK TO TB. Wrote the paper: MS EK.","The authors have declared that no competing interests exist."
"10.1371/journal.pone.0075986","plos one","2013-10-14T00:00:00Z","Federico Alessandro Ruffinatti; Alessandra Gilardino; Davide Lovisolo; Mario Ferraro","Department of Life Sciences and Systems Biology, University of Turin, Turin, Italy; Department of Physics, University of Turin, Turin, Italy; NIS Interdepartmental Center, University of Turin, Turin, Italy; Neuroscience Institute of Turin, University of Turin, Turin, Italy","Conceived and designed the experiments: FAR AG DL. Performed the experiments: FAR AG DL. Analyzed the data: FAR MF. Wrote the paper: FAR AG DL MF.","The authors have declared that no competing interests exist."
"10.1371/journal.pone.0041616","none","2012-08-09T00:00:00Z","Clémentine Ripoll; Isabelle Rivals; Emilie Ait Yahya-Graison; Luce Dauphinot; Evelyne Paly; Clothilde Mircher; Aimé Ravel; Yann Grattau; Henri Bléhaut; André Mégarbane; Guy Dembour; Bénédicte de Fréminville; Renaud Touraine; Nicole Créau; Marie Claude Potier; Jean Maurice Delabar","Univ Paris Diderot, Sorbonne Paris Cité, Unité de Biologie Fonctionnelle et Adaptative, EAC4413 CNRS, Paris, France; Equipe de Statistique Appliquée, ESPCI ParisTech, Paris, France; CRICM, CNRS UMR7225, INSERM UMR975, UPMC Hôpital de la Pitié-Salpêtrière, Paris, France; Institut Médical Jérôme Lejeune et Fondation Jérome Lejeune, Paris, France; Unité de Génétique Médicale, Faculté de Médecine, Université Saint-Joseph, Beirut, Lebanon; Cardiologie pédiatrique, Cliniques Universitaires St Luc, Bruxelles, Belgique; Service de Génétique, Centre Hospitalier Universitaire de Saint-Etienne, Saint-Etienne, France","Conceived and designed the experiments: JMD MCP. Performed the experiments: CR EAY-G LD EP. Analyzed the data: IR CR EAY-G NC MCP JMD. Contributed reagents/materials/analysis tools: CM AR YG HB BdF RT GD AM. Wrote the paper: NC MCP JMD.","The authors have declared that no competing interests exist."
"10.1371/journal.pone.0098820","plos one","2014-06-04T00:00:00Z","Pleunie van den Borne; Tomasz P Rygiel; Ayla Hoogendoorn; Geertje H A Westerlaken; Louis Boon; Paul H A Quax; Gerard Pasterkamp; Imo E Hoefer; Linde Meyaard","Laboratory of Experimental Cardiology, University Medical Center, Utrecht, The Netherlands; Laboratory for Translational Immunology, Department of Immunology, University Medical Center Utrecht, Utrecht, The Netherlands; Department of Immunology, Center of Biostructure Research, Medical University of Warsaw, Warsaw, Poland; Bioceros BV, Utrecht, The Netherlands; Department of Surgery, Leiden University Medical Center, Leiden, The Netherlands; Einthoven Laboratory of Experimental Vascular Medicine, Leiden University Medical Center, Leiden, The Netherlands; Interuniversity Cardiology Institute of the Netherlands, Utrecht, The Netherlands","Conceived and designed the experiments: PB TPR GP IEH LM. Performed the experiments: PB AH. Analyzed the data: PB TPR GHAW LM. Contributed reagents/materials/analysis tools: LB GHAW. Wrote the paper: PB TPR PHAQ GP IEH LM.","The author Louis Boon is Chief Scientific Officer of Bioceros BV (Bioceros BV, Yalelaan 46, 3584 CM Utrecht, The Netherlands). This does not alter the authors’ adherence to all the PLOS ONE policies on sharing data and materials. There are no further conflicts of interest to disclose."
"10.1371/journal.pone.0064528","plos one","2013-05-24T00:00:00Z","Takayuki Hirai; Kenzo Uchida; Hideaki Nakajima; Alexander Rodriguez Guerrero; Naoto Takeura; Shuji Watanabe; Daisuke Sugita; Ai Yoshida; William E B Johnson; Hisatoshi Baba","Department of Orthopaedics and Rehabilitation Medicine, Faculty of Medical Sciences, University of Fukui, Eiheiji, Fukui, Japan; Life & Health Sciences, Aston University, Aston Triangle, Birmingham, United Kingdom","Conceived and designed the experiments: KU HN HB. Performed the experiments: TH ARG NT SW DS AY. Analyzed the data: TH KU HN NT. Contributed reagents/materials/analysis tools: TH HN ARG NT SW DS AY. Wrote the paper: TH KU HN ARG WEBJ HB.","The authors have declared that no competing interests exist."
"10.1371/journal.pone.0121823","plos one","2015-03-20T00:00:00Z","Wen-ping Zhou; Hui Zhang; Yu-xia Zhao; Gang-qiong Liu; Jin-ying Zhang","Department of Cardiology, the First Affiliated Hospital of Zhengzhou University, Zhengzhou, Henan, P.R. China; Department of Medical Equipment, the First Affiliated Hospital of Zhengzhou University, Zhengzhou, Henan, P.R. China","Conceived and designed the experiments: WPZ JYZ. Performed the experiments: WPZ HZ YXZ GQL. Analyzed the data: HZ YXZ. Contributed reagents/materials/analysis tools: YXZ. Wrote the paper: GQL.","The authors have declared that no competing interests exist."
"10.1371/journal.pone.0087402","plos one","2014-01-23T00:00:00Z","Brooke K McMichael; Katharine F Scherer; Nicole C Franklin; Beth S Lee","Department of Physiology and Cell Biology, The Ohio State University College of Medicine, Columbus, Ohio, United States of America","Conceived and designed the experiments: BKM BSL. Performed the experiments: BKM KFS NCF. Analyzed the data: BKM KFS NCF BSL. Contributed reagents/materials/analysis tools: BSL. Wrote the paper: BKM BSL.","The authors have declared that no competing interests exist."
"10.1371/journal.pone.0053097","plos one","2012-12-27T00:00:00Z","Thomas Hassenklöver; Lars P Pallesen; Detlev Schild; Ivan Manzini","Department of Neurophysiology and Cellular Biophysics, University of Göttingen, Göttingen, Germany; Cluster of Excellence “Nanoscale Microscopy and Molecular Physiology of the Brain” (CNMPB), University of Göttingen, Göttingen, Germany","Conceived and designed the experiments: TH DS IM. Performed the experiments: TH LPP IM. Analyzed the data: TH IM. Wrote the paper: TH DS IM.","The authors have declared that no competing interests exist."
"10.1371/journal.pone.0053098","plos one","2012-12-31T00:00:00Z","Jemma Evans; Natalie J Hannan; Cassandra Hincks; Luk J F Rombauts; Lois A Salamonsen","Prince Henry’s Institute of Medical Research, University of Melbourne, Melbourne, Victoria, Australia; Department of Zoology, University of Melbourne, Melbourne, Victoria, Australia; Obstetrics and Gynaecology, Monash University, Melbourne, Victoria, Australia; Monash IVF, Melbourne, Victoria, Australia","Conceived and designed the experiments: JE NJH LJFR LAS. Performed the experiments: JE NJH CH. Analyzed the data: JE NJH. Contributed reagents/materials/analysis tools: LJFR LAS. Wrote the paper: JE NJH. Provided intellectual input and edited the manuscript: LJFR LAS.","The authors have read the journal's policy and have the following conflicts: J.E, N.J.H., and C.H. have nothing to declare. L.R. and L.A.S. have received research grants for this research. The other authors have the following interests. Monash IVF, though its research foundation, contributed funding for the study and L.R is a shareholder and company board member. There are no patents, products in development or marketed products to declare. This does not alter the authors' adherence to all PLOS ONE policies on sharing data and materials as detailed in the online guide for authors."
"10.1371/journal.pone.0007055","plos one","2009-09-18T00:00:00Z","Ming D Li; Jamie E Mangold; Chamindi Seneviratne; Guo-Bo Chen; Jennie Z Ma; Xiang-Yang Lou; Thomas J Payne","Department of Psychiatry and Neurobehavioral Sciences, University of Virginia, Charlottesville, Virginia, United States of America; ACT Center for Tobacco Treatment, Education and Research, Department of Otolaryngology and Communicative Sciences, University of Mississippi Medical Center, Jackson, Mississippi, United States of America; Department of Public Health Sciences, University of Virginia, Charlottesville, Virginia, United States of America","Conceived and designed the experiments: MDL JZM TJP. Performed the experiments: MDL CS. Analyzed the data: MDL JM CS GBC JZM XYL. Contributed reagents/materials/analysis tools: MDL JZM TJP. Wrote the paper: MDL JM CS XYL TJP.","The authors have declared that no competing interests exist."
"10.1371/journal.pone.0121818","plos one","2015-03-20T00:00:00Z","Shuang Ye; Jiaxin Yang; Dongyan Cao; Huimin Bai; Huifang Huang; Ming Wu; Jie Chen; Yan You; Jinghe Lang; Keng Shen","Department of Obstetrics and Gynecology, Peking Union Medical College Hospital, Chinese Academy of Medical Sciences & Peking Union Medical College, Beijing, China; Department of Pathology, Peking Union Medical College Hospital, Chinese Academy of Medical Sciences & Peking Union Medical College, Beijing, China","Conceived and designed the experiments: SY JY DC HB HH MW JC YY JL KS. Performed the experiments: SY JY DC HB HH MW JC YY JL KS. Analyzed the data: SY JY DC YY KS. Contributed reagents/materials/analysis tools: SY JY DC HB HH MW JC YY JL KS. Wrote the paper: SY JY DC HB HH MW JC YY JL KS.","The authors have declared that no competing interests exist."
"10.1371/journal.pone.0053221","plos one","2013-01-10T00:00:00Z","Markus Castegren; Paul Skorup; Miklós Lipcsey; Anders Larsson; Jan Sjölin","Centre for Clinical Research Sörmland, Uppsala University, Uppsala, Sweden; Section of Infectious Diseases, Department of Medical Sciences, Uppsala University, Uppsala, Sweden; Section of Anesthesiology and Intensive Care, Department of Surgical Sciences, Uppsala University, Uppsala, Sweden; Section of Clinical Chemistry, Department of Medical Sciences, Uppsala University, Uppsala, Sweden","Conceived and designed the experiments: MC ML JS. Performed the experiments: MC PS ML AL. Analyzed the data: MC PS ML AL JS. Contributed reagents/materials/analysis tools: AL. Wrote the paper: MC PS ML AL JS.","The authors have declared that no competing interests exist."
"10.1371/journal.pone.0098993","plos one","2014-06-09T00:00:00Z","Richard Long; Selvanayagam Niruban; Courtney Heffernan; Ryan Cooper; Dina Fisher; Rabia Ahmed; Mary Lou Egedahl; Rhonda Fur","Department of Medicine, University of Alberta, Edmonton, Alberta, Canada; Department of Public Health Sciences, University of Alberta, Edmonton, Alberta, Canada; Department of Medicine, University of Calgary, Calgary, Alberta, Canada; Alberta Health Services, Alberta, Canada","Conceived and designed the experiments: RL SN CH DF RC. Performed the experiments: RL SN CH RC. Analyzed the data: RL SN CH RC DF RA MLE RF. Contributed reagents/materials/analysis tools: RL SN CH MLE RF. Wrote the paper: RL SN CH RC DF RA MLE RF.","The authors have declared that no competing interests exist."
"10.1371/journal.pone.0076137","plos one","2013-10-24T00:00:00Z","Philip Klepeisz; Sandra Sagmeister; Verena Haudek-Prinz; Melanie Pichlbauer; Bettina Grasl-Kraupp; Christopher Gerner","Department of Inner Medicine I, Comprehensive Cancer Center, Institute of Cancer Research, Medical University of Vienna, Vienna, Austria; Institute of Analytical Chemistry, Faculty of Chemistry, University of Vienna, Vienna, Austria","Conceived and designed the experiments: CG BGK VHP SS. Performed the experiments: PK CG SS MP. Analyzed the data: CG PK. Contributed reagents/materials/analysis tools: CG BGK. Wrote the manuscript: CG BGK PK.","The authors have declared that no competing interests exist."
"10.1371/journal.pone.0053225","plos one","2013-01-07T00:00:00Z","Radhakrishnan Nagarajan; Jeffrey N Jonkman","Division of Biomedical Informatics, Department of Biostatistics, College of Public Health, University of Kentucky, Lexington, Kentucky, United States of America; Department of Mathematics and Statistics, Grinnell College, Grinnell, Iowa, United States of America","Conceived and designed the experiments: RN. Performed the experiments: RN. Analyzed the data: RN JJ. Contributed reagents/materials/analysis tools: RN JJ. Wrote the paper: RN JJ.","The authors have declared that no competing interests exist."
"10.1371/journal.pone.0145045","plos one","2015-12-16T00:00:00Z","Jia Wang; Hongju Jian; Lijuan Wei; Cunmin Qu; Xinfu Xu; Kun Lu; Wei Qian; Jiana Li; Maoteng Li; Liezhao Liu","College of Agronomy and Biotechnology, Southwest University, Beibei, Chongqing, China; Institute of Resource Biology and Biotechnology, College of Life Science and Technology, Huazhong University of Science and Technology, Wuhan, China","Conceived and designed the experiments: LL. Performed the experiments: JW HJ LW. Analyzed the data: JW LW LL. Contributed reagents/materials/analysis tools: CQ XX KL WQ JL ML. Wrote the paper: JW.","The authors have declared that no competing interests exist."
"10.1371/journal.pone.0122036","plos one","2015-03-31T00:00:00Z","Fei Li; Chun Song Bian; Jian Fei Xu; Wan fu Pang; Jie Liu; Shao Guang Duan; Zun-Guo Lei; Palta Jiwan; Li-Ping Jin","The Institute of Vegetables and Flowers, Chinese Academy of Agricultural Sciences, Beijing, China; Institute of Potato in Guizhou Province, Guiyang, China; Department of Horticulture, University of Wisconsin, Madison, Wisconsin, United States of America","Conceived and designed the experiments: FL CSB PJ LPJ. Performed the experiments: FL JFX. Analyzed the data: FL JFX JL. Contributed reagents/materials/analysis tools: WFP SGD ZGL. Wrote the paper: FL JFX PJ LPJ.","The authors have declared that no competing interests exist."
"10.1371/journal.pone.0110565","plos one","2014-10-22T00:00:00Z","Lei Han; Yong-Jun Zhang; Long Zhang; Xu Cui; Jinpu Yu; Ziding Zhang; Ming S Liu","Centre for Cancer Molecular Diagnosis, Tianjin Medical University Cancer Institute and Hospital, National Clinical Research Center for Cancer, Tianjin, China; State Key Laboratory of Agrobiotechnology, College of Biological Sciences, China Agricultural University, Beijing, China; State Key Laboratory for Biology of Plant Diseases and Insect Pests, Institute of Plant Protection, Chinese Academy of Agricultural Sciences, Beijing, China; Key Lab for Biological Control of the Ministry of Agriculture, China Agricultural University, Beijing, China; Beijing Computing Center, Beijing, China; CSIRO - Computational Informatics & Digital Productivity Flagship, Private Bag 10, Clayton South, Australia","Conceived and designed the experiments: LH MSL ZZ. Performed the experiments: LH MSL. Analyzed the data: LH MSL ZZ YJZ LZ XC JPY. Wrote the paper: LH ZZ MSL.","The authors have declared that no competing interests exist."
"10.1371/journal.pone.0098996","plos one","2014-06-03T00:00:00Z","Michael E Young; Tara L Webb; Jillian M Rung; Anthony W McCoy","Kansas State University, Manhattan, Kansas, United States of America; Southern Illinois University, Carbondale, Illinois, United States of America; Utah State University, Logan, Utah, United States of America","Conceived and designed the experiments: MEY. Performed the experiments: TLW JMR. Analyzed the data: MEY. Wrote the paper: MEY TLW JMR AWM. Literature review: AWM.","The authors have declared that no competing interests exist."
"10.1371/journal.pone.0030337","plos one","2012-01-23T00:00:00Z","Hon-Yen Wu; Kuan-Yu Hung; Tao-Min Huang; Fu-Chang Hu; Yu-Sen Peng; Jenq-Wen Huang; Shuei-Liong Lin; Yung-Ming Chen; Tzong-Shinn Chu; Tun-Jun Tsai; Kwan-Dun Wu","Department of Internal Medicine, Far Eastern Memorial Hospital, New Taipei City, Taiwan; Department of Internal Medicine, National Taiwan University Hospital, Taipei, Taiwan; Center of Quality Management, National Taiwan University Hospital, Taipei, Taiwan; National Center of Excellence for General Clinical Trial and Research, National Taiwan University Hospital, Taipei, Taiwan; Department of Internal Medicine, Yun-Lin Branch, National Taiwan University Hospital, Yun-Lin, Taiwan; International Harvard Statistical Consulting Company, Taipei, Taiwan","Conceived and designed the experiments: H-YW K-YH J-WH. Performed the experiments: H-YW T-MH F-CH. Analyzed the data: H-YW Y-SP S-LL Y-MC. Contributed reagents/materials/analysis tools: F-CH. Wrote the paper: H-YW K-YH J-WH. Reviewed and edited the manuscript: T-SC T-JT K-DW.","The authors have declared that no competing interests exist."
"10.1371/journal.pone.0041773","none","2012-07-27T00:00:00Z","Xiu-Jin Shen; Hai-Bing Wang; Xiao-Qiong Ma; Jiang-Hua Chen","Kidney Disease Center, The First Affiliated Hospital, College of Medicine, Zhejiang University, Hangzhou, China; National Clinical Research Base of Traditional Chinese Medicine, Zhejiang Hospital of Traditional Chinese Medicine, Zhejiang Chinese Medical University, Hangzhou, China","Conceived and designed the experiments: H-BW X-QM J-HC. Performed the experiments: X-JS H-BW. Analyzed the data: X-JS H-BW X-QM. Contributed reagents/materials/analysis tools: X-JS H-BW X-QM. Wrote the paper: X-JS H-BW J-HC.","The authors have declared that no competing interests exist."
"10.1371/journal.pone.0087587","plos one","2014-01-31T00:00:00Z","D Clark Files; Kunhong Xiao; Tan Zhang; Chun Liu; Jiang Qian; Weiling Zhao; Peter E Morris; Osvaldo Delbono; Xin Feng","Internal Medicine-Pulmonary, Critical Care, Allergy and Immunology, Wake Forest School of Medicine, Winston-Salem, North Carolina, United States of America; Wake Forest Critical Care Translational Research Center, Wake Forest School of Medicine, Winston-Salem, North Carolina, United States of America; Department of Medicine, Duke University, Durham, North Carolina, United States of America; Internal Medicine-Gerontology, Wake Forest School of Medicine, Winston-Salem, North Carolina, United States of America; Department of Radiation Oncology and Brain Tumor Center of Excellence, Wake Forest School of Medicine, Winston-Salem, North Carolina, United States of America; Department of Otolaryngology, Wake Forest School of Medicine, Winston-Salem, North Carolina, United States of America","Conceived and designed the experiments: DCF XF. Performed the experiments: DCF XF KHX TZ CL JQ. Analyzed the data: XF KHX TZ JQ. Contributed reagents/materials/analysis tools: WLZ OD. Wrote the paper: DCF XF PEM.","The authors have declared that no competing interests exist."
"10.1371/journal.pone.0064668","plos one","2013-05-31T00:00:00Z","Adam L Cronin","United Graduate School of Agricultural Sciences, Iwate University, Morioka, Iwate, Japan","Conceived and designed the experiments: ALC. Performed the experiments: ALC. Analyzed the data: ALC. Contributed reagents/materials/analysis tools: ALC. Wrote the paper: ALC.","The author has declared that no competing interests exist."
"10.1371/journal.pone.0110542","plos one","2014-10-16T00:00:00Z","Shun-Yao Ko; Hshin-An Ko; Tzong-Ming Shieh; Weng-Cheng Chang; Hong-I Chen; Shu-Shing Chang; I-Hsuan Lin","Graduate Institute of Medical Science, College of Health Science, Chang Jung Christian University, Tainan, Taiwan; Innovate Research Center of Medicine, Chang Jung Christian University, Tainan, Taiwan; Department of Dental Hygiene, China Medical University, Taichung, Taiwan","Conceived and designed the experiments: SYK. Performed the experiments: HAK SSC IHL. Analyzed the data: SYK HAK. Contributed reagents/materials/analysis tools: SYK TMS WCC HIC. Wrote the paper: SYK.","The authors have declared that no competing interests exist."
