"id","journal","publication_date","author","author_affiliate","author_notes","competing_interest"
"10.1371/journal.pone.0114478","plos one","2014-12-03T00:00:00Z","Fabrice Crivello; Nathalie Tzourio-Mazoyer; Christophe Tzourio; Bernard Mazoyer","Université de Bordeaux, GIN, UMR 5296, Bordeaux, France; CNRS, GIN, UMR 5296, Bordeaux, France; CEA, GIN, UMR 5296, Bordeaux, France; INSERM, U708, Victor Segalen University, Bordeaux, France","Conceived and designed the experiments: FC NTM CT BM. Performed the experiments: FC NTM CT BM. Analyzed the data: FC NTM CT BM. Contributed reagents/materials/analysis tools: FC NTM CT BM. Wrote the paper: FC NTM CT BM.","The Three-City Study is conducted under a partnership agreement between the Institut National de la Santé et de la Recherche Médicale (INSERM), the Victor Segalen-Bordeaux II University, and Sanofi-Aventis. There are no patents, products in development or marketed products to declare. This does not alter the authors' adherence to all the PLOS ONE policies on sharing data and materials, as detailed online in the guide for authors."
"10.1371/journal.pone.0069238","plos one","2013-07-24T00:00:00Z","Surabhi S Liyanage; Bayzidur Rahman; Iman Ridda; Anthony T Newall; Sepehr N Tabrizi; Suzanne M Garland; Eva Segelov; Holly Seale; Philip J Crowe; Aye Moa; C Raina MacIntyre","School of Public Health and Community Medicine, UNSW Medicine, University of New South Wales, Sydney, Australia; Department of Microbiology and Infectious Diseases, The Royal Women’s Hospital, Melbourne, Australia; Department of Medicine, St. Vincent’s Hospital Clinical School, University of New South Wales, Sydney, Australia; Department of Surgery, Prince of Wales Hospital Clinical School, University of New South Wales, Sydney, Australia","Conceived and designed the experiments: CRM BR ATN SL. Performed the experiments: BR SL. Analyzed the data: BR SL. Contributed reagents/materials/analysis tools: SL BR IR ATN SNT. Wrote the paper: SL CRM BR ATN ST SMG HS. Critical review and comments: BR IR ATN SNT SMG ES HS PJC AM CRM. Design of consrt diagram: AM. Editing of manuscript: AM SL.","ATN holds an NHMRC Training Fellowship (630724 - Australian Based Public Health Fellowship) and has previously received research funding for other projects from a manufacturer of HPV vaccine. HS currently holds a National Health and Medical Research Council (NHMRC) Training Fellowship (1012631) - Australian Based Public Health Fellowship). SG has received advisory board fees and grants support from CSL and GlaxoSmithKline, and lecture fees from Merck, GSK and Sanofi Pasteur; in addition, she has also received funding through her institution to conduct HPV vaccine studies for MSD and GSK. She is a member of the Merck Global Advisory Board as well as the Merck Scientific Advisory Committee for HPV. CRM has been on advisory boards for Merck, GSK and Pfizer for vaccines other than HPV. She has received funding for investigator-driven research on HPV vaccine from Merck. She has received funding for investigator driven research for other vaccines from GSK, CSL Biotherapies and Pfizer. The other authors have no competing interests to declare. This does not alter the authors’ adherence to all the PLOS ONE policies on sharing data and materials."
"10.1371/journal.pone.0138430","plos one","2015-10-07T00:00:00Z","Gerald Carter; Lauren Leffer","Department of Biology, University of Maryland, College Park, Maryland, United States of America","Conceived and designed the experiments: GC. Performed the experiments: GC LL. Analyzed the data: GC. Contributed reagents/materials/analysis tools: GC. Wrote the paper: GC LL.","The authors have declared that no competing interests exist."
"10.1371/journal.pone.0046341","none","2012-09-28T00:00:00Z","Elizabeth M Harper; Melody S Clark; Joseph I Hoffman; Eva E R Philipp; Lloyd S Peck; Simon A Morley","Department of Earth Sciences, University of Cambridge, Cambridge, United Kingdom; British Antarctic Survey, Natural Environment Research Council, Cambridge, United Kingdom; Department of Zoology, University of Cambridge, Cambridge, United Kingdom; Institute of Clinical Molecular Biology, Christian-Albrechts University, Kiel, Germany","Conceived and designed the experiments: EMH MSC JIH LSP SAM. Performed the experiments: EMH MSC JIH SAM. Analyzed the data: EMH MSC JIH LSP SAM . Contributed reagents/materials/analysis tools: MSC JIH EERPLSP . Wrote the paper: EMH MSC JIH LSP SAM .","The authors have declared that no competing interests exist."
"10.1371/journal.pone.0148842","plos one","2016-03-08T00:00:00Z","Katrina E Amaral; Michael Palace; Kathleen M O’Brien; Lindsey E Fenderson; Adrienne I Kovach","Department of Natural Resources and the Environment, University of New Hampshire, Durham, New Hampshire, United States of America; Institute for the Study of Earth, Oceans, and Space, University of New Hampshire, Durham, New Hampshire, United States of America; United States Fish and Wildlife Service, Rachel Carson National Wildlife Refuge, Wells, Maine, United States of America; United States Fish and Wildlife Service, Northeast Fishery Center, Conservation Genetics Lab, Lamar, Pennsylvania, United States of America","Conceived and designed the experiments: AIK KEA KMO MP LEF. Performed the experiments: KEA. Analyzed the data: KEA LEF. Contributed reagents/materials/analysis tools: AIK MP KMO. Wrote the paper: KEA AIK KMO LEF MP.","The authors have declared that no competing interests exist."
"10.1371/journal.pone.0091829","plos one","2014-03-14T00:00:00Z","Ying Feng; Zheng Wang; Zhaoshi Bao; Wei Yan; Gan You; Yinyan Wang; Huimin Hu; Wei Zhang; Quangeng Zhang; Tao Jiang","Department of Immunology, Institute of Basic Medical Sciences, Capital Medical University, Beijing, China; Department of Neurosurgery, Beijing Tiantan Hospital, Capital Medical University, Beijing, China; Beijing Neurosurgical Institute, Beijing, China","Conceived and designed the experiments: WZ TJ. Performed the experiments: YF ZW. Analyzed the data: ZB WY GY. Contributed reagents/materials/analysis tools: YW QZ HH. Wrote the paper: YF ZW.","The authors have declared that no competing interests exist."
"10.1371/journal.pone.0046340","none","2012-09-25T00:00:00Z","Sachi Jain; Seo Yeon Yoon; Lei Zhu; Jens Brodbeck; Jessica Dai; David Walker; Yadong Huang","Gladstone Institute of Neurological Disease, San Francisco, California, United States of America; Gladstone Institute of Cardiovascular Disease, San Francisco, California, United States of America; Biomedical Sciences Graduate Program, University of California San Francisco, San Francisco, California, United States of America; Department of Neurology, University of California San Francisco, San Francisco, California, United States of America; Department of Pathology, University of California San Francisco, San Francisco, California, United States of America","Conceived and designed the experiments: SJ YH. Performed the experiments: SJ SYY LZ JB JD DW YH. Analyzed the data: SJ LZ JD DW YH. Wrote the paper: SJ LZ YH.","The authors have declared that no competing interests exist."
"10.1371/journal.pone.0000713","plos one","2007-08-08T00:00:00Z","Patrick Hossler; Bhanu Chandra Mulukutla; Wei-Shou Hu","Department of Chemical Engineering and Materials Science, University of Minnesota, Minneapolis, Minnesota, United States of America","Conceived and designed the experiments: WH PH. Performed the experiments: PH BM. Analyzed the data: WH PH BM. Contributed reagents/materials/analysis tools: PH. Wrote the paper: WH PH.","The authors have declared that no competing interests exist."
"10.1371/journal.pone.0102959","plos one","2014-07-23T00:00:00Z","Ladd M Irvine; Bruce R Mate; Martha H Winsor; Daniel M Palacios; Steven J Bograd; Daniel P Costa; Helen Bailey","Marine Mammal Institute, Department of Fisheries and Wildlife, and Coastal Oregon Marine Experiment Station, Oregon State University, Hatfield Marine Science Center, Newport, Oregon, United States of America; Cooperative Institute for Marine Ecosystems and Climate, Institute of Marine Sciences, Division of Physical and Biological Sciences, University of California Santa Cruz, Santa Cruz, California, United States of America; NOAA/NMFS/SWFSC/Environmental Research Division, Pacific Grove, California, United States of America; Ecology and Evolutionary Biology, Long Marine Laboratory, University of California Santa Cruz, Santa Cruz, California, United States of America; Chesapeake Biological Laboratory, University of Maryland Center for Environmental Science, Solomons, Maryland, United States of America","Conceived and designed the experiments: LI BM. Performed the experiments: LI BM MW. Analyzed the data: LI HB DP. Contributed reagents/materials/analysis tools: HB. Wrote the paper: LI BM MW DP SB DC HB.","Steven Bograd is currently an editor for this journal and is an author on this paper. This does not alter the authors’ adherence to PLOS ONE Editorial policies and criteria."
"10.1371/journal.pone.0012860","plos one","2010-09-20T00:00:00Z","Yulong Liang; Hong Gao; Shiaw-Yih Lin; John A Goss; Francis C Brunicardi; Kaiyi Li","The Michael E. DeBakey Department of Surgery, Baylor College of Medicine, Houston, Texas, United States of America; Department of Systems Biology, M.D. Anderson Cancer Center, Houston, Texas, United States of America","Conceived and designed the experiments: SYL KL. Performed the experiments: YL HG KL. Analyzed the data: YL SYL KL. Contributed reagents/materials/analysis tools: JAG FCB. Wrote the paper: YL KL.","The authors have declared that no competing interests exist."
"10.1371/journal.pone.0000714","plos one","2007-08-08T00:00:00Z","Yale J Passamaneck; Anna-Katerina Hadjantonakis; Anna Di Gregorio","Department of Cell and Developmental Biology, Weill Medical College of Cornell University, New York, New York, United States of America; Developmental Biology Program, Sloan-Kettering Institute, New York, New York, United States of America","Conceived and designed the experiments: AD YP AH. Performed the experiments: YP. Analyzed the data: AD YP AH. Contributed reagents/materials/analysis tools: AD YP AH. Wrote the paper: AD YP AH.","The authors have declared that no competing interests exist."
"10.1371/journal.pone.0091830","plos one","2014-03-12T00:00:00Z","Xiankun Chen; Brian May; Yuan Ming Di; Anthony Lin Zhang; Chuanjian Lu; Charlie Changli Xue; Lin Lin","Evidence-Based Medicine & Clinical Research Service Group, Guangdong Provincial Academy of Chinese Medical Sciences, Guangzhou, China; Guangdong Provincial Hospital of Chinese Medicine, Guangzhou, China; Traditional & Complementary Medicine Research Program, Health Innovations Research Institute, School of Health Sciences, RMIT University, Melbourne, Australia; Guangdong Provincial Academy of Chinese Medical Sciences, Guangzhou, China; Department of Respiratory Medicine, Guangdong Provincial Hospital of Chinese Medicine, Guangzhou, Guangdong Province, China","Conceived and designed the experiments: XC. Performed the experiments: XC BM YD. Analyzed the data: XC BM YD. Wrote the paper: XC BM YD AZ CL CX LL. Reviewed the final manuscript: XC BM YD AZ CL CX LL. Approved the final manuscript: XC BM YD AZ CL CX LL.","The authors have declared that no competing interests exist."
"10.1371/journal.pone.0080603","plos one","2013-11-06T00:00:00Z","Pradeep Kumar Papolu; Nagavara Prasad Gantasala; Divya Kamaraju; Prakash Banakar; Rohini Sreevathsa; Uma Rao","Division of Nematology, Indian Agricultural Research Institute, New Delhi, India; National Research Centre on Plant Biotechnology, Indian Agricultural Research Institute, New Delhi, India","Conceived and designed the experiments: UR. Performed the experiments: PKP NPG DK PB. Analyzed the data: NPG PB. Wrote the manuscript: UR RS NPG.","The authors have declared that no competing interests exist."
"10.1371/journal.pone.0127212","plos one","2015-06-19T00:00:00Z","Jenny A Herbert; Andrea M Mitchell; Timothy J Mitchell","Institute of Microbiology and Infection, School of Immunity and Infection, University of Birmingham, Birmingham, England, United Kingdom","Conceived and designed the experiments: TJM AMM JAH. Performed the experiments: JAH. Analyzed the data: TJM AMM JAH. Wrote the paper: TJM AMM JAH.","The authors have declared that no competing interests exist."
"10.1371/journal.pone.0114477","plos one","2014-12-02T00:00:00Z","Juerg Schulze; Tina Frauenknecht; Peter Brodmann; Claudia Bagutti","State Laboratory Basel-City, Biosafety Laboratory, Basel, Switzerland","Conceived and designed the experiments: PB CB TF JS. Performed the experiments: TF JS. Analyzed the data: JS TF. Contributed reagents/materials/analysis tools: PB CB TF JS. Wrote the paper: JS TF PB CB.","The authors have declared that no competing interests exist."
"10.1371/journal.pone.0138429","plos one","2015-09-16T00:00:00Z","Shaneda Warren Andersen; Xiao-Ou Shu; Yu-Tang Gao; Xianglan Zhang; Hui Cai; Gong Yang; Hong-Lan Li; Yong-Bing Xiang; Wei Zheng","Division of Epidemiology, Department of Medicine, Vanderbilt Epidemiology Center, Vanderbilt-Ingram Cancer Center, Vanderbilt University School of Medicine, Nashville, Tennessee, United States of America; Department of Epidemiology, Shanghai Cancer Institute, Renji Hospital, Shanghai Jiaotong University School of Medicine, Shanghai, China","Conceived and designed the experiments: SWA WZ. Analyzed the data: SWA. Wrote the paper: SWA X-OS XZ WZ. Obtained funding, and conceived of, organized, and supervised the parent studies: WZ X-OS. Organized the field work and data collection for the parent studies: YTG HLL YBX. Involved with study implementation and data collection: GY. Managed the data and contributed to statistical analysis: HC.","The authors have declared that no competing interests exist."
"10.1371/journal.pone.0102966","plos one","2014-07-18T00:00:00Z","Gabriella M Anic; Stephanie J Weinstein; Alison M Mondul; Satu Männistö; Demetrius Albanes","Cancer Prevention Fellowship Program, Division of Cancer Prevention, National Cancer Institute, National Institutes of Health, Bethesda, Maryland, United States of America; Nutritional Epidemiology Branch, Division of Cancer Epidemiology and Genetics, National Cancer Institute, National Institutes of Health, Bethesda, Maryland, United States of America; Department of Chronic Disease Prevention, National Institute for Health and Welfare, Helsinki, Finland","Conceived and designed the experiments: SJW AMM SM DA. Performed the experiments: SJW AMM DA SM. Analyzed the data: GMA DA. Contributed reagents/materials/analysis tools: SJW DA AMM SM GMA. Contributed to the writing of the manuscript: GMA DA SJW AMM SM. Reviewed and revised the manuscript: GMA SJW AMM SM DA. Final approval of the manuscript: GMA SJW AMM SM DA.","The authors have declared that no competing interests exist."
"10.1371/journal.pone.0000718","plos one","2007-08-08T00:00:00Z","Debbie Winter; Ben Vinegar; Hardeep Nahal; Ron Ammar; Greg V Wilson; Nicholas J Provart","Department of Cell and Systems Biology, University of Toronto, Toronto, Ontario, Canada; Department of Computer Science, University of Toronto, Toronto, Ontario, Canada","Conceived and designed the experiments: NP. Performed the experiments: NP DW BV RA. Analyzed the data: NP DW BV HN. Contributed reagents/materials/analysis tools: NP DW BV HN RA GW. Wrote the paper: NP DW BV.","The authors have declared that no competing interests exist."
"10.1371/journal.pone.0138433","plos one","2015-09-22T00:00:00Z","Derek D Houston; R Paul Evans; Dennis K Shiozawa","Department of Biology, Brigham Young University, Provo, Utah, United States of America; Department of Microbiology and Molecular Biology, Brigham Young University, Provo, Utah, United States of America","Conceived and designed the experiments: DDH RPE DKS. Performed the experiments: DDH. Analyzed the data: DDH. Contributed reagents/materials/analysis tools: RPE DKS. Wrote the paper: DDH RPE DKS.","The authors have declared that no competing interests exist."
"10.1371/journal.pone.0127214","plos one","2015-05-18T00:00:00Z","Amy Sebeson; Liqun Xi; Quanwei Zhang; Audrey Sigmund; Ji-Ping Wang; Jonathan Widom; Xiaozhong Wang","Department of Molecular Biosciences, Northwestern University, Evanston, Illinois, United States of America; Department of Statistics, Northwestern University, Evanston, Illinois, United States of America","Conceived and designed the experiments: A. Sebeson JW J-PW XW. Performed the experiments: A. Sebeson A. Sigmund. Analyzed the data: A. Sebeson LX QZ A. Sigmund J-PW XW. Contributed reagents/materials/analysis tools: QZ LX J-PW. Wrote the paper: A. Sebeson J-PW XW.","The authors have declared that no competing interests exist."
"10.1371/journal.pone.0091831","plos one","2014-03-14T00:00:00Z","Gulrez Shah Azhar; Dileep Mavalankar; Amruta Nori-Sarma; Ajit Rajiva; Priya Dutta; Anjali Jaiswal; Perry Sheffield; Kim Knowlton; Jeremy J Hess; on behalf of the Ahmedabad HeatClimate Study Group","Indian Institute of Public Health, Ahmedabad, Gujarat, India; Public Health Foundation of India, New Delhi, India; Columbia Mailman School of Public Health, New York, New York, United States of America; Natural Resources Defense Council, New York, New York, United States of America; Icahn School of Medicine at Mount Sinai, New York, New York, United States of America; Department of Emergency Medicine, Emory University School of Medicine, Atlanta, Georgia, United States of America; Department of Environmental Health, Emory University School of Public Health, Atlanta, Georgia, United States of America","¶ Membership of the Ahmedabad Heat and Climate Study Group is provided in the Acknowledgments","The authors have declared that no competing interests exist."
"10.1371/journal.pone.0102963","plos one","2014-09-26T00:00:00Z","Xiaoqing Tang; Yunhua Xiao; Tingting Lv; Fangquan Wang; QianHao Zhu; Tianqing Zheng; Jie Yang","College of Horticulture, Nanjing Agricultural University, Nanjing, The People’s Republic of China; Institute of Food Crops, Jiangsu Academy of Agricultural Sciences, Nanjing, The People’s Republic of China; CSIRO Plant Industry, Canberra, Australia; Institute of Crop Sciences, Chinese Academy of Agricultural Sciences, Beijing, The People’s Republic of China","Conceived and designed the experiments: XQT JY. Performed the experiments: YHX TTL FQW. Analyzed the data: XQT TQZH. Contributed reagents/materials/analysis tools: XQT YHX. Wrote the paper: XQT QHZH.","The authors have declared that no competing interests exist."
"10.1371/journal.pone.0012859","plos one","2010-09-20T00:00:00Z","Paola Krall; Cesar P Canales; Pamela Kairath; Paulina Carmona-Mora; Jessica Molina; J Daniel Carpio; Phillip Ruiz; Sergio A Mezzano; Jing Li; Changli Wei; Jochen Reiser; Juan I Young; Katherina Walz","Centro de Estudios Científicos (CECS), Valdivia, Chile; Universidad Austral de Chile, Valdivia, Chile; John P. Hussman Institute for Human Genomics, University of Miami, Miami, Florida, United States of America; Institute of Anatomy, Histology and Pathology, School of Medicine, Universidad Austral, Valdivia, Chile; Nephrology Laboratory, School of Medicine, Universidad Austral, Valdivia, Chile; Department of Pathology, Leonard Miller School of Medicine, University of Miami, Miami, Florida, United States of America; Division of Nephrology and Hypertension, Leonard Miller School of Medicine, University of Miami, Miami, Florida, United States of America; CIN (Centro de Ingeniería de la Innovación CECS), Valdivia, Chile","Conceived and designed the experiments: PK CPC KW. Performed the experiments: PK CPC PK PCM JM JL CW. Analyzed the data: PK CPC PCM JDC PR SM CW JR JIY KW. Contributed reagents/materials/analysis tools: JR JIY KW. Wrote the paper: PK CPC JR KW.","The authors received funding from Antofagasta Minerals, Arauco, Empresas CMPC, Indura, Naviera Ultragas and Telefonica del Sur, but it does not alter their adherence to PLoS ONE policies."
"10.1371/journal.pone.0012857","plos one","2010-09-30T00:00:00Z","Rebecca H Chisholm; Barry D Hughes; Kerry A Landman","Department of Mathematics and Statistics, University of Melbourne, Victoria, Australia","Conceived and designed the experiments: RHC BDH KAL. Performed the experiments: RHC. Analyzed the data: RHC KAL. Contributed reagents/materials/analysis tools: RHC BDH KAL. Wrote the paper: RHC BDH KAL. Supervised and managed the research: KAL. Co-supervised the research: BDH.","The authors have declared that no competing interests exist."
"10.1371/journal.pone.0114476","plos one","2014-12-05T00:00:00Z","Stine Indrelid; Geir Mathiesen; Morten Jacobsen; Tor Lea; Charlotte R Kleiveland","Østfold Hospital Trust, Fredrikstad, Norway; Department of Chemistry, Biotechnology and Food Science, Norwegian University of Life Sciences, Aas, Norway; Department of Gastrointestinal and Children Surgery, Institute of Clinical Medicine, University of Oslo, Oslo, Norway","Conceived and designed the experiments: SI GM TL MJ CRK. Performed the experiments: SI. Analyzed the data: SI GM. Contributed reagents/materials/analysis tools: MJ TL CRK. Wrote the paper: SI GM MJ TL CRK.","The authors have declared that no competing interests exist."
"10.1371/journal.pone.0138428","plos one","2015-09-25T00:00:00Z","Jeanne Dekerle; Kristopher Mendes de Souza; Ricardo Dantas de Lucas; Luiz Guilherme Antonacci Guglielmo; Camila Coelho Greco; Benedito Sérgio Denadai","Centre for Sport and Exercise Science and Medicine, University of Brighton, Eastbourne, United Kingdom; Physical Effort Laboratory, Sports Center, Federal University of Santa Catarina, Florianópolis, Brazil; UNESP, Human Performance Laboratory, Rio Claro, Brazil","Conceived and designed the experiments: JD CCG BSD. Performed the experiments: JD KMdS RDdL LGAG CCG BSD. Analyzed the data: KMdS RDdL LGAG CCG BSD. Contributed reagents/materials/analysis tools: JD KMdS RDdL LGAG CCG BSD. Wrote the paper: JD CCG BSD.","The authors have declared that no competing interests exist."
"10.1371/journal.pone.0069236","plos one","2013-07-16T00:00:00Z","Patricia Landraud; Sarah Chuzeville; Geneviève Billon-Grande; Nathalie Poussereau; Christophe Bruel","UMR 5240 - Microbiologie, Adaptation et Pathogénie; Université Lyon 1, CNRS, Bayer CropScience, Villeurbanne, France","Conceived and designed the experiments: PL GBG CB. Performed the experiments: PL SC GBG. Analyzed the data: PL GBG CB. Wrote the paper: PL NP CB.","Part of the experiments were funded by Bayer CropScience. The authors are affiliated to UMR 5240 Microbiologie, Adaptation et Pathogénie; Université Lyon 1, CNRS, Bayer CropScience, Villeurbanne. There are no patents, products in development or marketed products to declare. This does not alter the authors’ adherence to all the PLOS ONE policies on sharing data and materials."
"10.1371/journal.pone.0091826","plos one","2014-03-14T00:00:00Z","Caihong Wang; Xiaojiao Liu; Suotang Peng; Qun Xu; Xiaoping Yuan; Yue Feng; Hanyong Yu; Yiping Wang; Xinghua Wei","State Key Laboratory of Rice Biology, China National Rice Research Institute, Hangzhou, China; College of Agricultural Sciences, Shanxi Agricultural University, Taigu, China","Conceived and designed the experiments: CW XL XW. Performed the experiments: CW XL. Analyzed the data: CW XL XW. Contributed reagents/materials/analysis tools: SP QX XY YF HY YW. Wrote the paper: CW XW.","The authors have declared that no competing interests exist."
"10.1371/journal.pone.0138427","plos one","2015-09-17T00:00:00Z","Nadine Shehata; Alan J Forster; Nadine Lawrence; Robin Ducharme; Dean A Fergusson; Michaël Chassé; Deanna M Rothwell; Paul C Hébert; Alan T Tinmouth; Kumanan Wilson","Department of Medicine, Mount Sinai Hospital, University of Toronto, Toronto, Canada; Department of Pathology and Laboratory Medicine, Mount Sinai Hospital, University of Toronto, Toronto, Canada; Li Ka Shing Knowledge Institute, St. Michael’s Hospital, Toronto, Canada; Central Ontario Region, Canadian Blood Services, Toronto, Canada; Clinical Epidemiology Program, Ottawa Hospital Research Institute, Ottawa, Canada; Institute for Clinical Evaluative Sciences, Ottawa, Canada; Department of Medicine, University of Ottawa, Ottawa, Canada; Department of Epidemiology and Community Medicine, University of Ottawa, Ottawa, Canada; Department of Surgery, University of Ottawa, Ottawa, Canada; Department of Medicine, University of Montreal, Montreal, Canada","Conceived and designed the experiments: NS KW. Analyzed the data: NL. Wrote the paper: NS RD MC DMR KW. Interpretation of data: NS AJF NL RD DAF MC DMR PCH ATT KW. Revising the manuscript for important intellectual content: NS AJF NL RD DAF MC DMR PCH ATT KW.","The authors have declared that no competing interest exist."
"10.1371/journal.pone.0148841","plos one","2016-02-17T00:00:00Z","Geraldina F Gaastra; Yvonne Groen; Lara Tucha; Oliver Tucha","Department of Clinical and Developmental Neuropsychology, University of Groningen, Groningen, The Netherlands","Conceived and designed the experiments: YG LT OT. Performed the experiments: GFG YG LT OT. Analyzed the data: GFG YG. Contributed reagents/materials/analysis tools: OT. Wrote the paper: GFG YG LT OT.","The authors have declared that no competing interests exist."
"10.1371/journal.pone.0091827","plos one","2014-03-13T00:00:00Z","Jiacong You; Yang Li; Nianzhen Fang; Bin Liu; Lingling Zu; Rui Chang; Xuebing Li; Qinghua Zhou","Tianjin Key Laboratory of Lung Cancer Metastasis and Tumor Microenvironment, Tianjin Lung Cancer Institute, Tianjin Medical University General Hospital, Tianjin, China","Conceived and designed the experiments: JY. Performed the experiments: JY YL NF BL. Analyzed the data: JY LZ RC XL. Contributed reagents/materials/analysis tools: QZ. Wrote the paper: JY.","The authors have declared that no competing interests exist."
