"id","journal","publication_date","author","author_affiliate","author_notes","competing_interest"
"10.1371/journal.pone.0063863","plos one","2013-05-13T00:00:00Z","Ali Reza Kasmati; Mats Töpel; Nadir Zaman Khan; Ramesh Patel; Qihua Ling; Sazzad Karim; Henrik Aronsson; Paul Jarvis","University of Leicester, Department of Biology, Leicester, United Kingdom; University of Gothenburg, Department of Biological and Environmental Sciences, Gothenburg, Sweden","Conceived and designed the experiments: PJ MT HA. Performed the experiments: ARK MT NZK RP QL SK. Analyzed the data: ARK MT NZK RP QL SK HA PJ. Wrote the paper: PJ MT ARK HA. Required Statement: PJ.","The authors have declared that no competing interests exist."
"10.1371/journal.pone.0098136","plos one","2014-05-19T00:00:00Z","Yoon-Ju Kim; Hyung-Ju Cho; Woo-Chul Shin; Hyun-Ah Song; Joo-Heon Yoon; Chang-Hoon Kim","Department of Otorhinolaryngology, Yonsei University College of Medicine, Seoul, Korea; The Airway Mucus Institute, Yonsei University College of Medicine, Seoul, Korea; BK 21 Project for Medical Science, Yonsei University College of Medicine, Seoul, Korea; Research Center for Human Natural Defense System, Yonsei University College of Medicine, Seoul, Korea; Hana ENT Hospital, Seoul, Korea","Conceived and designed the experiments: YJK WCS HAS JHY CHK. Performed the experiments: YJK HAS. Analyzed the data: YJK HJC CHK. Contributed reagents/materials/analysis tools: YJK WCS HAS. Wrote the paper: YJK HJC.","The authors have declared that no competing interests exist."
"10.1371/journal.pone.0098137","plos one","2014-07-18T00:00:00Z","Yanxia Fu; Hailing Zhou; Shuangyan Wang; Qun Wei","Department of Biochemistry and Molecular Biology, Beijing Normal University, Gene Engineering and Biotechnology Beijing Key Laboratory, Beijing, P. R. of China","Conceived and designed the experiments: YF QW. Performed the experiments: YF HZ. Analyzed the data: HZ YF. Contributed reagents/materials/analysis tools: SW HZ YF. Wrote the paper: YF QW.","The authors have declared that no competing interests exist."
"10.1371/journal.pone.0075341","plos one","2013-10-04T00:00:00Z","Kiriaki Pavlidou; Ioannis Savvas; Yves P S Moens; Dimitrios Vasilakos; Dimitrios Raptopoulos","Anaesthesiology and Intensive Care Unit, Companion Animal Clinic, Faculty of Veterinary Medicine, Aristotle University of Thessaloniki, Thessaloniki, Greece; Anaesthesiology and Perioperative Intensive Care, Veterinary University, Vienna, Austria; Anaesthesiology and ICU Department, AHEPA University Hospital, Thessaloniki, Greece","Conceived and designed the experiments: KP IS YM DR. Performed the experiments: KP. Analyzed the data: IS. Wrote the paper: KP IS YM DV DR. Read and approved the final manuscript: KP IS YM DV DR.","The authors have declared that no competing interests exist."
"10.1371/journal.pone.0086758","plos one","2014-01-30T00:00:00Z","Merete Osler; Solvej Mårtensson; Eva Prescott; Kathrine Carlsen","Research Center for Prevention and Health, Glostrup Hospital, Glostrup, Denmark; Department of Cardiology Y, Bispebjerg Hospital, Copenhagen, Denmark; Institute of Public Health, University of Copenhagen, Copenhagen, Denmark","Conceived and designed the experiments: MO. Performed the experiments: MO SM KC. Analyzed the data: MO. Contributed reagents/materials/analysis tools: MO SM KC. Wrote the paper: MO. Interpretation of data: MO SM EP KC. Revised the manuscript critically: MO.","The authors have declared that no competing interests exist."
"10.1371/journal.pone.0109743","plos one","2014-10-14T00:00:00Z","Xun Liu; Xiaoliang Gan; Jinxia Chen; Linsheng Lv; Ming Li; Tanqi Lou","Division of Nephrology, Department of Internal Medicine, The Third Affiliated Hospital of Sun Yat-sen University, Guangzhou, China; Department of Anesthesiology, Zhongshan Ophthalmic Center, Sun Yat-sen University, Guangzhou, China; Operating Room, The Third Affiliated Hospital of Sun Yat-sen University, Guangzhou, China","Conceived and designed the experiments: XL TQL. Performed the experiments: XL JXC LSL ML. Analyzed the data: XL JXC XLG LSL. Contributed reagents/materials/analysis tools: XL XLG. Wrote the paper: XL XLG.","The authors have declared that no competing interests exist."
"10.1371/journal.pone.0121186","plos one","2015-03-25T00:00:00Z","K V Shanavas; David J Singh","Oak Ridge National Laboratory, 1 Bethel Valley Road, Oak Ridge, Tennessee 37831, USA","Conceived and designed the experiments: KVS DJS. Performed the experiments: KVS DJS. Analyzed the data: KVS DJS. Wrote the paper: KVS DJS.","The authors have declared that no competing interests exist."
"10.1371/journal.pone.0040972","plos one","2012-07-19T00:00:00Z","Lynley D Pound; Suparna A Sarkar; Alessandro Ustione; Prasanna K Dadi; Melanie K Shadoan; Catherine E Lee; Jay A Walters; Masakazu Shiota; Owen P McGuinness; David A Jacobson; David W Piston; John C Hutton; David R Powell; Richard M O’Brien","Department of Molecular Physiology and Biophysics, Vanderbilt University Medical School, Nashville, Tennessee, United States of America; Lexicon Pharmaceuticals Incorporated, The Woodlands, Texas, United States of America; Barbara Davis Center for Childhood Diabetes, University of Colorado Health Sciences Center, Aurora, Colorado, United States of America","Conceived and designed the experiments: LDP SAS AU MS OPM DAJ DWP JCH DRP RO. Performed the experiments: LDP SAS AU PKD MKS CEL JAW MS DAJ RO. Analyzed the data: LDP SAS AU MS OPM DAJ DWP JCH DRP RO. Contributed reagents/materials/analysis tools: MKS JAW DRP. Wrote the paper: LDP SAS AU OPM DAJ DWP JCH DRP RO.","MKS and DRP work for Lexicon Pharmaceuticals and generated the mice described in this study. There are no pending patents, products in development or marketed products associated with these mice or this study. This relationship between Lexicon and Vanderbilt does not alter the authors’ adherence to all the PLoS ONE policies on sharing data and materials."
"10.1371/journal.pone.0052395","plos one","2012-12-21T00:00:00Z","Vinko Bandelj; Cosimo Solidoro; Daniele Curiel; Gianpiero Cossarini; Donata Melaku Canu; Andrea Rismondo","OGS, Istituto Nazionale di Oceanografia e di Geofisica Sperimentale, Sgonico, Italy; SELC, Venezia, Italy","Conceived and designed the experiments: VB CS DC AR. Performed the experiments: VB DC GC DMC AR CS. Analyzed the data: VB CS. Wrote the paper: VB CS. Elaborated water quality data: GC. Performed hydrodynamical simulations and elaborated hydrodynamical data: DMC. Contributed to discussion: VB DC GC DMC AR CS.","The authors have declared that no competing interests exist."
"10.1371/journal.pone.0040941","none","2012-08-10T00:00:00Z","Matthew D Castle; Christopher A Gilligan","Department of Plant Sciences, University of Cambridge, Cambridge, United Kingdom","Conceived and designed the experiments: MDC. Performed the experiments: MDC. Analyzed the data: MDC. Wrote the paper: MDC CAG.","The authors have declared that no competing interests exist."
"10.1371/journal.pone.0063836","plos one","2013-05-23T00:00:00Z","Jean-François Arrighi; Fabienne Cartieaux; Clémence Chaintreuil; Spencer Brown; Marc Boursot; Eric Giraud","IRD, Laboratoire des Symbioses Tropicales et Méditerranéennes, UMR IRD/SupAgro/INRA/UM2/CIRAD, Campus International de Baillarguet, Montpellier, France; Centre national de la recherche scientifique, IBiSA Imagerie Gif et Imagif BioCell, Institut des Sciences du Végétal, UPR 2355, Gif-sur-Yvette, France","Conceived and designed the experiments: JFA. Performed the experiments: JFA CC SB. Analyzed the data: JFA. Contributed reagents/materials/analysis tools: FC MB. Wrote the paper: JFA EG.","The authors have declared that no competing interests exist."
"10.1371/journal.pone.0075316","plos one","2013-09-24T00:00:00Z","Fanny Leroy; Tarik Meziane; Pascal Riera; Thierry Comtet","UPMC Univ Paris 06, UMR 7144, Station Biologique, Roscoff, France; CNRS, UMR 7144, Station Biologique, Roscoff, France; Muséum National d’Histoire Naturelle, UMR BOREA 7208, Committee for Programme and Coordination 53, Paris, France","Conceived and designed the experiments: FL TM PR TC. Analyzed the data: FL TM PR TC. Wrote the manuscript: FL TM PR TC.","The authors have declared that no competing interests exist."
"10.1371/journal.pone.0029513","plos one","2011-12-29T00:00:00Z","Eugenia Villa-Cuesta; Joan M Boylan; Marc Tatar; Philip A Gruppuso","Department of Ecology and Evolutionary Biology, Brown University, Providence, Rhode Island, United States of America; Department of Pediatrics, Brown University and Rhode Island Hospital, Providence, Rhode Island, United States of America","Conceived and designed the experiments: EV-C JMB PAG. Performed the experiments: EV-C JMB. Analyzed the data: EV-C PAG. Wrote the paper: EV-C PAG MT.","The authors have declared that no competing interests exist."
"10.1371/journal.pone.0063838","plos one","2013-05-10T00:00:00Z","Sachin Thakur; Neha Garg; Martin L Adamo","Department of Biochemistry, The University of Texas Health Science Center at San Antonio, San Antonio, Texas, United States of America; The Sam and Ann Barshop Institute for Longevity and Aging Studies at The University of Texas Health Science Center at San Antonio, San Antonio, Texas, United States of America","Conceived and designed the experiments: ST MLA. Performed the experiments: ST NG. Analyzed the data: ST MLA. Contributed reagents/materials/analysis tools: ST NG MLA. Wrote the paper: ST MLA.","The authors have declared that no competing interests exist."
"10.1371/journal.pone.0098113","plos one","2014-05-27T00:00:00Z","Beom Seob Lee; Soo Hyuk Kim; Jaewon Oh; Taewon Jin; Eun Young Choi; Sungha Park; Sang-Hak Lee; Ji Hyung Chung; Seok-Min Kang","Graduate Program in Science for Aging, Yonsei University, Seoul, Republic of Korea; Cardiology Division, Severance Cardiovascular Hospital and Cardiovascular Research Institute, Yonsei University College of Medicine, Seoul, Republic of Korea; Severance Integrative Research Institute for Cerebral and Cardiovascular Diseases (SIRIC), Yonsei University Health System, Seoul, Republic of Korea; Department of Applied Bioscience, College of Life Science, CHA University, Gyeonggi-do, Republic of Korea; Brain Korea 21 Project for Medical Science, Yonsei University College of Medicine, Seoul, Republic of Korea","Conceived and designed the experiments: BSL JO JHC SMK. Performed the experiments: BSL. Analyzed the data: BSL SHK JO SP SHL JHC SMK. Contributed reagents/materials/analysis tools: BSL SHK TJ EYC. Wrote the paper: BSL JO JHC SMK.","The authors have declared that no competing interests exist."
"10.1371/journal.pone.0040943","plos one","2012-07-13T00:00:00Z","Zhiwei Liu; Guoling Ren; Chenyan Shangguan; Lijing Guo; Zhixiong Dong; Yueyang Li; Weina Zhang; Li Zhao; Pingfu Hou; Yu Zhang; Xiuli Wang; Jun Lu; Baiqu Huang","The Institute of Genetics and Cytology, Northeast Normal University, Changchun, China; College of Life Sciences, Daqing Normal University, Daqing, Heilongjiang, China; The College of Life Science, Tianjin Normal University, Tianjin, China; The Key Laboratory of Molecular Epigenetics of Ministry of Education, Northeast Normal University, Changchun, China","Conceived and designed the experiments: ZWL GLR JL BQH. Performed the experiments: ZWL GLR CYSG LJG WNZ. Analyzed the data: ZWL GLR ZXD YYL YZ XLW. Contributed reagents/materials/analysis tools: ZWL GLR LZ PFH. Wrote the paper: ZWL BQH. Designed the software used in analysis: ZWL Obtained permission for use of cell line: ZWL GLR JL BQH.","The authors have declared that no competing interests exist."
"10.1371/journal.pone.0075314","plos one","2013-10-08T00:00:00Z","Michel Guillot; Natalia Gavrilova; Liudmila Torgasheva; Mikhail Denisenko","University of Pennsylvania, Philadelphia, Pennsylvania, United States of America; University of Chicago, Chicago, Illinois, United States of America; National Statistical Committee of the Kyrgyz Republic, Bishkek, Kyrgyzstan; National Research University “Higher School of Economics”, Moscow, Russia","Conceived and designed the experiments: MG NG LT MD. Analyzed the data: MG NG. Wrote the manuscript: MG. Supervised the archival data collection in Kyrgyzstan: MD.  Conducted the archival data collection in Kyrgyzstan: LT. Contributed to the interpretation of the results: MG NG MD LT.  Reviewed the manuscript: MG NG MD LT..","The authors have declared that no competing interests exist."
"10.1371/journal.pone.0132639","plos one","2015-07-14T00:00:00Z","Cheng Fu; Dong Chen; Ruijie Chen; Qingsong Hu; Guanghui Wang","Laboratory of Molecular Neuropathology, Key Laboratory of Brain Function and Diseases and School of Life Sciences, University of Science and Technology of China, Chinese Academy of Sciences. Hefei, Anhui, China; Laboratory of Molecular Neuropathology, Jiangsu Key Laboratory of Translational Research and Therapy for Neuro-Psycho-Diseases and College of Pharmaceutical Sciences, Soochow University, Suzhou, Jiangsu, China; Department of Clinical Pharmacy and Pharmacology, the Second Affiliated Hospital of Wenzhou Medical University, Wenzhou, Zhejiang, China","Conceived and designed the experiments: CF GW. Performed the experiments: CF DC QH. Analyzed the data: CF RC. Wrote the paper: CF GW.","The authors have declared that no competing interests exist."
"10.1371/journal.pone.0121169","plos one","2015-03-24T00:00:00Z","Sally-Anne Mortlock; Jerry Wei; Peter Williamson","Faculty of Veterinary Science, The University of Sydney, NSW 2006, Australia; Sydney Medical School, The University of Sydney, NSW 2006, Australia","Conceived and designed the experiments: SM PW. Performed the experiments: SM PW. Analyzed the data: SM JW PW. Contributed reagents/materials/analysis tools: SM JW PW. Wrote the paper: SM JW PW.","The authors have declared that no competing interests exist."
"10.1371/journal.pone.0075340","plos one","2013-11-25T00:00:00Z","Denisse Valladares; Gonzalo Almarza; Ariel Contreras; Mario Pavez; Sonja Buvinic; Enrique Jaimovich; Mariana Casas","Centro de Estudios Moleculares de la Célula, Instituto de Ciencias Biomédicas, Facultad de Medicina, Universidad de Chile, Santiago, Chile; Programa de Fisiología y Biofísica, Instituto de Ciencias Biomédicas, Facultad de Medicina, Universidad de Chile, Santiago, Chile; Departamento de Ciencias Básicas y Comunitarias, Facultad de Odontología, Universidad de Chile, Santiago, Chile","Conceived and designed the experiments: DV EJ MC. Performed the experiments: DV GA AC MP SB MC. Analyzed the data: DV SB EJ MC. Wrote the paper: DV EJ MC.","The authors have declared that no competing interests exist."
"10.1371/journal.pone.0109754","plos one","2014-10-07T00:00:00Z","Martin J Bishop; Adam Connolly; Gernot Plank","Department of Biomedical Engineering, Division of Imaging Sciences & Biomedical Engineering, King's College London, London, United Kingdom; Institute of Biophysics, Medical University of Graz, Graz, Austria; Oxford eResearch Centre, University of Oxford, Oxford, United Kingdom","Conceived and designed the experiments: MJB GP. Performed the experiments: MJB. Analyzed the data: MJB AC GP. Contributed reagents/materials/analysis tools: MJB AC GP. Wrote the paper: MJB AC GP.","The authors have declared that no competing interests exist."
"10.1371/journal.pone.0029534","plos one","2012-01-25T00:00:00Z","Li Shao; Xiaohui Fan; Ningtao Cheng; Leihong Wu; Haoshu Xiong; Hong Fang; Don Ding; Leming Shi; Yiyu Cheng; Weida Tong","Pharmaceutical Informatics Institute, College of Pharmaceutical Sciences, Zhejiang University, Hangzhou, China; The Wallace H. Coulter Department of Biomedical Engineering, Georgia Institute of Technology and Emory University, Atlanta, Georgia, United States of America; ICF International at NCTR/FDA, Jefferson, Arkansas, United States of America; National Center for Toxicological Research (NCTR), U. S. Food and Drug Administration, Jefferson, Arkansas, United States of America","Conceived and designed the experiments: XF HF WT YC. Analyzed the data: LS (Li Shao) XF LW HX. Wrote the paper: LS (Li Shao) XF NC HF DD LS (Leming Shi) WT YC.","The authors have declared that no competing interests exist."
"10.1371/journal.pone.0109733","plos one","2014-10-07T00:00:00Z","Yanqiong Liu; Yu He; Taijie Li; Li Xie; Jian Wang; Xue Qin; Shan Li","Department of Clinical Laboratory, First Affiliated Hospital of Guangxi Medical University, Nanning, Guangxi Zhuang Autonomous Region, China","Conceived and designed the experiments: YL YH XQ SL. Performed the experiments: YL LX TL. Analyzed the data: YL YH. Contributed reagents/materials/analysis tools: JW. Contributed to the writing of the manuscript: YL YH.","The authors have declared that no competing interests exist."
"10.1371/journal.pone.0063858","plos one","2013-05-16T00:00:00Z","Di Hu; Guohua Hu; Jing Zhu; Yang Shen; Houyong Kang; Suling Hong","Department of Otorhinolaryngology, the First Affiliated Hospital of Chongqing Medical University, Chongqing, People’s Republic of China","Conceived and designed the experiments: DH GHH SLH. Performed the experiments: DH JZ. Analyzed the data: DH GHH SLH. Contributed reagents/materials/analysis tools: DH GHH SLH JZ HYK YS. Wrote the paper: DH YS GHH SLH.","The authors have declared that no competing interests exist."
"10.1371/journal.pone.0144201","plos one","2015-12-04T00:00:00Z","Rui Zhong; Hua Liu; Hong Wang; Xiaojuan Li; Zeng He; Meiduo Gangla; Jingdan Zhang; Dingding Han; Jiaxin Liu","Institute of Blood Transfusion, Chinese Academy of Medical Sciences and Peking Union Medical College, Chengdu, Sichuan, China; Tibet Autonomous Region blood center, Lhasa, Tibet, China","Conceived and designed the experiments: RZ HW ZH JXL. Performed the experiments: RZ HL ZH JDZ DDH. Analyzed the data: RZ JDZ. Contributed reagents/materials/analysis tools: HL MDGL HW XJL. Wrote the paper: RZ DDH.","The authors have declared that no competing interests exist."
"10.1371/journal.pone.0132659","plos one","2015-07-15T00:00:00Z","Guojing Wang; Yu Sun; Kuo Zhang; Tingting Jia; Mingju Hao; Dong Zhang; Le Chang; Lei Zhang; Rui Zhang; Guigao Lin; Rongxue Peng; Jinming Li","National Center for Clinical Laboratories, Beijing Hospital of National Health and Family Planning Commission, Beijing, People’s Republic of China; Graduate School, Peking Union Medical College, Chinese Academy of Medical Sciences, Beijing, People’s Republic of China; Fifth School of Clinical Medicine, Peking University, Beijing, People’s Republic of China","Conceived and designed the experiments: JML GJW. Performed the experiments: GJW DZ. Analyzed the data: GJW YS JML. Contributed reagents/materials/analysis tools: KZ TTJ LC LZ RZ GGL RXP MJH. Wrote the paper: GJW YS JML.","The authors have declared that no competing interests exist."
"10.1371/journal.pone.0121225","plos one","2015-03-23T00:00:00Z","Lili Li; Sisi Li; Guohui Sun; Ruizeng Peng; Lijiao Zhao; Rugang Zhong","Beijing Key Laboratory of Environmental and Viral Oncology, College of Life Science and Bioengineering, Beijing University of Technology, Beijing, P. R. China","Conceived and designed the experiments: SL LL GS RP LZ RZ. Performed the experiments: SL LL GS RP LZ RZ. Analyzed the data: SL LL GS RP LZ RZ. Contributed reagents/materials/analysis tools: SL LL GS RP LZ RZ. Wrote the paper: SL LL GS RP LZ RZ.","The authors have declared that no competing interests exist."
"10.1371/journal.pone.0029594","plos one","2012-01-05T00:00:00Z","Jestinah M Mahachie John; Tom Cattaert; François Van Lishout; Elena S Gusareva; Kristel Van Steen","Systems and Modeling Unit, Montefiore Institute, University of Liege, Liege, Belgium; Bioinformatics and Modeling, GIGA-R, University of Liege, Liege, Belgium","Conceived and designed the experiments: JMMJ TC ESG KVS. Performed the experiments: JMMJ KVS. Analyzed the data: JMMJ KVS. Contributed reagents/materials/analysis tools: JMMJ TC ESG FVL KVS. Wrote the paper: JMMJ TC ESG FVL KVS.","The authors have declared that no competing interests exist."
"10.1371/journal.pone.0006450","plos one","2009-07-31T00:00:00Z","Hamish Innes-Brown; David Crewther","Brain Sciences Institute, Swinburne University, Melbourne Australia, Hawthorn, Victoria, Australia","Conceived and designed the experiments: HIB DPC. Performed the experiments: HIB. Analyzed the data: HIB DPC. Wrote the paper: HIB. Contributed to critical manuscript preparation and data analysis: DPC.","The authors have declared that no competing interests exist."
"10.1371/journal.pone.0086801","plos one","2014-01-23T00:00:00Z","Johan Ursing; Staffan Eksborg; Lars Rombo; Yngve Bergqvist; Daniel Blessborn; Amabelia Rodrigues; Poul-Erik Kofoed","Projecto de Saúde de Bandim, Indepth Network, Bissau, Guinea-Bissau; Malaria Research Laboratory, Department of Medicine, Karolinska University Hospital, Karolinska Institutet, Stockholm, Sweden; Department of Women’s and Children’s Health, Childhood Cancer Research Unit, Karolinska Institutet, Stockholm, Sweden; Centre for Clinical Research, Sörmland, Uppsala University, Sweden; Dalarna University College, Borlänge, Sweden; Mahidol Oxford Research Unit, Faculty of Tropical Medicine, Mahidol University, Bangkok, Thailand; Centre for Tropical Medicine, Nuffield Department of Clinical Medicine, University of Oxford, Oxford, United Kingdom; Department of Paediatrics, Kolding Hospital, Kolding, Denmark","Conceived and designed the experiments: JU SE LR YB AR PEK. Performed the experiments: JU DB AR PEK. Analyzed the data: JU SE LR PEK. Contributed reagents/materials/analysis tools: PEK YB DB AR. Wrote the paper: JU SE LR PEK YB DB. Contributed to design and coordination of clinical studies: JU PEK AR LR. Supervised enrollment and followup of patients: JU PEK AR LR. Assisted with data entry and interpretation: JU PEK AR LR SE YB DB. Prepared the manuscript: JU PEK AR LR. Contributed to data analyses: SE YB DB. Performed drug concentration analyses: YB DB.","The authors have declared that no competing interests exist."
"10.1371/journal.pone.0144271","plos one","2015-12-07T00:00:00Z","Megan E Moriarty; T Winston Vickers; Deana L Clifford; David K Garcelon; Patricia M Gaffney; Kenneth W Lee; Julie L King; Calvin L Duncan; Walter M Boyce","Karen C. Drayer Wildlife Health Center, School of Veterinary Medicine, University of California Davis, Davis, California, United States of America; Institute for Wildlife Studies, Arcata, California, United States of America; Wildlife Investigations Laboratory, California Department of Fish and Wildlife, Rancho Cordova, California, United States of America; Department of Pathology, Microbiology, and Immunology, School of Veterinary Medicine, University of California Davis, Davis, California, United States of America; Departments of Pathology and Medicine, University of California San Diego, San Diego, California, United States of America; Greer Laboratory, Lenoir, North Carolina, United States of America; Catalina Island Conservancy, Avalon, California, United States of America","Conceived and designed the experiments: MEM TWV DLC DKG KWL JLK CLD WMB. Performed the experiments: MEM TWV DLC PMG KWL JLK CLD WMB. Analyzed the data: MEM TWV DLC DKG PMG KWL JLK WMB. Contributed reagents/materials/analysis tools: DLC DKG PMG KWL JLK WMB. Wrote the paper: MEM TWV DLC DKG PMG KWL JLK CLD WMB.","We have the following interests: This study received funding from Greer Laboratories, Inc. Kenneth W. Lee is employed by Greer Laboratories, Inc. There are no patents, products in development, or marketed products as a result of this project. This does not alter the authors' adherence to PLOS ONE policies on sharing data and materials."
"10.1371/journal.pone.0063907","plos one","2013-05-16T00:00:00Z","Jean-François Pittet; Hidefumi Koh; Xiaohui Fang; Karen Iles; Sarah Christiaans; Naseem Anjun; Brant M Wagener; Dae Won Park; Jaroslaw W Zmijewski; Michael A Matthay; Jérémie Roux","Departments of Anesthesiology, University of Alabama at Birmingham, Birmingham, Alabama, United States of America; Division of Pulmonary Medicine, Keio University School of Medicine, Tokyo, Japan; Environmental Health Sciences, University of Alabama at Birmingham, Birmingham, Alabama, United States of America; Department of Medicine, University of Alabama at Birmingham, Birmingham, Alabama, United States of America; Division of Infectious Diseases, Korea University Ansan Hospital, Ansan, Republic of Korea; Department of Medicine and Cardiovascular Research Institute, University of California San Francisco, San Francisco, California, United States of America; Department of Systems Biology, Harvard Medical School, Boston, Massachusetts, United States of America","Conceived and designed the experiments: JFP HK JR. Performed the experiments: HK XF KI SC NA BMW JR. Analyzed the data: JFP HK MAM JR. Contributed reagents/materials/analysis tools: JFP XF DWP JWZ MAM JR. Wrote the paper: JFP JR.","The authors have declared that no competing interests exist."
"10.1371/journal.pone.0006409","plos one","2009-07-29T00:00:00Z","Balázs Csóka; Zoltán H Németh; Partha Mukhopadhyay; Zoltán Spolarics; Mohanraj Rajesh; Stephanie Federici; Edwin A Deitch; Sándor Bátkai; Pál Pacher; György Haskó","Department of Surgery, University of Medicine and Dentistry of New Jersey-New Jersey Medical School, Newark, New Jersey, United States of America; Department of Surgery, Morristown Memorial Hospital, Morristown, New Jersey, United States of America; National Institute on Alcohol Abuse and Alcoholism, Bethesda, Maryland, United States of America","Conceived and designed the experiments: BC. Performed the experiments: BC ZHN PM MR SF. Analyzed the data: BC ZS PP GH. Contributed reagents/materials/analysis tools: ED SB PP. Wrote the paper: BC PP GH.","The authors have declared that no competing interests exist."
