"id","journal","publication_date","author","author_affiliate","author_notes","competing_interest"
"10.1371/journal.pone.0153328","plos one","2016-04-12T00:00:00Z","Matteo Nespeca; Chiara Giorgetti; Stefano Nobile; Ilaria Ferrini; Manuela Simonato; Giovanna Verlato; Paola Cogo; Virgilio Paolo Carnielli","Division of Neonatology, Department of Clinical Sciences Polytechnic University of Marche and Azienda Ospedaliero Universitaria Ospedali Riuniti, Ancona, Italy; Department of Women’s and Children’s Health, University of Padova, Padova, Italy; Pediatric Research Institute “Città della speranza”, Padova, Italy; Department of Experimental and Clinical Medicine, University of Udine, Udine, Italy","Conceived and designed the experiments: PC VPC. Performed the experiments: MN CG SN IF GV. Analyzed the data: MS PC VPC. Contributed reagents/materials/analysis tools: MS PC VPC GV. Wrote the paper: MN CG MS PC VPC.","The authors have declared that no competing interests exist."
"10.1371/journal.pone.0062462","plos one","2013-04-24T00:00:00Z","PengFei Lin; XiangLi Lan; FengLei Chen; YanZhou Yang; YaPing Jin; AiHua Wang","Key Laboratory of Animal Biotechnology of the Ministry of Agriculture, Northwest A&F University, Yangling, Shaanxi, China; College of Veterinary Medicine, Northwest A&F University, Yangling, Shaanxi, China","Conceived and designed the experiments: AHW. Performed the experiments: PFL XLL. Analyzed the data: YPJ. Contributed reagents/materials/analysis tools: FLC YZY. Wrote the paper: PFL.","The authors have declared that no competing interests exist."
"10.1371/journal.pone.0085453","plos one","2014-01-20T00:00:00Z","Justina Hessel; Jonna Heldrich; Jennifer Fuller; Michelle R Staudt; Sharon Radisch; Charleen Hollmann; Ben-Gary Harvey; Robert J Kaner; Jacqueline Salit; Jenny Yee-Levin; Sriram Sridhar; Sreekumar Pillai; Holly Hilton; Gerhard Wolff; Hans Bitter; Sudha Visvanathan; Jay Fine; Christopher S Stevenson; Ronald G Crystal; Ann E Tilley","Division of Pulmonary and Critical Care Medicine, Weill Cornell Medical College, New York, New York, United States of America; Department of Genetic Medicine, Weill Cornell Medical College, New York, New York, United States of America; Hoffmann-La Roche, Inc., Nutley, New Jersey, United States of America","Conceived and designed the experiments: J. Hessel RGC AET. Performed the experiments: J. Hessel J. Heldrich B-GH RJK JY-L AET. Analyzed the data: J. Hessel J. Heldrich JS AET. Contributed reagents/materials/analysis tools: MRS J. Fuller SR CH SS SP HH GW HB SV J. Fine CSS RGC AET. Wrote the paper: J. Hessel RGC AET.","One or more of the authors are former employees of Hoffmann-La Roche, Inc. This does not alter the authors’ adherence to all the PLOS ONE policies on sharing data and materials."
"10.1371/journal.pone.0143166","plos one","2015-11-25T00:00:00Z","Marc Corrales; Pol Cuscó; Dinara R Usmanova; Heng-Chang Chen; Natalya S Bogatyreva; Guillaume J Filion; Dmitry N Ivankov","Genome Architecture, Gene Regulation, Stem Cells and Cancer Programme, Centre for Genomic Regulation (CRG), Barcelona, Spain; Universitat Pompeu Fabra (UPF), Barcelona, Spain; Spain Genome Architecture, Gene Regulation, Stem Cells and Cancer Programme, Centre for Genomic Regulation (CRG), Barcelona, Spain; Bioinformatics and Genomics Programme, Centre for Genomic Regulation (CRG), Barcelona, Spain; Moscow Institute of Physics and Technology, Dolgoprudny, Moscow Region, Russia; Laboratory of Protein Physics, Institute of Protein Research of the Russian Academy of Sciences, Pushchino, Moscow Region, Russia","Analyzed the data: MC PC DRU HCC NSB GJF DNI. Wrote the paper: GJF DNI.","The authors have declared that no competing interests exist."
"10.1371/journal.pone.0074001","plos one","2013-09-09T00:00:00Z","Jonathan H Shannahan; Xianyin Lai; Pu Chun Ke; Ramakrishna Podila; Jared M Brown; Frank A Witzmann","Department of Pharmaceutical Sciences, Skaggs School of Pharmacy and Pharmaceutical Sciences, University of Colorado Anschutz Medical Campus, Aurora, Colorado, United States of America; Department of Cellular and Integrative Physiology, Indiana University School of Medicine, Indianapolis, Indiana, United States of America; Department of Physics and Astronomy, Clemson University, Clemson, South Carolina, United States of America","Conceived and designed the experiments: FAW JMB. Performed the experiments: XL PCK RP. Analyzed the data: JHS. Contributed reagents/materials/analysis tools: FAW JMB PCK RP. Wrote the paper: JHS.","The authors have declared that no competing interests exist."
"10.1371/journal.pone.0108076","plos one","2014-09-23T00:00:00Z","Ling Tong; Kai Li; Qixing Zhou","School of Environmental Science and Engineering, Tianjin University, Tianjin, China; Department of Industrial Engineering, Nankai University, Tianjin, China; Key Laboratory of Pollution Process and Environmental Criteria (Ministry of Education), College of Environmental Science and Engineering, Nankai University, Tianjin, China","Performed the experiments: LT. Analyzed the data: KL LT QZ. Wrote the paper: LT QZ KL.","The authors have declared that no competing interests exist."
"10.1371/journal.pone.0119681","plos one","2015-04-10T00:00:00Z","Morten Stilund; Mikkel Carstensen Gjelstrup; Thor Petersen; Holger Jon Møller; Peter Vestergaard Rasmussen; Tove Christensen","Department of Neurology, Aarhus University Hospital, Nørrebrogade 44, DK-8000 Aarhus C, Denmark; Department of Clinical Biochemistry, Aarhus University Hospital, Nørrebrogade 44, DK-8000 Aarhus C, Denmark; Department of Biomedicine, Bartholin Building, Wilhelm Meyers Allé 4, Aarhus University, DK-8000 Aarhus C, Denmark","Conceived and designed the experiments: MS TC TP HJM. Performed the experiments: MS TC HJM MCG. Analyzed the data: MS TC TP MCG. Contributed reagents/materials/analysis tools: MS TC HJM TP PVR. Wrote the paper: MS TC TP PVR MCG HJM.","This study was funded by The Danish Multiple Sclerosis Society, grant number(s): 8990 and 14567, funder URL: http://scleroseforeningen.dk/, The Riisfort Foundation, grant no. 15399, URL: http://www.riisfort.dk/riisfort-fonden/, the Aase and Einar Danielsen’s Foundation; grant no 904587, URL: http://www.danielsensfond.dk/, The Jascha Foundation, grant no. 3099 URL: http://www.jaschafonden.dk/, and the Dagmar Marshalls Fond, grant no. N/A URL: N/A (it is a small Danish Foundation; applications via solicitor Oluf Engell; Bruun & Hjejle; Amagertorv 24; 1160 KøbenhavnK). HJM and Aarhus University have received royalties from IQ-products, NL. The funders had no role in study design, data collection and analysis, decision to publish, or preparation of the manuscript. This does not alter the authors' adherence to PLOS ONE policies on sharing data and materials."
"10.1371/journal.pone.0119423","plos one","2015-03-23T00:00:00Z","Lydia Herrmann; Caspar Wiegmann; Annika Arsalan-Werner; Isabel Hilbrich; Carsten Jäger; Katharina Flach; Anne Suttkus; Ingolf Lachmann; Thomas Arendt; Max Holzer","Paul Flechsig Institute of Brain Research, Department of Molecular and Cellular Mechanism of Neurodegeneration, University of Leipzig, Leipzig, Germany; AJ Roboscreen GmbH, Leipzig, Germany","Conceived and designed the experiments: LH CW TA MH. Performed the experiments: LH CW AW IH MH. Analyzed the data: LH CW AW AS IL TA MH. Contributed reagents/materials/analysis tools: KF CJ IL. Wrote the paper: LH CW TA MH.","The authors have declared that no competing interests exist."
"10.1371/journal.pone.0062237","plos one","2013-04-22T00:00:00Z","Rune A Høglund; Trygve Holmøy; Hanne F Harbo; Azzam A Maghazachi","Department of Physiology, Institute of Medical Basal Sciences, University of Oslo, Oslo, Norway; Department of Neurology, Akershus University Hospital and Institute of Clinical Medicine, University of Oslo, Oslo, Norway; Department of Neurology, Ullevål, Oslo University Hospital and Institute of Clinical Medicine, University of Oslo, Oslo, Norway","Recruited patients for participating in the study: HFH TH. Conceived and designed the experiments: AAM. Performed the experiments: RAH. Analyzed the data: RAH AAM. Contributed reagents/materials/analysis tools: TH HFH AAM. Wrote the paper: RAH AAM TH HFH.","Trygve Holmøy has received speakers honoraria and/or research grants from Biogen Idec, Novarits, Merck Serono, Sanofi Aventis, and Bayer Schering. Professor Hanne F. Harbo (MD, PhD) receives research grants to the Multiple Sclerosis (MS) research group at Oslo University Hospital from the Research Council of Norway, South-Eastern Norway Regional Health Authority, University of Oslo and Oslo University Hospital. Some MS research projects in this group are also supported by the Oslo MS association, Odd Fellow MS society Norway, and Novartis Norway. Harbo has during last years received some travel or research support or fee for lectures from Biogen Idec Norway, Novartis Norway and Sanofi-Aventis, Norway. The authors have declared that no competing interests exist in relation to this paper. The authors state that this does not alter their adherence to all the PLOS ONE policies on sharing data and materials."
"10.1371/journal.pone.0073739","plos one","2013-09-10T00:00:00Z","Penny Bee; Kathryn Berzins; Rachel Calam; Steven Pryjmachuk; Kathryn M Abel","Institute of Brain, Behaviour & Mental Health, University of Manchester, Manchester, United Kingdom; Division of Clinical Psychology, University of Manchester, Manchester, United Kingdom; Centre for Women’s Mental Health, University of Manchester, Manchester, United Kingdom","Conceived and designed the experiments: PB RC SP KA. Performed the experiments: PB KB. Analyzed the data: PB KB. Contributed reagents/materials/analysis tools: PB KB RC. Wrote the paper: PB SP KA RC.","The authors have declared that no competing interests exist."
"10.1371/journal.pone.0119421","plos one","2015-03-10T00:00:00Z","Annie Britton; Steven Bell","Research Department of Epidemiology and Public Health, University College London, London, United Kingdom","Conceived and designed the experiments: AB SB. Performed the experiments: AB SB. Analyzed the data: AB. Wrote the paper: AB SB.","The authors have declared that no competing interests exist."
"10.1371/journal.pone.0131258","plos one","2015-06-22T00:00:00Z","Vera Sandel; Rainer Kiko; Peter Brandt; Marcus Dengler; Lars Stemmann; Pieter Vandromme; Ulrich Sommer; Helena Hauss","GEOMAR Helmholtz Centre for Ocean Research Kiel, Düsternbrooker Weg 20, Kiel, Germany; Sorbonne Universités, UPMC Univ Paris 06, UMR7093, LOV, Observatoire océanologique, Villefranche-sur-mer, France","Conceived and designed the experiments: HH RK VS US. Performed the experiments: HH RK VS PB MD. Analyzed the data: HH RK VS MD LS PV. Contributed reagents/materials/analysis tools: HH LS US RK PV. Wrote the paper: VS HH RK US PV LS PB MD.","The authors have declared that no competing interests exist."
"10.1371/journal.pone.0016738","plos one","2011-02-02T00:00:00Z","Abdelilah el Barzouhi; Suzette Elias-Smale; Abbas Dehghan; Rozemarijn Vliegenthart-Proença; Matthijs Oudkerk; Albert Hofman; Jacqueline C M Witteman","Department of Epidemiology, Erasmus Medical Center, Rotterdam, The Netherlands; Department of Radiology, University Medical Center Groningen, University of Groningen, Groningen, The Netherlands","Conceived and designed the experiments: ABD SES AD RVP MO AH JCMW. Performed the experiments: ABD SES AD RVP MO AH JCMW. Analyzed the data: ABD SES AD RVP MO AH JCMW. Contributed reagents/materials/analysis tools: ABD SES AD RVP MO AH JCMW. Wrote the paper: ABD SES AD RVP MO AH JCMW.","The authors have declared that no competing interests exist."
"10.1371/journal.pone.0085236","plos one","2014-05-16T00:00:00Z","Ting Liu; Wei-Nan Zhang; Liujuan Cao; Yu Zhang","Research Center for Social Computing and Information Retrieval, Harbin Institute of Technology, Harbin City, Heilongjiang, China; Department of Computer Science, School of Information Science and Technology, Xiamen University, Xiamen City, Fujian, China","Conceived and designed the experiments: WNZ TL. Performed the experiments: WNZ LJC. Analyzed the data: TL WNZ. Contributed reagents/materials/analysis tools: WNZ. Wrote the paper: WNZ TL. Other (proofreading): YZ.","The authors have declared that no competing interests exist."
"10.1371/journal.pone.0005128","plos one","2009-04-08T00:00:00Z","John S Bett; Casey Cook; Leonard Petrucelli; Gillian P Bates","King's College London School of Medicine, Department of Medical and Molecular Genetics, King's College London, London, United Kingdom; Mayo Clinic, Jacksonville, Florida, United States of America","Conceived and designed the experiments: JSB GB. Performed the experiments: JSB. Analyzed the data: JSB. Contributed reagents/materials/analysis tools: CC LP. Wrote the paper: JSB GB.","King's College London licenses R6/2 mice for “for-profit” work."
"10.1371/journal.pone.0107816","plos one","2014-09-23T00:00:00Z","Ana Gervassi; Nicholas Lejarcegui; Sandra Dross; Amanda Jacobson; Grace Itaya; Elvis Kidzeru; Soren Gantt; Heather Jaspan; Helen Horton","Seattle Biomedical Research Institute, Seattle, Washington, United States of America; University of Washington Department of Global Health, Seattle, Washington, United States of America; University of Washington Department of Medicine, Seattle, Washington, United States of America; University of Washington Seattle Children's Hospital, Seattle, Washington, United States of America; Division of Immunology, Institute of Infectious Diseases and Molecular Medicine, University of Cape Town, Cape Town, South Africa; University of British Columbia Department of Pediatrics and Child and Family Research Institute, Vancouver, Canada","Conceived and designed the experiments: AG SG HJ HH. Performed the experiments: AG NL SD AJ GI EK HJ. Analyzed the data: AG NL HJ HH. Contributed reagents/materials/analysis tools: HJ HH. Wrote the paper: AG HH.","The authors have declared that no competing interests exist."
"10.1371/journal.pone.0027715","plos one","2011-11-16T00:00:00Z","Wei Zhang; Jamie A Johnston; Mark A Ross; Anthony A Smith; Brandon J Coakley; Elizabeth A Gleason; Amylou C Dueck; Marco Santello","School of Biological and Health Systems Engineering, Arizona State University, Tempe, Arizona, United States of America; Faculty of Kinesiology, University of Calgary, Calgary, Alberta, Canada; Mayo Clinic Hospital, Phoenix, Arizona, United States of America","Conceived and designed the experiments: WZ JJ MR AS MS. Performed the experiments: WZ JJ MR AS BJC EG AD MS. Analyzed the data: WZ JJ MR AS BJC EG AD MS. Contributed reagents/materials/analysis tools: WZ JJ MR AS BJC EG AD MS. Wrote the paper: WZ JJ MR AS BJC EG AD MS.","The authors have declared that no competing interests exist."
"10.1371/journal.pone.0039298","plos one","2012-06-22T00:00:00Z","Yongchen Guo; Yonghua Bao; Qingwen Meng; Xiaoxiang Hu; Qingyong Meng; Liming Ren; Ning Li; Yaofeng Zhao","State Key Laboratory of AgroBiotechnology, College of Biological Sciences, China Agricultural University, Beijing, People's Republic of China; Department of Basic Immunology, Xinxiang Medical University, Xinxiang, People's Republic of China; National Key Laboratory of Veterinary Biotechnology, Harbin Veterinary Research Institute, Chinese Academy of Agricultural Sciences, Harbin, People's Republic of China; College of Animal Science and Technology, Qingdao Agricultural University, Qingdao, People's Republic of China","Conceived and designed the experiments: YG YB YZ. Performed the experiments: YG YB YZ. Analyzed the data: YG YB YZ. Contributed reagents/materials/analysis tools: QM XH QM LR NL. Wrote the paper: YG YB YZ.","The authors have declared that no competing interests exist."
"10.1371/journal.pone.0096424","plos one","2014-04-30T00:00:00Z","Paola Villa; Wil Roebroeks","University of Colorado Museum, Boulder, Colorado, United States of America; Unité Mixte de Recherche 5199, De la Préhistoire à l’Actuel, Culture, Environnement et Anthropologie (PACEA), Université Bordeaux 1, Talence, France; School of Geography and Environmental Studies, University of the Witwatersrand, Johannesburg, South Africa; Faculty of Archaeology, Leiden University, Leiden, The Netherlands","Conceived and designed the experiments: PV WR. Analyzed the data: PV WR. Wrote the paper: PV WR. Performed research: PV WR.","The authors have declared that no competing interest exist."
"10.1371/journal.pone.0050836","plos one","2012-12-07T00:00:00Z","Imad M Tleyjeh; Aref A Bin Abdulhak; Muhammad Riaz; Faisal A Alasmari; Musa A Garbati; Mushabab AlGhamdi; Abdur Rahman Khan; Mohamad Al Tannir; Patricia J Erwin; Talal Ibrahim; Abed AlLehibi; Larry M Baddour; Alex J Sutton","Department of Medicine, King Fahad Medical City, Riyadh, Saudi Arabia; College of Medicine, AlFaisal University, Riyadh, Saudi Arabia; Division of Infectious Diseases, Mayo Clinic, Rochester, Minnesota, United States of America; Division of Epidemiology, Mayo Clinic, Rochester, Minnesota, United States of America; Department of Internal Medicine, University of Missouri-Kansas City, Kansas City, Missouri, United States of America; Research and Scientific Publication Center, King Fahad Medical City, Riyadh, Saudi Arabia; Department of Internal Medicine, University of Toledo Medical Center, Toledo, Ohio, United States of America; Mayo Medical Library, Mayo Clinic, Rochester, Minnesota, United States of America; Department of Orthopedic and Trauma Surgery, Hamad Medical Corporation Doha, Qatar; Department of Health Sciences, University of Leicester, University of Leicester, Leicester, England","Analyzed the data: IMT AJS MR ABA MAA MAG. Wrote the paper: IMT MR ARK ABA MAA MAG MA. Study concept and design: IMT AJS MR PJE. Data abstraction: ABA FAA MA AA TI MAG. Quality assessment: FAA ABA MAG. Revision of the manuscript: IMT AJS MR ABA FAA MAA AA TI MAG ARK LMB.","The authors have declared that no competing interests exist."
"10.1371/journal.pone.0142945","plos one","2015-11-12T00:00:00Z","Sang Joon Lee; Woorak Choi; Eunseok Seo; Eunseop Yeom","Department of Mechanical Engineering, Pohang University of Science and Technology (POSTECH), San 31, Hyoja-dong, Pohang 790–784, Republic of Korea; Department of New Biology, Daegu Gyeongbuk Institute of Science and Technology (DGIST), Dalseong, Daegu 711–873, Republic of Korea","Conceived and designed the experiments: SJL WC. Performed the experiments: WC ES. Analyzed the data: WC ES. Contributed reagents/materials/analysis tools: WC ES. Wrote the paper: SJL WC EY.","The authors have declared that no competing interests exist."
"10.1371/journal.pone.0153019","plos one","2016-04-12T00:00:00Z","Sarah V Maifeld; Bodrey Ro; Hoyin Mok; Marla Chu; Li Yu; Ryan Yamagata; Tansy Leonardson; Vera Chio; Bandita Parhy; Samuel Park; Marcia Carlson; Shushil Machhi; Nancy Ulbrandt; Ann R Falsey; Edward E Walsh; C Kathy Wang; Mark T Esser; Fengrong Zuo","Applied Immunology and Microbiology, MedImmune, Mountain View, California, United States of America; Non-clinical Biostatistics, MedImmune, Gaithersburg, Maryland, United States of America; Vaccine and Analytical Sciences, MedImmune, Mountain View, California, United States of America; Purification Process Sciences, MedImmune, Gaithersburg, Maryland, United States of America; Cell Culture and Fermentation Sciences, MedImmune, Gaithersburg, Maryland, United States of America; Department of Infectious Disease and Vaccines, Gaithersburg, California, United States of America; Department of Medicine, University of Rochester School of Medicine and Dentistry, and Department of Medicine, Rochester General Hospital, Rochester, New York, United States of America; Translational Medicine, MedImmune, Gaithersburg, Maryland, United States of America","Conceived and designed the experiments: SVM BR HM M. Chu AF EW CKW FZ. Performed the experiments: SVM BR HM M. Chu TL BP SP. Analyzed the data: SVM BR HM M. Chu LY RY TL VC ARF CKW FZ. Contributed reagents/materials/analysis tools: VC M. Carlson SM NU ARF EEW. Wrote the paper: SVM BR. Critically reviewed the manuscript: SVM BR HM M. Chu LY NU ARF EEW CKW MTE FZ.","The authors of this manuscript have read the journal's policy and have the following competing interests. SVM, BR, HM, M. Chu, LY, RY, TL, VC, BP, SP, M. Carlson, SM, NU, CKW, MTE and FZ are current or past employees of MedImmune. ARF receives research funding from ADMA Biologics, MedImmune, AstraZeneca and Sanofi Pasteur. EEW receives research funding from Gilead and MedImmune. ARF serves on advisory boards for Janssen GlaxoSmithKline, Novartis and Merck. EEW provides consulting services to GlaxoSmithKline, Alios Biopharma and Gilead. This does not alter the authors' adherence to PLOS ONE policies on sharing data and materials."
"10.1371/journal.pone.0107822","plos one","2014-09-24T00:00:00Z","Stefano Casalegno; Jonathan J Bennie; Richard Inger; Kevin J Gaston","Environment & Sustainability Institute, University of Exeter, Penryn, Cornwall, United Kingdom","Conceived and designed the experiments: SC KJG. Performed the experiments: SC. Analyzed the data: SC JB RI. Contributed reagents/materials/analysis tools: SC. Contributed to the writing of the manuscript: SC KJG RI JB.","The authors have declared that no competing interests exist."
"10.1371/journal.pone.0119424","plos one","2015-04-09T00:00:00Z","Jee Eun Sung","Department of Communication Disorders, Ewha Womans University, Seoul, Korea","Conceived and designed the experiments: JES. Performed the experiments: JES. Analyzed the data: JES. Contributed reagents/materials/analysis tools: JES. Wrote the paper: JES.","The authors have declared that no competing interests exist."
"10.1371/journal.pone.0027719","plos one","2011-11-28T00:00:00Z","Jia-Qiang He; Duc Minh Vu; Greg Hunt; Atul Chugh; Aruni Bhatnagar; Roberto Bolli","Institute of Molecular Cardiology, University of Louisville, Louisville, Kentucky, United States of America","Conceived and designed the experiments: JQH DMV. Performed the experiments: DMV JQH GH AC. Analyzed the data: JQH DMV. Contributed reagents/materials/analysis tools: JQH DMV GH AC. Wrote the paper: JQH AB RB.","The authors have declared that no competing interests exist."
"10.1371/journal.pone.0016742","plos one","2011-02-11T00:00:00Z","Emmanuel Vijay Paul Pandeeti; Gopi Krishna Pitchika; Jyotsna Jotshi; Smita S Nilegaonkar; Pradnya P Kanekar; Dayananda Siddavattam","Department of Animal Sciences, School of Life Sciences, University of Hyderabad, Hyderabad, Andhra Pradesh, India; Microbial Sciences Division, MACS-Agharkar Research Institute, Pune, Maharashtra, India","Conceived and designed the experiments: DS. Performed the experiments: EVPP GKP JJ. Analyzed the data: DS NSS KPP. Contributed reagents/materials/analysis tools: SD KPP. Wrote the paper: EVPP DS.","The authors have declared that no competing interests exist."
"10.1371/journal.pone.0050835","plos one","2012-12-19T00:00:00Z","Nicola Dimitri","Department of Political Economy and Statistics, University of Siena, Siena, Italy; Maastricht School of Management, Maastricht, Holland; IMT Lucca, Lucca, Italy","Wrote the paper: ND.","The author has declared that no competing interests exist."
"10.1371/journal.pone.0142943","plos one","2015-11-23T00:00:00Z","Kunihiko Yasuda; Mayumi Takahashi; Nozomu Mori","The Department of Anatomy and Neurobiology, Nagasaki University School of Medicine, Nagasaki, Japan","Conceived and designed the experiments: KY. Performed the experiments: KY MT. Analyzed the data: KY. Contributed reagents/materials/analysis tools: KY. Wrote the paper: KY. Using the grants: NM. Discussions regarding the manuscript: NM.","The authors have declared that no competing interests exist."
"10.1371/journal.pone.0131267","plos one","2015-07-06T00:00:00Z","Kurt J Gron; Janet Montgomery; Peter Rowley-Conwy","Department of Archaeology, Durham University, Durham, United Kingdom","Conceived and designed the experiments: KG JM PR-C. Performed the experiments: KG. Analyzed the data: KG JM PR-C. Contributed reagents/materials/analysis tools: JM. Wrote the paper: KG JM PR-C.","The authors have declared that no competing interests exist."
"10.1371/journal.pone.0050834","plos one","2012-12-04T00:00:00Z","Antoinette J Piaggio; Susan A Shriner; Kaci K VanDalen; Alan B Franklin; Theodore D Anderson; Sergios-Orestis Kolokotronis","National Wildlife Research Center, Wildlife Services, United States Department of Agriculture, Fort Collins, Colorado, United States of America; Sackler Institute for Comparative Genomics, American Museum of Natural History, New York, New York, United States of America and Department of Biological Sciences, Fordham University, Bronx, New York, United States of America","Conceived and designed the experiments: AJP ABF SOK. Performed the experiments: AJP TDA SOK KKV. Analyzed the data: AJP SAS KKV ABF SOK TDA. Contributed reagents/materials/analysis tools: AJP SAS ABF TDA SOK. Wrote the paper: AJP SAS KKV ABF SOK TDA.","The authors have declared that no competing interests exist."
"10.1371/journal.pone.0039301","plos one","2012-06-25T00:00:00Z","Gilles Maussion; Jennie Yang; Volodymyr Yerko; Philip Barker; Naguib Mechawar; Carl Ernst; Gustavo Turecki","McGill Group for Suicide Studies, Douglas Hospital Research Institute, McGill University, Montreal, Quebec, Canada; Montreal Neurological Institute, McGill University, Montreal, Quebec, Canada","Conceived and designed the experiments: GM JY VY CE GT. Performed the experiments: GM JY VY CE. Analyzed the data: GM JY VY. Contributed reagents/materials/analysis tools: GM VY NM PB GT. Wrote the paper: GM VY CE GT.","The authors have declared that no competing interests exist."
