"id","journal","publication_date","author","author_affiliate","author_notes","competing_interest"
"10.1371/journal.pone.0066581","plos one","2013-07-04T00:00:00Z","Supratik Das; Baisakhi Banerjee; Maidul Hossain; Muruganandan Thangamuniyandi; Saumya Dasgupta; Nipa Chongdar; Gopinatha Suresh Kumar; Gautam Basu","Department of Biochemistry, University of Calcutta, Kolkata, India; Dr. B.C. Guha Center for Genetic Engineering and Biotechnology, University of Calcutta, Kolkata, India; Biophysical Chemistry Laboratory, CSIR-Indian Institute of Chemical Biology, Kolkata, India; Central Instrumentation, CSIR-Indian Institute of Chemical Biology, Kolkata, India; Department of Biophysics, Bose Institute, Kolkata, India","Conceived and designed the experiments: SD. Performed the experiments: S. Das BB MH MT. Analyzed the data: S. Das S. Dasgupta GB GSK. Contributed reagents/materials/analysis tools: NC. Wrote the paper: S. Das GB.","The authors have declared that no competing interests exist."
"10.1371/journal.pone.0135846","plos one","2015-08-18T00:00:00Z","Oathokwa Nkomazana; Robert Mash; Sheila Shaibu; Nthabiseng Phaladze","Faculty of Medicine, University of Botswana, Gaborone, Botswana; Division of Family Medicine and Primary Care, Stellenbosch University, Cape Town South Africa; School of Nursing, University of Botswana, Gaborone, Botswana","Conceived and designed the experiments: ON. Performed the experiments: ON SS NP. Analyzed the data: ON RM. Contributed reagents/materials/analysis tools: ON RM. Wrote the paper: ON RM SS NP.","The authors have declared that no competing interests exist."
"10.1371/journal.pone.0066580","plos one","2013-06-20T00:00:00Z","Séverine Martini; Badr Al Ali; Marc Garel; David Nerini; Vincent Grossi; Muriel Pacton; Laurence Casalot; Philippe Cuny; Christian Tamburini","Aix Marseille Université, CNRS/INSU, IRD, Mediterranean Institute of Oceanography (MIO), UM 110, Marseille, France; Université du Sud Toulon-Var, CNRS/INSU, IRD, Mediterranean Institute of Oceanography (MIO), UM 110, La Garde, France; Laboratoire de Géologie de Lyon, UMR5276 Université Lyon1, CNRS, Villeurbanne, France; ETH Zürich, Geological Institute, Zürich, Switzerland","Conceived and designed the experiments: CT SM MG. Performed the experiments: BAA MG SM CT VG MP LC PC. Analyzed the data: SM CT MG VG MP LC PC DN BAA. Wrote the paper: SM CT MG VG MP LC PC DN BAA.","The authors have declared that no competing interests exist."
"10.1371/journal.pone.0010744","plos one","2010-05-20T00:00:00Z","Andres F Zuluaga; Maria Agudelo; John J Cardeño; Carlos A Rodriguez; Omar Vesga","Department of Pharmacology and Toxicology, University of Antioquia Medical School, Medellín, Colombia; Grupo Investigador de Problemas en Enfermedades Infecciosas, University of Antioquia Medical School, Medellín, Colombia; Section of Infectious Diseases, Department of Medicine, Hospital Universitario San Vicente de Paul and University of Antioquia Medical School, Medellín, Colombia","Conceived and designed the experiments: AFZ OV. Performed the experiments: AFZ MA JJC CAR OV. Analyzed the data: AFZ OV. Contributed reagents/materials/analysis tools: AFZ MA JJC CAR OV. Wrote the paper: AFZ CAR OV. Gave final approval of the version to be published: OV AFZ MA JJC CAR. Provided care for the animals: MA JJC CAR.","Zuluaga has received honoraries for speaking from Pfizer, Allergan and Roche, received financial support from Pfizer, AztraZeneca and Merck Sharp & Dohme (MSD) to participate in scientific international meetings, and has been a member of advisory boards for Pfizer. Rodriguez received financial support to participate in international meetings from AztraZeneca and Wyeth. Agudelo received financial support to participate in international meetings from Wyeth and Bristol-Myers Squibb (BMS), respectively. Vesga has received honoraries for lectures and financial support to participate in international meetings from GlaxoSmithKline, Pfizer, BMS, AstraZeneca, MSD, Sanofi-Aventis and Wyeth, and has been a member of advisory boards for Wyeth. None of these or any other pharmaceutical companies supported the present study."
"10.1371/journal.pone.0124706","plos one","2015-04-24T00:00:00Z","Shweta Tripathi; Guangshun Wang; Mitchell White; Li Qi; Jeffery Taubenberger; Kevan L Hartshorn","Boston University School of Medicine, Department of Medicine, Boston, MA, United States of America; Department of Pathology and Microbiology, University of Nebraska Medical Center, 986495 Nebraska Medical Center, Omaha, NE 68198–6495, United States of America; National Institute of Allergy and Infectious Diseases, Bethesda, United States of America","Conceived and designed the experiments: ST GW MW LQ JT KLH. Performed the experiments: ST LQ MW. Analyzed the data: ST GW MW LQ JT KLH. Contributed reagents/materials/analysis tools: GW LQ JT. Wrote the paper: ST GW KLH.","The authors have declared that no competing interests exist."
"10.1371/journal.pone.0078030","plos one","2013-10-21T00:00:00Z","Melanie Caron; Gilda Grard; Christophe Paupy; Illich Mamfred Mombo; Branly Bikie Bi Nso; Fabrice Roland Kassa Kassa; Dieudonne Nkoghe; Eric Maurice Leroy","Centre International de Recherches Médicales de Franceville (CIRMF), Franceville, Gabon; Institut de recherche pour le développement (IRD), Montpellier, France; Ministère de la Santé Publique, Libreville, Gabon","Conceived and designed the experiments: MC GG CP DN EML. Performed the experiments: MC GG CP IMM BBBN FRKK. Analyzed the data: MC CP DN EML. Wrote the manuscript: MC CP EML.","This study was partly funded by Total Gabon. There are no patents, products in development or marketed products to declare. This does not alter the authors' adherence to all the PLOS ONE policies on sharing data and materials, as detailed online in the guide for authors."
"10.1371/journal.pone.0020481","plos one","2011-06-17T00:00:00Z","Monika H E Christensen; Simon N Dankel; Yngve Nordbø; Jan Erik Varhaug; Bjørg Almås; Ernst A Lien; Gunnar Mellgren","Institute of Medicine, University of Bergen, Bergen, Norway; Hormone Laboratory, Haukeland University Hospital, Bergen, Norway; Department of Surgery, Haukeland University Hospital, Bergen, Norway; Department of Surgical Science, University of Bergen, Bergen, Norway","Conceived and designed the experiments: MHEC SND JEV BA EAL GM. Performed the experiments: MHEC. Analyzed the data: MHEC SND EAL GM. Contributed reagents/materials/analysis tools: EAL GM. Wrote the paper: MHEC SND YN JEV BA EAL GM. Collected the samples: MHEC YN JEV.","The authors have declared that no competing interests exist."
"10.1371/journal.pone.0043598","none","2012-08-22T00:00:00Z","Li-Yan Zhao; Jie Tian; Wei Wang; Wei Qin; Jie Shi; Qiang Li; Kai Yuan; Ming-Hao Dong; Wei-Chuang Yang; Ya-Rong Wang; Li-Li Sun; Lin Lu","National Institute on Drug Dependence, Peking University, Beijing, China; Xidian University, Xian, China; Tangdu Hospital, The Fourth Military Medical University, Xian, China","Conceived and designed the experiments: LZ LL. Performed the experiments: LZ QL WY LS. Analyzed the data: LZ KY. Contributed reagents/materials/analysis tools: LZ WW JS JT WQ YW MD. Wrote the paper: LZ.","The authors have declared that no competing interests exist."
"10.1371/journal.pone.0055284","plos one","2013-01-28T00:00:00Z","Paul Dean; Lorna Young; Sabine Quitard; Brendan Kenny","Institute of Cell and Molecular Biosciences, Medical School, University of Newcastle, Newcastle-Upon-Tyne, United Kingdom","Conceived and designed the experiments: PD LY BK. Performed the experiments: SQ PD LY. Analyzed the data: BK SQ PD LY. Wrote the paper: PD BK.","The authors have declared that no competing interests exist."
"10.1371/journal.pone.0124710","plos one","2015-04-21T00:00:00Z","Joanne S Carpenter; Rébecca Robillard; Rico S C Lee; Daniel F Hermens; Sharon L Naismith; Django White; Bradley Whitwell; Elizabeth M Scott; Ian B Hickie","Clinical Research Unit, Brain & Mind Research Institute, University of Sydney, Camperdown, NSW, Australia","Conceived and designed the experiments: JSC RR DFH SLN EMS IBH. Performed the experiments: RR RSCL DW BW EMS. Analyzed the data: JSC. Contributed reagents/materials/analysis tools: RR RSCL DFH. Wrote the paper: JSC RR RSCL DFH SLN DW BW EMS IBH.","The authors have read the journal’s policy and have the following conflicts. DFH has received honoraria for educational seminars from Janssen-Cilag and Eli Lilly. EMS is the (unpaid) Clinical Director of Headspace Services at the BMRI, the (unpaid) Coordinator of the Youth Mental Health Research Program at the BMRI, and Deputy Director of St Vincent’s Private Hospital Young Adult Mental Health Unit. She has received honoraria for educational seminars related to the clinical management of depressive disorders supported by Servier and Eli Lilly pharmaceuticals. She has participated in a national advisory board for the antidepressant compound Pristiq, manufactured by Pfizer. IBH is a Commissioner in Australia’s new National Mental Health Commission from 2012. He was a director of headspace: the national youth mental health foundation until January 2012. He was previously the chief executive officer (till 2003) and clinical adviser (till 2006) of beyondblue, an Australian National Depression Initiative. He is the executive director of the Brain and Mind Research Institute, which operates two early-intervention youth services under contract to headspace. He has led a range of community-based and pharmaceutical industry-supported depression awareness and education and training programs. He has led projects for health professionals and the community supported by governmental, community agency and pharmaceutical industry partners (Wyeth, Eli Lily, Servier, Pfizer, AstraZeneca) for the identification and management of depression and anxiety. He has received honoraria for presentations of his own work at educational seminars supported by a number of non-government organisations and the pharmaceutical industry (including Servier, Pfizer, AstraZeneca, and Eli Lilly). He is a member of the Medical Advisory Panel for Medibank Private and also a Board Member of Psychosis Australia Trust. He leads an investigator-initiated study of the effects of agomelatine on circadian parameters (supported in part by Servier) and has participated in a multicentre clinical trial of the effects of agomelatine on sleep architecture in depression and a Servier-supported study of major depression and sleep disturbance in primary care settings. The competing interests do not alter the authors’ adherence to all the PLOS ONE policies on sharing data and materials."
"10.1371/journal.pone.0010747","plos one","2010-05-20T00:00:00Z","Christina Hägglöf; Peter Hammarsten; Andreas Josefsson; Pär Stattin; Janna Paulsson; Anders Bergh; Arne Östman","Department of Oncology-Pathology, Karolinska Institutet, Stockholm, Sweden; Department of Medical Biosciences, Pathology, Umeå University, Umeå, Sweden; Departments of Surgery and Perioperative Sciences, Urology and Andrology, Umeå University, Umeå, Sweden","Conceived and designed the experiments: CH PH AB AO. Performed the experiments: CH PH. Analyzed the data: CH PH AB AO. Contributed reagents/materials/analysis tools: PH AJ PS JP AB AO. Wrote the paper: CH PH AB AO.","The authors have declared that no competing interests exist."
"10.1371/journal.pone.0020483","plos one","2011-05-25T00:00:00Z","Joanna L Coleman; Robert M R Barclay","Department of Biological Sciences, University of Calgary, Calgary, Alberta, Canada","Conceived and designed the experiments: JLC RMRB. Performed the experiments: JLC. Analyzed the data: JLC. Contributed reagents/materials/analysis tools: JLC. Wrote the paper: JLC.","The authors have declared that no competing interests exist."
"10.1371/journal.pone.0135847","plos one","2015-09-02T00:00:00Z","Diana C Koester; Elizabeth W Freeman; Janine L Brown; David E Wildt; Kimberly A Terrell; Ashley D Franklin; Adrienne E Crosier","Center for Species Survival, Smithsonian Conservation Biology Institute, Front Royal, Virginia, United States of America; Department of Environmental Science and Policy, George Mason University, Fairfax, Virginia, United States of America; New Century College, George Mason University, Fairfax, Virginia, United States of America; Department of Ecology and Evolutionary Biology, Tulane University, New Orleans, Louisiana, United States of America; Department of Animal and Avian Sciences, University of Maryland, College Park, Maryland, United States of America","Conceived and designed the experiments: DCK AEC EWF JLB. Performed the experiments: DCK KAT AEC. Analyzed the data: DCK ADF JLB. Contributed reagents/materials/analysis tools: JLB EWF. Wrote the paper: DCK DEW AEC.","The authors have declared that no competing interests exist."
"10.1371/journal.pone.0078031","plos one","2013-10-18T00:00:00Z","Laurie A Heinicke; Behnam Nabet; Shihao Shen; Peng Jiang; Sebastiaan van Zalen; Benjamin Cieply; J Eric Russell; Yi Xing; Russ P Carstens","Department of Medicine (Hematology-Oncology Division), Perelman School of Medicine, University of Pennsylvania, Philadelphia, Pennsylvania, United States of America; Department of Medicine (Renal Division), Perelman School of Medicine, University of Pennsylvania, Philadelphia, Pennsylvania, United States of America; Department of Internal Medicine, University of Iowa, Iowa City, Iowa, United States of America; Department of Microbiology, Immunology, and Molecular Genetics, University of California Los Angeles, Los Angeles, California, United States of America; Department of Pediatrics (Hematology), Perelman School of Medicine, University of Pennsylvania, and the Children’s Hospital of Philadelphia, Philadelphia, Pennsylvania, United States of America; Department of Genetics University of Pennsylvania, Perelman School of Medicine, Philadelphia, Pennsylvania, United States of America","Conceived and designed the experiments: LH BN RC. Performed the experiments: LH BN SS SV BC. Analyzed the data: LH SS PJ YX RC. Contributed reagents/materials/analysis tools: SV JER. Wrote the manuscript: LH RC.","Dr. YX, a co-author on the manuscript, is a PLOS ONE editorial board member. This fact does not alter the authors' adherence to all the PLOS ONE policies on sharing data and materials."
"10.1371/journal.pone.0020482","plos one","2011-06-10T00:00:00Z","Sabrina Molinaro; Valeria Siciliano; Olivia Curzio; Francesca Denoth; Stefano Salvadori; Fabio Mariani","Institute of Clinical Physiology, National Research Council, Pisa, Italy","Conceived and designed the experiments: SM FM. Performed the experiments: SM FD. Analyzed the data: SM VS SS. Wrote the paper: SM OC FD.","The authors have declared that no competing interests exist."
"10.1371/journal.pone.0135845","plos one","2015-08-14T00:00:00Z","Indu Jose Thoompumkal; Malireddi Rama Krishna Subba Rao; Anbarasu Kumaraswamy; Rehna Krishnan; Sundarasamy Mahalingam","Laboratory of Molecular Virology and Cell Biology, Department of Biotechnology, Bhupat and Jyoti Mehta School of Biosciences, Indian Institute of Technology-Madras, Chennai, 600 036, India; National Cancer Tissue Biobank, Department of Biotechnology, Bhupat and Jyoti Mehta School of Biosciences, Indian Institute of Technology-Madras, Chennai, 600 036, India","Conceived and designed the experiments: IJT SM. Performed the experiments: IJT MRKSR AK RK. Analyzed the data: IJT MRKSR AK SM. Wrote the paper: IJT SM.","The authors have declared that no competing interests exist."
"10.1371/journal.pone.0055285","plos one","2013-02-01T00:00:00Z","Benjamin Maasoumy; Kerstin Port; Antoaneta Angelova Markova; Beatriz Calle Serrano; Magdalena Rogalska-Taranta; Lisa Sollik; Carola Mix; Janina Kirschner; Michael P Manns; Heiner Wedemeyer; Markus Cornberg","Department of Gastroenterology, Hepatology and Endocrinology, Hannover Medical School, Hannover, Germany","Assesment of data: BM KP AM BCS MRT LS CM JK. Conceived and designed the experiments: BM MPM HW MC. Analyzed the data: BM HW MC. Wrote the paper: BM MPM HW MC.","The authors have read the journal’s policy and declare the following conflicts concerning Peg-Interferon alpha-2a (Roche), Peg-Interferon alpha-2b (Merck), Ribavirin (Roche, Merck), Boceprevir (Merck), Telaprevir (Janssen-Cilag): BM received travel grants from Merck and Janssen-Cilag, KP received lecture fees from Roche and Janssen-Cilag, AM declares no conflict, BCS received lecture fees from Merck, MRT declares no conflict, LS declares no conflict, JK declares no conflict, CM declares no conflict, MPM received grants, lectural fees and/or consult fees from Roche, Merck and Janssen-Cilag, HW received grants, lectural fees and/or consult fees from Roche, Merck and Janssen-Cilag. HW is also Academic Editor of PLOS ONE. MC received grants, lectural fees and/or consult fees from Roche, Merck and Janssen-Cilag. This does not alter the authors’ adherence to all the PLOS ONE policies on sharing data and materials."
"10.1371/journal.pone.0124705","plos one","2015-05-01T00:00:00Z","Hanbo Hu; Xiaoyan Zhu; Sunil Joshi; Li Lu; Chang-Qing Xia; Jawaharlal M Patel","Department of Medicine, University of Florida College of Medicine, Gainesville, Florida 32608, United States of America; Department of Pathology, Immunology and Laboratory Medicine, University of Florida College of Medicine, Gainesville, Florida 32608, United States of America; Research Service, North Florida/South Georgia Veterans Health System, Gainesville, Florida 32608, United States of America","Conceived and designed the experiments: JMP HBH CQX. Performed the experiments: HBH XYZ SJ. Analyzed the data: JMP HBH CQX LL SJ. Wrote the paper: HBH CQX LL JMP.","The authors have declared that no competing interests exist."
"10.1371/journal.pone.0032351","plos one","2012-03-01T00:00:00Z","Katarzyna A Podyma-Inoue; Miki Hara-Yokoyama; Tamayuki Shinomura; Tomoko Kimura; Masaki Yanagishita","Section of Biochemistry, Graduate School of Medical and Dental Sciences, Tokyo Medical and Dental University, Tokyo, Japan; Section of Hard Tissue Engineering, Department of Hard Tissue Engineering, Graduate School of Medical and Dental Sciences, Tokyo Medical and Dental University, Tokyo, Japan","Conceived and designed the experiments: KAPI MY. Performed the experiments: KAPI MHY TS TK. Analyzed the data: KAPI MHY MY. Contributed reagents/materials/analysis tools: KAPI MHU TS. Wrote the paper: KAPI MY.","The authors have declared that no competing interests exist."
"10.1371/journal.pone.0066579","plos one","2013-06-20T00:00:00Z","Wei-Fong Kao; Jyh-How Huang; Terry B J Kuo; Po-Lun Chang; Wen-Chen Chang; Kuo-Hung Chan; Wen-Hsiung Liu; Shih-Hao Wang; Tzu-Yao Su; Hsiu-chen Chiang; Jin-Jong Chen","Department of Emergency and Critical Care Medicine, Taipei Medical University Hospital, Taipei, Taiwan; Institute of BioMedical Informatics, National Yang-Ming University, Taipei, Taiwan; Institute of Neuroscience, National Yang-Ming University, Taipei, Taiwan; Institute of Physical Therapy, National Yang-Ming University, Taipei, Taiwan; Department of Sports Information and Communication, National Taiwan College of Physical Education, Chiaryi, Taiwan; Center for Measurement Standards, Industrial Technology Research Institute, Hsinchu, Taiwan; Taiwan Telemedicine Device Company, Kaohsiung, Taiwan; Yu-Shan National Park, Nan-Tou, Taiwan","Conceived and designed the experiments: W-FK J-HH TBJK P-LC W-CC K-HC W-HL T-YS J-JC. Performed the experiments: W-FK J-HH TBJK P-LC W-CC K-HC W-HL T-YS H-CC J-JC. Analyzed the data: W-FK J-HH TBJK P-LC W-CC K-HC W-HL S-HW. Contributed reagents/materials/analysis tools: W-FK J-HH TBJK P-LC W-CC K-HC W-HL S-HW T-YS H-CC. Wrote the paper: W-FK J-HH TBJK P-LC S-HW H-CC J-JC. Designed the devices: W-FK J-HH TBJK P-LC W-CC K-HC W-HL T-YS. Designed the transmission system: W-FK J-HH TBJK P-LC W-CC K-HC W-HL T-YS.","Drs W-HL and T-YS, although employed by Taiwan Telemedicine Device Company (Kaohsiung, Taiwan), do not have any conflict of interest in regards to the current investigation. Their employment does not alter the authors’ adherence to all the PLOS ONE policies on sharing data and materials."
"10.1371/journal.pone.0032354","plos one","2012-02-29T00:00:00Z","Dorke Meyer; Anja Voigt; Patricia Widmayer; Heike Borth; Sandra Huebner; Andreas Breit; Susan Marschall; Martin Hrabé de Angelis; Ulrich Boehm; Wolfgang Meyerhof; Thomas Gudermann; Ingrid Boekhoff","Walther-Straub Institute of Pharmacology and Toxicology, Ludwig-Maximilians-University, Munich, Germany; German Institute of Nutrition, Potsdam-Rehbruecke, Germany; Institute for Neural Signal Transduction, Center for Molecular Neurobiology, Hamburg, Germany; Institute of Physiology, University of Hohenheim, Stuttgart, Germany; Institute of Experimental Genetics, Helmholtz-Zentrum, Munich, Germany","Conceived and designed the experiments: IB DM PW TG WM. Performed the experiments: DM HB SM SH. Analyzed the data: DM IB AB. Contributed reagents/materials/analysis tools: AV UB WM MHA. Wrote the paper: IB DM.","TG, IB and DM are named inventors of a patent (DE 10 2005 028 453.1) concerning taste receptor related evaluation and manipulation of human fertility. This does not alter the authors' adherence to all the PLoS ONE policies on sharing data and materials."
"10.1371/journal.pone.0078029","plos one","2013-11-01T00:00:00Z","Peter J Schulz; Uwe Hartung; Silvia Riva","Institute of Communication and Health, Università della Svizzera Italiana, Lugano, Switzerland","Conceived and designed the experiments: PJS. Performed the experiments: PJS UH SR. Analyzed the data: UH SR. Contributed reagents/materials/analysis tools: PJS. Wrote the paper: PJS UH.","The authors declare that no competing interests exist."
"10.1371/journal.pone.0043597","none","2012-08-23T00:00:00Z","Richard C Lennertz; Elena A Kossyreva; Amanda K Smith; Cheryl L Stucky","Department of Cell Biology, Neurobiology and Anatomy, Medical College of Wisconsin, Milwaukee, Wisconsin, United States of America","Conceived and designed the experiments: RCL CLS. Performed the experiments: RCL EAK AKS. Analyzed the data: RCL EAK AKS. Wrote the paper: RCL CLS.","The authors have declared that no competing interests exist."
"10.1371/journal.pone.0043596","plos one","2012-11-02T00:00:00Z","Dong-Jiang Tang; Yuen-Man Lam; Yu-Lam Siu; Chi-Hong Lam; Shui-Ling Chu; J S Malik Peiris; Philippe Buchy; Béatrice Nal; Roberto Bruzzone","HKU-Pasteur Research Centre, The University of Hong Kong, Hong Kong, Special Administrative Region, People's Republic of China; Center for Influenza Research – School of Public Health, The University of Hong Kong, Hong Kong, Special Administrative Region, People's Republic of China; Department of Anatomy, The University of Hong Kong, Hong Kong, Special Administrative Region, People's Republic of China; Virology Unit, Institut Pasteur in Cambodia, Phnom Penh, Kingdom of Cambodia; Department of Cell Biology and Infection, Institut Pasteur, Paris, France","Conceived and designed the experiments: DJT RB PB BN JSMP. Performed the experiments: DJT YML YLS CHL SLC PB. Analyzed the data: DJT YML RB PB. Contributed reagents/materials/analysis tools: PB JSMP. Wrote the paper: DJT RB PB.","The authors have declared that no competing interests exist."
"10.1371/journal.pone.0135842","plos one","2015-08-28T00:00:00Z","Manikandan Subramanian; Lale Ozcan; Devram Sampat Ghorpade; Anthony W Ferrante; Ira Tabas","Department of Medicine, Columbia University, New York, NY, 10032, United States of America; Department of Pathology & Cell Biology, Columbia University, New York, NY, 10032, United States of America; Department of Physiology & Cellular Biophysics, Columbia University, New York, NY, 10032, United States of America","Conceived and designed the experiments: MS LO AWF IT. Performed the experiments: MS LO DSG. Analyzed the data: MS LO DSG AWF IT. Contributed reagents/materials/analysis tools: IT. Wrote the paper: MS LO AWF IT.","The authors have declared that no competing interests exist."
"10.1371/journal.pone.0078026","plos one","2013-10-30T00:00:00Z","Jinqiang Zhu; Liyuan Kang; Qiaofeng Ye; Guanwei Fan; Yubin Liang; Chen Yan; John Orgah","Institute of Traditional Chinese Medicine, Tianjin Key Laboratory of Chinese Medical Pharmacology, Tianjin University of Traditional Chinese Medicine, Tianjin, People’s Republic of China; Research and Development Center of TCM, Tianjin International Joint Academy of Biotechnology and Medicine, Tianjin, People’s Republic of China","Conceived and designed the experiments: LYK JQZ GWF. Performed the experiments: JQZ QFY YBL. Analyzed the data: JQZ CY QFY. Contributed reagents/materials/analysis tools: JQZ CY QFY. Wrote the paper: JQZ LYK JO.","The authors have declared that no competing interests exist."
"10.1371/journal.pone.0032350","plos one","2012-05-16T00:00:00Z","Jumi Kim; Jeong Min Shin; Young Joo Jeon; Hyung Min Chung; Jung-Il Chae","CHA Bio & Diostech Co., Ltd., Seoul, Korea; Graduate School of Life Science, CHA Stem Cell Institute, College of Medicine, CHA University, Seoul, Korea; Department of Oral Pharmacology, School of Dentistry, Brain Korea 21 Project, Chonbuk National University, Jeonju, Korea","Conceived and designed the experiments: JK JIC. Performed the experiments: JMS YJJ. Analyzed the data: JK JIC. Contributed reagents/materials/analysis tools: HMC. Wrote the paper: JK. Financial support: HMC. Administrative support: HMC.","The authors have read the journal's policy and have the following conflicts: Jeong Min Shin, Jumi Kim, Min Ji Lee and Hyung Min Chung are employed by CHA Bio & Diostech Co. Ltd. There are no patents, products in development or marketed products to declare. This does not alter the authors' adherence to all the PLoS ONE policies on sharing data and materials, as detailed online in the guide for authors."
