"id","journal","publication_date","author","author_affiliate","author_notes","competing_interest"
"10.1371/journal.pgen.1004796","plos genetics","2014-11-20T00:00:00Z","Hiromi Maekawa; Yoshinobu Kaneko","Yeast Genetic Resources Laboratory, Graduate School of Engineering, Osaka University, Osaka, Japan","Conceived the genome sequencing experiment: YK. Conceived and designed the experiments: HM. Performed the experiments: HM. Analyzed the data: HM. Contributed reagents/materials/analysis tools: YK. Wrote the paper: HM. Commented on the manuscript: YK.","The authors have declared that no competing interests exist."
"10.1371/journal.pgen.1004798","plos genetics","2014-11-20T00:00:00Z","Zhihao Ding; Yunyun Ni; Sander W Timmer; Bum-Kyu Lee; Anna Battenhouse; Sandra Louzada; Fengtang Yang; Ian Dunham; Gregory E Crawford; Jason D Lieb; Richard Durbin; Vishwanath R Iyer; Ewan Birney","The Wellcome Trust Sanger Institute, Wellcome Trust Genome Campus, Hinxton, Cambridgeshire, United Kingdom; Center for Systems and Synthetic Biology, Institute for Cellular and Molecular Biology, Department of Molecular Biosciences, University of Texas at Austin, Austin, Texas, United States of America; The European Molecular Biology Laboratory, The European Bioinformatics Institute (EMBL-EBI), Wellcome Trust Genome Campus, Hinxton, Cambridgeshire, United Kingdom; Institute for Genome Sciences and Policy, and Department of Pediatrics, Division of Medical Genetics, Duke University, Durham, North Carolina, United States of America; Department of Biology and Lineberger Comprehensive Cancer Center, The University of North Carolina at Chapel Hill, Chapel Hill, North Carolina, United States of America","Conceived and designed the experiments: ID GEC JDL VRI RD EB. Performed the experiments: AB SL FY BKL. Analyzed the data: ZD YN SWT ID RD EB. Contributed reagents/materials/analysis tools: GEC JDL. Wrote the paper: ZD YN SWT ID RD VRI EB.","The authors have declared that no competing interests exist."
"10.1371/journal.pgen.1004797","plos genetics","2014-11-20T00:00:00Z","Di Chen; Chan Wu; Shaowei Zhao; Qing Geng; Yu Gao; Xin Li; Yang Zhang; Zhaohui Wang","State Key Laboratory of Molecular Developmental Biology, Institute of Genetics and Developmental Biology, Chinese Academy of Sciences, Beijing, P.R. China,; The University of Chinese Academy of Sciences, Beijing, P.R. China,","Conceived and designed the experiments: DC ZW. Performed the experiments: DC CW YG XL YZ. Analyzed the data: DC ZW. Wrote the paper: ZW. Participated in the genetic screen: SZ QG.","The authors have declared that no competing interests exist."
"10.1371/journal.pgen.1004795","plos genetics","2014-11-20T00:00:00Z","Amanda R Haltom; Tom V Lee; Beth M Harvey; Jessica Leonardi; Yi-Jiun Chen; Yang Hong; Robert S Haltiwanger; Hamed Jafar-Nejad","Program in Genes & Development, The University of Texas Graduate School of Biomedical Sciences, Houston, Texas, United States of America; Department of Molecular & Human Genetics, Baylor College of Medicine, Houston, Texas, United States of America; Department of Biochemistry and Cell Biology, Stony Brook University, Stony Brook, New York, United States of America; Program in Developmental Biology, Baylor College of Medicine, Houston, Texas, United States of America; Department of Cell Biology, University of Pittsburgh School of Medicine, Pittsburgh, Pennsylvania, United States of America","Conceived and designed the experiments: ARH TVL BMH JL RSH HJN. Performed the experiments: ARH TVL BMH JL YJC. Analyzed the data: ARH TVL BMH JL RSH HJN. Contributed reagents/materials/analysis tools: BMH YJC YH RSH. Wrote the paper: ARH TVL BMH JL YJC YH RSH HJN.","The authors have declared that no competing interests exist."
"10.1371/journal.pbio.1001013","plos biology","2011-02-08T00:00:00Z","Anna Kalinovsky; Fatiha Boukhtouche; Richard Blazeski; Caroline Bornmann; Noboru Suzuki; Carol A Mason; Peter Scheiffele","Department of Physiology & Cellular Biophysics and Department of Neuroscience, Columbia University, New York, New York, United States of America; Biozentrum, University of Basel, Basel, Switzerland; Department of Pathology & Cell Biology and Department of Neuroscience and Ophthalmology, Columbia University, New York, New York, United States of America; Mie University Life Science Research Center of Animal Genomics, Functional Genomics Institute, Japan","The author(s) have made the following declarations about their contributions: Conceived and designed the experiments: AK FB CAM PS. Performed the experiments: AK, FB, RB, CB. Analyzed the data: AK FB RB CAM PS. Contributed reagents/materials/analysis tools: AK, FB, NS, CAM, PS. Wrote the paper: AK FB CAM PS.","The authors have declared that no competing interests exist."
"10.1371/journal.ppat.0010006","plos pathogens","2005-07-22T00:00:00Z","Viviana Simon; Veronique Zennou; Deya Murray; Yaoxing Huang; David D Ho; Paul D Bieniasz","Aaron Diamond AIDS Research Center, The Rockefeller University, New York, New York, United States of America","VS, DDH, and PDB conceived and designed the experiments. VS, VZ, DM, and YH performed the experiments. VS and PDB wrote the paper.","The authors have declared that no competing interests exist."
"10.1371/journal.pgen.1004838","plos genetics","2014-12-04T00:00:00Z","Julie Jaquiéry; Solenn Stoeckel; Chloé Larose; Pierre Nouhaud; Claude Rispe; Lucie Mieuzet; Joël Bonhomme; Frédérique Mahéo; Fabrice Legeai; Jean-Pierre Gauthier; Nathalie Prunier-Leterme; Denis Tagu; Jean-Christophe Simon","INRA, UMR1349, Institute of Genetics, Environment and Plant Protection, Domaine de la Motte, Le Rheu, France; INRIA Centre Rennes - Bretagne Atlantique, GenOuest, Campus de Beaulieu, Rennes, France","Conceived and designed the experiments: DT JCS JJ SS. Performed the experiments: JJ SS LM JB FL FM PN CR NPL CL. Analyzed the data: JJ CL PN LM. Contributed reagents/materials/analysis tools: JPG. Wrote the paper: JJ JCS.","The authors have declared that no competing interests exist."
"10.1371/journal.pgen.1004836","plos genetics","2014-12-04T00:00:00Z","Giulia Moriggi; Blanca Nieto; Mercedes Dosil","Centro de Investigación del Cáncer and Instituto de Biología Molecular y Celular del Cáncer (IBMCC), CSIC-University of Salamanca, Salamanca, Spain; Departamento de Bioquímica y Biología Molecular, University of Salamanca, Salamanca, Spain","Conceived and designed the experiments: GM MD. Performed the experiments: GM BN. Analyzed the data: GM MD. Wrote the paper: MD.","The authors have declared that no competing interests exist."
"10.1371/journal.pbio.1001059","plos biology","2011-05-03T00:00:00Z","Erin L Barnhart; Kun-Chun Lee; Kinneret Keren; Alex Mogilner; Julie A Theriot","Department of Biochemistry and Howard Hughes Medical Institute, Stanford School of Medicine, Stanford, California, United States of America; Department of Mathematics, University of California, Davis, California, United States of America; Department of Physics and Russell Berrie Nanotechnology Institute, Technion – Israel Institute of Technology, Haifa, Israel; Department of Microbiology and Immunology, Stanford School of Medicine, Stanford, California, United States of America","The author(s) have made the following declarations about their contributions: Conceived and designed the experiments: ELB KK JAT. Performed the experiments: ELB. Analyzed the data: ELB KL AM. Wrote the paper: ELB KL AM JAT. Developed the model: AM KL ELB KK JAT. Performed model simulations: KL AM.","The authors have declared that no competing interests exist."
"10.1371/journal.ppat.0010010","plos pathogens","2005-09-30T00:00:00Z","Joy Loh; Qiulong Huang; Andrew M Petros; David Nettesheim; Linda F van Dyk; Lucia Labrada; Samuel H Speck; Beth Levine; Edward T Olejniczak; Herbert W Virgin","Departments of Pathology and Immunology and Molecular Microbiology, Washington University School of Medicine, St. Louis, Missouri, United States of America; Pharmaceutical Discovery Division, Abbott Laboratories, Abbott Park, Illinois, United States of America; Department of Microbiology, University of Colorado Health Science Center, Aurora, Colorado, United States of America; Department of Medicine, Columbia College of Physicians and Surgeons, New York, New York, United States of America; Division of Microbiology and Immunology, Yerkes Regional Primate Center, Emory University, Atlanta, Georgia, United States of America; Departments of Internal Medicine and Microbiology, University of Texas Southwestern Medical Center, Dallas, Texas, United States of America","All authors participated in conception and design of the experiments. JL, QH, LFvD, and LL performed the experiments. All authors participated in analysis of the data. JL, QH, BL, ETO, and HWV wrote the paper.","The authors have declared that no competing interests exist."
"10.1371/journal.pbio.1001057","plos biology","2011-05-03T00:00:00Z","Skyler L Jackman; Norbert Babai; James J Chambers; Wallace B Thoreson; Richard H Kramer","Department of Physics, University of California, Berkeley, Berkeley, California, United States of America; Department of Ophthalmology, University of Nebraska Medical Center, Omaha, Nebraska, United States of America; Department of Chemistry, University of Massachusetts, Amherst, Amherst, Massachusetts, United States of America; Department of Molecular and Cell Biology, University of California, Berkeley, Berkeley, California, United States of America","The author(s) have made the following declarations about their contributions: Designed and synthesized photolyzable NVOC-AMPA: JJC. Conceived and designed the experiments: SLJ WBT RHK. Performed the experiments: SLJ NB. Analyzed the data: SLJ NB. Wrote the paper: SLJ RHK.","The authors have declared that no competing interests exist."
"10.1371/journal.ppat.0010008","plos pathogens","2005-09-30T00:00:00Z","Nathan S Blow; Robert N Salomon; Kerry Garrity; Isabelle Reveillaud; Alan Kopin; F Rob Jackson; Paula I Watnick","Department of Geographic Medicine and Infectious Diseases, Tufts-New England Medical Center, Boston, Massachusetts, United States of America; Department of Pathology, Tufts-New England Medical Center, Boston, Massachusetts, United States of America; Molecular Cardiology Research Institute, Tufts-New England Medical Center, Boston, Massachusetts, United States of America; Department of Neurosciences, Tufts University School of Medicine, Boston, Massachusetts, United States of America","NSB, RNS, AK, FRJ, and PIW conceived and designed the experiments. NSB and RNS performed the experiments. NSB, RNS, and PIW analyzed the data. KG, IR, and AK contributed reagents/materials/analysis tools. NSB and PIW wrote the paper.","The authors have declared that no competing interests exist."
"10.1371/journal.pgen.1004837","plos genetics","2014-12-11T00:00:00Z","Saheed Imam; Daniel R Noguera; Timothy J Donohue","Program in Cellular and Molecular Biology, University of Wisconsin – Madison, Madison, Wisconsin, United States of America; Department of Bacteriology, University of Wisconsin – Madison, Wisconsin Energy Institute, Madison, Wisconsin, United States of America; DOE Great Lakes Bioenergy Research Center, University of Wisconsin – Madison, Madison, Wisconsin, United States of America; Department of Civil and Environmental Engineering, University of Wisconsin – Madison, Madison, Wisconsin, United States of America","Conceived and designed the experiments: SI DRN TJD. Performed the experiments: SI. Analyzed the data: SI DRN TJD. Contributed reagents/materials/analysis tools: SI. Wrote the paper: SI DRN TJD.","The authors have declared that no competing interests exist."
"10.1371/journal.pbio.1001034","plos biology","2011-03-29T00:00:00Z","Marijke Brams; Anshul Pandya; Dmitry Kuzmin; René van Elk; Liz Krijnen; Jerrel L Yakel; Victor Tsetlin; August B Smit; Chris Ulens","Laboratory of Structural Neurobiology, KULeuven, Leuven, Belgium; Laboratory of Neurobiology, National Institute of Environmental Health Sciences, National Institutes of Health, Department of Health and Human Services, Research Triangle Park, North Carolina, United States of America; Department of Molecular Basis of Neurosignaling, Shemyakin-Ovchinnikov Institute of Bioorganic Chemistry, Russian Academy of Sciences, Moscow, Russia; Department of Molecular & Cellular Neurobiology, Center for Neurogenomics and Cognitive Research, Neuroscience Campus Amsterdam, VU University, Amsterdam, The Netherlands","The author(s) have made the following declarations about their contributions: Conceived and designed the experiments: JLY VT ABS CU. Performed the experiments: MB AP DK RVE LK CU. Analyzed the data: MB AP DK RVE JLY VT ABS CU. Contributed reagents/materials/analysis tools: MB AP DK RVE. Wrote the paper: AP DK JLY VT ABS CU.","The authors have declared that no competing interests exist."
"10.1371/journal.pgen.1004818","plos genetics","2014-12-04T00:00:00Z","Brandon L Pierce; Lin Tong; Lin S Chen; Ronald Rahaman; Maria Argos; Farzana Jasmine; Shantanu Roy; Rachelle Paul-Brutus; Harm-Jan Westra; Lude Franke; Tonu Esko; Rakibuz Zaman; Tariqul Islam; Mahfuzar Rahman; John A Baron; Muhammad G Kibriya; Habibul Ahsan","Department of Public Health Sciences, The University of Chicago, Chicago, Illinois, United States of America; Comprehensive Cancer Center, The University of Chicago, Chicago, Illinois, United States of America; University of Groningen, University Medical Center Groningen, Groningen, The Netherlands; Estonian Genome Center, University of Tartu, Tartu, Estonia; UChicago Research Bangladesh, Mohakhali, Dhaka, Bangladesh; Research and Evaluation Division, BRAC, Dhaka, Bangladhesh; University of North Carolina, Lineberger Comprehensive Cancer Center, Chapel Hill, North Carolina, United States of America; Department of Medicine The University of Chicago, Chicago, Illinois, United States of America; Department of Human Genetics, The University of Chicago, Chicago, Illinois, United States of America","Conceived and designed the experiments: BLP MGK HA. Performed the experiments: RR FJ SR RPB MGK. Analyzed the data: BLP LT LSC HJW. Contributed reagents/materials/analysis tools: HJW LF TE RZ TI MR JAB HA. Wrote the paper: BLP LT LSC RR MA HJW LF JAB MGK HA.","The authors have declared that no competing interests exist."
"10.1371/journal.pgen.1004816","plos genetics","2014-12-04T00:00:00Z","Jennifer H Wisecaver; Jason C Slot; Antonis Rokas","Department of Biological Sciences, Vanderbilt University, Nashville, Tennessee, United States of America; Department of Plant Pathology, The Ohio State University, Columbus, Ohio, United States of America","Conceived and designed the experiments: JHW JCS AR. Performed the experiments: JHW JCS. Analyzed the data: JHW JCS AR. Contributed reagents/materials/analysis tools: JHW JCS. Wrote the paper: JHW JCS AR.","The authors have declared that no competing interests exist."
"10.1371/journal.pbio.1001033","plos biology","2011-03-22T00:00:00Z","Hannes Mutschler; Maike Gebhardt; Robert L Shoeman; Anton Meinhart","Department of Biomolecular Mechanisms, Max Planck Institute for Medical Research, Heidelberg, Germany","The author(s) have made the following declarations about their contributions: Conceived and designed the experiments: HM RLS AM. Performed the experiments: HM MG RLS AM. Analyzed the data: HM RLS AM. Contributed reagents/materials/analysis tools: AM. Wrote the paper: HM AM.","The authors have declared that no competing interests exist."
"10.1371/journal.pgen.1004814","plos genetics","2015-01-08T00:00:00Z","Fatih Arslan; Joo Y Hong; Vydehi Kanneganti; Sei-Kyoung Park; Susan W Liebman","Department of Biological Sciences, University of Illinois at Chicago, Chicago, Illinois, United States of America; Department of Biochemistry and Molecular Biology, University of Nevada, Reno, Nevada, United States of America","Conceived and designed the experiments: FA JYH SWL. Performed the experiments: FA JYH VK SKP. Analyzed the data: FA SWL. Contributed reagents/materials/analysis tools: FA JYH SKP VK. Wrote the paper: FA SWL.","The authors have declared that no competing interests exist."
"10.1371/journal.pbio.1001040","plos biology","2011-04-05T00:00:00Z","Lianwei Peng; Yoichiro Fukao; Fumiyoshi Myouga; Reiko Motohashi; Kazuo Shinozaki; Toshiharu Shikanai","Department of Botany, Graduate School of Science, Kyoto University, Sakyo-ku, Kyoto, Japan; Plant Global Educational Project, Graduate School of Biological Sciences, Nara Institute of Science and Technology, Takayama, Ikoma, Nara, Japan; Gene Discovery Research Group, RIKEN Plant Science Center, Yokohama, Japan; Faculty of Agriculture, University of Shizuoka, Shizuoka, Japan","The author(s) have made the following declarations about their contributions: Conceived and designed the experiments: LP TS. Performed the experiments: LP YF. Analyzed the data: LP YF . Contributed reagents/materials/analysis tools: FM RM KS. Wrote the paper: LP TS.","The authors have declared that no competing interests exist."
"10.1371/journal.pgen.1004815","plos genetics","2014-11-20T00:00:00Z","Joe H Pogson; Rachael M Ivatt; Alvaro Sanchez-Martinez; Roberta Tufi; Emma Wilson; Heather Mortiboys; Alexander J Whitworth","MRC Centre for Developmental and Biomedical Genetics, Sheffield, United Kingdom; Department of Biomedical Sciences, University of Sheffield, Sheffield, United Kingdom; Sheffield Institute for Translational Neuroscience, University of Sheffield, Sheffield, United Kingdom","Conceived and designed the experiments: JHP AJW. Performed the experiments: JHP RMI ASM RT EW. Analyzed the data: JHP RMI ASM RT HM AJW. Contributed reagents/materials/analysis tools: HM. Wrote the paper: AJW.","The authors have declared that no competing interests exist."
"10.1371/journal.pgen.1004827","plos genetics","2014-12-04T00:00:00Z","Stefania Bottardi; Lionel Mavoungou; Helen Pak; Salima Daou; Vincent Bourgoin; Yahia A Lakehal; El Bachir Affar; Eric Milot","Maisonneuve Rosemont Hospital Research Center, Maisonneuve-Rosemont Hospital and Faculty of Medicine, University of Montreal, Montreal, Quebec, Canada","Conceived and designed the experiments: SB EM. Performed the experiments: SB LM HP SD VB YAL. Analyzed the data: SB EM EBA. Wrote the paper: SB EM EBA.","The authors have declared that no competing interests exist."
"10.1371/journal.pbio.1001048","plos biology","2011-04-19T00:00:00Z","Valeria Zampini; Lukas Rüttiger; Stuart L Johnson; Christoph Franz; David N Furness; Jörg Waldhaus; Hao Xiong; Carole M Hackney; Matthew C Holley; Nina Offenhauser; Pier Paolo Di Fiore; Marlies Knipper; Sergio Masetto; Walter Marcotti","Department of Biomedical Science, University of Sheffield, Sheffield, United Kingdom; Department of Physiology, University of Pavia, Pavia, Italy; Department of Otolaryngology, THR, University of Tübingen, Tübingen, Germany; Institute for Science and Technology in Medicine, Keele University, Keele, United Kingdom; Department of Otolaryngology-Head & Neck Surgery, Tongji Hospital, Tongji Medical College, Huazhong University of Science & Technology, Wuhan, China; IFOM, Fondazione Istituto FIRC di Oncologia Molecolare, Milan, Italy; Istituto Europeo di Oncologia, Milan, Italy; Dipartimento di Medicina, Chirurgia e Odontoiatria, Università degli Studi di Milano, Milan, Italy","The author(s) have made the following declarations about their contributions: Conceived and designed the experiments: WM. Performed the experiments: VZ LR SLJ CF DNF JW HX CMH WM. Analyzed the data: VZ LR SLJ CF DNF JW HX CMH MCH MK WM. Contributed reagents/materials/analysis tools: NO PPDF. Wrote the paper: SM WM.","The authors have declared that no competing interests exist."
"10.1371/journal.pgen.1004824","plos genetics","2014-12-04T00:00:00Z","Anja Wartenberg; Jörg Linde; Ronny Martin; Maria Schreiner; Fabian Horn; Ilse D Jacobsen; Sabrina Jenull; Thomas Wolf; Karl Kuchler; Reinhard Guthke; Oliver Kurzai; Anja Forche; Christophe d'Enfert; Sascha Brunke; Bernhard Hube","Department of Microbial Pathogenicity Mechanisms, Leibniz Institute for Natural Product Research and Infection Biology – Hans Knoell Institute Jena (HKI), Jena, Germany; Research Group Systems Biology & Bioinformatics, Leibniz Institute for Natural Product Research and Infection Biology – Hans Knoell Institute Jena (HKI), Jena, Germany; Septomics Research Center, Friedrich Schiller University and Leibniz Institute for Natural Product Research and Infection Biology –Hans Knoell Institute, Jena, Germany; Research Group Microbial Immunology, Leibniz Institute for Natural Product Research and Infection Biology – Hans Knoell Institute Jena (HKI), Jena, Germany; Medical University Vienna, Max F. Perutz Laboratories, Department of Medical Biochemistry, Vienna, Austria; Department of Biology, Bowdoin College, Brunswick, Maine, United States of America; Institut Pasteur, Unité Biologie et Pathogénicité Fongiques, Département Génomes et Génétique, Paris, France; INRA, USC2019, Paris, France; Integrated Research and Treatment Center, Sepsis und Sepsisfolgen, Center for Sepsis Control and Care (CSCC), Universitätsklinikum Jena, Germany; Friedrich Schiller University, Jena, Germany","Conceived and designed the experiments: AW RM IDJ KK OK AF Cd SB BH. Performed the experiments: AW RM MS IDJ SJ AF Cd. Analyzed the data: AW JL RM FH IDJ SJ TW AF Cd SB. Contributed reagents/materials/analysis tools: IDJ AF RG OK Cd SB BH. Wrote the paper: AW RM SJ AF Cd SB RG BH.","The authors have declared that no competing interests exist."
"10.1371/journal.pgen.1004775","plos genetics","2014-11-06T00:00:00Z","Alan O Bergland; Emily L Behrman; Katherine R O'Brien; Paul S Schmidt; Dmitri A Petrov","Department of Biology, Stanford University, Stanford, California, United States of America; Department of Biology, University of Pennsylvania, Philadelphia, Pennsylvania, United States of America","Conceived and designed the experiments: AOB ELB KRO PSS DAP. Analyzed the data: AOB PSS DAP. Contributed reagents/materials/analysis tools: AOB ELB KRO PSS. Wrote the paper: AOB PSS DAP.","The authors have declared that no competing interests exist."
"10.1371/journal.pbio.1000613","plos biology","2011-04-26T00:00:00Z","Coraline Brangbour; Olivia du Roure; Emmanuèle Helfer; Damien Démoulin; Alexis Mazurier; Marc Fermigier; Marie-France Carlier; Jérôme Bibette; Jean Baudry","Laboratoire Colloïdes et Matériaux Divisés, UPMC, ESPCI ParisTech, CNRS PECSA UMR 7195, Paris, France; Physique et Mécanique des Milieux Hétérogènes, ESPCI ParisTech, CNRS UMR 7636, UPMC, Université Denis Diderot, Paris, France; Laboratoire d'Enzymologie et Biochimie Structurales, CNRS UPR 3082, Gif-sur-Yvette, France","The author(s) have made the following declarations about their contributions: Conceived and designed the experiments: M Fermigier, MF Carlier, J Bibette, J Baudry. Performed the experiments: C Brangbour, D Démoulin, A Mazurier. Analyzed the data: C Brangbour, O du Roure, E Helfer, M Fermigier, MF Carlier, J Bibette, J Baudry. Contributed reagents/materials/analysis tools: C Brangbour, O du Roure, E Helfer, MF Carlier, J Baudry. Wrote the paper: O du Roure, J Bibette, J Baudry.","The authors have declared that no competing interests exist."
"10.1371/journal.pbio.1000611","plos biology","2011-04-19T00:00:00Z","Marisa Müller; Roland Gerhard Heym; Andreas Mayer; Katharina Kramer; Maria Schmid; Patrick Cramer; Henning Urlaub; Ralf-Peter Jansen; Dierk Niessing","Institute of Structural Biology, Helmholtz Zentrum München–German Research Center for Environmental Health, München, Germany; Gene Center and Department of Biochemistry, Ludwig-Maximilians-University, München, Germany; Bioanalytical Mass Spectrometry Group, Max Planck Institute for Biophysical Chemistry, Göttingen, Germany; Center for Integrated Protein Science CIPSM, München, Germany; Interfaculty Institute for Biochemistry, University of Tübingen, Tübingen, Germany","The author(s) have made the following declarations about their contributions: Conceived and designed the experiments: MM RGH AM KK RPJ DN. Performed the experiments: MM RGH AM KK MS RPJ. Analyzed the data: MM RGH AM KK MS PC HU RPJ DN. Contributed reagents/materials/analysis tools: MM RGH AM KK PC HU RPJ DN. Wrote the paper: MM RGH DN.","The authors have declared that no competing interests exist."
"10.1371/journal.pbio.1000618","plos biology","2011-05-17T00:00:00Z","Matthew P Neilson; Douwe M Veltman; Peter J M van Haastert; Steven D Webb; John A Mackenzie; Robert H Insall","Cancer Research UK Beatson Institute, Glasgow, United Kingdom; Department of Cell Biochemistry, University of Groningen, Groningen, The Netherlands; Department of Mathematics and Statistics, University of Strathclyde, Glasgow, United Kingdom","The author(s) have made the following declarations about their contributions: Conceived and designed the experiments: MPN PJMVH SDW JAM RHI. Performed the experiments: MPN DMV. Analyzed the data: MPN PJMVH JAM RHI. Contributed reagents/materials/analysis tools: DMV. Wrote the paper: MPN PJMVH SDW JAM RHI.","The authors have declared that no competing interests exist."
