"id","journal","publication_date","author","author_affiliate","author_notes","competing_interest"
"10.1371/journal.pbio.1000115","plos biology","2009-05-26T00:00:00Z","Károly Kovács; Laurence D Hurst; Balázs Papp","Institute of Biochemistry, Biological Research Center, Szeged, Hungary; Department of Biology and Biochemistry, University of Bath, Bath, United Kingdom","The author(s) have made the following declarations about their contributions: Conceived and designed the experiments: KK LDH BP. Performed the experiments: KK BP. Analyzed the data: KK LDH BP. Contributed reagents/materials/analysis tools: KK LDH BP. Wrote the paper: LDH BP.","The authors have declared that no competing interests exist."
"10.1371/journal.pbio.1000116","plos biology","2009-05-26T00:00:00Z","Yongli Shan; Lihou Yu; Yan Li; Youdong Pan; Qiangge Zhang; Fubin Wang; Jianfeng Chen; Xueliang Zhu","Laboratory of Molecular Cell Biology, Institute of Biochemistry and Cell Biology, Shanghai Institutes for Biological Sciences, Chinese Academy of Sciences, Shanghai, China","The author(s) have made the following declarations about their contributions: Conceived and designed the experiments: YS LY YL YP JC XZ. Performed the experiments: YS LY YL YP. Analyzed the data: YS LY XZ. Contributed reagents/materials/analysis tools: QZ FW. Wrote the paper: YS XZ. Commented on the manuscript: JC.","The authors have declared that no competing interests exist."
"10.1371/journal.pgen.1004301","plos genetics","2014-04-17T00:00:00Z","Ayako Oka; Toyoyuki Takada; Hironori Fujisawa; Toshihiko Shiroishi","Transdisciplinary Research Integration Center, Research Organization of Information and Systems, Toranomon, Tokyo, Japan; Mammalian Genetics Laboratory, National Institute of Genetics, Mishima, Shizuoka, Japan; The Institute of Statistical Mathematics, Tachikawa, Tokyo, Japan","Conceived and designed the experiments: AO TS. Performed the experiments: AO. Analyzed the data: AO HF. Contributed reagents/materials/analysis tools: TT HF. Wrote the paper: AO TS.","The authors have declared that no competing interests exist."
"10.1371/journal.pgen.1004300","plos genetics","2014-05-01T00:00:00Z","Rafal Mostowy; Nicholas J Croucher; William P Hanage; Simon R Harris; Stephen Bentley; Christophe Fraser","Department of Infectious Disease Epidemiology, Imperial College London, St Mary's Campus, London, United Kingdom; Center for Communicable Disease Dynamics, Harvard School of Public Health, Boston, Massachusetts, United States of America; The Wellcome Trust Sanger Institute, Wellcome Trust Genome Campus, Hinxton, Cambridge, United Kingdom; Department of Medicine, University of Cambridge, Addenbrookes Hospital, Cambridge, United Kingdom","Conceived and designed the experiments: CF. Performed the experiments: RM NJC CF. Analyzed the data: RM NJC CF. Contributed reagents/materials/analysis tools: SRH SB CF. Wrote the paper: RM NJC WPH CF. Aided the correct interpretation of the findings: WPH. These authors contributed equally to this article: RM NJC.","The authors have declared that no competing interests exist."
"10.1371/journal.pbio.1000121","plos biology","2009-06-02T00:00:00Z","Hasan Korkaya; Amanda Paulson; Emmanuelle Charafe-Jauffret; Christophe Ginestier; Marty Brown; Julie Dutcher; Shawn G Clouthier; Max S Wicha","Comprehensive Cancer Center, Department of Internal Medicine, University of Michigan, Ann Arbor, Michigan, United States of America; Laboratory of Molecular Oncology, Marseille Cancer Research Institute, UMR 599 Inserm/Institut Paoli – Calmettes, Marseille, France","The author(s) have made the following declarations about their contributions: Conceived and designed the experiments: HK MW. Performed the experiments: HK AP MB JD. Analyzed the data: HK MW. Contributed reagents/materials/analysis tools: ECJ CG SGC. Wrote the paper: HK MW.","MSW holds equity in and is a scientific consultant for OncoMed Pharmaceuticals."
"10.1371/journal.pgen.1004328","plos genetics","2014-05-08T00:00:00Z","Lizhi Ian Gong; Jesse D Bloom","Division of Basic Sciences and Computational Biology Program, Fred Hutchinson Cancer Research Center, Seattle, Washington, United States of America","Conceived and designed the experiments: JDB. Performed the experiments: LIG. Analyzed the data: JDB LIG. Contributed reagents/materials/analysis tools: JDB. Wrote the paper: JDB.","The authors have declared that no competing interests exist."
"10.1371/journal.pbio.1000139","plos biology","2009-06-30T00:00:00Z","Jun Liu; James M Elmore; Anja T Fuglsang; Michael G Palmgren; Brian J Staskawicz; Gitta Coaker","Department of Plant Pathology, University of California Davis, Davis, California, United States of America; Centre for Membrane Pumps in Cells and Disease—PUMPKIN, Danish National Research Foundation, Århus and Copenhagen, Denmark; Plant Physiology and Anatomy Laboratory, Department of Plant Biology, University of Copenhagen, Frederiksberg, Denmark; Department of Plant and Microbial Biology, University of California Berkeley, Berkeley, California, United States of America","The author(s) have made the following declarations about their contributions: Conceived and designed the experiments: JL MGP BJS GC. Performed the experiments: JL JME ATF GC. Analyzed the data: JL GC. Contributed reagents/materials/analysis tools: BJS. Wrote the paper: JL JME ATF MGP BJS GC.","The authors have declared that no competing interests exist."
"10.1371/journal.pgen.1004327","plos genetics","2014-05-08T00:00:00Z","Christopher S Campbell; Hans Hombauer; Anjana Srivatsan; Nikki Bowen; Kerstin Gries; Arshad Desai; Christopher D Putnam; Richard D Kolodner","Ludwig Institute for Cancer Research, University of California School of Medicine, San Diego, La Jolla, California, United States of America; German Cancer Research Center (DKFZ), Im Neuenheimer Feld 581, Heidelberg, Germany; Department of Cellular and Molecular Medicine, University of California School of Medicine, San Diego, La Jolla, California, United States of America; Moores-UCSD Cancer Center, University of California School of Medicine, San Diego, La Jolla, California, United States of America; Department of Medicine, University of California School of Medicine, San Diego, La Jolla, California, United States of America","Conceived and designed the experiments: CSC HH CDP RDK. Performed the experiments: CSC HH AS NB KG CDP. Analyzed the data: CSC HH AS AD CDP RDK. Contributed reagents/materials/analysis tools: NB. Wrote the paper: CSC HH AS NB KG AD CDP RDK.","The authors have declared that no competing interests exist."
"10.1371/journal.pgen.1004335","plos genetics","2014-05-29T00:00:00Z","Deanna L Howarth; Claudia Lindtner; Ana M Vacaru; Ravi Sachidanandam; Orkhontuya Tsedensodnom; Taisa Vasilkova; Christoph Buettner; Kirsten C Sadler","Department of Medicine – Division of Liver Diseases, Icahn School of Medicine at Mount Sinai, New York, New York, United States of America; Department of Developmental and Regenerative Biology, Icahn School of Medicine at Mount Sinai, New York, New York, United States of America; Department of Medicine – Division of Endocrinology, Diabetes, and Bone Disease, Icahn School of Medicine at Mount Sinai, New York, New York, United States of America; Diabetes and Metabolism Institute, Icahn School of Medicine at Mount Sinai, New York, New York, United States of America; Department of Genetics and Genomic Sciences, Icahn School of Medicine at Mount Sinai, New York, New York, United States of America; Graduate School of Biomedical Sciences, Icahn School of Medicine at Mount Sinai, New York, New York, United States of America","Conceived and designed the experiments: DLH CL RS CB KCS. Performed the experiments: DLH CL RS OT AMV TV. Analyzed the data: DLH RS OT KCS AMV TV CL CB. Contributed reagents/materials/analysis tools: DLH RS. Wrote the paper: DLH RS OT AMV KCS CL CB.","The authors have declared that no competing interests exist."
"10.1371/journal.pbio.1000144","plos biology","2009-06-30T00:00:00Z","Andrew Balmford; James Beresford; Jonathan Green; Robin Naidoo; Matt Walpole; Andrea Manica","Department of Zoology, University of Cambridge, Cambridge, United Kingdom; Conservation Science Program, World Wildlife Fund–US, Washington, DC, United States of America; Fauna and Flora International, Cambridge, United Kingdom","The author(s) have made the following declarations about their contributions: Conceived and designed the experiments: AB RN MW AM. Performed the experiments: AB JB JG RN MW AM. Analyzed the data: AB JB JG AM. Wrote the paper: AB RN AM. Obtained grant: AB.","The authors have declared that no competing interests exist."
"10.1371/journal.pgen.1004333","plos genetics","2014-05-15T00:00:00Z","Gina M DeStefano; Mazen Kurban; Kwame Anyane-Yeboa; Claudia Dall'Armi; Gilbert Di Paolo; Heather Feenstra; Nanette Silverberg; Luis Rohena; Larissa D López-Cepeda; Vaidehi Jobanputra; Katherine A Fantauzzo; Maija Kiuru; Marija Tadin-Strapps; Antonio Sobrino; Anna Vitebsky; Dorothy Warburton; Brynn Levy; Julio C Salas-Alanis; Angela M Christiano","Department of Genetics and Development, Columbia University, New York, New York, United States of America; Department of Dermatology, Columbia University, New York, New York, United States of America; Department of Pediatrics, Columbia University Medical Center, New York, New York, United States of America; Department of Pathology and Cell Biology, Columbia University, New York, New York, United States of America; Taub Institute for Research on Alzheimer's Disease and the Aging Brain, Columbia University Medical Center, New York, New York, United States of America; St. Luke's-Roosevelt Hospital Center, New York, New York, United States of America; Centro Dermatológico Pascua, Mexico City, Mexico; New York Presbyterian Hospital, New York, New York, United States of America; Basic Science, Universidad de Monterrey, Nueva Leon, Mexico","Conceived and designed the experiments: GMD AMC. Performed the experiments: GMD. Analyzed the data: GMD CD GDP. Contributed reagents/materials/analysis tools: CD GDP. Wrote the paper: GMD. Performed autophagy analysis and filipin staining: CD. Performed experiments and analyses in sporadic CGHT case: GMD MKu VJ KAF MKi MTS AS AV DW BL. Performed clinical evaluations of the patients and provided clinical photos: KAY HF NS LR LDLC JCSA.","The authors have declared that no competing interests exist."
"10.1371/journal.pbio.1000148","plos biology","2009-07-07T00:00:00Z","Johannes Mathieu; Levi J Yant; Felix Mürdter; Frank Küttner; Markus Schmid","Max Planck Institute for Developmental Biology, Department of Molecular Biology, Tübingen, Germany","The author(s) have made the following declarations about their contributions: Conceived and designed the experiments: JM LJY MS. Performed the experiments: JM LJY FM FK MS. Analyzed the data: JM LJY MS. Contributed reagents/materials/analysis tools: JM MS. Wrote the paper: JM LJY MS.","The authors have declared that no competing interests exist."
"10.1371/journal.pgen.1004321","plos genetics","2014-05-08T00:00:00Z","Daniel J Coleman; Gloria Garcia; Stephen Hyter; Hyo Sang Jang; Sharmeen Chagani; Xiaobo Liang; Lionel Larue; Gitali Ganguli-Indra; Arup K Indra","Department of Pharmaceutical Sciences, College of Pharmacy, Oregon State University, Corvallis, Oregon, United States of America; Molecular and Cellular Biology Program, Oregon State University, Corvallis, Oregon, United States of America; Developmental Genetics of Melanocytes, Institut Curie, Centre de Recherche, Orsay, France; CNRS UMR3347, Orsay, France; INSERM U1021, Orsay, France; Dermatology Research Division, Oregon Health and Science University, Portland, Oregon, United States of America","Conceived and designed the experiments: AKI GGI LL. Performed the experiments: DJC SH HSJ SC GG XL. Analyzed the data: DJC AKI GGI. Contributed reagents/materials/analysis tools: LL. Wrote the paper: AKI DJC GGI.","The authors have declared that no competing interests exist."
"10.1371/journal.pbio.1000137","plos biology","2009-06-23T00:00:00Z","Derek Greenfield; Ann L McEvoy; Hari Shroff; Gavin E Crooks; Ned S Wingreen; Eric Betzig; Jan Liphardt","Biophysics Graduate Group, University of California Berkeley, Berkeley, California, United States of America; Physical Biosciences Division, Lawrence Berkeley National Laboratory, Berkeley, California, United States of America; Howard Hughes Medical Institute, Janelia Farm Research Campus, Ashburn, Virginia, United States of America; Department of Molecular Biology, Princeton University, Princeton, New Jersey, United States of America; Department of Physics, University of California Berkeley, Berkeley, California, United States of America","The author(s) have made the following declarations about their contributions: Conceived and designed the experiments: DG ALM HS EB JL. Performed the experiments: DG ALM. Analyzed the data: DG ALM NSW EB. Contributed reagents/materials/analysis tools: HS GEC EB JL. Wrote the paper: DG ALM NSW JL.","The authors declare competing financial interests. EB and Harald Hess (Janelia Farm) have licensed the PALM technology to Carl Zeiss Microimaging, GmbH."
"10.1371/journal.pgen.1004323","plos genetics","2014-05-22T00:00:00Z","Nathan J Godde; Julie M Sheridan; Lorey K Smith; Helen B Pearson; Kara L Britt; Ryan C Galea; Laura L Yates; Jane E Visvader; Patrick O Humbert","Cell Cycle and Cancer Genetics Laboratory, Peter MacCallum Cancer Centre, East Melbourne, Victoria, Australia; Sir Peter MacCallum Department of Oncology, University of Melbourne, Parkville, Victoria, Australia; ACRF Stem Cells and Cancer Division, Walter and Eliza Hall Institute, Parkville, Victoria, Australia; Department of Medical Biology, The University of Melbourne, Parkville, Victoria, Australia; Department of Pathology, The University of Melbourne, Parkville, Victoria, Australia; Metastasis Research Laboratory, Peter MacCallum Cancer Centre, East Melbourne, Victoria, Australia; Department of Molecular Biology and Biochemistry, The University of Melbourne, Parkville, Victoria, Australia","Conceived and designed the experiments: NJG POH. Performed the experiments: NJG JMS LKS HBP KLB RCG LLY. Analyzed the data: JEV. Wrote the paper: NJG.","The authors have declared that no competing interests exist."
"10.1371/journal.pbio.1000125","plos biology","2009-06-09T00:00:00Z","Jessica W Tsai; Jens Hannibal; Grace Hagiwara; Damien Colas; Elisabeth Ruppert; Norman F Ruby; H Craig Heller; Paul Franken; Patrice Bourgin","Department of Biology, Stanford University, Stanford, California, United States of America; Department of Clinical Biochemistry, Rigshopitalet, Copenhagen, Denmark; Laboratory of Rhythms - CNRS UMR 7168/LC2, Louis Pasteur University and Department of Neurology - School of Medicine, Strasbourg, France; Center for Integrative Genomics, University of Lausanne, 1015 Lausanne-Dorigny, Switzerland","The author(s) have made the following declarations about their contributions: Responsible for supervision and data collection: PB. Developed the study protocol: JWT, JH, GH, DC, ER, NFR, HCH, PF, PB. Performed anatomical experiments: JH, ER. Performed ECoG recordings and scoring: JT, GH, DC. Analyzed sleep and ECoG: PF. Drafted and prepared the final manuscript: HCH, PF, PB. Reviewed, revised, and approved the final paper: JWT, JH, GH, DC, ER NFR, HCH, PF, PB.","The authors have declared that no competing interests exist."
"10.1371/journal.pgen.1004311","plos genetics","2014-05-01T00:00:00Z","Cybel Mehawej; Agnès Delahodde; Laurence Legeai-Mallet; Valérie Delague; Nabil Kaci; Jean-Pierre Desvignes; Zoha Kibar; José-Mario Capo-Chichi; Eliane Chouery; Arnold Munnich; Valérie Cormier-Daire; André Mégarbané","Unité de Génétique Médicale et Laboratoire International associé INSERM à l'Unité UMR_S 910, Faculté de Médecine, Université Saint-Joseph, Beirut, Lebanon; Département de Génétique, Unité INSERM U781, Université Paris Descartes-Sorbonne Paris Cité, Fondation Imagine, Hôpital Necker Enfants Malades, Paris, France; University of Paris-Sud, CNRS, UMR 8621, Institute of Genetics and Microbiology, Orsay, France; Inserm, UMR_S 910, Marseille, France; Aix Marseille Université, GMGF, Marseille, France; Center of Excellence in Neuroscience of Université de Montréal, Centre de Recherche du CHU Sainte-Justine, Montréal, Canada; Department of Obstetrics and Gynecology, Université de Montréal, Montréal, Canada","Conceived and designed the experiments: AMe VCD AD LLM AMu. Performed the experiments: CM. Analyzed the data: AMe CM VD JPD JMCC ZK. Contributed reagents/materials/analysis tools: NK AD VD EC. Wrote the paper: AMe CM VCD.","The authors have declared that no competing interests exist."
"10.1371/journal.pbio.1000124","plos biology","2009-06-09T00:00:00Z","Isabelle d'Erfurth; Sylvie Jolivet; Nicole Froger; Olivier Catrice; Maria Novatchkova; Raphaël Mercier","INRA, UR254, IJPB, Versailles. France; CNRS, UPR2355, Gif sur Yvette, France; Research Institute of Molecular Pathology (IMP), Vienna, Austria","The author(s) have made the following declarations about their contributions: Conceived and designed the experiments: Id'E RM. Performed the experiments: Id'E SJ NF MN RM. Analyzed the data: Id'E MN RM. Contributed reagents/materials/analysis tools: OC MN. Wrote the paper: Id'E RM.","European patent EP09290010, “Plants producing 2N gametes or apomeiotic gametes,” was deposited by INRA on 7 January 2009."
"10.1371/journal.pbio.1000123","plos biology","2009-06-09T00:00:00Z","Zahra Kadri; Ritsuko Shimizu; Osamu Ohneda; Leila Maouche-Chretien; Sylvie Gisselbrecht; Masayuki Yamamoto; Paul-Henri Romeo; Philippe Leboulch; Stany Chretien","CEA, Institute of Emerging Diseases and Innovative Therapies, Fontenay-aux-Roses, France; UMR INSERM U.962, University Paris XI, CEA, Fontenay-aux-Roses, France; Département d'Hématologie, INSERM U567, CNRS UMR 8104, Institute Cochin and University Paris V René Descartes, Paris, France; Department of Molecular and Developmental Biology, Center for TARA, ERATO Environmental Response Project, University of Tsukuba, Tsukuba, Japan; Genetics Division, Department of Medicine, Brigham & Women's Hospital and Harvard Medical School, Boston, Massachusetts, United States of America","The author(s) have made the following declarations about their contributions: Conceived and designed the experiments: ZK RS OO MY SC. Performed the experiments: ZK RS OO SC. Analyzed the data: ZK LM-C SG MY P-HR PL SC. Wrote the paper: PL SC. Originator of the central hypothesis: SC.","The authors have declared that no competing interests exist."
"10.1371/journal.pgen.1004306","plos genetics","2014-04-24T00:00:00Z","Yvonne Heilig; Anne Dettmann; Rosa R Mouriño-Pérez; Kerstin Schmitt; Oliver Valerius; Stephan Seiler","Institute for Biology II – Molecular Plant Physiology, Albert-Ludwigs University Freiburg, Freiburg, Germany; Department of Microbiology, Center for Scientific Research and Higher Education of Ensenada (CICESE), Baja California, Mexico; Institute for Microbiology and Genetics, University of Goettingen, Goettingen, Germany; Freiburg Institute for Advanced Studies (FRIAS), Albert-Ludwigs University Freiburg, Freiburg, Germany","Conceived and designed the experiments: YH SS. Performed the experiments: YH AD RRMP KS OV. Analyzed the data: YH AD RRMP KS OV SS. Wrote the paper: YH SS.","The authors have declared that no competing interests exist."
"10.1371/journal.pbio.1000119","plos biology","2009-05-26T00:00:00Z","Jinglan Liu; Zhe Zhang; Masashige Bando; Takehiko Itoh; Matthew A Deardorff; Dinah Clark; Maninder Kaur; Stephany Tandy; Tatsuro Kondoh; Eric Rappaport; Nancy B Spinner; Hugo Vega; Laird G Jackson; Katsuhiko Shirahige; Ian D Krantz","Division of Human Genetics, Abramson Research Institute, The Children's Hospital of Philadelphia, Philadelphia, Pennsylvania, United States of America; Center for Biomedical Informatics, The Children's Hospital of Philadelphia, Philadelphia, Pennsylvania, United States of America; Laboratory of Chromosome Structure and Function, Department of Biological Science, Graduate School of Bioscience and Biotechnology, Tokyo Institute of Technology, Yokohama City, Kanagawa, Japan; The University of Pennsylvania School of Medicine, Philadelphia, Pennsylvania, United States of America; Division of Developmental Disability, Misakaenosono Mutsumi Developmental, Medical, and Welfare Center, Isahaya, Japan; NAPCORE, The Children's Hospital of Philadelphia, Philadelphia, Pennsylvania, United States of America; Instituto de Genética, Universidad Nacional de Colombia, Bogotá, Colombia; Department of Obstetrics and Gynecology, Drexel University School of Medicine, Philadelphia, Pennsylvania, United States of America","The author(s) have made the following declarations about their contributions: Conceived and designed the experiments: KS IDK. Performed the experiments: JL MB TI. Analyzed the data: JL ZZ MB. Contributed reagents/materials/analysis tools: MAD DC MK ST TK ER NBS HV LGJ. Wrote the paper: JL ZZ IDK. Figure preparation: ZZ JL KS IDK.","The authors have declared that no competing interests exist."
"10.1371/journal.pgen.1004303","plos genetics","2014-05-01T00:00:00Z","Muriel Boube; Bruno Hudry; Clément Immarigeon; Yannick Carrier; Sandra Bernat-Fabre; Samir Merabet; Yacine Graba; Henri-Marc Bourbon; David L Cribbs","Centre de Biologie du Développement, CBD, UMR5547 CNRS/UPS, Université de Toulouse, Toulouse, France; Institut de Biologie du Développement de Marseille Luminy, IBDML, UMR6216 CNRS, Université de la méditerranée, Marseille, France","Conceived and designed the experiments: MB BH SM YG HMB DLC. Performed the experiments: MB BH CI YC SBF HMB DLC. Analyzed the data: MB BH CI YC SBF SM YG HMB DLC. Contributed reagents/materials/analysis tools: MB BH YC SBF SM YG HMB DLC. Wrote the paper: MB DLC.","The authors have declared that no competing interests exist."
"10.1371/journal.pgen.1004302","plos genetics","2014-05-08T00:00:00Z","Sandra Tenreiro; Madalena M Reimão-Pinto; Pedro Antas; José Rino; Donata Wawrzycka; Diana Macedo; Rita Rosado-Ramos; Triana Amen; Meytal Waiss; Filipa Magalhães; Andreia Gomes; Cláudia N Santos; Daniel Kaganovich; Tiago Fleming Outeiro","Instituto de Medicina Molecular, Faculdade de Medicina da Universidade de Lisboa, Lisboa, Portugal; Department of Genetics and Cell Physiology, Institute of Experimental Biology, University of Wroclaw, Wroclaw, Poland; Instituto de Tecnologia Química e Biológica, Universidade Nova de Lisboa, Oeiras, Portugal; Department of Cell and Developmental Biology, Alexander Silberman Institute of Life Sciences, Hebrew University of Jerusalem, Jerusalem, Israel; Instituto de Biologia Experimental e Tecnológica, Oeiras, Portugal; Instituto de Fisiologia, Faculdade de Medicina da Universidade de Lisboa, Lisboa, Portugal; Department of NeuroDegeneration and Restorative Research, Center for Nanoscale Microscopy and Molecular Physiology of the Brain, University Medical Center Göttingen, Göttingen, Germany","Conceived and designed the experiments: ST CNS DK TFO. Performed the experiments: ST DW MMRP PA DM RRR TA MW FM AG. Analyzed the data: ST MMRP JR MW DM. Wrote the paper: ST MMRP TFO.","The authors have declared that no competing interests exist."
"10.1371/journal.pgen.1004304","plos genetics","2014-05-01T00:00:00Z","Kimberly R Kukurba; Rui Zhang; Xin Li; Kevin S Smith; David A Knowles; Meng How Tan; Robert Piskol; Monkol Lek; Michael Snyder; Daniel G MacArthur; Jin Billy Li; Stephen B Montgomery","Department of Pathology, Stanford University School of Medicine, Stanford, California, United States of America; Department of Genetics, Stanford University School of Medicine, Stanford, California, United States of America; Department of Computer Science, Stanford University School of Medicine, Stanford, California, United States of America; Analytic and Translational Genetics Unit, Massachusetts General Hospital, Boston, Massachusetts, United States of America; Program in Medical and Population Genetics, Broad Institute of Harvard and MIT, Cambridge, Massachusetts, United States of America","Conceived and designed the experiments: SBM KRK JBL. Performed the experiments: RZ KSS MHT RP ML. Analyzed the data: KRK RZ XL DAK DGM SBM. Contributed reagents/materials/analysis tools: MS DGM JBL SBM. Wrote the paper: KRK DGM MS JBL SBM.","The authors have declared that no competing interests exist."
"10.1371/journal.pbio.1000110","plos biology","2009-05-26T00:00:00Z","Benjamin A Wolfe; Tohru Takaki; Mark Petronczki; Michael Glotzer","Department of Molecular Genetics and Cell Biology, The University of Chicago, Chicago, Illinois, United States of America; Cell Division and Aneuploidy Laboratory, Cancer Research UK London Research Institute, Clare Hall Laboratories, Hertfordshire, United Kingdom","The author(s) have made the following declarations about their contributions: Conceived and designed the experiments: BAW TT MP MG. Performed the experiments: BAW TT MP. Analyzed the data: BAW TT MP MG. Wrote the paper: BAW MP MG.","The authors have declared that no competing interests exist."
