"id","journal","publication_date","author","author_affiliate","author_notes","competing_interest"
"10.1371/journal.pone.0131390","plos one","2015-09-01T00:00:00Z","Michael D Hill; Renee H Martin; Yuko Y Palesch; Claudia S Moy; Diego Tamariz; Karla J Ryckborst; Elizabeth B Jones; David Weisman; Creed Pettigrew; Myron D Ginsberg","Departments of Clinical Neurosciences, Medicine, Radiology and Community Health Sciences, Hotchkiss Brain Institute, Cumming School of Medicine, University of Calgary, Calgary, AB, Canada; Department of Public Health Sciences, Medical University of South Carolina, Charleston, South Carolina, United States of America; Office of Clinical Research, National Institute of Neurological Disorders and Stroke, National Institutes of Health, Bethesda, Maryland, United States of America; Department of Neurology, University of Miami Miller School of Medicine, Miami, Florida, United States of America; Department of Clinical Neurosciences, Cumming School of Medicine, University of Calgary, Calgary, AB, Canada; Department of Emergency Medicine, University of Texas Health Science Center at Houston, Houston, Texas, United States of America; Abington Neurological Associates, Abington, Pennsylvania, United States of America; Department of Neurology and Sanders-Brown Center on Aging, University of Kentucky, Lexington, Kentuck, United States of America","Conceived and designed the experiments: MDH MG YYP RHM CSM KJR DT. Performed the experiments: MDH KJR EBJ DW CP MDG. Analyzed the data: MDH RHM YYP MDG. Contributed reagents/materials/analysis tools: RHM YYP. Wrote the paper: MDH RHM YYP CSM DT KJR EBJ DW CP MDG.","The authors have declared that no competing interests exist."
"10.1371/journal.pone.0107960","plos one","2014-10-15T00:00:00Z","Ning-Ping Foo; Jer-Hao Chang; Shih-Bin Su; Kow-Tong Chen; Ching-Fa Cheng; Pei-Chung Chen; Tsung-Yi Lin; How-Ran Guo","Department of Emergency Medicine, China Medical University-An Nan Hospital, Taichung, Taiwan; Department of Environmental and Occupational Health College of Medicine, National Cheng Kung University, Tainan, Taiwan; Department of Emergency Medicine, Ditmanson Medical Foundation, Chiayi Christian Hospital, Chia-Yi, Taiwan; Department of Occupational Therapy, College of Medicine, National Cheng Kung University, Tainan, Taiwan; Department of Occupational Medicine, Chi-Mei Medical Center, Tainan, Taiwan; Department of Leisure, Recreation and Tourism Management, Southern Taiwan University of Science and Technology, Tainan, Taiwan; Department of Public Health, College of Medicine, National Cheng Kung University, Tainan, Taiwan; Department of Occupational Medicine, Tainan Municipal Hospital, Tainan, Taiwan; Division of Emergency Medical Services, Tainan City Fire Bureau, Tainan, Taiwan; Department of Mechanical Engineering, Southern Taiwan University of Science and Technology,Tainan, Taiwan; Department of Occupational and Environmental Medicine, National Cheng Kung University Hospital, Tainan, Taiwan","Conceived and designed the experiments: NPF CFC PCC TYL HRG. Performed the experiments: NPF JHC SBS KTC CFC PCC TYL HRG. Analyzed the data: NPF HRG. Contributed reagents/materials/analysis tools: NPF JHC CFC PCC TYL HRG. Wrote the paper: NPF JHC SBS KTC CFC PCC TYL HRG.","The authors have declared that no competing interests exist."
"10.1371/journal.pone.0153175","plos one","2016-04-07T00:00:00Z","Shengjun Nie; Huilian Xu","International Nature Farming Research Center, Hata 5632, Matsumoto-city, Nagano 390–1401, Japan","Conceived and designed the experiments: SN HX. Performed the experiments: SN. Analyzed the data: SN HX. Contributed reagents/materials/analysis tools: SN HX. Wrote the paper: SN HX.","The authors have declared that no competing interests exist."
"10.1371/journal.pone.0016837","plos one","2011-02-24T00:00:00Z","Leslie A Gillum; Christopher Gouveia; E Ray Dorsey; Mark Pletcher; Colin D Mathers; Charles E McCulloch; S Claiborne Johnston","Department of Neurology, University of California San Francisco, San Francisco, California, United States of America; Department of Epidemiology and Biostatistics, University of California San Francisco, San Francisco, California, United States of America; Department of Neurology, Johns Hopkins University Medical Center, Baltimore, Maryland, United States of America; Department of Health Statistics and Informatics, World Health Organization, Geneva, Switzerland","Conceived and designed the experiments: LAG ERD MP CDM SCJ. Analyzed the data: LAG SCJ. Contributed reagents/materials/analysis tools: LAG CEM SCJ. Wrote the paper: LAG SCJ. Acquisition of data: LAG CG CDM SCJ. Critical revision for intellectual content: LAG ERD MP CDM CEM SCJ. Study Supervision: SCJ LAG. Obtained funding: LAG.","The authors have declared that no competing interests exist."
"10.1371/journal.pone.0039437","plos one","2012-06-25T00:00:00Z","Andrea C Tricco; Erin Lillie; Charlene Soobiah; Laure Perrier; Sharon E Straus","Li Ka Shing Knowledge Institute of St Michael’s Hospital, Toronto, Ontario, Canada; Child Health Evaluative Sciences, The Hospital for Sick Children, Toronto, Ontario, Canada; Continuing Education and Professional Development, University of Toronto, Toronto, Ontario, Canada; Division of Geriatrics, Faculty of Medicine, University of Toronto, Toronto, Ontario, Canada","Conceived and designed the experiments: ACT SES. Performed the experiments: EL CS LP ACT. Analyzed the data: ACT SES. Wrote the paper: ACT EL CS LP SES.","The authors have the following interests: ACT has been a paid consultant to examine cross-protection of non-influenza vaccine types for GlaxoSmithKline. This does not alter the authors' adherence to all the PLoS ONE policies on sharing data and materials. The other authors have nothing to declare."
"10.1371/journal.pone.0027886","plos one","2011-12-15T00:00:00Z","Mike J Downey; Danuta M Jeziorska; Sascha Ott; T Katherine Tamai; Georgy Koentges; Keith W Vance; Till Bretschneider","Molecular Organisation and Assembly in Cells, University of Warwick, Coventry, United Kingdom; School of Life Sciences, University of Warwick, Coventry, United Kingdom; Warwick Systems Biology Centre, University of Warwick, Coventry, United Kingdom; Department of Cell and Developmental Biology, University College London, London, United Kingdom","Conceived and designed the experiments: MJD DMJ SO GK KWV TB. Performed the experiments: MJD DMJ KWV. Analyzed the data: MJD TB. Contributed reagents/materials/analysis tools: DMJ SO GK KWV TKT. Wrote the paper: MJD TB.","The authors have declared that no competing interests exist."
"10.1371/journal.pone.0153198","plos one","2016-04-07T00:00:00Z","David J DiSilvestro; Emiliano Melgar-Bermudez; Rumana Yasmeen; Paolo Fadda; L James Lee; Anuradha Kalyanasundaram; Chen L Gilor; Ouliana Ziouzenkova","Department of Human Sciences, The Ohio State University, Columbus, Ohio, 43210, United States of America; Genomics Shared Resource, Comprehensive Cancer Center, The Ohio State University, Columbus, Ohio, 43210, United States of America; NSF Nanoscale Science and Engineering Center for Affordable Nanoengineering of Polymeric Biomedical Devices, The Ohio State University, Columbus, Ohio, United States of America; Department of Physiology and Cell Biology, Davis Heart and Lung Research Institute, The Ohio State University, Columbus, Ohio, 43210, United States of America; Veterinary Clinical Sciences, The Ohio State University, Columbus, Ohio, 43210, United States of America","Conceived and designed the experiments: DJD LJL OZ. Performed the experiments: DJD EMB RY PF CLG. Analyzed the data: DJD OZ. Contributed reagents/materials/analysis tools: LJL AK. Wrote the paper: DJD OZ. Edited manuscript: LJL AK EMB RY PF CLG.","The funding by pharmacological company Novo Nordisk and other funding organizations did not alter our adherence to PLOS ONE policies on sharing data and materials (as detailed online in our guide for authors http://www.PLOSone.org/static/editorial.action#competing)."
"10.1371/journal.pone.0027885","plos one","2012-02-24T00:00:00Z","Nicholas E Burger; Daniel Kopf; Connor P Spreng; Joanne Yoong; Neeraj Sood","RAND Corporation, Arlington, Virginia, United States of America; Department of Economics, London School of Economics, London, United Kingdom; The World Bank, Washington, D.C., United States of America; School of Pharmacy, University of Southern California, Los Angeles, California, United States of America","Conceived and designed the experiments: NEB DK CPS JY NS. Performed the experiments: NEB DK. Analyzed the data: NEB CPS JY NS. Wrote the paper: NEB CPS JY NS. Survey data management: DK.","Authors affiliated with RAND are working on other, unrelated research funded by the World Bank. One of the authors (Spreng) is employed by the World Bank, who funded the research. This does not alter the authors' adherence to all the PLoS ONE policies on sharing data and materials."
"10.1371/journal.pone.0119585","plos one","2015-03-16T00:00:00Z","Rosana Arizmendi-Mejía; Cristina Linares; Joaquim Garrabou; Agostinho Antunes; Enric Ballesteros; Emma Cebrian; David Díaz; Jean-Baptiste Ledoux","Departament d´Ecologia, Facultat de Biologia, Universitat de Barcelona, Avinguda Diagonal 643, 08028, Barcelona, Spain; Institut de Ciències del Mar (ICM-CSIC), Passeig Marítim de la Barceloneta 37-49, 08003, Barcelona, Spain; CIMAR/CIIMAR, Centro Interdisciplinar de Investigação Marinha e Ambiental, Universidade do Porto, Rua dos Bragas 177, 4050-123, Porto, Portugal; Departamento de Biologia, Faculdade de Ciências, Universidade do Porto, Rua do Campo Alegre, 4169-007, Porto, Portugal; Centre d’Estudis Avançats de Blanes (CSIC), Accés Cala St. Francesc 14, 17300, Blanes, Spain; Instituto Español de Oceanografia, C/ Moll de Ponent s/n, 07015, Palma de Mallorca, Spain","Conceived and designed the experiments: RAM CL JG JBL. Performed the experiments: RAM JBL. Analyzed the data: RAM CL JBL. Contributed reagents/materials/analysis tools: CL JG EB EC DD. Wrote the paper: RAM CL JG AA EB EC DD JBL.","The authors have declared that no competing interests exist."
"10.1371/journal.pone.0039435","plos one","2012-07-17T00:00:00Z","Donald M Carter; Hai-Rong Lu; Chalise E Bloom; Corey J Crevar; Joshua L Cherry; David J Lipman; Ted M Ross","Center for Vaccine Research, School of Medicine, University of Pittsburgh, Pittsburgh, Pennsylvania, United States of America; Graduate Program in Immunology, School of Medicine, University of Pittsburgh, Pittsburgh, Pennsylvania, United States of America; Department of Microbiology and Molecular Genetics, School of Medicine, University of Pittsburgh, Pittsburgh, Pennsylvania, United States of America; National Center for Biotechnology Information, National Library of Medicine, National Institutes of Health, Bethesda, Maryland, United States of America","Conceived and designed the experiments: DMC JLC DJL TMR. Performed the experiments: DMC HL CEB CJC. Analyzed the data: DMC CJC JLC DJL TMR. Contributed reagents/materials/analysis tools: DMC JLC DJL TMR. Wrote the paper: DMC JLC DJL TMR.","The authors have declared that no competing interests exist."
"10.1371/journal.pone.0073897","plos one","2013-09-10T00:00:00Z","Ikuya Miyamoto; Ayataka Ishikawa; Yasuhiro Morimoto; Tetsu Takahashi","Division of Oral Medicine, Kyushu Dental University, Fukuoka, Japan; Department of Pathology, Saitama Cancer Center, Saitama, Japan; Division of Oral and Maxillofacial Radiology, Kyushu Dental University, Fukuoka, Japan; Division of Oral and Maxillofacial Surgery, Department of Oral Medicine and Surgery, Tohoku University Graduate School of Dentistry, Sendai, Japan","Conceived and designed the experiments: IM TT. Performed the experiments: IM. Analyzed the data: AI YM. Contributed reagents/materials/analysis tools: IM. Wrote the paper: IM.","The authors have declared that no competing interests exist."
"10.1371/journal.pone.0119590","plos one","2015-03-18T00:00:00Z","Francesco Colloca; Germana Garofalo; Isabella Bitetto; Maria Teresa Facchini; Fabio Grati; Angela Martiradonna; Gianluca Mastrantonio; Nikolaos Nikolioudakis; Francesc Ordinas; Giuseppe Scarcella; George Tserpes; M Pilar Tugores; Vasilis Valavanis; Roberto Carlucci; Fabio Fiorentino; Maria C Follesa; Magdalena Iglesias; Leyla Knittweis; Eugenia Lefkaditou; Giuseppe Lembo; Chiara Manfredi; Enric Massutí; Marie Louise Pace; Nadia Papadopoulou; Paolo Sartor; Christopher J Smith; Maria Teresa Spedicato","Istituto per l’Ambiente Marino Costiero (IAMC), Consiglio Nazionale delle Ricerche, Mazara del Vallo, Italy; COISPA Tecnologia & Ricerca, Bari, Italy; Istituto di Scienze Marine (ISMAR), Consiglio Nazionale delle Ricerche, Ancona, Italy; Department of Economics, Roma Tre University, Rome, Italy; Hellenic Centre for Marine Research, Heraklion, Greece; Instituto Español de Oceanografía, Centre Oceanogràfic de les Balears, Palma de Mallorca, Spain; Department of Biology, University of Bari, Bari, Italy; Department of Life and Environmental Sciences, University of Cagliari, Cagliari, Italy; Department of Biology, University of Malta, Msida, Malta; Laboratorio Biologia Marina Fano, Università di Bologna, Bologna, Italy; Department of Fisheries and Aquaculture, Ministry for Sustainable Development, the Environment and Climate Change, Santa Venera, Malta; Centro Interuniversitario di Biologia Marina ed Ecologia Applicata “G. Bacci” (CIBM), Livorno, Italy","Conceived and designed the experiments: FC GG GL MTS. Analyzed the data: GG IB MTF FG AM GM NN FO GS GT MPT VV NP CJS. Wrote the paper: FC GG RC FF MCF MI LK EL GL CM EM MLP PS MTS.","The authors have declared that no competing interests exist."
"10.1371/journal.pone.0027889","plos one","2011-11-21T00:00:00Z","Kazuo Konishi; Yoshiyuki Watanabe; Lanlan Shen; Yi Guo; Ryan J Castoro; Kimie Kondo; Woonbok Chung; Saira Ahmed; Jaroslav Jelinek; Yanis A Boumber; Marcos R Estecio; Shinji Maegawa; Yutaka Kondo; Fumio Itoh; Michio Imawari; Stanley R Hamilton; Jean-Pierre J Issa","Department of Leukemia, Division of Cancer Medicine, The University of Texas M. D. Anderson Cancer Center, Houston, Texas, United States of America; Department of Pathology, Division of Pathology and Laboratory Medicine, The University of Texas M. D. Anderson Cancer Center, Houston, Texas, United States of America; Division of Gastroenterology, Department of Medicine, Showa University School of Medicine, Tokyo, Japan; Division of Gastroenterology and Hepatology, Department of Internal Medicine, St. Marianna University School of Medicine, Kawasaki, Japan; Division of Molecular Oncology, Aichi Cancer Center, Nagoya, Japan","Conceived and designed the experiments: K.Konishi YW J-PI. Performed the experiments: K.Konishi YW LS YG RC K.Kondo WC SA JJ YB ME SM YK FI MI SH. Analyzed the data: K.Konishi YW J-PI. Contributed reagents/materials/analysis tools: K.Konishi YW LS SA JJ SH J-PI. Wrote the paper: K.Konishi J-PI.","The authors have declared that no competing interests exist."
"10.1371/journal.pone.0143092","plos one","2015-11-25T00:00:00Z","Luiz H Araujo; Cynthia Timmers; Konstantin Shilo; Weiqiang Zhao; Jianying Zhang; Lianbo Yu; Thanemozhi G Natarajan; Clinton J Miller; Ayse Selen Yilmaz; Tom Liu; Joseph Amann; José Roberto Lapa e Silva; Carlos Gil Ferreira; David P Carbone","James Thoracic Center, The Ohio State University Comprehensive Cancer Center, Columbus, Ohio, 43210, United States of America; Department of Biomedical Informatics, The Ohio State University, Columbus, Ohio, 43210, United States of America; GenomOncology, Cleveland, Ohio, 44145, United States of America; Biomedical Informatics Shared Resource, The Ohio State University Comprehensive Cancer Center, Columbus, Ohio, 43210, United States of America; Federal University of Rio de Janeiro, Rio de Janeiro, Brazil; Brazilian National Cancer Institute, Rio de Janeiro, Brazil","Conceived and designed the experiments: LHA CT KS WZ TL JA JRLS CGF DPC. Performed the experiments: LHA CT TL. Analyzed the data: LHA CT JZ LY TGN CJM ASY. Contributed reagents/materials/analysis tools: KS WZ JA DPC. Wrote the paper: LHA CT DPC.","T.G.N and C.J.M. are employed by GenomOncology. This does not alter the authors' adherence to PLOS ONE policies on sharing data and materials."
"10.1371/journal.pone.0119589","plos one","2015-03-16T00:00:00Z","Victor Bong-Hang Shyu; Chung-En Hsu; Chih-hao Chen; Chien-Tzung Chen","Craniofacial Research Center, Department of Plastic and Reconstructive Surgery, Chang Gung Memorial Hospital at Linkou, Chang Gung University, College of Medicine, Taoyuan, Taiwan; Department of Medicine, College of Medicine, Chang Gung University, Taoyuan, Taiwan; Department of Plastic and Reconstructive Surgery, Chang Gung Memorial Hospital at Keelung, Keelung, Taiwan","Conceived and designed the experiments: VBS CEH CHC CTC. Performed the experiments: VBS CEH. Analyzed the data: VBS CEH CHC. Contributed reagents/materials/analysis tools: CHC CTC. Wrote the paper: VBS CEH CHC CTC.","The authors have declared that no competing interests exist."
"10.1371/journal.pone.0016855","plos one","2011-02-11T00:00:00Z","Marco Tullio Liuzza; Matteo Candidi; Salvatore Maria Aglioti","Department of Psychology, University of Rome “La Sapienza”, Rome, Italy; IRCCS, Fondazione Santa Lucia, Rome, Italy","Conceived and designed the experiments: MTL MC SMA. Performed the experiments: MTL MC. Analyzed the data: MTL MC. Contributed reagents/materials/analysis tools: MTL MC. Wrote the paper: MTL MC SMA.","The authors have declared that no competing interests exist."
"10.1371/journal.pone.0027887","plos one","2011-11-28T00:00:00Z","Zhen Liu; Weiren Luo; Ying Zhou; Yan Zhen; Huiling Yang; Xiaoli Yu; Yanfen Ye; Xin Li; Hao Wang; Qinping Jiang; Yajie Zhang; Kaitai Yao; Weiyi Fang","Department of Pathology, Basic School of Guangzhou Medical College, Guangzhou, People's Republic of China; Cancer Research Institute, Southern Medical University, Guangzhou, People's Republic of China; Department of Pathology, Guangdong Medical College, Dongguan, People's Republic of China; Third Affiliated Hospital of Guangzhou Medical College, Guangzhou, People's Republic of China; School of Pharmacy, Guangdong Medical College, Dongguan, People's Republic of China","Conceived and designed the experiments: WYF. Performed the experiments: ZL WRL Y. Zhou Y. Zhen HLY XLY YFY XL HW. Analyzed the data: YWF XL ZL. Wrote the paper: WYF. Conducted statistical analyses: XL. Provided material and collected the clinical data: QPJ. Supervised all the work: Y. Zhang KTY.","The authors have declared that no competing interests exist."
"10.1371/journal.pone.0027893","plos one","2011-11-23T00:00:00Z","Rachel L Beattie; Zhong-Lin Lu; Franklin R Manis","Department of Psychology, University of Southern California, Los Angeles, California, United States of America; Department of Psychology, The Ohio State University, Columbus, Ohio, United States of America","Conceived and designed the experiments: RB Z-LL FR. Performed the experiments: RB. Analyzed the data: RB. Contributed reagents/materials/analysis tools: Z-LL FR. Wrote the paper: RB.","The authors have declared that no competing interests exist."
"10.1371/journal.pone.0096603","plos one","2014-05-21T00:00:00Z","So-Yeon Lee; Jinho Yu; Kang-Mo Ahn; Kyung Won Kim; Youn Ho Shin; Kyung-shin Lee; Seo Ah Hong; Young-ho Jung; Eun Lee; Song-I Yang; Ju-hee Seo; Ji-Won Kwon; Byoung-Ju Kim; Hyo-Bin Kim; Woo-Kyung Kim; Dae Jin Song; Gwang Cheon Jang; Jung Yeon Shim; Soo-Young Lee; Ja-Young Kwon; Suk-Joo Choi; Kyung-Ju Lee; Hee Jin Park; Hye-Sung Won; Ho-Sung Yoo; Mi-Jin Kang; Hyung-Young Kim; Soo-Jong Hong","Department of Pediatrics, Hallym University College of Medicine, Anyang, Korea; Childhood Asthma Atopy Center, Asan Medical Center, Seoul, Korea; Department of Pediatrics, Sungkyunkwan University of School of Medicine, Seoul, Korea; Department of Pediatrics, College of Medicine, Yonsei University, Seoul, Korea; Department of Pediatrics, CHA University of School of Medicine, Seoul, Korea; The Asan Institute for Life Science, Seoul, Korea; Department of Pediatrics, Korea Cancer Center Hospital, Seoul, Korea; Department of Pediatrics, Seoul National University Bundang Hospital, Seongnam, Korea; Department of Pediatrics, Inje University College of Medicine, Seoul, Korea; Department of Pediatrics, Korea University Guro Hospital, Seoul, Korea; Department of Pediatrics, National Health Insurance Corporation Ilsan Hospital, Goyang, Korea; Department of Pediatrics, Ajou University School of Medicine, Suwon, Korea; Department of Obstetrics and Gynecology, Yonsei University College of Medicine, Seoul, Korea; Department of Obstetrics and Gynecology, Samsung Medical Center, Sungkyunkwan University School of Medicine, Seoul, Korea; Department of Obstetrics and Gynecology, Pochon CHA University College of Medicine, Seoul, Korea; Department of Obstetrics and Gynecology, Asan Medical Center, University of Ulsan College of Medicine, Seoul, Korea; Department of Pediatrics, Kosin University College of Medicine, Busan, Korea","Conceived and designed the experiments: So-Yeon Lee JY KMA KWK YHS HBK WKK DJS GCJ JYS Soo-Young Lee JYK SJH. Performed the experiments: JY KMA KWK YHS SJC KJL HJP HSW YHJ EL SIY JHS JWK BJK. Analyzed the data: KSL SAH HSY MJK HYK. Contributed reagents/materials/analysis tools: KSL SAH. Wrote the paper: So-Yeon Lee KSL SAH SJH.","The authors have declared that no competing interests exist."
"10.1371/journal.pone.0119592","plos one","2015-03-20T00:00:00Z","Aline Santos Sampaio; Ana Gabriela Hounie; Kátia Petribú; Carolina Cappi; Ivanil Morais; Homero Vallada; Maria Conceição do Rosário; S Evelyn Stewart; Jesen Fargeness; Carol Mathews; Paul Arnold; Gregory L Hanna; Margaret Richter; James Kennedy; Leonardo Fontenelle; Carlos Alberto de Bragança Pereira; David L Pauls; Eurípedes Constantino Miguel","Department and Institute of Psychiatry, Faculdade de Medicina da Universidade de São Paulo, São Paulo, SP, Brazil; Serviço Médico Universitário, Universidade Federal da Bahia (UFBA, Federal University of Bahia), Salvador, BA, Brazil; Universidade de Pernambuco (UPE, University of Pernambuco) Faculdade de Ciências Médicas, Recife, PE, Brazil; Universidade Federal de Sao Paulo (UNIFESP, Federal University of São Paulo), São Paulo, SP, Brazil; British Columbia Mental Health and Addictions Research Institute, Vancouver, BC, Canada; Psychiatric and Neurodevelopmental Genetics Unit (PNGU), Massachusetts General Hospital, Boston, Massachusetts, United States of America; Center for Human Genetics Research, Massachusetts General Hospital, Boston, Massachusetts, United States of America; Department of Psychiatry, University of California, San Francisco, California, United States of America; Program in Genetics and Genome Biology, The Hospital for Sick Children, Toronto, Ontario, Canada; Department of Psychiatry, University of Michigan, Ann Arbor, Michigan, United States of America; The Frederick W. Thompson Anxiety Disorders Centre, Sunnybrook Health Sciences Centre, Toronto, Ontario, Canada; Centre for Addiction and Mental Health, University of Toronto, Toronto, Ontario, Canada; Programa de Ansiedade e Depressão, Instituto de Psiquiatria, Universidade Federal do Rio de Janeiro (IPUB/UFRJ), Rio de Janeiro, RJ, Brazil; Department of Statistics, The Institute of Mathematics and Statistics, University of São Paulo, SP, Brazil","Conceived and designed the experiments: ASS AGH SES CM PA MR JK DLP ECM. Performed the experiments: ASS KP CC IM MCR AGH CM PA MR SES GLH. Analyzed the data: ASS JF CABP DLP ECM. Contributed reagents/materials/analysis tools: KP HV SES DLP ECM JK GLH. Wrote the paper: ASS DLP ECM LF KP IM CC AGH MCR SES CM PA MR JK CABP JF HV GLH.","The authors have read the journal's policy and have the following conflicts: MA Richter has received honoraria from Lundbeck and is the recipient of grant funding from Eli Lilly Canada Inc. Dr. Leonardo Fontenelle is currently a member of the PLOS ONE editorial board. This does not alter the authors' adherence to PLOS ONE Editorial policies and criteria."
"10.1371/journal.pone.0153210","plos one","2016-04-11T00:00:00Z","Kyung-Min Lee; Jin-Myoung Song; Jin-Hyoung Cho; Hyeon-Shik Hwang","Department of Orthodontics, School of Dentistry, 4D Dental Research Institute, Chonnam National University, Gwangju, Korea; Department of Orthodontics, School of Dentistry, Dental Science Research Institute, Chonnam National University, Gwangju, Korea","Conceived and designed the experiments: KML HSH. Performed the experiments: KML. Analyzed the data: KML HSH. Contributed reagents/materials/analysis tools: JMS JHC. Wrote the paper: KML HSH.","The authors have declared that no competing interests exist."
"10.1371/journal.pone.0050991","plos one","2012-11-29T00:00:00Z","Emily G Severance; Geetha Kannan; Kristin L Gressitt; Jianchun Xiao; Armin Alaedini; Mikhail V Pletnikov; Robert H Yolken","Stanley Division of Developmental Neurovirology, Department of Pediatrics, Johns Hopkins University School of Medicine, Baltimore, Maryland, United States of America; Division of Neurobiology, Department of Psychiatry, Johns Hopkins University School of Medicine, Baltimore, Maryland, United States of America; Department of Medicine, Columbia University Medical Center, New York, New York, United States of America","Conceived and designed the experiments: EGS GK MVP RHY. Performed the experiments: GK KLG JX. Analyzed the data: EGS. Contributed reagents/materials/analysis tools: EGS AA MVP RHY. Wrote the paper: EGS AA MVP RHY.","The authors have declared that no competing interests exist."
