"id","journal","publication_date","author","author_affiliate","author_notes","competing_interest"
"10.1371/journal.pone.0027466","plos one","2011-12-05T00:00:00Z","Qianting Zhai; Michael B Landesman; Howard Robinson; Wesley I Sundquist; Christopher P Hill","Department of Biochemistry, University of Utah School of Medicine, Salt Lake City, Utah, United States of America; Department of Biology, Brookhaven National Laboratory, Upton, New York, United States of America","Conceived and designed the experiments: QZ MBL WIS CPH. Performed the experiments: QZ MBL. Analyzed the data: QZ MBL HR WIS CPH. Contributed reagents/materials/analysis tools: HR. Wrote the paper: QZ MBL WIS CPH. Performed structural and biochemical studies: QZ. Performed functional studies: MBL. Collected the SeMet X-ray data: HR. Helped design, interpret and write up the analyses: WIS CPH.","The authors have declared that no competing interests exist."
"10.1371/journal.pone.0131016","plos one","2015-06-22T00:00:00Z","Yolanda Peña-Oliver; Chiara Giuliano; Daina Economidou; Charles R Goodlett; Trevor W Robbins; Jeffrey W Dalley; Barry J Everitt","Department of Psychology and Behavioural and Clinical Neuroscience Institute, University of Cambridge, Downing St, Cambridge, United Kingdom; Department of Psychology, Indiana University–Purdue University Indianapolis, Indianapolis, Indiana, United States of America; Department of Psychiatry, University of Cambridge, Addenbrooke’s Hospital, Cambridge, United Kingdom","Conceived and designed the experiments: YP CG DE CRG TWR JWD BJE. Performed the experiments: YP CG. Analyzed the data: YP. Contributed reagents/materials/analysis tools: CRG. Wrote the paper: YP JWD TWR BJE.","The authors declare no competing interests exist. TWR has consulted for GSK, Cambridge Cognition, Lilly, Lundbeck and Merck. He also has research grants with GSK, Lilly and Lundbeck. This does not alter the authors' adherence to PLOS ONE policies on sharing data and materials."
"10.1371/journal.pone.0039062","plos one","2012-06-20T00:00:00Z","Yu-Hao Zhou; Xiu-Qiang Ma; Cheng Wu; Jian Lu; Shan-Shan Zhang; Jia Guo; Shun-Quan Wu; Xiao-Fei Ye; Jin-Fang Xu; Jia He","Department of Health Statistics, Second Military Medical University, Shanghai, China; Tumor Immunology and Gene Therapy Center, Eastern Hepatobiliary Surgery Hospital, Second Military Medical University, Shanghai, China; Department of Ultrasonography, Eastern Hepatobiliary Surgery Hospital, Second Military Medical University, Shanghai, China","Conceived and designed the experiments: YHZ JH. Performed the experiments: JL JFX CW. Analyzed the data: XFY JG XQM. Contributed reagents/materials/analysis tools: YHZ JH. Wrote the paper: YHZ JL SSZ SQW.","The authors have declared that no competing interests exist."
"10.1371/journal.pone.0142697","plos one","2015-11-12T00:00:00Z","Xingwei He; Xintian Liu; Wanjun Liu; Bei Wang; Yujian Liu; Zhuxi Li; Tao Wang; Rong Tan; Bo Gao; Hesong Zeng","Department of Cardiology, Tongji Hospital, Tongji Medical College, Huazhong University of Science and Technology, Wuhan, China; Department of Cardiology, Suizhou Affiliated Hospital of Hubei Medical College, Suizhou, China","Conceived and designed the experiments: XWH HSZ. Performed the experiments: XWH ZXL RT WJL. Analyzed the data: XWH XTL BG TW. Contributed reagents/materials/analysis tools: YJL BW. Wrote the paper: XWH.","The authors have declared that no competing interests exist."
"10.1371/journal.pone.0050610","plos one","2012-11-30T00:00:00Z","Dana B Hancock; Joshua L Levy; Nathan C Gaddis; Laura J Bierut; Nancy L Saccone; Grier P Page; Eric O Johnson","Behavioral Health Epidemiology Program, Research Triangle Institute International, Research Triangle Park, North Carolina, United States of America; Research Computing Division, Research Triangle Institute International, Research Triangle Park, North Carolina, United States of America; Department of Psychiatry, Washington University, St. Louis, Missouri, United States of America; Department of Genetics, Washington University, St. Louis, Missouri, United States of America; Genomics, Statistical Genetics, and Environmental Research Program, Research Triangle Institute International, Atlanta, Georgia, United States of America","Conceived and designed the experiments: DBH JLL NCG LJB NLS GPP EOJ. Performed the experiments: JLL NCG. Analyzed the data: DBH JLL NCG. Wrote the paper: DBH JLL NCG LJB NLS GPP EOJ.","The authors have declared that no competing interests exist."
"10.1371/journal.pone.0016549","plos one","2011-01-31T00:00:00Z","Marcelo A Catalán; Kathleen Scott-Anne; Marlise I Klein; Hyun Koo; William H Bowen; James E Melvin","Department of Pharmacology and Physiology, University of Rochester Medical Center, Rochester, New York, United States of America; Center for Oral Biology, University of Rochester Medical Center, Rochester, New York, United States of America","Conceived and designed the experiments: MAC KS-A MIK HK WHB JEM. Performed the experiments: MAC KS-A MIK. Analyzed the data: MAC KS-A MIK HK WHB JEM. Contributed reagents/materials/analysis tools: MAC KS-A MIK HK WHB JEM. Wrote the paper: MAC MIK HK WHB JEM.","The authors have declared that no competing interests exist."
"10.1371/journal.pone.0152740","plos one","2016-04-12T00:00:00Z","Magdalena Orczyk-Pawilowicz; Ewa Jawien; Stanislaw Deja; Lidia Hirnle; Adam Zabek; Piotr Mlynarz","Department of Chemistry and Immunochemistry, Wroclaw Medical University, Wroclaw, Poland; Department of Chemistry, Wroclaw University of Technology, Wroclaw, Poland; 1st Department and Clinic of Gynaecology and Obstetrics, Wroclaw Medical University, Wrocław, Poland; Faculty of Chemistry, Opole University, Opole, Poland","Conceived and designed the experiments: PM MO-P. Performed the experiments: EJ SD. Analyzed the data: SD PM EJ AZ. Contributed reagents/materials/analysis tools: PM LH. Wrote the paper: SD PM EJ MO-P.","The authors have declared that no competing interests exist."
"10.1371/journal.pone.0062014","plos one","2013-05-06T00:00:00Z","Donglu Wu; Rui Zhang; Rui Zhao; Guang Chen; Yong Cai; Jingji Jin","College of Life Science, Jilin University, Changchun, Jilin, China; Graduate School of Jilin University, Changchun, Jilin, China; The First Clinical Hospital, Jilin University, Changchun, Jilin, China; National Engineering Laboratory for AIDS Vaccine, College of Life Science, Jilin University, Changchun, Jilin, China","Conceived and designed the experiments: GC YC JJ. Performed the experiments: DW R. Zhang R. Zhao. Analyzed the data: YC JJ. Contributed reagents/materials/analysis tools: GC YC JJ. Wrote the paper: YC JJ.","The authors have declared that no competing interests exist."
"10.1371/journal.pone.0073497","plos one","2013-09-16T00:00:00Z","Stephanie L Angione; Zintis Inde; Christina M Beck; Andrew W Artenstein; Steven M Opal; Anubhav Tripathi","School of Engineering, Center for Biomedical Engineering, Brown University, Providence, Rhode Island, United States of America; Division of Biology and Medicine, Brown University, Providence, Rhode Island, United States of America; Department of Medicine and the Center for Biodefense and Emerging Pathogens, Baystate Health, Springfield, Massachusetts, United States of America; Warren Alpert Medical School, Brown University, Providence, Rhode Island, United States of America; Memorial Hospital of Rhode Island, Pawtucket, Rhode Island, United States of America","Conceived and designed the experiments: SLA AT. Performed the experiments: SLA ZI CMB. Analyzed the data: SLA SMO AWA. Contributed reagents/materials/analysis tools: SMO AWA AT. Wrote the paper: SLA ZI CMB SMO AWA AT.","The authors have declared that no competing interests exist."
"10.1371/journal.pone.0142700","plos one","2015-12-02T00:00:00Z","Xianze Wang; Zhongmou Liu; Jiancong Liu; Mingxin Huo; Hongliang Huo; Wu Yang","School of Environment, Northeast Normal University, Changchun, China; Jilin Engineering Research Centre for Municipal Wastewater Treatment and Water Quality Protection, Changchun, China","Conceived and designed the experiments: XZW HLH WY. Performed the experiments: JCL MXH WY. Analyzed the data: XZW ZML HLH. Contributed reagents/materials/analysis tools: XZW ZML. Wrote the paper: XZW WY HLH.","The authors have declared that no competing interests exist."
"10.1371/journal.pone.0027467","plos one","2011-11-07T00:00:00Z","Eva-Maria Hüttmann; Timm Greulich; Akira Hattesohl; Severin Schmid; Sarah Noeske; Christian Herr; Gerrit John; Rudolf A Jörres; Bernd Müller; Claus Vogelmeier; Andreas Rembert Koczulla","Division for Pulmonary Diseases, Department of Internal Medicine, Philipps-University Marburg, Marburg, Germany; Comprehensive Pneumology Center, Institute of Lung Biology and Disease, Helmholtz Zentrum Munich, Neuherberg, Germany; Institute and Outpatient Clinic for Occupational, Social and Environmental Medicine, Ludwig-Maximilians-University, Munich, Germany","Conceived and designed the experiments: TG RAJ BM CV ARK. Performed the experiments: EMH AH SS SN CH GJ. Analyzed the data: EMH TG AH ARK. Contributed reagents/materials/analysis tools: CH BM GJ. Wrote the paper: TG ARK. Read the manuscript, gave critical feedback and approved the final version of the manuscript: EMH TG AH SS SN CH GJ RAJ BM CV ARK.","The authors have declared that no competing interests exist."
"10.1371/journal.pone.0085001","plos one","2014-01-20T00:00:00Z","Effua Usuf; Christian Bottomley; Richard A Adegbola; Andrew Hall","Child Survival, Medical Research Council The Gambia Unit, Fajara, The Gambia; Tropical Epidemiology Group, London School of Hygiene and Tropical Medicine, London, United Kingdom; GlaxoSmithKline Vaccines, Wavre, Belgium; Faculty of Epidemiology and Public Health, London School of Hygiene and Tropical Medicine, London, United Kingdom","Conceived and designed the experiments: EU AH RA. Performed the experiments: EU AH. Analyzed the data: EU AH CB. Contributed reagents/materials/analysis tools: EU AH CB RA. Wrote the paper: EU CB RA AH.","The authors have the following interests. Richard A. Adegbola is employed by GlaxoSmithKline Vaccines. There are no patents, products in development or marketed products to declare. This does not alter the authors' adherence to all the PLOS ONE policies on sharing data and materials, as detailed online in the guide for authors."
"10.1371/journal.pone.0152745","plos one","2016-03-31T00:00:00Z","Josy ter Beek; Nils Krause; Pia Ädelroth","Department of Biochemistry and Biophysics, Stockholm University, Stockholm, Sweden","Conceived and designed the experiments: JB NK PÄ. Performed the experiments: JB NK. Analyzed the data: JB NK PÄ. Wrote the paper: JB PÄ.","The authors have declared that no competing interests exist."
"10.1371/journal.pone.0096183","plos one","2014-04-25T00:00:00Z","Ying-Wen Su; Yun-Ho Lin; Man-Hui Pai; An-Chi Lo; Yu-Chieh Lee; I-Chih Fang; Johnson Lin; Ruey-Kuen Hsieh; Yi-Fang Chang; Chi-Long Chen","Division of Hematology and Medical Oncology, Department of Internal Medicine, Mackay Memorial Hospital, Taipei, Taiwan; Division of Oral Pathology, Department of Dentistry, Taipei Medical University Hospital, Taipei, Taiwan; Department of Anatomy, Taipei Medical University, Taipei, Taiwan; Good Clinical Research Center, Mackay Memorial Hospital, Taipei, Taiwan; Graduate Institute of Medical Sciences, Taipei Medical University, Taipei, Taiwan; Department of Pathology, Wan Fang Hospital, Taipei Medical University, Taipei, Taiwan","Conceived and designed the experiments: YWS YHL CLC. Performed the experiments: YWS YHL YCL MHP ICF CLC. Analyzed the data: YWS ACL CLC. Contributed reagents/materials/analysis tools: RKH JL YFC. Wrote the paper: YWS CLC.","The authors have declared that no competing interests exist."
"10.1371/journal.pone.0016551","plos one","2011-01-31T00:00:00Z","Flavia Bernini; Erika Ebranati; Chiara De Maddalena; Renata Shkjezi; Laura Milazzo; Alessandra Lo Presti; Massimo Ciccozzi; Massimo Galli; Gianguglielmo Zehender","Department of Clinical Sciences “L. Sacco”, University of Milan, Milan, Italy; Department of Infectious, Parasitic and Immune-Mediated Diseases, Istituto Superiore di Sanità, Rome, Italy","Conceived and designed the experiments: GZ FB MG. Performed the experiments: FB EE CDM GZ. Analyzed the data: GZ FB MC ALP. Contributed reagents/materials/analysis tools: GZ MG MC. Wrote the paper: GZ FB MG. Patients' enrollment and follow up: LM. Clinical follow-up of the patients: RS.","The authors have declared that no competing interests exist."
"10.1371/journal.pone.0142704","plos one","2015-11-16T00:00:00Z","Valerie B Sampson; Nancy S Vetter; Davida F Kamara; Anderson B Collier; Renee C Gresh; E Anders Kolb","Nemours Center for Cancer and Blood Disorders, Nemours/A.I. duPont Hospital for Children, Wilmington, Delaware, United States of America; Department of Pediatrics, Division of Hematology and Oncology, Children's Healthcare of Mississippi, University of Mississippi Medical Center, Jackson, MS, United States of America","Conceived and designed the experiments: VBS ABC EAK. Performed the experiments: VBS NSV DFK RCG. Analyzed the data: VBS ABC RCG EAK. Contributed reagents/materials/analysis tools: VBS NSV DFK RCG EAK. Wrote the paper: VBS EAK.","The authors have declared that no competing interests exist."
"10.1371/journal.pone.0050611","plos one","2012-11-28T00:00:00Z","Simone Ciuti; Joseph M Northrup; Tyler B Muhly; Silvia Simi; Marco Musiani; Justin A Pitt; Mark S Boyce","Department of Biological Sciences, University of Alberta, Edmonton, Alberta, Canada; Department of Fish, Wildlife, and Conservation Biology, Colorado State University, Fort Collins, Colorado, United States of America; Alberta Innovates, Technology Futures, Vegreville, Alberta, Canada; Faculty of Environmental Design, University of Calgary, Calgary, Alberta, Canada","Conceived and designed the experiments: SC. Performed the experiments: SC SS. Analyzed the data: SC. Contributed reagents/materials/analysis tools: JMN TBM MM JAP MSB. Wrote the paper: SC JMN TBM MSB.","Co-author Dr. MS Boyce currently serves as editor for this journal. This study was funded by Alberta Conservation Association (ACA – Grant Eligible Conservation Fund), the Natural Sciences and Engineering Research Council of Canada (NSERC-CRD), and Shell Canada limited, as declared in the manuscript. This does not alter the authors' adherence to all the PLOS ONE policies on sharing data and materials."
"10.1371/journal.pone.0096182","plos one","2014-05-09T00:00:00Z","Markus Lange; Maike Habekost; Nico Eisenhauer; Christiane Roscher; Holger Bessler; Christof Engels; Yvonne Oelmann; Stefan Scheu; Wolfgang Wilcke; Ernst-Detlef Schulze; Gerd Gleixner","Max Planck Institute for Biogeochemistry, Jena, Germany; Institute of Ecology, Friedrich- Schiller-University Jena, Jena, Germany; UFZ, Helmholtz Centre for Environmental Research, Department of Community Ecology, Halle, Germany; Department of Plant Nutrition, Faculty of Agriculture and Horticulture, Humboldt-Universität zu Berlin, Berlin, Germany; Geoecology/Geography, Eberhard Karls University of Tübingen, Tübingen, Germany; J.F. Blumenbach Institute of Zoology and Anthropology, Georg August University Göttingen, Göttingen, Germany; Soil Science Group, Geographic Institute, University of Berne, Bern, Switzerland","Conceived and designed the experiments: GG SS WW EDS CR. Performed the experiments: MH GG HB. Analyzed the data: ML MH CR NE. Contributed reagents/materials/analysis tools: GG. Wrote the paper: ML MH NE CR HB CE YO SS WW EDS GG.","The authors have declared that no competing interests exist."
"10.1371/journal.pone.0107571","plos one","2014-09-17T00:00:00Z","James B Elsner; Thomas H Jagger; Ian J Elsner","Department of Geography, Florida State University, Tallahassee, FL, United States of America; Digital Worlds Institute, University of Florida, Gainesville, FL, United States of America","Conceived and designed the experiments: JBE THJ. Performed the experiments: JBE THJ. Analyzed the data: JBE THJ IJE. Contributed reagents/materials/analysis tools: JBE THJ IJE. Wrote the paper: JBE.","The authors have declared that no competing interests exist."
"10.1371/journal.pone.0085004","plos one","2014-01-06T00:00:00Z","Alexander M Menzies; Lauren E Haydu; Matteo S Carlino; Mary W F Azer; Peter J A Carr; Richard F Kefford; Georgina V Long","Melanoma Institute Australia, Sydney, Australia; The University of Sydney, Sydney, Australia; Westmead Hospital, Crown Princess Mary Cancer Centre, Sydney, Australia; Westmead Hospital, Department of Radiology, Sydney, Australia; Westmead Institute for Cancer Research, Westmead, Australia","Conceived and designed the experiments: AMM GVL. Performed the experiments: AMM. Analyzed the data: AMM LEH GVL. Contributed reagents/materials/analysis tools: PJAC RFK GVL. Wrote the paper: AMM LEH MSC MWFA PJAC RFK GVL.","The authors have read the journal’s policy and have the following conflicts: AMM – Roche (H & T), GlaxoSmithKline (T). RFK – Roche (C), GlaxoSmithKline (C), Novartis (C). GVL – Roche (C, T & H), GlaxoSmithKline (C), Novartis (C). None to declare for the remaining authors. There are no employment or leadership positions, no stock ownership, no expert testimony. Note: (C) = Consultant advisor, (H) Honoraria and (T) Travel support for conference attendance. This does not alter the authors’ adherence to all the PLOS ONE policies on sharing data and materials."
"10.1371/journal.pone.0096180","plos one","2014-06-16T00:00:00Z","Kevin S Kung; Kael Greco; Stanislav Sobolevsky; Carlo Ratti","Massachusetts Institute of Technology (MIT) Senseable City Laboratory, Cambridge, Massachusetts, United States of America; Department of Biological Engineering, Massachusetts Institute of Technology, Cambridge, Massachusetts, United States of America; Department of Urban Studies and Planning, Massachusetts Institute of Technology, Cambridge, Massachusetts, United States of America","Conceived and designed the experiments: KSK KG SS CR. Performed the experiments: KSK KG. Analyzed the data: KSK KG. Contributed reagents/materials/analysis tools: KSK KG. Wrote the paper: KSK KG.","The authors have declared that no competing interests exist. We acknowledge that Audi Volkswagen, BBVA, The Coca Cola Company, Ericsson, Ferrovial, GE provided funding for this study. There are no patents, products in development or marketed products to declare. This does not alter the authors’ adherence to all the PLOS ONE policies on sharing data and materials."
"10.1371/journal.pone.0119138","plos one","2015-03-16T00:00:00Z","Lena Hohwü; Jin Liang Zhu; Lise Graversen; Jiong Li; Thorkild I A Sørensen; Carsten Obel","Department of Public Health, Aarhus University, Aarhus, Denmark; Institute of Preventive Medicine, Bispebjerg and Frederiksbjerg Hospitals, Copenhagen, Denmark; Novo Nordisk Foundation Center for Basic Metabolic Research, Faculty of Health and Medical Sciences, University of Copenhagen, Copenhagen, Denmark","Analyzed the data: LH. Wrote the paper: LH JLZ LG JL TIAS CO.","The authors have declared that no competing interests exist."
"10.1371/journal.pone.0107570","plos one","2014-09-26T00:00:00Z","Shari E Smith; Sarah A Figley; David J Schreyer; Phyllis G Paterson","College of Pharmacy and Nutrition, University of Saskatchewan, Saskatoon, Saskatchewan, Canada; Department of Anatomy and Cell Biology, University of Saskatchewan, Saskatoon, Saskatchewan, Canada; Cameco MS Neuroscience Research Center, Saskatoon City Hospital, Saskatoon, Saskatchewan, Canada","Conceived and designed the experiments: SES PGP. Performed the experiments: SES SAF. Analyzed the data: SES SAF DJS PGP. Contributed reagents/materials/analysis tools: DJS PGP. Wrote the paper: SES SAF DJS PGP.","The authors have declared that no competing interests exist."
"10.1371/journal.pone.0152737","plos one","2016-04-08T00:00:00Z","Elena Arellano-Orden; Carmen Calero-Acuña; Nicolás Moreno-Mata; Lourdes Gómez-Izquierdo; Verónica Sánchez-López; Cecilia López-Ramírez; Daniela Tobar; José Luis López-Villalobos; Cesar Gutiérrez; Ana Blanco-Orozco; José Luis López-Campos","Unidad Médico-Quirúrgica de Enfermedades Respiratorias, Instituto de Biomedicina de Sevilla (IBiS), Hospital Universitario Virgen del Rocío/Universidad de Sevilla, Seville, Spain; CIBER de Enfermedades Respiratorias (CIBERES), Instituto de Salud Carlos III, Madrid, Spain","Conceived and designed the experiments: EAO VSL CCA LGI. Performed the experiments: EAO VSL LGI. Analyzed the data: EAO JLLC CLR DT CG. Contributed reagents/materials/analysis tools: NMM JLLV ABO. Wrote the paper: JLLV EAO.","The authors have declared that no competing interests exist."
"10.1371/journal.pone.0131017","plos one","2015-06-29T00:00:00Z","Che-Hung Yen; Yi-Wei Yeh; Chih-Sung Liang; Pei-Shen Ho; Shin-Chang Kuo; Chang-Chih Huang; Chun-Yen Chen; Mei-Chen Shih; Kuo-Hsing Ma; Giia-Sheun Peng; Ru-Band Lu; San-Yuan Huang","Graduate Institute of Medical Sciences, National Defense Medical Center, Taipei, Taiwan, ROC; Department of Neurology, Tri-Service General Hospital, National Defense Medical Center, Taipei, Taiwan, ROC; Department of Psychiatry, Tri-Service General Hospital, National Defense Medical Center, Taipei, Taiwan, ROC; Department of Psychiatry, Beitou Branch, Tri-Service General Hospital, National Defense Medical Center, Taipei, Taiwan, ROC; Department of Psychiatry, Taipei Branch, Buddhist Tzu Chi General Hospital, Taipei, Taiwan, ROC; Department of anatomy and biology, National Defense Medical Center, Taipei, Taiwan, ROC; Institute of Behavior Medicine, College of Medicine, National Cheng Kung University, Tainan, Taiwan, ROC","Conceived and designed the experiments: SYH CHY. Performed the experiments: CHY SYH MCS KHM. Analyzed the data: CHY SYH YWY CSL PSH CYC. Contributed reagents/materials/analysis tools: SYH CHY RBL GSP KHM SCK CCH. Wrote the paper: CHY SYH.","The authors have declared that no competing interests exist."
"10.1371/journal.pone.0062004","plos one","2013-04-26T00:00:00Z","Colin Sumpter; Belen Torondel","Department of Disease Control, London School of Hygiene and Tropical Medicine, London, United Kingdom","Conceived and designed the experiments: CS BT. Performed the experiments: CS BT. Analyzed the data: CS BT. Contributed reagents/materials/analysis tools: CS BT. Wrote the paper: CS BT.","The authors have declared that no competing interests exist."
"10.1371/journal.pone.0004886","plos one","2009-03-19T00:00:00Z","Colin R Lickwar; Bhargavi Rao; Andrey A Shabalin; Andrew B Nobel; Brian D Strahl; Jason D Lieb","Curriculum in Genetics and Molecular Biology, University of North Carolina at Chapel Hill, Chapel Hill, North Carolina, United States of America; Department of Statistics and Operations Research, University of North Carolina at Chapel Hill, Chapel Hill, North Carolina, United States of America; Department of Biochemistry and Biophysics, University of North Carolina School of Medicine, Chapel Hill, North Carolina, United States of America; Department of Biology, Carolina Center for the Genome Sciences, and Lineberger Comprehensive Cancer Center, University of North Carolina at Chapel Hill, Chapel Hill, North Carolina, United States of America","Conceived and designed the experiments: BS JDL. Performed the experiments: BR. Analyzed the data: CRL AAS AN BS JDL. Wrote the paper: CRL AAS AN BS JDL.","The authors have declared that no competing interests exist."
"10.1371/journal.pone.0073484","plos one","2013-09-12T00:00:00Z","Ayako Suzuki; Sachiyo Mimaki; Yuki Yamane; Akikazu Kawase; Koutatsu Matsushima; Makito Suzuki; Koichi Goto; Sumio Sugano; Hiroyasu Esumi; Yutaka Suzuki; Katsuya Tsuchihara","Department of Medical Genome Sciences, Graduate School of Frontier Sciences, The University of Tokyo, Chiba, Japan; Division of Translational Research, Research Center for Innovative Oncology, National Cancer Center Hospital East, Chiba, Japan; Thoracic Oncology Division, National Cancer Center Hospital East, Chiba, Japan","Conceived and designed the experiments: KT YS HE KG SS. Performed the experiments: SM YY AK KM MS. Analyzed the data: AS YS KT. Contributed reagents/materials/analysis tools: KG KT. Wrote the manuscript: AS KT YS.","The authors have declared that no competing interests exist."
"10.1371/journal.pone.0050601","plos one","2012-11-29T00:00:00Z","Kara L Crossley; Piers L Cornelissen; Martin J Tovée","Institute of Neuroscience, Newcastle University, United Kingdom; Department of Psychology, University of Northumbria, United Kingdom","Conceived and designed the experiments: MJT. Performed the experiments: KLC MJT. Analyzed the data: KLC PLC MJT. Contributed reagents/materials/analysis tools: MJT PLC. Wrote the paper: MJT PLC KLC.","The authors have declared that no competing interests exist."
