"id","journal","publication_date","author","author_affiliate","author_notes","competing_interest"
"10.1371/journal.pone.0098817","plos one","2014-06-03T00:00:00Z","Hirohisa Okabe; Evan Delgado; Jung Min Lee; Jing Yang; Hiroki Kinoshita; Hiromitsu Hayashi; Allan Tsung; Jaideep Behari; Toru Beppu; Hideo Baba; Satdarshan P Monga","Department of Pathology, University of Pittsburgh, Pittsburgh, Pennsylvania, United States of America; Department of Gastroenterological Surgery, Graduate School of Life Sciences, Kumamoto University, Kumamoto, Japan; Department of Surgery, University of Pittsburgh Medical Center, Pittsburgh, Pennsylvania, United States of America; Department of Medicine, University of Pittsburgh, Pittsburgh, Pennsylvania, United States of America; Department of Multidisciplinary Treatment for Gastroenterological Cancer, Kumamoto University Hospital, Kumamoto, Japan","Conceived and designed the experiments: HO AT JB TB HB SPM. Performed the experiments: HO ED JML JY HK HH. Analyzed the data: HO SPM. Contributed reagents/materials/analysis tools: AT JB TB HB SPM. Wrote the paper: HO SPM.","SPM is a consultant for Abbvie and PhaseRx. None of the content in the current manuscript was affected by the consultation relationship. In addition, this does not alter the authors' adherence to PLOS ONE policies on sharing data and materials."
"10.1371/journal.pone.0144870","plos one","2015-12-21T00:00:00Z","Yoichiro Ito; Mamoru Yamanishi; Akinori Ikeuchi; Chie Imamura; Takashi Matsuyama","Matsuyama Research Group, TOYOTA Central Research and Development Laboratories Incorporation, Nagakute, Aichi, Japan; Biotechnology Laboratory, TOYOTA Central Research and Development Laboratories Incorporation, Nagakute, Aichi, Japan","Conceived and designed the experiments: YI MY AI CI TM. Performed the experiments: YI TM. Analyzed the data: YI MY AI CI TM. Wrote the paper: YI TM.","The authors have the following interests. This work was partially supported by a JSPS Grant-in-Aid for Scientific Research (C) (Grant Number 15K07378 (TM)). All authors were employed by TOYOTA Central Research and Development Laboratories Incorporation at the time of the study. There are no patents, products in development or marketed products to declare. This does not alter the authors' adherence to all the PLOS ONE policies on sharing data and materials, as detailed online in the guide for authors."
"10.1371/journal.pone.0110416","plos one","2014-10-14T00:00:00Z","Maria de los Angeles Dublan; Juan Cesar Federico Ortiz-Marquez; Lina Lett; Leonardo Curatti","Instituto de Investigaciones en Biodiversidad y Biotecnología, Consejo Nacional de Investigaciones Científicas y Técnicas, Mar del Plata, Buenos Aires, Argentina; Fundación para Investigaciones Biológicas Aplicadas, Mar del Plata, Buenos Aires, Argentina; Laboratorio Integrado de Microbiología Agrícola y de Alimentos, Facultad de Agronomía, Universidad Nacional del Centro de la Provincia de Buenos Aires, Azul, Buenos Aires, Argentina","Conceived and designed the experiments: MAD LC. Performed the experiments: MAD. Analyzed the data: MAD JCFOM LL LC. Contributed reagents/materials/analysis tools: MAD JCFOM LL LC. Contributed to the writing of the manuscript: MAD LC.","The authors have declared that no competing interests exist."
"10.1371/journal.pone.0030210","plos one","2012-02-17T00:00:00Z","Bertrand Blondeau; Iman Sahly; Emmanuelle Massouridès; Amrit Singh-Estivalet; Bérengère Valtat; Delphine Dorchene; Frédéric Jaisser; Bernadette Bréant; Francois Tronche","INSERM UMR-S 872, Centre de Recherches des Cordeliers, Paris, France; Université Pierre et Marie Curie, Paris, France; Centre National de la Recherche Scientifique, UMR7224, “Molecular Genetics, Neurophysiology and Behavior” team, Paris, France; Institut National de la Santé et de la Recherche Médicale, U952, Paris, France","Conceived and designed the experiments: B. Blondeau IS B. Bréant FT. Performed the experiments: B. Blondeau IS EM AS-E BV DD. Analyzed the data: B. Blondeau IS B. Bréant FT. Contributed reagents/materials/analysis tools: B. Blondeau IS AS-E B. Bréant FT. Wrote the paper: B. Blondeau IS EM BV FJ B. Bréant FT.","The authors have declared that no competing interests exist."
"10.1371/journal.pone.0064553","plos one","2013-05-22T00:00:00Z","Laureline Arnaud; Marc Sato; Lucie Ménard; Vincent L Gracco","Centre for Research on Brain, Language and Music, McGill University, Montréal, Canada; Centre for Research on Brain, Language and Music, and GIPSA-lab, Centre national de la recherche scientifique and Grenoble Université, Grenoble, France; Département de Linguistique, Université du Québec à Montréal, Montréal, Canada; School of Communication Sciences and Disorders, McGill University, Montréal, Canada; Haskins Laboratories, New Haven, Connecticut, United States of America","Conceived and designed the experiments: LA MS LM VG. Performed the experiments: LA MS. Analyzed the data: LA MS LM VG. Wrote the paper: VG MS LA LM.","The authors have declared that no competing interests exist."
"10.1371/journal.pone.0030220","plos one","2012-01-17T00:00:00Z","Chris B Stone; Seiji Sugiman-Marangos; David C Bulir; Rob C Clayden; Tiffany L Leighton; Jerry W Slootstra; Murray S Junop; James B Mahony","M. G. DeGroote Institute for Infectious Disease Research, Faculty of Health Sciences and the Department of Pathology and Molecular Medicine, McMaster University, Hamilton, Canada; Father Sean O'Sullivan Research Centre, St. Joseph's Healthcare, Hamilton, Canada; Department of Biochemistry and Biomedical Sciences, McMaster University, Hamilton, Canada; Pepscan Presto, Zuidersluisweg, Lelystad, The Netherlands","Conceived and designed the experiments: CBS SS MSJ JBM. Performed the experiments: CBS SS DCB RCC TLL JWS. Analyzed the data: CBS SS MSJ JBM. Contributed reagents/materials/analysis tools: CBS SS MSJ JBM. Wrote the paper: CBS SS JBM.","The authors have read the journal's policy and have the following conflicts. JWS is an employee of PepScan Presto and performed the author's epitope mapping experiments. This does not alter the authors' adherence to all the PLoS ONE policies on sharing data and materials."
"10.1371/journal.pone.0110452","plos one","2014-12-03T00:00:00Z","Robert J Ellis; Zhiyan Duan; Ye Wang","School of Computing, National University of Singapore, Singapore, Singapore","Conceived and designed the experiments: RJE YW. Analyzed the data: RJE ZD. Wrote the paper: RJE ZD YW.","The authors have declared that no competing interests exist."
"10.1371/journal.pone.0087528","plos one","2014-01-28T00:00:00Z","Jinyue Hu; Guihua Wang; Xueting Liu; Lina Zhou; Manli Jiang; Li Yang","Medical Research Center, Changsha Central Hospital, Changsha, Hunan, China; Cancer Center, Changsha Central Hospital, Changsha, Hunan, China; Central Laboratory, Renmin Hospital of Wuhan University, Wuhan, Hubei, China; Tuberculosis Research Center, Changsha Central Hospital, Changsha, Hunan, China","Conceived and designed the experiments: JH GW XL LZ MJ LY. Performed the experiments: JH GW XL LZ MJ LY. Analyzed the data: JH GW XL LZ MJ LY. Contributed reagents/materials/analysis tools: JH LY. Wrote the paper: JH.","The authors have declared that no competing interests exist."
"10.1371/journal.pone.0121943","plos one","2015-03-24T00:00:00Z","Lei Wu; Zhao-Yang Zhou; Chun-Guang Zhang; Juan Chai; Qin Zhou; Li Wang; Eva Hirnerová; Michaela Mrvková; Ondřej Novák; Guang-Qin Guo","MOE Key Laboratory of Cell Activities and Stress Adaptations, School of Life Sciences, Lanzhou University, Lanzhou, China; Laboratory of Molecular and Cell Biology, Hebei Normal University, Shijiazhuang, China; Laboratory of Growth Regulators, Centre of the Region Haná for Biotechnological and Agricultural Research, Institute of Experimental Botany ASCR & Faculty of Science, Palacký University, Šlechtitelů 11, Olomouc, Czech Republic","Conceived and designed the experiments: GQG. Performed the experiments: L Wu ZYZ CGZ JC QZ L Wang MM EH ON. Analyzed the data: GQG L Wu ZYZ ON. Wrote the paper: GQG L Wu.","The authors have declared that no competing interests exist."
"10.1371/journal.pone.0110549","plos one","2014-10-21T00:00:00Z","Miki Tanaka-Okamoto; Yu Itoh; Jun Miyoshi; Akira Mizoguchi; Kiyohito Mizutani; Yoshimi Takai; Masahiro Inoue","Department of Molecular Biology, Osaka Medical Center for Cancer and Cardiovascular Disease, Osaka, Japan; Department of Biochemistry, Osaka Medical Center for Cancer and Cardiovascular Disease, Osaka, Japan; Department of Neural Regeneration and Cell Communication, Mie University Graduate School of Medicine, Mie, Japan; Division of Pathogenetic Signaling, Department of Biochemistry and Molecular Biology, Kobe University Graduate School of Medicine, Kobe, Hyogo, Japan","Conceived and designed the experiments: MTO JM. Performed the experiments: MTO YI. Analyzed the data: MTO AM MI. Contributed to the writing of the manuscript: MTO KM YT MI.","The authors have declared that no competing interests exist."
"10.1371/journal.pone.0145014","plos one","2015-12-21T00:00:00Z","Zhi-Wei Wang; Shao-Tian Chen; Ze-Long Nie; Jian-Wen Zhang; Zhuo Zhou; Tao Deng; Hang Sun","Key Laboratory for Plant Diversity and Biogeography of East Asia, Kunming Institute of Botany, Chinese Academy of Sciences, Kunming, 650201, China; University of Chinese Academy of Sciences, Beijing, 100049, China","Conceived and designed the experiments: HS. Performed the experiments: Z-WW. Analyzed the data: Z-WW S-TC. Contributed reagents/materials/analysis tools: Z-WW Z-LN J-WZ ZZ TD. Wrote the paper: Z-WW.","The authors have declared that no competing interests exist."
"10.1371/journal.pone.0145011","plos one","2015-12-14T00:00:00Z","Jibiao Zhang; Baojuan Li; Junling Gao; Huqing Shi; Xiang Wang; Yali Jiang; Qingsen Ming; Yidian Gao; Ren Ma; Shuqiao Yao","Department of Psychology, School of Education, Jianghan University, Wuhan, Hubei, China; Medical Psychological Institute, Second Xiangya Hospital, Central South University, Changsha, Hunan, China; School of Biomedical Engineering, Fourth Military Medical University, Xi’an, Shaanxi, China; Centre of Buddhist Studies, University of Hong Kong, Hong Kong, China; Department of Psychology, Shanghai Normal University, Shanghai, China; National Technology Institute of Psychiatry, Changsha, Hunan, China","Conceived and designed the experiments: SQY JBZ BJL XW. Performed the experiments: JBZ HQS YLJ QSM YDG RM. Analyzed the data: JBZ BJL HQS. Contributed reagents/materials/analysis tools: JBZ BJL. Wrote the paper: JBZ BJL JLG SQY.","The authors have declared that no competing interests exist."
"10.1371/journal.pone.0041768","plos one","2012-07-23T00:00:00Z","Yong-Biao Zhang; Xin Li; Feng Zhang; Duen-Mei Wang; Jun Yu","CAS Key Laboratory of Genome Sciences and Information, Beijing Institute of Genomics, Chinese Academy of Sciences, Beijing, People’s Republic of China","Conceived and designed the experiments: FZ YBZ. Performed the experiments: XL YBZ. Analyzed the data: YBZ XL. Contributed reagents/materials/analysis tools: FZ. Wrote the paper: YBZ XL DMW JY.","The authors have declared that no competing interests exist."
"10.1371/journal.pone.0030330","plos one","2012-02-01T00:00:00Z","Marta Curriu; Hughes Fausther-Bovendo; María Pernas; Marta Massanella; Jorge Carrillo; Cecilia Cabrera; Cecilio López-Galíndez; Bonaventura Clotet; Patrice Debré; Vincent Vieillard; Julià Blanco","IrsiCaixa-HIVACAT, Institut de Recerca en Ciències de la Salut Germans Trias i Pujol (IGTP), Hospital Germans Trias, Universitat Autònoma de Barcelona, Badalona, Barcelona, Catalonia, Spain; INSERM UMR-S 945, Laboratoire Immunité et Infection, Hôpital Pitié-Salpêtrière, UPMC, Université Paris-6, Paris, France; Centro Nacional de Microbiología (CNM), Instituto de Salud Carlos III, Majadahonda, Madrid, Spain; Lluita contra la SIDA Foundation, Institut de Recerca en Ciències de la Salut Germans Trias i Pujol, Hospital Universitari Germans Trias i Pujol, Universitat Autònoma de Barcelona, Badalona, Barcelona, Spain","Conceived and designed the experiments: MC HFB CC MM JC VV. Performed the experiments: MC HFB MM JC VV. Analyzed the data: MP CLG CC BC PD JB. Contributed reagents/materials/analysis tools: VV MP CLG. Wrote the paper: MC PD BC JB.","The authors have read the journal's policy and have the following conflicts: B.C. has received research funding from Merck Sharp & Domme and has received honoraria for speaking and serving on advisory boards from Abbott, Bristol-Myers Squibb, Boehringer-Ingelheim, Gilead Sciences, GlaxoSmithKline, Roche, Janssen-Cilag, and Merck Sharp & Domme. J.B. has received honoraria as a consultant for GlaxoSmithKline. This does not alter the authors' adherence to all the PLoS ONE policies on sharing data and materials. All other authors: no conflicts."
"10.1371/journal.pone.0133529","plos one","2015-07-14T00:00:00Z","Ralph T Wiedmann; Dan J Nonneman; Gary A Rohrer","United States Department of Agriculture, Agricultural Research Service, United States Meat Animal Research Center, Clay Center, Nebraska, United States of America","Conceived and designed the experiments: RTW. Performed the experiments: RTW DJN GAR. Analyzed the data: RTW. Contributed reagents/materials/analysis tools: RTW DJN GAR. Wrote the paper: RTW DJN GAR.","The authors have declared that no competing interests exist."
"10.1371/journal.pone.0007139","plos one","2009-09-23T00:00:00Z","Jeffrey W Koehler; Michael Bolton; Amanda Rollins; Kirsten Snook; Eileen deHaro; Elizabeth Henson; Linda Rogers; Louis N Martin; Donald J Krogstad; Mark A James; Janet Rice; Billie Davison; Ronald S Veazey; Ramesh Prabhu; Angela M Amedee; Robert F Garry; Frank B Cogswell","Department of Microbiology and Immunology, Tulane University School of Medicine, New Orleans, Louisiana, United States of America; Department of Bacteriology and Parasitology, Tulane National Primate Research Center, Covington, Louisiana, United States of America; Department of Microbiology, Tulane National Primate Research Center, Covington, Louisiana, United States of America; Department of Comparative Pathology, Tulane National Primate Research Center, Covington, Louisiana, United States of America; Department of Tropical Medicine, Tulane University School of Public Health and Tropical Medicine, New Orleans, Louisiana, United States of America; Department of Epidemiology, Tulane University School of Public Health and Tropical Medicine, New Orleans, Louisiana, United States of America; Department of Microbiology, Immunology, and Parasitology, Louisiana State University Health Sciences Center, New Orleans, Louisiana, United States of America","Conceived and designed the experiments: JWK MB LNM DJK MAJ BD RSV AA RFG FBC. Performed the experiments: JWK AR KS Ed EH LR BD RSV RP AA FBC. Analyzed the data: JWK JR. Contributed reagents/materials/analysis tools: MAJ BD RSV AA. Wrote the paper: JWK RFG.","The authors have declared that no competing interests exist."
"10.1371/journal.pone.0087525","plos one","2014-02-25T00:00:00Z","Joachim P Gröger; Hans-Harald Hinrichsen; Patrick Polte","Thünen Institute of Sea Fisheries, Hamburg, Germany; Institute for Bio-Sciences, Rostock University, Rostock, Germany; GEOMAR Helmholtz Centre for Ocean Research, Kiel, Germany; Thünen Institute of Baltic Sea Fisheries, Rostock, Germany","Analyzed the data: JPG HHH. Contributed reagents/materials/analysis tools: JPG HHH. Wrote the paper: JPG HHH PP.","The authors have declared that no competing interests exist."
"10.1371/journal.pone.0087522","plos one","2014-01-29T00:00:00Z","Shiu-Dong Chung; Shih-Ping Liu; Hsien-Chang Li; Herng-Ching Lin","Division of Urology, Department of Surgery, Far Eastern Memorial Hospital, Ban Ciao, Taipei, Taiwan; Sleep Research Center, Taipei Medical University Hospital, Taipei, Taiwan; Department of Urology, National Taiwan University Hospital and College of Medicine, Taipei, Taiwan; School of Health Care Administration, Taipei Medical University, Taipei, Taiwan","Conceived and designed the experiments: SDC H. Lin. Analyzed the data: H. Lin H. Li. Wrote the paper: SDC SPL H. Li H. Lin.","The authors have declared that no competing interests exist."
"10.1371/journal.pone.0121937","plos one","2015-04-08T00:00:00Z","Daniel C Ayala; Dexter Morin; Alan R Buckpitt","Department of Molecular Biosciences, School of Veterinary Medicine, University of California Davis, Davis, CA 95616, United States of America; University of California Davis, Forensic Science, Graduate Program, 1909 Galileo Ct., Suite B, Davis, CA 95618, United States of America","Conceived and designed the experiments: DCA DM AB. Performed the experiments: DCA DM. Analyzed the data: DCA DM AB. Contributed reagents/materials/analysis tools: DM. Wrote the paper: DCA DM AB.","The authors have declared that no competing interests exist."
"10.1371/journal.pone.0087519","plos one","2014-01-27T00:00:00Z","Chandirasegaran Massilamany; Arunakumar Gangaplara; Ting Jia; Christian Elowsky; Guobin Kang; Jean-Jack Riethoven; Qingsheng Li; You Zhou; Jay Reddy","School of Veterinary Medicine and Biomedical Sciences, University of Nebraska-Lincoln, Lincoln, Nebraska, United States of America; Center for Biotechnology, University of Nebraska-Lincoln, Lincoln, Nebraska, United States of America; Nebraska Center for Virology and School of Biological Sciences, University of Nebraska-Lincoln, Lincoln, Nebraska, United States of America","Conceived and designed the experiments: CM JR. Performed the experiments: CM AG TJ. Analyzed the data: CM AG CE YZ J-JR JR. Contributed reagents/materials/analysis tools: CE YZ GK QL. Wrote the paper: CM JR.","The authors have declared that no competing interests exist."
"10.1371/journal.pone.0064612","plos one","2013-05-31T00:00:00Z","Yun Liu; Sifei Yu; Zitao Li; Jiangjun Ma; Yannan Zhang; Hui Wang; Binyan Yang; Changyou Wu","Institute of Immunology, Zhongshan School of Medicine; Key Laboratory of Tropical Disease Control Research of Ministry of Education, Sun Yat-sen University, Guangzhou, China","Conceived and designed the experiments: YL CW. Performed the experiments: SY ZL JM YZ HW BY. Analyzed the data: YL CW. Contributed reagents/materials/analysis tools: SY ZL JM YZ HW BY. Wrote the paper: YL CW.","The authors have declared that no competing interests exist."
"10.1371/journal.pone.0053161","plos one","2013-01-11T00:00:00Z","Yoshinori Ohno; Shin'ichiro Yasunaga; Salima Janmohamed; Motoaki Ohtsubo; Keita Saeki; Toshiaki Kurogi; Keichiro Mihara; Norman N Iscove; Yoshihiro Takihara","Department of Stem Cell Biology, Research Institute for Radiation Biology and Medicine, Hiroshima University, Hiroshima, Japan; Ontario Cancer Institute, McEwen Centre for Regenerative Medicine, Departments of Medical Biophysics and Immunology, University of Toronto, Toronto, Ontario, Canada; Department of Food and Fermentation Science, Faculty of Food Science and Nutrition, Beppu University, Beppu, Oita, Japan; Department of Hematology and Oncology, Research Institute for Radiation Biology and Medicine, Hiroshima University, Hiroshima, Japan","Conceived and designed the experiments: YT. Performed the experiments: YO SY SJ MO KS TK KM. Analyzed the data: YT NI. Contributed reagents/materials/analysis tools: YT. Wrote the paper: YT NI.","The authors have declared that no competing interests exist."
"10.1371/journal.pone.0076090","plos one","2013-09-30T00:00:00Z","Yang-Wen-Ke Liao; Zeng-Hui Sun; Yan-Hong Zhou; Kai Shi; Xin Li; Guan-Qun Zhang; Xiao-Jian Xia; Zhi-Xiang Chen; Jing-Quan Yu","Department of Horticulture, Zhejiang University, Hangzhou, People’s Republic of China; Key Laboratory of Horticultural Plants Growth, Development and Quality Improvement, Agricultural Ministry of China, Hangzhou, People’s Republic of China; Department of Botany & Plant Pathology, Purdue University, West Lafayette, Indiana, United States of America","Conceived and designed the experiments: KS ZXC JQY. Performed the experiments: YWKL ZHS XL GQZ. Analyzed the data: YWKL KS. Contributed reagents/materials/analysis tools: XJX YHZ. Wrote the paper: YWKL KS.","The authors have declared that no competing interests exist."
"10.1371/journal.pone.0007138","plos one","2009-09-28T00:00:00Z","Francisco O'Valle; Raimundo G M Del Moral; María del Carmén Benítez; David Martín-Oliva; Mercedes Gómez-Morales; David Aguilar; José Aneiros-Fernández; Pedro Hernández-Cortés; Antonio Osuna; Francesc Moreso; Daniel Serón; Francisco J Oliver; Raimundo G Del Moral","Department of Pathology and Institute of Biopathology and Regenerative Medicine (IBIMER), School of Medicine, University of Granada, Granada, Spain; Department of cell Biology, University of Granada, Granada, Spain; Department of Traumatology and Orthopaedic Surgery, San cecilio University Hospital, Granada, Spain; Department of Nephrology, Virgen de las Nieves University Hospital, Granada, Spain; Department of Nephrology, Bellvitge University Hospital, Barcelona, Spain; Institute of Parasitology and Biomedicine, CSIC, Armilla, Granada, Spain","Conceived and designed the experiments: FJO PHC FJO RGDM. Performed the experiments: DMO. Analyzed the data: FJO RGMDM MdCB MGM DA JAF AO FJO. Contributed reagents/materials/analysis tools: FJO RGMDM MdCB MGM DA JAF AO FM DS FJO RGDM. Wrote the paper: FJO. Made the murine Parp-1 knockout model of IR injury: PHC. Critical revision of manuscript for important intellectual content, and obtained funding: RGDM.","The authors have declared that no competing interests exist."
"10.1371/journal.pone.0030302","plos one","2012-01-19T00:00:00Z","Masaki Shoji; Shinji Yoshizaki; Hiroyuki Mizuguchi; Kenji Okuda; Masaru Shimada","Department of Molecular Biodefense Research, Yokohama City University, Yokohama, Japan; Laboratory of Biochemistry and Molecular Biology, Graduate School of Pharmaceutical Sciences, Osaka University, Osaka, Japan; Laboratory of Gene Transfer and Regulation, National Institute of Biomedical Innovation, Ibaraki, Osaka, Japan; Choju Medical Institute, Fukushimura Hospital, Toyohasi, Aichi, Japan","Conceived and designed the experiments: M. Shimada KO. Performed the experiments: M. Shoji SY. Analyzed the data: M. Shoji. Contributed reagents/materials/analysis tools: HM. Wrote the paper: M. Shimada.","The authors have declared that no competing interests exist."
"10.1371/journal.pone.0076222","plos one","2013-09-30T00:00:00Z","Chester C Wu; You-Min Lin; Jerry Gao; John H Winston; Leo K Cheng; Xuan-Zheng Shi","Division of Gastroenterology and Hepatology, Department of Internal Medicine, The University of Texas Medical Branch, Galveston, Texas, United States of America; Auckland Bioengineering Institute, the University of Auckland, Auckland, New Zealand; Depertment of Surgery, Vanderbilt University, Nashville, Tennessee, United States of America","Conceived and designed the experiments: XZS. Performed the experiments: CCW YML JHW XZS. Analyzed the data: JG LKC CCW XZS. Contributed reagents/materials/analysis tools: JG LKC. Wrote the manuscript: CCW XZS.","The authors have declared that no competing interests exist."
"10.1371/journal.pone.0099052","plos one","2014-06-06T00:00:00Z","Ming-juan Du; Xiang-dong Chen; Xiao-li Zhou; Ya-juan Wan; Bei Lan; Cui-zhu Zhang; Youjia Cao","Key Laboratory of Microbial Functional Genomics of Ministry of Education, College of Life Sciences, Nankai University, Tianjin, P. R. China; State Key Laboratory of Medicinal Chemical Biology, College of Life Sciences, Nankai University, Tianjin, P. R. China","Conceived and designed the experiments: MD YC. Performed the experiments: MD XC XZ. Analyzed the data: MD XC YC. Contributed reagents/materials/analysis tools: YW BL CZ. Wrote the paper: MD YC.","The authors have declared that no competing interests exist."
"10.1371/journal.pone.0030373","plos one","2012-02-17T00:00:00Z","Azadeh Kushki; Alexander J Andrews; Sarah D Power; Gillian King; Tom Chau","Bloorview Research Institute, Holland Bloorview Kids Rehabilitation Hospital, Toronto, Canada; Institute of Biomaterials and Biomedical Engineering, University of Toronto, Toronto, Canada","Conceived and designed the experiments: AK GK TC. Performed the experiments: AK AA. Analyzed the data: AK AA SP. Wrote the paper: AK GK TC.","The authors have declared that no competing interests exist."
"10.1371/journal.pone.0041807","none","2012-07-31T00:00:00Z","Maria Abreu; Linda Sealy","Department of Cancer Biology, Vanderbilt University School of Medicine, Nashville, Tennessee, United States of America; Department of Molecular Physiology and Biophysics, Vanderbilt University School of Medicine, Nashville, Tennessee, United States of America","Conceived and designed the experiments: MA LS. Performed the experiments: MA LS. Analyzed the data: MA LS. Contributed reagents/materials/analysis tools: MA LS. Wrote the paper: MA LS.","The authors have declared that no competing interests exist."
