"id","journal","publication_date","author","author_affiliate","author_notes","competing_interest"
"10.1371/journal.pone.0031966","plos one","2012-03-12T00:00:00Z","Karin Erbertseder; Johannes Reichold; Bernd Flemisch; Patrick Jenny; Rainer Helmig","Department of Hydromechanics and Modeling of Hydrosystems, Institute for Modelling Hydraulic and Environmental Systems, University of Stuttgart, Stuttgart, Germany; Department of Mechanical and Process Engineering, Institute of Fluid Dynamics, ETH Zurich, Zurich, Switzerland","Contributed reagents/materials/analysis tools: KE JR BF. Wrote the paper: KE JR. Designed the software: KE JR BF. Contributed to concept and design of the model: KE JR BF PJ RH.","The authors have declared that no competing interests exist."
"10.1371/journal.pone.0135450","plos one","2015-08-13T00:00:00Z","Jonathan D Tonkin; Andrea Sundermann; Sonja C Jähnig; Peter Haase","Department of River Ecology and Conservation, Senckenberg Research Institute and Natural History Museum Frankfurt, D-63571 Gelnhausen, Germany; Leibniz-Institute of Freshwater Ecology and Inland Fisheries (IGB), Department of Ecosystem Research, 12587 Berlin, Germany","Conceived and designed the experiments: JDT. Performed the experiments: JDT. Analyzed the data: JDT. Contributed reagents/materials/analysis tools: SCJ PH. Wrote the paper: JDT AS SCJ PH. Compiled data: AS JDT.","The authors have declared that no competing interests exist."
"10.1371/journal.pone.0010436","plos one","2010-05-03T00:00:00Z","Adam D Cohen; David A Schaer; Cailian Liu; Yanyun Li; Daniel Hirschhorn-Cymmerman; Soo Chong Kim; Adi Diab; Gabrielle Rizzuto; Fei Duan; Miguel A Perales; Taha Merghoub; Alan N Houghton; Jedd D Wolchok","Department of Medicine, Memorial Sloan-Kettering Cancer Center, New York, New York, United States of America; Immunology Program, Sloan-Kettering Institute for Cancer Research, New York, New York, United States of America; Weill Medical College of Cornell University, New York, New York, United States of America","Conceived and designed the experiments: ADC DAS TM ANH JDW. Performed the experiments: ADC DAS CL YL DHC SCK AD GAR FD. Analyzed the data: ADC DAS CL SCK MP TM ANH. Contributed reagents/materials/analysis tools: TM. Wrote the paper: ADC DAS.","The authors have declared that no competing interests exist."
"10.1371/journal.pone.0124335","plos one","2015-04-17T00:00:00Z","Tam T Nguyen; Patrick J Collins; Paul R Ebert","School of Biological Sciences, University of Queensland, St. Lucia, Queensland, Australia; Faculty of Biology, Hanoi National University of Education, Hanoi, Vietnam; Department of Agriculture, Fisheries and Forestry, Ecosciences Precinct, Brisbane, Queensland, Australia","Conceived and designed the experiments: TTN PJC PRE. Performed the experiments: TTN. Analyzed the data: TTN PJC PRE. Contributed reagents/materials/analysis tools: TTN PJC. Wrote the paper: TTN PJC PRE.","The authors have declared that no competing interests exist."
"10.1371/journal.pone.0135467","plos one","2015-08-12T00:00:00Z","Jan Pieter van der Berg; Pramod Kumar Madoori; Amalina Ghaisani Komarudin; Andy-Mark Thunnissen; Arnold J M Driessen","Molecular Microbiology, Groningen Biomolecular Sciences and Biotechnology Institute, University of Groningen, Groningen, The Netherlands; Department of Biophysical Chemistry, Groningen Biomolecular Sciences and Biotechnology Institute, University of Groningen, Groningen, The Netherlands","Conceived and designed the experiments: JB PM AT AD. Performed the experiments: JB PM AK. Analyzed the data: JB PM AK AT AD. Contributed reagents/materials/analysis tools: JB PM AK AT AD. Wrote the paper: JB PM AK AT AD.","The authors have declared that no competing interests exist."
"10.1371/journal.pone.0031984","plos one","2012-05-31T00:00:00Z","Liyan Shao; Lishan Wang; Zhiyun Wei; Yuyu Xiong; Yang Wang; Kefu Tang; Yang Li; Guoyin Feng; Qinghe Xing; Lin He","Bio-X Institutes, Key Laboratory for the Genetics of Developmental and Neuropsychiatric Disorders (Ministry of Education), Shanghai Jiao Tong University, Shanghai, China; Institute for Nutritional Sciences, Shanghai Institutes of Biological Sciences, Chinese Academy of Sciences, Shanghai, China; Institutes of Biomedical Sciences, Fudan University, Shanghai, China","Conceived and designed the experiments: LYS LH QHX. Performed the experiments: LYS LSW ZYW. Analyzed the data: YYX YW KFT. Contributed reagents/materials/analysis tools: YL GYF. Wrote the paper: LYS LSW.","The authors have declared that no competing interests exist."
"10.1371/journal.pone.0010449","plos one","2010-05-03T00:00:00Z","Johan Lundberg; Stefan Jonsson; Staffan Holmin","Department of Clinical Neuroscience, Karolinska Institutet and Department of Neuroradiology, Karolinska University Hospital, Stockholm, Sweden; Department of Materials Science and Engineering, Royal Institute of Technology, Stockholm, Sweden","Contributed to the design of the prototypes: SH JL SJ. Had the initial idea of transvascular intervention and performed microsurgery and angiographical intervention: SH. Wrote revisions of the manuscript: SH SJ. Performed simulations and flow-calculations: JL SJ. Developed early prototypes, performed microsurgery and angiographical intervention in small and large animals, assisted in building prototypes, wrote first draft and revisions of the manuscript: JL. Developed the construction process and built all the prototypes: SJ.","The medical device/catheter system described in the paper is subject to US and PCT patent application. The patent application is still in process. The entire system/device has been manufactured by hand and is not part of any now available commercial products or modified commercial products. None of the authors are shareholders in any company associated with the patent nor has any of the work with the device/catheter system been part of an employment or consultancy from any catheter developing company. In accordance with PLoS ONE sharing policies the authors will freely make available any materials and information associated with their publication that are reasonably requested by others for the purpose of academic, non-commercial research."
"10.1371/journal.pone.0054947","plos one","2013-01-29T00:00:00Z","Stéphanie Simon; Christian Demeure; Patricia Lamourette; Sofia Filali; Marc Plaisance; Christophe Créminon; Hervé Volland; Elisabeth Carniel","CEA Saclay, iBiTec-S, Service de Pharmacologie et d’Immunoanalyse, Laboratoire d’Etudes et de Recherches en Immunoanalyse, Gif sur Yvette, France; Institut Pasteur, Yersinia Research Unit and WHO Collaborating Center for Yersinia, Paris, France","Conceived and designed the experiments: SS CD EC. Performed the experiments: SS CD PL SF MP. Analyzed the data: SS CD PL HV CC EC. Contributed reagents/materials/analysis tools: SS CD PL HV EC. Wrote the paper: SS CD CC EC.","The authors have declared that no competing interests exist."
"10.1371/journal.pone.0054946","plos one","2013-02-04T00:00:00Z","Charatdao Bunthi; Somsak Thamthitiwat; Henry C Baggett; Pasakorn Akarasewi; Ruchira Ruangchira-urai; Susan A Maloney; Kumnuan Ungchusak","International Emerging Infections Program, Global Disease Detection Regional Center, Thailand Ministry of Public Health- US Centers for Disease Control and Prevention Collaboration, Nonthaburi, Thailand; Bureau of Epidemiology, Thailand Ministry of Public Health, Nonthaburi, Thailand; Department of Pathology, Siriraj Hospital, Mahidol University, Bangkok, Thailand","Reviewed and edited the manuscript: ST HB PA SM KU. Conceived and designed the experiments: CB ST RR HB PA SM KU. Performed the experiments: CB ST. Analyzed the data: CB. Wrote the paper: CB RR.","The authors have declared that no competing interests exist."
"10.1371/journal.pone.0031982","plos one","2012-02-24T00:00:00Z","Michal Ciborowski; Joanna Teul; Jose Luis Martin-Ventura; Jesús Egido; Coral Barbas","CEMBIO (Center for Metabolomics and Bioanalysis), Facultad de Farmacia, Universidad CEU San Pablo, Madrid, Spain; Department of Physical Chemistry, Medical University of Bialystok, Bialystok, Poland; Department of Pharmaceutical Analysis, Medical University of Bialystok, Bialystok, Poland; Vascular Research Laboratory, IIS-Fundación Jiménez Díaz, Madrid, Spain; Autónoma University, Madrid, Spain","Conceived and designed the experiments: JLMV JE CB. Performed the experiments: JT. Analyzed the data: MC. Wrote the paper: MC JLMV CB.","Funding was provided by EADSCASA; however, this does not alter the authors' adherence to all the PLoS ONE policies on sharing data and materials."
"10.1371/journal.pone.0054945","plos one","2013-01-23T00:00:00Z","Theodore McCormack; Oliver Frings; Andrey Alexeyenko; Erik L L Sonnhammer","Stockholm Bioinformatics Centre, Science for Life Laboratory, Solna, Sweden; Department of Biochemistry and Biophysics, Stockholm University, Stockholm, Sweden; School of Biotechnology, Royal Institute of Technology, Stockholm, Sweden; Swedish eScience Research Center, Stockholm, Sweden","Conceived and designed the experiments: TM OF AA ES. Performed the experiments: TM OF. Analyzed the data: TM OF AA ES. Contributed reagents/materials/analysis tools: TM OF AA ES. Wrote the paper: TM OF AA ES.","The authors have declared that no competing interests exist."
"10.1371/journal.pone.0124351","plos one","2015-05-11T00:00:00Z","Michael K Adjemian; Richard J Volpe; Jennifer Adjemian","Economic Research Service, United States Department of Agriculture, Washington, District of Columbia, United States of America; Agribusiness Department, College of Agriculture, Food, and Environmental Sciences, California Polytechnic State University, San Luis Obispo, California, United States of America; Epidemiology Unit, Laboratory of Clinical Infectious Diseases, National Institute of Allergy and Infectious Diseases, Bethesda, Maryland, United States of America; United States Public Health Service Commissioned Corps, Rockville, Maryland, United States of America","Conceived and designed the experiments: MA JA RV. Performed the experiments: MA. Analyzed the data: MA JA. Contributed reagents/materials/analysis tools: MA RV. Wrote the paper: MA RV JA.","The authors have declared that no competing interests exist."
"10.1371/journal.pone.0135464","plos one","2015-08-13T00:00:00Z","Cara A Rockwell; Manuel R Guariguata; Mary Menton; Eriks Arroyo Quispe; Julia Quaedvlieg; Eleanor Warren-Thomas; Harol Fernandez Silva; Edwin Eduardo Jurado Rojas; José Andrés Hideki Kohagura Arrunátegui; Luis Alberto Meza Vega; Olivia Revilla Vera; Roger Quenta Hancco; Jonatan Frank Valera Tito; Betxy Tabita Villarroel Panduro; Juan José Yucra Salas","Center for International Forestry Research (CIFOR), Lima, Perú; International Center for Tropical Botany, Department of Earth and Environment, Florida International University (FIU), Miami, FL, United States of America; Solutions and Evidence for Environment and Development (SEED), Oxford, United Kingdom; Universidad Nacional Amazónica de Madre de Dios (UNAMAD), Facultad de Ingeniería Forestal y Medio Ambiente, Puerto Maldonado, Madre de Dios, Perú; Centre for Ecology, Evolution and Conservation, School of Environmental Sciences, University of East Anglia, Norwich, United Kingdom","Conceived and designed the experiments: MRG MM CAR. Performed the experiments: EAQ HFS EEJR JAHKA LAMV ORV RQH JFVT BTVP JJYS. Analyzed the data: CAR. Contributed reagents/materials/analysis tools: EWT. Wrote the paper: CAR MRG MM JQ EWT. Reviewed and commented on manuscript: EAQ HFS EEJR JAHKA LAMV ORV RQH JFVT BTVP JJYS.","The authors have declared that no competing interests exist. The authors would also like to emphasize that Solutions and Evidence for Environment and Development did not provide support in the form of salary for MM during the time she was involved in this project, nor did this company have any additional role in the study design, data collection and analysis, decision to publish, or preparation of the manuscript. MM contributed to the development period of the study when she was still employed by CIFOR. The specific role of this author is articulated in the ‘author contributions’ section."
"10.1371/journal.pone.0124350","plos one","2015-04-17T00:00:00Z","Pervez Haider Zaidi; Zerka Rashid; Madhumal Thayil Vinayan; Gustavo Dias Almeida; Ramesh Kumar Phagna; Raman Babu","International Maize and Wheat Improvement Center (CIMMYT)—Asia, C/o International Crop Research Institute for Semi-Arid Tropics (ICRISAT), Patancheru, Hyderabad, India; Directorate of Maize Research (DMR), Pusa Campus, New Delhi, India; Monsanto Company, Uberlândia, Minas Gerais, Brazil","Conceived and designed the experiments: PHZ RB. Performed the experiments: PHZ ZR MTV RKP. Analyzed the data: GDA RB. Wrote the paper: RB MTV PHZ.","The authors declare no conflict of interest. Gustavo Dias Almeida is an employee of Monsanto Company, Brazil. This does not alter the authors' adherence to PLOS ONE policies on sharing data and materials."
"10.1371/journal.pone.0010446","plos one","2010-05-05T00:00:00Z","Geneviève Mailhot; Rémi Rabasa-Lhoret; Alain Moreau; Yves Berthiaume; Emile Levy","Research Centre, CHU Sainte-Justine, Université de Montréal, Montreal, Quebec, Canada; Department of Nutrition, Université de Montréal, Montreal, Quebec, Canada; Department of Pediatrics, Université de Montréal, Montreal, Quebec, Canada; Cystic Fibrosis Clinic, Centre Hospitalier de l'Université de Montréal (CHUM)-Hôtel-Dieu, Montreal, Quebec, Canada; Diabetes and Metabolic Diseases Research Group, Institut de Recherches Cliniques and Centre Hospitalier de l'Université de Montréal (CHUM)-Hôtel-Dieu, Université de Montréal, Montreal, Quebec, Canada","Conceived and designed the experiments: GM EL. Performed the experiments: GM AM. Analyzed the data: GM. Contributed reagents/materials/analysis tools: YB. Wrote the paper: GM RRL EL.","The authors have declared that no competing interests exist."
"10.1371/journal.pone.0010445","plos one","2010-05-03T00:00:00Z","Katarina Hajdin; Valentina D'Alessandro; Felix K Niggli; Beat W Schäfer; Michele Bernasconi","Department of Oncology, University Children's Hospital Zurich, Zurich, Switzerland; Experimental Infectious Diseases and Cancer Research, University Children's Hospital Zurich, Zurich, Switzerland","Conceived and designed the experiments: KH FKN BWS MB. Performed the experiments: KH VD MB. Analyzed the data: KH VD MB. Contributed reagents/materials/analysis tools: FKN BWS. Wrote the paper: KH MB.","The authors have declared that no competing interests exist."
"10.1371/journal.pone.0031979","plos one","2012-02-21T00:00:00Z","Shifu Kan; Yuhang Wang; Lili Sun; Peng Jia; Yanxin Qi; Jiaqiang Su; Lei Liu; Guohua Yang; Liming Liu; Zhuoyue Wang; Jinhui Wang; Guangchen Liu; Ningyi Jin; Xiao Li; Zhuang Ding","College of Animal Science and Veterinary Medicine, Jilin University, Jilin, People's Republic of China; Genetic Engineering Laboratory of PLA, Academy of Military Medical Sciences of PLA, Jilin, People's Republic of China; Department of Head and Neck Surgery, Tumor Hospital of Jilin Province, Jilin, People's Republic of China; Animal & Plant Inspection and Quarantine Technology Center, Shenzhen Entry-Exit Inspection and Quarantine Bureau, Guangdong, People's Republic of China; Norman Bethune School of Medical Science, Jilin University, Jilin, People's Republic of China","Conceived and designed the experiments: NJ XL ZD. Performed the experiments: SK YW LS PJ JS LL LL GY ZW. Analyzed the data: SK YW LS PJ. Contributed reagents/materials/analysis tools: YQ JW GL. Wrote the paper: SK.","The authors have declared that no competing interests exist."
"10.1371/journal.pone.0054939","plos one","2013-01-25T00:00:00Z","D Ross Robertson","Smithsonian Tropical Research Institute, Balboa, Republic of Panamá","Conceived and designed the experiments: DRR. Performed the experiments: DRR. Analyzed the data: DRR. Contributed reagents/materials/analysis tools: DRR. Wrote the paper: DRR.","The author has declared that no competing interests exist."
"10.1371/journal.pone.0010444","plos one","2010-05-06T00:00:00Z","Beth F Kochin; Andrew J Yates; Jacobus C de Roode; Rustom Antia","Department of Biology, Emory University, Atlanta, Georgia, United States of America","Conceived and designed the experiments: JCdR RA. Performed the experiments: JCdR. Analyzed the data: BFK AJY. Wrote the paper: BFK AJY RA.","The authors have declared that no competing interests exist."
"10.1371/journal.pone.0124347","plos one","2015-04-17T00:00:00Z","Cansu Yıldırım; Daphne Y S Vogel; Maurits R Hollander; Josefien M Baggen; Ruud D Fontijn; Sylvia Nieuwenhuis; Anouk Haverkamp; Margreet R de Vries; Paul H A Quax; Juan J Garcia-Vallejo; Anja M van der Laan; Christine D Dijkstra; Tineke C T M van der Pouw Kraan; Niels van Royen; Anton J G Horrevoets","Dept of Molecular Cell Biology and Immunology, VU University Medical Centre, Amsterdam, the Netherlands; Dept of Cardiology, VU University Medical Centre, Amsterdam, the Netherlands; Dept of Vascular Surgery, Einthoven Laboratories, Leiden University Medical Centre, Leiden, the Netherlands; Dept of Cardiology, Academic Medical Centre, University of Amsterdam, Amsterdam, the Netherlands","Conceived and designed the experiments: CY DV MH JB RF SN AH MdeV PQ JGV AvdL CD TvdPK NvR AJGH. Performed the experiments: CY DV MH JB RF SN AH MdeV JGV AvdL. Analyzed the data: CY DV MH JB RF SN AH MdeV PQ JGV AvdL CD TvdPK NvR AJGH. Contributed reagents/materials/analysis tools: DV SN MdeV PQ JGV AvdL. Wrote the paper: CY DV MH JB RF SN AH MdeV PQ JGV AvdL CD TvdPK NvR AJGH.","The authors have declared that no competing interests exist."
"10.1371/journal.pone.0124352","plos one","2015-04-29T00:00:00Z","Haiyan Wang; Liangzhong Sun; Weiping Tan","Department of Pediatrics, Sun Yat-sen Memorial Hospital, Sun Yat-sen University, Guangzhou, Guangdong, Peoples’ Republic of China; Children’s Kidney Disease Center, Department of Pediatrics, The First Affiliated Hospital, Sun Yat-sen University, Guangzhou, Guangdong, Peoples’ Republic of China","Conceived and designed the experiments: WT. Analyzed the data: HW LS. Contributed reagents/materials/analysis tools: HW LS WT. Wrote the paper: HW LS.","The authors have declared that no competing interests exist."
"10.1371/journal.pone.0135465","plos one","2015-08-18T00:00:00Z","Stephen S Ban; Robert L Pressey; Nicholas A J Graham","ARC Centre of Excellence for Coral Reef Studies, James Cook University, Townsville, Queensland, Australia","Conceived and designed the experiments: SB. Performed the experiments: SB. Analyzed the data: SB. Contributed reagents/materials/analysis tools: SB. Wrote the paper: SB RLP NG.","The authors have declared that no competing interests exist."
"10.1371/journal.pone.0010447","plos one","2010-05-27T00:00:00Z","Stefan Prost; Nickolay Smirnov; Vadim B Fedorov; Robert S Sommer; Mathias Stiller; Doris Nagel; Michael Knapp; Michael Hofreiter","Research Group Molecular Ecology, Max-Planck Institute for Evolutionary Anthropology, Leipzig, Germany; Department of Paleontology, University of Vienna, Vienna, Austria; Institute of Plant and Animal Ecology, Russian Academy of Sciences, Yekaterinburg, Russia; Institute of Arctic Biology, University of Alaska Fairbanks, Fairbanks, Alaska, United States of America; Ecology Centre, Christian-Albrechts-University of Kiel, Kiel, Germany","Conceived and designed the experiments: SP MS DN MK MH. Performed the experiments: SP. Analyzed the data: SP. Contributed reagents/materials/analysis tools: NS VBF. Wrote the paper: SP NS VBF RS MK MH.","The authors have declared that no competing interests exist."
"10.1371/journal.pone.0031981","plos one","2012-02-22T00:00:00Z","Yann Bertrand; Mats Töpel; Annelie Elväng; Wessam Melik; Magnus Johansson","Department of Plant and Environmental Sciences, Göteborg University, Göteborg, Sweden; School of Life Sciences, Södertörn University, Huddinge, Sweden; Department of Genetics, Microbiology and Toxicology, Stockholm University, Stockholm, Sweden","Conceived and designed the experiments: YB AE MT. Performed the experiments: YB MT. Analyzed the data: YB MT. Contributed reagents/materials/analysis tools: YB MT. Wrote the paper: YB MT WM MJ.","The authors have declared that no competing interests exist."
"10.1371/journal.pone.0054943","plos one","2013-01-28T00:00:00Z","Sam M Doesburg; George M Ibrahim; Mary Lou Smith; Rohit Sharma; Amrita Viljoen; Bill Chu; James T Rutka; O Carter Snead; Elizabeth W Pang","Department of Diagnostic Imaging, Hospital for Sick Children, Toronto, Ontario, Canada; Neurosciences and Mental Health Program, Hospital for Sick Children Research Institute, Toronto, Ontario, Canada; Department of Medical Imaging, University of Toronto, Toronto, Ontario, Canada; Division of Neurosurgery, Hospital for Sick Children, Toronto, Ontario, Canada; Institute of Medical Science, University of Toronto, Toronto, Ontario, Canada; Division of Neurology, Hospital for Sick Children, Toronto, Ontario, Canada; Department of Psychology, University of Toronto, Toronto, Ontario, Canada","Conceived and designed the experiments: SMD GMI EWP. Performed the experiments: SMD GMI MLS RS AV BC JTR OCS EWP. Analyzed the data: SMD GMI. Wrote the paper: SMD GMI EWP.","The authors have declared that no competing interests exist."
"10.1371/journal.pone.0031980","plos one","2012-02-29T00:00:00Z","Ulla Knorr; Maj Vinberg; Erik Lykke Mortensen; Per Winkel; Christian Gluud; Jørn Wetterslev; Ulrik Gether; Lars Vedel Kessing","Psychiatric Centre Copenhagen, Rigshospitalet, University Hospital of Copenhagen, Copenhagen, Denmark; Copenhagen Trial Unit, Centre for Clinical Intervention Research, Rigshospitalet, University Hospital Copenhagen, Copenhagen, Denmark; Department of Health Psychology, University of Copenhagen, Copenhagen, Denmark; Department of Neuroscience and Pharmacology, Centre for Pharmacogenomics, University of Copenhagen, Copenhagen, Denmark","Conceived and designed the experiments: UK MV LVK CG JW UG. Performed the experiments: UK. Analyzed the data: PW UK LVK JW CG. Wrote the paper: UK. Revised drafts of the paper and final approval: UK MV ELM UG CG PW JW LVK.","The authors have read the journal's policy and have the following conflicts: UK has been a paid speaker for Servier. MV has been a paid speaker for Eli Lilly, Jannsen-Cilag and AstraZeneca. LVK has been a consultant for Bristol-Myers Squibb, Eli Lilly, Lundbeck, AstraZeneca, Servier and Janssen-Cilag. The trial was fully investigator initiated and controlled to secure unbiased assessment of the effect of escitalopram on healthy first-degree relatives of patients with MD. ELM, UG, CG, PW, and JW declare no competing interests. This does not alter the authors' adherence to all the PLoS ONE policies on sharing data and materials."
"10.1371/journal.pone.0135461","plos one","2015-08-20T00:00:00Z","Ying Wang; Kaichun Wu; Zhiping Yang; Qingchuan Zhao; Dongmei Fan; Po Xu; Yongzhan Nie; Daiming Fan","State Key Laboratory of Cancer Biology and Xijing Hospital of Digestive Diseases, Fourth Military Medical University, 15 Changlexi Road, Xi’an, Shaanxi, China; Department of Oncology, First Affiliated Hospital of Henan University of Science and Technology, 24 Jinghua Road, Luoyang, Henan, China; Department of Gynaecology and Obstetrics, First Affiliated Hospital of Henan University of Science and Technology, 24 Jinghua Road, Luoyang, Henan, China; Department of Urology, First Affiliated Hospital of Henan University of Science and Technology, 24 Jinghua Road, Luoyang, Henan, China","Conceived and designed the experiments: Daiming Fan. Performed the experiments: YW. Analyzed the data: KW. Contributed reagents/materials/analysis tools: ZY. Wrote the paper: QZ. Submitted data in the Gene Expression Omnibus: Dongmei Fan PX. Acted as a guarantor for the data in the manuscript: Daiming Fan. Provided intellectual input: ZY QZ YN.","The authors have declared that no competing interests exist."
"10.1371/journal.pone.0124348","plos one","2015-04-21T00:00:00Z","Patrizia Paganin; Ersilia Vita Fiscarelli; Vanessa Tuccio; Manuela Chiancianesi; Giovanni Bacci; Patrizia Morelli; Daniela Dolce; Claudia Dalmastri; Alessandra De Alessandri; Vincenzina Lucidi; Giovanni Taccetti; Alessio Mengoni; Annamaria Bevivino","Technical Unit for Sustainable Development and Innovation of Agro-Industrial System, ENEA (Italian National Agency for New Technologies, Energy and Sustainable Economic Development), Casaccia Research Center, Rome, Italy; Cystic Fibrosis Microbiology and Cystic Fibrosis Center, Children's Hospital and Research Institute Bambino Gesù, Rome, Italy; Department of Evolutionary Biology, University of Florence, Florence, Italy; Department of Pediatrics, Cystic Fibrosis Center, G. Gaslini Institute, Genoa, Italy; Department of Pediatrics, Cystic Fibrosis Center, Meyer Hospital, Florence, Italy","Conceived and designed the experiments: AB GT VL. Performed the experiments: PP EVF VT MC PM DD ADA VL GT. Analyzed the data: AB AM EVF GT ADA VL GB CD. Contributed reagents/materials/analysis tools: AB AM EVF ADA VL GT GB. Wrote the paper: AB AM EVF GT VL.","The authors have declared that no competing interests exist."
