"id","journal","publication_date","author","author_affiliate","author_notes","competing_interest"
"10.1371/journal.pone.0076812","plos one","2013-10-09T00:00:00Z","Michal Zdzalik; Magdalena Kalinska; Magdalena Wysocka; Justyna Stec-Niemczyk; Przemyslaw Cichon; Natalia Stach; Natalia Gruba; Henning R Stennicke; Abeer Jabaiah; Michal Markiewicz; Sylwia Kedracka-Krok; Benedykt Wladyka; Patrick S Daugherty; Adam Lesner; Krzysztof Rolka; Adam Dubin; Jan Potempa; Grzegorz Dubin","Department of Microbiology, Faculty of Biochemistry, Biophysics and Biotechnology, Jagiellonian University, Krakow, Poland; Faculty of Chemistry, University of Gdansk, Gdansk, Poland; Department of Analytical Biochemistry, Faculty of Biochemistry, Biophysics and Biotechnology, Jagiellonian University, Krakow, Poland; Haemophilia Biology, Novo Nordisk A/S, Maaloev, Denmark; Department of Chemical Engineering, University of California at Santa Barbara, Santa Barbara, California, United States of America; Department of Computational Biophysics and Bioinformatics, Faculty of Biochemistry, Biophysics and Biotechnology, Jagiellonian University, Krakow, Poland; Department of Physical Biochemistry, Faculty of Biochemistry, Biophysics and Biotechnology, Jagiellonian University, Krakow, Poland; Malopolska Centre of Biotechnology, Krakow, Poland; Center of Oral Health and Systemic Disease, School of Dentistry, University of Louisville, Louisville, Kentucky, United States of America","Conceived and designed the experiments: HS GD KR PSD AL. Performed the experiments: MZ MK MW JSN PC NS NG AJ MM SKK. Analyzed the data: MZ MM SKK BW AL AD JP GD HS. Wrote the manuscript: AD JP GD.","The authors have the following interests: Henning R. Stennicke is employed by Novo Nordisk A/S. This does not alter the authors’ adherence to all the PLOS ONE policies on sharing data and materials."
"10.1371/journal.pone.0065300","plos one","2013-06-05T00:00:00Z","Vikram R Shende; Nichole Neuendorff; David J Earnest","Department of Biology, Texas A&M University, College Station, Texas, United States of America; Center for Biological Clocks Research, Texas A&M University, College Station, Texas, United States of America; Department of Neuroscience and Experimental Therapeutics, Texas A&M Health Science Center, College of Medicine, Bryan, Texas, United States of America","Conceived and designed the experiments: VRS DJE. Performed the experiments: VRS NN. Analyzed the data: VRS NN DJE. Contributed reagents/materials/analysis tools: VRS NN DJE. Wrote the paper: VRS DJE.","The authors have declared that no competing interests exist."
"10.1371/journal.pone.0088285","plos one","2014-05-15T00:00:00Z","Anja Vogelgesang; Cristina Scapin; Caroline Barone; Elaine Tam; Anna Blumental Perry; Christiane E L Dammann","Division of Newborn Medicine, Department of Pediatrics, Floating Hospital for Children at Tufts Medical Center, Boston, Massachusetts, United States of America; Hanover Medical School, Hanover, Germany; Department of Surgery, Tufts Medical Center, Boston, Massachusetts, United States of America; Sackler School of Graduate Biomedical Sciences, Tufts University School of Medicine, Boston, Massachusetts, United States of America; Genetic and Cellular Biology Division, Dibit. San Raffaele Scientific Institute, Milan, Italy; Department of Biomedical Sciences, Mercer School of Medicine and Department of Laboratory Oncology Research, Anderson Cancer Institute, Memorial University Medical Center, Savannah, Georgia, United States of America","Conceived and designed the experiments: ABP CD CS. Performed the experiments: AC CS CB ET. Analyzed the data: AV CS CB ET. Contributed reagents/materials/analysis tools: ABP CD. Wrote the paper: AV ABP CD.","The authors have declared that no competing interests exist."
"10.1371/journal.pone.0111166","plos one","2014-10-22T00:00:00Z","Sherin Al-Safadi; Aya Al-Safadi; Marie Branchaud; Spencer Rutherford; Arun Dayanandan; Barry Robinson; Shimon Amir","Department of Biology, Concordia University, Montréal, Quebéc, Canada; Department of Psychology, Center for Studies in Behavioral Neurobiology, Concordia University, Montréal, Quebéc, Canada","Conceived and designed the experiments: SAS SA. Performed the experiments: SAS AAS MB SR AD BR. Analyzed the data: SAS SA. Wrote the paper: SAS SA.","The authors have declared that no competing interests exist."
"10.1371/journal.pone.0088291","plos one","2014-02-12T00:00:00Z","Lei Wang; Haichuan Hu; Yunjian Pan; Rui Wang; Yuan Li; Lei Shen; Yongfu Yu; Hang Li; Deng Cai; Yihua Sun; Haiquan Chen","Department of Thoracic Surgery, Shanghai Medical College, Fudan University Shanghai Cancer Center, Shanghai, China; Department of Oncology, Shanghai Medical College, Fudan University Shanghai Cancer Center, Shanghai, China; Department of Pathology, Fudan University Shanghai Cancer Center, Shanghai, China; Department of Biostatistics, School of Public Health, Fudan University, Shanghai, China","Conceived and designed the experiments: LW YS HC. Performed the experiments: LW HH YP YL LS. Analyzed the data: LW HH YP YY YS HC. Contributed reagents/materials/analysis tools: LW RW HL DC. Wrote the paper: LW HH YS HC.","The authors have declared that no competing interests exist."
"10.1371/journal.pone.0065304","plos one","2013-06-13T00:00:00Z","Jennifer Adamski; Andrew Price; Caroline Dive; Guy Makin","Clinical and Experimental Pharmacology, Paterson Institute for Cancer Research, Manchester, United Kingdom; Institute of Cancer Sciences, Manchester Cancer Research Centre, Manchester Academic Health Sciences Centre, University of Manchester, Manchester, United Kingdom; Department of Paediatric Oncology, Royal Manchester Children’s Hospital, Manchester, United Kingdom","Conceived and designed the experiments: JA AP CD GM. Performed the experiments: JA AP. Analyzed the data: JA GM. Wrote the paper: JA GM.","The authors have declared that no competing interests exist."
"10.1371/journal.pone.0019379","plos one","2011-05-04T00:00:00Z","Robert J Elshire; Jeffrey C Glaubitz; Qi Sun; Jesse A Poland; Ken Kawamoto; Edward S Buckler; Sharon E Mitchell","Institute for Genomic Diversity, Cornell University, Ithaca, New York, United States of America; Computational Biology Service Unit, Cornell University, Ithaca, New York, United States of America; Hard Winter Wheat Genetics Research Unit, United States Department of Agriculture/Agricultural Research Service, Manhattan, Kansas, United States of America; Plant, Soil and Nutrition Research Unit, United States Department of Agriculture/Agricultural Research Service, Ithaca, New York, United States of America","Conceived and designed the experiments: RJE JCG QS JAP KK ESB SEM. Performed the experiments: RJE JCG QS JAP KK. Analyzed the data: RJE JCG QS JAP ESB. Contributed reagents/materials/analysis tools: RJE JCG QS JAP ESB SEM. Wrote the paper: RJE JCG QS JAP ESB SEM.","The authors have declared that no competing interests exist."
"10.1371/journal.pone.0099659","plos one","2014-09-23T00:00:00Z","Ping Zhao; Fang Fang; Qin Yu; Jiao Guo; Jian-hua Zhang; Jifu Qu; Yingjie Liu","Tuberculosis Clinic, Chaoyang Distric Center for Disease Control and Prevention, Chaoyang District, Beijing, P.R. China; Department of Endocrinology, Chongqing Hospital of Traditional Chinese Medicine and Department of Endocrinology Chongqing No. 1 People's Hospital, Jiangbei District, Chongqing City, P.R. China; Department of Emergency Medicine, Daping Hospital, Third Military Medical University, Yuzhong District, Chongqing City, P.R. China","Conceived and designed the experiments: JQ PZ FF. Performed the experiments: JG JZ QY. Analyzed the data: PZ. Contributed reagents/materials/analysis tools: YL. Wrote the paper: PZ.","The authors have declared that no competing interests exist."
"10.1371/journal.pone.0145875","plos one","2016-01-04T00:00:00Z","Ibai Mendia-Iztueta; Kristen Monahan; Heikki Kyröläinen; Esa Hynynen","Department of Biology of Physical Activity, University of Jyväskylä, Jyväskylä, Finland; KIHU—Research Institute for Olympic Sports, Jyväskylä, Finland","Conceived and designed the experiments: IMI KM HK EH. Performed the experiments: IMI KM EH. Analyzed the data: IMI HK EH. Contributed reagents/materials/analysis tools: HK EH. Wrote the paper: IMI KM HK EH.","The authors have declared that no competing interests exist."
"10.1371/journal.pone.0076835","plos one","2013-10-02T00:00:00Z","Anneliese Müller; Kathrin Rychli; Meryem Muhterem-Uyar; Andreas Zaiser; Beatrix Stessl; Caitriona M Guinane; Paul D Cotter; Martin Wagner; Stephan Schmitz-Esser","Institute for Milk Hygiene, University of Veterinary Medicine Vienna, Vienna, Austria; Christian Doppler Laboratory for Molecularbiological Food Analytics, University of Veterinary Medicine, Vienna, Austria; Teagasc Food Research Centre, Moorepark, Fermoy, Cork, Ireland; Alimentary Pharmabiotic Centre, University College Cork, Cork, Ireland","Conceived and designed the experiments: SSE KR. Performed the experiments: AM KR MMU AZ CMG PDC. Analyzed the data: AM KR MW SSE. Contributed reagents/materials/analysis tools: BS. Wrote the manuscript: AM KR MW SSE.","The authors have declared that no competing interests exist."
"10.1371/journal.pone.0134339","plos one","2015-07-29T00:00:00Z","Estefanía Domínguez-Martínez; Eugenio Parise; Tommy Strandvall; Vincent M Reid","Department of Psychology, Lancaster University, Lancaster, United Kingdom; Tobii AB, Danderyd, Sweden","Conceived and designed the experiments: ED VR TS EP. Performed the experiments: ED. Analyzed the data: ED. Wrote the paper: ED VR EP TS.","Authors EDM and TS received funding from Tobii Technology AB, a commercial company, in the form of salaries. There are no patents, products in development or marketed products to declare. This did not alter the authors' adherence to PLOS ONE policies on sharing data and materials."
"10.1371/journal.pone.0122662","plos one","2015-03-24T00:00:00Z","Karin A W Wadt; Lauren G Aoude; Lotte Krogh; Lone Sunde; Anders Bojesen; Karen Grønskov; Nine Wartacz; Jakob Ek; Morten Tolstrup-Andersen; Mette Klarskov-Andersen; Åke Borg; Steffen Heegaard; Jens F Kiilgaard; Thomas V O Hansen; Kerenaftali Klein; Göran Jönsson; Krzysztof T Drzewiecki; Morten Dunø; Nicholas K Hayward; Anne-Marie Gerdes","Department of Clinical Genetics, University Hospital of Copenhagen, Copenhagen, Denmark; QIMR Berghofer Medical Research Institute, Brisbane, Australia; Department of Clinical Genetics, University hospital of Odense, Odense, Denmark; Department of Clinical Genetics, University hospital of Århus, Århus, Denmark; Department of Clinical Genetics, Vejle hospital, Lillebaelt Hospital, Vejle, Denmark; Department of Cellular and Molecular Medicine, University of Copenhagen, Copenhagen, Denmark; Department of Oncology, Lund University and Skåne University Hospital, Lund, Sweden; Department of Ophthalmology, Glostrup Hospital, University of Copenhagen, Denmark; Eye Pathology Institute, Department of Neuroscience and Pharmacology, University of Copenhagen, Copenhagen, Denmark; Center for Genomic Medicine, Rigshospitalet, Copenhagen University hospital, Copenhagen, Denmark; Department of Plastic Surgery, Breast Surgery and Burns, Rigshospitalet, Copenhagen University Hospital, Copenhagen, Denmark","Conceived and designed the experiments: KW NH AMG. Performed the experiments: KW LGA KG NW JE. Analyzed the data: KW LGA KG MTA Å. Borg TH KK GJ MD NH MTA MKA JE. Contributed reagents/materials/analysis tools: KW LK LS A. Bojesen KG SH JFK KD AMG. Wrote the paper: KW LGA LS A. Bojesen KG MD NH AMG.","LGA was supported by a PhD scholarship from the Australia and New Zealand Banking Group Limited Trustees; this does not alter the authors' adherence to PLOS ONE policies on sharing data and materials."
"10.1371/journal.pone.0099671","plos one","2014-06-13T00:00:00Z","Nan Hu; Helena Mora-Jensen; Kim Theilgaard-Mönch; Berber Doornbos-van der Meer; Minke G Huitema; Coen A Stegeman; Peter Heeringa; Cees G M Kallenberg; Johanna Westra","Department of Medicine, Peking University First Hospital, Beijing, China; The Granulocyte Research Laboratory, Department of Hematology, Rigshospitalet, University of Copenhagen, Copenhagen, Denmark; The Finsen Laboratory, Rigshospitalet & Biotech and Research Innovation Centre, University of Copenhagen, Copenhagen, Denmark; Department of Hematology, Skåne University Hospital, University of Lund, Lund, Sweden; Department of Rheumatology and Clinical Immunology, University Medical Center Groningen, University of Groningen, Groningen, The Netherlands; Department of Nephrology, University Medical Center Groningen, University of Groningen, Groningen, The Netherlands; Department of Pathology and Medical Biology, University Medical Center Groningen, University of Groningen, Groningen, The Netherlands","Conceived and designed the experiments: NH JW KTM CGMK PH. Performed the experiments: NH HMJ BDM MGH. Analyzed the data: NH JW KTM. Contributed reagents/materials/analysis tools: HMJ KTM CAS PH. Wrote the paper: NH JW CGMK PH.","The authors have declared that no competing interests exist."
"10.1371/journal.pone.0030886","plos one","2012-01-23T00:00:00Z","Firuseh Dierkes; Nikolaos Andriopoulos; Christoph Sucker; Kathrin Kuhr; Markus Hollenbeck; Gerd R Hetzel; Volker Burst; Sven Teschner; Lars C Rump; Thomas Benzing; Bernd Grabensee; Christine E Kurschat","Department of Nephrology, Medical Faculty, Heinrich-Heine-University, Düsseldorf, Germany; Renal Division, Department of Medicine and Center for Molecular Medicine, University of Cologne, Cologne, Germany; Department of Hemostasis and Transfusion Medicine, Heinrich-Heine-University Medical Center, Düsseldorf, Germany; Institute of Medical Statistics, Informatics and Epidemiology, University of Cologne, Cologne, Germany; Department of Nephrology and Rheumatology, Knappschaftskrankenhaus, Bottrop, Germany; Cologne Excellence Cluster on Cellular Stress Responses in Aging-Associated Diseases, University of Cologne, Cologne, Germany","Conceived and designed the experiments: CEK. Performed the experiments: FD. Analyzed the data: CEK KK NA. Wrote the paper: CEK. Critical revision of the manuscript and important intellectual contribution: CS MH GRH VB ST LCR TB BG.","The authors have declared that no competing interests exist."
"10.1371/journal.pone.0088173","plos one","2014-02-04T00:00:00Z","Anna Babakhanyan; Rose G F Leke; Ali Salanti; Naveen Bobbili; Philomina Gwanmesia; Robert J I Leke; Isabella A Quakyi; John J Chen; Diane Wallace Taylor","Department of Tropical Medicine, Medical Microbiology and Pharmacology, University of Hawai'i at Manoa, John A. Burns School of Medicine, Honolulu, Hawai'i, United States of America; The Biotechnology Center, Faculty of Medicine and Biomedical Research, University of Yaoundé 1, Yaoundé, Cameroon; Centre for Medical Parasitology, Department of International Health, Immunology and Microbiology, University of Copenhagen, Copenhagen, Denmark; School of Public Health, College of Health Sciences, University of Ghana, Legon, Ghana","Conceived and designed the experiments: AB RGFL AS NB JJC DWT. Performed the experiments: AB NB PG RJIL JJC. Analyzed the data: AB AS NB IAQ JJC DWT. Contributed reagents/materials/analysis tools: AS RGFL RJIL IAQ. Wrote the paper: AB AS DWT.","The authors have declared that no competing interests exist."
"10.1371/journal.pone.0065187","plos one","2013-06-11T00:00:00Z","Haiyun Wang; Guolin Wang; Chenxu Wang; Ying Wei; Zhiting Wen; Chunyan Wang; Ai Zhu","Department of Anesthesiology, Tianjin Medical University General Hospital, Tianjin Research Institute of Anesthesiology, Tianjin, People's Republic of China","Conceived and designed the experiments: HW . Performed the experiments: CW YW. Analyzed the data: ZW. Contributed reagents/materials/analysis tools: AZ. Wrote the paper: HW GW. Revised submission critically for important intellectual content: CW.","The authors have declared that no competing interests exist."
"10.1371/journal.pone.0030798","plos one","2012-01-26T00:00:00Z","Irina Makarevitch; Addie Thompson; Gary J Muehlbauer; Nathan M Springer","Department of Biology, Hamline University, Saint Paul, Minnesota, United States of America; Department of Agronomy and Plant Genetics, University of Minnesota, Saint Paul, Minnesota, United States of America; Microbial and Plant Genomics Institute, University of Minnesota, Saint Paul, Minnesota, United States of America; Department of Plant Biology, University of Minnesota, Saint Paul, Minnesota, United States of America","Conceived and designed the experiments: NMS IM GJM. Performed the experiments: IM AT. Analyzed the data: IM NMS GJM AT. Contributed reagents/materials/analysis tools: NMS GJM IM. Wrote the paper: IM NMS.","The authors have declared that no competing interests exist."
"10.1371/journal.pone.0134239","plos one","2015-07-30T00:00:00Z","Jaroslav Albert; Marianne Rooman","BioModeling, BioInformatics & BioProcesses, Université Libre de Bruxelles, Brussels, Belgium; Applied Physics Research Group, Vrije Universiteit Brussel, Brussels, Belgium","Conceived and designed the experiments: JA. Performed the experiments: JA. Analyzed the data: JA MR. Contributed reagents/materials/analysis tools: JA MR. Wrote the paper: JA MR.","The authors have declared that no competing interests exist."
"10.1371/journal.pone.0145778","plos one","2016-03-01T00:00:00Z","Brendan Fisher; Robin Naidoo","Gund Institute, Rubenstein School of Environment and Natural Resources, Aiken Center, University of Vermont, Burlington, Vermont, United States of America; World Wildlife Fund, Washington, DC, United States of America; Institute for Resources, Environment and Sustainability, University of British Columbia, Vancouver, British Columbia, Canada","Conceived and designed the experiments: BF RN. Performed the experiments: BF RN. Analyzed the data: BF RN. Wrote the paper: BF RN.","The authors have declared that no competing interests exist."
"10.1371/journal.pone.0042232","plos one","2012-07-25T00:00:00Z","Yuming Guo; Fan Jiang; Li Peng; Jun Zhang; Fuhai Geng; Jianming Xu; Canming Zhen; Xiaoming Shen; Shilu Tong","School of Public Health and Institute of Health and Biomedical Innovation, Queensland University of Technology, Brisbane, Australia; Department of Developmental and Behavioral Pediatrics, Shanghai Institute of Pediatric Translational Medicine, Shanghai Children's Medical Centre, Shanghai Jiaotong University, School of Medicine, Shanghai, China; Ministry of Education-Shanghai Key Laboratory of Children's Environmental Health, Xinhua Hospital, Shanghai Jiaotong University, School of Medicine, Shanghai, China; Shanghai Meteorological Bureau, Shanghai, China","Conceived and designed the experiments: YG XS ST. Performed the experiments: FJ LP JZ FG JX CZ. Analyzed the data: YG. Contributed reagents/materials/analysis tools: YG FJ. Wrote the paper: YG FJ LP JZ FG JX CZ XS ST.","The authors have declared that no competing interests exist."
"10.1371/journal.pone.0065186","plos one","2013-06-04T00:00:00Z","Edoardo Calizza; Loreto Rossi; Maria Letizia Costantini","Department of Environmental Biology, ‘Sapienza’ University of Rome, Rome, Italy","Conceived and designed the experiments: LR MLC. Performed the experiments: LR MLC. Analyzed the data: EC LR MLC. Contributed reagents/materials/analysis tools: LR. Wrote the paper: EC LR MLC.","The authors have declared that no competing interests exist."
"10.1371/journal.pone.0076726","plos one","2013-10-22T00:00:00Z","Susanne Cranz-Mileva; Melissa C Pamula; Bipasha Barua; Brinda Desai; Yaejee Hannah Hong; Jacquelyn Russell; Richard Trent; Jianqiu Wang; Nancy C Walworth; Sarah E Hitchcock-DeGregori","Department of Pathology and Laboratory Medicine, Robert Wood Johnson Medical School, Rutgers University, Piscataway, New Jersey, United States of America; Department of Pharmacology, Robert Wood Johnson Medical School, Rutgers University, Piscataway, New Jersey, United States of America","Conceived and designed the experiments: SC-M MCP BB JW NCW SEH-D. Performed the experiments: SC-M MCP BB BD YHH JR RT JW SEH-D. Analyzed the data: SC-M MCP BB YHH JR RT JW SEH-D. Contributed reagents/materials/analysis tools: SC-M MCP BD YHH JW NCW. Wrote the paper: SC-M BB SEH-D.","The authors have declared that no competing interests exist."
"10.1371/journal.pone.0065185","plos one","2013-06-06T00:00:00Z","Ceri Shipton; Christopher Clarkson; Marco Antonio Bernal; Nicole Boivin; Clive Finlayson; Geraldine Finlayson; Darren Fa; Francisco Giles Pacheco; Michael Petraglia","School of Social Science, University of Queensland, Brisbane, Queensland, Australia; The Gibraltar Caves Project, Gibraltar Museum, Gibraltar; School of Archaeology, University of Oxford, Oxford, England, United Kingdom; Department of Social Sciences, University of Toronto at Scarborough, Toronto, Ontario, Canada","Conceived and designed the experiments: MP CC NB CF. Performed the experiments: CS CC MP. Analyzed the data: CS CC MAB. Contributed reagents/materials/analysis tools: CS CC MAB CF GF DF FGP MP. Wrote the paper: CS MP CC GF CF MAB FGP.","Please note that one of the co-authors of this paper, Michael Petraglia, is a PLOS ONE Editorial Board member. This does not alter the authors' adherence to all the PLOS ONE policies on sharing data and materials."
"10.1371/journal.pone.0134237","plos one","2015-07-29T00:00:00Z","Xiaoyue Yu; Xiaoyu Liang; Kexue Liu; Wenxia Dong; Jianxin Wang; Ming-guo Zhou","College of Plant Protection, Nanjing Agricultural University, Nanjing, Jiangsu Province, China","Conceived and designed the experiments: XY KL JW MZ. Performed the experiments: XY XL KL WD. Analyzed the data: XY XL KL WD. Contributed reagents/materials/analysis tools: XY WD KL JW. Wrote the paper: XY MZ.","The authors have declared that no competing interests exist."
"10.1371/journal.pone.0122544","plos one","2015-03-30T00:00:00Z","Muhammad Aziz Rahman; Nicholas Hann; Andrew Wilson; George Mnatzaganian; Linda Worrall-Carter","The Mary MacKillop Institute for Health Research, Australian Catholic University, Melbourne, Australia; St Vincent’s Centre for Nursing Research (SVCNR), Australian Catholic University, Melbourne, Australia; The Cardiovascular Research Centre (CvRC), Australian Catholic University, Melbourne, Australia; The University of Melbourne, Melbourne, Australia; St Vincent’s Hospital, Melbourne, Australia; School of Allied Health, Faculty of Health Sciences, Australian Catholic University, Melbourne, Australia","Conceived and designed the experiments: MAR NH AW LWC. Performed the experiments: MAR NH. Analyzed the data: MAR NH GM. Contributed reagents/materials/analysis tools: MAR NH GM. Wrote the paper: MAR NH GM AW LWC.","The authors have declared that no competing interests exist."
"10.1371/journal.pone.0030795","plos one","2012-02-09T00:00:00Z","Matthias Bopp; Julia Braun; Felix Gutzwiller; David Faeh; for the Swiss National Cohort Study Group","Institute of Social and Preventive Medicine (ISPM), University of Zurich, Zurich, Switzerland","Conceived and designed the experiments: MB DF. Performed the experiments: MB DF JB. Analyzed the data: MB JB. Wrote the paper: MB DF JB. Conceived and directed the NRP 1A study: FG. Contributed important intellectual content and gave final approval of the version to be published: FG.","The authors have declared that no competing interests exist."
"10.1371/journal.pone.0042230","none","2012-08-08T00:00:00Z","Tianhai Tian; Jiangning Song","School of Mathematical Sciences, Faculty of Science, Monash University, Clayton, Victoria, Australia; Department of Biochemistry and Molecular Biology, Faculty of Medicine, Monash University, Clayton, Victoria, Australia","Conceived and designed the experiments: TT JS. Performed the experiments: TT. Analyzed the data: TT JS. Contributed reagents/materials/analysis tools: TT JS. Wrote the paper: TT JS.","The authors have declared that no competing interests exist."
"10.1371/journal.pone.0065182","plos one","2013-06-03T00:00:00Z","Frederikke F Rönsholt; Henrik Ullum; Terese L Katzenstein; Jan Gerstoft; Sisse R Ostrowski","Department of Infectious Diseases, Rigshospitalet, Copenhagen, Denmark; Department of Clinical Immunology, Rigshospitalet, Copenhagen, Denmark","Conceived and designed the experiments: SRO JG TLK HU FFR. Performed the experiments: FFR. Analyzed the data: FFR. Contributed reagents/materials/analysis tools: SRO HU FFR. Wrote the paper: FFR. Statistics: FFR HU SRO. Critical review: JG TLK HU SRO.","The authors have declared that no competing interests exist."
"10.1371/journal.pone.0076723","plos one","2013-10-02T00:00:00Z","Erin Gorman; Maureen C Ashe; David W Dunstan; Heather M Hanson; Ken Madden; Elisabeth A H Winkler; Heather A McKay; Genevieve N Healy","Centre for Hip Health and Mobility, Vancouver, British Columbia, Canada; University of British Columbia Department of Family Practice, Vancouver, British Columbia, Canada; Baker IDI Heart and Diabetes Institute, Melbourne, Victoria, Australia; University of British Columbia Department of Medicine, Vancouver, British Columbia, Canada; University of British Columbia Department of Orthopaedics, Vancouver, British Columbia, Canada; University of Queensland, School of Population Health, Brisbane, Queensland, Australia; Monash University, Epidemiology and Preventive Medicine, Melbourne, Victoria, Australia; University of Western Australia, School of Sports Science, Exercise and Health, Perth, Western Australia, Australia","Conceived and designed the experiments: EG MA DD EW KM HM GNH. Performed the experiments: EG MA HH. Analyzed the data: EG MA EW GNH. Contributed reagents/materials/analysis tools: MA HM. Wrote the manuscript: EG MA DD HH HM KM EW GNH.","The authors have declared that no competing interests exist."
