"id","journal","publication_date","author","author_affiliate","author_notes","competing_interest"
"10.1371/journal.pone.0086422","plos one","2014-01-17T00:00:00Z","Honghao Cai; Yushan Chen; Xiaohong Cui; Shuhui Cai; Zhong Chen","Department of Electronic Science, Fujian Provincial Key Laboratory of Plasma and Magnetic Resonance, State Key Laboratory of Physical Chemistry of Solid Surfaces, Xiamen University, Xiamen, China","Conceived and designed the experiments: HC XC ZC. Performed the experiments: HC YC. Analyzed the data: HC XC. Contributed reagents/materials/analysis tools: HC YC. Wrote the paper: HC XC ZC SC. Purchased the experimental materials: HC XC.","The authors have declared that no competing interests exist."
"10.1371/journal.pone.0097788","plos one","2014-06-06T00:00:00Z","Yujiao Zhou; Yuan Zhang; Yang Guo; Youyi Zhang; Ming Xu; Bei He","Department of Respiratory Medicine and Institute of Vascular Medicine, Peking University Third Hospital; Beijing Key Laboratory of Cardiovascular Receptors Research, Key Laboratory of Cardiovascular Molecular Biology and Regulatory Peptides, Beijing, People’s Republic of China; Department of Respiratory Medicine, Changji Renmin Hospital, Changji, Xinjiang, People’s Republic of China","Conceived and designed the experiments: BH MX Youyi Zhang. Performed the experiments: Y. Zhou Yuan Zhang YG. Analyzed the data: Y. Zhou Yuan Zhang. Contributed reagents/materials/analysis tools: Y. Zhou Yuan Zhang. Wrote the paper: Y. Zhou. Developed the research ideas and experimental design: BH MX Youyi Zhang. Performed animal experiments: Y. Zhou Yuan Zhang YG. Cell cultures, statistical analysis and wrote manuscript: Y. Zhou. Manuscript writing and editing: BH MX Youyi Zhang.","The authors have declared that no competing interests exist."
"10.1371/journal.pone.0132352","plos one","2015-07-06T00:00:00Z","Jian Yin; Juan Wen; Dong Hang; Jing Han; Jie Jiang; Ci Song; Yao Liu; Jibin Liu; Li Liu; Liguo Zhu; Jianguo Chen; Xiangjun Zhai; Shuanghua Xie; Zhibin Hu; Hongbing Shen; Min Dai; Ni Li","Department of Epidemiology and Biostatistics, Jiangsu Key Lab of Cancer Biomarkers, Prevention and Treatment, Collaborative Innovation Center For Cancer Personalized Medicine, School of Public Health, Nanjing Medical University, Nanjing, China; Pathology Center and Department of Pathology, Soochow University, Suzhou, China; Department of Hepatobiliary Surgery, Nantong Tumor Hospital, Nantong, China; Digestive Endoscopy Center, the First Affiliated Hospital of Nanjing Medical University, Nanjing, China; Department of Infection Diseases, Jiangsu Province Center for Disease Prevention and Control, Nanjing, China; Qidong Liver Cancer Institute, Qidong, China; National Office for Cancer Prevention and Control, Cancer Institute and Hospital, Chinese Academy of Medical Science, Beijing, China","Conceived and designed the experiments: NL MD HS ZH JY JW. Performed the experiments: JY JW JH JJ CS YL SX. Analyzed the data: JY JW NL MD HS ZH. Contributed reagents/materials/analysis tools: NL MD HS ZH JL LL LZ JC XZ. Wrote the paper: JY JW NL MD DH.","The authors have declared that no competing interests exist."
"10.1371/journal.pone.0063554","plos one","2013-05-13T00:00:00Z","Xing Fu Jiang; Jian Chen; Lei Zhang; Thomas W Sappington; Li Zhi Luo","State Key Laboratory for Biology of Plant Diseases and Insect Pests, Institute of Plant Protection, Chinese Academy of Agricultural Sciences, Beijing, China; United States Department of Agriculture - Agricultural Research Service, Corn Insects and Crop Genetics Research Unit, Genetics Laboratory ISU, Ames, Iowa, United States of America","Conceived and designed the experiments: XJ LL. Performed the experiments: JC. Analyzed the data: XJ JC LZ. Wrote the paper: XJ TWS.","The authors have declared that no competing interests exist."
"10.1371/journal.pone.0029216","plos one","2011-12-21T00:00:00Z","Fausto Bruno Dos Reis Almeida; Fernanda Caroline Carvalho; Vânia Sammartino Mariano; Ana Claudia Paiva Alegre; Roberto do Nascimento Silva; Ebert Seixas Hanna; Maria Cristina Roque-Barreira","Departamento de Biologia Celular e Molecular e Bioagentes Patogênicos, Faculdade de Medicina de Ribeirão Preto, Universidade de São Paulo, Ribeirão Preto, São Paulo, Brazil; Departamento de Bioquímica e Imunologia, Faculdade de Medicina de Ribeirão Preto, Universidade de São Paulo, Ribeirão Preto, São Paulo, Brazil; Invent Biotecnologia Ltda. ME, Incubadora Supera, Rua dos Técnicos s/n, Universidade de São Paulo, Ribeirão Preto, São Paulo, Brazil","Conceived and designed the experiments: FBRA ESH RNS MCRB. Performed the experiments: FBRA FCC VSM ACPA. Analyzed the data: FBRA FCC ESH. Contributed reagents/materials/analysis tools: RNS MCRB. Wrote the paper: FBRA FCC ESH RNS MCRB.","The authors have read the journal's policy and have the following conflicts: Ebert S. Hanna is paid employer of Invent Biotecnologia. The employment of this author in a commercial company does not alter the authors' adherence to all the PLoS ONE policies on sharing data and materials, as detailed online in the guide for authors."
"10.1371/journal.pone.0029215","plos one","2011-12-22T00:00:00Z","Justin M Calabrese; Jesse L Brunner; Richard S Ostfeld","Smithsonian Conservation Biology Institute, Front Royal, Virginia, United States of America; Helmholtz Centre for Environmental Research-UFZ, Leipzig, Germany; Cary Institute of Ecosystem Studies, Millbrook, New York, United States of America; School of Biological Sciences, Washington State University, Pullman, Washington, United States of America","Conceived and designed the experiments: JLB RSO. Performed the experiments: JLB RSO. Analyzed the data: JMC JLB. Wrote the paper: JMC JLB. Designed models and statistical methods: JMC.","The authors have declared that no competing interests exist."
"10.1371/journal.pone.0109398","plos one","2014-10-10T00:00:00Z","Liang Qin; Yang Wu; Youting Liu; Yiming Chen; Peng Zhang","Beijing Bioprocess Key Laboratory, College of Life Science and Technology, Beijing University of Chemical Technology, Beijing, China","Conceived and designed the experiments: LQ PZ. Performed the experiments: LQ YW YL. Analyzed the data: LQ YW YL. Contributed reagents/materials/analysis tools: YC PZ. Wrote the paper: LQ.","The authors have declared that no competing interests exist."
"10.1371/journal.pone.0063562","plos one","2013-05-10T00:00:00Z","Liaojun Pang; Huixian Li; Lu Gao; Yumin Wang","School of Life Sciences and Technology, Xidian University, Xi’an, China; Department of Computer Science, Wayne State University, Detroit, Michigan, United States of America; School of Computer Science and Engineering, Northwestern Polytechnical University, Xi’an, China","Proved the security of the scheme: LP HL LG. Conceived and designed the experiments: LP HL. Analyzed the data: LP HL LG YW. Wrote the paper: LP HL LG YW.","The authors have declared that no competing interests exist."
"10.1371/journal.pone.0029218","plos one","2012-02-10T00:00:00Z","Sebastian Bernhardsson; Namiko Mitarai; Kim Sneppen","Niels Bohr institute, University of Copenhagen, Copenhagen, Denmark; FOI, Swedish Defence Research Agency, Tumba, Sweden","Contributed reagents/materials/analysis tools: SB NM KS. Wrote the paper: SB NM KS.","The authors have declared that no competing interests exist."
"10.1371/journal.pone.0063561","plos one","2013-05-07T00:00:00Z","Benzhi Cai; Xingda Li; Yang Wang; Yanju Liu; Fan Yang; Hongyang Chen; Kun Yin; Xueying Tan; Jiuxin Zhu; Zhenwei Pan; Baoqiu Wang; Yanjie Lu","Department of Pharmacology, State-Province Key Laboratories of Biomedicine- Pharmaceutics of China, Harbin Medical University, Harbin, Heilongjiang Province, China; Institute of Cardiovascular Research, Harbin Medical University, Harbin, Heilongjiang Province, China","Conceived and designed the experiments: BZC YJL. Performed the experiments: YJL XDL FY YW JXZ KY BQW ZWP. Analyzed the data: YJL. Contributed reagents/materials/analysis tools: YJL XYT HYC. Wrote the paper: BCZ YJL.","The authors have declared that no competing interests exist."
"10.1371/journal.pone.0120907","plos one","2015-03-25T00:00:00Z","Tai-Ho Hung; T’sang-T’ang Hsieh; Hung-Pin Liu","Department of Obstetrics and Gynecology, Chang Gung Memorial Hospital at Taipei, Taipei, Taiwan; Department of Chinese Medicine, College of Medicine, Chang Gung University, Taoyuan, Taiwan; Department of Anesthesiology, Chang Gung Memorial Hospital at Taipei, Taipei, Taiwan","Conceived and designed the experiments: THH TTH. Analyzed the data: THH. Wrote the paper: THH HPL.","The authors have declared that no competing interests exist."
"10.1371/journal.pone.0040712","plos one","2012-07-11T00:00:00Z","Sen Pang; Liusheng Duan; Zhiqian Liu; Xiaoyu Song; Xuefeng Li; Chengju Wang","Engineering Research Center of Plant Growth Regulators, Ministry of Education, College of Agronomy and Biotechnology, China Agricultural University, Beijing, People’s Republic of China; College of Sciences, China Agricultural University, Beijing, People’s Republic of China; Department of Primary Industries, Biosciences Research Division, Victorian AgriBiosciences Centre, Bundoora, Victoria, Australia","Conceived and designed the experiments: SP ZL XL CW. Performed the experiments: SP LD XS. Analyzed the data: SP ZL. Contributed reagents/materials/analysis tools: SP XL CW. Wrote the paper: SP ZL.","The authors have declared that no competing interests exist."
"10.1371/journal.pone.0120885","plos one","2015-04-07T00:00:00Z","Yiliang Zeng; Jinhui Lan; Bin Ran; Qi Wang; Jing Gao","Department of Instrument Science and Technology, School of Automation and Electrical Engineering, University of Science and Technology Beijing, Beijing, P.R. China; School of Transportation, Southeast University, Nanjing, Jiangsu Province, P.R. China","Conceived and designed the experiments: YLZ JHL BR QW JG. Performed the experiments: YLZ JHL BR QW JG. Analyzed the data: YLZ JHL BR QW JG. Contributed reagents/materials/analysis tools: YLZ JHL BR QW JG. Wrote the paper: YLZ JHL BR QW JG.","The authors have declared that no competing interests exist."
"10.1371/journal.pone.0063575","plos one","2013-05-17T00:00:00Z","Karen S Korsholm; Ingrid Karlsson; Sheila T Tang; Lea Brandt; Else Marie Agger; Claus Aagaard; Peter Andersen; Anders Fomsgaard","Department of Infectious Disease Immunology, Statens Serum Institut, Copenhagen, Denmark; Department of Virology, Statens Serum Institut, Copenhagen, Denmark","Conceived and designed the experiments: KSK IK STT LB EMA PA AF. Performed the experiments: KSK IK STT LB CAA. Analyzed the data: KSK IK STT. Contributed reagents/materials/analysis tools: KSK IK STT LB CAA. Wrote the paper: KSK IK STT LB EMA CAA PA AF.","The authors have declared that no competing interests exist."
"10.1371/journal.pone.0086446","plos one","2014-01-24T00:00:00Z","Rong Qin; Jingxu Zhou; Chao Chen; Tao Xu; Yong Yan; Yushui Ma; Zongli Zheng; Yiping Shen; Yicheng Lu; Da Fu; Juxiang Chen","Department of Neurosurgery, Shanghai Institute of Neurosurgery, Changzheng Hospital, Second Military Medical University, Shanghai, China; Department of Neurosurgery, the 101st hospital of PLA, Wuxi, Jiangsu Province, China; Key Laboratory of Stem Cell Biology, Institute of Health Sciences, Shanghai Jiao Tong University School of Medicine & Shanghai Institutes for Biological Sciences, Chinese Academy of Sciences, Shanghai, China; Department of Pathology, Massachusetts General Hospital, Harvard Medical School, Boston, Massachusetts, United States of America; Department of Laboratory Medicine, Children's Hospital Boston, Harvard Medical School, Boston, Massachusetts, United States of America","Conceived and designed the experiments: JC DF YL. Performed the experiments: RQ JZ CC YM. Analyzed the data: RQ JZ CC TX YY. Contributed reagents/materials/analysis tools: JC DF ZZ YS. Wrote the paper: RQ CC JC DF.","The authors have declared that no competing interests exist."
"10.1371/journal.pone.0086445","plos one","2014-01-22T00:00:00Z","Yicun Wu; Jin Dai; Weilin Zhang; Rong Yan; Yiwen Zhang; Changgeng Ruan; Kesheng Dai","Jiangsu Institute of Hematology, The First Affiliated Hospital of Soochow University, Key Laboratory of Thrombosis and Hemostasis, Ministry of Health, Suzhou, China; School of Life Sciences, Peking University, Beijing, China","Conceived and designed the experiments: YW KD. Performed the experiments: YW JD WZ RY YZ. Analyzed the data: YW WZ CR KD. Contributed reagents/materials/analysis tools: CR. Wrote the paper: YW KD. Supervised experiments and provided research support: KD.","The authors have declared that no competing interests exist."
"10.1371/journal.pone.0052115","plos one","2012-12-18T00:00:00Z","Taihei Ninomiya; Hiromasa Sawamura; Ken-ichi Inoue; Masahiko Takada","Department of System Neuroscience, Tokyo Metropolitan Institute for Neuroscience, Fuchu, Tokyo, Japan; Systems Neuroscience Section, Primate Research Institute, Kyoto University, Inuyama, Aichi, Japan; Department of Ophthalmology, The University of Tokyo, Bunkyo-ku, Tokyo, Japan","Conceived and designed the experiments: TN HS MT. Performed the experiments: TN HS KI. Analyzed the data: TN. Wrote the paper: TN HS KI MT.","The authors have declared that no competing interests exist."
"10.1371/journal.pone.0097825","plos one","2014-05-15T00:00:00Z","In Ho Park; K Aaron Geno; Logan K Sherwood; Moon H Nahm; Bernard Beall","Department of Pathology, University of Alabama at Birmingham, Birmingham, Alabama, United States of America; Respiratory Diseases Branch, Centers for Disease Control and Prevention, Atlanta, Georgia, United States of America; Department of Microbiology, University of Alabama at Birmingham, Birmingham, Alabama, United States of America","Conceived and designed the experiments: IHP KAG MHN BB. Performed the experiments: IHP KAG LKS. Analyzed the data: IHP KAG LKS MHN BB. Contributed reagents/materials/analysis tools: IHP KAG LKS MHN BB. Contributed to the writing of the manuscript: IHP KAG MHN BB.","BB is an academic editor for PLOS ONE. This does not alter the authors' adherence to PLOS ONE Editorial policies and criteria."
"10.1371/journal.pone.0109349","plos one","2014-10-30T00:00:00Z","Juan-Juan Xin; Qing-Li Shang; Nicolas Desneux; Xi-Wu Gao","Department of Entomology, China Agricultural University, Beijing, PR China; College of Plant Science and Technology, Jilin University, Changchun, PR China; French National Institute for Agricultural Research (INRA), Paris, France","Conceived and designed the experiments: XWG JJX. Performed the experiments: JJX QLS. Analyzed the data: JJX ND. Contributed reagents/materials/analysis tools: XWG JJX. Wrote the paper: JJX QLS XWG ND.","The authors have declared that no competing interests exist."
"10.1371/journal.pone.0040627","plos one","2012-07-19T00:00:00Z","Kadarusman; Nicolas Hubert; Renny Kurnia Hadiaty; Sudarto; Emmanuel Paradis; Laurent Pouyaud","Akademi Perikanan Sorong, Ministry of Marine Affairs and Fisheries, Sorong, West Papua, Indonesia; UR226 ISE-M, Institut de Recherche pour le Développement, Montpellier, France; Museum Zoologicum Bogoriense, Indonesian Institute of Sciences, Cibinong, West Java, Indonesia; Institute for Research and Development of Ornamental Fish Culture, Ministry of Marine Affairs and Fisheries, Depok, West Java, Indonesia","Conceived and designed the experiments: K LP NH. Performed the experiments: K NH RKH S EP LP. Analyzed the data: K NH EP LP. Contributed reagents/materials/analysis tools: K RKH S. Wrote the paper: K NH LP. Obtained sampling permits: K RKH S.","Funding was provided by the COLAS company in Indonesia. This does not alter the authors’ adherence to all the PLoS ONE policies on sharing data and materials."
"10.1371/journal.pone.0097756","plos one","2014-05-21T00:00:00Z","Chol Seung Lim; Daniel L Alkon","Blanchette Rockefeller Neurosciences Institute at West Virginia University, Morgantown, West Virginia, United States of America","Conceived and designed the experiments: CSL DLA. Performed the experiments: CSL. Analyzed the data: CSL DLA. Contributed reagents/materials/analysis tools: CSL. Wrote the paper: CSL DLA.","The authors have declared that no competing interests exist."
"10.1371/journal.pone.0040623","plos one","2012-11-12T00:00:00Z","Lewis John Haddow; Mahomed-Yunus Suleman Moosa; Anisa Mosam; Pravi Moodley; Raveen Parboosing; Philippa Jane Easterbrook","Centre for Sexual Health and HIV Research, Research Department of Infection and Population Health, University College London, London, United Kingdom; Department of Infectious Diseases, Nelson R. Mandela School of Medicine, University of KwaZulu-Natal, Durban, South Africa; Department of Dermatology, Nelson R. Mandela School of Medicine, University of KwaZulu-Natal, Durban, South Africa; Department of Virology, Nelson R. Mandela School of Medicine, University of KwaZulu-Natal, Durban, South Africa; National Health Laboratory Services, Inkosi Albert Luthuli Central Hospital, Durban, South Africa","Conceived and designed the experiments: LH MYSM PM RP PE. Performed the experiments: LH MYSM AM PM RP PE. Analyzed the data: LH PE. Wrote the paper: LH PE.","The authors have declared that no competing interests exist."
"10.1371/journal.pone.0109345","plos one","2014-10-02T00:00:00Z","Wei Yu; Li Zeng","Key Laboratory of Optoelectronic Technology and System of the Education Ministry of China, Chongqing University, Chongqing, China; College of Mathematics and Statistics, Chongqing University, Chongqing, China; Engineering Research Center of Industrial Computed Tomography Nondestructive Testing of the Education Ministry of China, Chongqing University, Chongqing, China","Conceived and designed the experiments: WY LZ. Performed the experiments: WY. Analyzed the data: WY LZ. Contributed reagents/materials/analysis tools: WY LZ. Contributed to the writing of the manuscript: WY LZ.","The authors have declared that no competing interests exist."
"10.1371/journal.pone.0097743","plos one","2014-05-28T00:00:00Z","Fang Lu; Jian-xin Xue; Yu-chang Hu; Lu Gan; Yi Shi; Han-shuo Yang; Yu-quan Wei","State Key Laboratory of Biotherapy, West China Hospital, Sichuan University, Chengdu, P.R. China; Sichuan Provincial Key Laboratory for Human Disease Gene Study, Sichuan Academy of Medical Sciences & Sichuan Provincial People's Hospital, Chengdu, P.R. China; Department of Thoracic Oncology, Cancer Center and State Key Laboratory of Biotherapy, West China Hospital, Sichuan University, Chengdu, P.R. China; Institute of Pathology, China Three Gorges University, Yichang, P.R. China","Conceived and designed the experiments: FL JXX HSY YQW. Performed the experiments: FL JXX LG. Analyzed the data: FL JXX LG YS. Contributed reagents/materials/analysis tools: JXX YCH HSY. Wrote the paper: FL JXX LG.","The authors have declared that no competing interests exist."
"10.1371/journal.pone.0029163","plos one","2011-12-21T00:00:00Z","Amira Hosni-Ahmed; Joseph D Barnes; Jim Wan; Terreia S Jones","Department of Clinical Pharmacy, University of Tennessee Health Science Center, Memphis, Tennessee, United States of America; Department of Pharmaceutical Sciences, University of Tennessee Health Science Center, Memphis, Tennessee, United States of America; Department of Neurosurgery, University of Tennessee Health Science Center, Memphis, Tennessee, United States of America; Division of Biostatistics and Epidemiology, University of Tennessee Health Science Center, Memphis, Tennessee, United States of America; Department of Chemistry, College of Science, Fayoum University, Fayoum, Egypt","Conceived and designed the experiments: TSJ AH-A. Performed the experiments: AH-A JDB. Analyzed the data: TSJ AH-A JDB JW. Contributed reagents/materials/analysis tools: TSJ. Wrote the paper: TSJ AH-A JW JDB.","The authors have declared that no competing interests exist."
"10.1371/journal.pone.0063488","plos one","2013-05-15T00:00:00Z","Jie Chao; Lu Yang; Shilpa Buch; Lie Gao","Department of Cellular and Integrative Physiology, University of Nebraska Medical Center, Omaha, Nebraska, United States of America; Department of Pharmacology and Experimental Neuroscience, University of Nebraska Medical Center, Omaha, Nebraska, United States of America","Conceived and designed the experiments: JC LG. Performed the experiments: JC LY. Analyzed the data: JC SB. Wrote the paper: JC.","The authors have declared that no competing interests exist."
"10.1371/journal.pone.0097725","plos one","2014-05-20T00:00:00Z","Rasna R Walia; Li C Xue; Katherine Wilkins; Yasser El-Manzalawy; Drena Dobbs; Vasant Honavar","Bioinformatics and Computational Biology Program, Iowa State University, Ames, Iowa, United States of America; Department of Computer Science, Iowa State University, Ames, Iowa, United States of America; College of Information Sciences and Technology, Pennsylvania State University, University Park, Pennsylvania, United States of America; Department of Plant Pathology and Plant-Microbe Biology, Cornell University, Ithaca, New York, United States of America; Graduate Field of Computational Biology, Cornell University, Ithaca, New York, United States of America; Department of Systems and Computer Engineering, Al-Azhar University, Cairo, Egypt; Department of Genetics, Development, and Cell Biology, Iowa State University, Ames, Iowa, United States of America; Bioinformatics and Genomics Graduate Program, Pennsylvania State University, University Park, Pennsylvania, United States of America; The Huck Institutes of the Life Sciences, Pennsylvania State University, University Park, Pennsylvania, United States of America","Conceived and designed the experiments: RRW VH DD. Performed the experiments: RRW LCX KW. Analyzed the data: RRW LCX YE-M. Wrote the paper: RRW DD VH. Implemented the webserver: RRW.","The authors have declared that no competing interests exist."
"10.1371/journal.pone.0086346","plos one","2014-01-22T00:00:00Z","Wei Tian; Xiaoguang Han; Bo Liu; Yajun Liu; Ying Hu; Xiao Han; Yunfeng Xu; Mingxing Fan; Haiyang Jin","Department of Spine Surgery, Beijing Jishuitan Hospital, Beijing, China; Medical Center, Tsinghua University, Beijing, China; Shenzhen Institutes of Advanced Technology, Chinese Academy of Sciences, Shenzhen, China","Conceived and designed the experiments: WT. Performed the experiments: Xiaoguang Han BL YL Xiao Han YX MF. Analyzed the data: Xiaoguang Han. Wrote the paper: Xiaoguang Han. Contributed to the robot used in the experiment: YH HJ.","The authors have declared that no competing interests exist."
"10.1371/journal.pone.0109320","plos one","2014-10-10T00:00:00Z","Julie Haesebaert; Delphine Lutringer-Magnin; Julie Kalecinski; Giovanna Barone; Anne-Carole Jacquard; Yann Leocmach; Véronique Régnier; Philippe Vanhems; Franck Chauvin; Christine Lasset","Université Lyon 1, CNRS UMR 5558 et Centre Léon Bérard, Lyon, France; Institut de Cancérologie de la Loire et Université Jean Monnet de Saint-Étienne, IFR 143, Saint-Étienne, France; Sanofi-Pasteur MSD, Lyon, France; Université Lyon 1, CNRS UMR 5558 et Hospices Civils de Lyon, Lyon, France","Conceived and designed the experiments: DLM CL PV FC VR YL ACJ. Performed the experiments: GB JK JH. Analyzed the data: JH CL JK VR FC. Contributed reagents/materials/analysis tools: JH DLM JK CL. Wrote the paper: JH JK DLM CL. Revised the manuscript: GB VR FC PV ACJ YL.","YL and ACJ are employees of Sanofi Pasteur MSD and participated in the design of the study and revised the manuscript. Others authors have no competing interests. This does not alter the authors' adherence to all PLOS ONE policies on sharing data and materials."
"10.1371/journal.pone.0074943","plos one","2013-09-23T00:00:00Z","Zoë L S Brookes; Emily N Stedman; Nicola J Brown; Christopher P Hebbes; Remo Guerrini; Girolamo Calo; Charles S Reilly; David G Lambert","Microcirculation Research Group, Department of Cardiovascular Sciences, University of Sheffield, Sheffield, United Kingdom; Department of Cardiovascular Sciences, Division of Anaesthesia, Critical Care and Pain Management, University of Leicester, Leicester Royal Infirmary, Leicester, United Kingdom; Department of Pharmaceutical Sciences and Biotechnology Center, University of Ferrara, Ferrara, Italy; Department of Experimental and Clinical Medicine, Section of Pharmacology, University of Ferrara and Italian Institute of Neuroscience, Ferrara, Italy","Conceived and designed the experiments: ZB ES NB CH RG GC CR DL. Performed the experiments: ZB ES CH RG DL. Analyzed the data: ZB ES NB CH RG CG DL. Contributed reagents/materials/analysis tools: ZB NB RG CG CR DL. Wrote the manuscript: ZB ES NB CH RG CG CR DL.","The authors have declared that no competing interests exist."
"10.1371/journal.pone.0029134","plos one","2011-12-29T00:00:00Z","Jasmine Sethi; Manuel Sanchez-Alavez; Iustin V Tabarean","The Department of Molecular and Integrative Neurosciences, The Scripps Research Institute, La Jolla, California, United States of America","Conceived and designed the experiments: IVT. Performed the experiments: JS MS-A IVT. Analyzed the data: JS MS-A IVT. Wrote the paper: JS IVT.","The authors have declared that no competing interests exist."
